system:index,Code Departamento,Code Provincia,Date (YMD),Departamento,Provincia,codeRio,distanciaRio,estacion,fecha0,fechas,hayRioCercano,idx,lat,lon,runoff_sum,temperature_2m,tipoDeSuelo,total_evaporation_sum,volumetric_soil_water_layer_1,.geo
0,54028,54,29/6/2014,Capital,Misiones,14-14,8.07,invierno,2014-06-23,"[2014-06-23, 2014-06-24, 2014-06-25, 2014-06-26, 2014-06-27, 2014-06-28, 2014-06-29]",true,0,-27.47659493,-55.92169961,0.01453717052936554,291.45590527852374,Alfisoles,-0.0011485274881124496,0.46769078572591144,"{""type"":""Point"",""coordinates"":[-55.92169961,-27.47659493]}"
1,06098,6,6/2/2014,Berisso,Buenos Aires,3314-1708,0.7,verano,2014-02-03,"[2014-02-03, 2014-02-04, 2014-02-05, 2014-02-06, 2014-02-07, 2014-02-08, 2014-02-09]",true,1,-34.84587606,-57.87973336,,,Miscelaneas,,,"{""type"":""Point"",""coordinates"":[-57.87973336,-34.84587606]}"
2,06427,6,28/10/2014,La Matanza,Buenos Aires,33486-6512,4.98,primavera,2014-10-27,"[2014-10-27, 2014-10-28, 2014-10-29, 2014-10-30, 2014-10-31, 2014-11-01, 2014-11-02]",true,2,-34.71417289,-58.50890438,6.224066019058228E-4,299.02834765116376,Molisoles,-0.0032360348850488663,0.20611699422200522,"{""type"":""Point"",""coordinates"":[-58.50890437999999,-34.71417289000001]}"
3,50007,50,12/2/2014,Capital,Mendoza,6840-2183,42.83,verano,2014-02-10,"[2014-02-10, 2014-02-11, 2014-02-12, 2014-02-13, 2014-02-14, 2014-02-15, 2014-02-16]",false,3,-32.87749385,-68.85278707,7.301568984985352E-7,296.4107042948405,Entisoles,-9.836694225668907E-4,0.16572125752766928,"{""type"":""Point"",""coordinates"":[-68.85278707,-32.87749385]}"
4,14063,14,2/3/2015,Marcos Juarez,Cordoba,34344-6360,15.81,verano,2015-03-02,"[2015-03-02, 2015-03-03, 2015-03-04, 2015-03-05, 2015-03-06, 2015-03-07, 2015-03-08]",false,4,-32.62947464,-62.30913162,8.463859558105469E-6,296.1630051930745,Molisoles,-0.003030844032764435,0.45834096272786456,"{""type"":""Point"",""coordinates"":[-62.30913162,-32.629474640000005]}"
5,14063,14,2/3/2015,Marcos Juarez,Cordoba,34344-6360,15.81,verano,2015-03-02,"[2015-03-02, 2015-03-03, 2015-03-04, 2015-03-05, 2015-03-06, 2015-03-07, 2015-03-08]",false,5,-32.62947464,-62.30913162,8.463859558105469E-6,296.1630051930745,Molisoles,-0.003030844032764435,0.45834096272786456,"{""type"":""Point"",""coordinates"":[-62.30913162,-32.629474640000005]}"
6,14021,14,2/3/2015,Colon,Cordoba,33948-6745,20.69,verano,2015-03-02,"[2015-03-02, 2015-03-03, 2015-03-04, 2015-03-05, 2015-03-06, 2015-03-07, 2015-03-08]",false,6,-31.25624481,-63.95340394,2.905726432800293E-5,295.8409023284912,Miscelaneas,-0.003029913641512394,0.3947563171386719,"{""type"":""Point"",""coordinates"":[-63.953403939999994,-31.256244809999995]}"
7,14140,14,25/2/2015,San Justo,Cordoba,6955-2119,12.54,verano,2015-02-23,"[2015-02-23, 2015-02-24, 2015-02-25, 2015-02-26, 2015-02-27, 2015-02-28, 2015-03-01]",true,7,-31.23400374,-62.74066613,9.685754776000977E-7,297.69277318318683,Alfisoles,-0.0040434375405311584,0.26619720458984375,"{""type"":""Point"",""coordinates"":[-62.74066613,-31.234003740000002]}"
8,14140,14,25/2/2015,San Justo,Cordoba,6955-2119,12.54,verano,2015-02-23,"[2015-02-23, 2015-02-24, 2015-02-25, 2015-02-26, 2015-02-27, 2015-02-28, 2015-03-01]",true,8,-31.23400374,-62.74066613,9.685754776000977E-7,297.69277318318683,Alfisoles,-0.0040434375405311584,0.26619720458984375,"{""type"":""Point"",""coordinates"":[-62.74066613,-31.234003740000002]}"
9,14140,14,25/2/2015,San Justo,Cordoba,6955-2119,12.54,verano,2015-02-23,"[2015-02-23, 2015-02-24, 2015-02-25, 2015-02-26, 2015-02-27, 2015-02-28, 2015-03-01]",true,9,-31.23400374,-62.74066613,9.685754776000977E-7,297.69277318318683,Alfisoles,-0.0040434375405311584,0.26619720458984375,"{""type"":""Point"",""coordinates"":[-62.74066613,-31.234003740000002]}"
10,14098,14,25/2/2015,Rio Cuarto,Cordoba,34345-6361,23.14,verano,2015-02-23,"[2015-02-23, 2015-02-24, 2015-02-25, 2015-02-26, 2015-02-27, 2015-02-28, 2015-03-01]",false,10,-32.64751095,-64.22141859,5.960464477539063E-8,295.4457842508952,Complejo indiferenci,-0.0038398653268814087,0.25366655985514325,"{""type"":""Point"",""coordinates"":[-64.22141859,-32.64751095]}"
11,06875,6,6/9/2012,Villarino,Buenos Aires,33091-6394,29.23,invierno,2012-09-03,"[2012-09-03, 2012-09-04, 2012-09-05, 2012-09-06, 2012-09-07, 2012-09-08, 2012-09-09]",false,11,-39.4323988,-62.9350751,8.463859558105469E-6,281.09694417317706,Molisoles,-7.848339155316353E-4,0.120330810546875,"{""type"":""Point"",""coordinates"":[-62.935075100000006,-39.4323988]}"
12,82042,82,10/8/2015,General Lopez,Santa Fe,6725-2212,8.61,invierno,2015-08-10,"[2015-08-10, 2015-08-11, 2015-08-12, 2015-08-13, 2015-08-14, 2015-08-15, 2015-08-16]",true,12,-34.17471073,-62.05032677,1.0223686695098877E-4,284.5526574452718,Molisoles,-0.001829506829380989,0.41796239217122394,"{""type"":""Point"",""coordinates"":[-62.05032677,-34.17471073]}"
13,06357,6,10/8/2015,General Pueyrredon,Buenos Aires,3347-1742,17.47,invierno,2015-08-10,"[2015-08-10, 2015-08-11, 2015-08-12, 2015-08-13, 2015-08-14, 2015-08-15, 2015-08-16]",false,13,-37.80766254,-57.62989086,0.006689161062240601,282.4353885650635,Molisoles,-0.001512475311756134,0.4706554412841797,"{""type"":""Point"",""coordinates"":[-57.62989086,-37.80766254000001]}"
14,82105,82,13/1/2015,San Jeronimo,Santa Fe,123-123,29.33,verano,2015-01-12,"[2015-01-12, 2015-01-13, 2015-01-14, 2015-01-15, 2015-01-16, 2015-01-17, 2015-01-18]",false,14,-32.2399352,-61.231266,7.003545761108398E-7,299.9401461283366,Molisoles,-0.005336340516805649,0.42922719319661456,"{""type"":""Point"",""coordinates"":[-61.231266,-32.2399352]}"
15,82133,82,13/1/2015,Vera,Santa Fe,3041-1094,9.46,verano,2015-01-12,"[2015-01-12, 2015-01-13, 2015-01-14, 2015-01-15, 2015-01-16, 2015-01-17, 2015-01-18]",true,15,-29.72572798,-60.28951287,2.1263957023620605E-5,300.6671969095866,Lagunas,-0.0057938434183597565,0.47377904256184894,"{""type"":""Point"",""coordinates"":[-60.28951287,-29.72572798]}"
16,82049,82,13/1/2015,General Obligado,Santa Fe,32822-6509,17.99,verano,2015-01-12,"[2015-01-12, 2015-01-13, 2015-01-14, 2015-01-15, 2015-01-16, 2015-01-17, 2015-01-18]",false,16,-28.6765561,-59.7497004,5.0127506256103516E-5,301.41223271687824,Alfisoles,-0.006106188520789146,0.43047332763671875,"{""type"":""Point"",""coordinates"":[-59.7497004,-28.676556099999996]}"
17,22140,22,13/1/2015,San Fernando,Chaco,6254-1933,11.88,verano,2015-01-12,"[2015-01-12, 2015-01-13, 2015-01-14, 2015-01-15, 2015-01-16, 2015-01-17, 2015-01-18]",true,17,-27.92561531,-59.31798172,6.966292858123779E-5,302.3913180033366,Complejo indiferenci,-0.00645563006401062,0.3351128896077474,"{""type"":""Point"",""coordinates"":[-59.317981720000006,-27.925615310000005]}"
18,22014,22,23/12/2015,Bermejo,Chaco,32998-6511,18.89,verano,2015-12-21,"[2015-12-21, 2015-12-22, 2015-12-23, 2015-12-24, 2015-12-25, 2015-12-26, 2015-12-27]",false,18,-26.92175039,-58.77874597,4.219859838485718E-4,299.26625633239746,Rio,-0.0056894440203905106,0.4446086883544922,"{""type"":""Point"",""coordinates"":[-58.77874597,-26.92175039]}"
19,22140,22,23/12/2015,San Fernando,Chaco,6254-1933,11.88,verano,2015-12-21,"[2015-12-21, 2015-12-22, 2015-12-23, 2015-12-24, 2015-12-25, 2015-12-26, 2015-12-27]",true,19,-27.92561531,-59.31798172,4.5852363109588623E-4,299.5400193532308,Complejo indiferenci,-0.005482318811118603,0.3526604970296224,"{""type"":""Point"",""coordinates"":[-59.317981720000006,-27.925615310000005]}"
20,18077,18,22/12/2015,Itati,Corrientes,17-17,41.46,verano,2015-12-21,"[2015-12-21, 2015-12-22, 2015-12-23, 2015-12-24, 2015-12-25, 2015-12-26, 2015-12-27]",false,20,-27.35196615,-57.87393625,0.003442898392677307,299.6266892751058,Entisoles,-0.005040252581238747,0.4406566619873047,"{""type"":""Point"",""coordinates"":[-57.87393625,-27.35196615]}"
21,18133,18,22/12/2015,San Cosme,Corrientes,59-59,5.73,verano,2015-12-21,"[2015-12-21, 2015-12-22, 2015-12-23, 2015-12-24, 2015-12-25, 2015-12-26, 2015-12-27]",true,21,-27.36393313,-58.66198243,0.004867926239967346,299.46441713968915,Rio,-0.0054277172312140465,0.2982584635416667,"{""type"":""Point"",""coordinates"":[-58.66198243,-27.363933129999996]}"
22,18049,18,22/12/2015,Esquina,Corrientes,9200-2836,11.96,verano,2015-12-21,"[2015-12-21, 2015-12-22, 2015-12-23, 2015-12-24, 2015-12-25, 2015-12-26, 2015-12-27]",true,22,-30.0784368,-59.4055912,1.0225176811218262E-4,296.94635073343915,Complejo indiferenci,-0.003163461573421955,0.37055333455403644,"{""type"":""Point"",""coordinates"":[-59.405591199999996,-30.0784368]}"
23,18070,18,23/12/2015,Goya,Corrientes,6624-2091,11.86,verano,2015-12-21,"[2015-12-21, 2015-12-22, 2015-12-23, 2015-12-24, 2015-12-25, 2015-12-26, 2015-12-27]",true,23,-29.1751244,-58.88982054,0.0013111978769302368,298.15948549906415,Rio,-0.004072342999279499,0.35811487833658856,"{""type"":""Point"",""coordinates"":[-58.889820540000024,-29.1751244]}"
24,18091,18,22/12/2015,Lavalle,Corrientes,6577-2072,5.81,verano,2015-12-21,"[2015-12-21, 2015-12-22, 2015-12-23, 2015-12-24, 2015-12-25, 2015-12-26, 2015-12-27]",true,24,-28.9356733,-58.8052348,0.0015637874603271484,298.5690720876058,Complejo indiferenci,-0.004363003186881542,0.3770885467529297,"{""type"":""Point"",""coordinates"":[-58.8052348,-28.9356733]}"
25,18021,18,22/12/2015,Capital,Corrientes,6611-2085,6.4,verano,2015-12-21,"[2015-12-21, 2015-12-22, 2015-12-23, 2015-12-24, 2015-12-25, 2015-12-26, 2015-12-27]",true,25,-27.4064,-58.78276,0.00411437451839447,299.47963523864746,Rio,-0.005270368419587612,0.3476683298746745,"{""type"":""Point"",""coordinates"":[-58.78276,-27.4064]}"
26,82049,82,22/12/2015,General Obligado,Santa Fe,32822-6509,17.99,verano,2015-12-21,"[2015-12-21, 2015-12-22, 2015-12-23, 2015-12-24, 2015-12-25, 2015-12-26, 2015-12-27]",false,26,-28.6765561,-59.7497004,3.14563512802124E-5,299.1489060719808,Alfisoles,-0.004982089623808861,0.43468157450358075,"{""type"":""Point"",""coordinates"":[-59.7497004,-28.676556099999996]}"
27,82063,82,23/12/2015,La Capital,Santa Fe,103-103,23.73,verano,2015-12-21,"[2015-12-21, 2015-12-22, 2015-12-23, 2015-12-24, 2015-12-25, 2015-12-26, 2015-12-27]",false,27,-31.18858147,-60.62677383,3.6209821701049805E-6,297.6313279469808,Molisoles,-0.003119104541838169,0.3790321350097656,"{""type"":""Point"",""coordinates"":[-60.62677383,-31.18858147]}"
28,18021,18,6/12/2015,Capital,Corrientes,6611-2085,6.4,primavera,2015-11-30,"[2015-11-30, 2015-12-01, 2015-12-02, 2015-12-03, 2015-12-04, 2015-12-05, 2015-12-06]",true,28,-27.4064,-58.78276,0.004339590668678284,294.0069700876872,Rio,-0.007449916563928127,0.3406505584716797,"{""type"":""Point"",""coordinates"":[-58.78276,-27.4064]}"
29,22014,22,22/12/2015,Bermejo,Chaco,32998-6511,18.89,verano,2015-12-21,"[2015-12-21, 2015-12-22, 2015-12-23, 2015-12-24, 2015-12-25, 2015-12-26, 2015-12-27]",false,29,-26.92175039,-58.77874597,4.219859838485718E-4,299.26625633239746,Rio,-0.0056894440203905106,0.4446086883544922,"{""type"":""Point"",""coordinates"":[-58.77874597,-26.92175039]}"
30,30028,30,22/12/2015,Federacion,Entre Rios,1385-1073,7.52,verano,2015-12-21,"[2015-12-21, 2015-12-22, 2015-12-23, 2015-12-24, 2015-12-25, 2015-12-26, 2015-12-27]",true,30,-30.70681007,-57.88784914,0.002915024757385254,296.41900698343915,Molisoles,-0.0032871365547180176,0.2706788380940755,"{""type"":""Point"",""coordinates"":[-57.88784913999999,-30.70681007]}"
31,30028,30,22/12/2015,Federacion,Entre Rios,1385-1073,7.52,verano,2015-12-21,"[2015-12-21, 2015-12-22, 2015-12-23, 2015-12-24, 2015-12-25, 2015-12-26, 2015-12-27]",true,31,-30.70681007,-57.88784914,0.002915024757385254,296.41900698343915,Molisoles,-0.0032871365547180176,0.2706788380940755,"{""type"":""Point"",""coordinates"":[-57.88784913999999,-30.70681007]}"
32,30008,30,22/12/2015,Colon,Entre Rios,32026-6403,25.96,verano,2015-12-21,"[2015-12-21, 2015-12-22, 2015-12-23, 2015-12-24, 2015-12-25, 2015-12-26, 2015-12-27]",false,32,-31.70735861,-58.28660961,9.933114051818848E-5,296.0693162282308,Entisoles,-0.0037220772355794907,0.4270165761311849,"{""type"":""Point"",""coordinates"":[-58.28660961,-31.70735861]}"
33,30098,30,22/12/2015,Uruguay,Entre Rios,7061-2233,5.89,verano,2015-12-21,"[2015-12-21, 2015-12-22, 2015-12-23, 2015-12-24, 2015-12-25, 2015-12-26, 2015-12-27]",true,33,-32.38095474,-58.23688127,5.534887313842773E-4,296.06817690531415,Entisoles,-0.004338395781815052,0.23967297871907553,"{""type"":""Point"",""coordinates"":[-58.23688127,-32.38095474000001]}"
34,34049,34,22/12/2015,Pilcomayo,Formosa,36840-7239,50.93,verano,2015-12-21,"[2015-12-21, 2015-12-22, 2015-12-23, 2015-12-24, 2015-12-25, 2015-12-26, 2015-12-27]",false,34,-25.11711311,-58.18847657,0.002468124032020569,300.2526658376058,Rio,-0.006195421330630779,0.4473756154378255,"{""type"":""Point"",""coordinates"":[-58.18847657,-25.117113110000002]}"
35,30015,30,22/12/2015,Concordia,Entre Rios,6557-2063,4.51,verano,2015-12-21,"[2015-12-21, 2015-12-22, 2015-12-23, 2015-12-24, 2015-12-25, 2015-12-26, 2015-12-27]",true,35,-31.35230446,-58.05355072,8.618086576461792E-4,296.20595359802246,Vertisoles,-0.0034779319539666176,0.24617830912272134,"{""type"":""Point"",""coordinates"":[-58.05355072,-31.352304459999996]}"
36,30070,30,21/12/2015,La Paz,Entre Rios,6543-2055,11.16,verano,2015-12-21,"[2015-12-21, 2015-12-22, 2015-12-23, 2015-12-24, 2015-12-25, 2015-12-26, 2015-12-27]",true,36,-30.60360412,-59.52751986,1.1710822582244873E-4,296.5846970876058,Molisoles,-0.0029983539134263992,0.4305744171142578,"{""type"":""Point"",""coordinates"":[-59.52751986,-30.60360412]}"
37,30008,30,21/12/2015,Colon,Entre Rios,32026-6403,25.96,verano,2015-12-21,"[2015-12-21, 2015-12-22, 2015-12-23, 2015-12-24, 2015-12-25, 2015-12-26, 2015-12-27]",false,37,-31.70735861,-58.28660961,9.933114051818848E-5,296.0693162282308,Entisoles,-0.0037220772355794907,0.4270165761311849,"{""type"":""Point"",""coordinates"":[-58.28660961,-31.70735861]}"
38,30098,30,21/12/2015,Uruguay,Entre Rios,7061-2233,5.89,verano,2015-12-21,"[2015-12-21, 2015-12-22, 2015-12-23, 2015-12-24, 2015-12-25, 2015-12-26, 2015-12-27]",true,38,-32.38095474,-58.23688127,5.534887313842773E-4,296.06817690531415,Entisoles,-0.004338395781815052,0.23967297871907553,"{""type"":""Point"",""coordinates"":[-58.23688127,-32.38095474000001]}"
39,30015,30,21/12/2015,Concordia,Entre Rios,6557-2063,4.51,verano,2015-12-21,"[2015-12-21, 2015-12-22, 2015-12-23, 2015-12-24, 2015-12-25, 2015-12-26, 2015-12-27]",true,39,-31.35230446,-58.05355072,8.618086576461792E-4,296.20595359802246,Vertisoles,-0.0034779319539666176,0.24617830912272134,"{""type"":""Point"",""coordinates"":[-58.05355072,-31.352304459999996]}"
40,18119,18,21/12/2015,Paso de los Libres,Corrientes,1383-1063,15.85,verano,2015-12-21,"[2015-12-21, 2015-12-22, 2015-12-23, 2015-12-24, 2015-12-25, 2015-12-26, 2015-12-27]",false,40,-29.87793885,-57.53288465,0.002852514386177063,295.8464158376058,Molisoles,-0.0032842839136719704,0.4321206410725911,"{""type"":""Point"",""coordinates"":[-57.53288465,-29.877938850000003]}"
41,18168,18,21/12/2015,Santo Tome,Corrientes,68-68,3.13,verano,2015-12-21,"[2015-12-21, 2015-12-22, 2015-12-23, 2015-12-24, 2015-12-25, 2015-12-26, 2015-12-27]",true,41,-28.51878167,-56.05544289,0.006799861788749695,297.75819969177246,Ultisoles,-0.0033810213208198547,0.4887746175130208,"{""type"":""Point"",""coordinates"":[-56.05544289,-28.518781670000006]}"
42,18049,18,21/12/2015,Esquina,Corrientes,9200-2836,11.96,verano,2015-12-21,"[2015-12-21, 2015-12-22, 2015-12-23, 2015-12-24, 2015-12-25, 2015-12-26, 2015-12-27]",true,42,-30.0784368,-59.4055912,1.0225176811218262E-4,296.94635073343915,Complejo indiferenci,-0.003163461573421955,0.37055333455403644,"{""type"":""Point"",""coordinates"":[-59.405591199999996,-30.0784368]}"
43,18070,18,21/12/2015,Goya,Corrientes,6624-2091,11.86,verano,2015-12-21,"[2015-12-21, 2015-12-22, 2015-12-23, 2015-12-24, 2015-12-25, 2015-12-26, 2015-12-27]",true,43,-29.1751244,-58.88982054,0.0013111978769302368,298.15948549906415,Rio,-0.004072342999279499,0.35811487833658856,"{""type"":""Point"",""coordinates"":[-58.889820540000024,-29.1751244]}"
44,18133,18,21/12/2015,San Cosme,Corrientes,59-59,5.73,verano,2015-12-21,"[2015-12-21, 2015-12-22, 2015-12-23, 2015-12-24, 2015-12-25, 2015-12-26, 2015-12-27]",true,44,-27.36393313,-58.66198243,0.004867926239967346,299.46441713968915,Rio,-0.0054277172312140465,0.2982584635416667,"{""type"":""Point"",""coordinates"":[-58.66198243,-27.363933129999996]}"
45,18077,18,21/12/2015,Itati,Corrientes,17-17,41.46,verano,2015-12-21,"[2015-12-21, 2015-12-22, 2015-12-23, 2015-12-24, 2015-12-25, 2015-12-26, 2015-12-27]",false,45,-27.35196615,-57.87393625,0.003442898392677307,299.6266892751058,Entisoles,-0.005040252581238747,0.4406566619873047,"{""type"":""Point"",""coordinates"":[-57.87393625,-27.35196615]}"
46,18084,18,21/12/2015,Ituzaingo,Corrientes,87-87,28.3,verano,2015-12-21,"[2015-12-21, 2015-12-22, 2015-12-23, 2015-12-24, 2015-12-25, 2015-12-26, 2015-12-27]",false,46,-27.71591449,-56.94751639,0.0011911094188690186,299.2892869313558,Alfisoles,-0.004338438622653484,0.44080861409505206,"{""type"":""Point"",""coordinates"":[-56.94751638999999,-27.71591449]}"
47,18084,18,21/12/2015,Ituzaingo,Corrientes,87-87,28.3,verano,2015-12-21,"[2015-12-21, 2015-12-22, 2015-12-23, 2015-12-24, 2015-12-25, 2015-12-26, 2015-12-27]",false,47,-27.71591449,-56.94751639,0.0011911094188690186,299.2892869313558,Alfisoles,-0.004338438622653484,0.44080861409505206,"{""type"":""Point"",""coordinates"":[-56.94751638999999,-27.71591449]}"
48,22014,22,21/12/2015,Bermejo,Chaco,32998-6511,18.89,verano,2015-12-21,"[2015-12-21, 2015-12-22, 2015-12-23, 2015-12-24, 2015-12-25, 2015-12-26, 2015-12-27]",false,48,-26.92175039,-58.77874597,4.219859838485718E-4,299.26625633239746,Rio,-0.0056894440203905106,0.4446086883544922,"{""type"":""Point"",""coordinates"":[-58.77874597,-26.92175039]}"
49,22140,22,21/12/2015,San Fernando,Chaco,6254-1933,11.88,verano,2015-12-21,"[2015-12-21, 2015-12-22, 2015-12-23, 2015-12-24, 2015-12-25, 2015-12-26, 2015-12-27]",true,49,-27.92561531,-59.31798172,4.5852363109588623E-4,299.5400193532308,Complejo indiferenci,-0.005482318811118603,0.3526604970296224,"{""type"":""Point"",""coordinates"":[-59.317981720000006,-27.925615310000005]}"
50,22140,22,21/12/2015,San Fernando,Chaco,6254-1933,11.88,verano,2015-12-21,"[2015-12-21, 2015-12-22, 2015-12-23, 2015-12-24, 2015-12-25, 2015-12-26, 2015-12-27]",true,50,-27.92561531,-59.31798172,4.5852363109588623E-4,299.5400193532308,Complejo indiferenci,-0.005482318811118603,0.3526604970296224,"{""type"":""Point"",""coordinates"":[-59.317981720000006,-27.925615310000005]}"
51,18133,18,6/12/2015,San Cosme,Corrientes,59-59,5.73,primavera,2015-11-30,"[2015-11-30, 2015-12-01, 2015-12-02, 2015-12-03, 2015-12-04, 2015-12-05, 2015-12-06]",true,51,-27.36393313,-58.66198243,0.005246967077255249,293.9364948272705,Rio,-0.007354837842285633,0.29282251993815106,"{""type"":""Point"",""coordinates"":[-58.66198243,-27.363933129999996]}"
52,18077,18,6/12/2015,Itati,Corrientes,17-17,41.46,primavera,2015-11-30,"[2015-11-30, 2015-12-01, 2015-12-02, 2015-12-03, 2015-12-04, 2015-12-05, 2015-12-06]",false,52,-27.35196615,-57.87393625,0.001639038324356079,294.4159056345622,Entisoles,-0.00634248461574316,0.41441917419433594,"{""type"":""Point"",""coordinates"":[-57.87393625,-27.35196615]}"
53,18084,18,6/12/2015,Ituzaingo,Corrientes,87-87,28.3,primavera,2015-11-30,"[2015-11-30, 2015-12-01, 2015-12-02, 2015-12-03, 2015-12-04, 2015-12-05, 2015-12-06]",false,53,-27.71591449,-56.94751639,4.6539306640625E-4,294.1704629262288,Alfisoles,-0.006626239977777004,0.3985741933186849,"{""type"":""Point"",""coordinates"":[-56.94751638999999,-27.71591449]}"
54,18084,18,6/12/2015,Ituzaingo,Corrientes,87-87,28.3,primavera,2015-11-30,"[2015-11-30, 2015-12-01, 2015-12-02, 2015-12-03, 2015-12-04, 2015-12-05, 2015-12-06]",false,54,-27.71591449,-56.94751639,4.6539306640625E-4,294.1704629262288,Alfisoles,-0.006626239977777004,0.3985741933186849,"{""type"":""Point"",""coordinates"":[-56.94751638999999,-27.71591449]}"
55,22140,22,6/12/2015,San Fernando,Chaco,6254-1933,11.88,primavera,2015-11-30,"[2015-11-30, 2015-12-01, 2015-12-02, 2015-12-03, 2015-12-04, 2015-12-05, 2015-12-06]",true,55,-27.92561531,-59.31798172,3.429502248764038E-4,293.6286334991455,Complejo indiferenci,-0.006143325008451939,0.3586591084798177,"{""type"":""Point"",""coordinates"":[-59.317981720000006,-27.925615310000005]}"
56,22140,22,6/12/2015,San Fernando,Chaco,6254-1933,11.88,primavera,2015-11-30,"[2015-11-30, 2015-12-01, 2015-12-02, 2015-12-03, 2015-12-04, 2015-12-05, 2015-12-06]",true,56,-27.92561531,-59.31798172,3.429502248764038E-4,293.6286334991455,Complejo indiferenci,-0.006143325008451939,0.3586591084798177,"{""type"":""Point"",""coordinates"":[-59.317981720000006,-27.925615310000005]}"
57,22126,22,6/12/2015,1 de Mayo,Chaco,32633-6454,13.09,primavera,2015-11-30,"[2015-11-30, 2015-12-01, 2015-12-02, 2015-12-03, 2015-12-04, 2015-12-05, 2015-12-06]",true,57,-27.22855035,-58.90405078,1.6671419143676758E-4,293.8307005564372,Molisoles,-0.006100247614085674,0.4144287109375,"{""type"":""Point"",""coordinates"":[-58.904050780000006,-27.22855035]}"
58,90084,90,5/12/2015,Capital,Tucuman,33966-6506,7.44,primavera,2015-11-30,"[2015-11-30, 2015-12-01, 2015-12-02, 2015-12-03, 2015-12-04, 2015-12-05, 2015-12-06]",true,58,-26.82900979,-65.21054418,4.105120897293091E-4,292.3398151397705,Molisoles,-0.003899778239428997,0.468441645304362,"{""type"":""Point"",""coordinates"":[-65.21054418,-26.829009789999997]}"
59,06658,6,19/11/2015,Quilmes,Buenos Aires,35407-6950,4.25,primavera,2015-11-16,"[2015-11-16, 2015-11-17, 2015-11-18, 2015-11-19, 2015-11-20, 2015-11-21, 2015-11-22]",true,59,-34.70037841,-58.27664278,,,Miscelaneas,,,"{""type"":""Point"",""coordinates"":[-58.276642779999996,-34.70037841]}"
60,06490,6,19/11/2015,Lomas de Zamora,Buenos Aires,35405-6949,5.53,primavera,2015-11-16,"[2015-11-16, 2015-11-17, 2015-11-18, 2015-11-19, 2015-11-20, 2015-11-21, 2015-11-22]",true,60,-34.73790272,-58.44067537,7.11679458618164E-5,295.53733317057294,Miscelaneas,-0.004629033617675304,0.3064409891764323,"{""type"":""Point"",""coordinates"":[-58.44067537000001,-34.73790272]}"
61,06490,6,19/11/2015,Lomas de Zamora,Buenos Aires,35405-6949,5.53,primavera,2015-11-16,"[2015-11-16, 2015-11-17, 2015-11-18, 2015-11-19, 2015-11-20, 2015-11-21, 2015-11-22]",true,61,-34.73790272,-58.44067537,7.11679458618164E-5,295.53733317057294,Miscelaneas,-0.004629033617675304,0.3064409891764323,"{""type"":""Point"",""coordinates"":[-58.44067537000001,-34.73790272]}"
62,06035,6,19/11/2015,Avellaneda,Buenos Aires,35411-6952,1.59,primavera,2015-11-16,"[2015-11-16, 2015-11-17, 2015-11-18, 2015-11-19, 2015-11-20, 2015-11-21, 2015-11-22]",true,62,-34.67500565,-58.31056343,,,Miscelaneas,,,"{""type"":""Point"",""coordinates"":[-58.31056343,-34.675005649999996]}"
63,06035,6,19/11/2015,Avellaneda,Buenos Aires,35411-6952,1.59,primavera,2015-11-16,"[2015-11-16, 2015-11-17, 2015-11-18, 2015-11-19, 2015-11-20, 2015-11-21, 2015-11-22]",true,63,-34.67500565,-58.31056343,,,Miscelaneas,,,"{""type"":""Point"",""coordinates"":[-58.31056343,-34.675005649999996]}"
64,06035,6,19/11/2015,Avellaneda,Buenos Aires,35411-6952,1.59,primavera,2015-11-16,"[2015-11-16, 2015-11-17, 2015-11-18, 2015-11-19, 2015-11-20, 2015-11-21, 2015-11-22]",true,64,-34.67500565,-58.31056343,,,Miscelaneas,,,"{""type"":""Point"",""coordinates"":[-58.31056343,-34.675005649999996]}"
65,06035,6,19/11/2015,Avellaneda,Buenos Aires,35411-6952,1.59,primavera,2015-11-16,"[2015-11-16, 2015-11-17, 2015-11-18, 2015-11-19, 2015-11-20, 2015-11-21, 2015-11-22]",true,65,-34.67500565,-58.31056343,,,Miscelaneas,,,"{""type"":""Point"",""coordinates"":[-58.31056343,-34.675005649999996]}"
66,06434,6,19/11/2015,Lanus,Buenos Aires,8891-2706,4.6,primavera,2015-11-16,"[2015-11-16, 2015-11-17, 2015-11-18, 2015-11-19, 2015-11-20, 2015-11-21, 2015-11-22]",true,66,-34.69095715,-58.38386285,7.11679458618164E-5,295.53733317057294,Miscelaneas,-0.004629033617675304,0.3064409891764323,"{""type"":""Point"",""coordinates"":[-58.38386285000001,-34.69095715000001]}"
67,06343,6,26/8/2015,General Paz,Buenos Aires,3274-1695,33.67,invierno,2015-08-24,"[2015-08-24, 2015-08-25, 2015-08-26, 2015-08-27, 2015-08-28, 2015-08-29, 2015-08-30]",false,67,-35.45190573,-58.26954177,1.259148120880127E-5,281.3391342163086,Complejo indiferenci,-0.001851169392466545,0.43448448181152344,"{""type"":""Point"",""coordinates"":[-58.26954176999999,-35.45190573]}"
68,06357,6,21/8/2015,General Pueyrredon,Buenos Aires,3347-1742,17.47,invierno,2015-08-17,"[2015-08-17, 2015-08-18, 2015-08-19, 2015-08-20, 2015-08-21, 2015-08-22, 2015-08-23]",false,68,-37.80766254,-57.62989086,1.6838312149047852E-6,284.27000109354657,Molisoles,-0.0015711039304733276,0.4588127136230469,"{""type"":""Point"",""coordinates"":[-57.62989086,-37.80766254000001]}"
69,06630,6,21/8/2015,Pila,Buenos Aires,6766-2227,28.56,invierno,2015-08-17,"[2015-08-17, 2015-08-18, 2015-08-19, 2015-08-20, 2015-08-21, 2015-08-22, 2015-08-23]",false,69,-36.09760675,-58.09855871,6.860494613647461E-5,284.34202257792157,Molisoles,-0.00135795958340168,0.45408376057942706,"{""type"":""Point"",""coordinates"":[-58.09855871,-36.09760674999999]}"
70,06812,6,21/8/2015,Tordillo,Buenos Aires,3309-1703,53.41,invierno,2015-08-17,"[2015-08-17, 2015-08-18, 2015-08-19, 2015-08-20, 2015-08-21, 2015-08-22, 2015-08-23]",false,70,-36.4708183,-57.1914178,3.7997961044311523E-6,285.4876117706299,Lagunas,-0.001268189400434494,0.4469369252522786,"{""type"":""Point"",""coordinates"":[-57.1914178,-36.4708183]}"
71,06693,6,21/8/2015,Roque Perez,Buenos Aires,9022-2838,10.28,invierno,2015-08-17,"[2015-08-17, 2015-08-18, 2015-08-19, 2015-08-20, 2015-08-21, 2015-08-22, 2015-08-23]",true,71,-35.41999054,-59.66501618,1.500546932220459E-5,283.7293109893799,Complejo indiferenci,-0.0011106505990028381,0.3674265543619792,"{""type"":""Point"",""coordinates"":[-59.665016179999995,-35.41999054]}"
72,06343,6,21/8/2015,General Paz,Buenos Aires,3274-1695,33.67,invierno,2015-08-17,"[2015-08-17, 2015-08-18, 2015-08-19, 2015-08-20, 2015-08-21, 2015-08-22, 2015-08-23]",false,72,-35.45190573,-58.26954177,1.1965632438659668E-5,284.55271593729657,Complejo indiferenci,-6.402693688869476E-4,0.45610809326171875,"{""type"":""Point"",""coordinates"":[-58.26954176999999,-35.45190573]}"
73,06301,6,21/8/2015,General Belgrano,Buenos Aires,9552-2855,9.08,invierno,2015-08-17,"[2015-08-17, 2015-08-18, 2015-08-19, 2015-08-20, 2015-08-21, 2015-08-22, 2015-08-23]",true,73,-35.83441,-58.47736003,1.2487173080444336E-5,284.1646137237549,Complejo indiferenci,-0.001091156154870987,0.45908355712890625,"{""type"":""Point"",""coordinates"":[-58.47736003000001,-35.83440999999999]}"
74,06658,6,13/8/2015,Quilmes,Buenos Aires,35407-6950,4.25,invierno,2015-08-10,"[2015-08-10, 2015-08-11, 2015-08-12, 2015-08-13, 2015-08-14, 2015-08-15, 2015-08-16]",true,74,-34.70037841,-58.27664278,,,Miscelaneas,,,"{""type"":""Point"",""coordinates"":[-58.276642779999996,-34.70037841]}"
75,06483,6,12/8/2015,Lobos,Buenos Aires,146-146,24.21,invierno,2015-08-10,"[2015-08-10, 2015-08-11, 2015-08-12, 2015-08-13, 2015-08-14, 2015-08-15, 2015-08-16]",false,75,-35.2649767,-59.0698098,0.008266627788543701,283.8262577056885,Molisoles,-0.0013081096112728119,0.474822998046875,"{""type"":""Point"",""coordinates"":[-59.06980980000001,-35.264976700000005]}"
76,06574,6,13/8/2015,Navarro,Buenos Aires,150-150,22.27,invierno,2015-08-10,"[2015-08-10, 2015-08-11, 2015-08-12, 2015-08-13, 2015-08-14, 2015-08-15, 2015-08-16]",false,76,-35.0117915,-59.4247779,0.009061425924301147,283.88086382548016,Molisoles,-0.0012269094586372375,0.48180580139160156,"{""type"":""Point"",""coordinates"":[-59.42477790000001,-35.0117915]}"
77,06658,6,13/8/2015,Quilmes,Buenos Aires,35407-6950,4.25,invierno,2015-08-10,"[2015-08-10, 2015-08-11, 2015-08-12, 2015-08-13, 2015-08-14, 2015-08-15, 2015-08-16]",true,77,-34.70037841,-58.27664278,,,Miscelaneas,,,"{""type"":""Point"",""coordinates"":[-58.276642779999996,-34.70037841]}"
78,82014,82,13/8/2015,Caseros,Santa Fe,6726-2218,16.67,invierno,2015-08-10,"[2015-08-10, 2015-08-11, 2015-08-12, 2015-08-13, 2015-08-14, 2015-08-15, 2015-08-16]",false,78,-33.2334798,-61.682947,0.0018604844808578491,284.8916873931885,Alfisoles,-0.0016588568687438965,0.4826488494873047,"{""type"":""Point"",""coordinates"":[-61.682947000000006,-33.23347979999999]}"
79,82014,82,9/8/2015,Caseros,Santa Fe,6726-2218,16.67,invierno,2015-08-03,"[2015-08-03, 2015-08-04, 2015-08-05, 2015-08-06, 2015-08-07, 2015-08-08, 2015-08-09]",false,79,-33.2334798,-61.682947,7.748603820800781E-7,287.3432140350342,Alfisoles,-0.0018374212086200714,0.4300676981608073,"{""type"":""Point"",""coordinates"":[-61.682947000000006,-33.23347979999999]}"
80,82084,82,10/8/2015,Rosario,Santa Fe,118-118,22.58,invierno,2015-08-10,"[2015-08-10, 2015-08-11, 2015-08-12, 2015-08-13, 2015-08-14, 2015-08-15, 2015-08-16]",false,80,-33.07901008,-60.91379957,0.007333487272262573,285.06763140360516,Alfisoles,-0.0016411617398262024,0.48523394266764325,"{""type"":""Point"",""coordinates"":[-60.91379957,-33.07901008]}"
81,06539,6,5/8/2015,Merlo,Buenos Aires,33486-6512,18.44,invierno,2015-08-03,"[2015-08-03, 2015-08-04, 2015-08-05, 2015-08-06, 2015-08-07, 2015-08-08, 2015-08-09]",false,81,-34.70854224,-58.67958673,8.821487426757812E-6,286.64611117045087,Complejo indiferenci,-0.002022136002779007,0.45119603474934894,"{""type"":""Point"",""coordinates"":[-58.67958673,-34.70854223999999]}"
82,06427,6,5/8/2015,La Matanza,Buenos Aires,33486-6512,4.98,invierno,2015-08-03,"[2015-08-03, 2015-08-04, 2015-08-05, 2015-08-06, 2015-08-07, 2015-08-08, 2015-08-09]",true,82,-34.71417289,-58.50890438,7.43865966796875E-5,286.7600434621175,Molisoles,-0.0018861573189496994,0.4251778920491536,"{""type"":""Point"",""coordinates"":[-58.50890437999999,-34.71417289000001]}"
83,06532,6,5/8/2015,Mercedes,Buenos Aires,7-7,20.35,invierno,2015-08-03,"[2015-08-03, 2015-08-04, 2015-08-05, 2015-08-06, 2015-08-07, 2015-08-08, 2015-08-09]",false,83,-34.64501572,-59.35927582,5.4836273193359375E-6,286.4568208058675,Molisoles,-0.0019692685455083847,0.4507274627685547,"{""type"":""Point"",""coordinates"":[-59.35927582,-34.64501572]}"
84,06658,6,10/8/2015,Quilmes,Buenos Aires,35407-6950,4.25,invierno,2015-08-10,"[2015-08-10, 2015-08-11, 2015-08-12, 2015-08-13, 2015-08-14, 2015-08-15, 2015-08-16]",true,84,-34.70037841,-58.27664278,,,Miscelaneas,,,"{""type"":""Point"",""coordinates"":[-58.276642779999996,-34.70037841]}"
85,06714,6,10/8/2015,Salto,Buenos Aires,31982-6397,17.53,invierno,2015-08-10,"[2015-08-10, 2015-08-11, 2015-08-12, 2015-08-13, 2015-08-14, 2015-08-15, 2015-08-16]",false,85,-34.1554316,-60.4724629,0.005735680460929871,284.24512163798016,Molisoles,-0.0012756995856761932,0.48502159118652344,"{""type"":""Point"",""coordinates"":[-60.472462900000004,-34.1554316]}"
86,06497,6,6/8/2015,Lujan,Buenos Aires,7-7,7.25,invierno,2015-08-03,"[2015-08-03, 2015-08-04, 2015-08-05, 2015-08-06, 2015-08-07, 2015-08-08, 2015-08-09]",true,86,-34.4619848,-59.1744878,1.2874603271484375E-5,286.56603304545087,Complejo indiferenci,-0.001888565719127655,0.4383424123128255,"{""type"":""Point"",""coordinates"":[-59.1744878,-34.4619848]}"
87,06126,6,5/8/2015,Campana,Buenos Aires,26206-5876,0.02,invierno,2015-08-03,"[2015-08-03, 2015-08-04, 2015-08-05, 2015-08-06, 2015-08-07, 2015-08-08, 2015-08-09]",true,87,-34.059934,-58.836065,1.7881393432617188E-7,287.59581820170087,Rio,-0.0019290316849946976,0.5034173329671224,"{""type"":""Point"",""coordinates"":[-58.836065000000005,-34.059934]}"
88,06638,6,5/8/2015,Pilar,Buenos Aires,34357-5904,12.77,invierno,2015-08-03,"[2015-08-03, 2015-08-04, 2015-08-05, 2015-08-06, 2015-08-07, 2015-08-08, 2015-08-09]",true,88,-34.42200558,-58.95283788,1.2695789337158203E-5,286.7631359100342,Molisoles,-0.0018884073942899704,0.42026710510253906,"{""type"":""Point"",""coordinates"":[-58.95283788,-34.42200558]}"
89,06490,6,5/8/2015,Lomas de Zamora,Buenos Aires,35405-6949,5.53,invierno,2015-08-03,"[2015-08-03, 2015-08-04, 2015-08-05, 2015-08-06, 2015-08-07, 2015-08-08, 2015-08-09]",true,89,-34.73790272,-58.44067537,8.365511894226074E-5,286.9477062225342,Miscelaneas,-0.0018374789506196976,0.41573143005371094,"{""type"":""Point"",""coordinates"":[-58.44067537000001,-34.73790272]}"
90,06658,6,5/8/2015,Quilmes,Buenos Aires,35407-6950,4.25,invierno,2015-08-03,"[2015-08-03, 2015-08-04, 2015-08-05, 2015-08-06, 2015-08-07, 2015-08-08, 2015-08-09]",true,90,-34.70037841,-58.27664278,,,Miscelaneas,,,"{""type"":""Point"",""coordinates"":[-58.276642779999996,-34.70037841]}"
91,06098,6,5/8/2015,Berisso,Buenos Aires,3314-1708,0.7,invierno,2015-08-03,"[2015-08-03, 2015-08-04, 2015-08-05, 2015-08-06, 2015-08-07, 2015-08-08, 2015-08-09]",true,91,-34.84587606,-57.87973336,,,Miscelaneas,,,"{""type"":""Point"",""coordinates"":[-57.87973336,-34.84587606]}"
92,06497,6,5/8/2015,Lujan,Buenos Aires,7-7,7.25,invierno,2015-08-03,"[2015-08-03, 2015-08-04, 2015-08-05, 2015-08-06, 2015-08-07, 2015-08-08, 2015-08-09]",true,92,-34.4619848,-59.1744878,1.2874603271484375E-5,286.56603304545087,Complejo indiferenci,-0.001888565719127655,0.4383424123128255,"{""type"":""Point"",""coordinates"":[-59.1744878,-34.4619848]}"
93,06882,6,5/8/2015,Zarate,Buenos Aires,3320-1714,3.88,invierno,2015-08-03,"[2015-08-03, 2015-08-04, 2015-08-05, 2015-08-06, 2015-08-07, 2015-08-08, 2015-08-09]",true,93,-33.9804188,-59.2846864,3.606081008911133E-6,287.4040050506592,Rio,-0.0020089857280254364,0.5278828938802084,"{""type"":""Point"",""coordinates"":[-59.2846864,-33.9804188]}"
94,06735,6,5/8/2015,San Antonio de Areco,Buenos Aires,6906-2215,2.81,invierno,2015-08-03,"[2015-08-03, 2015-08-04, 2015-08-05, 2015-08-06, 2015-08-07, 2015-08-08, 2015-08-09]",true,94,-34.2881384,-59.5070413,1.2099742889404297E-5,286.72106234232587,Molisoles,-0.002000080421566963,0.45360247294108075,"{""type"":""Point"",""coordinates"":[-59.5070413,-34.2881384]}"
95,06638,6,3/11/2014,Pilar,Buenos Aires,34357-5904,12.77,primavera,2014-11-03,"[2014-11-03, 2014-11-04, 2014-11-05, 2014-11-06, 2014-11-07, 2014-11-08, 2014-11-09]",true,95,-34.42200558,-58.95283788,0.005469679832458496,288.63281440734863,Molisoles,-0.0014757756143808365,0.4653326670328776,"{""type"":""Point"",""coordinates"":[-58.95283788,-34.42200558]}"
96,06490,6,3/11/2014,Lomas de Zamora,Buenos Aires,35405-6949,5.53,primavera,2014-11-03,"[2014-11-03, 2014-11-04, 2014-11-05, 2014-11-06, 2014-11-07, 2014-11-08, 2014-11-09]",true,96,-34.73790272,-58.44067537,0.004826456308364868,289.3024107615153,Miscelaneas,-0.0017813146114349365,0.4735552469889323,"{""type"":""Point"",""coordinates"":[-58.44067537000001,-34.73790272]}"
97,06245,6,1/11/2014,Ensenada,Buenos Aires,3314-1708,6.45,primavera,2014-10-27,"[2014-10-27, 2014-10-28, 2014-10-29, 2014-10-30, 2014-10-31, 2014-11-01, 2014-11-02]",true,97,-34.87584856,-57.9336299,2.218484878540039E-4,298.5275338490804,Miscelaneas,-0.005073683336377144,0.3232288360595703,"{""type"":""Point"",""coordinates"":[-57.9336299,-34.875848559999994]}"
98,06749,6,2/11/2014,San Fernando,Buenos Aires,34847-6831,5.62,primavera,2014-10-27,"[2014-10-27, 2014-10-28, 2014-10-29, 2014-10-30, 2014-10-31, 2014-11-01, 2014-11-02]",true,98,-34.2256455,-58.5931568,1.8149614334106445E-5,299.11827278137207,Rio,-0.005775796249508858,0.3831907908121745,"{""type"":""Point"",""coordinates"":[-58.5931568,-34.2256455]}"
99,06749,6,1/11/2014,San Fernando,Buenos Aires,34847-6831,5.62,primavera,2014-10-27,"[2014-10-27, 2014-10-28, 2014-10-29, 2014-10-30, 2014-10-31, 2014-11-01, 2014-11-02]",true,99,-34.2256455,-58.5931568,1.8149614334106445E-5,299.11827278137207,Rio,-0.005775796249508858,0.3831907908121745,"{""type"":""Point"",""coordinates"":[-58.5931568,-34.2256455]}"
100,06658,6,1/11/2014,Quilmes,Buenos Aires,35407-6950,4.25,primavera,2014-10-27,"[2014-10-27, 2014-10-28, 2014-10-29, 2014-10-30, 2014-10-31, 2014-11-01, 2014-11-02]",true,100,-34.70037841,-58.27664278,,,Miscelaneas,,,"{""type"":""Point"",""coordinates"":[-58.276642779999996,-34.70037841]}"
101,06196,6,29/10/2014,Coronel Pringles,Buenos Aires,36845-7243,88.06,primavera,2014-10-27,"[2014-10-27, 2014-10-28, 2014-10-29, 2014-10-30, 2014-10-31, 2014-11-01, 2014-11-02]",false,101,-37.9951979,-60.8897785,0.011764079332351685,292.14927864074707,Molisoles,-0.0016173925250768661,0.40946388244628906,"{""type"":""Point"",""coordinates"":[-60.889778500000006,-37.9951979]}"
102,06112,6,28/10/2014,Bragado,Buenos Aires,6954-2111,27.83,primavera,2014-10-27,"[2014-10-27, 2014-10-28, 2014-10-29, 2014-10-30, 2014-10-31, 2014-11-01, 2014-11-02]",false,102,-35.2410531,-60.3474272,7.137656211853027E-5,298.2811959584554,Molisoles,-0.0035536661744117737,0.22015762329101562,"{""type"":""Point"",""coordinates"":[-60.3474272,-35.24105310000001]}"
103,06497,6,28/10/2014,Lujan,Buenos Aires,7-7,7.25,primavera,2014-10-27,"[2014-10-27, 2014-10-28, 2014-10-29, 2014-10-30, 2014-10-31, 2014-11-01, 2014-11-02]",true,103,-34.4619848,-59.1744878,1.2286007404327393E-4,299.02053515116376,Complejo indiferenci,-0.004270583391189575,0.3156960805257161,"{""type"":""Point"",""coordinates"":[-59.1744878,-34.4619848]}"
104,62021,62,2/6/2015,Bariloche,Rio Negro,6953-2144,0.07,otoño,2015-06-01,"[2015-06-01, 2015-06-02, 2015-06-03, 2015-06-04, 2015-06-05, 2015-06-06, 2015-06-07]",true,104,-41.89814608,-71.50316469,0.016475260257720947,277.31045722961426,Inceptisoles,-3.6691315472126007E-4,0.4661979675292969,"{""type"":""Point"",""coordinates"":[-71.50316469000002,-41.898146080000004]}"
105,14161,14,29/12/2013,Tercero Arriba,Cordoba,34345-6361,4.53,verano,2013-12-23,"[2013-12-23, 2013-12-24, 2013-12-25, 2013-12-26, 2013-12-27, 2013-12-28, 2013-12-29]",true,105,-32.25289151,-64.25143209,4.470348358154297E-8,301.4117069244385,Complejo indiferenci,-0.0022096578031778336,0.17734654744466147,"{""type"":""Point"",""coordinates"":[-64.25143209,-32.25289151]}"
106,14091,14,22/12/2013,Punilla,Cordoba,36828-7231,28.57,primavera,2013-12-16,"[2013-12-16, 2013-12-17, 2013-12-18, 2013-12-19, 2013-12-20, 2013-12-21, 2013-12-22]",false,106,-31.10580063,-64.59128571,1.3560056686401367E-6,296.60048802693683,Molisoles,-0.003182303160429001,0.23668797810872397,"{""type"":""Point"",""coordinates"":[-64.59128571,-31.105800630000005]}"
107,30042,30,9/11/2013,Feliciano,Entre Rios,36832-7234,6.85,primavera,2013-11-04,"[2013-11-04, 2013-11-05, 2013-11-06, 2013-11-07, 2013-11-08, 2013-11-09, 2013-11-10]",true,107,-30.42934153,-58.76618814,3.874301910400391E-6,291.4975236256917,Molisoles,-0.005681226029992104,0.43631871541341144,"{""type"":""Point"",""coordinates"":[-58.766188140000004,-30.42934153]}"
108,30028,30,9/11/2013,Federacion,Entre Rios,1385-1073,7.52,primavera,2013-11-04,"[2013-11-04, 2013-11-05, 2013-11-06, 2013-11-07, 2013-11-08, 2013-11-09, 2013-11-10]",true,108,-30.70681007,-57.88784914,3.079324960708618E-4,291.4217586517334,Molisoles,-0.005709197372198105,0.24923070271809897,"{""type"":""Point"",""coordinates"":[-57.88784913999999,-30.70681007]}"
109,30028,30,9/11/2013,Federacion,Entre Rios,1385-1073,7.52,primavera,2013-11-04,"[2013-11-04, 2013-11-05, 2013-11-06, 2013-11-07, 2013-11-08, 2013-11-09, 2013-11-10]",true,109,-30.70681007,-57.88784914,3.079324960708618E-4,291.4217586517334,Molisoles,-0.005709197372198105,0.24923070271809897,"{""type"":""Point"",""coordinates"":[-57.88784913999999,-30.70681007]}"
110,30035,30,9/11/2013,Federal,Entre Rios,36958-7272,25.83,primavera,2013-11-04,"[2013-11-04, 2013-11-05, 2013-11-06, 2013-11-07, 2013-11-08, 2013-11-09, 2013-11-10]",false,110,-30.97193714,-58.99327599,1.1071562767028809E-5,291.3936010996501,Vertisoles,-0.005637435242533684,0.4358539581298828,"{""type"":""Point"",""coordinates"":[-58.99327599,-30.971937140000005]}"
111,06581,6,22/8/2014,Necochea,Buenos Aires,32742-6427,63.08,invierno,2014-08-18,"[2014-08-18, 2014-08-19, 2014-08-20, 2014-08-21, 2014-08-22, 2014-08-23, 2014-08-24]",false,111,-38.085516,-59.2924177,4.172325134277344E-7,290.64195187886554,Molisoles,-0.0018696319311857224,0.260257085164388,"{""type"":""Point"",""coordinates"":[-59.2924177,-38.085516000000005]}"
112,82063,82,16/7/2014,La Capital,Santa Fe,103-103,23.73,invierno,2014-07-14,"[2014-07-14, 2014-07-15, 2014-07-16, 2014-07-17, 2014-07-18, 2014-07-19, 2014-07-20]",false,112,-31.18858147,-60.62677383,5.662441253662109E-6,293.12093353271484,Molisoles,-0.0014156289398670197,0.4578196207682292,"{""type"":""Point"",""coordinates"":[-60.62677383,-31.18858147]}"
113,82063,82,12/7/2014,La Capital,Santa Fe,103-103,23.73,invierno,2014-07-07,"[2014-07-07, 2014-07-08, 2014-07-09, 2014-07-10, 2014-07-11, 2014-07-12, 2014-07-13]",false,113,-31.18858147,-60.62677383,5.066394805908203E-7,284.21615409851074,Molisoles,-0.0017805220559239388,0.45339202880859375,"{""type"":""Point"",""coordinates"":[-60.62677383,-31.18858147]}"
114,34014,34,3/7/2014,Formosa,Formosa,34001-6658,9.62,invierno,2014-06-30,"[2014-06-30, 2014-07-01, 2014-07-02, 2014-07-03, 2014-07-04, 2014-07-05, 2014-07-06]",true,114,-25.73826408,-57.92005921,4.5205652713775635E-4,284.4552478790283,Rio,-0.0012406613677740097,0.40606943766276044,"{""type"":""Point"",""coordinates"":[-57.920059210000005,-25.73826408]}"
115,82063,82,27/7/2013,La Capital,Santa Fe,103-103,23.73,invierno,2013-07-22,"[2013-07-22, 2013-07-23, 2013-07-24, 2013-07-25, 2013-07-26, 2013-07-27, 2013-07-28]",false,115,-31.18858147,-60.62677383,7.748603820800781E-7,279.30291239420575,Molisoles,-0.001244809478521347,0.3424428304036458,"{""type"":""Point"",""coordinates"":[-60.62677383,-31.18858147]}"
116,06441,6,11/7/2013,La Plata,Buenos Aires,3314-1708,23.31,invierno,2013-07-08,"[2013-07-08, 2013-07-09, 2013-07-10, 2013-07-11, 2013-07-12, 2013-07-13, 2013-07-14]",false,116,-35.03880607,-58.05930616,1.4767050743103027E-5,279.57482020060223,Complejo indiferenci,-7.617417722940445E-4,0.3726463317871094,"{""type"":""Point"",""coordinates"":[-58.05930616,-35.03880607000001]}"
117,22140,22,25/6/2013,San Fernando,Chaco,6254-1933,11.88,invierno,2013-06-24,"[2013-06-24, 2013-06-25, 2013-06-26, 2013-06-27, 2013-06-28, 2013-06-29, 2013-06-30]",true,117,-27.92561531,-59.31798172,1.2069940567016602E-5,286.9002520243327,Complejo indiferenci,-7.943920791149139E-4,0.3724924723307292,"{""type"":""Point"",""coordinates"":[-59.317981720000006,-27.925615310000005]}"
118,22126,22,25/6/2013,1 de Mayo,Chaco,32633-6454,13.09,invierno,2013-06-24,"[2013-06-24, 2013-06-25, 2013-06-26, 2013-06-27, 2013-06-28, 2013-06-29, 2013-06-30]",true,118,-27.22855035,-58.90405078,1.4007091522216797E-5,287.3167559305827,Molisoles,-0.0011225156486034393,0.4460366566975911,"{""type"":""Point"",""coordinates"":[-58.904050780000006,-27.22855035]}"
119,90091,90,10/3/2015,Simoca,Tucuman,32292-6460,1.11,verano,2015-03-09,"[2015-03-09, 2015-03-10, 2015-03-11, 2015-03-12, 2015-03-13, 2015-03-14, 2015-03-15]",true,119,-27.40925026,-65.26894379,3.585219383239746E-5,299.0289223988851,Entisoles,-0.004016730934381485,0.3758220672607422,"{""type"":""Point"",""coordinates"":[-65.26894379,-27.409250260000004]}"
120,10077,10,10/3/2015,Paclin,Catamarca,33832-6763,15.08,verano,2015-03-09,"[2015-03-09, 2015-03-10, 2015-03-11, 2015-03-12, 2015-03-13, 2015-03-14, 2015-03-15]",false,120,-27.85473251,-65.7172699,0.006816074252128601,294.3690102895101,Roca,-0.0034175794571638107,0.3829078674316406,"{""type"":""Point"",""coordinates"":[-65.7172699,-27.85473251]}"
121,10021,10,10/3/2015,Andalgala,Catamarca,33952-6744,15.51,verano,2015-03-09,"[2015-03-09, 2015-03-10, 2015-03-11, 2015-03-12, 2015-03-13, 2015-03-14, 2015-03-15]",false,121,-27.61905956,-66.11518542,9.114295244216919E-4,292.23831367492676,Entisoles,-0.003331616520881653,0.4615643819173177,"{""type"":""Point"",""coordinates"":[-66.11518542,-27.619059560000004]}"
122,90035,90,10/3/2015,Graneros,Tucuman,32679-6504,25.54,verano,2015-03-09,"[2015-03-09, 2015-03-10, 2015-03-11, 2015-03-12, 2015-03-13, 2015-03-14, 2015-03-15]",false,122,-27.6423966,-65.5086366,9.621679782867432E-4,297.50336901346844,Molisoles,-0.003988813608884811,0.41589800516764325,"{""type"":""Point"",""coordinates"":[-65.50863660000002,-27.642396600000005]}"
123,90035,90,10/3/2015,Graneros,Tucuman,32679-6504,25.54,verano,2015-03-09,"[2015-03-09, 2015-03-10, 2015-03-11, 2015-03-12, 2015-03-13, 2015-03-14, 2015-03-15]",false,123,-27.6423966,-65.5086366,9.621679782867432E-4,297.50336901346844,Molisoles,-0.003988813608884811,0.41589800516764325,"{""type"":""Point"",""coordinates"":[-65.50863660000002,-27.642396600000005]}"
124,74007,74,2/3/2015,Ayacucho,San Luis,31950-2172,64.22,verano,2015-03-02,"[2015-03-02, 2015-03-03, 2015-03-04, 2015-03-05, 2015-03-06, 2015-03-07, 2015-03-08]",false,124,-32.13651315,-66.85445389,1.6927719116210938E-5,295.1757005055745,Entisoles,-0.003970797173678875,0.2097784678141276,"{""type"":""Point"",""coordinates"":[-66.85445389,-32.13651315]}"
125,74007,74,2/3/2015,Ayacucho,San Luis,31950-2172,64.22,verano,2015-03-02,"[2015-03-02, 2015-03-03, 2015-03-04, 2015-03-05, 2015-03-06, 2015-03-07, 2015-03-08]",false,125,-32.13651315,-66.85445389,1.6927719116210938E-5,295.1757005055745,Entisoles,-0.003970797173678875,0.2097784678141276,"{""type"":""Point"",""coordinates"":[-66.85445389,-32.13651315]}"
126,14140,14,25/2/2015,San Justo,Cordoba,6955-2119,12.54,verano,2015-02-23,"[2015-02-23, 2015-02-24, 2015-02-25, 2015-02-26, 2015-02-27, 2015-02-28, 2015-03-01]",true,126,-31.23400374,-62.74066613,9.685754776000977E-7,297.69277318318683,Alfisoles,-0.0040434375405311584,0.26619720458984375,"{""type"":""Point"",""coordinates"":[-62.74066613,-31.234003740000002]}"
127,14105,14,25/2/2015,Rio Primero,Cordoba,6799-2118,21.24,verano,2015-02-23,"[2015-02-23, 2015-02-24, 2015-02-25, 2015-02-26, 2015-02-27, 2015-02-28, 2015-03-01]",false,127,-30.80593546,-63.17324293,1.1920928955078125E-6,297.67617162068683,Molisoles,-0.004029270261526108,0.2517433166503906,"{""type"":""Point"",""coordinates"":[-63.17324293,-30.805935460000004]}"
128,14014,14,18/2/2015,Capital,Cordoba,37574-7384,24.04,verano,2015-02-16,"[2015-02-16, 2015-02-17, 2015-02-18, 2015-02-19, 2015-02-20, 2015-02-21, 2015-02-22]",false,128,-31.47878838,-64.14509583,0.009745590388774872,295.2551097869873,Miscelaneas,-0.0041305189952254295,0.41217931111653644,"{""type"":""Point"",""coordinates"":[-64.14509583,-31.478788380000008]}"
129,82063,82,15/7/2014,La Capital,Santa Fe,103-103,23.73,invierno,2014-07-14,"[2014-07-14, 2014-07-15, 2014-07-16, 2014-07-17, 2014-07-18, 2014-07-19, 2014-07-20]",false,129,-31.18858147,-60.62677383,5.662441253662109E-6,293.12093353271484,Molisoles,-0.0014156289398670197,0.4578196207682292,"{""type"":""Point"",""coordinates"":[-60.62677383,-31.18858147]}"
130,14021,14,18/2/2015,Colon,Cordoba,33948-6745,20.69,verano,2015-02-16,"[2015-02-16, 2015-02-17, 2015-02-18, 2015-02-19, 2015-02-20, 2015-02-21, 2015-02-22]",false,130,-31.25624481,-63.95340394,0.0012191012501716614,295.6647777557373,Miscelaneas,-0.004104655236005783,0.3997732798258464,"{""type"":""Point"",""coordinates"":[-63.953403939999994,-31.256244809999995]}"
131,14021,14,18/2/2015,Colon,Cordoba,33948-6745,20.69,verano,2015-02-16,"[2015-02-16, 2015-02-17, 2015-02-18, 2015-02-19, 2015-02-20, 2015-02-21, 2015-02-22]",false,131,-31.25624481,-63.95340394,0.0012191012501716614,295.6647777557373,Miscelaneas,-0.004104655236005783,0.3997732798258464,"{""type"":""Point"",""coordinates"":[-63.953403939999994,-31.256244809999995]}"
132,14021,14,18/2/2015,Colon,Cordoba,33948-6745,20.69,verano,2015-02-16,"[2015-02-16, 2015-02-17, 2015-02-18, 2015-02-19, 2015-02-20, 2015-02-21, 2015-02-22]",false,132,-31.25624481,-63.95340394,0.0012191012501716614,295.6647777557373,Miscelaneas,-0.004104655236005783,0.3997732798258464,"{""type"":""Point"",""coordinates"":[-63.953403939999994,-31.256244809999995]}"
133,74028,74,2/3/2015,Chacabuco,San Luis,33256-6389,30.54,verano,2015-03-02,"[2015-03-02, 2015-03-03, 2015-03-04, 2015-03-05, 2015-03-06, 2015-03-07, 2015-03-08]",false,133,-32.56339762,-65.03153075,2.1725893020629883E-5,292.1474615732829,Entisoles,-0.003270776942372322,0.3918069203694661,"{""type"":""Point"",""coordinates"":[-65.03153075,-32.56339762000001]}"
134,74049,74,2/3/2015,Junin,San Luis,34137-6448,58.78,verano,2015-03-02,"[2015-03-02, 2015-03-03, 2015-03-04, 2015-03-05, 2015-03-06, 2015-03-07, 2015-03-08]",false,134,-32.31398017,-65.41102538,1.7970800399780273E-5,293.0643723805745,Entisoles,-0.0037479521706700325,0.354831059773763,"{""type"":""Point"",""coordinates"":[-65.41102538,-32.31398017]}"
135,74049,74,2/3/2015,Junin,San Luis,34137-6448,58.78,verano,2015-03-02,"[2015-03-02, 2015-03-03, 2015-03-04, 2015-03-05, 2015-03-06, 2015-03-07, 2015-03-08]",false,135,-32.31398017,-65.41102538,1.7970800399780273E-5,293.0643723805745,Entisoles,-0.0037479521706700325,0.354831059773763,"{""type"":""Point"",""coordinates"":[-65.41102538,-32.31398017]}"
136,10098,10,2/3/2015,Santa Rosa,Catamarca,37029-7291,18.43,verano,2015-03-02,"[2015-03-02, 2015-03-03, 2015-03-04, 2015-03-05, 2015-03-06, 2015-03-07, 2015-03-08]",false,136,-28.04503194,-65.27845615,2.2739171981811523E-5,296.8212896982829,Roca,-0.0026334719732403755,0.3176403045654297,"{""type"":""Point"",""coordinates"":[-65.27845615,-28.04503194]}"
137,10098,10,2/3/2015,Santa Rosa,Catamarca,37029-7291,18.43,verano,2015-03-02,"[2015-03-02, 2015-03-03, 2015-03-04, 2015-03-05, 2015-03-06, 2015-03-07, 2015-03-08]",false,137,-28.04503194,-65.27845615,2.2739171981811523E-5,296.8212896982829,Roca,-0.0026334719732403755,0.3176403045654297,"{""type"":""Point"",""coordinates"":[-65.27845615,-28.04503194]}"
138,10098,10,2/3/2015,Santa Rosa,Catamarca,37029-7291,18.43,verano,2015-03-02,"[2015-03-02, 2015-03-03, 2015-03-04, 2015-03-05, 2015-03-06, 2015-03-07, 2015-03-08]",false,138,-28.04503194,-65.27845615,2.2739171981811523E-5,296.8212896982829,Roca,-0.0026334719732403755,0.3176403045654297,"{""type"":""Point"",""coordinates"":[-65.27845615,-28.04503194]}"
139,86182,86,2/3/2015,Sarmiento,Santiago del Estero,6804-2223,13.63,verano,2015-03-02,"[2015-03-02, 2015-03-03, 2015-03-04, 2015-03-05, 2015-03-06, 2015-03-07, 2015-03-08]",true,139,-28.08144587,-63.33466823,3.547966480255127E-5,298.3143723805745,Alfisoles,-0.003142988309264183,0.39772987365722656,"{""type"":""Point"",""coordinates"":[-63.33466822999999,-28.081445870000003]}"
140,86084,86,2/3/2015,Guasayan,Santiago del Estero,32299-6447,23.83,verano,2015-03-02,"[2015-03-02, 2015-03-03, 2015-03-04, 2015-03-05, 2015-03-06, 2015-03-07, 2015-03-08]",false,140,-27.85040093,-65.01179504,3.243982791900635E-5,296.9856777191162,Molisoles,-0.0026363786309957504,0.2906678517659505,"{""type"":""Point"",""coordinates"":[-65.01179504,-27.85040093]}"
141,86105,86,2/3/2015,Loreto,Santiago del Estero,33116-6456,8.34,verano,2015-03-02,"[2015-03-02, 2015-03-03, 2015-03-04, 2015-03-05, 2015-03-06, 2015-03-07, 2015-03-08]",true,141,-28.47635326,-64.04507396,4.8980116844177246E-5,297.8678391774495,Alfisoles,-0.002652660943567753,0.4086386362711589,"{""type"":""Point"",""coordinates"":[-64.04507396,-28.47635326]}"
142,86077,86,2/3/2015,General Taboada,Santiago del Estero,32704-6540,10.43,verano,2015-03-02,"[2015-03-02, 2015-03-03, 2015-03-04, 2015-03-05, 2015-03-06, 2015-03-07, 2015-03-08]",true,142,-28.41299021,-62.79434139,2.2038817405700684E-5,298.0810553232829,Alfisoles,-0.0029495228081941605,0.3982702891031901,"{""type"":""Point"",""coordinates"":[-62.79434139,-28.412990209999997]}"
143,86077,86,2/3/2015,General Taboada,Santiago del Estero,32704-6540,10.43,verano,2015-03-02,"[2015-03-02, 2015-03-03, 2015-03-04, 2015-03-05, 2015-03-06, 2015-03-07, 2015-03-08]",true,143,-28.41299021,-62.79434139,2.2038817405700684E-5,298.0810553232829,Alfisoles,-0.0029495228081941605,0.3982702891031901,"{""type"":""Point"",""coordinates"":[-62.79434139,-28.412990209999997]}"
144,86042,86,2/3/2015,Belgrano,Santiago del Estero,6800-2197,12.07,verano,2015-03-02,"[2015-03-02, 2015-03-03, 2015-03-04, 2015-03-05, 2015-03-06, 2015-03-07, 2015-03-08]",true,144,-28.89628,-62.62596,1.9237399101257324E-5,298.1041673024495,Molisoles,-0.0028094202280044556,0.4026482899983724,"{""type"":""Point"",""coordinates"":[-62.62596,-28.89628]}"
145,86049,86,2/3/2015,Capital,Santiago del Estero,36917-7264,13.33,verano,2015-03-02,"[2015-03-02, 2015-03-03, 2015-03-04, 2015-03-05, 2015-03-06, 2015-03-07, 2015-03-08]",true,145,-27.80983349,-64.48893926,1.506507396697998E-4,297.7330735524495,Alfisoles,-0.0027170609682798386,0.2791124979654948,"{""type"":""Point"",""coordinates"":[-64.48893926,-27.809833490000003]}"
146,82063,82,29/10/2013,La Capital,Santa Fe,103-103,23.73,primavera,2013-10-28,"[2013-10-28, 2013-10-29, 2013-10-30, 2013-10-31, 2013-11-01, 2013-11-02, 2013-11-03]",false,146,-31.18858147,-60.62677383,5.662441253662109E-7,293.6342258453369,Molisoles,-0.004896249622106552,0.385372797648112,"{""type"":""Point"",""coordinates"":[-60.62677383,-31.18858147]}"
147,82084,82,29/10/2013,Rosario,Santa Fe,118-118,22.58,primavera,2013-10-28,"[2013-10-28, 2013-10-29, 2013-10-30, 2013-10-31, 2013-11-01, 2013-11-02, 2013-11-03]",false,147,-33.07901008,-60.91379957,1.773238182067871E-6,293.0067030588786,Alfisoles,-0.0015794774517416954,0.2897205352783203,"{""type"":""Point"",""coordinates"":[-60.91379957,-33.07901008]}"
148,14140,14,2/3/2015,San Justo,Cordoba,6955-2119,12.54,verano,2015-03-02,"[2015-03-02, 2015-03-03, 2015-03-04, 2015-03-05, 2015-03-06, 2015-03-07, 2015-03-08]",true,148,-31.23400374,-62.74066613,1.0117888450622559E-5,296.6875006357829,Alfisoles,-0.0032593291252851486,0.39661216735839844,"{""type"":""Point"",""coordinates"":[-62.74066613,-31.234003740000002]}"
149,14014,14,30/10/2013,Capital,Cordoba,37574-7384,24.04,primavera,2013-10-28,"[2013-10-28, 2013-10-29, 2013-10-30, 2013-10-31, 2013-11-01, 2013-11-02, 2013-11-03]",false,149,-31.47878838,-64.14509583,2.8312206268310547E-7,294.7611789703369,Miscelaneas,-5.776332691311836E-4,0.13377507527669272,"{""type"":""Point"",""coordinates"":[-64.14509583,-31.478788380000008]}"
150,14056,14,30/10/2013,Juarez Celman,Cordoba,8232-2605,4.84,primavera,2013-10-28,"[2013-10-28, 2013-10-29, 2013-10-30, 2013-10-31, 2013-11-01, 2013-11-02, 2013-11-03]",true,150,-33.3160107,-63.2538219,1.7881393432617188E-7,296.30056699117023,Molisoles,-8.463272824883461E-4,0.14284833272298178,"{""type"":""Point"",""coordinates"":[-63.2538219,-33.3160107]}"
151,14021,14,30/10/2013,Colon,Cordoba,33948-6745,20.69,primavera,2013-10-28,"[2013-10-28, 2013-10-29, 2013-10-30, 2013-10-31, 2013-11-01, 2013-11-02, 2013-11-03]",false,151,-31.25624481,-63.95340394,5.960464477539063E-8,294.99294980367023,Miscelaneas,-8.810311555862427E-4,0.17668914794921875,"{""type"":""Point"",""coordinates"":[-63.953403939999994,-31.256244809999995]}"
152,14021,14,30/10/2013,Colon,Cordoba,33948-6745,20.69,primavera,2013-10-28,"[2013-10-28, 2013-10-29, 2013-10-30, 2013-10-31, 2013-11-01, 2013-11-02, 2013-11-03]",false,152,-31.25624481,-63.95340394,5.960464477539063E-8,294.99294980367023,Miscelaneas,-8.810311555862427E-4,0.17668914794921875,"{""type"":""Point"",""coordinates"":[-63.953403939999994,-31.256244809999995]}"
153,14021,14,30/10/2013,Colon,Cordoba,33948-6745,20.69,primavera,2013-10-28,"[2013-10-28, 2013-10-29, 2013-10-30, 2013-10-31, 2013-11-01, 2013-11-02, 2013-11-03]",false,153,-31.25624481,-63.95340394,5.960464477539063E-8,294.99294980367023,Miscelaneas,-8.810311555862427E-4,0.17668914794921875,"{""type"":""Point"",""coordinates"":[-63.953403939999994,-31.256244809999995]}"
154,82063,82,2/3/2015,La Capital,Santa Fe,103-103,23.73,verano,2015-03-02,"[2015-03-02, 2015-03-03, 2015-03-04, 2015-03-05, 2015-03-06, 2015-03-07, 2015-03-08]",false,154,-31.18858147,-60.62677383,1.4516711235046387E-4,297.6965338389079,Molisoles,-0.0033746138215065002,0.4921061197916667,"{""type"":""Point"",""coordinates"":[-60.62677383,-31.18858147]}"
155,14021,14,2/3/2015,Colon,Cordoba,33948-6745,20.69,verano,2015-03-02,"[2015-03-02, 2015-03-03, 2015-03-04, 2015-03-05, 2015-03-06, 2015-03-07, 2015-03-08]",false,155,-31.25624481,-63.95340394,2.905726432800293E-5,295.8409023284912,Miscelaneas,-0.003029913641512394,0.3947563171386719,"{""type"":""Point"",""coordinates"":[-63.953403939999994,-31.256244809999995]}"
156,14091,14,2/3/2015,Punilla,Cordoba,36828-7231,28.57,verano,2015-03-02,"[2015-03-02, 2015-03-03, 2015-03-04, 2015-03-05, 2015-03-06, 2015-03-07, 2015-03-08]",false,156,-31.10580063,-64.59128571,3.7923455238342285E-5,293.2568365732829,Molisoles,-0.0028208643198013306,0.3916327158610026,"{""type"":""Point"",""coordinates"":[-64.59128571,-31.105800630000005]}"
157,14140,14,2/3/2015,San Justo,Cordoba,6955-2119,12.54,verano,2015-03-02,"[2015-03-02, 2015-03-03, 2015-03-04, 2015-03-05, 2015-03-06, 2015-03-07, 2015-03-08]",true,157,-31.23400374,-62.74066613,1.0117888450622559E-5,296.6875006357829,Alfisoles,-0.0032593291252851486,0.39661216735839844,"{""type"":""Point"",""coordinates"":[-62.74066613,-31.234003740000002]}"
158,14091,14,2/3/2015,Punilla,Cordoba,36828-7231,28.57,verano,2015-03-02,"[2015-03-02, 2015-03-03, 2015-03-04, 2015-03-05, 2015-03-06, 2015-03-07, 2015-03-08]",false,158,-31.10580063,-64.59128571,3.7923455238342285E-5,293.2568365732829,Molisoles,-0.0028208643198013306,0.3916327158610026,"{""type"":""Point"",""coordinates"":[-64.59128571,-31.105800630000005]}"
159,14042,14,2/3/2015,General San Martin,Cordoba,9400-2835,27.92,verano,2015-03-02,"[2015-03-02, 2015-03-03, 2015-03-04, 2015-03-05, 2015-03-06, 2015-03-07, 2015-03-08]",false,159,-32.34123693,-62.99621706,1.7508864402770996E-5,295.7876796722412,Complejo indiferenci,-0.0028636427596211433,0.3941338857014974,"{""type"":""Point"",""coordinates"":[-62.99621706,-32.34123693]}"
160,14140,14,2/3/2015,San Justo,Cordoba,6955-2119,12.54,verano,2015-03-02,"[2015-03-02, 2015-03-03, 2015-03-04, 2015-03-05, 2015-03-06, 2015-03-07, 2015-03-08]",true,160,-31.23400374,-62.74066613,1.0117888450622559E-5,296.6875006357829,Alfisoles,-0.0032593291252851486,0.39661216735839844,"{""type"":""Point"",""coordinates"":[-62.74066613,-31.234003740000002]}"
161,34049,34,27/6/2014,Pilcomayo,Formosa,36840-7239,50.93,invierno,2014-06-23,"[2014-06-23, 2014-06-24, 2014-06-25, 2014-06-26, 2014-06-27, 2014-06-28, 2014-06-29]",false,161,-25.11711311,-58.18847657,8.93816351890564E-4,295.6600882212321,Rio,-0.002672632224857807,0.4692115783691406,"{""type"":""Point"",""coordinates"":[-58.18847657,-25.117113110000002]}"
162,34049,34,9/6/2014,Pilcomayo,Formosa,36840-7239,50.93,otoño,2014-06-09,"[2014-06-09, 2014-06-10, 2014-06-11, 2014-06-12, 2014-06-13, 2014-06-14, 2014-06-15]",false,162,-25.11711311,-58.18847657,5.7220458984375E-6,287.921324412028,Rio,-0.0019100271165370941,0.4141470591227214,"{""type"":""Point"",""coordinates"":[-58.18847657,-25.117113110000002]}"
163,54063,54,9/6/2014,Iguazu,Misiones,33696-6458,8.04,otoño,2014-06-09,"[2014-06-09, 2014-06-10, 2014-06-11, 2014-06-12, 2014-06-13, 2014-06-14, 2014-06-15]",true,163,-25.86430349,-54.55489168,0.016610905528068542,289.39243443806964,Molisoles,-0.0023182202130556107,0.45819536844889325,"{""type"":""Point"",""coordinates"":[-54.55489168,-25.864303490000005]}"
164,06638,6,21/5/2014,Pilar,Buenos Aires,34357-5904,12.77,otoño,2014-05-19,"[2014-05-19, 2014-05-20, 2014-05-21, 2014-05-22, 2014-05-23, 2014-05-24, 2014-05-25]",true,164,-34.42200558,-58.95283788,3.0159950256347656E-5,285.4324200948079,Molisoles,-9.168088436126709E-4,0.4255485534667969,"{""type"":""Point"",""coordinates"":[-58.95283788,-34.42200558]}"
165,06714,6,21/5/2014,Salto,Buenos Aires,31982-6397,17.53,otoño,2014-05-19,"[2014-05-19, 2014-05-20, 2014-05-21, 2014-05-22, 2014-05-23, 2014-05-24, 2014-05-25]",false,165,-34.1554316,-60.4724629,8.314847946166992E-6,285.4100405375163,Molisoles,-6.278138607740402E-4,0.42527516682942706,"{""type"":""Point"",""coordinates"":[-60.472462900000004,-34.1554316]}"
166,06497,6,21/5/2014,Lujan,Buenos Aires,7-7,7.25,otoño,2014-05-19,"[2014-05-19, 2014-05-20, 2014-05-21, 2014-05-22, 2014-05-23, 2014-05-24, 2014-05-25]",true,166,-34.4619848,-59.1744878,2.12937593460083E-5,285.2623354593913,Complejo indiferenci,-8.917711675167084E-4,0.4358336130777995,"{""type"":""Point"",""coordinates"":[-59.1744878,-34.4619848]}"
167,06658,6,16/9/2013,Quilmes,Buenos Aires,35407-6950,4.25,invierno,2013-09-16,"[2013-09-16, 2013-09-17, 2013-09-18, 2013-09-19, 2013-09-20, 2013-09-21, 2013-09-22]",true,167,-34.70037841,-58.27664278,,,Miscelaneas,,,"{""type"":""Point"",""coordinates"":[-58.276642779999996,-34.70037841]}"
168,26077,26,7/4/2014,Rawson,Chubut,6380-1985,11.08,otoño,2014-04-07,"[2014-04-07, 2014-04-08, 2014-04-09, 2014-04-10, 2014-04-11, 2014-04-12, 2014-04-13]",true,168,-43.31555403,-65.3717721,8.314847946166992E-6,287.5740388234456,Aridisoles,-3.417693078517914E-4,0.362457275390625,"{""type"":""Point"",""coordinates"":[-65.3717721,-43.31555403]}"
169,26007,26,7/4/2014,Biedma,Chubut,32798-6301,46.39,otoño,2014-04-07,"[2014-04-07, 2014-04-08, 2014-04-09, 2014-04-10, 2014-04-11, 2014-04-12, 2014-04-13]",false,169,-42.32925797,-65.63134766,4.1566789150238037E-4,287.225731531779,Aridisoles,-4.791039973497391E-4,0.2963714599609375,"{""type"":""Point"",""coordinates"":[-65.63134766,-42.32925797]}"
170,26077,26,7/4/2014,Rawson,Chubut,6380-1985,11.08,otoño,2014-04-07,"[2014-04-07, 2014-04-08, 2014-04-09, 2014-04-10, 2014-04-11, 2014-04-12, 2014-04-13]",true,170,-43.31555403,-65.3717721,8.314847946166992E-6,287.5740388234456,Aridisoles,-3.417693078517914E-4,0.362457275390625,"{""type"":""Point"",""coordinates"":[-65.3717721,-43.31555403]}"
171,14182,14,27/2/2015,Union,Cordoba,34347-6363,19.27,verano,2015-02-23,"[2015-02-23, 2015-02-24, 2015-02-25, 2015-02-26, 2015-02-27, 2015-02-28, 2015-03-01]",false,171,-33.4792553,-62.9564065,1.7881393432617188E-6,297.08193333943683,Molisoles,-0.0039419690147042274,0.25203577677408856,"{""type"":""Point"",""coordinates"":[-62.95640650000001,-33.479255300000005]}"
172,82105,82,2/3/2015,San Jeronimo,Santa Fe,123-123,29.33,verano,2015-03-02,"[2015-03-02, 2015-03-03, 2015-03-04, 2015-03-05, 2015-03-06, 2015-03-07, 2015-03-08]",false,172,-32.2399352,-61.231266,1.3619661331176758E-5,296.9748541514079,Molisoles,-0.0033241165801882744,0.4666328430175781,"{""type"":""Point"",""coordinates"":[-61.231266,-32.2399352]}"
173,74063,74,27/2/2015,Libertador General San Martin,San Luis,36906-7261,27.91,verano,2015-02-23,"[2015-02-23, 2015-02-24, 2015-02-25, 2015-02-26, 2015-02-27, 2015-02-28, 2015-03-01]",false,173,-32.77143097,-65.76694489,1.1403858661651611E-4,291.53847630818683,Entisoles,-0.004333997145295143,0.3320484161376953,"{""type"":""Point"",""coordinates"":[-65.76694489,-32.77143097]}"
174,74007,74,27/2/2015,Ayacucho,San Luis,31950-2172,64.22,verano,2015-02-23,"[2015-02-23, 2015-02-24, 2015-02-25, 2015-02-26, 2015-02-27, 2015-02-28, 2015-03-01]",false,174,-32.13651315,-66.85445389,6.124377250671387E-6,296.25844701131183,Entisoles,-0.00454060360789299,0.13083521525065103,"{""type"":""Point"",""coordinates"":[-66.85445389,-32.13651315]}"
175,74007,74,27/2/2015,Ayacucho,San Luis,31950-2172,64.22,verano,2015-02-23,"[2015-02-23, 2015-02-24, 2015-02-25, 2015-02-26, 2015-02-27, 2015-02-28, 2015-03-01]",false,175,-32.13651315,-66.85445389,6.124377250671387E-6,296.25844701131183,Entisoles,-0.00454060360789299,0.13083521525065103,"{""type"":""Point"",""coordinates"":[-66.85445389,-32.13651315]}"
176,74007,74,27/2/2015,Ayacucho,San Luis,31950-2172,64.22,verano,2015-02-23,"[2015-02-23, 2015-02-24, 2015-02-25, 2015-02-26, 2015-02-27, 2015-02-28, 2015-03-01]",false,176,-32.13651315,-66.85445389,6.124377250671387E-6,296.25844701131183,Entisoles,-0.00454060360789299,0.13083521525065103,"{""type"":""Point"",""coordinates"":[-66.85445389,-32.13651315]}"
177,74028,74,27/2/2015,Chacabuco,San Luis,33256-6389,30.54,verano,2015-02-23,"[2015-02-23, 2015-02-24, 2015-02-25, 2015-02-26, 2015-02-27, 2015-02-28, 2015-03-01]",false,177,-32.56339762,-65.03153075,2.5331974029541016E-7,292.77773412068683,Entisoles,-0.0031638378277420998,0.31042925516764325,"{""type"":""Point"",""coordinates"":[-65.03153075,-32.56339762000001]}"
178,14126,14,17/2/2015,San Alberto,Cordoba,9461-2776,35.26,verano,2015-02-16,"[2015-02-16, 2015-02-17, 2015-02-18, 2015-02-19, 2015-02-20, 2015-02-21, 2015-02-22]",false,178,-31.79056275,-65.16710187,3.084540367126465E-6,296.4601879119873,Entisoles,-0.0036522382870316505,0.2687549591064453,"{""type"":""Point"",""coordinates"":[-65.16710187,-31.79056275]}"
179,14007,14,17/2/2015,Calamuchita,Cordoba,36828-7231,19.43,verano,2015-02-16,"[2015-02-16, 2015-02-17, 2015-02-18, 2015-02-19, 2015-02-20, 2015-02-21, 2015-02-22]",false,179,-32.09286214,-64.56387845,6.704777479171753E-4,293.215477625529,Roca,-0.0038917986676096916,0.4188639322916667,"{""type"":""Point"",""coordinates"":[-64.56387845,-32.09286214]}"
180,14014,14,17/2/2015,Capital,Cordoba,37574-7384,24.04,verano,2015-02-16,"[2015-02-16, 2015-02-17, 2015-02-18, 2015-02-19, 2015-02-20, 2015-02-21, 2015-02-22]",false,180,-31.47878838,-64.14509583,0.009745590388774872,295.2551097869873,Miscelaneas,-0.0041305189952254295,0.41217931111653644,"{""type"":""Point"",""coordinates"":[-64.14509583,-31.478788380000008]}"
181,14021,14,17/2/2015,Colon,Cordoba,33948-6745,20.69,verano,2015-02-16,"[2015-02-16, 2015-02-17, 2015-02-18, 2015-02-19, 2015-02-20, 2015-02-21, 2015-02-22]",false,181,-31.25624481,-63.95340394,0.0012191012501716614,295.6647777557373,Miscelaneas,-0.004104655236005783,0.3997732798258464,"{""type"":""Point"",""coordinates"":[-63.953403939999994,-31.256244809999995]}"
182,14021,14,17/2/2015,Colon,Cordoba,33948-6745,20.69,verano,2015-02-16,"[2015-02-16, 2015-02-17, 2015-02-18, 2015-02-19, 2015-02-20, 2015-02-21, 2015-02-22]",false,182,-31.25624481,-63.95340394,0.0012191012501716614,295.6647777557373,Miscelaneas,-0.004104655236005783,0.3997732798258464,"{""type"":""Point"",""coordinates"":[-63.953403939999994,-31.256244809999995]}"
183,14021,14,17/2/2015,Colon,Cordoba,33948-6745,20.69,verano,2015-02-16,"[2015-02-16, 2015-02-17, 2015-02-18, 2015-02-19, 2015-02-20, 2015-02-21, 2015-02-22]",false,183,-31.25624481,-63.95340394,0.0012191012501716614,295.6647777557373,Miscelaneas,-0.004104655236005783,0.3997732798258464,"{""type"":""Point"",""coordinates"":[-63.953403939999994,-31.256244809999995]}"
184,14021,14,17/2/2015,Colon,Cordoba,33948-6745,20.69,verano,2015-02-16,"[2015-02-16, 2015-02-17, 2015-02-18, 2015-02-19, 2015-02-20, 2015-02-21, 2015-02-22]",false,184,-31.25624481,-63.95340394,0.0012191012501716614,295.6647777557373,Miscelaneas,-0.004104655236005783,0.3997732798258464,"{""type"":""Point"",""coordinates"":[-63.953403939999994,-31.256244809999995]}"
185,14021,14,17/2/2015,Colon,Cordoba,33948-6745,20.69,verano,2015-02-16,"[2015-02-16, 2015-02-17, 2015-02-18, 2015-02-19, 2015-02-20, 2015-02-21, 2015-02-22]",false,185,-31.25624481,-63.95340394,0.0012191012501716614,295.6647777557373,Miscelaneas,-0.004104655236005783,0.3997732798258464,"{""type"":""Point"",""coordinates"":[-63.953403939999994,-31.256244809999995]}"
186,14021,14,17/2/2015,Colon,Cordoba,33948-6745,20.69,verano,2015-02-16,"[2015-02-16, 2015-02-17, 2015-02-18, 2015-02-19, 2015-02-20, 2015-02-21, 2015-02-22]",false,186,-31.25624481,-63.95340394,0.0012191012501716614,295.6647777557373,Miscelaneas,-0.004104655236005783,0.3997732798258464,"{""type"":""Point"",""coordinates"":[-63.953403939999994,-31.256244809999995]}"
187,14021,14,17/2/2015,Colon,Cordoba,33948-6745,20.69,verano,2015-02-16,"[2015-02-16, 2015-02-17, 2015-02-18, 2015-02-19, 2015-02-20, 2015-02-21, 2015-02-22]",false,187,-31.25624481,-63.95340394,0.0012191012501716614,295.6647777557373,Miscelaneas,-0.004104655236005783,0.3997732798258464,"{""type"":""Point"",""coordinates"":[-63.953403939999994,-31.256244809999995]}"
188,14091,14,17/2/2015,Punilla,Cordoba,36828-7231,28.57,verano,2015-02-16,"[2015-02-16, 2015-02-17, 2015-02-18, 2015-02-19, 2015-02-20, 2015-02-21, 2015-02-22]",false,188,-31.10580063,-64.59128571,0.0017314627766609192,292.6294587453206,Molisoles,-0.0037819696590304375,0.3956133524576823,"{""type"":""Point"",""coordinates"":[-64.59128571,-31.105800630000005]}"
189,14021,14,15/2/2015,Colon,Cordoba,33948-6745,20.69,verano,2015-02-09,"[2015-02-09, 2015-02-10, 2015-02-11, 2015-02-12, 2015-02-13, 2015-02-14, 2015-02-15]",false,189,-31.25624481,-63.95340394,1.1369585990905762E-5,297.07933807373047,Miscelaneas,-0.0028686653822660446,0.3502724965413411,"{""type"":""Point"",""coordinates"":[-63.953403939999994,-31.256244809999995]}"
190,82112,82,6/4/2014,San Justo,Santa Fe,6235-1924,3,otoño,2014-03-31,"[2014-03-31, 2014-04-01, 2014-04-02, 2014-04-03, 2014-04-04, 2014-04-05, 2014-04-06]",true,190,-30.8130411,-60.3886502,2.384185791015625E-7,291.90665499369305,Molisoles,-0.00322125107049942,0.45348358154296875,"{""type"":""Point"",""coordinates"":[-60.3886502,-30.813041099999996]}"
191,82070,82,6/4/2014,Las Colonias,Santa Fe,6856-2113,19.32,otoño,2014-03-31,"[2014-03-31, 2014-04-01, 2014-04-02, 2014-04-03, 2014-04-04, 2014-04-05, 2014-04-06]",false,191,-31.6618986,-61.0112577,2.1010637283325195E-6,290.72599093119305,Molisoles,-0.0034385686740279198,0.43919944763183594,"{""type"":""Point"",""coordinates"":[-61.0112577,-31.6618986]}"
192,82021,82,6/4/2014,Castellanos,Santa Fe,36829-7232,43.75,otoño,2014-03-31,"[2014-03-31, 2014-04-01, 2014-04-02, 2014-04-03, 2014-04-04, 2014-04-05, 2014-04-06]",false,192,-31.38184929,-61.37005997,3.5762786865234375E-7,290.42089653015137,Alfisoles,-0.0035854503512382507,0.4334901173909505,"{""type"":""Point"",""coordinates"":[-61.37005997,-31.38184929000001]}"
193,14021,14,15/2/2015,Colon,Cordoba,33948-6745,20.69,verano,2015-02-09,"[2015-02-09, 2015-02-10, 2015-02-11, 2015-02-12, 2015-02-13, 2015-02-14, 2015-02-15]",false,193,-31.25624481,-63.95340394,1.1369585990905762E-5,297.07933807373047,Miscelaneas,-0.0028686653822660446,0.3502724965413411,"{""type"":""Point"",""coordinates"":[-63.953403939999994,-31.256244809999995]}"
194,14021,14,15/2/2015,Colon,Cordoba,33948-6745,20.69,verano,2015-02-09,"[2015-02-09, 2015-02-10, 2015-02-11, 2015-02-12, 2015-02-13, 2015-02-14, 2015-02-15]",false,194,-31.25624481,-63.95340394,1.1369585990905762E-5,297.07933807373047,Miscelaneas,-0.0028686653822660446,0.3502724965413411,"{""type"":""Point"",""coordinates"":[-63.953403939999994,-31.256244809999995]}"
195,14021,14,15/2/2015,Colon,Cordoba,33948-6745,20.69,verano,2015-02-09,"[2015-02-09, 2015-02-10, 2015-02-11, 2015-02-12, 2015-02-13, 2015-02-14, 2015-02-15]",false,195,-31.25624481,-63.95340394,1.1369585990905762E-5,297.07933807373047,Miscelaneas,-0.0028686653822660446,0.3502724965413411,"{""type"":""Point"",""coordinates"":[-63.953403939999994,-31.256244809999995]}"
196,14168,14,15/2/2015,Totoral,Cordoba,37559-7382,7.06,verano,2015-02-09,"[2015-02-09, 2015-02-10, 2015-02-11, 2015-02-12, 2015-02-13, 2015-02-14, 2015-02-15]",true,196,-30.81785967,-64.21185018,3.9324164390563965E-4,295.2105229695638,Entisoles,-0.0037746699526906013,0.2955633799235026,"{""type"":""Point"",""coordinates"":[-64.21185018,-30.817859669999994]}"
197,14014,14,15/2/2015,Capital,Cordoba,37574-7384,24.04,verano,2015-02-09,"[2015-02-09, 2015-02-10, 2015-02-11, 2015-02-12, 2015-02-13, 2015-02-14, 2015-02-15]",false,197,-31.47878838,-64.14509583,3.351271152496338E-5,296.34634653727215,Miscelaneas,-0.0028948085382580757,0.37422943115234375,"{""type"":""Point"",""coordinates"":[-64.14509583,-31.478788380000008]}"
198,14091,14,15/2/2015,Punilla,Cordoba,36828-7231,28.57,verano,2015-02-09,"[2015-02-09, 2015-02-10, 2015-02-11, 2015-02-12, 2015-02-13, 2015-02-14, 2015-02-15]",false,198,-31.10580063,-64.59128571,2.8640031814575195E-5,293.5630620320638,Molisoles,-0.0030725663527846336,0.3638540903727214,"{""type"":""Point"",""coordinates"":[-64.59128571,-31.105800630000005]}"
199,14021,14,15/2/2015,Colon,Cordoba,33948-6745,20.69,verano,2015-02-09,"[2015-02-09, 2015-02-10, 2015-02-11, 2015-02-12, 2015-02-13, 2015-02-14, 2015-02-15]",false,199,-31.25624481,-63.95340394,1.1369585990905762E-5,297.07933807373047,Miscelaneas,-0.0028686653822660446,0.3502724965413411,"{""type"":""Point"",""coordinates"":[-63.953403939999994,-31.256244809999995]}"
200,14021,14,15/2/2015,Colon,Cordoba,33948-6745,20.69,verano,2015-02-09,"[2015-02-09, 2015-02-10, 2015-02-11, 2015-02-12, 2015-02-13, 2015-02-14, 2015-02-15]",false,200,-31.25624481,-63.95340394,1.1369585990905762E-5,297.07933807373047,Miscelaneas,-0.0028686653822660446,0.3502724965413411,"{""type"":""Point"",""coordinates"":[-63.953403939999994,-31.256244809999995]}"
201,22014,22,25/6/2013,Bermejo,Chaco,32998-6511,18.89,invierno,2013-06-24,"[2013-06-24, 2013-06-25, 2013-06-26, 2013-06-27, 2013-06-28, 2013-06-29, 2013-06-30]",false,201,-26.92175039,-58.77874597,1.2800097465515137E-5,287.19265111287433,Rio,-0.001095438376069069,0.47362327575683594,"{""type"":""Point"",""coordinates"":[-58.77874597,-26.92175039]}"
202,18084,18,25/6/2013,Ituzaingo,Corrientes,87-87,28.3,invierno,2013-06-24,"[2013-06-24, 2013-06-25, 2013-06-26, 2013-06-27, 2013-06-28, 2013-06-29, 2013-06-30]",false,202,-27.71591449,-56.94751639,6.307661533355713E-5,287.729679107666,Alfisoles,-7.74867832660675E-4,0.42690149943033856,"{""type"":""Point"",""coordinates"":[-56.94751638999999,-27.71591449]}"
203,14091,14,15/2/2015,Punilla,Cordoba,36828-7231,28.57,verano,2015-02-09,"[2015-02-09, 2015-02-10, 2015-02-11, 2015-02-12, 2015-02-13, 2015-02-14, 2015-02-15]",false,203,-31.10580063,-64.59128571,2.8640031814575195E-5,293.5630620320638,Molisoles,-0.0030725663527846336,0.3638540903727214,"{""type"":""Point"",""coordinates"":[-64.59128571,-31.105800630000005]}"
204,22140,22,25/6/2013,San Fernando,Chaco,6254-1933,11.88,invierno,2013-06-24,"[2013-06-24, 2013-06-25, 2013-06-26, 2013-06-27, 2013-06-28, 2013-06-29, 2013-06-30]",true,204,-27.92561531,-59.31798172,1.2069940567016602E-5,286.9002520243327,Complejo indiferenci,-7.943920791149139E-4,0.3724924723307292,"{""type"":""Point"",""coordinates"":[-59.317981720000006,-27.925615310000005]}"
205,54028,54,25/6/2013,Capital,Misiones,14-14,8.07,invierno,2013-06-24,"[2013-06-24, 2013-06-25, 2013-06-26, 2013-06-27, 2013-06-28, 2013-06-29, 2013-06-30]",true,205,-27.47659493,-55.92169961,1.3081729412078857E-4,288.2095781962077,Alfisoles,-6.420128047466278E-4,0.4918829600016276,"{""type"":""Point"",""coordinates"":[-55.92169961,-27.47659493]}"
206,82049,82,5/7/2013,General Obligado,Santa Fe,32822-6509,17.99,invierno,2013-07-01,"[2013-07-01, 2013-07-02, 2013-07-03, 2013-07-04, 2013-07-05, 2013-07-06, 2013-07-07]",false,206,-28.6765561,-59.7497004,2.980232238769531E-7,284.6578203837077,Alfisoles,-0.0017548110336065292,0.41819190979003906,"{""type"":""Point"",""coordinates"":[-59.7497004,-28.676556099999996]}"
207,18021,18,25/6/2013,Capital,Corrientes,6611-2085,6.4,invierno,2013-06-24,"[2013-06-24, 2013-06-25, 2013-06-26, 2013-06-27, 2013-06-28, 2013-06-29, 2013-06-30]",true,207,-27.4064,-58.78276,5.023330450057983E-4,287.33059056599933,Rio,-0.0015352573245763779,0.3633251190185547,"{""type"":""Point"",""coordinates"":[-58.78276,-27.4064]}"
208,18042,18,25/6/2013,Empedrado,Corrientes,9551-2854,17.34,invierno,2013-06-24,"[2013-06-24, 2013-06-25, 2013-06-26, 2013-06-27, 2013-06-28, 2013-06-29, 2013-06-30]",false,208,-27.70578113,-58.68808341,2.5540590286254883E-5,287.2127520243327,Rio,-8.056219667196274E-4,0.4370950063069661,"{""type"":""Point"",""coordinates"":[-58.688083410000004,-27.70578113]}"
209,18133,18,25/6/2013,San Cosme,Corrientes,59-59,5.73,invierno,2013-06-24,"[2013-06-24, 2013-06-25, 2013-06-26, 2013-06-27, 2013-06-28, 2013-06-29, 2013-06-30]",true,209,-27.36393313,-58.66198243,0.0012469738721847534,287.30251439412433,Rio,-0.0013877544552087784,0.3136577606201172,"{""type"":""Point"",""coordinates"":[-58.66198243,-27.363933129999996]}"
210,18077,18,25/6/2013,Itati,Corrientes,17-17,41.46,invierno,2013-06-24,"[2013-06-24, 2013-06-25, 2013-06-26, 2013-06-27, 2013-06-28, 2013-06-29, 2013-06-30]",false,210,-27.35196615,-57.87393625,3.9190053939819336E-5,287.52224095662433,Entisoles,-8.453112095594406E-4,0.4632008870442708,"{""type"":""Point"",""coordinates"":[-57.87393625,-27.35196615]}"
211,18042,18,25/6/2013,Empedrado,Corrientes,9551-2854,17.34,invierno,2013-06-24,"[2013-06-24, 2013-06-25, 2013-06-26, 2013-06-27, 2013-06-28, 2013-06-29, 2013-06-30]",false,211,-27.70578113,-58.68808341,2.5540590286254883E-5,287.2127520243327,Rio,-8.056219667196274E-4,0.4370950063069661,"{""type"":""Point"",""coordinates"":[-58.688083410000004,-27.70578113]}"
212,54063,54,29/6/2013,Iguazu,Misiones,33696-6458,8.04,invierno,2013-06-24,"[2013-06-24, 2013-06-25, 2013-06-26, 2013-06-27, 2013-06-28, 2013-06-29, 2013-06-30]",true,212,-25.86430349,-54.55489168,0.019260555505752563,289.5745684305827,Molisoles,-6.94500282406807E-4,0.485775629679362,"{""type"":""Point"",""coordinates"":[-54.55489168,-25.864303490000005]}"
213,06805,6,4/3/2014,Tigre,Buenos Aires,34847-6831,1.44,verano,2014-03-03,"[2014-03-03, 2014-03-04, 2014-03-05, 2014-03-06, 2014-03-07, 2014-03-08, 2014-03-09]",true,213,-34.3277116,-58.608687,1.0219216346740723E-4,294.0541515350342,Rio,-0.0042870547622442245,0.33971405029296875,"{""type"":""Point"",""coordinates"":[-58.608687,-34.3277116]}"
214,14182,14,4/3/2014,Union,Cordoba,34347-6363,19.27,verano,2014-03-03,"[2014-03-03, 2014-03-04, 2014-03-05, 2014-03-06, 2014-03-07, 2014-03-08, 2014-03-09]",false,214,-33.4792553,-62.9564065,1.0436773300170898E-4,291.8828461964925,Molisoles,-0.0022486895322799683,0.36815325419108075,"{""type"":""Point"",""coordinates"":[-62.95640650000001,-33.479255300000005]}"
215,06658,6,13/1/2015,Quilmes,Buenos Aires,35407-6950,4.25,verano,2015-01-12,"[2015-01-12, 2015-01-13, 2015-01-14, 2015-01-15, 2015-01-16, 2015-01-17, 2015-01-18]",true,215,-34.70037841,-58.27664278,,,Miscelaneas,,,"{""type"":""Point"",""coordinates"":[-58.276642779999996,-34.70037841]}"
216,06756,6,13/1/2015,San Isidro,Buenos Aires,53-53,1.29,verano,2015-01-12,"[2015-01-12, 2015-01-13, 2015-01-14, 2015-01-15, 2015-01-16, 2015-01-17, 2015-01-18]",true,216,-34.47940181,-58.5074044,,,Rio,,,"{""type"":""Point"",""coordinates"":[-58.507404400000006,-34.47940181]}"
217,06861,6,13/1/2015,Vicente Lopez,Buenos Aires,36837-7237,3.72,verano,2015-01-12,"[2015-01-12, 2015-01-13, 2015-01-14, 2015-01-15, 2015-01-16, 2015-01-17, 2015-01-18]",true,217,-34.52591497,-58.53576394,,,Miscelaneas,,,"{""type"":""Point"",""coordinates"":[-58.53576394000001,-34.52591497]}"
218,02013,2,13/1/2015,Comuna 13,Capital Federal,54-54,3.99,verano,2015-01-12,"[2015-01-12, 2015-01-13, 2015-01-14, 2015-01-15, 2015-01-16, 2015-01-17, 2015-01-18]",true,218,-34.55488152,-58.4502891,5.751848220825195E-4,300.8962821960449,Miscelaneas,-0.004758588969707489,0.20541826883951822,"{""type"":""Point"",""coordinates"":[-58.4502891,-34.55488152]}"
219,02012,2,13/1/2015,Comuna 12,Capital Federal,54-54,3.13,verano,2015-01-12,"[2015-01-12, 2015-01-13, 2015-01-14, 2015-01-15, 2015-01-16, 2015-01-17, 2015-01-18]",true,219,-34.56062514,-58.47494475,5.830526351928711E-4,300.71496709187824,Miscelaneas,-0.0057319216430187225,0.2615782419840495,"{""type"":""Point"",""coordinates"":[-58.474944750000006,-34.560625140000006]}"
220,02012,2,13/1/2015,Comuna 12,Capital Federal,54-54,3.13,verano,2015-01-12,"[2015-01-12, 2015-01-13, 2015-01-14, 2015-01-15, 2015-01-16, 2015-01-17, 2015-01-18]",true,220,-34.56062514,-58.47494475,5.830526351928711E-4,300.71496709187824,Miscelaneas,-0.0057319216430187225,0.2615782419840495,"{""type"":""Point"",""coordinates"":[-58.474944750000006,-34.560625140000006]}"
221,18084,18,25/6/2013,Ituzaingo,Corrientes,87-87,28.3,invierno,2013-06-24,"[2013-06-24, 2013-06-25, 2013-06-26, 2013-06-27, 2013-06-28, 2013-06-29, 2013-06-30]",false,221,-27.71591449,-56.94751639,6.307661533355713E-5,287.729679107666,Alfisoles,-7.74867832660675E-4,0.42690149943033856,"{""type"":""Point"",""coordinates"":[-56.94751638999999,-27.71591449]}"
222,14007,14,13/1/2015,Calamuchita,Cordoba,36828-7231,19.43,verano,2015-01-12,"[2015-01-12, 2015-01-13, 2015-01-14, 2015-01-15, 2015-01-16, 2015-01-17, 2015-01-18]",false,222,-32.09286214,-64.56387845,2.4631619453430176E-5,297.45056279500324,Roca,-0.004517171531915665,0.27819188435872394,"{""type"":""Point"",""coordinates"":[-64.56387845,-32.09286214]}"
223,14098,14,13/1/2015,Rio Cuarto,Cordoba,34345-6361,23.14,verano,2015-01-12,"[2015-01-12, 2015-01-13, 2015-01-14, 2015-01-15, 2015-01-16, 2015-01-17, 2015-01-18]",false,223,-32.64751095,-64.22141859,2.682209014892578E-7,300.1111259460449,Complejo indiferenci,-0.002764597535133362,0.2038294474283854,"{""type"":""Point"",""coordinates"":[-64.22141859,-32.64751095]}"
224,14007,14,13/1/2015,Calamuchita,Cordoba,36828-7231,19.43,verano,2015-01-12,"[2015-01-12, 2015-01-13, 2015-01-14, 2015-01-15, 2015-01-16, 2015-01-17, 2015-01-18]",false,224,-32.09286214,-64.56387845,2.4631619453430176E-5,297.45056279500324,Roca,-0.004517171531915665,0.27819188435872394,"{""type"":""Point"",""coordinates"":[-64.56387845,-32.09286214]}"
225,14161,14,13/1/2015,Tercero Arriba,Cordoba,34345-6361,4.53,verano,2015-01-12,"[2015-01-12, 2015-01-13, 2015-01-14, 2015-01-15, 2015-01-16, 2015-01-17, 2015-01-18]",true,225,-32.25289151,-64.25143209,2.384185791015625E-7,299.4206148783366,Complejo indiferenci,-0.0028319135308265686,0.2613302866617839,"{""type"":""Point"",""coordinates"":[-64.25143209,-32.25289151]}"
226,14007,14,13/1/2015,Calamuchita,Cordoba,36828-7231,19.43,verano,2015-01-12,"[2015-01-12, 2015-01-13, 2015-01-14, 2015-01-15, 2015-01-16, 2015-01-17, 2015-01-18]",false,226,-32.09286214,-64.56387845,2.4631619453430176E-5,297.45056279500324,Roca,-0.004517171531915665,0.27819188435872394,"{""type"":""Point"",""coordinates"":[-64.56387845,-32.09286214]}"
227,14007,14,13/1/2015,Calamuchita,Cordoba,36828-7231,19.43,verano,2015-01-12,"[2015-01-12, 2015-01-13, 2015-01-14, 2015-01-15, 2015-01-16, 2015-01-17, 2015-01-18]",false,227,-32.09286214,-64.56387845,2.4631619453430176E-5,297.45056279500324,Roca,-0.004517171531915665,0.27819188435872394,"{""type"":""Point"",""coordinates"":[-64.56387845,-32.09286214]}"
228,14007,14,13/1/2015,Calamuchita,Cordoba,36828-7231,19.43,verano,2015-01-12,"[2015-01-12, 2015-01-13, 2015-01-14, 2015-01-15, 2015-01-16, 2015-01-17, 2015-01-18]",false,228,-32.09286214,-64.56387845,2.4631619453430176E-5,297.45056279500324,Roca,-0.004517171531915665,0.27819188435872394,"{""type"":""Point"",""coordinates"":[-64.56387845,-32.09286214]}"
229,14161,14,13/1/2015,Tercero Arriba,Cordoba,34345-6361,4.53,verano,2015-01-12,"[2015-01-12, 2015-01-13, 2015-01-14, 2015-01-15, 2015-01-16, 2015-01-17, 2015-01-18]",true,229,-32.25289151,-64.25143209,2.384185791015625E-7,299.4206148783366,Complejo indiferenci,-0.0028319135308265686,0.2613302866617839,"{""type"":""Point"",""coordinates"":[-64.25143209,-32.25289151]}"
230,18084,18,19/6/2013,Ituzaingo,Corrientes,87-87,28.3,otoño,2013-06-17,"[2013-06-17, 2013-06-18, 2013-06-19, 2013-06-20, 2013-06-21, 2013-06-22, 2013-06-23]",false,230,-27.71591449,-56.94751639,3.653764724731445E-5,289.8551826477051,Alfisoles,-8.889138698577881E-4,0.4267832438151042,"{""type"":""Point"",""coordinates"":[-56.94751638999999,-27.71591449]}"
231,54084,54,19/6/2013,Montecarlo,Misiones,37066-7304,6.29,otoño,2013-06-17,"[2013-06-17, 2013-06-18, 2013-06-19, 2013-06-20, 2013-06-21, 2013-06-22, 2013-06-23]",true,231,-26.75464362,-54.69924477,1.4075636863708496E-4,290.1249580383301,Molisoles,-9.117927402257919E-4,0.4922784169514974,"{""type"":""Point"",""coordinates"":[-54.69924477,-26.754643619999996]}"
232,54098,54,19/6/2013,San Ignacio,Misiones,13-13,8.32,otoño,2013-06-17,"[2013-06-17, 2013-06-18, 2013-06-19, 2013-06-20, 2013-06-21, 2013-06-22, 2013-06-23]",true,232,-27.25123207,-55.5304925,8.955597877502441E-5,290.62219111124676,Entisoles,-0.001347605139017105,0.4359626770019531,"{""type"":""Point"",""coordinates"":[-55.5304925,-27.25123207]}"
233,54063,54,19/6/2013,Iguazu,Misiones,33696-6458,8.04,otoño,2013-06-17,"[2013-06-17, 2013-06-18, 2013-06-19, 2013-06-20, 2013-06-21, 2013-06-22, 2013-06-23]",true,233,-25.86430349,-54.55489168,0.0013150572776794434,290.45666376749676,Molisoles,-0.0010157432407140732,0.4775562286376953,"{""type"":""Point"",""coordinates"":[-54.55489168,-25.864303490000005]}"
234,54084,54,19/6/2013,Montecarlo,Misiones,37066-7304,6.29,otoño,2013-06-17,"[2013-06-17, 2013-06-18, 2013-06-19, 2013-06-20, 2013-06-21, 2013-06-22, 2013-06-23]",true,234,-26.75464362,-54.69924477,1.4075636863708496E-4,290.1249580383301,Molisoles,-9.117927402257919E-4,0.4922784169514974,"{""type"":""Point"",""coordinates"":[-54.69924477,-26.754643619999996]}"
235,90084,90,22/2/2014,Capital,Tucuman,33966-6506,7.44,verano,2014-02-17,"[2014-02-17, 2014-02-18, 2014-02-19, 2014-02-20, 2014-02-21, 2014-02-22, 2014-02-23]",true,235,-26.82900979,-65.21054418,2.4782121181488037E-4,293.9179935455322,Molisoles,-0.003246709704399109,0.48952166239420575,"{""type"":""Point"",""coordinates"":[-65.21054418,-26.829009789999997]}"
236,50028,50,25/2/2014,Guaymallen,Mendoza,32300-6465,57.79,verano,2014-02-24,"[2014-02-24, 2014-02-25, 2014-02-26, 2014-02-27, 2014-02-28, 2014-03-01, 2014-03-02]",false,236,-32.92076147,-68.70711858,5.932897329330444E-5,290.20093663533527,Entisoles,-0.0019316617399454117,0.18033345540364584,"{""type"":""Point"",""coordinates"":[-68.70711858,-32.92076147000001]}"
237,70035,70,25/2/2014,Caucete,San Juan,32300-6465,40.48,verano,2014-02-24,"[2014-02-24, 2014-02-25, 2014-02-26, 2014-02-27, 2014-02-28, 2014-03-01, 2014-03-02]",false,237,-31.70272711,-68.28587359,0.001812085509300232,292.63623936971027,Entisoles,-0.0021774498745799065,0.3865528106689453,"{""type"":""Point"",""coordinates"":[-68.28587359,-31.702727109999998]}"
238,70119,70,25/2/2014,Valle Fertil,San Juan,34179-6743,71.88,verano,2014-02-24,"[2014-02-24, 2014-02-25, 2014-02-26, 2014-02-27, 2014-02-28, 2014-03-01, 2014-03-02]",false,238,-30.80415774,-67.366235,1.6835331916809082E-4,290.93409093221027,Entisoles,-0.001564348116517067,0.24177678426106772,"{""type"":""Point"",""coordinates"":[-67.366235,-30.80415774]}"
239,06658,6,6/2/2014,Quilmes,Buenos Aires,35407-6950,4.25,verano,2014-02-03,"[2014-02-03, 2014-02-04, 2014-02-05, 2014-02-06, 2014-02-07, 2014-02-08, 2014-02-09]",true,239,-34.70037841,-58.27664278,,,Miscelaneas,,,"{""type"":""Point"",""coordinates"":[-58.276642779999996,-34.70037841]}"
240,82070,82,10/2/2014,Las Colonias,Santa Fe,6856-2113,19.32,verano,2014-02-10,"[2014-02-10, 2014-02-11, 2014-02-12, 2014-02-13, 2014-02-14, 2014-02-15, 2014-02-16]",false,240,-31.6618986,-61.0112577,0.005233004689216614,298.3014106750488,Molisoles,-0.00208437442779541,0.4626808166503906,"{""type"":""Point"",""coordinates"":[-61.0112577,-31.6618986]}"
241,82063,82,10/2/2014,La Capital,Santa Fe,103-103,23.73,verano,2014-02-10,"[2014-02-10, 2014-02-11, 2014-02-12, 2014-02-13, 2014-02-14, 2014-02-15, 2014-02-16]",false,241,-31.18858147,-60.62677383,0.0014432072639465332,300.2393175760905,Molisoles,-0.004038148559629917,0.43207422892252606,"{""type"":""Point"",""coordinates"":[-60.62677383,-31.18858147]}"
242,06770,6,6/2/2014,San Pedro,Buenos Aires,33257-6395,3.79,verano,2014-02-03,"[2014-02-03, 2014-02-04, 2014-02-05, 2014-02-06, 2014-02-07, 2014-02-08, 2014-02-09]",true,242,-33.6362648,-59.7862782,0.020475149154663086,296.24410247802734,Rio,-0.002524379640817642,0.5666046142578125,"{""type"":""Point"",""coordinates"":[-59.78627819999999,-33.6362648]}"
243,06568,6,6/2/2014,Moron,Buenos Aires,33486-6512,15.92,verano,2014-02-03,"[2014-02-03, 2014-02-04, 2014-02-05, 2014-02-06, 2014-02-07, 2014-02-08, 2014-02-09]",false,243,-34.6644131,-58.64564271,0.0054069459438323975,295.50622812906903,Miscelaneas,-0.0015400629490613937,0.4556897481282552,"{""type"":""Point"",""coordinates"":[-58.645642710000004,-34.6644131]}"
244,06427,6,6/2/2014,La Matanza,Buenos Aires,33486-6512,4.98,verano,2014-02-03,"[2014-02-03, 2014-02-04, 2014-02-05, 2014-02-06, 2014-02-07, 2014-02-08, 2014-02-09]",true,244,-34.71417289,-58.50890438,0.004540726542472839,295.79374440511066,Molisoles,-0.0015113316476345062,0.46904754638671875,"{""type"":""Point"",""coordinates"":[-58.50890437999999,-34.71417289000001]}"
245,06427,6,6/2/2014,La Matanza,Buenos Aires,33486-6512,4.98,verano,2014-02-03,"[2014-02-03, 2014-02-04, 2014-02-05, 2014-02-06, 2014-02-07, 2014-02-08, 2014-02-09]",true,245,-34.71417289,-58.50890438,0.004540726542472839,295.79374440511066,Molisoles,-0.0015113316476345062,0.46904754638671875,"{""type"":""Point"",""coordinates"":[-58.50890437999999,-34.71417289000001]}"
246,06497,6,6/2/2014,Lujan,Buenos Aires,7-7,7.25,verano,2014-02-03,"[2014-02-03, 2014-02-04, 2014-02-05, 2014-02-06, 2014-02-07, 2014-02-08, 2014-02-09]",true,246,-34.4619848,-59.1744878,0.006341293454170227,295.35648854573566,Complejo indiferenci,-0.0015354305505752563,0.4699700673421224,"{""type"":""Point"",""coordinates"":[-59.1744878,-34.4619848]}"
247,06441,6,6/2/2014,La Plata,Buenos Aires,3314-1708,23.31,verano,2014-02-03,"[2014-02-03, 2014-02-04, 2014-02-05, 2014-02-06, 2014-02-07, 2014-02-08, 2014-02-09]",false,247,-35.03880607,-58.05930616,4.0605664253234863E-4,295.26379648844403,Complejo indiferenci,-0.0015798751264810562,0.4644063313802083,"{""type"":""Point"",""coordinates"":[-58.05930616,-35.03880607000001]}"
248,06638,6,6/2/2014,Pilar,Buenos Aires,34357-5904,12.77,verano,2014-02-03,"[2014-02-03, 2014-02-04, 2014-02-05, 2014-02-06, 2014-02-07, 2014-02-08, 2014-02-09]",true,248,-34.42200558,-58.95283788,0.006260007619857788,295.47001393636066,Molisoles,-0.0016446355730295181,0.46628061930338544,"{""type"":""Point"",""coordinates"":[-58.95283788,-34.42200558]}"
249,06035,6,6/2/2014,Avellaneda,Buenos Aires,35411-6952,1.59,verano,2014-02-03,"[2014-02-03, 2014-02-04, 2014-02-05, 2014-02-06, 2014-02-07, 2014-02-08, 2014-02-09]",true,249,-34.67500565,-58.31056343,,,Miscelaneas,,,"{""type"":""Point"",""coordinates"":[-58.31056343,-34.675005649999996]}"
250,06490,6,6/2/2014,Lomas de Zamora,Buenos Aires,35405-6949,5.53,verano,2014-02-03,"[2014-02-03, 2014-02-04, 2014-02-05, 2014-02-06, 2014-02-07, 2014-02-08, 2014-02-09]",true,250,-34.73790272,-58.44067537,0.004141464829444885,296.00622812906903,Miscelaneas,-0.0015574265271425247,0.4666220347086589,"{""type"":""Point"",""coordinates"":[-58.44067537000001,-34.73790272]}"
251,06028,6,6/2/2014,Almirante Brown,Buenos Aires,35405-6949,1.13,verano,2014-02-03,"[2014-02-03, 2014-02-04, 2014-02-05, 2014-02-06, 2014-02-07, 2014-02-08, 2014-02-09]",true,251,-34.80155807,-58.39146772,0.0021918118000030518,295.62219492594403,Miscelaneas,-0.0016071517020463943,0.4652868906656901,"{""type"":""Point"",""coordinates"":[-58.39146772000001,-34.80155807]}"
252,06763,6,6/2/2014,San Nicolas,Buenos Aires,6776-2114,14.58,verano,2014-02-03,"[2014-02-03, 2014-02-04, 2014-02-05, 2014-02-06, 2014-02-07, 2014-02-08, 2014-02-09]",true,252,-33.6042287,-60.4178226,0.01634514331817627,295.88545989990234,Molisoles,-0.001977385953068733,0.4883893330891927,"{""type"":""Point"",""coordinates"":[-60.417822599999994,-33.6042287]}"
253,06665,6,3/2/2014,Ramallo,Buenos Aires,3325-1719,9.81,verano,2014-02-03,"[2014-02-03, 2014-02-04, 2014-02-05, 2014-02-06, 2014-02-07, 2014-02-08, 2014-02-09]",true,253,-33.6241496,-60.0461017,0.019792407751083374,296.07076263427734,Rio,-0.002098865807056427,0.5372587839762369,"{""type"":""Point"",""coordinates"":[-60.04610170000001,-33.6241496]}"
254,82084,82,3/2/2014,Rosario,Santa Fe,118-118,22.58,verano,2014-02-03,"[2014-02-03, 2014-02-04, 2014-02-05, 2014-02-06, 2014-02-07, 2014-02-08, 2014-02-09]",false,254,-33.07901008,-60.91379957,0.006342500448226929,296.28064219156903,Alfisoles,-0.002418162301182747,0.4684244791666667,"{""type"":""Point"",""coordinates"":[-60.91379957,-33.07901008]}"
255,06623,6,28/1/2014,Pergamino,Buenos Aires,140-140,25.11,verano,2014-01-27,"[2014-01-27, 2014-01-28, 2014-01-29, 2014-01-30, 2014-01-31, 2014-02-01, 2014-02-02]",false,255,-33.5893048,-60.7727646,2.855062484741211E-5,296.2035535176595,Alfisoles,-0.003188328817486763,0.3469187418619792,"{""type"":""Point"",""coordinates"":[-60.7727646,-33.5893048]}"
256,06568,6,28/1/2014,Moron,Buenos Aires,33486-6512,15.92,verano,2014-01-27,"[2014-01-27, 2014-01-28, 2014-01-29, 2014-01-30, 2014-01-31, 2014-02-01, 2014-02-02]",false,256,-34.6644131,-58.64564271,9.59634780883789E-6,296.1627820332845,Miscelaneas,-0.004857586696743965,0.40260887145996094,"{""type"":""Point"",""coordinates"":[-58.645642710000004,-34.6644131]}"
257,06568,6,28/1/2014,Moron,Buenos Aires,33486-6512,15.92,verano,2014-01-27,"[2014-01-27, 2014-01-28, 2014-01-29, 2014-01-30, 2014-01-31, 2014-02-01, 2014-02-02]",false,257,-34.6644131,-58.64564271,9.59634780883789E-6,296.1627820332845,Miscelaneas,-0.004857586696743965,0.40260887145996094,"{""type"":""Point"",""coordinates"":[-58.645642710000004,-34.6644131]}"
258,18168,18,2/1/2015,Santo Tome,Corrientes,68-68,3.13,verano,2014-12-29,"[2014-12-29, 2014-12-30, 2014-12-31, 2015-01-01, 2015-01-02, 2015-01-03, 2015-01-04]",true,258,-28.51878167,-56.05544289,3.6719441413879395E-4,297.7571220397949,Ultisoles,-0.005761250853538513,0.4763024648030599,"{""type"":""Point"",""coordinates"":[-56.05544289,-28.518781670000006]}"
259,18049,18,2/1/2015,Esquina,Corrientes,9200-2836,11.96,verano,2014-12-29,"[2014-12-29, 2014-12-30, 2014-12-31, 2015-01-01, 2015-01-02, 2015-01-03, 2015-01-04]",true,259,-30.0784368,-59.4055912,2.6270747184753418E-5,299.0161552429199,Complejo indiferenci,-0.005384529009461403,0.3567638397216797,"{""type"":""Point"",""coordinates"":[-59.405591199999996,-30.0784368]}"
260,18035,18,2/1/2015,Curuzu Cuatia,Corrientes,9021-2832,18.94,verano,2014-12-29,"[2014-12-29, 2014-12-30, 2014-12-31, 2015-01-01, 2015-01-02, 2015-01-03, 2015-01-04]",false,260,-29.30959977,-58.51285545,1.9675493240356445E-4,298.22595342000324,Alfisoles,-0.0049505773931741714,0.47531700134277344,"{""type"":""Point"",""coordinates"":[-58.51285545,-29.30959977]}"
261,18091,18,2/1/2015,Lavalle,Corrientes,6577-2072,5.81,verano,2014-12-29,"[2014-12-29, 2014-12-30, 2014-12-31, 2015-01-01, 2015-01-02, 2015-01-03, 2015-01-04]",true,261,-28.9356733,-58.8052348,2.1180510520935059E-4,298.1347262064616,Complejo indiferenci,-0.005358144640922546,0.39545567830403644,"{""type"":""Point"",""coordinates"":[-58.8052348,-28.9356733]}"
262,54091,54,2/1/2015,Obera,Misiones,33745-6552,20.16,verano,2014-12-29,"[2014-12-29, 2014-12-30, 2014-12-31, 2015-01-01, 2015-01-02, 2015-01-03, 2015-01-04]",false,262,-27.3929091,-55.12277042,1.9262731075286865E-4,296.86193974812824,Molisoles,-0.005367361940443516,0.46290334065755206,"{""type"":""Point"",""coordinates"":[-55.12277042,-27.392909099999994]}"
263,54098,54,2/1/2015,San Ignacio,Misiones,13-13,8.32,verano,2014-12-29,"[2014-12-29, 2014-12-30, 2014-12-31, 2015-01-01, 2015-01-02, 2015-01-03, 2015-01-04]",true,263,-27.25123207,-55.5304925,2.788156270980835E-4,297.5334078470866,Entisoles,-0.004536489024758339,0.43108050028483075,"{""type"":""Point"",""coordinates"":[-55.5304925,-27.25123207]}"
264,54077,54,2/1/2015,Libertador General San Martin,Misiones,6487-2027,13.67,verano,2014-12-29,"[2014-12-29, 2014-12-30, 2014-12-31, 2015-01-01, 2015-01-02, 2015-01-03, 2015-01-04]",true,264,-26.78501255,-54.90115103,2.976059913635254E-4,297.0225028991699,Molisoles,-0.0033873235806822777,0.40773455301920575,"{""type"":""Point"",""coordinates"":[-54.90115103000001,-26.785012549999998]}"
265,54112,54,2/1/2015,San Pedro,Misiones,33720-6520,20.3,verano,2014-12-29,"[2014-12-29, 2014-12-30, 2014-12-31, 2015-01-01, 2015-01-02, 2015-01-03, 2015-01-04]",false,265,-26.50855467,-53.92302828,0.002368614077568054,295.33068974812824,Entisoles,-0.003906278870999813,0.4669698079427083,"{""type"":""Point"",""coordinates"":[-53.92302828,-26.50855467]}"
266,06357,6,20/1/2014,General Pueyrredon,Buenos Aires,3347-1742,17.47,verano,2014-01-20,"[2014-01-20, 2014-01-21, 2014-01-22, 2014-01-23, 2014-01-24, 2014-01-25, 2014-01-26]",false,266,-37.80766254,-57.62989086,3.382563591003418E-6,296.9186083475749,Molisoles,-0.0011561503633856773,0.27092615763346356,"{""type"":""Point"",""coordinates"":[-57.62989086,-37.80766254000001]}"
267,54028,54,19/12/2012,Capital,Misiones,14-14,8.07,primavera,2012-12-17,"[2012-12-17, 2012-12-18, 2012-12-19, 2012-12-20, 2012-12-21, 2012-12-22, 2012-12-23]",true,267,-27.47659493,-55.92169961,7.554888725280762E-6,301.43994585673016,Alfisoles,-0.005956470966339111,0.3879407246907552,"{""type"":""Point"",""coordinates"":[-55.92169961,-27.47659493]}"
268,06770,6,6/12/2012,San Pedro,Buenos Aires,33257-6395,3.79,primavera,2012-12-03,"[2012-12-03, 2012-12-04, 2012-12-05, 2012-12-06, 2012-12-07, 2012-12-08, 2012-12-09]",true,268,-33.6362648,-59.7862782,2.5762617588043213E-4,297.7982915242513,Rio,-0.0033980924636125565,0.42153167724609375,"{""type"":""Point"",""coordinates"":[-59.78627819999999,-33.6362648]}"
269,06371,6,6/12/2012,General San Martin,Buenos Aires,36837-7237,8.51,primavera,2012-12-03,"[2012-12-03, 2012-12-04, 2012-12-05, 2012-12-06, 2012-12-07, 2012-12-08, 2012-12-09]",true,269,-34.56734338,-58.58431125,1.2184679508209229E-4,298.76004282633465,Miscelaneas,-0.0050608012825250626,0.35175514221191406,"{""type"":""Point"",""coordinates"":[-58.58431125,-34.56734338]}"
270,02004,2,6/12/2012,Comuna 4,Capital Federal,8891-2706,2.09,primavera,2012-12-03,"[2012-12-03, 2012-12-04, 2012-12-05, 2012-12-06, 2012-12-07, 2012-12-08, 2012-12-09]",true,270,-34.64641355,-58.38427103,0.0014571547508239746,298.83133188883465,Miscelaneas,-0.004140621982514858,0.2158527374267578,"{""type"":""Point"",""coordinates"":[-58.384271029999994,-34.64641355]}"
271,02007,2,6/12/2012,Comuna 7,Capital Federal,36837-7237,7.04,primavera,2012-12-03,"[2012-12-03, 2012-12-04, 2012-12-05, 2012-12-06, 2012-12-07, 2012-12-08, 2012-12-09]",true,271,-34.63680708,-58.45826985,0.0010084211826324463,298.7882817586263,Miscelaneas,-0.004787037149071693,0.27356211344401044,"{""type"":""Point"",""coordinates"":[-58.45826984999999,-34.63680708]}"
272,02007,2,6/12/2012,Comuna 7,Capital Federal,36837-7237,7.04,primavera,2012-12-03,"[2012-12-03, 2012-12-04, 2012-12-05, 2012-12-06, 2012-12-07, 2012-12-08, 2012-12-09]",true,272,-34.63680708,-58.45826985,0.0010084211826324463,298.7882817586263,Miscelaneas,-0.004787037149071693,0.27356211344401044,"{""type"":""Point"",""coordinates"":[-58.45826984999999,-34.63680708]}"
273,02006,2,6/12/2012,Comuna 6,Capital Federal,85-85,5.9,primavera,2012-12-03,"[2012-12-03, 2012-12-04, 2012-12-05, 2012-12-06, 2012-12-07, 2012-12-08, 2012-12-09]",true,273,-34.6168255,-58.44360311,0.0014571547508239746,298.83133188883465,Miscelaneas,-0.004140621982514858,0.2158527374267578,"{""type"":""Point"",""coordinates"":[-58.44360310999999,-34.6168255]}"
274,02015,2,6/12/2012,Comuna 15,Capital Federal,36837-7237,2.81,primavera,2012-12-03,"[2012-12-03, 2012-12-04, 2012-12-05, 2012-12-06, 2012-12-07, 2012-12-08, 2012-12-09]",true,274,-34.59294425,-58.48867142,0.0010084211826324463,298.7882817586263,Miscelaneas,-0.004787037149071693,0.27356211344401044,"{""type"":""Point"",""coordinates"":[-58.48867142,-34.59294425]}"
275,02014,2,6/12/2012,Comuna 14,Capital Federal,85-85,2.68,primavera,2012-12-03,"[2012-12-03, 2012-12-04, 2012-12-05, 2012-12-06, 2012-12-07, 2012-12-08, 2012-12-09]",true,275,-34.57389998,-58.42243645,0.0014571547508239746,298.83133188883465,Miscelaneas,-0.004140621982514858,0.2158527374267578,"{""type"":""Point"",""coordinates"":[-58.42243645,-34.57389997999999]}"
276,02013,2,6/12/2012,Comuna 13,Capital Federal,54-54,3.99,primavera,2012-12-03,"[2012-12-03, 2012-12-04, 2012-12-05, 2012-12-06, 2012-12-07, 2012-12-08, 2012-12-09]",true,276,-34.55488152,-58.4502891,0.0014571547508239746,298.83133188883465,Miscelaneas,-0.004140621982514858,0.2158527374267578,"{""type"":""Point"",""coordinates"":[-58.4502891,-34.55488152]}"
277,06490,6,28/1/2014,Lomas de Zamora,Buenos Aires,35405-6949,5.53,verano,2014-01-27,"[2014-01-27, 2014-01-28, 2014-01-29, 2014-01-30, 2014-01-31, 2014-02-01, 2014-02-02]",true,277,-34.73790272,-58.44067537,7.013976573944092E-5,296.3576062520345,Miscelaneas,-0.004716137424111366,0.3765830993652344,"{""type"":""Point"",""coordinates"":[-58.44067537000001,-34.73790272]}"
