system:index,Code Departamento,Code Provincia,Date (YMD),Departamento,Provincia,codeRio,distanciaRio,elevacion_m,estacion,fecha0,fechas,hayRioCercano,idx,lat,lon,pendiente_grados,precipitation_sum,runoff_sum,temperature_2m,tipoDeSuelo,total_evaporation_sum,volumetric_soil_water_layer_1,.geo
0,54028,54,6/12/2005,Capital,Misiones,14-14,8.07,150,primavera,2005-12-05,"[2005-12-05, 2005-12-06, 2005-12-07, 2005-12-08, 2005-12-09, 2005-12-10, 2005-12-11]",true,0,-27.47659493,-55.92169961,2.79,"[34.7, 0, 0, 0, 0, 0, 0]",0.004865795373916626,297.9346555074056,Alfisoles,-0.002089269459247589,0.3829345703125,"{""type"":""Point"",""coordinates"":[-55.92169961,-27.47659493]}"
1,06098,6,9/1/1994,Berisso,Buenos Aires,3314-1708,0.7,7,verano,1994-01-03,"[1994-01-03, 1994-01-04, 1994-01-05, 1994-01-06, 1994-01-07, 1994-01-08, 1994-01-09]",true,1,-34.84587606,-57.87973336,3.58,"[0, 0, 0, 0, 0.2, 1, 0]",,,Miscelaneas,,,"{""type"":""Point"",""coordinates"":[-57.87973336,-34.84587606]}"
2,06427,6,14/11/2002,La Matanza,Buenos Aires,33486-6512,4.98,8,primavera,2002-11-11,"[2002-11-11, 2002-11-12, 2002-11-13, 2002-11-14, 2002-11-15, 2002-11-16, 2002-11-17]",true,2,-34.71417289,-58.50890438,7.28,"[1.9, 0, 0, 2.3, 0, 0, 7.5]",0.0013237148523330688,287.6846618652344,Molisoles,-0.004944538697600365,0.4578711191813151,"{""type"":""Point"",""coordinates"":[-58.50890437999999,-34.71417289000001]}"
3,50007,50,21/12/2000,Capital,Mendoza,6840-2183,42.83,771,primavera,2000-12-18,"[2000-12-18, 2000-12-19, 2000-12-20, 2000-12-21, 2000-12-22, 2000-12-23, 2000-12-24]",false,3,-32.87749385,-68.85278707,2.88,"[0.1, 0.6, 0.7, 0.3, 0, 0, 0]",2.86102294921875E-4,295.8098227183024,Entisoles,-0.0029987944290041924,0.2013117472330729,"{""type"":""Point"",""coordinates"":[-68.85278707,-32.87749385]}"
4,14063,14,20/4/2009,Marcos Juarez,Cordoba,34344-6360,15.81,117,otoño,2009-04-20,"[2009-04-20, 2009-04-21, 2009-04-22, 2009-04-23, 2009-04-24, 2009-04-25, 2009-04-26]",false,4,-32.62947464,-62.30913162,1.44,"[0, 0, 0, 0, 0, 0, 0]",3.5315752029418945E-6,288.496342976888,Molisoles,-0.0015195226296782494,0.3992970784505208,"{""type"":""Point"",""coordinates"":[-62.30913162,-32.629474640000005]}"
5,14063,14,11/5/1994,Marcos Juarez,Cordoba,34344-6360,15.81,117,otoño,1994-05-09,"[1994-05-09, 1994-05-10, 1994-05-11, 1994-05-12, 1994-05-13, 1994-05-14, 1994-05-15]",false,5,-32.62947464,-62.30913162,1.44,"[0, 0.7, 0.6, 0, 0, 0, 0]",2.9690563678741455E-4,286.6697572072347,Molisoles,-0.0016267448663711548,0.46624755859375,"{""type"":""Point"",""coordinates"":[-62.30913162,-32.629474640000005]}"
6,14021,14,23/8/1991,Colon,Cordoba,33948-6745,20.69,355,invierno,1991-08-19,"[1991-08-19, 1991-08-20, 1991-08-21, 1991-08-22, 1991-08-23, 1991-08-24, 1991-08-25]",false,6,-31.25624481,-63.95340394,0.93,"[0, 3.7, 6.1, 10.5, 0, 0.2, 14.3]",3.291666507720947E-5,288.0463473002116,Miscelaneas,-0.001361645758152008,0.27682940165201825,"{""type"":""Point"",""coordinates"":[-63.953403939999994,-31.256244809999995]}"
7,14140,14,12/4/2006,San Justo,Cordoba,6955-2119,12.54,107,otoño,2006-04-10,"[2006-04-10, 2006-04-11, 2006-04-12, 2006-04-13, 2006-04-14, 2006-04-15, 2006-04-16]",true,7,-31.23400374,-62.74066613,1.08,"[0, 0, 0, 3.5, 1.7, 0, 0]",2.339482307434082E-6,293.0799102783203,Alfisoles,-0.002428884617984295,0.36218833923339844,"{""type"":""Point"",""coordinates"":[-62.74066613,-31.234003740000002]}"
8,14140,14,28/5/1992,San Justo,Cordoba,6955-2119,12.54,107,otoño,1992-05-25,"[1992-05-25, 1992-05-26, 1992-05-27, 1992-05-28, 1992-05-29, 1992-05-30, 1992-05-31]",true,8,-31.23400374,-62.74066613,1.08,"[0, 3.2, 1.8, 0.7, 0, 0, 0]",2.9265880584716797E-5,289.3721040089925,Alfisoles,-0.0013223402202129364,0.28954633076985675,"{""type"":""Point"",""coordinates"":[-62.74066613,-31.234003740000002]}"
9,14140,14,28/6/2004,San Justo,Cordoba,6955-2119,12.54,107,invierno,2004-06-28,"[2004-06-28, 2004-06-29, 2004-06-30, 2004-07-01, 2004-07-02, 2004-07-03, 2004-07-04]",true,9,-31.23400374,-62.74066613,1.08,"[0, 0.7, 0.1, 0, 0, 0, 0]",1.3679265975952148E-5,288.5836232503255,Alfisoles,-7.775872945785522E-4,0.2635396321614583,"{""type"":""Point"",""coordinates"":[-62.74066613,-31.234003740000002]}"
10,14098,14,22/2/2008,Rio Cuarto,Cordoba,34345-6361,23.14,514,verano,2008-02-18,"[2008-02-18, 2008-02-19, 2008-02-20, 2008-02-21, 2008-02-22, 2008-02-23, 2008-02-24]",false,10,-32.64751095,-64.22141859,2.88,"[40.4, 0.7, 10, 9, 9.7, 0.2, 0.2]",0.0018525421619415283,295.49245897928876,Complejo indiferenci,-0.001271987333893776,0.32193247477213544,"{""type"":""Point"",""coordinates"":[-64.22141859,-32.64751095]}"
11,06875,6,11/11/2004,Villarino,Buenos Aires,33091-6394,29.23,25,primavera,2004-11-08,"[2004-11-08, 2004-11-09, 2004-11-10, 2004-11-11, 2004-11-12, 2004-11-13, 2004-11-14]",false,11,-39.4323988,-62.9350751,1.2,"[0.2, 2.9, 0, 0, 0, 6.2, 0]",7.897615432739258E-7,293.8878943125407,Molisoles,-0.0018964912742376328,0.06526819864908855,"{""type"":""Point"",""coordinates"":[-62.935075100000006,-39.4323988]}"
12,82042,82,28/10/2015,General Lopez,Santa Fe,6725-2212,8.61,121,primavera,2015-10-26,"[2015-10-26, 2015-10-27, 2015-10-28, 2015-10-29, 2015-10-30, 2015-10-31, 2015-11-01]",true,12,-34.17471073,-62.05032677,3.84,"[0, 0.3, 6.1, 39.8, 0, 0, 0]",3.069639205932617E-6,289.8850631713867,Molisoles,-0.0020633377134799957,0.27904001871744794,"{""type"":""Point"",""coordinates"":[-62.05032677,-34.17471073]}"
13,06357,6,14/9/1996,General Pueyrredon,Buenos Aires,3347-1742,17.47,21,invierno,1996-09-09,"[1996-09-09, 1996-09-10, 1996-09-11, 1996-09-12, 1996-09-13, 1996-09-14, 1996-09-15]",false,13,-37.80766254,-57.62989086,5.55,"[0.4, 0, 0, 0, 0, 0.1, 13.1]",6.645917892456055E-6,280.62456766764325,Molisoles,-0.002209056168794632,0.4459349314371745,"{""type"":""Point"",""coordinates"":[-57.62989086,-37.80766254000001]}"
14,82105,82,2/7/2011,San Jeronimo,Santa Fe,123-123,29.33,42,invierno,2011-06-27,"[2011-06-27, 2011-06-28, 2011-06-29, 2011-06-30, 2011-07-01, 2011-07-02, 2011-07-03]",false,14,-32.2399352,-61.231266,4.95,"[0, 0, 0, 0, 0, 0, 0]",1.341104507446289E-7,278.02099990844727,Molisoles,-0.001161813735961914,0.4412771860758464,"{""type"":""Point"",""coordinates"":[-61.231266,-32.2399352]}"
15,82133,82,3/11/2003,Vera,Santa Fe,3041-1094,9.46,59,primavera,2003-11-03,"[2003-11-03, 2003-11-04, 2003-11-05, 2003-11-06, 2003-11-07, 2003-11-08, 2003-11-09]",true,15,-29.72572798,-60.28951287,2.33,"[0, 0, 0, 0, 0, 0.4, 19.4]",2.532750368118286E-4,289.4060688018799,Lagunas,-0.004283979535102844,0.3678404490152995,"{""type"":""Point"",""coordinates"":[-60.28951287,-29.72572798]}"
16,82049,82,25/7/2000,General Obligado,Santa Fe,32822-6509,17.99,58,invierno,2000-07-24,"[2000-07-24, 2000-07-25, 2000-07-26, 2000-07-27, 2000-07-28, 2000-07-29, 2000-07-30]",false,16,-28.6765561,-59.7497004,1.41,"[0, 0, 0, 0, 0, 0, 0]",7.074624300003052E-4,282.940336227417,Alfisoles,-0.002084433101117611,0.4122740427652995,"{""type"":""Point"",""coordinates"":[-59.7497004,-28.676556099999996]}"
17,22140,22,1/10/1993,San Fernando,Chaco,6254-1933,11.88,54,primavera,1993-09-27,"[1993-09-27, 1993-09-28, 1993-09-29, 1993-09-30, 1993-10-01, 1993-10-02, 1993-10-03]",true,17,-27.92561531,-59.31798172,2.97,"[0, 0, 6.5, 7.8, 3.4, 5, 12]",2.4700164794921875E-4,288.53279813130695,Complejo indiferenci,-0.003764689899981022,0.32599131266276044,"{""type"":""Point"",""coordinates"":[-59.317981720000006,-27.925615310000005]}"
18,22014,22,6/11/1998,Bermejo,Chaco,32998-6511,18.89,65,primavera,1998-11-02,"[1998-11-02, 1998-11-03, 1998-11-04, 1998-11-05, 1998-11-06, 1998-11-07, 1998-11-08]",false,18,-26.92175039,-58.77874597,2.28,"[0.6, 0.9, 0, 0, 0, 21, 0]",0.0011081397533416748,294.1586284637451,Rio,-0.004920433275401592,0.3608570098876953,"{""type"":""Point"",""coordinates"":[-58.77874597,-26.92175039]}"
19,22140,22,28/3/1991,San Fernando,Chaco,6254-1933,11.88,54,otoño,1991-03-25,"[1991-03-25, 1991-03-26, 1991-03-27, 1991-03-28, 1991-03-29, 1991-03-30, 1991-03-31]",true,19,-27.92561531,-59.31798172,2.97,"[0, 0, 0, 0, 0, 0, 0]",1.0651350021362305E-4,300.2734495798747,Complejo indiferenci,-0.00458117201924324,0.2927430470784505,"{""type"":""Point"",""coordinates"":[-59.317981720000006,-27.925615310000005]}"
20,18077,18,21/8/1996,Itati,Corrientes,17-17,41.46,69,invierno,1996-08-19,"[1996-08-19, 1996-08-20, 1996-08-21, 1996-08-22, 1996-08-23, 1996-08-24, 1996-08-25]",false,20,-27.35196615,-57.87393625,1.04,"[0, 1.5, 0.2, 1.4, 0, 0, 2]",4.931837320327759E-4,295.45932642618817,Entisoles,-0.003466285765171051,0.3822593688964844,"{""type"":""Point"",""coordinates"":[-57.87393625,-27.35196615]}"
21,18133,18,3/5/2008,San Cosme,Corrientes,59-59,5.73,52,otoño,2008-04-28,"[2008-04-28, 2008-04-29, 2008-04-30, 2008-05-01, 2008-05-02, 2008-05-03, 2008-05-04]",true,21,-27.36393313,-58.66198243,0.93,"[4, 0.2, 0.2, 3.7, 0, 0, 0]",2.1480023860931396E-4,297.98924763997394,Rio,-0.0021928753703832626,0.3044109344482422,"{""type"":""Point"",""coordinates"":[-58.66198243,-27.363933129999996]}"
22,18049,18,22/8/1998,Esquina,Corrientes,9200-2836,11.96,43,invierno,1998-08-17,"[1998-08-17, 1998-08-18, 1998-08-19, 1998-08-20, 1998-08-21, 1998-08-22, 1998-08-23]",true,22,-30.0784368,-59.4055912,1.42,"[1.1, 0, 0, 0, 0, 4.1, 5.2]",0.0012643635272979736,290.6152038574219,Complejo indiferenci,-9.517865255475044E-4,0.3387285868326823,"{""type"":""Point"",""coordinates"":[-59.405591199999996,-30.0784368]}"
23,18070,18,1/1/1991,Goya,Corrientes,6624-2091,11.86,59,verano,1990-12-31,"[1990-12-31, 1991-01-01, 1991-01-02, 1991-01-03, 1991-01-04, 1991-01-05, 1991-01-06]",true,23,-29.1751244,-58.88982054,2.14,"[0, 3.2, 17.9, 0.9, 0, 0, 0]",8.188635110855103E-4,298.3941249847412,Rio,-0.006397591903805733,0.2709941864013672,"{""type"":""Point"",""coordinates"":[-58.889820540000024,-29.1751244]}"
24,18091,18,23/8/1999,Lavalle,Corrientes,6577-2072,5.81,66,invierno,1999-08-23,"[1999-08-23, 1999-08-24, 1999-08-25, 1999-08-26, 1999-08-27, 1999-08-28, 1999-08-29]",true,24,-28.9356733,-58.8052348,0.93,"[3.6, 1.1, 8, 0, 0, 0, 0]",3.361552953720093E-4,290.5945129394531,Complejo indiferenci,-0.0014090817421674728,0.3598785400390625,"{""type"":""Point"",""coordinates"":[-58.8052348,-28.9356733]}"
25,18021,18,3/7/2003,Capital,Corrientes,6611-2085,6.4,45,invierno,2003-06-30,"[2003-06-30, 2003-07-01, 2003-07-02, 2003-07-03, 2003-07-04, 2003-07-05, 2003-07-06]",true,25,-27.4064,-58.78276,12.77,"[0, 0, 0, 0, 0, 0.9, 0]",7.854998111724854E-4,294.2227776845296,Rio,-0.002279641106724739,0.27823321024576825,"{""type"":""Point"",""coordinates"":[-58.78276,-27.4064]}"
26,82049,82,23/10/1990,General Obligado,Santa Fe,32822-6509,17.99,58,primavera,1990-10-22,"[1990-10-22, 1990-10-23, 1990-10-24, 1990-10-25, 1990-10-26, 1990-10-27, 1990-10-28]",false,26,-28.6765561,-59.7497004,1.41,"[0, 1.3, 1.7, 3, 6.6, 0.7, 18.4]",8.746981620788574E-6,295.5698935190837,Alfisoles,-0.004707875661551952,0.31914647420247394,"{""type"":""Point"",""coordinates"":[-59.7497004,-28.676556099999996]}"
27,82063,82,14/9/2004,La Capital,Santa Fe,103-103,23.73,25,invierno,2004-09-13,"[2004-09-13, 2004-09-14, 2004-09-15, 2004-09-16, 2004-09-17, 2004-09-18, 2004-09-19]",false,27,-31.18858147,-60.62677383,2.15,"[0, 0, 0, 0, 0, 0, 0]",1.1995434761047363E-5,285.28971036275226,Molisoles,-0.0023714248090982437,0.3816064198811849,"{""type"":""Point"",""coordinates"":[-60.62677383,-31.18858147]}"
28,18021,18,12/8/2010,Capital,Corrientes,6611-2085,6.4,45,invierno,2010-08-09,"[2010-08-09, 2010-08-10, 2010-08-11, 2010-08-12, 2010-08-13, 2010-08-14, 2010-08-15]",true,28,-27.4064,-58.78276,12.77,"[0, 0, 0, 0, 0, 0, 0]",0.0015014111995697021,284.74657948811847,Rio,-0.002322303131222725,0.29474639892578125,"{""type"":""Point"",""coordinates"":[-58.78276,-27.4064]}"
29,22014,22,14/8/2014,Bermejo,Chaco,32998-6511,18.89,65,invierno,2014-08-11,"[2014-08-11, 2014-08-12, 2014-08-13, 2014-08-14, 2014-08-15, 2014-08-16, 2014-08-17]",false,29,-26.92175039,-58.77874597,2.28,"[0, 0, 0, 0, 4.8, 0, 0]",4.8607587814331055E-5,292.85682423909503,Rio,-0.002084258943796158,0.4172191619873047,"{""type"":""Point"",""coordinates"":[-58.77874597,-26.92175039]}"
30,30028,30,16/3/2008,Federacion,Entre Rios,1385-1073,7.52,49,verano,2008-03-10,"[2008-03-10, 2008-03-11, 2008-03-12, 2008-03-13, 2008-03-14, 2008-03-15, 2008-03-16]",true,30,-30.70681007,-57.88784914,1.85,"[0, 0, 0, 0, 0, 0, 0]",2.5241076946258545E-4,297.4974835713704,Molisoles,-0.004215676337480545,0.13830057779947916,"{""type"":""Point"",""coordinates"":[-57.88784913999999,-30.70681007]}"
31,30028,30,21/12/2013,Federacion,Entre Rios,1385-1073,7.52,49,primavera,2013-12-16,"[2013-12-16, 2013-12-17, 2013-12-18, 2013-12-19, 2013-12-20, 2013-12-21, 2013-12-22]",true,31,-30.70681007,-57.88784914,1.85,"[0, 0, 0, 0, 0.3, 0, 0]",0.0025257468223571777,302.1259600321452,Molisoles,-0.005867312662303448,0.066131591796875,"{""type"":""Point"",""coordinates"":[-57.88784913999999,-30.70681007]}"
32,30008,30,22/4/1996,Colon,Entre Rios,32026-6403,25.96,31,otoño,1996-04-22,"[1996-04-22, 1996-04-23, 1996-04-24, 1996-04-25, 1996-04-26, 1996-04-27, 1996-04-28]",false,32,-31.70735861,-58.28660961,1.43,"[1.3, 4.2, 68.7, 0, 0.3, 0, 12.2]",1.583993434906006E-5,292.77889251708984,Entisoles,-0.0017539234831929207,0.418118158976237,"{""type"":""Point"",""coordinates"":[-58.28660961,-31.70735861]}"
33,30098,30,18/4/2011,Uruguay,Entre Rios,7061-2233,5.89,21,otoño,2011-04-18,"[2011-04-18, 2011-04-19, 2011-04-20, 2011-04-21, 2011-04-22, 2011-04-23, 2011-04-24]",true,33,-32.38095474,-58.23688127,0,"[0, 0, 54.5, 0, 1, 0, 0]",6.781518459320068E-5,287.63232803344727,Entisoles,-0.0032574674114584923,0.22454134623209634,"{""type"":""Point"",""coordinates"":[-58.23688127,-32.38095474000001]}"
34,34049,34,3/1/2008,Pilcomayo,Formosa,36840-7239,50.93,78,verano,2007-12-31,"[2007-12-31, 2008-01-01, 2008-01-02, 2008-01-03, 2008-01-04, 2008-01-05, 2008-01-06]",false,34,-25.11711311,-58.18847657,0,"[14.2, 3.1, 0.7, 0.5, 13.5, 0.4, 0]",6.976276636123657E-4,298.9601313273112,Rio,-0.004239077679812908,0.46663538614908856,"{""type"":""Point"",""coordinates"":[-58.18847657,-25.117113110000002]}"
35,30015,30,7/12/2002,Concordia,Entre Rios,6557-2063,4.51,37,primavera,2002-12-02,"[2002-12-02, 2002-12-03, 2002-12-04, 2002-12-05, 2002-12-06, 2002-12-07, 2002-12-08]",true,35,-31.35230446,-58.05355072,6.42,"[0, 7.6, 14.4, 38, 0.6, 0.6, 0]",0.0025885701179504395,293.239054997762,Vertisoles,-0.005526291206479073,0.23661931355794272,"{""type"":""Point"",""coordinates"":[-58.05355072,-31.352304459999996]}"
36,30070,30,27/4/1990,La Paz,Entre Rios,6543-2055,11.16,36,otoño,1990-04-23,"[1990-04-23, 1990-04-24, 1990-04-25, 1990-04-26, 1990-04-27, 1990-04-28, 1990-04-29]",true,36,-30.60360412,-59.52751986,4.26,"[1.5, 8.6, 3.8, 2.6, 0, 0, 0]",5.549192428588867E-5,293.05241839090985,Molisoles,-8.147889748215675E-4,0.4760589599609375,"{""type"":""Point"",""coordinates"":[-59.52751986,-30.60360412]}"
37,30008,30,8/3/2008,Colon,Entre Rios,32026-6403,25.96,31,verano,2008-03-03,"[2008-03-03, 2008-03-04, 2008-03-05, 2008-03-06, 2008-03-07, 2008-03-08, 2008-03-09]",false,37,-31.70735861,-58.28660961,1.43,"[6.6, 4.9, 0, 0, 0, 0.8, 0.3]",4.8995018005371094E-5,294.8380762736003,Entisoles,-0.003375754691660404,0.4659461975097656,"{""type"":""Point"",""coordinates"":[-58.28660961,-31.70735861]}"
38,30098,30,28/10/2009,Uruguay,Entre Rios,7061-2233,5.89,21,primavera,2009-10-26,"[2009-10-26, 2009-10-27, 2009-10-28, 2009-10-29, 2009-10-30, 2009-10-31, 2009-11-01]",true,38,-32.38095474,-58.23688127,0,"[0, 0, 0, 0, 0.5, 0, 0.3]",5.856156349182129E-5,289.7058334350586,Entisoles,-0.005133096128702164,0.1515045166015625,"{""type"":""Point"",""coordinates"":[-58.23688127,-32.38095474000001]}"
39,30015,30,3/9/2001,Concordia,Entre Rios,6557-2063,4.51,37,invierno,2001-09-03,"[2001-09-03, 2001-09-04, 2001-09-05, 2001-09-06, 2001-09-07, 2001-09-08, 2001-09-09]",true,39,-31.35230446,-58.05355072,6.42,"[3.1, 0.3, 0, 0.4, 10.5, 0, 0.9]",0.0020443201065063477,288.10058339436847,Vertisoles,-8.859653025865555E-4,0.29457855224609375,"{""type"":""Point"",""coordinates"":[-58.05355072,-31.352304459999996]}"
40,18119,18,22/5/1996,Paso de los Libres,Corrientes,1383-1063,15.85,57,otoño,1996-05-20,"[1996-05-20, 1996-05-21, 1996-05-22, 1996-05-23, 1996-05-24, 1996-05-25, 1996-05-26]",false,40,-29.87793885,-57.53288465,1.42,"[0, 0, 1.1, 0, 0, 0.9, 0]",0.0013586580753326416,285.6301034291585,Molisoles,-0.0021139662712812424,0.4056529998779297,"{""type"":""Point"",""coordinates"":[-57.53288465,-29.877938850000003]}"
41,18168,18,5/1/1995,Santo Tome,Corrientes,68-68,3.13,96,verano,1995-01-02,"[1995-01-02, 1995-01-03, 1995-01-04, 1995-01-05, 1995-01-06, 1995-01-07, 1995-01-08]",true,41,-28.51878167,-56.05544289,2.13,"[1.6, 3.4, 4.8, 5.2, 0, 0, 0.4]",5.126446485519409E-4,301.04993693033856,Ultisoles,-0.004900604486465454,0.3776238759358724,"{""type"":""Point"",""coordinates"":[-56.05544289,-28.518781670000006]}"
42,18049,18,22/7/1994,Esquina,Corrientes,9200-2836,11.96,43,invierno,1994-07-18,"[1994-07-18, 1994-07-19, 1994-07-20, 1994-07-21, 1994-07-22, 1994-07-23, 1994-07-24]",true,42,-30.0784368,-59.4055912,1.42,"[0, 0, 0, 1, 3.5, 0, 0]",3.412365913391113E-5,293.7208302815755,Complejo indiferenci,-0.0016657309606671333,0.2519982655843099,"{""type"":""Point"",""coordinates"":[-59.405591199999996,-30.0784368]}"
43,18070,18,6/7/2002,Goya,Corrientes,6624-2091,11.86,59,invierno,2002-07-01,"[2002-07-01, 2002-07-02, 2002-07-03, 2002-07-04, 2002-07-05, 2002-07-06, 2002-07-07]",true,43,-29.1751244,-58.88982054,2.14,"[16.1, 4.4, 9.3, 22.5, 13.8, 15.5, 0]",0.0014196932315826416,284.4640464782715,Rio,-9.312592446804047E-4,0.3557516733805339,"{""type"":""Point"",""coordinates"":[-58.889820540000024,-29.1751244]}"
44,18133,18,12/8/1995,San Cosme,Corrientes,59-59,5.73,52,invierno,1995-08-07,"[1995-08-07, 1995-08-08, 1995-08-09, 1995-08-10, 1995-08-11, 1995-08-12, 1995-08-13]",true,44,-27.36393313,-58.66198243,0.93,"[2.4, 0.8, 3.2, 0, 26.2, 21.3, 0]",4.600435495376587E-4,288.37707328796387,Rio,-0.0011075837537646294,0.3117014567057292,"{""type"":""Point"",""coordinates"":[-58.66198243,-27.363933129999996]}"
45,18077,18,28/7/1993,Itati,Corrientes,17-17,41.46,69,invierno,1993-07-26,"[1993-07-26, 1993-07-27, 1993-07-28, 1993-07-29, 1993-07-30, 1993-07-31, 1993-08-01]",false,45,-27.35196615,-57.87393625,1.04,"[1.2, 0, 22.7, 4.8, 0, 0, 0]",3.6332011222839355E-4,286.4536526997884,Entisoles,-0.001861603930592537,0.409060796101888,"{""type"":""Point"",""coordinates"":[-57.87393625,-27.35196615]}"
46,18084,18,12/3/1996,Ituzaingo,Corrientes,87-87,28.3,78,verano,1996-03-11,"[1996-03-11, 1996-03-12, 1996-03-13, 1996-03-14, 1996-03-15, 1996-03-16, 1996-03-17]",false,46,-27.71591449,-56.94751639,6.26,"[22, 0, 7.8, 2.2, 1.2, 1.3, 0]",8.392333984375E-4,298.6725279490153,Alfisoles,-0.0036405082792043686,0.37600962320963544,"{""type"":""Point"",""coordinates"":[-56.94751638999999,-27.71591449]}"
47,18084,18,11/1/2003,Ituzaingo,Corrientes,87-87,28.3,78,verano,2003-01-06,"[2003-01-06, 2003-01-07, 2003-01-08, 2003-01-09, 2003-01-10, 2003-01-11, 2003-01-12]",false,47,-27.71591449,-56.94751639,6.26,"[0, 0, 0, 0, 31.2, 4, 0]",0.0016448497772216797,300.73284975687665,Alfisoles,-0.006439207121729851,0.3354810078938802,"{""type"":""Point"",""coordinates"":[-56.94751638999999,-27.71591449]}"
48,22014,22,14/11/1996,Bermejo,Chaco,32998-6511,18.89,65,primavera,1996-11-11,"[1996-11-11, 1996-11-12, 1996-11-13, 1996-11-14, 1996-11-15, 1996-11-16, 1996-11-17]",false,48,-26.92175039,-58.77874597,2.28,"[0, 0.2, 1.9, 6.1, 6, 1, 0]",5.520284175872803E-4,293.93901952107746,Rio,-0.005500786006450653,0.4563299814860026,"{""type"":""Point"",""coordinates"":[-58.77874597,-26.92175039]}"
49,22140,22,8/2/2003,San Fernando,Chaco,6254-1933,11.88,54,verano,2003-02-03,"[2003-02-03, 2003-02-04, 2003-02-05, 2003-02-06, 2003-02-07, 2003-02-08, 2003-02-09]",true,49,-27.92561531,-59.31798172,2.97,"[0, 0, 0, 0.8, 3.1, 35.4, 19.7]",7.567852735519409E-4,304.14320309956867,Complejo indiferenci,-0.006241165101528168,0.16362571716308594,"{""type"":""Point"",""coordinates"":[-59.317981720000006,-27.925615310000005]}"
50,22140,22,16/5/2007,San Fernando,Chaco,6254-1933,11.88,54,otoño,2007-05-14,"[2007-05-14, 2007-05-15, 2007-05-16, 2007-05-17, 2007-05-18, 2007-05-19, 2007-05-20]",true,50,-27.92561531,-59.31798172,2.97,"[0, 1.8, 11.5, 0, 0, 0, 0]",1.1712312698364258E-5,288.3675734202067,Complejo indiferenci,-0.002190394327044487,0.3292077382405599,"{""type"":""Point"",""coordinates"":[-59.317981720000006,-27.925615310000005]}"
51,18133,18,17/1/1991,San Cosme,Corrientes,59-59,5.73,52,verano,1991-01-14,"[1991-01-14, 1991-01-15, 1991-01-16, 1991-01-17, 1991-01-18, 1991-01-19, 1991-01-20]",true,51,-27.36393313,-58.66198243,0.93,"[0, 0, 0, 0, 0, 0, 0]",9.511560201644897E-4,298.5180257161458,Rio,-0.005551913753151894,0.12822659810384116,"{""type"":""Point"",""coordinates"":[-58.66198243,-27.363933129999996]}"
52,18077,18,28/1/1998,Itati,Corrientes,17-17,41.46,69,verano,1998-01-26,"[1998-01-26, 1998-01-27, 1998-01-28, 1998-01-29, 1998-01-30, 1998-01-31, 1998-02-01]",false,52,-27.35196615,-57.87393625,1.04,"[8.9, 0, 8.9, 8.7, 3.1, 12.7, 9.3]",0.004982560873031616,301.982182820638,Entisoles,-0.004232729785144329,0.46027882893880206,"{""type"":""Point"",""coordinates"":[-57.87393625,-27.35196615]}"
53,18084,18,21/8/1996,Ituzaingo,Corrientes,87-87,28.3,78,invierno,1996-08-19,"[1996-08-19, 1996-08-20, 1996-08-21, 1996-08-22, 1996-08-23, 1996-08-24, 1996-08-25]",false,53,-27.71591449,-56.94751639,6.26,"[0, 0.4, 1.5, 0, 0, 0, 2.7]",1.226663589477539E-4,294.8561363220215,Alfisoles,-0.0037240684032440186,0.3798472086588542,"{""type"":""Point"",""coordinates"":[-56.94751638999999,-27.71591449]}"
54,18084,18,24/10/2008,Ituzaingo,Corrientes,87-87,28.3,78,primavera,2008-10-20,"[2008-10-20, 2008-10-21, 2008-10-22, 2008-10-23, 2008-10-24, 2008-10-25, 2008-10-26]",false,54,-27.71591449,-56.94751639,6.26,"[0, 0.3, 77.4, 38.6, 0.5, 9.9, 20.8]",5.821883678436279E-5,295.7831751505534,Alfisoles,-0.0046780165284872055,0.3967946370442708,"{""type"":""Point"",""coordinates"":[-56.94751638999999,-27.71591449]}"
55,22140,22,2/12/1991,San Fernando,Chaco,6254-1933,11.88,54,primavera,1991-12-02,"[1991-12-02, 1991-12-03, 1991-12-04, 1991-12-05, 1991-12-06, 1991-12-07, 1991-12-08]",true,55,-27.92561531,-59.31798172,2.97,"[0, 0, 0, 0.6, 10.6, 0.1, 0]",3.4017860889434814E-4,297.07654062906903,Complejo indiferenci,-0.006332938559353352,0.3321005503336589,"{""type"":""Point"",""coordinates"":[-59.317981720000006,-27.925615310000005]}"
56,22140,22,13/10/2000,San Fernando,Chaco,6254-1933,11.88,54,primavera,2000-10-09,"[2000-10-09, 2000-10-10, 2000-10-11, 2000-10-12, 2000-10-13, 2000-10-14, 2000-10-15]",true,56,-27.92561531,-59.31798172,2.97,"[11.6, 0, 0, 3.8, 8.5, 17.3, 1.2]",5.303323268890381E-4,296.4629484812419,Complejo indiferenci,-0.003730461001396179,0.2671318054199219,"{""type"":""Point"",""coordinates"":[-59.317981720000006,-27.925615310000005]}"
57,22126,22,8/10/2010,1 de Mayo,Chaco,32633-6454,13.09,57,primavera,2010-10-04,"[2010-10-04, 2010-10-05, 2010-10-06, 2010-10-07, 2010-10-08, 2010-10-09, 2010-10-10]",true,57,-27.22855035,-58.90405078,1.85,"[0, 0, 60.8, 0.7, 0, 0, 0]",3.4123659133911133E-6,289.56358973185223,Molisoles,-0.004038435406982899,0.3514823913574219,"{""type"":""Point"",""coordinates"":[-58.904050780000006,-27.22855035]}"
58,90084,90,5/11/1993,Capital,Tucuman,33966-6506,7.44,453,primavera,1993-11-01,"[1993-11-01, 1993-11-02, 1993-11-03, 1993-11-04, 1993-11-05, 1993-11-06, 1993-11-07]",true,58,-26.82900979,-65.21054418,6.28,"[0, 0, 0, 0, 0.1, 0, 0]",2.081543207168579E-4,292.26037406921387,Molisoles,-0.004242276772856712,0.4663003285725911,"{""type"":""Point"",""coordinates"":[-65.21054418,-26.829009789999997]}"
59,06658,6,27/5/2006,Quilmes,Buenos Aires,35407-6950,4.25,3,otoño,2006-05-22,"[2006-05-22, 2006-05-23, 2006-05-24, 2006-05-25, 2006-05-26, 2006-05-27, 2006-05-28]",true,59,-34.70037841,-58.27664278,2.17,"[0, 0, 0, 0, 0.3, 0.5, 0]",,,Miscelaneas,,,"{""type"":""Point"",""coordinates"":[-58.276642779999996,-34.70037841]}"
60,06490,6,6/6/2015,Lomas de Zamora,Buenos Aires,35405-6949,5.53,9,otoño,2015-06-01,"[2015-06-01, 2015-06-02, 2015-06-03, 2015-06-04, 2015-06-05, 2015-06-06, 2015-06-07]",true,60,-34.73790272,-58.44067537,3,"[0, 0, 0, 0, 0, 4.6, 0]",1.1740624904632568E-4,288.0781167348226,Miscelaneas,-9.946897625923157E-4,0.3076629638671875,"{""type"":""Point"",""coordinates"":[-58.44067537000001,-34.73790272]}"
61,06490,6,20/5/2002,Lomas de Zamora,Buenos Aires,35405-6949,5.53,9,otoño,2002-05-20,"[2002-05-20, 2002-05-21, 2002-05-22, 2002-05-23, 2002-05-24, 2002-05-25, 2002-05-26]",true,61,-34.73790272,-58.44067537,3,"[0, 0, 0, 0, 0, 0, 6.3]",0.0012519359588623047,284.76536242167157,Miscelaneas,-0.001303981989622116,0.4427286783854167,"{""type"":""Point"",""coordinates"":[-58.44067537000001,-34.73790272]}"
62,06035,6,21/5/2014,Avellaneda,Buenos Aires,35411-6952,1.59,6,otoño,2014-05-19,"[2014-05-19, 2014-05-20, 2014-05-21, 2014-05-22, 2014-05-23, 2014-05-24, 2014-05-25]",true,62,-34.67500565,-58.31056343,3.38,"[0.5, 15, 31.1, 0, 0, 0, 0]",,,Miscelaneas,,,"{""type"":""Point"",""coordinates"":[-58.31056343,-34.675005649999996]}"
63,06035,6,26/11/2004,Avellaneda,Buenos Aires,35411-6952,1.59,6,primavera,2004-11-22,"[2004-11-22, 2004-11-23, 2004-11-24, 2004-11-25, 2004-11-26, 2004-11-27, 2004-11-28]",true,63,-34.67500565,-58.31056343,3.38,"[0, 0.6, 15.7, 1, 0, 4.5, 0]",,,Miscelaneas,,,"{""type"":""Point"",""coordinates"":[-58.31056343,-34.675005649999996]}"
64,06035,6,3/12/2008,Avellaneda,Buenos Aires,35411-6952,1.59,6,primavera,2008-12-01,"[2008-12-01, 2008-12-02, 2008-12-03, 2008-12-04, 2008-12-05, 2008-12-06, 2008-12-07]",true,64,-34.67500565,-58.31056343,3.38,"[0.5, 0.9, 0, 0, 0, 0, 0]",,,Miscelaneas,,,"{""type"":""Point"",""coordinates"":[-58.31056343,-34.675005649999996]}"
65,06035,6,7/11/2002,Avellaneda,Buenos Aires,35411-6952,1.59,6,primavera,2002-11-04,"[2002-11-04, 2002-11-05, 2002-11-06, 2002-11-07, 2002-11-08, 2002-11-09, 2002-11-10]",true,65,-34.67500565,-58.31056343,3.38,"[0, 0, 0, 0, 12.2, 5.8, 3.9]",,,Miscelaneas,,,"{""type"":""Point"",""coordinates"":[-58.31056343,-34.675005649999996]}"
66,06434,6,9/3/1997,Lanus,Buenos Aires,8891-2706,4.6,5,verano,1997-03-03,"[1997-03-03, 1997-03-04, 1997-03-05, 1997-03-06, 1997-03-07, 1997-03-08, 1997-03-09]",true,66,-34.69095715,-58.38386285,4.6,"[0.5, 0, 0, 0, 0, 0.3, 0]",6.629526615142822E-5,293.9420083363851,Miscelaneas,-9.630527347326279E-4,0.1561915079752604,"{""type"":""Point"",""coordinates"":[-58.38386285000001,-34.69095715000001]}"
67,06343,6,20/6/1998,General Paz,Buenos Aires,3274-1695,33.67,18,otoño,1998-06-15,"[1998-06-15, 1998-06-16, 1998-06-17, 1998-06-18, 1998-06-19, 1998-06-20, 1998-06-21]",false,67,-35.45190573,-58.26954177,2.78,"[2.7, 0, 0, 0, 0, 0, 0]",5.9098005294799805E-5,285.80478795369464,Complejo indiferenci,-4.571862518787384E-4,0.46097373962402344,"{""type"":""Point"",""coordinates"":[-58.26954176999999,-35.45190573]}"
68,06357,6,28/1/1998,General Pueyrredon,Buenos Aires,3347-1742,17.47,21,verano,1998-01-26,"[1998-01-26, 1998-01-27, 1998-01-28, 1998-01-29, 1998-01-30, 1998-01-31, 1998-02-01]",false,68,-37.80766254,-57.62989086,5.55,"[0.1, 37.4, 0, 0, 0, 0.3, 0]",7.808208465576172E-6,295.400639851888,Molisoles,-0.0030084066092967987,0.32950083414713544,"{""type"":""Point"",""coordinates"":[-57.62989086,-37.80766254000001]}"
69,06630,6,27/11/2013,Pila,Buenos Aires,6766-2227,28.56,12,primavera,2013-11-25,"[2013-11-25, 2013-11-26, 2013-11-27, 2013-11-28, 2013-11-29, 2013-11-30, 2013-12-01]",false,69,-36.09760675,-58.09855871,3.6,"[32.7, 0.8, 14.4, 0, 0, 0.1, 0.3]",0.0020531564950942993,293.8244736989339,Molisoles,-0.0012847399339079857,0.3718878428141276,"{""type"":""Point"",""coordinates"":[-58.09855871,-36.09760674999999]}"
70,06812,6,18/12/2014,Tordillo,Buenos Aires,3309-1703,53.41,3,primavera,2014-12-15,"[2014-12-15, 2014-12-16, 2014-12-17, 2014-12-18, 2014-12-19, 2014-12-20, 2014-12-21]",false,70,-36.4708183,-57.1914178,0.93,"[0.6, 0, 2.7, 0, 0.2, 26.6, 0.6]",3.904104232788086E-6,291.8935324350993,Lagunas,-0.0034983959048986435,0.3056163787841797,"{""type"":""Point"",""coordinates"":[-57.1914178,-36.4708183]}"
71,06693,6,6/9/2004,Roque Perez,Buenos Aires,9022-2838,10.28,44,invierno,2004-09-06,"[2004-09-06, 2004-09-07, 2004-09-08, 2004-09-09, 2004-09-10, 2004-09-11, 2004-09-12]",true,71,-35.41999054,-59.66501618,4.4,"[0.3, 0.1, 0, 0, 0, 0, 0]",6.32554292678833E-5,287.86822001139325,Complejo indiferenci,-0.0017681606113910675,0.38751983642578125,"{""type"":""Point"",""coordinates"":[-59.665016179999995,-35.41999054]}"
72,06343,6,15/11/2009,General Paz,Buenos Aires,3274-1695,33.67,18,primavera,2009-11-09,"[2009-11-09, 2009-11-10, 2009-11-11, 2009-11-12, 2009-11-13, 2009-11-14, 2009-11-15]",false,72,-35.45190573,-58.26954177,2.78,"[0, 0, 0, 0, 12, 0, 0]",2.205371856689453E-6,290.7714900970459,Complejo indiferenci,-0.0040334854274988174,0.35913340250651044,"{""type"":""Point"",""coordinates"":[-58.26954176999999,-35.45190573]}"
73,06301,6,12/3/1996,General Belgrano,Buenos Aires,9552-2855,9.08,23,verano,1996-03-11,"[1996-03-11, 1996-03-12, 1996-03-13, 1996-03-14, 1996-03-15, 1996-03-16, 1996-03-17]",true,73,-35.83441,-58.47736003,1.47,"[2.7, 3.4, 0, 0.6, 0.9, 3.7, 0]",2.321600914001465E-5,297.35888862609863,Complejo indiferenci,-0.001194322481751442,0.2815430959065755,"{""type"":""Point"",""coordinates"":[-58.47736003000001,-35.83440999999999]}"
74,06658,6,10/9/1998,Quilmes,Buenos Aires,35407-6950,4.25,3,invierno,1998-09-07,"[1998-09-07, 1998-09-08, 1998-09-09, 1998-09-10, 1998-09-11, 1998-09-12, 1998-09-13]",true,74,-34.70037841,-58.27664278,2.17,"[0, 0, 0, 0, 0, 0, 0]",,,Miscelaneas,,,"{""type"":""Point"",""coordinates"":[-58.276642779999996,-34.70037841]}"
75,06483,6,20/3/1990,Lobos,Buenos Aires,146-146,24.21,32,verano,1990-03-19,"[1990-03-19, 1990-03-20, 1990-03-21, 1990-03-22, 1990-03-23, 1990-03-24, 1990-03-25]",false,75,-35.2649767,-59.0698098,1.47,"[0, 0, 0, 0, 18.2, 0.5, 0.3]",2.9802322387695312E-6,291.2789707183838,Molisoles,-0.002675725147128105,0.39203453063964844,"{""type"":""Point"",""coordinates"":[-59.06980980000001,-35.264976700000005]}"
76,06574,6,4/8/1996,Navarro,Buenos Aires,150-150,22.27,43,invierno,1996-07-29,"[1996-07-29, 1996-07-30, 1996-07-31, 1996-08-01, 1996-08-02, 1996-08-03, 1996-08-04]",false,76,-35.0117915,-59.4247779,3.87,"[0, 0, 0, 0, 0, 14.9, 21.8]",4.231929779052734E-6,285.6633815765381,Molisoles,-0.001561574637889862,0.39987945556640625,"{""type"":""Point"",""coordinates"":[-59.42477790000001,-35.0117915]}"
77,06658,6,3/10/1998,Quilmes,Buenos Aires,35407-6950,4.25,3,primavera,1998-09-28,"[1998-09-28, 1998-09-29, 1998-09-30, 1998-10-01, 1998-10-02, 1998-10-03, 1998-10-04]",true,77,-34.70037841,-58.27664278,2.17,"[0, 0, 0, 0, 0, 0.3, 6.8]",,,Miscelaneas,,,"{""type"":""Point"",""coordinates"":[-58.276642779999996,-34.70037841]}"
78,82014,82,20/2/2015,Caseros,Santa Fe,6726-2218,16.67,107,verano,2015-02-16,"[2015-02-16, 2015-02-17, 2015-02-18, 2015-02-19, 2015-02-20, 2015-02-21, 2015-02-22]",false,78,-33.2334798,-61.682947,0,"[0.2, 0.1, 12.5, 0, 0, 0.5, 0]",4.403293132781982E-6,297.162499109904,Alfisoles,-0.00395459309220314,0.36179860432942706,"{""type"":""Point"",""coordinates"":[-61.682947000000006,-33.23347979999999]}"
79,82014,82,22/2/2002,Caseros,Santa Fe,6726-2218,16.67,107,verano,2002-02-18,"[2002-02-18, 2002-02-19, 2002-02-20, 2002-02-21, 2002-02-22, 2002-02-23, 2002-02-24]",false,79,-33.2334798,-61.682947,0,"[0.3, 0.1, 2.3, 0.6, 0, 5.5, 0]",8.934736251831055E-5,294.0733165740967,Alfisoles,-0.001945515163242817,0.2743701934814453,"{""type"":""Point"",""coordinates"":[-61.682947000000006,-33.23347979999999]}"
80,82084,82,10/11/2014,Rosario,Santa Fe,118-118,22.58,64,primavera,2014-11-10,"[2014-11-10, 2014-11-11, 2014-11-12, 2014-11-13, 2014-11-14, 2014-11-15, 2014-11-16]",false,80,-33.07901008,-60.91379957,1.11,"[0.2, 7.9, 2.3, 0, 0, 0, 0]",5.125999450683594E-6,296.34141731262207,Alfisoles,-0.002907327376306057,0.37178293863932294,"{""type"":""Point"",""coordinates"":[-60.91379957,-33.07901008]}"
81,06539,6,7/2/2007,Merlo,Buenos Aires,33486-6512,18.44,32,verano,2007-02-05,"[2007-02-05, 2007-02-06, 2007-02-07, 2007-02-08, 2007-02-09, 2007-02-10, 2007-02-11]",false,81,-34.70854224,-58.67958673,3.7,"[4.4, 2.9, 0, 0, 0, 0.1, 0]",2.6553869247436523E-5,297.54403368632,Complejo indiferenci,-0.002376629039645195,0.3080329895019531,"{""type"":""Point"",""coordinates"":[-58.67958673,-34.70854223999999]}"
82,06427,6,15/3/2000,La Matanza,Buenos Aires,33486-6512,4.98,8,verano,2000-03-13,"[2000-03-13, 2000-03-14, 2000-03-15, 2000-03-16, 2000-03-17, 2000-03-18, 2000-03-19]",true,82,-34.71417289,-58.50890438,7.28,"[0, 0, 0, 1.1, 0, 0, 0]",9.642541408538818E-5,295.8390115102132,Molisoles,-7.23397359251976E-4,0.16417249043782553,"{""type"":""Point"",""coordinates"":[-58.50890437999999,-34.71417289000001]}"
83,06532,6,21/12/1992,Mercedes,Buenos Aires,7-7,20.35,37,verano,1992-12-21,"[1992-12-21, 1992-12-22, 1992-12-23, 1992-12-24, 1992-12-25, 1992-12-26, 1992-12-27]",false,83,-34.64501572,-59.35927582,3.5,"[0.3, 13.2, 23.2, 0, 0, 0, 0]",8.063018321990967E-5,295.967825571696,Molisoles,-0.004371139220893383,0.3004709879557292,"{""type"":""Point"",""coordinates"":[-59.35927582,-34.64501572]}"
84,06658,6,25/2/1995,Quilmes,Buenos Aires,35407-6950,4.25,3,verano,1995-02-20,"[1995-02-20, 1995-02-21, 1995-02-22, 1995-02-23, 1995-02-24, 1995-02-25, 1995-02-26]",true,84,-34.70037841,-58.27664278,2.17,"[0, 1.4, 11.1, 0.4, 5.4, 0, 0]",,,Miscelaneas,,,"{""type"":""Point"",""coordinates"":[-58.276642779999996,-34.70037841]}"
85,06714,6,20/6/2015,Salto,Buenos Aires,31982-6397,17.53,69,otoño,2015-06-15,"[2015-06-15, 2015-06-16, 2015-06-17, 2015-06-18, 2015-06-19, 2015-06-20, 2015-06-21]",false,85,-34.1554316,-60.4724629,0,"[0, 0, 0, 0, 0, 0, 0]",9.34302806854248E-6,282.83738899230957,Molisoles,-0.001014750450849533,0.3469397226969401,"{""type"":""Point"",""coordinates"":[-60.472462900000004,-34.1554316]}"
86,06497,6,6/5/2001,Lujan,Buenos Aires,7-7,7.25,39,otoño,2001-04-30,"[2001-04-30, 2001-05-01, 2001-05-02, 2001-05-03, 2001-05-04, 2001-05-05, 2001-05-06]",true,86,-34.4619848,-59.1744878,0.93,"[7.9, 2.9, 0, 0, 0, 0, 0]",1.6641616821289062E-4,284.9551658630371,Complejo indiferenci,-9.048487991094589E-4,0.4146302541097005,"{""type"":""Point"",""coordinates"":[-59.1744878,-34.4619848]}"
87,06126,6,19/9/1997,Campana,Buenos Aires,26206-5876,0.02,4,invierno,1997-09-15,"[1997-09-15, 1997-09-16, 1997-09-17, 1997-09-18, 1997-09-19, 1997-09-20, 1997-09-21]",true,87,-34.059934,-58.836065,2.91,"[0, 0, 0, 0, 0.6, 2.5, 0]",0.0,285.4764124552409,Rio,-0.003107614815235138,0.48566563924153644,"{""type"":""Point"",""coordinates"":[-58.836065000000005,-34.059934]}"
88,06638,6,28/1/2003,Pilar,Buenos Aires,34357-5904,12.77,16,verano,2003-01-27,"[2003-01-27, 2003-01-28, 2003-01-29, 2003-01-30, 2003-01-31, 2003-02-01, 2003-02-02]",true,88,-34.42200558,-58.95283788,1.46,"[0, 0.1, 1.6, 0, 0.4, 18.4, 5.2]",2.5710463523864746E-4,298.9119052886963,Molisoles,-0.005194630473852158,0.3119589487711589,"{""type"":""Point"",""coordinates"":[-58.95283788,-34.42200558]}"
89,06490,6,10/2/2007,Lomas de Zamora,Buenos Aires,35405-6949,5.53,9,verano,2007-02-05,"[2007-02-05, 2007-02-06, 2007-02-07, 2007-02-08, 2007-02-09, 2007-02-10, 2007-02-11]",true,89,-34.73790272,-58.44067537,3,"[3.9, 3.4, 0, 0, 0, 0.1, 0.3]",6.788969039916992E-5,297.8195056915283,Miscelaneas,-0.0020685363560914993,0.1865990956624349,"{""type"":""Point"",""coordinates"":[-58.44067537000001,-34.73790272]}"
90,06658,6,14/2/2015,Quilmes,Buenos Aires,35407-6950,4.25,3,verano,2015-02-09,"[2015-02-09, 2015-02-10, 2015-02-11, 2015-02-12, 2015-02-13, 2015-02-14, 2015-02-15]",true,90,-34.70037841,-58.27664278,2.17,"[0.2, 3.2, 0, 1, 0, 0, 0]",,,Miscelaneas,,,"{""type"":""Point"",""coordinates"":[-58.276642779999996,-34.70037841]}"
91,06098,6,19/1/2015,Berisso,Buenos Aires,3314-1708,0.7,7,verano,2015-01-19,"[2015-01-19, 2015-01-20, 2015-01-21, 2015-01-22, 2015-01-23, 2015-01-24, 2015-01-25]",true,91,-34.84587606,-57.87973336,3.58,"[9.9, 0, 0, 0, 0, 0, 0]",,,Miscelaneas,,,"{""type"":""Point"",""coordinates"":[-57.87973336,-34.84587606]}"
92,06497,6,5/2/2006,Lujan,Buenos Aires,7-7,7.25,39,verano,2006-01-30,"[2006-01-30, 2006-01-31, 2006-02-01, 2006-02-02, 2006-02-03, 2006-02-04, 2006-02-05]",true,92,-34.4619848,-59.1744878,0.93,"[0.7, 0, 16.4, 0.6, 0.7, 31.5, 0]",1.3500452041625977E-5,296.4108606974284,Complejo indiferenci,-0.004255082458257675,0.3181419372558594,"{""type"":""Point"",""coordinates"":[-59.1744878,-34.4619848]}"
93,06882,6,10/8/2008,Zarate,Buenos Aires,3320-1714,3.88,28,invierno,2008-08-04,"[2008-08-04, 2008-08-05, 2008-08-06, 2008-08-07, 2008-08-08, 2008-08-09, 2008-08-10]",true,93,-33.9804188,-59.2846864,2.42,"[0, 0, 0, 0, 0, 0, 0]",6.094574928283691E-6,282.8638623555501,Rio,-5.926154553890228E-4,0.4513556162516276,"{""type"":""Point"",""coordinates"":[-59.2846864,-33.9804188]}"
94,06735,6,15/1/2007,San Antonio de Areco,Buenos Aires,6906-2215,2.81,39,verano,2007-01-15,"[2007-01-15, 2007-01-16, 2007-01-17, 2007-01-18, 2007-01-19, 2007-01-20, 2007-01-21]",true,94,-34.2881384,-59.5070413,1.46,"[0, 0, 0, 0.4, 0, 0, 0]",1.7881393432617188E-6,294.13073984781903,Molisoles,-0.003536730073392391,0.30269432067871094,"{""type"":""Point"",""coordinates"":[-59.5070413,-34.2881384]}"
95,06638,6,11/1/2014,Pilar,Buenos Aires,34357-5904,12.77,16,verano,2014-01-06,"[2014-01-06, 2014-01-07, 2014-01-08, 2014-01-09, 2014-01-10, 2014-01-11, 2014-01-12]",true,95,-34.42200558,-58.95283788,1.46,"[0, 16.3, 0, 0, 7.6, 0, 0]",1.6763806343078613E-6,300.3570963541667,Molisoles,-0.005350727587938309,0.3249549865722656,"{""type"":""Point"",""coordinates"":[-58.95283788,-34.42200558]}"
96,06490,6,25/6/1992,Lomas de Zamora,Buenos Aires,35405-6949,5.53,9,invierno,1992-06-22,"[1992-06-22, 1992-06-23, 1992-06-24, 1992-06-25, 1992-06-26, 1992-06-27, 1992-06-28]",true,96,-34.73790272,-58.44067537,3,"[21.9, 0.1, 13.5, 13, 10.1, 0, 0.3]",0.0038091838359832764,284.6984411875407,Miscelaneas,-6.322991102933884E-4,0.4744427998860677,"{""type"":""Point"",""coordinates"":[-58.44067537000001,-34.73790272]}"
97,06245,6,16/10/1990,Ensenada,Buenos Aires,3314-1708,6.45,8,primavera,1990-10-15,"[1990-10-15, 1990-10-16, 1990-10-17, 1990-10-18, 1990-10-19, 1990-10-20, 1990-10-21]",true,97,-34.87584856,-57.9336299,5.71,"[0, 0, 0, 0, 0.9, 0.4, 0]",2.491474151611328E-5,287.87466367085773,Miscelaneas,-0.004493825137615204,0.40063730875651044,"{""type"":""Point"",""coordinates"":[-57.9336299,-34.875848559999994]}"
98,06749,6,8/11/2012,San Fernando,Buenos Aires,34847-6831,5.62,5,primavera,2012-11-05,"[2012-11-05, 2012-11-06, 2012-11-07, 2012-11-08, 2012-11-09, 2012-11-10, 2012-11-11]",true,98,-34.2256455,-58.5931568,3.84,"[0, 0, 0, 0, 20.9, 1.2, 3.5]",7.897615432739258E-7,296.6551907857259,Rio,-0.005731577053666115,0.4750836690266927,"{""type"":""Point"",""coordinates"":[-58.5931568,-34.2256455]}"
99,06749,6,8/2/1992,San Fernando,Buenos Aires,34847-6831,5.62,5,verano,1992-02-03,"[1992-02-03, 1992-02-04, 1992-02-05, 1992-02-06, 1992-02-07, 1992-02-08, 1992-02-09]",true,99,-34.2256455,-58.5931568,3.84,"[0, 0, 0, 0, 0, 0, 28.1]",2.130866050720215E-6,297.65142186482746,Rio,-0.004535624757409096,0.4470996856689453,"{""type"":""Point"",""coordinates"":[-58.5931568,-34.2256455]}"
100,06658,6,2/9/1998,Quilmes,Buenos Aires,35407-6950,4.25,3,invierno,1998-08-31,"[1998-08-31, 1998-09-01, 1998-09-02, 1998-09-03, 1998-09-04, 1998-09-05, 1998-09-06]",true,100,-34.70037841,-58.27664278,2.17,"[0, 1, 7.5, 0, 0, 0, 0]",,,Miscelaneas,,,"{""type"":""Point"",""coordinates"":[-58.276642779999996,-34.70037841]}"
101,06196,6,20/8/1997,Coronel Pringles,Buenos Aires,36845-7243,88.06,183,invierno,1997-08-18,"[1997-08-18, 1997-08-19, 1997-08-20, 1997-08-21, 1997-08-22, 1997-08-23, 1997-08-24]",false,101,-37.9951979,-60.8897785,1.5,"[0.1, 0, 0.2, 0, 0, 0, 0]",5.036592483520508E-6,282.52062861124676,Molisoles,-6.747562438249588E-4,0.37827618916829425,"{""type"":""Point"",""coordinates"":[-60.889778500000006,-37.9951979]}"
102,06112,6,1/1/1997,Bragado,Buenos Aires,6954-2111,27.83,62,verano,1996-12-30,"[1996-12-30, 1996-12-31, 1997-01-01, 1997-01-02, 1997-01-03, 1997-01-04, 1997-01-05]",false,102,-35.2410531,-60.3474272,1.47,"[0, 26.4, 0, 0, 0.7, 0, 0]",1.4573335647583008E-5,297.4308153788249,Molisoles,-0.006299466826021671,0.27840296427408856,"{""type"":""Point"",""coordinates"":[-60.3474272,-35.24105310000001]}"
103,06497,6,23/2/1998,Lujan,Buenos Aires,7-7,7.25,39,verano,1998-02-23,"[1998-02-23, 1998-02-24, 1998-02-25, 1998-02-26, 1998-02-27, 1998-02-28, 1998-03-01]",true,103,-34.4619848,-59.1744878,0.93,"[1, 0, 0, 0, 0, 0, 0]",1.2546777725219727E-5,292.213326772054,Complejo indiferenci,-0.0031701885163784027,0.41756248474121094,"{""type"":""Point"",""coordinates"":[-59.1744878,-34.4619848]}"
104,62021,62,25/10/2014,Bariloche,Rio Negro,6953-2144,0.07,408,primavera,2014-10-20,"[2014-10-20, 2014-10-21, 2014-10-22, 2014-10-23, 2014-10-24, 2014-10-25, 2014-10-26]",true,104,-41.89814608,-71.50316469,2.66,"[12.7, 1.3, 0.4, 0, 0, 0, 0]",0.0064298659563064575,279.7030652364095,Inceptisoles,-0.0014259489253163338,0.47889455159505206,"{""type"":""Point"",""coordinates"":[-71.50316469000002,-41.898146080000004]}"
105,14161,14,19/7/1996,Tercero Arriba,Cordoba,34345-6361,4.53,473,invierno,1996-07-15,"[1996-07-15, 1996-07-16, 1996-07-17, 1996-07-18, 1996-07-19, 1996-07-20, 1996-07-21]",true,105,-32.25289151,-64.25143209,2.87,"[0, 0, 0, 0, 0, 0, 0]",2.3096799850463867E-6,278.07214101155597,Complejo indiferenci,-5.645425990223885E-4,0.22196324666341147,"{""type"":""Point"",""coordinates"":[-64.25143209,-32.25289151]}"
106,14091,14,5/3/2002,Punilla,Cordoba,36828-7231,28.57,1223,verano,2002-03-04,"[2002-03-04, 2002-03-05, 2002-03-06, 2002-03-07, 2002-03-08, 2002-03-09, 2002-03-10]",false,106,-31.10580063,-64.59128571,2.98,"[3.5, 5.5, 0.1, 2.9, 3.1, 8.6, 16.2]",1.663118600845337E-4,294.47929191589355,Molisoles,-0.0025031287223100662,0.3392346700032552,"{""type"":""Point"",""coordinates"":[-64.59128571,-31.105800630000005]}"
107,30042,30,25/10/2003,Feliciano,Entre Rios,36832-7234,6.85,64,primavera,2003-10-20,"[2003-10-20, 2003-10-21, 2003-10-22, 2003-10-23, 2003-10-24, 2003-10-25, 2003-10-26]",true,107,-30.42934153,-58.76618814,2.84,"[8.1, 0.1, 0, 0, 0, 6.7, 0.4]",4.3126940727233887E-4,292.90589396158856,Molisoles,-0.003171331249177456,0.35580889383951825,"{""type"":""Point"",""coordinates"":[-58.766188140000004,-30.42934153]}"
108,30028,30,8/11/2008,Federacion,Entre Rios,1385-1073,7.52,49,primavera,2008-11-03,"[2008-11-03, 2008-11-04, 2008-11-05, 2008-11-06, 2008-11-07, 2008-11-08, 2008-11-09]",true,108,-30.70681007,-57.88784914,1.85,"[0, 0, 0.1, 17.7, 0, 0, 0]",7.366389036178589E-4,294.2076021830241,Molisoles,-0.004551524296402931,0.1639258066813151,"{""type"":""Point"",""coordinates"":[-57.88784913999999,-30.70681007]}"
109,30028,30,11/5/1997,Federacion,Entre Rios,1385-1073,7.52,49,otoño,1997-05-05,"[1997-05-05, 1997-05-06, 1997-05-07, 1997-05-08, 1997-05-09, 1997-05-10, 1997-05-11]",true,109,-30.70681007,-57.88784914,1.85,"[0, 0, 0, 0, 0, 0, 0]",3.2557547092437744E-4,291.2575174967448,Molisoles,-0.0021830573678016663,0.10393778483072917,"{""type"":""Point"",""coordinates"":[-57.88784913999999,-30.70681007]}"
110,30035,30,17/1/2015,Federal,Entre Rios,36958-7272,25.83,66,verano,2015-01-12,"[2015-01-12, 2015-01-13, 2015-01-14, 2015-01-15, 2015-01-16, 2015-01-17, 2015-01-18]",false,110,-30.97193714,-58.99327599,2.16,"[0, 0.7, 54.2, 2.1, 0.4, 0.5, 0.7]",3.25128436088562E-4,299.1951103210449,Vertisoles,-0.005783658474683762,0.4214038848876953,"{""type"":""Point"",""coordinates"":[-58.99327599,-30.971937140000005]}"
111,06581,6,3/7/2002,Necochea,Buenos Aires,32742-6427,63.08,124,invierno,2002-07-01,"[2002-07-01, 2002-07-02, 2002-07-03, 2002-07-04, 2002-07-05, 2002-07-06, 2002-07-07]",false,111,-38.085516,-59.2924177,1.5,"[0.5, 13.8, 0, 0, 0.1, 0, 0]",3.1441450119018555E-6,276.6233075459798,Molisoles,-6.431806832551956E-4,0.2944800059000651,"{""type"":""Point"",""coordinates"":[-59.2924177,-38.085516000000005]}"
112,82063,82,16/9/2001,La Capital,Santa Fe,103-103,23.73,25,invierno,2001-09-10,"[2001-09-10, 2001-09-11, 2001-09-12, 2001-09-13, 2001-09-14, 2001-09-15, 2001-09-16]",false,112,-31.18858147,-60.62677383,2.15,"[0, 0, 0, 1.9, 0, 0, 0]",4.9427151679992676E-5,286.7735818227132,Molisoles,-0.0031627435237169266,0.4488302866617839,"{""type"":""Point"",""coordinates"":[-60.62677383,-31.18858147]}"
113,82063,82,6/1/2014,La Capital,Santa Fe,103-103,23.73,25,verano,2014-01-06,"[2014-01-06, 2014-01-07, 2014-01-08, 2014-01-09, 2014-01-10, 2014-01-11, 2014-01-12]",false,113,-31.18858147,-60.62677383,2.15,"[0.1, 1.3, 0.4, 0, 2.1, 0, 0]",2.168118953704834E-6,300.933349609375,Molisoles,-0.005708693526685238,0.353909174601237,"{""type"":""Point"",""coordinates"":[-60.62677383,-31.18858147]}"
114,34014,34,18/11/2009,Formosa,Formosa,34001-6658,9.62,61,primavera,2009-11-16,"[2009-11-16, 2009-11-17, 2009-11-18, 2009-11-19, 2009-11-20, 2009-11-21, 2009-11-22]",true,114,-25.73826408,-57.92005921,3.22,"[0, 0.2, 0, 0, 16.8, 0, 0]",1.8458068370819092E-4,298.72013092041016,Rio,-0.004744112491607666,0.4022668202718099,"{""type"":""Point"",""coordinates"":[-57.920059210000005,-25.73826408]}"
115,82063,82,7/9/2003,La Capital,Santa Fe,103-103,23.73,25,invierno,2003-09-01,"[2003-09-01, 2003-09-02, 2003-09-03, 2003-09-04, 2003-09-05, 2003-09-06, 2003-09-07]",false,115,-31.18858147,-60.62677383,2.15,"[0, 0, 0.4, 19.8, 0, 0, 19.7]",6.210952997207642E-4,286.3057683308919,Molisoles,-0.002381330356001854,0.3804931640625,"{""type"":""Point"",""coordinates"":[-60.62677383,-31.18858147]}"
116,06441,6,24/7/2011,La Plata,Buenos Aires,3314-1708,23.31,26,invierno,2011-07-18,"[2011-07-18, 2011-07-19, 2011-07-20, 2011-07-21, 2011-07-22, 2011-07-23, 2011-07-24]",false,116,-35.03880607,-58.05930616,0.93,"[11.6, 13, 0, 0, 0, 0, 0]",9.353458881378174E-5,283.68506622314453,Complejo indiferenci,-0.0011753728613257408,0.43308448791503906,"{""type"":""Point"",""coordinates"":[-58.05930616,-35.03880607000001]}"
117,22140,22,2/6/2003,San Fernando,Chaco,6254-1933,11.88,54,otoño,2003-06-02,"[2003-06-02, 2003-06-03, 2003-06-04, 2003-06-05, 2003-06-06, 2003-06-07, 2003-06-08]",true,117,-27.92561531,-59.31798172,2.97,"[24.2, 0.3, 0, 0, 0, 0, 0]",0.001330554485321045,296.93821907043457,Complejo indiferenci,-0.0023557404056191444,0.35898907979329425,"{""type"":""Point"",""coordinates"":[-59.317981720000006,-27.925615310000005]}"
118,22126,22,1/12/2007,1 de Mayo,Chaco,32633-6454,13.09,57,primavera,2007-11-26,"[2007-11-26, 2007-11-27, 2007-11-28, 2007-11-29, 2007-11-30, 2007-12-01, 2007-12-02]",true,118,-27.22855035,-58.90405078,1.85,"[0, 0, 0, 0, 0, 0, 2.2]",6.3925981521606445E-6,295.3098672231038,Molisoles,-0.006936553865671158,0.427029291788737,"{""type"":""Point"",""coordinates"":[-58.904050780000006,-27.22855035]}"
119,90091,90,28/1/1992,Simoca,Tucuman,32292-6460,1.11,309,verano,1992-01-27,"[1992-01-27, 1992-01-28, 1992-01-29, 1992-01-30, 1992-01-31, 1992-02-01, 1992-02-02]",true,119,-27.40925026,-65.26894379,3.85,"[0, 3.3, 3.1, 8.4, 1, 23.7, 4.5]",2.711862325668335E-4,298.92515627543133,Entisoles,-0.005383692681789398,0.3138109842936198,"{""type"":""Point"",""coordinates"":[-65.26894379,-27.409250260000004]}"
120,10077,10,20/10/2002,Paclin,Catamarca,33832-6763,15.08,1175,primavera,2002-10-14,"[2002-10-14, 2002-10-15, 2002-10-16, 2002-10-17, 2002-10-18, 2002-10-19, 2002-10-20]",false,120,-27.85473251,-65.7172699,10.53,"[0.7, 1.6, 16.8, 0, 0, 0.1, 4.8]",4.015713930130005E-4,299.1381581624349,Roca,-0.0030838875100016594,0.19879849751790366,"{""type"":""Point"",""coordinates"":[-65.7172699,-27.85473251]}"
121,10021,10,16/12/1994,Andalgala,Catamarca,33952-6744,15.51,1777,primavera,1994-12-12,"[1994-12-12, 1994-12-13, 1994-12-14, 1994-12-15, 1994-12-16, 1994-12-17, 1994-12-18]",false,121,-27.61905956,-66.11518542,1.4,"[0.9, 10.8, 45.2, 0.4, 20.7, 19.5, 2.1]",4.5239925384521484E-4,295.24347432454425,Entisoles,-0.0033445190638303757,0.23208745320638022,"{""type"":""Point"",""coordinates"":[-66.11518542,-27.619059560000004]}"
122,90035,90,7/11/1992,Graneros,Tucuman,32679-6504,25.54,351,primavera,1992-11-02,"[1992-11-02, 1992-11-03, 1992-11-04, 1992-11-05, 1992-11-06, 1992-11-07, 1992-11-08]",false,122,-27.6423966,-65.5086366,1.85,"[0, 0, 0, 0, 0, 0, 0]",5.056113004684448E-4,294.41138712565106,Molisoles,-0.004593983292579651,0.25790850321451825,"{""type"":""Point"",""coordinates"":[-65.50863660000002,-27.642396600000005]}"
123,90035,90,1/8/2015,Graneros,Tucuman,32679-6504,25.54,351,invierno,2015-07-27,"[2015-07-27, 2015-07-28, 2015-07-29, 2015-07-30, 2015-07-31, 2015-08-01, 2015-08-02]",false,123,-27.6423966,-65.5086366,1.85,"[0, 0, 0, 0.1, 0, 0, 0]",2.663135528564453E-4,288.17505264282227,Molisoles,-0.002028869464993477,0.2960828145345052,"{""type"":""Point"",""coordinates"":[-65.50863660000002,-27.642396600000005]}"
124,74007,74,12/10/2013,Ayacucho,San Luis,31950-2172,64.22,491,primavera,2013-10-07,"[2013-10-07, 2013-10-08, 2013-10-09, 2013-10-10, 2013-10-11, 2013-10-12, 2013-10-13]",false,124,-32.13651315,-66.85445389,2.78,"[0, 0, 0.9, 0, 1.1, 3.1, 0.7]",1.0579824447631836E-6,295.5127347310384,Entisoles,-1.4351587742567062E-4,0.027929306030273438,"{""type"":""Point"",""coordinates"":[-66.85445389,-32.13651315]}"
125,74007,74,23/5/1997,Ayacucho,San Luis,31950-2172,64.22,491,otoño,1997-05-19,"[1997-05-19, 1997-05-20, 1997-05-21, 1997-05-22, 1997-05-23, 1997-05-24, 1997-05-25]",false,125,-32.13651315,-66.85445389,2.78,"[0.2, 0.9, 2.9, 0, 0, 0, 0]",7.651746273040771E-5,289.4859224955241,Entisoles,-4.3968670070171356E-4,0.035381317138671875,"{""type"":""Point"",""coordinates"":[-66.85445389,-32.13651315]}"
126,14140,14,11/6/2006,San Justo,Cordoba,6955-2119,12.54,107,otoño,2006-06-05,"[2006-06-05, 2006-06-06, 2006-06-07, 2006-06-08, 2006-06-09, 2006-06-10, 2006-06-11]",true,126,-31.23400374,-62.74066613,1.08,"[0, 0, 0, 1.5, 12.5, 0, 0]",1.4007091522216797E-6,286.48058954874676,Alfisoles,-0.0010456796735525131,0.2281513214111328,"{""type"":""Point"",""coordinates"":[-62.74066613,-31.234003740000002]}"
127,14105,14,25/5/1994,Rio Primero,Cordoba,6799-2118,21.24,93,otoño,1994-05-23,"[1994-05-23, 1994-05-24, 1994-05-25, 1994-05-26, 1994-05-27, 1994-05-28, 1994-05-29]",false,127,-30.80593546,-63.17324293,3.7,"[0.1, 0.8, 0, 3.8, 0.6, 0, 0]",9.810924530029297E-5,294.465815226237,Molisoles,-0.001494615338742733,0.33092498779296875,"{""type"":""Point"",""coordinates"":[-63.17324293,-30.805935460000004]}"
128,14014,14,8/11/1990,Capital,Cordoba,37574-7384,24.04,426,primavera,1990-11-05,"[1990-11-05, 1990-11-06, 1990-11-07, 1990-11-08, 1990-11-09, 1990-11-10, 1990-11-11]",false,128,-31.47878838,-64.14509583,2.86,"[0, 0, 4.2, 0.4, 0, 1.6, 0]",1.8134713172912598E-5,286.3119468688965,Miscelaneas,-0.002707746811211109,0.31712913513183594,"{""type"":""Point"",""coordinates"":[-64.14509583,-31.478788380000008]}"
129,82063,82,16/9/2002,La Capital,Santa Fe,103-103,23.73,25,invierno,2002-09-16,"[2002-09-16, 2002-09-17, 2002-09-18, 2002-09-19, 2002-09-20, 2002-09-21, 2002-09-22]",false,129,-31.18858147,-60.62677383,2.15,"[0.2, 2.2, 8.2, 7, 0, 0, 0]",5.161464214324951E-4,290.5779266357422,Molisoles,-0.0024000555276870728,0.4237874348958333,"{""type"":""Point"",""coordinates"":[-60.62677383,-31.18858147]}"
130,14021,14,7/6/1997,Colon,Cordoba,33948-6745,20.69,355,otoño,1997-06-02,"[1997-06-02, 1997-06-03, 1997-06-04, 1997-06-05, 1997-06-06, 1997-06-07, 1997-06-08]",false,130,-31.25624481,-63.95340394,0.93,"[0, 2.4, 2.7, 0, 0.2, 0, 0]",2.332031726837158E-6,286.2157732645671,Miscelaneas,-6.036460399627686E-4,0.23367627461751303,"{""type"":""Point"",""coordinates"":[-63.953403939999994,-31.256244809999995]}"
131,14021,14,27/2/2006,Colon,Cordoba,33948-6745,20.69,355,verano,2006-02-27,"[2006-02-27, 2006-02-28, 2006-03-01, 2006-03-02, 2006-03-03, 2006-03-04, 2006-03-05]",false,131,-31.25624481,-63.95340394,0.93,"[1.6, 0.8, 3.9, 14, 1.7, 0, 0]",1.1831521987915039E-5,290.9749406178792,Miscelaneas,-0.002645818516612053,0.24695650736490884,"{""type"":""Point"",""coordinates"":[-63.953403939999994,-31.256244809999995]}"
132,14021,14,8/9/1993,Colon,Cordoba,33948-6745,20.69,355,invierno,1993-09-06,"[1993-09-06, 1993-09-07, 1993-09-08, 1993-09-09, 1993-09-10, 1993-09-11, 1993-09-12]",false,132,-31.25624481,-63.95340394,0.93,"[0, 0, 0, 0, 0, 0, 0]",1.175999641418457E-4,286.170171101888,Miscelaneas,-8.851373568177223E-4,0.2186126708984375,"{""type"":""Point"",""coordinates"":[-63.953403939999994,-31.256244809999995]}"
133,74028,74,19/3/1995,Chacabuco,San Luis,33256-6389,30.54,905,verano,1995-03-13,"[1995-03-13, 1995-03-14, 1995-03-15, 1995-03-16, 1995-03-17, 1995-03-18, 1995-03-19]",false,133,-32.56339762,-65.03153075,1.44,"[0, 0, 7.8, 0, 0, 0, 2.3]",1.4528632164001465E-5,291.17758242289227,Entisoles,-0.002980765886604786,0.2987810770670573,"{""type"":""Point"",""coordinates"":[-65.03153075,-32.56339762000001]}"
134,74049,74,5/4/1996,Junin,San Luis,34137-6448,58.78,587,otoño,1996-04-01,"[1996-04-01, 1996-04-02, 1996-04-03, 1996-04-04, 1996-04-05, 1996-04-06, 1996-04-07]",false,134,-32.31398017,-65.41102538,2.15,"[2, 17.2, 6.1, 24.5, 0.7, 0, 0]",5.9604644775390625E-6,295.4395459493001,Entisoles,-0.0011445386335253716,0.11210441589355469,"{""type"":""Point"",""coordinates"":[-65.41102538,-32.31398017]}"
135,74049,74,1/12/1994,Junin,San Luis,34137-6448,58.78,587,primavera,1994-11-28,"[1994-11-28, 1994-11-29, 1994-11-30, 1994-12-01, 1994-12-02, 1994-12-03, 1994-12-04]",false,135,-32.31398017,-65.41102538,2.15,"[15.2, 0, 0, 0.6, 1, 0, 0]",0.0011330246925354004,289.89150110880536,Entisoles,-0.0049431780353188515,0.3670603434244792,"{""type"":""Point"",""coordinates"":[-65.41102538,-32.31398017]}"
136,10098,10,24/9/1993,Santa Rosa,Catamarca,37029-7291,18.43,447,invierno,1993-09-20,"[1993-09-20, 1993-09-21, 1993-09-22, 1993-09-23, 1993-09-24, 1993-09-25, 1993-09-26]",false,136,-28.04503194,-65.27845615,0,"[1.9, 0.2, 0.5, 0, 0, 0, 0]",8.121132850646973E-6,289.96346791585285,Roca,-0.001175878569483757,0.13175837198893228,"{""type"":""Point"",""coordinates"":[-65.27845615,-28.04503194]}"
137,10098,10,11/2/1999,Santa Rosa,Catamarca,37029-7291,18.43,447,verano,1999-02-08,"[1999-02-08, 1999-02-09, 1999-02-10, 1999-02-11, 1999-02-12, 1999-02-13, 1999-02-14]",false,137,-28.04503194,-65.27845615,0,"[0, 0, 0, 2.2, 2.5, 2.8, 0]",5.960464477539063E-8,292.4533583323161,Roca,-0.005491511896252632,0.38257789611816406,"{""type"":""Point"",""coordinates"":[-65.27845615,-28.04503194]}"
138,10098,10,26/8/2011,Santa Rosa,Catamarca,37029-7291,18.43,447,invierno,2011-08-22,"[2011-08-22, 2011-08-23, 2011-08-24, 2011-08-25, 2011-08-26, 2011-08-27, 2011-08-28]",false,138,-28.04503194,-65.27845615,0,"[0, 0, 0, 0, 0, 0, 0]",2.9802322387695312E-8,282.1576239267985,Roca,-4.591904580593109E-4,0.1330127716064453,"{""type"":""Point"",""coordinates"":[-65.27845615,-28.04503194]}"
139,86182,86,22/2/2015,Sarmiento,Santiago del Estero,6804-2223,13.63,127,verano,2015-02-16,"[2015-02-16, 2015-02-17, 2015-02-18, 2015-02-19, 2015-02-20, 2015-02-21, 2015-02-22]",true,139,-28.08144587,-63.33466823,3.7,"[7.2, 0.7, 18.3, 11.8, 0, 0.2, 0]",1.0470300912857056E-4,298.691795984904,Alfisoles,-0.004421803168952465,0.3627948760986328,"{""type"":""Point"",""coordinates"":[-63.33466822999999,-28.081445870000003]}"
140,86084,86,2/4/2009,Guasayan,Santiago del Estero,32299-6447,23.83,376,otoño,2009-03-30,"[2009-03-30, 2009-03-31, 2009-04-01, 2009-04-02, 2009-04-03, 2009-04-04, 2009-04-05]",false,140,-27.85040093,-65.01179504,3.28,"[0, 5.1, 1.8, 0, 0, 4.4, 0]",1.2546777725219727E-5,299.5796356201172,Molisoles,-0.004057435318827629,0.1932544708251953,"{""type"":""Point"",""coordinates"":[-65.01179504,-27.85040093]}"
141,86105,86,14/9/1994,Loreto,Santiago del Estero,33116-6456,8.34,133,invierno,1994-09-12,"[1994-09-12, 1994-09-13, 1994-09-14, 1994-09-15, 1994-09-16, 1994-09-17, 1994-09-18]",true,141,-28.47635326,-64.04507396,2.78,"[0, 0, 0, 0, 0, 0, 0]",2.9489398002624512E-5,297.3964900970459,Alfisoles,-0.0017027556896209717,0.17064412434895834,"{""type"":""Point"",""coordinates"":[-64.04507396,-28.47635326]}"
142,86077,86,10/9/2012,General Taboada,Santiago del Estero,32704-6540,10.43,112,invierno,2012-09-10,"[2012-09-10, 2012-09-11, 2012-09-12, 2012-09-13, 2012-09-14, 2012-09-15, 2012-09-16]",true,142,-28.41299021,-62.79434139,1.05,"[0, 0, 0, 0, 0, 0, 0]",8.940696716308594E-8,292.07794189453125,Alfisoles,-0.0014553377404808998,0.21223322550455728,"{""type"":""Point"",""coordinates"":[-62.79434139,-28.412990209999997]}"
143,86077,86,28/10/2004,General Taboada,Santiago del Estero,32704-6540,10.43,112,primavera,2004-10-25,"[2004-10-25, 2004-10-26, 2004-10-27, 2004-10-28, 2004-10-29, 2004-10-30, 2004-10-31]",true,143,-28.41299021,-62.79434139,1.05,"[0, 0, 0, 0, 0, 12.2, 0]",1.2665987014770508E-6,289.5731150309245,Alfisoles,-0.004569734446704388,0.3060448964436849,"{""type"":""Point"",""coordinates"":[-62.79434139,-28.412990209999997]}"
144,86042,86,16/9/2007,Belgrano,Santiago del Estero,6800-2197,12.07,97,invierno,2007-09-10,"[2007-09-10, 2007-09-11, 2007-09-12, 2007-09-13, 2007-09-14, 2007-09-15, 2007-09-16]",true,144,-28.89628,-62.62596,2.97,"[4.9, 2.2, 1.9, 7.3, 29.6, 0.8, 1.3]",1.8894672393798828E-5,301.76648203531903,Molisoles,-0.0024880943819880486,0.1782983144124349,"{""type"":""Point"",""coordinates"":[-62.62596,-28.89628]}"
145,86049,86,12/7/1999,Capital,Santiago del Estero,36917-7264,13.33,287,invierno,1999-07-12,"[1999-07-12, 1999-07-13, 1999-07-14, 1999-07-15, 1999-07-16, 1999-07-17, 1999-07-18]",true,145,-27.80983349,-64.48893926,0.93,"[0.2, 1, 0.4, 0, 0, 0, 0]",6.953328847885132E-4,289.4251232147217,Alfisoles,-5.401205271482468E-4,0.18827120463053384,"{""type"":""Point"",""coordinates"":[-64.48893926,-27.809833490000003]}"
146,82063,82,14/10/2005,La Capital,Santa Fe,103-103,23.73,25,primavera,2005-10-10,"[2005-10-10, 2005-10-11, 2005-10-12, 2005-10-13, 2005-10-14, 2005-10-15, 2005-10-16]",false,146,-31.18858147,-60.62677383,2.15,"[0, 0, 0, 37.7, 0, 1.2, 0]",5.879998207092285E-5,291.7761402130127,Molisoles,-0.004149364307522774,0.3899129231770833,"{""type"":""Point"",""coordinates"":[-60.62677383,-31.18858147]}"
147,82084,82,4/2/1995,Rosario,Santa Fe,118-118,22.58,64,verano,1995-01-30,"[1995-01-30, 1995-01-31, 1995-02-01, 1995-02-02, 1995-02-03, 1995-02-04, 1995-02-05]",false,147,-33.07901008,-60.91379957,1.11,"[0, 0.1, 7.7, 0, 0, 2, 0]",2.302229404449463E-5,296.2671718597412,Alfisoles,-0.0023370636627078056,0.24979209899902344,"{""type"":""Point"",""coordinates"":[-60.91379957,-33.07901008]}"
148,14140,14,18/10/2006,San Justo,Cordoba,6955-2119,12.54,107,primavera,2006-10-16,"[2006-10-16, 2006-10-17, 2006-10-18, 2006-10-19, 2006-10-20, 2006-10-21, 2006-10-22]",true,148,-31.23400374,-62.74066613,1.08,"[0, 0, 0, 0, 0, 0, 0]",1.1324882507324219E-6,291.16030820210773,Alfisoles,-0.0038273539394140244,0.3173745473225911,"{""type"":""Point"",""coordinates"":[-62.74066613,-31.234003740000002]}"
149,14014,14,15/1/1999,Capital,Cordoba,37574-7384,24.04,426,verano,1999-01-11,"[1999-01-11, 1999-01-12, 1999-01-13, 1999-01-14, 1999-01-15, 1999-01-16, 1999-01-17]",false,149,-31.47878838,-64.14509583,2.86,"[0, 12.3, 2.3, 0.1, 0, 0, 0.9]",5.748867988586426E-5,291.9511578877767,Miscelaneas,-0.003509131260216236,0.2781658172607422,"{""type"":""Point"",""coordinates"":[-64.14509583,-31.478788380000008]}"
150,14056,14,23/2/1997,Juarez Celman,Cordoba,8232-2605,4.84,142,verano,1997-02-17,"[1997-02-17, 1997-02-18, 1997-02-19, 1997-02-20, 1997-02-21, 1997-02-22, 1997-02-23]",true,150,-33.3160107,-63.2538219,1.45,"[0, 0, 8.1, 0, 0, 0, 0]",6.943941116333008E-6,299.3821500142415,Molisoles,-0.0033658985048532486,0.20024426778157553,"{""type"":""Point"",""coordinates"":[-63.2538219,-33.3160107]}"
151,14021,14,22/8/1995,Colon,Cordoba,33948-6745,20.69,355,invierno,1995-08-21,"[1995-08-21, 1995-08-22, 1995-08-23, 1995-08-24, 1995-08-25, 1995-08-26, 1995-08-27]",false,151,-31.25624481,-63.95340394,0.93,"[0, 0, 0, 0, 0, 0, 0]",1.004338264465332E-5,285.3596363067627,Miscelaneas,-8.341353386640549E-4,0.16525586446126303,"{""type"":""Point"",""coordinates"":[-63.953403939999994,-31.256244809999995]}"
152,14021,14,23/10/1999,Colon,Cordoba,33948-6745,20.69,355,primavera,1999-10-18,"[1999-10-18, 1999-10-19, 1999-10-20, 1999-10-21, 1999-10-22, 1999-10-23, 1999-10-24]",false,152,-31.25624481,-63.95340394,0.93,"[0, 0, 0.2, 0, 0, 0, 0]",7.46995210647583E-5,294.3794987996419,Miscelaneas,-0.0034086154773831367,0.29296112060546875,"{""type"":""Point"",""coordinates"":[-63.953403939999994,-31.256244809999995]}"
153,14021,14,4/11/1995,Colon,Cordoba,33948-6745,20.69,355,primavera,1995-10-30,"[1995-10-30, 1995-10-31, 1995-11-01, 1995-11-02, 1995-11-03, 1995-11-04, 1995-11-05]",false,153,-31.25624481,-63.95340394,0.93,"[0, 0, 0, 0, 0, 0, 1.3]",7.733702659606934E-6,289.5982723236084,Miscelaneas,-0.0025148792192339897,0.26383336385091144,"{""type"":""Point"",""coordinates"":[-63.953403939999994,-31.256244809999995]}"
154,82063,82,28/8/2000,La Capital,Santa Fe,103-103,23.73,25,invierno,2000-08-28,"[2000-08-28, 2000-08-29, 2000-08-30, 2000-08-31, 2000-09-01, 2000-09-02, 2000-09-03]",false,154,-31.18858147,-60.62677383,2.15,"[0, 0, 4.3, 2.4, 0, 0, 0]",3.5566091537475586E-4,283.0283832550049,Molisoles,-0.002942439168691635,0.442352294921875,"{""type"":""Point"",""coordinates"":[-60.62677383,-31.18858147]}"
155,14021,14,26/2/1994,Colon,Cordoba,33948-6745,20.69,355,verano,1994-02-21,"[1994-02-21, 1994-02-22, 1994-02-23, 1994-02-24, 1994-02-25, 1994-02-26, 1994-02-27]",false,155,-31.25624481,-63.95340394,0.93,"[0, 0, 0, 0, 5.3, 7.5, 0.8]",6.343424320220947E-5,295.17070325215656,Miscelaneas,-0.004120497032999992,0.2496821085611979,"{""type"":""Point"",""coordinates"":[-63.953403939999994,-31.256244809999995]}"
156,14091,14,24/12/1995,Punilla,Cordoba,36828-7231,28.57,1223,primavera,1995-12-18,"[1995-12-18, 1995-12-19, 1995-12-20, 1995-12-21, 1995-12-22, 1995-12-23, 1995-12-24]",false,156,-31.10580063,-64.59128571,2.98,"[0, 0, 0.9, 37, 0, 0, 0]",2.2396445274353027E-5,298.74842262268066,Molisoles,-0.004295933060348034,0.23647308349609375,"{""type"":""Point"",""coordinates"":[-64.59128571,-31.105800630000005]}"
157,14140,14,10/10/1997,San Justo,Cordoba,6955-2119,12.54,107,primavera,1997-10-06,"[1997-10-06, 1997-10-07, 1997-10-08, 1997-10-09, 1997-10-10, 1997-10-11, 1997-10-12]",true,157,-31.23400374,-62.74066613,1.08,"[0, 0, 0.2, 1.7, 4.6, 13.8, 21.7]",2.250075340270996E-6,289.1694418589274,Alfisoles,-0.002900095656514168,0.2722880045572917,"{""type"":""Point"",""coordinates"":[-62.74066613,-31.234003740000002]}"
158,14091,14,19/5/2006,Punilla,Cordoba,36828-7231,28.57,1223,otoño,2006-05-15,"[2006-05-15, 2006-05-16, 2006-05-17, 2006-05-18, 2006-05-19, 2006-05-20, 2006-05-21]",false,158,-31.10580063,-64.59128571,2.98,"[0, 0, 0, 0, 0.2, 0, 0]",9.447336196899414E-6,285.3616015116374,Molisoles,-0.0015899734571576118,0.2810503641764323,"{""type"":""Point"",""coordinates"":[-64.59128571,-31.105800630000005]}"
159,14042,14,18/8/2014,General San Martin,Cordoba,9400-2835,27.92,162,invierno,2014-08-18,"[2014-08-18, 2014-08-19, 2014-08-20, 2014-08-21, 2014-08-22, 2014-08-23, 2014-08-24]",false,159,-32.34123693,-62.99621706,2.87,"[0, 0, 0, 0, 0, 1.1, 10.6]",3.3855438232421875E-5,291.4765872955322,Complejo indiferenci,-0.0014281095936894417,0.21994781494140625,"{""type"":""Point"",""coordinates"":[-62.99621706,-32.34123693]}"
160,14140,14,24/3/2014,San Justo,Cordoba,6955-2119,12.54,107,otoño,2014-03-24,"[2014-03-24, 2014-03-25, 2014-03-26, 2014-03-27, 2014-03-28, 2014-03-29, 2014-03-30]",true,160,-31.23400374,-62.74066613,1.08,"[0, 0, 0, 2.1, 8.5, 4.2, 0.7]",1.6391277313232422E-7,291.8413022359212,Alfisoles,-0.003222881816327572,0.2903016408284505,"{""type"":""Point"",""coordinates"":[-62.74066613,-31.234003740000002]}"
161,34049,34,10/2/2004,Pilcomayo,Formosa,36840-7239,50.93,78,verano,2004-02-09,"[2004-02-09, 2004-02-10, 2004-02-11, 2004-02-12, 2004-02-13, 2004-02-14, 2004-02-15]",false,161,-25.11711311,-58.18847657,0,"[0, 0, 0, 0, 9.7, 0.7, 0]",1.1906027793884277E-5,300.4352035522461,Rio,-0.005399600602686405,0.31242942810058594,"{""type"":""Point"",""coordinates"":[-58.18847657,-25.117113110000002]}"
162,34049,34,25/5/2001,Pilcomayo,Formosa,36840-7239,50.93,78,otoño,2001-05-21,"[2001-05-21, 2001-05-22, 2001-05-23, 2001-05-24, 2001-05-25, 2001-05-26, 2001-05-27]",false,162,-25.11711311,-58.18847657,0,"[10.1, 0, 1.3, 0, 0, 31.4, 25.2]",0.003164932131767273,294.90479469299316,Rio,-0.003046410158276558,0.47850799560546875,"{""type"":""Point"",""coordinates"":[-58.18847657,-25.117113110000002]}"
163,54063,54,28/5/2012,Iguazu,Misiones,33696-6458,8.04,216,otoño,2012-05-28,"[2012-05-28, 2012-05-29, 2012-05-30, 2012-05-31, 2012-06-01, 2012-06-02, 2012-06-03]",true,163,-25.86430349,-54.55489168,2.77,"[2.7, 0, 1.4, 11.4, 0, 2.5, 36.6]",8.709728717803955E-5,294.23699442545575,Molisoles,-0.002221919596195221,0.4842376708984375,"{""type"":""Point"",""coordinates"":[-54.55489168,-25.864303490000005]}"
164,06638,6,22/3/2014,Pilar,Buenos Aires,34357-5904,12.77,16,verano,2014-03-17,"[2014-03-17, 2014-03-18, 2014-03-19, 2014-03-20, 2014-03-21, 2014-03-22, 2014-03-23]",true,164,-34.42200558,-58.95283788,1.46,"[0, 0.2, 1.2, 0, 3.4, 0, 0]",3.6507844924926758E-6,292.3821366628011,Molisoles,-0.003974058665335178,0.42559051513671875,"{""type"":""Point"",""coordinates"":[-58.95283788,-34.42200558]}"
165,06714,6,24/5/2008,Salto,Buenos Aires,31982-6397,17.53,69,otoño,2008-05-19,"[2008-05-19, 2008-05-20, 2008-05-21, 2008-05-22, 2008-05-23, 2008-05-24, 2008-05-25]",false,165,-34.1554316,-60.4724629,0,"[0, 0, 5.3, 1.4, 5.9, 0, 0]",1.4230608940124512E-5,296.7586847941081,Molisoles,-4.700012505054474E-4,0.25512123107910156,"{""type"":""Point"",""coordinates"":[-60.472462900000004,-34.1554316]}"
166,06497,6,24/1/2006,Lujan,Buenos Aires,7-7,7.25,39,verano,2006-01-23,"[2006-01-23, 2006-01-24, 2006-01-25, 2006-01-26, 2006-01-27, 2006-01-28, 2006-01-29]",true,166,-34.4619848,-59.1744878,0.93,"[0, 12.4, 2.1, 0, 0, 0, 0]",1.0848045349121094E-5,295.22058232625324,Complejo indiferenci,-0.003569815307855606,0.3515338897705078,"{""type"":""Point"",""coordinates"":[-59.1744878,-34.4619848]}"
167,06658,6,23/10/2005,Quilmes,Buenos Aires,35407-6950,4.25,3,primavera,2005-10-17,"[2005-10-17, 2005-10-18, 2005-10-19, 2005-10-20, 2005-10-21, 2005-10-22, 2005-10-23]",true,167,-34.70037841,-58.27664278,2.17,"[0.2, 0, 0, 0, 0, 2.9, 0]",,,Miscelaneas,,,"{""type"":""Point"",""coordinates"":[-58.276642779999996,-34.70037841]}"
168,26077,26,16/6/1997,Rawson,Chubut,6380-1985,11.08,14,otoño,1997-06-16,"[1997-06-16, 1997-06-17, 1997-06-18, 1997-06-19, 1997-06-20, 1997-06-21, 1997-06-22]",true,168,-43.31555403,-65.3717721,0,"[2, 0, 0, 3.8, 0.2, 0, 0]",5.099177360534668E-5,281.95502344767254,Aridisoles,-7.793111726641655E-4,0.4773260752360026,"{""type"":""Point"",""coordinates"":[-65.3717721,-43.31555403]}"
169,26007,26,11/3/2014,Biedma,Chubut,32798-6301,46.39,228,verano,2014-03-10,"[2014-03-10, 2014-03-11, 2014-03-12, 2014-03-13, 2014-03-14, 2014-03-15, 2014-03-16]",false,169,-42.32925797,-65.63134766,4.19,"[0.5, 0, 0, 0, 0, 0.1, 1.4]",4.3213367462158203E-7,289.8955879211426,Aridisoles,-6.922334432601929E-5,0.10564994812011719,"{""type"":""Point"",""coordinates"":[-65.63134766,-42.32925797]}"
170,26077,26,11/5/1996,Rawson,Chubut,6380-1985,11.08,14,otoño,1996-05-06,"[1996-05-06, 1996-05-07, 1996-05-08, 1996-05-09, 1996-05-10, 1996-05-11, 1996-05-12]",true,170,-43.31555403,-65.3717721,0,"[0, 0, 0, 0, 0, 0, 0]",0.0,289.06353187561035,Aridisoles,-1.9248388707637787E-4,0.24239095052083334,"{""type"":""Point"",""coordinates"":[-65.3717721,-43.31555403]}"
171,14182,14,26/10/1999,Union,Cordoba,34347-6363,19.27,128,primavera,1999-10-25,"[1999-10-25, 1999-10-26, 1999-10-27, 1999-10-28, 1999-10-29, 1999-10-30, 1999-10-31]",false,171,-33.4792553,-62.9564065,2.89,"[0, 0, 16.7, 16.3, 27.1, 9, 10.8]",1.338571310043335E-4,295.8686860402425,Molisoles,-0.003963004797697067,0.21672693888346353,"{""type"":""Point"",""coordinates"":[-62.95640650000001,-33.479255300000005]}"
172,82105,82,10/4/2015,San Jeronimo,Santa Fe,123-123,29.33,42,otoño,2015-04-06,"[2015-04-06, 2015-04-07, 2015-04-08, 2015-04-09, 2015-04-10, 2015-04-11, 2015-04-12]",false,172,-32.2399352,-61.231266,4.95,"[0, 0, 0, 0, 0, 0, 0]",2.5331974029541016E-7,292.3847300211589,Molisoles,-0.0022345827892422676,0.2834161122639974,"{""type"":""Point"",""coordinates"":[-61.231266,-32.2399352]}"
173,74063,74,15/7/2010,Libertador General San Martin,San Luis,36906-7261,27.91,1274,invierno,2010-07-12,"[2010-07-12, 2010-07-13, 2010-07-14, 2010-07-15, 2010-07-16, 2010-07-17, 2010-07-18]",false,173,-32.77143097,-65.76694489,6.84,"[0, 0, 0, 1.5, 0, 0, 0]",4.388391971588135E-5,273.39353370666504,Entisoles,-0.0011887717992067337,0.19130388895670572,"{""type"":""Point"",""coordinates"":[-65.76694489,-32.77143097]}"
174,74007,74,9/12/2001,Ayacucho,San Luis,31950-2172,64.22,491,primavera,2001-12-03,"[2001-12-03, 2001-12-04, 2001-12-05, 2001-12-06, 2001-12-07, 2001-12-08, 2001-12-09]",false,174,-32.13651315,-66.85445389,2.78,"[0, 0, 0, 0, 1.4, 0, 0]",7.471442222595215E-5,289.29560470581055,Entisoles,-0.0028578434139490128,0.05579249064127604,"{""type"":""Point"",""coordinates"":[-66.85445389,-32.13651315]}"
175,74007,74,6/4/2005,Ayacucho,San Luis,31950-2172,64.22,491,otoño,2005-04-04,"[2005-04-04, 2005-04-05, 2005-04-06, 2005-04-07, 2005-04-08, 2005-04-09, 2005-04-10]",false,175,-32.13651315,-66.85445389,2.78,"[0, 0, 0, 0, 0, 0, 0]",1.1235475540161133E-5,289.895050684611,Entisoles,-0.0020399894565343857,0.06684366861979167,"{""type"":""Point"",""coordinates"":[-66.85445389,-32.13651315]}"
176,74007,74,17/3/2000,Ayacucho,San Luis,31950-2172,64.22,491,verano,2000-03-13,"[2000-03-13, 2000-03-14, 2000-03-15, 2000-03-16, 2000-03-17, 2000-03-18, 2000-03-19]",false,176,-32.13651315,-66.85445389,2.78,"[3.8, 8.6, 12.4, 14, 0, 0, 0]",6.262809038162231E-4,294.80857531229657,Entisoles,-0.0033549126237630844,0.25330543518066406,"{""type"":""Point"",""coordinates"":[-66.85445389,-32.13651315]}"
177,74028,74,8/9/1994,Chacabuco,San Luis,33256-6389,30.54,905,invierno,1994-09-05,"[1994-09-05, 1994-09-06, 1994-09-07, 1994-09-08, 1994-09-09, 1994-09-10, 1994-09-11]",false,177,-32.56339762,-65.03153075,1.44,"[0, 0, 0.6, 0, 0, 0, 0]",1.1906027793884277E-5,286.6566975911458,Entisoles,-0.002065218985080719,0.24727884928385416,"{""type"":""Point"",""coordinates"":[-65.03153075,-32.56339762000001]}"
178,14126,14,23/1/2012,San Alberto,Cordoba,9461-2776,35.26,669,verano,2012-01-23,"[2012-01-23, 2012-01-24, 2012-01-25, 2012-01-26, 2012-01-27, 2012-01-28, 2012-01-29]",false,178,-31.79056275,-65.16710187,5.71,"[6.5, 0.3, 0, 0, 0, 0, 0.2]",2.396106719970703E-5,298.15749104817706,Entisoles,-0.002651102840900421,0.17862319946289062,"{""type"":""Point"",""coordinates"":[-65.16710187,-31.79056275]}"
179,14007,14,8/5/1997,Calamuchita,Cordoba,36828-7231,19.43,603,otoño,1997-05-05,"[1997-05-05, 1997-05-06, 1997-05-07, 1997-05-08, 1997-05-09, 1997-05-10, 1997-05-11]",false,179,-32.09286214,-64.56387845,5.66,"[0, 0, 0, 0, 0, 0, 0]",3.2870471477508545E-4,289.7719217936198,Roca,-0.0014178436249494553,0.19428380330403647,"{""type"":""Point"",""coordinates"":[-64.56387845,-32.09286214]}"
180,14014,14,8/4/1990,Capital,Cordoba,37574-7384,24.04,426,otoño,1990-04-02,"[1990-04-02, 1990-04-03, 1990-04-04, 1990-04-05, 1990-04-06, 1990-04-07, 1990-04-08]",false,180,-31.47878838,-64.14509583,2.86,"[0, 0.3, 6.5, 4.4, 17.1, 2.4, 0]",1.449882984161377E-5,293.4535617828369,Miscelaneas,-0.0021240534260869026,0.33287302652994794,"{""type"":""Point"",""coordinates"":[-64.14509583,-31.478788380000008]}"
181,14021,14,28/12/1999,Colon,Cordoba,33948-6745,20.69,355,verano,1999-12-27,"[1999-12-27, 1999-12-28, 1999-12-29, 1999-12-30, 1999-12-31, 2000-01-01, 2000-01-02]",false,181,-31.25624481,-63.95340394,0.93,"[0.3, 5.8, 1.7, 0, 0, 0, 0]",1.0776519775390625E-4,299.61230595906574,Miscelaneas,-0.003256409429013729,0.31914202372233075,"{""type"":""Point"",""coordinates"":[-63.953403939999994,-31.256244809999995]}"
182,14021,14,26/7/2012,Colon,Cordoba,33948-6745,20.69,355,invierno,2012-07-23,"[2012-07-23, 2012-07-24, 2012-07-25, 2012-07-26, 2012-07-27, 2012-07-28, 2012-07-29]",false,182,-31.25624481,-63.95340394,0.93,"[0, 0, 0, 0, 0, 0, 0]",7.450580596923828E-8,286.06128946940106,Miscelaneas,-4.803081974387169E-4,0.16368611653645834,"{""type"":""Point"",""coordinates"":[-63.953403939999994,-31.256244809999995]}"
183,14021,14,9/11/2008,Colon,Cordoba,33948-6745,20.69,355,primavera,2008-11-03,"[2008-11-03, 2008-11-04, 2008-11-05, 2008-11-06, 2008-11-07, 2008-11-08, 2008-11-09]",false,183,-31.25624481,-63.95340394,0.93,"[0, 1.4, 7.1, 0, 0, 4.7, 0]",6.556510925292969E-7,295.02954228719074,Miscelaneas,-0.0022956645116209984,0.22532018025716147,"{""type"":""Point"",""coordinates"":[-63.953403939999994,-31.256244809999995]}"
184,14021,14,28/10/2014,Colon,Cordoba,33948-6745,20.69,355,primavera,2014-10-27,"[2014-10-27, 2014-10-28, 2014-10-29, 2014-10-30, 2014-10-31, 2014-11-01, 2014-11-02]",false,184,-31.25624481,-63.95340394,0.93,"[0, 0, 0, 0, 3, 13.9, 4.6]",4.023313522338867E-7,302.15342903137207,Miscelaneas,-0.00244317390024662,0.1920801798502604,"{""type"":""Point"",""coordinates"":[-63.953403939999994,-31.256244809999995]}"
185,14021,14,21/11/2005,Colon,Cordoba,33948-6745,20.69,355,primavera,2005-11-21,"[2005-11-21, 2005-11-22, 2005-11-23, 2005-11-24, 2005-11-25, 2005-11-26, 2005-11-27]",false,185,-31.25624481,-63.95340394,0.93,"[0, 0, 1.5, 0, 0, 0, 0]",4.723668098449707E-6,298.28132756551105,Miscelaneas,-0.003180418163537979,0.28913625081380206,"{""type"":""Point"",""coordinates"":[-63.953403939999994,-31.256244809999995]}"
186,14021,14,12/12/2007,Colon,Cordoba,33948-6745,20.69,355,primavera,2007-12-10,"[2007-12-10, 2007-12-11, 2007-12-12, 2007-12-13, 2007-12-14, 2007-12-15, 2007-12-16]",false,186,-31.25624481,-63.95340394,0.93,"[0.1, 0, 0, 0, 19.6, 0, 0]",2.8461217880249023E-6,297.2370719909668,Miscelaneas,-0.002917274832725525,0.24799728393554688,"{""type"":""Point"",""coordinates"":[-63.953403939999994,-31.256244809999995]}"
187,14021,14,18/9/2006,Colon,Cordoba,33948-6745,20.69,355,invierno,2006-09-18,"[2006-09-18, 2006-09-19, 2006-09-20, 2006-09-21, 2006-09-22, 2006-09-23, 2006-09-24]",false,187,-31.25624481,-63.95340394,0.93,"[0, 1.7, 0, 0, 0, 0, 0]",2.384185791015625E-6,291.47421582539874,Miscelaneas,-0.001164402812719345,0.14867782592773438,"{""type"":""Point"",""coordinates"":[-63.953403939999994,-31.256244809999995]}"
188,14091,14,15/2/2001,Punilla,Cordoba,36828-7231,28.57,1223,verano,2001-02-12,"[2001-02-12, 2001-02-13, 2001-02-14, 2001-02-15, 2001-02-16, 2001-02-17, 2001-02-18]",false,188,-31.10580063,-64.59128571,2.98,"[0, 0, 0, 6.6, 0, 0, 0]",3.122687339782715E-4,289.38690185546875,Molisoles,-0.0050141531974077225,0.3283240000406901,"{""type"":""Point"",""coordinates"":[-64.59128571,-31.105800630000005]}"
189,14021,14,1/10/2007,Colon,Cordoba,33948-6745,20.69,355,primavera,2007-10-01,"[2007-10-01, 2007-10-02, 2007-10-03, 2007-10-04, 2007-10-05, 2007-10-06, 2007-10-07]",false,189,-31.25624481,-63.95340394,0.93,"[7.7, 0, 0, 0, 10.8, 13.3, 0]",6.915628910064697E-5,296.065772374471,Miscelaneas,-0.0017745811492204666,0.2682749430338542,"{""type"":""Point"",""coordinates"":[-63.953403939999994,-31.256244809999995]}"
190,82112,82,18/3/2000,San Justo,Santa Fe,6235-1924,3,25,verano,2000-03-13,"[2000-03-13, 2000-03-14, 2000-03-15, 2000-03-16, 2000-03-17, 2000-03-18, 2000-03-19]",true,190,-30.8130411,-60.3886502,2.35,"[0, 0, 0, 35, 0.8, 0, 0]",6.124377250671387E-6,296.04246203104657,Molisoles,-0.0046466924250125885,0.4105243682861328,"{""type"":""Point"",""coordinates"":[-60.3886502,-30.813041099999996]}"
191,82070,82,15/1/2015,Las Colonias,Santa Fe,6856-2113,19.32,40,verano,2015-01-12,"[2015-01-12, 2015-01-13, 2015-01-14, 2015-01-15, 2015-01-16, 2015-01-17, 2015-01-18]",false,191,-31.6618986,-61.0112577,0,"[0, 24.3, 3.9, 0, 0, 1.5, 0]",2.130866050720215E-6,300.05700810750324,Molisoles,-0.005239903926849365,0.4678885142008464,"{""type"":""Point"",""coordinates"":[-61.0112577,-31.6618986]}"
192,82021,82,5/4/2013,Castellanos,Santa Fe,36829-7232,43.75,69,otoño,2013-04-01,"[2013-04-01, 2013-04-02, 2013-04-03, 2013-04-04, 2013-04-05, 2013-04-06, 2013-04-07]",false,192,-31.38184929,-61.37005997,1.09,"[26.7, 1.7, 0, 0, 0, 0, 0]",0.001435607671737671,294.93763097127277,Alfisoles,-0.0017926646396517754,0.3852837880452474,"{""type"":""Point"",""coordinates"":[-61.37005997,-31.38184929000001]}"
193,14021,14,12/5/2010,Colon,Cordoba,33948-6745,20.69,355,otoño,2010-05-10,"[2010-05-10, 2010-05-11, 2010-05-12, 2010-05-13, 2010-05-14, 2010-05-15, 2010-05-16]",false,193,-31.25624481,-63.95340394,0.93,"[0, 0, 0, 0, 0, 0, 3.4]",2.086162567138672E-7,285.1052831013997,Miscelaneas,-0.0010295445099473,0.2195262908935547,"{""type"":""Point"",""coordinates"":[-63.953403939999994,-31.256244809999995]}"
194,14021,14,25/10/1999,Colon,Cordoba,33948-6745,20.69,355,primavera,1999-10-25,"[1999-10-25, 1999-10-26, 1999-10-27, 1999-10-28, 1999-10-29, 1999-10-30, 1999-10-31]",false,194,-31.25624481,-63.95340394,0.93,"[0, 0, 2.8, 5.7, 46.2, 30.6, 47.5]",7.222592830657959E-5,294.99401156107587,Miscelaneas,-0.0030132681131362915,0.23493258158365884,"{""type"":""Point"",""coordinates"":[-63.953403939999994,-31.256244809999995]}"
195,14021,14,10/7/1990,Colon,Cordoba,33948-6745,20.69,355,invierno,1990-07-09,"[1990-07-09, 1990-07-10, 1990-07-11, 1990-07-12, 1990-07-13, 1990-07-14, 1990-07-15]",false,195,-31.25624481,-63.95340394,0.93,"[0, 0, 0, 0, 0, 0, 1.5]",4.708766937255859E-6,283.6424204508464,Miscelaneas,-0.0012800227850675583,0.3540058135986328,"{""type"":""Point"",""coordinates"":[-63.953403939999994,-31.256244809999995]}"
196,14168,14,28/12/1990,Totoral,Cordoba,37559-7382,7.06,766,verano,1990-12-24,"[1990-12-24, 1990-12-25, 1990-12-26, 1990-12-27, 1990-12-28, 1990-12-29, 1990-12-30]",true,196,-30.81785967,-64.21185018,1.42,"[2.1, 1.2, 0.2, 20.3, 0, 0, 0]",7.876306772232056E-4,293.69016456604004,Entisoles,-0.0038176551461219788,0.30314890543619794,"{""type"":""Point"",""coordinates"":[-64.21185018,-30.817859669999994]}"
197,14014,14,28/12/2009,Capital,Cordoba,37574-7384,24.04,426,verano,2009-12-28,"[2009-12-28, 2009-12-29, 2009-12-30, 2009-12-31, 2010-01-01, 2010-01-02, 2010-01-03]",false,197,-31.47878838,-64.14509583,2.86,"[4.8, 2.6, 0.4, 0, 3.7, 0, 24]",7.262825965881348E-5,297.08800888061523,Miscelaneas,-0.0030250493437051773,0.3587303161621094,"{""type"":""Point"",""coordinates"":[-64.14509583,-31.478788380000008]}"
198,14091,14,19/6/1999,Punilla,Cordoba,36828-7231,28.57,1223,otoño,1999-06-14,"[1999-06-14, 1999-06-15, 1999-06-16, 1999-06-17, 1999-06-18, 1999-06-19, 1999-06-20]",false,198,-31.10580063,-64.59128571,2.98,"[0, 0, 0, 5.3, 0, 0, 0]",2.9940903186798096E-4,282.8745981852214,Molisoles,-0.0012291930615901947,0.2884330749511719,"{""type"":""Point"",""coordinates"":[-64.59128571,-31.105800630000005]}"
199,14021,14,4/8/2001,Colon,Cordoba,33948-6745,20.69,355,invierno,2001-07-30,"[2001-07-30, 2001-07-31, 2001-08-01, 2001-08-02, 2001-08-03, 2001-08-04, 2001-08-05]",false,199,-31.25624481,-63.95340394,0.93,"[0, 0, 0, 0, 0, 0, 12.8]",2.2646784782409668E-4,284.1705741882324,Miscelaneas,-0.0013602282851934433,0.28572527567545575,"{""type"":""Point"",""coordinates"":[-63.953403939999994,-31.256244809999995]}"
200,14021,14,21/10/1990,Colon,Cordoba,33948-6745,20.69,355,primavera,1990-10-15,"[1990-10-15, 1990-10-16, 1990-10-17, 1990-10-18, 1990-10-19, 1990-10-20, 1990-10-21]",false,200,-31.25624481,-63.95340394,0.93,"[0, 0, 1, 4.1, 0, 0, 0]",2.3245811462402344E-6,287.81851132710773,Miscelaneas,-0.0016950275748968124,0.2897040049235026,"{""type"":""Point"",""coordinates"":[-63.953403939999994,-31.256244809999995]}"
201,22014,22,17/7/1991,Bermejo,Chaco,32998-6511,18.89,65,invierno,1991-07-15,"[1991-07-15, 1991-07-16, 1991-07-17, 1991-07-18, 1991-07-19, 1991-07-20, 1991-07-21]",false,201,-26.92175039,-58.77874597,2.28,"[0, 0, 1.1, 60.7, 0, 0.6, 23.9]",6.153881549835205E-4,281.90009053548175,Rio,-0.0013316432014107704,0.41948191324869794,"{""type"":""Point"",""coordinates"":[-58.77874597,-26.92175039]}"
202,18084,18,22/2/2013,Ituzaingo,Corrientes,87-87,28.3,78,verano,2013-02-18,"[2013-02-18, 2013-02-19, 2013-02-20, 2013-02-21, 2013-02-22, 2013-02-23, 2013-02-24]",false,202,-27.71591449,-56.94751639,6.26,"[10.9, 13.3, 17.5, 0, 0, 0, 0]",1.0360777378082275E-4,300.22572644551593,Alfisoles,-0.0035202372819185257,0.370297114054362,"{""type"":""Point"",""coordinates"":[-56.94751638999999,-27.71591449]}"
203,14091,14,10/5/2012,Punilla,Cordoba,36828-7231,28.57,1223,otoño,2012-05-07,"[2012-05-07, 2012-05-08, 2012-05-09, 2012-05-10, 2012-05-11, 2012-05-12, 2012-05-13]",false,203,-31.10580063,-64.59128571,2.98,"[0.6, 2, 0, 1.3, 0.1, 0, 0]",4.023313522338867E-6,289.85223452250165,Molisoles,-8.87533649802208E-4,0.2215722401936849,"{""type"":""Point"",""coordinates"":[-64.59128571,-31.105800630000005]}"
204,22140,22,23/5/2005,San Fernando,Chaco,6254-1933,11.88,54,otoño,2005-05-23,"[2005-05-23, 2005-05-24, 2005-05-25, 2005-05-26, 2005-05-27, 2005-05-28, 2005-05-29]",true,204,-27.92561531,-59.31798172,2.97,"[0, 0, 0, 0, 0, 0, 0]",2.8133392333984375E-5,285.68834749857587,Complejo indiferenci,-0.00185384601354599,0.3839028676350911,"{""type"":""Point"",""coordinates"":[-59.317981720000006,-27.925615310000005]}"
205,54028,54,16/2/2000,Capital,Misiones,14-14,8.07,150,verano,2000-02-14,"[2000-02-14, 2000-02-15, 2000-02-16, 2000-02-17, 2000-02-18, 2000-02-19, 2000-02-20]",true,205,-27.47659493,-55.92169961,2.79,"[0, 0, 0, 0, 0, 0, 0]",1.2180209159851074E-4,299.4082202911377,Alfisoles,-0.004202352836728096,0.31929270426432294,"{""type"":""Point"",""coordinates"":[-55.92169961,-27.47659493]}"
206,82049,82,15/9/1999,General Obligado,Santa Fe,32822-6509,17.99,58,invierno,1999-09-13,"[1999-09-13, 1999-09-14, 1999-09-15, 1999-09-16, 1999-09-17, 1999-09-18, 1999-09-19]",false,206,-28.6765561,-59.7497004,1.41,"[10.7, 22, 0, 0, 0, 0, 0]",0.0013909190893173218,293.2921772003174,Alfisoles,-0.002179880626499653,0.4255301157633464,"{""type"":""Point"",""coordinates"":[-59.7497004,-28.676556099999996]}"
207,18021,18,16/6/1996,Capital,Corrientes,6611-2085,6.4,45,otoño,1996-06-10,"[1996-06-10, 1996-06-11, 1996-06-12, 1996-06-13, 1996-06-14, 1996-06-15, 1996-06-16]",true,207,-27.4064,-58.78276,12.77,"[0, 0, 0, 0, 0.3, 4.7, 2.2]",0.0010061711072921753,291.3318341573079,Rio,-0.001898936927318573,0.2943471272786458,"{""type"":""Point"",""coordinates"":[-58.78276,-27.4064]}"
208,18042,18,24/8/1998,Empedrado,Corrientes,9551-2854,17.34,64,invierno,1998-08-24,"[1998-08-24, 1998-08-25, 1998-08-26, 1998-08-27, 1998-08-28, 1998-08-29, 1998-08-30]",false,208,-27.70578113,-58.68808341,1.4,"[27.5, 36.5, 0.2, 0, 0, 0, 0]",0.0029861629009246826,289.0639120737712,Rio,-0.0011614281684160233,0.45322100321451825,"{""type"":""Point"",""coordinates"":[-58.688083410000004,-27.70578113]}"
209,18133,18,5/9/1994,San Cosme,Corrientes,59-59,5.73,52,invierno,1994-09-05,"[1994-09-05, 1994-09-06, 1994-09-07, 1994-09-08, 1994-09-09, 1994-09-10, 1994-09-11]",true,209,-27.36393313,-58.66198243,0.93,"[0, 0, 12.4, 0, 0, 0, 0]",0.0026195645332336426,291.5107014973958,Rio,-0.003163915127515793,0.28901036580403644,"{""type"":""Point"",""coordinates"":[-58.66198243,-27.363933129999996]}"
210,18077,18,1/2/1997,Itati,Corrientes,17-17,41.46,69,verano,1997-01-27,"[1997-01-27, 1997-01-28, 1997-01-29, 1997-01-30, 1997-01-31, 1997-02-01, 1997-02-02]",false,210,-27.35196615,-57.87393625,1.04,"[0.5, 0.2, 2.3, 14.5, 3.9, 0.7, 2.8]",4.7084689140319824E-4,303.459441502889,Entisoles,-0.004799334332346916,0.2720266977945964,"{""type"":""Point"",""coordinates"":[-57.87393625,-27.35196615]}"
211,18042,18,7/11/1991,Empedrado,Corrientes,9551-2854,17.34,64,primavera,1991-11-04,"[1991-11-04, 1991-11-05, 1991-11-06, 1991-11-07, 1991-11-08, 1991-11-09, 1991-11-10]",false,211,-27.70578113,-58.68808341,1.4,"[0, 6.5, 54.7, 0, 0, 0, 0]",4.921704530715942E-4,295.07687695821124,Rio,-0.004607444629073143,0.39063135782877606,"{""type"":""Point"",""coordinates"":[-58.688083410000004,-27.70578113]}"
212,54063,54,7/9/1997,Iguazu,Misiones,33696-6458,8.04,216,invierno,1997-09-01,"[1997-09-01, 1997-09-02, 1997-09-03, 1997-09-04, 1997-09-05, 1997-09-06, 1997-09-07]",true,212,-25.86430349,-54.55489168,2.77,"[0, 4.3, 4.5, 2.3, 22.5, 0, 0]",0.0012609362602233887,296.9687690734863,Molisoles,-0.004213245585560799,0.3569895426432292,"{""type"":""Point"",""coordinates"":[-54.55489168,-25.864303490000005]}"
213,06805,6,8/2/1995,Tigre,Buenos Aires,34847-6831,1.44,4,verano,1995-02-06,"[1995-02-06, 1995-02-07, 1995-02-08, 1995-02-09, 1995-02-10, 1995-02-11, 1995-02-12]",true,213,-34.3277116,-58.608687,3.84,"[0, 0, 0, 0, 0.7, 1.2, 0.6]",5.906820297241211E-5,293.70348930358887,Rio,-0.004895644262433052,0.3755531311035156,"{""type"":""Point"",""coordinates"":[-58.608687,-34.3277116]}"
214,14182,14,18/9/2015,Union,Cordoba,34347-6363,19.27,128,invierno,2015-09-14,"[2015-09-14, 2015-09-15, 2015-09-16, 2015-09-17, 2015-09-18, 2015-09-19, 2015-09-20]",false,214,-33.4792553,-62.9564065,2.89,"[0, 0, 0, 0, 0, 0, 0.4]",2.8908252716064453E-6,289.4167009989421,Molisoles,-0.00283893384039402,0.2596925099690755,"{""type"":""Point"",""coordinates"":[-62.95640650000001,-33.479255300000005]}"
215,06658,6,11/10/2000,Quilmes,Buenos Aires,35407-6950,4.25,3,primavera,2000-10-09,"[2000-10-09, 2000-10-10, 2000-10-11, 2000-10-12, 2000-10-13, 2000-10-14, 2000-10-15]",true,215,-34.70037841,-58.27664278,2.17,"[9.8, 0, 0, 0, 0, 0, 3.8]",,,Miscelaneas,,,"{""type"":""Point"",""coordinates"":[-58.276642779999996,-34.70037841]}"
216,06756,6,13/9/2002,San Isidro,Buenos Aires,53-53,1.29,24,invierno,2002-09-09,"[2002-09-09, 2002-09-10, 2002-09-11, 2002-09-12, 2002-09-13, 2002-09-14, 2002-09-15]",true,216,-34.47940181,-58.5074044,5.81,"[0, 2, 18.9, 0, 0, 0, 0]",,,Rio,,,"{""type"":""Point"",""coordinates"":[-58.507404400000006,-34.47940181]}"
217,06861,6,20/5/2009,Vicente Lopez,Buenos Aires,36837-7237,3.72,28,otoño,2009-05-18,"[2009-05-18, 2009-05-19, 2009-05-20, 2009-05-21, 2009-05-22, 2009-05-23, 2009-05-24]",true,217,-34.52591497,-58.53576394,1.13,"[0, 0, 1.2, 7.6, 0, 0, 0]",,,Miscelaneas,,,"{""type"":""Point"",""coordinates"":[-58.53576394000001,-34.52591497]}"
218,02013,2,9/2/1998,Comuna 13,Capital Federal,54-54,3.99,10,verano,1998-02-09,"[1998-02-09, 1998-02-10, 1998-02-11, 1998-02-12, 1998-02-13, 1998-02-14, 1998-02-15]",true,218,-34.55488152,-58.4502891,3.85,"[0, 0, 0, 0, 0, 0, 0.1]",4.485994577407837E-4,292.77606201171875,Miscelaneas,-0.00382082536816597,0.437374750773112,"{""type"":""Point"",""coordinates"":[-58.4502891,-34.55488152]}"
219,02012,2,1/10/1994,Comuna 12,Capital Federal,54-54,3.13,20,primavera,1994-09-26,"[1994-09-26, 1994-09-27, 1994-09-28, 1994-09-29, 1994-09-30, 1994-10-01, 1994-10-02]",true,219,-34.56062514,-58.47494475,0.93,"[0, 0, 1.2, 0, 0, 0, 6]",5.717426538467407E-4,286.7348855336507,Miscelaneas,-0.004473053850233555,0.3851470947265625,"{""type"":""Point"",""coordinates"":[-58.474944750000006,-34.560625140000006]}"
220,02012,2,19/12/2001,Comuna 12,Capital Federal,54-54,3.13,20,primavera,2001-12-17,"[2001-12-17, 2001-12-18, 2001-12-19, 2001-12-20, 2001-12-21, 2001-12-22, 2001-12-23]",true,220,-34.56062514,-58.47494475,0.93,"[0.9, 0, 0, 0.6, 11.7, 0, 0]",0.0013827085494995117,294.7967014312744,Miscelaneas,-0.0033062510192394257,0.2150599161783854,"{""type"":""Point"",""coordinates"":[-58.474944750000006,-34.560625140000006]}"
221,18084,18,17/6/1992,Ituzaingo,Corrientes,87-87,28.3,78,otoño,1992-06-15,"[1992-06-15, 1992-06-16, 1992-06-17, 1992-06-18, 1992-06-19, 1992-06-20, 1992-06-21]",false,221,-27.71591449,-56.94751639,6.26,"[0, 0, 0, 0.1, 0, 0, 23.8]",0.002990216016769409,293.46311378479004,Alfisoles,-0.0019827745854854584,0.384402592976888,"{""type"":""Point"",""coordinates"":[-56.94751638999999,-27.71591449]}"
222,14007,14,9/10/2013,Calamuchita,Cordoba,36828-7231,19.43,603,primavera,2013-10-07,"[2013-10-07, 2013-10-08, 2013-10-09, 2013-10-10, 2013-10-11, 2013-10-12, 2013-10-13]",false,222,-32.09286214,-64.56387845,5.66,"[0, 0, 0, 0, 1.8, 2.5, 4.8]",3.3974647521972656E-6,288.9675687154134,Roca,-0.001500554382801056,0.18101374308268228,"{""type"":""Point"",""coordinates"":[-64.56387845,-32.09286214]}"
223,14098,14,15/7/1994,Rio Cuarto,Cordoba,34345-6361,23.14,514,invierno,1994-07-11,"[1994-07-11, 1994-07-12, 1994-07-13, 1994-07-14, 1994-07-15, 1994-07-16, 1994-07-17]",false,223,-32.64751095,-64.22141859,2.88,"[0, 0, 0, 0, 0, 0, 0]",2.905726432800293E-6,278.4163881937663,Complejo indiferenci,-6.006807088851929E-4,0.1847820281982422,"{""type"":""Point"",""coordinates"":[-64.22141859,-32.64751095]}"
224,14007,14,2/1/2014,Calamuchita,Cordoba,36828-7231,19.43,603,verano,2013-12-30,"[2013-12-30, 2013-12-31, 2014-01-01, 2014-01-02, 2014-01-03, 2014-01-04, 2014-01-05]",false,224,-32.09286214,-64.56387845,5.66,"[4.7, 1.5, 2.7, 15.6, 0, 0, 0]",4.686415195465088E-5,299.67417844136554,Roca,-0.004542618058621883,0.3365052541097005,"{""type"":""Point"",""coordinates"":[-64.56387845,-32.09286214]}"
225,14161,14,11/11/2007,Tercero Arriba,Cordoba,34345-6361,4.53,473,primavera,2007-11-05,"[2007-11-05, 2007-11-06, 2007-11-07, 2007-11-08, 2007-11-09, 2007-11-10, 2007-11-11]",true,225,-32.25289151,-64.25143209,2.87,"[0, 0.4, 6.9, 0.9, 12.4, 9.8, 0]",9.5367431640625E-7,292.4292163848877,Complejo indiferenci,-0.0026443181559443474,0.2444305419921875,"{""type"":""Point"",""coordinates"":[-64.25143209,-32.25289151]}"
226,14007,14,22/4/1994,Calamuchita,Cordoba,36828-7231,19.43,603,otoño,1994-04-18,"[1994-04-18, 1994-04-19, 1994-04-20, 1994-04-21, 1994-04-22, 1994-04-23, 1994-04-24]",false,226,-32.09286214,-64.56387845,5.66,"[2.1, 0, 0, 0, 0, 2, 0]",5.64083456993103E-4,282.1513964335124,Roca,-0.001327313482761383,0.302487055460612,"{""type"":""Point"",""coordinates"":[-64.56387845,-32.09286214]}"
227,14007,14,11/3/2000,Calamuchita,Cordoba,36828-7231,19.43,603,verano,2000-03-06,"[2000-03-06, 2000-03-07, 2000-03-08, 2000-03-09, 2000-03-10, 2000-03-11, 2000-03-12]",false,227,-32.09286214,-64.56387845,5.66,"[1.5, 7, 15.4, 0, 0, 2.4, 6.2]",0.0010216236114501953,292.9077212015788,Roca,-0.003276664763689041,0.3901011149088542,"{""type"":""Point"",""coordinates"":[-64.56387845,-32.09286214]}"
228,14007,14,15/3/1999,Calamuchita,Cordoba,36828-7231,19.43,603,verano,1999-03-15,"[1999-03-15, 1999-03-16, 1999-03-17, 1999-03-18, 1999-03-19, 1999-03-20, 1999-03-21]",false,228,-32.09286214,-64.56387845,5.66,"[13.2, 25.1, 4.6, 0.4, 3.3, 0.9, 0]",2.1073222160339355E-4,293.82349332173663,Roca,-0.003161756321787834,0.36293665568033856,"{""type"":""Point"",""coordinates"":[-64.56387845,-32.09286214]}"
229,14161,14,19/3/1990,Tercero Arriba,Cordoba,34345-6361,4.53,473,verano,1990-03-19,"[1990-03-19, 1990-03-20, 1990-03-21, 1990-03-22, 1990-03-23, 1990-03-24, 1990-03-25]",true,229,-32.25289151,-64.25143209,2.87,"[0.9, 0, 2.1, 5.4, 4.8, 0, 4.9]",8.374452590942383E-6,291.3760573069255,Complejo indiferenci,-0.001860596239566803,0.3756694793701172,"{""type"":""Point"",""coordinates"":[-64.25143209,-32.25289151]}"
230,18084,18,14/11/1990,Ituzaingo,Corrientes,87-87,28.3,78,primavera,1990-11-12,"[1990-11-12, 1990-11-13, 1990-11-14, 1990-11-15, 1990-11-16, 1990-11-17, 1990-11-18]",false,230,-27.71591449,-56.94751639,6.26,"[34.2, 0, 0, 0, 14, 0.4, 3.7]",0.024565771222114563,299.0318546295166,Alfisoles,-0.003555789589881897,0.4448496500651042,"{""type"":""Point"",""coordinates"":[-56.94751638999999,-27.71591449]}"
231,54084,54,10/4/2005,Montecarlo,Misiones,37066-7304,6.29,223,otoño,2005-04-04,"[2005-04-04, 2005-04-05, 2005-04-06, 2005-04-07, 2005-04-08, 2005-04-09, 2005-04-10]",true,231,-26.75464362,-54.69924477,4.15,"[0, 3.8, 2.2, 0, 2.4, 0.5, 0]",5.155801773071289E-6,293.079620997111,Molisoles,-0.004171740263700485,0.44389915466308594,"{""type"":""Point"",""coordinates"":[-54.69924477,-26.754643619999996]}"
232,54098,54,24/8/2005,San Ignacio,Misiones,13-13,8.32,161,invierno,2005-08-22,"[2005-08-22, 2005-08-23, 2005-08-24, 2005-08-25, 2005-08-26, 2005-08-27, 2005-08-28]",true,232,-27.25123207,-55.5304925,0.93,"[0, 13.3, 3.9, 0, 0, 0, 0]",4.725456237792969E-4,297.0516014099121,Entisoles,-0.0032372325658798218,0.32137298583984375,"{""type"":""Point"",""coordinates"":[-55.5304925,-27.25123207]}"
233,54063,54,4/7/2009,Iguazu,Misiones,33696-6458,8.04,216,invierno,2009-06-29,"[2009-06-29, 2009-06-30, 2009-07-01, 2009-07-02, 2009-07-03, 2009-07-04, 2009-07-05]",true,233,-25.86430349,-54.55489168,2.77,"[13, 0, 3.4, 0, 0, 6.9, 19.5]",0.002088487148284912,292.98483657836914,Molisoles,-0.0019817743450403214,0.45499928792317706,"{""type"":""Point"",""coordinates"":[-54.55489168,-25.864303490000005]}"
234,54084,54,6/8/1996,Montecarlo,Misiones,37066-7304,6.29,223,invierno,1996-08-05,"[1996-08-05, 1996-08-06, 1996-08-07, 1996-08-08, 1996-08-09, 1996-08-10, 1996-08-11]",true,234,-26.75464362,-54.69924477,4.15,"[0, 18.5, 0.3, 12.4, 29.4, 0, 0]",7.409155368804932E-4,292.92710940043133,Molisoles,-0.003150077536702156,0.3605333964029948,"{""type"":""Point"",""coordinates"":[-54.69924477,-26.754643619999996]}"
235,90084,90,28/5/2009,Capital,Tucuman,33966-6506,7.44,453,otoño,2009-05-25,"[2009-05-25, 2009-05-26, 2009-05-27, 2009-05-28, 2009-05-29, 2009-05-30, 2009-05-31]",true,235,-26.82900979,-65.21054418,6.28,"[0.2, 13.3, 2.2, 1.2, 0.2, 0, 0]",3.420114517211914E-4,293.4788513183594,Molisoles,-0.0023880135267972946,0.3811219533284505,"{""type"":""Point"",""coordinates"":[-65.21054418,-26.829009789999997]}"
236,50028,50,13/7/1990,Guaymallen,Mendoza,32300-6465,57.79,677,invierno,1990-07-09,"[1990-07-09, 1990-07-10, 1990-07-11, 1990-07-12, 1990-07-13, 1990-07-14, 1990-07-15]",false,236,-32.92076147,-68.70711858,1.1,"[0, 0, 0, 0, 0, 0, 0]",6.854534149169922E-7,279.8910369873047,Entisoles,-9.123384952545166E-4,0.12821833292643228,"{""type"":""Point"",""coordinates"":[-68.70711858,-32.92076147000001]}"
237,70035,70,7/5/2013,Caucete,San Juan,32300-6465,40.48,576,otoño,2013-05-06,"[2013-05-06, 2013-05-07, 2013-05-08, 2013-05-09, 2013-05-10, 2013-05-11, 2013-05-12]",false,237,-31.70272711,-68.28587359,4.35,"[0, 0, 0, 0, 0, 0, 0]",0.0,290.77651532491046,Entisoles,-2.0947400480508804E-4,0.11273384094238281,"{""type"":""Point"",""coordinates"":[-68.28587359,-31.702727109999998]}"
238,70119,70,2/2/2013,Valle Fertil,San Juan,34179-6743,71.88,763,verano,2013-01-28,"[2013-01-28, 2013-01-29, 2013-01-30, 2013-01-31, 2013-02-01, 2013-02-02, 2013-02-03]",false,238,-30.80415774,-67.366235,3.37,"[0.9, 0.5, 0, 6, 1.3, 0, 0]",4.1678547859191895E-5,298.26405270894367,Entisoles,-0.0013684090226888657,0.03505261739095052,"{""type"":""Point"",""coordinates"":[-67.366235,-30.80415774]}"
239,06658,6,7/4/2012,Quilmes,Buenos Aires,35407-6950,4.25,3,otoño,2012-04-02,"[2012-04-02, 2012-04-03, 2012-04-04, 2012-04-05, 2012-04-06, 2012-04-07, 2012-04-08]",true,239,-34.70037841,-58.27664278,2.17,"[0.8, 0, 30.5, 0.9, 0, 0, 0]",,,Miscelaneas,,,"{""type"":""Point"",""coordinates"":[-58.276642779999996,-34.70037841]}"
240,82070,82,5/6/2014,Las Colonias,Santa Fe,6856-2113,19.32,40,otoño,2014-06-02,"[2014-06-02, 2014-06-03, 2014-06-04, 2014-06-05, 2014-06-06, 2014-06-07, 2014-06-08]",false,240,-31.6618986,-61.0112577,0,"[0, 0, 0.5, 0, 0, 0, 0]",2.2649765014648438E-6,285.2038377126058,Molisoles,-0.0014514382928609848,0.4312248229980469,"{""type"":""Point"",""coordinates"":[-61.0112577,-31.6618986]}"
241,82063,82,25/7/2004,La Capital,Santa Fe,103-103,23.73,25,invierno,2004-07-19,"[2004-07-19, 2004-07-20, 2004-07-21, 2004-07-22, 2004-07-23, 2004-07-24, 2004-07-25]",false,241,-31.18858147,-60.62677383,2.15,"[0, 0, 0, 10, 18.1, 0.6, 12.7]",1.3709068298339844E-5,284.3994623819987,Molisoles,-0.0013226363807916641,0.35985247294108075,"{""type"":""Point"",""coordinates"":[-60.62677383,-31.18858147]}"
242,06770,6,22/2/2011,San Pedro,Buenos Aires,33257-6395,3.79,14,verano,2011-02-21,"[2011-02-21, 2011-02-22, 2011-02-23, 2011-02-24, 2011-02-25, 2011-02-26, 2011-02-27]",true,242,-33.6362648,-59.7862782,1.45,"[0, 0.1, 41.8, 0, 0, 0, 0]",1.3813376426696777E-5,297.16309293111163,Rio,-0.004628758877515793,0.48596954345703125,"{""type"":""Point"",""coordinates"":[-59.78627819999999,-33.6362648]}"
243,06568,6,8/12/1997,Moron,Buenos Aires,33486-6512,15.92,14,primavera,1997-12-08,"[1997-12-08, 1997-12-09, 1997-12-10, 1997-12-11, 1997-12-12, 1997-12-13, 1997-12-14]",false,243,-34.6644131,-58.64564271,3.58,"[0, 0.5, 10.1, 2.2, 21.1, 26.2, 2.3]",6.258487701416016E-7,294.60541979471844,Miscelaneas,-0.005581350065767765,0.38258107503255206,"{""type"":""Point"",""coordinates"":[-58.645642710000004,-34.6644131]}"
244,06427,6,3/3/2014,La Matanza,Buenos Aires,33486-6512,4.98,8,verano,2014-03-03,"[2014-03-03, 2014-03-04, 2014-03-05, 2014-03-06, 2014-03-07, 2014-03-08, 2014-03-09]",true,244,-34.71417289,-58.50890438,7.28,"[0, 45.5, 2.3, 0, 0, 0, 4.7]",3.439486026763916E-4,293.8281586964925,Molisoles,-0.0028639482334256172,0.2704607645670573,"{""type"":""Point"",""coordinates"":[-58.50890437999999,-34.71417289000001]}"
245,06427,6,6/3/1991,La Matanza,Buenos Aires,33486-6512,4.98,8,verano,1991-03-04,"[1991-03-04, 1991-03-05, 1991-03-06, 1991-03-07, 1991-03-08, 1991-03-09, 1991-03-10]",true,245,-34.71417289,-58.50890438,7.28,"[0, 0, 0, 0, 3.7, 5.5, 0]",2.3826956748962402E-4,293.6548652648926,Molisoles,-0.00492872204631567,0.3870887756347656,"{""type"":""Point"",""coordinates"":[-58.50890437999999,-34.71417289000001]}"
246,06497,6,7/1/2001,Lujan,Buenos Aires,7-7,7.25,39,verano,2001-01-01,"[2001-01-01, 2001-01-02, 2001-01-03, 2001-01-04, 2001-01-05, 2001-01-06, 2001-01-07]",true,246,-34.4619848,-59.1744878,0.93,"[0, 0, 0, 0, 0, 12.5, 16.7]",2.943277359008789E-4,299.4167474110921,Complejo indiferenci,-0.0052664196118712425,0.30643272399902344,"{""type"":""Point"",""coordinates"":[-59.1744878,-34.4619848]}"
247,06441,6,27/4/2007,La Plata,Buenos Aires,3314-1708,23.31,26,otoño,2007-04-23,"[2007-04-23, 2007-04-24, 2007-04-25, 2007-04-26, 2007-04-27, 2007-04-28, 2007-04-29]",false,247,-35.03880607,-58.05930616,0.93,"[0.5, 0, 0.2, 0, 0, 0, 0]",4.774332046508789E-5,289.5289999643962,Complejo indiferenci,-0.0014245044440031052,0.4888426462809245,"{""type"":""Point"",""coordinates"":[-58.05930616,-35.03880607000001]}"
248,06638,6,18/4/1991,Pilar,Buenos Aires,34357-5904,12.77,16,otoño,1991-04-15,"[1991-04-15, 1991-04-16, 1991-04-17, 1991-04-18, 1991-04-19, 1991-04-20, 1991-04-21]",true,248,-34.42200558,-58.95283788,1.46,"[8.4, 22.7, 3.3, 0, 0, 0, 0]",3.9637088775634766E-5,292.991641998291,Molisoles,-9.229080751538277E-4,0.3805357615152995,"{""type"":""Point"",""coordinates"":[-58.95283788,-34.42200558]}"
249,06035,6,15/4/2002,Avellaneda,Buenos Aires,35411-6952,1.59,6,otoño,2002-04-15,"[2002-04-15, 2002-04-16, 2002-04-17, 2002-04-18, 2002-04-19, 2002-04-20, 2002-04-21]",true,249,-34.67500565,-58.31056343,3.38,"[9.7, 39.6, 9.3, 0, 0.2, 0, 0]",,,Miscelaneas,,,"{""type"":""Point"",""coordinates"":[-58.31056343,-34.675005649999996]}"
250,06490,6,3/7/2014,Lomas de Zamora,Buenos Aires,35405-6949,5.53,9,invierno,2014-06-30,"[2014-06-30, 2014-07-01, 2014-07-02, 2014-07-03, 2014-07-04, 2014-07-05, 2014-07-06]",true,250,-34.73790272,-58.44067537,3,"[0, 0, 0, 0, 0, 16.9, 1.8]",4.112720489501953E-4,279.368496576945,Miscelaneas,-5.917120724916458E-4,0.44980748494466144,"{""type"":""Point"",""coordinates"":[-58.44067537000001,-34.73790272]}"
251,06028,6,7/1/2011,Almirante Brown,Buenos Aires,35405-6949,1.13,28,verano,2011-01-03,"[2011-01-03, 2011-01-04, 2011-01-05, 2011-01-06, 2011-01-07, 2011-01-08, 2011-01-09]",true,251,-34.80155807,-58.39146772,0.93,"[0.2, 0.1, 8, 0, 0, 8.5, 0.5]",1.671910285949707E-5,297.7651176452637,Miscelaneas,-0.0011853259056806564,0.24799728393554688,"{""type"":""Point"",""coordinates"":[-58.39146772000001,-34.80155807]}"
252,06763,6,14/11/1990,San Nicolas,Buenos Aires,6776-2114,14.58,50,primavera,1990-11-12,"[1990-11-12, 1990-11-13, 1990-11-14, 1990-11-15, 1990-11-16, 1990-11-17, 1990-11-18]",true,252,-33.6042287,-60.4178226,1.45,"[0.8, 25.6, 2.5, 2.2, 0, 0, 0.6]",5.187094211578369E-5,293.6184431711833,Molisoles,-0.00439063087105751,0.4079596201578776,"{""type"":""Point"",""coordinates"":[-60.417822599999994,-33.6042287]}"
253,06665,6,3/2/1991,Ramallo,Buenos Aires,3325-1719,9.81,37,verano,1991-01-28,"[1991-01-28, 1991-01-29, 1991-01-30, 1991-01-31, 1991-02-01, 1991-02-02, 1991-02-03]",true,253,-33.6241496,-60.0461017,3.82,"[0, 31.5, 18.8, 0, 0, 0, 0]",4.3064355850219727E-5,296.0286051432292,Rio,-0.005640048533678055,0.4092884063720703,"{""type"":""Point"",""coordinates"":[-60.04610170000001,-33.6241496]}"
254,82084,82,7/3/2011,Rosario,Santa Fe,118-118,22.58,64,verano,2011-03-07,"[2011-03-07, 2011-03-08, 2011-03-09, 2011-03-10, 2011-03-11, 2011-03-12, 2011-03-13]",false,254,-33.07901008,-60.91379957,1.11,"[0.1, 0.2, 0, 0, 0.1, 17, 0]",1.6391277313232422E-6,298.24694569905597,Alfisoles,-0.0018337815999984741,0.26970863342285156,"{""type"":""Point"",""coordinates"":[-60.91379957,-33.07901008]}"
255,06623,6,20/12/1995,Pergamino,Buenos Aires,140-140,25.11,63,primavera,1995-12-18,"[1995-12-18, 1995-12-19, 1995-12-20, 1995-12-21, 1995-12-22, 1995-12-23, 1995-12-24]",false,255,-33.5893048,-60.7727646,0.93,"[1.3, 0, 0, 13.7, 7.4, 2, 0]",1.5854835510253906E-5,304.65589332580566,Alfisoles,-0.0029334761202335358,0.23981602986653647,"{""type"":""Point"",""coordinates"":[-60.7727646,-33.5893048]}"
256,06568,6,4/5/1992,Moron,Buenos Aires,33486-6512,15.92,14,otoño,1992-05-04,"[1992-05-04, 1992-05-05, 1992-05-06, 1992-05-07, 1992-05-08, 1992-05-09, 1992-05-10]",false,256,-34.6644131,-58.64564271,3.58,"[0, 3.3, 0.3, 1.8, 0, 11.5, 0.5]",1.901388168334961E-5,290.3874117533366,Miscelaneas,-4.7163479030132294E-4,0.3164831797281901,"{""type"":""Point"",""coordinates"":[-58.645642710000004,-34.6644131]}"
257,06568,6,13/5/2002,Moron,Buenos Aires,33486-6512,15.92,14,otoño,2002-05-13,"[2002-05-13, 2002-05-14, 2002-05-15, 2002-05-16, 2002-05-17, 2002-05-18, 2002-05-19]",false,257,-34.6644131,-58.64564271,3.58,"[28.8, 13.8, 0, 2.1, 18.3, 0, 0]",0.006248265504837036,292.8758195241292,Miscelaneas,-0.0015212157741189003,0.4761816660563151,"{""type"":""Point"",""coordinates"":[-58.645642710000004,-34.6644131]}"
258,18168,18,16/12/1998,Santo Tome,Corrientes,68-68,3.13,96,primavera,1998-12-14,"[1998-12-14, 1998-12-15, 1998-12-16, 1998-12-17, 1998-12-18, 1998-12-19, 1998-12-20]",true,258,-28.51878167,-56.05544289,2.13,"[1.9, 0.4, 31.3, 0, 0, 0, 0]",3.649890422821045E-4,299.5818678538005,Ultisoles,-0.003996250219643116,0.3889636993408203,"{""type"":""Point"",""coordinates"":[-56.05544289,-28.518781670000006]}"
259,18049,18,7/6/1996,Esquina,Corrientes,9200-2836,11.96,43,otoño,1996-06-03,"[1996-06-03, 1996-06-04, 1996-06-05, 1996-06-06, 1996-06-07, 1996-06-08, 1996-06-09]",true,259,-30.0784368,-59.4055912,1.42,"[0, 0, 0, 0, 0, 0, 0]",2.3633241653442383E-5,281.73073132832843,Complejo indiferenci,-0.0013792403042316437,0.2995141347249349,"{""type"":""Point"",""coordinates"":[-59.405591199999996,-30.0784368]}"
260,18035,18,24/8/2003,Curuzu Cuatia,Corrientes,9021-2832,18.94,69,invierno,2003-08-18,"[2003-08-18, 2003-08-19, 2003-08-20, 2003-08-21, 2003-08-22, 2003-08-23, 2003-08-24]",false,260,-29.30959977,-58.51285545,1.41,"[0, 0, 0, 0, 7.5, 16.4, 0]",8.09401273727417E-4,287.1645024617513,Alfisoles,-0.002781067043542862,0.3864612579345703,"{""type"":""Point"",""coordinates"":[-58.51285545,-29.30959977]}"
261,18091,18,9/1/2015,Lavalle,Corrientes,6577-2072,5.81,66,verano,2015-01-05,"[2015-01-05, 2015-01-06, 2015-01-07, 2015-01-08, 2015-01-09, 2015-01-10, 2015-01-11]",true,261,-28.9356733,-58.8052348,0.93,"[0, 0.2, 24.3, 7, 8.4, 17.5, 32.7]",2.3850798606872559E-4,299.81213506062824,Complejo indiferenci,-0.0064740609377622604,0.3182665506998698,"{""type"":""Point"",""coordinates"":[-58.8052348,-28.9356733]}"
262,54091,54,26/12/1994,Obera,Misiones,33745-6552,20.16,389,verano,1994-12-26,"[1994-12-26, 1994-12-27, 1994-12-28, 1994-12-29, 1994-12-30, 1994-12-31, 1995-01-01]",false,262,-27.3929091,-55.12277042,3.64,"[3.5, 4, 16.8, 11.4, 5.1, 1.6, 3.6]",6.120055913925171E-4,300.33623758951825,Molisoles,-0.006259709596633911,0.38077735900878906,"{""type"":""Point"",""coordinates"":[-55.12277042,-27.392909099999994]}"
263,54098,54,11/4/2015,San Ignacio,Misiones,13-13,8.32,161,otoño,2015-04-06,"[2015-04-06, 2015-04-07, 2015-04-08, 2015-04-09, 2015-04-10, 2015-04-11, 2015-04-12]",true,263,-27.25123207,-55.5304925,0.93,"[0, 0, 0.1, 0, 0, 0, 0]",3.487914800643921E-4,293.4510548909505,Entisoles,-0.003335457295179367,0.41990216573079425,"{""type"":""Point"",""coordinates"":[-55.5304925,-27.25123207]}"
264,54077,54,3/7/1995,Libertador General San Martin,Misiones,6487-2027,13.67,162,invierno,1995-07-03,"[1995-07-03, 1995-07-04, 1995-07-05, 1995-07-06, 1995-07-07, 1995-07-08, 1995-07-09]",true,264,-26.78501255,-54.90115103,4.99,"[15.4, 6.2, 0, 16.7, 2.9, 0, 0]",0.0013180524110794067,292.21410942077637,Molisoles,-0.001112307421863079,0.4152170817057292,"{""type"":""Point"",""coordinates"":[-54.90115103000001,-26.785012549999998]}"
265,54112,54,7/11/2015,San Pedro,Misiones,33720-6520,20.3,692,primavera,2015-11-02,"[2015-11-02, 2015-11-03, 2015-11-04, 2015-11-05, 2015-11-06, 2015-11-07, 2015-11-08]",false,265,-26.50855467,-53.92302828,1.39,"[1.8, 15.6, 12.4, 3.6, 0, 4, 47.8]",0.0028833746910095215,293.5762087504069,Entisoles,-0.003916270099580288,0.47014427185058594,"{""type"":""Point"",""coordinates"":[-53.92302828,-26.50855467]}"
266,06357,6,9/1/1991,General Pueyrredon,Buenos Aires,3347-1742,17.47,21,verano,1991-01-07,"[1991-01-07, 1991-01-08, 1991-01-09, 1991-01-10, 1991-01-11, 1991-01-12, 1991-01-13]",false,266,-37.80766254,-57.62989086,5.55,"[0, 0, 0, 0, 0, 0, 0]",2.6673078536987305E-6,294.77750968933105,Molisoles,-0.004641707055270672,0.3429698944091797,"{""type"":""Point"",""coordinates"":[-57.62989086,-37.80766254000001]}"
267,54028,54,11/10/2013,Capital,Misiones,14-14,8.07,150,primavera,2013-10-07,"[2013-10-07, 2013-10-08, 2013-10-09, 2013-10-10, 2013-10-11, 2013-10-12, 2013-10-13]",true,267,-27.47659493,-55.92169961,2.79,"[0, 0, 0, 1.8, 5.6, 22.4, 1.4]",1.377016305923462E-4,291.7663968404134,Alfisoles,-0.004783032462000847,0.3491586049397786,"{""type"":""Point"",""coordinates"":[-55.92169961,-27.47659493]}"
268,06770,6,25/3/1993,San Pedro,Buenos Aires,33257-6395,3.79,14,otoño,1993-03-22,"[1993-03-22, 1993-03-23, 1993-03-24, 1993-03-25, 1993-03-26, 1993-03-27, 1993-03-28]",true,268,-33.6362648,-59.7862782,1.45,"[0, 0, 0, 0, 0, 0, 0]",1.4135241508483887E-4,293.8812370300293,Rio,-0.0039986176416277885,0.48345057169596356,"{""type"":""Point"",""coordinates"":[-59.78627819999999,-33.6362648]}"
269,06371,6,6/8/2006,General San Martin,Buenos Aires,36837-7237,8.51,8,invierno,2006-07-31,"[2006-07-31, 2006-08-01, 2006-08-02, 2006-08-03, 2006-08-04, 2006-08-05, 2006-08-06]",true,269,-34.56734338,-58.58431125,17.23,"[0, 0, 0, 0, 0, 0, 0]",1.0326504707336426E-5,278.32047208150226,Miscelaneas,-0.0010416479781270027,0.40493202209472656,"{""type"":""Point"",""coordinates"":[-58.58431125,-34.56734338]}"
270,02004,2,24/9/2003,Comuna 4,Capital Federal,8891-2706,2.09,10,primavera,2003-09-22,"[2003-09-22, 2003-09-23, 2003-09-24, 2003-09-25, 2003-09-26, 2003-09-27, 2003-09-28]",true,270,-34.64641355,-58.38427103,1.46,"[0, 24.4, 0, 0, 0, 7.6, 0]",9.842216968536377E-4,291.31416575113934,Miscelaneas,-0.002425381913781166,0.34724171956380206,"{""type"":""Point"",""coordinates"":[-58.384271029999994,-34.64641355]}"
271,02007,2,15/2/1996,Comuna 7,Capital Federal,36837-7237,7.04,22,verano,1996-02-12,"[1996-02-12, 1996-02-13, 1996-02-14, 1996-02-15, 1996-02-16, 1996-02-17, 1996-02-18]",true,271,-34.63680708,-58.45826985,2.25,"[0, 0, 0, 0.1, 0, 0, 0]",9.390711784362793E-5,292.809045791626,Miscelaneas,-0.002029506489634514,0.20220438639322916,"{""type"":""Point"",""coordinates"":[-58.45826984999999,-34.63680708]}"
272,02007,2,15/7/1994,Comuna 7,Capital Federal,36837-7237,7.04,22,invierno,1994-07-11,"[1994-07-11, 1994-07-12, 1994-07-13, 1994-07-14, 1994-07-15, 1994-07-16, 1994-07-17]",true,272,-34.63680708,-58.45826985,2.25,"[0, 0, 0, 0, 0, 0, 0]",0.001122400164604187,280.0245424906413,Miscelaneas,-9.336899966001511E-4,0.3609841664632161,"{""type"":""Point"",""coordinates"":[-58.45826984999999,-34.63680708]}"
273,02006,2,14/8/2012,Comuna 6,Capital Federal,85-85,5.9,32,invierno,2012-08-13,"[2012-08-13, 2012-08-14, 2012-08-15, 2012-08-16, 2012-08-17, 2012-08-18, 2012-08-19]",true,273,-34.6168255,-58.44360311,5.01,"[0, 27.4, 21.4, 0.5, 25, 45, 0]",1.0347366333007812E-4,283.28992017110187,Miscelaneas,-0.0020412616431713104,0.43767738342285156,"{""type"":""Point"",""coordinates"":[-58.44360310999999,-34.6168255]}"
274,02015,2,23/7/2008,Comuna 15,Capital Federal,36837-7237,2.81,29,invierno,2008-07-21,"[2008-07-21, 2008-07-22, 2008-07-23, 2008-07-24, 2008-07-25, 2008-07-26, 2008-07-27]",true,274,-34.59294425,-58.48867142,4.63,"[13, 6, 1.8, 2.6, 0, 0, 1.1]",1.752227544784546E-4,284.2508996327718,Miscelaneas,-0.001318078488111496,0.34087689717610675,"{""type"":""Point"",""coordinates"":[-58.48867142,-34.59294425]}"
275,02014,2,24/6/1999,Comuna 14,Capital Federal,85-85,2.68,24,invierno,1999-06-21,"[1999-06-21, 1999-06-22, 1999-06-23, 1999-06-24, 1999-06-25, 1999-06-26, 1999-06-27]",true,275,-34.57389998,-58.42243645,5.28,"[0, 1.6, 1.1, 4.7, 0, 0.3, 1.4]",2.437978982925415E-4,286.2438424428304,Miscelaneas,-0.001051284372806549,0.3566417694091797,"{""type"":""Point"",""coordinates"":[-58.42243645,-34.57389997999999]}"
276,02013,2,21/4/2006,Comuna 13,Capital Federal,54-54,3.99,10,otoño,2006-04-17,"[2006-04-17, 2006-04-18, 2006-04-19, 2006-04-20, 2006-04-21, 2006-04-22, 2006-04-23]",true,276,-34.55488152,-58.4502891,3.85,"[0, 0, 0, 12.7, 0, 0, 0]",2.0141899585723877E-4,285.90367635091144,Miscelaneas,-0.0021998099982738495,0.270965576171875,"{""type"":""Point"",""coordinates"":[-58.4502891,-34.55488152]}"
277,06490,6,19/2/1993,Lomas de Zamora,Buenos Aires,35405-6949,5.53,9,verano,1993-02-15,"[1993-02-15, 1993-02-16, 1993-02-17, 1993-02-18, 1993-02-19, 1993-02-20, 1993-02-21]",true,277,-34.73790272,-58.44067537,3,"[0, 0, 0, 6.9, 0.9, 6.7, 0]",2.0895898342132568E-4,298.39026769002277,Miscelaneas,-0.00493147037923336,0.34407806396484375,"{""type"":""Point"",""coordinates"":[-58.44067537000001,-34.73790272]}"
278,06035,6,1/5/1994,Avellaneda,Buenos Aires,35411-6952,1.59,6,otoño,1994-04-25,"[1994-04-25, 1994-04-26, 1994-04-27, 1994-04-28, 1994-04-29, 1994-04-30, 1994-05-01]",true,278,-34.67500565,-58.31056343,3.38,"[21.2, 3.7, 17.4, 0, 0.5, 28.7, 20.6]",,,Miscelaneas,,,"{""type"":""Point"",""coordinates"":[-58.31056343,-34.675005649999996]}"
279,06434,6,4/2/1997,Lanus,Buenos Aires,8891-2706,4.6,5,verano,1997-02-03,"[1997-02-03, 1997-02-04, 1997-02-05, 1997-02-06, 1997-02-07, 1997-02-08, 1997-02-09]",true,279,-34.69095715,-58.38386285,4.6,"[0, 17.6, 0, 0, 0, 6.9, 3.4]",6.717443466186523E-5,295.48426564534503,Miscelaneas,-0.0028428416699171066,0.1958141326904297,"{""type"":""Point"",""coordinates"":[-58.38386285000001,-34.69095715000001]}"
280,06427,6,2/9/1999,La Matanza,Buenos Aires,33486-6512,4.98,8,invierno,1999-08-30,"[1999-08-30, 1999-08-31, 1999-09-01, 1999-09-02, 1999-09-03, 1999-09-04, 1999-09-05]",true,280,-34.71417289,-58.50890438,7.28,"[17.2, 0, 1.7, 0, 1, 0.6, 6.9]",0.002354845404624939,289.5572878519694,Molisoles,-0.0011206865310668945,0.4422423044840495,"{""type"":""Point"",""coordinates"":[-58.50890437999999,-34.71417289000001]}"
281,10035,10,15/3/1992,Belen,Catamarca,33927-6638,42.86,2607,verano,1992-03-09,"[1992-03-09, 1992-03-10, 1992-03-11, 1992-03-12, 1992-03-13, 1992-03-14, 1992-03-15]",false,281,-26.94426,-66.73487,5.07,"[1.1, 4.3, 8.7, 7.5, 4.2, 5.4, 2.9]",1.2031197547912598E-4,284.2151158650716,Aridisoles,-0.002864547073841095,0.37775739034016925,"{""type"":""Point"",""coordinates"":[-66.73487,-26.94426]}"
282,06805,6,18/1/1997,Tigre,Buenos Aires,34847-6831,1.44,4,verano,1997-01-13,"[1997-01-13, 1997-01-14, 1997-01-15, 1997-01-16, 1997-01-17, 1997-01-18, 1997-01-19]",true,282,-34.3277116,-58.608687,3.84,"[14.2, 0, 0, 0, 0.2, 9.3, 0]",0.001441657543182373,298.6530564626058,Rio,-0.005414468236267567,0.427859624226888,"{""type"":""Point"",""coordinates"":[-58.608687,-34.3277116]}"
283,06441,6,5/2/1994,La Plata,Buenos Aires,3314-1708,23.31,26,verano,1994-01-31,"[1994-01-31, 1994-02-01, 1994-02-02, 1994-02-03, 1994-02-04, 1994-02-05, 1994-02-06]",false,283,-35.03880607,-58.05930616,0.93,"[0.8, 0.1, 0, 0.3, 4, 0, 0]",9.363889694213867E-5,297.5662473042806,Complejo indiferenci,-0.004785384051501751,0.35642369588216144,"{""type"":""Point"",""coordinates"":[-58.05930616,-35.03880607000001]}"
284,06098,6,28/6/1991,Berisso,Buenos Aires,3314-1708,0.7,7,invierno,1991-06-24,"[1991-06-24, 1991-06-25, 1991-06-26, 1991-06-27, 1991-06-28, 1991-06-29, 1991-06-30]",true,284,-34.84587606,-57.87973336,3.58,"[0, 0, 0, 0, 0, 0, 0]",,,Miscelaneas,,,"{""type"":""Point"",""coordinates"":[-57.87973336,-34.84587606]}"
285,06245,6,19/2/2000,Ensenada,Buenos Aires,3314-1708,6.45,8,verano,2000-02-14,"[2000-02-14, 2000-02-15, 2000-02-16, 2000-02-17, 2000-02-18, 2000-02-19, 2000-02-20]",true,285,-34.87584856,-57.9336299,5.71,"[0, 0, 0, 0, 0, 0, 4.6]",6.5267086029052734E-6,293.6285978953044,Miscelaneas,-0.0034814346581697464,0.3793468475341797,"{""type"":""Point"",""coordinates"":[-57.9336299,-34.875848559999994]}"
286,06490,6,11/9/2012,Lomas de Zamora,Buenos Aires,35405-6949,5.53,9,invierno,2012-09-10,"[2012-09-10, 2012-09-11, 2012-09-12, 2012-09-13, 2012-09-14, 2012-09-15, 2012-09-16]",true,286,-34.73790272,-58.44067537,3,"[0, 0, 0, 0, 0, 0, 0.8]",1.2446939945220947E-4,285.90329996744794,Miscelaneas,-0.0028958050534129143,0.4255828857421875,"{""type"":""Point"",""coordinates"":[-58.44067537000001,-34.73790272]}"
287,06756,6,22/7/2010,San Isidro,Buenos Aires,53-53,1.29,24,invierno,2010-07-19,"[2010-07-19, 2010-07-20, 2010-07-21, 2010-07-22, 2010-07-23, 2010-07-24, 2010-07-25]",true,287,-34.47940181,-58.5074044,5.81,"[15, 0.5, 0, 0, 0, 0, 1.8]",,,Rio,,,"{""type"":""Point"",""coordinates"":[-58.507404400000006,-34.47940181]}"
288,06749,6,19/11/1994,San Fernando,Buenos Aires,34847-6831,5.62,5,primavera,1994-11-14,"[1994-11-14, 1994-11-15, 1994-11-16, 1994-11-17, 1994-11-18, 1994-11-19, 1994-11-20]",true,288,-34.2256455,-58.5931568,3.84,"[0.4, 0.1, 0.2, 0, 0, 0, 0]",5.751848220825195E-6,295.7945384979248,Rio,-0.004823995754122734,0.43695322672526044,"{""type"":""Point"",""coordinates"":[-58.5931568,-34.2256455]}"
289,06371,6,7/5/1994,General San Martin,Buenos Aires,36837-7237,8.51,8,otoño,1994-05-02,"[1994-05-02, 1994-05-03, 1994-05-04, 1994-05-05, 1994-05-06, 1994-05-07, 1994-05-08]",true,289,-34.56734338,-58.58431125,17.23,"[9.8, 1.6, 0, 0, 11.8, 2.7, 22.1]",1.8838047981262207E-4,290.982967376709,Miscelaneas,-6.759427487850189E-4,0.47148895263671875,"{""type"":""Point"",""coordinates"":[-58.58431125,-34.56734338]}"
290,06427,6,8/5/2011,La Matanza,Buenos Aires,33486-6512,4.98,8,otoño,2011-05-02,"[2011-05-02, 2011-05-03, 2011-05-04, 2011-05-05, 2011-05-06, 2011-05-07, 2011-05-08]",true,290,-34.71417289,-58.50890438,7.28,"[0, 0, 0, 0, 0, 0, 0]",7.480382919311523E-5,282.93458366394043,Molisoles,-0.0020852023735642433,0.4416796366373698,"{""type"":""Point"",""coordinates"":[-58.50890437999999,-34.71417289000001]}"
291,14021,14,1/3/1998,Colon,Cordoba,33948-6745,20.69,355,verano,1998-02-23,"[1998-02-23, 1998-02-24, 1998-02-25, 1998-02-26, 1998-02-27, 1998-02-28, 1998-03-01]",false,291,-31.25624481,-63.95340394,0.93,"[3.6, 0.2, 0, 0.1, 0.2, 0, 0]",1.0409951210021973E-4,291.1365852355957,Miscelaneas,-0.0010533956810832024,0.37894948323567706,"{""type"":""Point"",""coordinates"":[-63.953403939999994,-31.256244809999995]}"
292,26007,26,4/8/1992,Biedma,Chubut,32798-6301,46.39,228,invierno,1992-08-03,"[1992-08-03, 1992-08-04, 1992-08-05, 1992-08-06, 1992-08-07, 1992-08-08, 1992-08-09]",false,292,-42.32925797,-65.63134766,4.19,"[0, 0, 0, 2, 0, 0, 0]",5.960464477539063E-8,277.1339880625407,Aridisoles,-5.167974159121513E-4,0.23560333251953125,"{""type"":""Point"",""coordinates"":[-65.63134766,-42.32925797]}"
293,82070,82,25/3/1999,Las Colonias,Santa Fe,6856-2113,19.32,40,otoño,1999-03-22,"[1999-03-22, 1999-03-23, 1999-03-24, 1999-03-25, 1999-03-26, 1999-03-27, 1999-03-28]",false,293,-31.6618986,-61.0112577,0,"[0.1, 0.3, 1.4, 39.6, 14.5, 2.5, 36.8]",2.89231538772583E-5,297.0968774159749,Molisoles,-0.0037766452878713608,0.4449564615885417,"{""type"":""Point"",""coordinates"":[-61.0112577,-31.6618986]}"
294,82070,82,18/9/2014,Las Colonias,Santa Fe,6856-2113,19.32,40,invierno,2014-09-15,"[2014-09-15, 2014-09-16, 2014-09-17, 2014-09-18, 2014-09-19, 2014-09-20, 2014-09-21]",false,294,-31.6618986,-61.0112577,0,"[0, 0, 0, 0, 0, 0, 0]",2.3990869522094727E-6,289.03523445129395,Molisoles,-0.0032151248306035995,0.4765758514404297,"{""type"":""Point"",""coordinates"":[-61.0112577,-31.6618986]}"
295,82021,82,11/9/1993,Castellanos,Santa Fe,36829-7232,43.75,69,invierno,1993-09-06,"[1993-09-06, 1993-09-07, 1993-09-08, 1993-09-09, 1993-09-10, 1993-09-11, 1993-09-12]",false,295,-31.38184929,-61.37005997,1.09,"[0, 0, 0, 0, 0, 0, 0]",2.4577975273132324E-4,289.6376190185547,Alfisoles,-0.0022424114868044853,0.37284088134765625,"{""type"":""Point"",""coordinates"":[-61.37005997,-31.38184929000001]}"
296,82049,82,15/11/1994,General Obligado,Santa Fe,32822-6509,17.99,58,primavera,1994-11-14,"[1994-11-14, 1994-11-15, 1994-11-16, 1994-11-17, 1994-11-18, 1994-11-19, 1994-11-20]",false,296,-28.6765561,-59.7497004,1.41,"[2, 4.7, 2.7, 22.8, 0, 0, 0]",1.779496669769287E-4,298.8077220916748,Alfisoles,-0.005222160369157791,0.4544455210367839,"{""type"":""Point"",""coordinates"":[-59.7497004,-28.676556099999996]}"
297,82070,82,10/9/1999,Las Colonias,Santa Fe,6856-2113,19.32,40,invierno,1999-09-06,"[1999-09-06, 1999-09-07, 1999-09-08, 1999-09-09, 1999-09-10, 1999-09-11, 1999-09-12]",false,297,-31.6618986,-61.0112577,0,"[0.8, 23.9, 0, 0.2, 0, 0, 0]",8.80211591720581E-5,292.31359990437824,Molisoles,-0.0015889499336481094,0.4838205973307292,"{""type"":""Point"",""coordinates"":[-61.0112577,-31.6618986]}"
298,82070,82,14/8/2004,Las Colonias,Santa Fe,6856-2113,19.32,40,invierno,2004-08-09,"[2004-08-09, 2004-08-10, 2004-08-11, 2004-08-12, 2004-08-13, 2004-08-14, 2004-08-15]",false,298,-31.6618986,-61.0112577,0,"[0, 0, 0.3, 0, 0, 0, 0.3]",1.424551010131836E-5,281.7912953694661,Molisoles,-0.0016565006226301193,0.41893895467122394,"{""type"":""Point"",""coordinates"":[-61.0112577,-31.6618986]}"
299,82063,82,12/9/2000,La Capital,Santa Fe,103-103,23.73,25,invierno,2000-09-11,"[2000-09-11, 2000-09-12, 2000-09-13, 2000-09-14, 2000-09-15, 2000-09-16, 2000-09-17]",false,299,-31.18858147,-60.62677383,2.15,"[8.7, 1.4, 3.2, 5.8, 0.1, 0, 0.1]",0.01044684648513794,288.99157333374023,Molisoles,-0.004090668633580208,0.4343605041503906,"{""type"":""Point"",""coordinates"":[-60.62677383,-31.18858147]}"
300,02012,2,4/5/2001,Comuna 12,Capital Federal,54-54,3.13,20,otoño,2001-04-30,"[2001-04-30, 2001-05-01, 2001-05-02, 2001-05-03, 2001-05-04, 2001-05-05, 2001-05-06]",true,300,-34.56062514,-58.47494475,0.93,"[10.3, 7.8, 0, 0, 0, 0, 0]",5.148053169250488E-4,285.9990297953288,Miscelaneas,-0.0012904349714517593,0.31531397501627606,"{""type"":""Point"",""coordinates"":[-58.474944750000006,-34.560625140000006]}"
301,02002,2,13/2/2008,Comuna 2,Capital Federal,85-85,1.52,30,verano,2008-02-11,"[2008-02-11, 2008-02-12, 2008-02-13, 2008-02-14, 2008-02-15, 2008-02-16, 2008-02-17]",true,301,-34.58587601,-58.39499618,1.85,"[0.1, 0, 0.3, 0, 0, 0, 0]",2.124309539794922E-4,291.6969706217448,Miscelaneas,-0.005050785839557648,0.38259251912434894,"{""type"":""Point"",""coordinates"":[-58.39499618,-34.58587601000001]}"
302,02015,2,16/1/1996,Comuna 15,Capital Federal,36837-7237,2.81,29,verano,1996-01-15,"[1996-01-15, 1996-01-16, 1996-01-17, 1996-01-18, 1996-01-19, 1996-01-20, 1996-01-21]",true,302,-34.59294425,-58.48867142,4.63,"[0.1, 0, 4.4, 0, 0, 0, 0]",1.1162459850311279E-4,294.5329704284668,Miscelaneas,-0.004063778556883335,0.25261179606119794,"{""type"":""Point"",""coordinates"":[-58.48867142,-34.59294425]}"
303,02014,2,18/10/2012,Comuna 14,Capital Federal,85-85,2.68,24,primavera,2012-10-15,"[2012-10-15, 2012-10-16, 2012-10-17, 2012-10-18, 2012-10-19, 2012-10-20, 2012-10-21]",true,303,-34.57389998,-58.42243645,5.28,"[7.9, 44.3, 1.2, 0, 1.2, 0.2, 2]",0.0011031031608581543,293.1119505564372,Miscelaneas,-0.0028871791437268257,0.30712000528971356,"{""type"":""Point"",""coordinates"":[-58.42243645,-34.57389997999999]}"
304,02013,2,7/6/1997,Comuna 13,Capital Federal,54-54,3.99,10,otoño,1997-06-02,"[1997-06-02, 1997-06-03, 1997-06-04, 1997-06-05, 1997-06-06, 1997-06-07, 1997-06-08]",true,304,-34.55488152,-58.4502891,3.85,"[1.3, 0, 1.5, 14.6, 0, 1.1, 0]",1.1239200830459595E-4,287.0367368062337,Miscelaneas,-9.230226278305054E-4,0.3401711781819661,"{""type"":""Point"",""coordinates"":[-58.4502891,-34.55488152]}"
305,06861,6,15/1/2009,Vicente Lopez,Buenos Aires,36837-7237,3.72,28,verano,2009-01-12,"[2009-01-12, 2009-01-13, 2009-01-14, 2009-01-15, 2009-01-16, 2009-01-17, 2009-01-18]",true,305,-34.52591497,-58.53576394,1.13,"[0, 3, 0, 1.1, 0, 6.4, 2.2]",,,Miscelaneas,,,"{""type"":""Point"",""coordinates"":[-58.53576394000001,-34.52591497]}"
306,06609,6,11/9/1998,Pehuajo,Buenos Aires,6725-2212,72.84,89,invierno,1998-09-07,"[1998-09-07, 1998-09-08, 1998-09-09, 1998-09-10, 1998-09-11, 1998-09-12, 1998-09-13]",false,306,-35.6179927,-62.0046671,1.47,"[0.1, 0, 0, 0, 0, 0, 0]",1.6675889492034912E-4,287.9970817565918,Molisoles,-0.0024711396545171738,0.3828818003336589,"{""type"":""Point"",""coordinates"":[-62.0046671,-35.61799270000001]}"
307,06441,6,2/9/1995,La Plata,Buenos Aires,3314-1708,23.31,26,invierno,1995-08-28,"[1995-08-28, 1995-08-29, 1995-08-30, 1995-08-31, 1995-09-01, 1995-09-02, 1995-09-03]",false,307,-35.03880607,-58.05930616,0.93,"[0, 0.2, 0, 0, 0, 0, 0]",2.002716064453125E-5,286.32081031799316,Complejo indiferenci,-0.0018760096281766891,0.40987714131673175,"{""type"":""Point"",""coordinates"":[-58.05930616,-35.03880607000001]}"
308,06770,6,11/7/2000,San Pedro,Buenos Aires,33257-6395,3.79,14,invierno,2000-07-10,"[2000-07-10, 2000-07-11, 2000-07-12, 2000-07-13, 2000-07-14, 2000-07-15, 2000-07-16]",true,308,-33.6362648,-59.7862782,1.45,"[14.2, 5.4, 0.9, 0, 0, 0, 0]",0.002175658941268921,278.4954897562663,Rio,-0.002562718465924263,0.5629704793294271,"{""type"":""Point"",""coordinates"":[-59.78627819999999,-33.6362648]}"
309,06392,6,15/6/1999,General Villegas,Buenos Aires,33055-6609,38.59,123,otoño,1999-06-14,"[1999-06-14, 1999-06-15, 1999-06-16, 1999-06-17, 1999-06-18, 1999-06-19, 1999-06-20]",false,309,-34.8579191,-63.1611931,3.58,"[0, 0, 0, 4.1, 0.1, 0, 0]",8.925795555114746E-6,285.1172739664714,Molisoles,-7.522739470005035E-4,0.29849688212076825,"{""type"":""Point"",""coordinates"":[-63.1611931,-34.8579191]}"
310,06616,6,10/2/1994,Pellegrini,Buenos Aires,9549-2809,91.14,115,verano,1994-02-07,"[1994-02-07, 1994-02-08, 1994-02-09, 1994-02-10, 1994-02-11, 1994-02-12, 1994-02-13]",false,310,-36.3151294,-63.2094531,1.15,"[0, 18, 1.1, 0, 0, 0.8, 5.7]",2.917647361755371E-5,294.3121922810872,Molisoles,-0.0031339358538389206,0.08887736002604167,"{""type"":""Point"",""coordinates"":[-63.2094531,-36.3151294]}"
311,06497,6,9/3/2004,Lujan,Buenos Aires,7-7,7.25,39,verano,2004-03-08,"[2004-03-08, 2004-03-09, 2004-03-10, 2004-03-11, 2004-03-12, 2004-03-13, 2004-03-14]",true,311,-34.4619848,-59.1744878,0.93,"[0, 0, 0, 0.6, 0.6, 0, 0]",4.723668098449707E-5,293.81095695495605,Complejo indiferenci,-0.0020215511322021484,0.3107217152913411,"{""type"":""Point"",""coordinates"":[-59.1744878,-34.4619848]}"
312,06840,6,27/12/2014,Tres de Febrero,Buenos Aires,36837-7237,6.8,27,verano,2014-12-22,"[2014-12-22, 2014-12-23, 2014-12-24, 2014-12-25, 2014-12-26, 2014-12-27, 2014-12-28]",true,312,-34.60887295,-58.56366446,1.85,"[0.3, 0, 0, 0, 2.2, 8.4, 0]",1.599639654159546E-4,289.9740111033122,Miscelaneas,-0.00553908571600914,0.40182940165201825,"{""type"":""Point"",""coordinates"":[-58.563664460000005,-34.60887294999999]}"
313,06568,6,26/5/1994,Moron,Buenos Aires,33486-6512,15.92,14,otoño,1994-05-23,"[1994-05-23, 1994-05-24, 1994-05-25, 1994-05-26, 1994-05-27, 1994-05-28, 1994-05-29]",false,313,-34.6644131,-58.64564271,3.58,"[11.6, 0, 0.1, 0, 0, 0, 0]",0.0041955262422561646,292.1832631429036,Miscelaneas,-0.0010176915675401688,0.45975494384765625,"{""type"":""Point"",""coordinates"":[-58.645642710000004,-34.6644131]}"
314,06028,6,17/6/1991,Almirante Brown,Buenos Aires,35405-6949,1.13,28,otoño,1991-06-17,"[1991-06-17, 1991-06-18, 1991-06-19, 1991-06-20, 1991-06-21, 1991-06-22, 1991-06-23]",true,314,-34.80155807,-58.39146772,0.93,"[2.7, 44, 0, 0, 0, 0, 0]",2.2649765014648438E-5,286.36504554748535,Miscelaneas,-4.968354478478432E-4,0.4721520741780599,"{""type"":""Point"",""coordinates"":[-58.39146772000001,-34.80155807]}"
315,06260,6,22/1/2011,Esteban Echeverria,Buenos Aires,33486-6512,6.94,23,verano,2011-01-17,"[2011-01-17, 2011-01-18, 2011-01-19, 2011-01-20, 2011-01-21, 2011-01-22, 2011-01-23]",true,315,-34.88497914,-58.47780994,1.46,"[0, 0, 38.1, 0, 0, 0, 0]",6.8247318267822266E-6,294.66630999247235,Miscelaneas,-0.0041905855759978294,0.3852240244547526,"{""type"":""Point"",""coordinates"":[-58.47780994,-34.884979140000006]}"
316,06035,6,1/5/2003,Avellaneda,Buenos Aires,35411-6952,1.59,6,otoño,2003-04-28,"[2003-04-28, 2003-04-29, 2003-04-30, 2003-05-01, 2003-05-02, 2003-05-03, 2003-05-04]",true,316,-34.67500565,-58.31056343,3.38,"[0, 6.6, 0, 0, 0, 0, 0]",,,Miscelaneas,,,"{""type"":""Point"",""coordinates"":[-58.31056343,-34.675005649999996]}"
317,06434,6,24/5/1990,Lanus,Buenos Aires,8891-2706,4.6,5,otoño,1990-05-21,"[1990-05-21, 1990-05-22, 1990-05-23, 1990-05-24, 1990-05-25, 1990-05-26, 1990-05-27]",true,317,-34.69095715,-58.38386285,4.6,"[0, 0, 0, 0, 0, 0.2, 0]",3.085136413574219E-4,283.1055965423584,Miscelaneas,-0.002000901848077774,0.42226600646972656,"{""type"":""Point"",""coordinates"":[-58.38386285000001,-34.69095715000001]}"
318,06252,6,17/11/2011,Escobar,Buenos Aires,42-42,1.31,4,primavera,2011-11-14,"[2011-11-14, 2011-11-15, 2011-11-16, 2011-11-17, 2011-11-18, 2011-11-19, 2011-11-20]",true,318,-34.3007971,-58.7215474,2.24,"[0, 0, 0, 0, 0, 3.3, 13.6]",1.341104507446289E-7,292.9480673472087,Molisoles,-0.0036271102726459503,0.35435231526692706,"{""type"":""Point"",""coordinates"":[-58.7215474,-34.3007971]}"
319,06658,6,3/6/1995,Quilmes,Buenos Aires,35407-6950,4.25,3,otoño,1995-05-29,"[1995-05-29, 1995-05-30, 1995-05-31, 1995-06-01, 1995-06-02, 1995-06-03, 1995-06-04]",true,319,-34.70037841,-58.27664278,2.17,"[0, 0, 1.1, 1, 0, 0, 0]",,,Miscelaneas,,,"{""type"":""Point"",""coordinates"":[-58.276642779999996,-34.70037841]}"
320,06490,6,4/2/2006,Lomas de Zamora,Buenos Aires,35405-6949,5.53,9,verano,2006-01-30,"[2006-01-30, 2006-01-31, 2006-02-01, 2006-02-02, 2006-02-03, 2006-02-04, 2006-02-05]",true,320,-34.73790272,-58.44067537,3,"[1.6, 0, 16.2, 1.5, 1, 19.2, 0]",2.034008502960205E-4,296.0629603068034,Miscelaneas,-0.0031219404190778732,0.1794910430908203,"{""type"":""Point"",""coordinates"":[-58.44067537000001,-34.73790272]}"
321,06427,6,17/10/2011,La Matanza,Buenos Aires,33486-6512,4.98,8,primavera,2011-10-17,"[2011-10-17, 2011-10-18, 2011-10-19, 2011-10-20, 2011-10-21, 2011-10-22, 2011-10-23]",true,321,-34.71417289,-58.50890438,7.28,"[0, 8.5, 0.1, 0, 0, 0.2, 0]",5.307793617248535E-5,288.0316918690999,Molisoles,-0.003846103325486183,0.36768658955891925,"{""type"":""Point"",""coordinates"":[-58.50890437999999,-34.71417289000001]}"
322,06056,6,11/1/2009,Bahia Blanca,Buenos Aires,34120-6732,48.75,47,verano,2009-01-05,"[2009-01-05, 2009-01-06, 2009-01-07, 2009-01-08, 2009-01-09, 2009-01-10, 2009-01-11]",false,322,-38.68387462,-62.21595631,0,"[0, 4.2, 0.5, 0, 0, 0, 0]",1.043081283569336E-7,300.11805470784503,Molisoles,-0.0012542158365249634,0.14722442626953125,"{""type"":""Point"",""coordinates"":[-62.21595631,-38.68387462]}"
323,14021,14,13/7/1997,Colon,Cordoba,33948-6745,20.69,355,invierno,1997-07-07,"[1997-07-07, 1997-07-08, 1997-07-09, 1997-07-10, 1997-07-11, 1997-07-12, 1997-07-13]",false,323,-31.25624481,-63.95340394,0.93,"[1.6, 0.1, 5.6, 2.6, 2.2, 3.2, 0]",9.000301361083984E-6,283.33934275309247,Miscelaneas,-4.586614668369293E-4,0.23168118794759116,"{""type"":""Point"",""coordinates"":[-63.953403939999994,-31.256244809999995]}"
324,14021,14,19/12/1998,Colon,Cordoba,33948-6745,20.69,355,primavera,1998-12-14,"[1998-12-14, 1998-12-15, 1998-12-16, 1998-12-17, 1998-12-18, 1998-12-19, 1998-12-20]",false,324,-31.25624481,-63.95340394,0.93,"[0, 1.2, 18.1, 0, 0, 0.6, 24.9]",2.123415470123291E-5,295.3226718902588,Miscelaneas,-0.0028216522186994553,0.33358192443847656,"{""type"":""Point"",""coordinates"":[-63.953403939999994,-31.256244809999995]}"
325,14021,14,14/8/1993,Colon,Cordoba,33948-6745,20.69,355,invierno,1993-08-09,"[1993-08-09, 1993-08-10, 1993-08-11, 1993-08-12, 1993-08-13, 1993-08-14, 1993-08-15]",false,325,-31.25624481,-63.95340394,0.93,"[0, 0, 0, 0, 0, 0, 0]",1.3870000839233398E-4,279.4360707600911,Miscelaneas,-0.0010250601917505264,0.22085952758789062,"{""type"":""Point"",""coordinates"":[-63.953403939999994,-31.256244809999995]}"
326,46042,46,17/2/2006,Chilecito,La Rioja,34179-6743,13,1669,verano,2006-02-13,"[2006-02-13, 2006-02-14, 2006-02-15, 2006-02-16, 2006-02-17, 2006-02-18, 2006-02-19]",true,326,-29.10233846,-67.60548106,10.5,"[0.8, 0, 0.2, 3.2, 0.6, 1.3, 1.9]",0.009911730885505676,287.1895058949788,Roca,-0.003178795799612999,0.3123881022135417,"{""type"":""Point"",""coordinates"":[-67.60548106,-29.102338459999995]}"
327,18021,18,7/3/2015,Capital,Corrientes,6611-2085,6.4,45,verano,2015-03-02,"[2015-03-02, 2015-03-03, 2015-03-04, 2015-03-05, 2015-03-06, 2015-03-07, 2015-03-08]",true,327,-27.4064,-58.78276,12.77,"[3.8, 4.3, 8.2, 4.5, 2.9, 0.7, 0]",0.0011380165815353394,299.7277838389079,Rio,-0.004540787078440189,0.38486671447753906,"{""type"":""Point"",""coordinates"":[-58.78276,-27.4064]}"
328,06805,6,20/4/2002,Tigre,Buenos Aires,34847-6831,1.44,4,otoño,2002-04-15,"[2002-04-15, 2002-04-16, 2002-04-17, 2002-04-18, 2002-04-19, 2002-04-20, 2002-04-21]",true,328,-34.3277116,-58.608687,3.84,"[9.7, 42.2, 9.5, 0, 0.1, 0, 0]",5.385875701904297E-4,290.57216199239093,Rio,-0.0018203845247626305,0.44778696695963544,"{""type"":""Point"",""coordinates"":[-58.608687,-34.3277116]}"
329,82049,82,9/1/2015,General Obligado,Santa Fe,32822-6509,17.99,58,verano,2015-01-05,"[2015-01-05, 2015-01-06, 2015-01-07, 2015-01-08, 2015-01-09, 2015-01-10, 2015-01-11]",false,329,-28.6765561,-59.7497004,1.41,"[1.2, 0, 30.4, 5.3, 7.6, 5.2, 18.9]",1.8090009689331055E-5,300.09143193562824,Alfisoles,-0.006107354536652565,0.3988348642985026,"{""type"":""Point"",""coordinates"":[-59.7497004,-28.676556099999996]}"
330,82098,82,23/1/2005,San Javier,Santa Fe,6247-1929,17.29,60,verano,2005-01-17,"[2005-01-17, 2005-01-18, 2005-01-19, 2005-01-20, 2005-01-21, 2005-01-22, 2005-01-23]",false,330,-29.42420679,-59.97955475,5.55,"[0, 0, 0, 0, 0, 0, 0]",4.276633262634277E-6,297.94876925150555,Complejo indiferenci,-0.004513395018875599,0.3464762369791667,"{""type"":""Point"",""coordinates"":[-59.97955475,-29.424206790000007]}"
331,82063,82,15/3/1991,La Capital,Santa Fe,103-103,23.73,25,verano,1991-03-11,"[1991-03-11, 1991-03-12, 1991-03-13, 1991-03-14, 1991-03-15, 1991-03-16, 1991-03-17]",false,331,-31.18858147,-60.62677383,2.15,"[1, 0.3, 0, 0, 0, 0, 0]",1.539289951324463E-4,296.86681747436523,Molisoles,-0.00341921579092741,0.4630393981933594,"{""type"":""Point"",""coordinates"":[-60.62677383,-31.18858147]}"
332,06427,6,15/9/1994,La Matanza,Buenos Aires,33486-6512,4.98,8,invierno,1994-09-12,"[1994-09-12, 1994-09-13, 1994-09-14, 1994-09-15, 1994-09-16, 1994-09-17, 1994-09-18]",true,332,-34.71417289,-58.50890438,7.28,"[0.2, 0, 0.3, 0, 0, 0, 0]",4.6625733375549316E-4,287.8147843678792,Molisoles,-0.001336934044957161,0.3230609893798828,"{""type"":""Point"",""coordinates"":[-58.50890437999999,-34.71417289000001]}"
333,70105,70,6/4/2011,Sarmiento,San Juan,32300-6465,34.88,546,otoño,2011-04-04,"[2011-04-04, 2011-04-05, 2011-04-06, 2011-04-07, 2011-04-08, 2011-04-09, 2011-04-10]",false,333,-32.02091413,-68.39270346,1.43,"[0, 0, 0, 0.1, 0, 0, 0.6]",2.9802322387695312E-8,294.9549140930176,Roca,-1.2120790779590607E-4,0.048220316569010414,"{""type"":""Point"",""coordinates"":[-68.39270346,-32.02091413]}"
334,66133,66,17/9/2000,Rivadavia,Salta,6362-1978,14.31,246,invierno,2000-09-11,"[2000-09-11, 2000-09-12, 2000-09-13, 2000-09-14, 2000-09-15, 2000-09-16, 2000-09-17]",true,334,-22.49881,-62.40759,1,"[0, 0, 0, 0, 0, 0, 0]",8.940696716308594E-8,304.06921005249023,Molisoles,-5.525480955839157E-4,0.1290105183919271,"{""type"":""Point"",""coordinates"":[-62.40759,-22.498810000000002]}"
335,06581,6,13/12/2011,Necochea,Buenos Aires,32742-6427,63.08,124,primavera,2011-12-12,"[2011-12-12, 2011-12-13, 2011-12-14, 2011-12-15, 2011-12-16, 2011-12-17, 2011-12-18]",false,335,-38.085516,-59.2924177,1.5,"[0, 1.5, 0, 0.3, 0, 0, 0]",6.854534149169922E-7,289.17131932576496,Molisoles,-0.004100164398550987,0.312930425008138,"{""type"":""Point"",""coordinates"":[-59.2924177,-38.085516000000005]}"
336,06357,6,26/3/1981,General Pueyrredon,Buenos Aires,3347-1742,17.47,21,otoño,1981-03-23,"[1981-03-23, 1981-03-24, 1981-03-25, 1981-03-26, 1981-03-27, 1981-03-28, 1981-03-29]",false,336,-37.80766254,-57.62989086,5.55,"[2.1, 0, 0.2, 0, 0, 10.1, 4.6]",2.232193946838379E-5,291.52569071451825,Molisoles,-0.0015415763482451439,0.3004614512125651,"{""type"":""Point"",""coordinates"":[-57.62989086,-37.80766254000001]}"
337,06672,6,3/4/1995,Rauch,Buenos Aires,9552-2855,64.46,51,otoño,1995-04-03,"[1995-04-03, 1995-04-04, 1995-04-05, 1995-04-06, 1995-04-07, 1995-04-08, 1995-04-09]",false,337,-36.3845307,-59.0051146,3.61,"[0, 0, 14.7, 17.3, 63.6, 32.1, 3.4]",6.854534149169922E-6,290.6216354370117,Molisoles,-0.0022034291177988052,0.3900292714436849,"{""type"":""Point"",""coordinates"":[-59.0051146,-36.3845307]}"
338,06833,6,24/11/1998,Tres Arroyos,Buenos Aires,36844-7242,76.95,163,primavera,1998-11-23,"[1998-11-23, 1998-11-24, 1998-11-25, 1998-11-26, 1998-11-27, 1998-11-28, 1998-11-29]",false,338,-38.2667152,-60.4002814,2.78,"[16.3, 0, 0, 0, 0, 0, 0]",1.2077391147613525E-4,295.6835257212321,Molisoles,-0.0022370126098394394,0.2070611317952474,"{""type"":""Point"",""coordinates"":[-60.400281400000004,-38.26671519999999]}"
339,06049,6,20/11/2003,Azul,Buenos Aires,32742-6427,7.78,205,primavera,2003-11-17,"[2003-11-17, 2003-11-18, 2003-11-19, 2003-11-20, 2003-11-21, 2003-11-22, 2003-11-23]",true,339,-37.0314689,-59.6042326,2.5,"[52.6, 10.4, 0, 0, 0, 7.2, 0]",0.016815781593322754,286.6913598378499,Molisoles,-0.0022029737010598183,0.4648418426513672,"{""type"":""Point"",""coordinates"":[-59.604232599999996,-37.0314689]}"
340,06581,6,27/7/2008,Necochea,Buenos Aires,32742-6427,63.08,124,invierno,2008-07-21,"[2008-07-21, 2008-07-22, 2008-07-23, 2008-07-24, 2008-07-25, 2008-07-26, 2008-07-27]",false,340,-38.085516,-59.2924177,1.5,"[11.4, 0, 0.4, 2.9, 0, 0, 0]",1.497417688369751E-4,278.8592980702718,Molisoles,-8.454881608486176E-4,0.3952935536702474,"{""type"":""Point"",""coordinates"":[-59.2924177,-38.085516000000005]}"
341,06609,6,27/10/2004,Pehuajo,Buenos Aires,6725-2212,72.84,89,primavera,2004-10-25,"[2004-10-25, 2004-10-26, 2004-10-27, 2004-10-28, 2004-10-29, 2004-10-30, 2004-10-31]",false,341,-35.6179927,-62.0046671,1.47,"[1.6, 1.4, 0, 0, 0.4, 0, 0]",2.7939677238464355E-5,288.4305369059245,Molisoles,-0.004002653993666172,0.4377250671386719,"{""type"":""Point"",""coordinates"":[-62.0046671,-35.61799270000001]}"
342,06609,6,24/7/1995,Pehuajo,Buenos Aires,6725-2212,72.84,89,invierno,1995-07-24,"[1995-07-24, 1995-07-25, 1995-07-26, 1995-07-27, 1995-07-28, 1995-07-29, 1995-07-30]",false,342,-35.6179927,-62.0046671,1.47,"[0, 0, 0, 0, 0, 0, 0]",2.0623207092285156E-5,284.37627665201825,Molisoles,-0.0010298313573002815,0.37132008870442706,"{""type"":""Point"",""coordinates"":[-62.0046671,-35.61799270000001]}"
343,06476,6,11/12/2010,Loberia,Buenos Aires,6903-2151,41.88,172,primavera,2010-12-06,"[2010-12-06, 2010-12-07, 2010-12-08, 2010-12-09, 2010-12-10, 2010-12-11, 2010-12-12]",false,343,-37.7714343,-58.6447231,3.97,"[1.5, 6.2, 0, 0.1, 1.2, 0, 0.3]",2.041459083557129E-6,293.48901049296063,Molisoles,-0.0061418963596224785,0.34625498453776044,"{""type"":""Point"",""coordinates"":[-58.6447231,-37.77143430000001]}"
344,06448,6,19/10/2002,Laprida,Buenos Aires,36845-7243,62.27,202,primavera,2002-10-14,"[2002-10-14, 2002-10-15, 2002-10-16, 2002-10-17, 2002-10-18, 2002-10-19, 2002-10-20]",false,344,-37.52471,-60.96114,1.49,"[12.9, 8.7, 0, 0, 0, 11, 33.7]",0.005289986729621887,290.94349670410156,Molisoles,-0.00292394682765007,0.4748045603434245,"{""type"":""Point"",""coordinates"":[-60.96114,-37.52470999999999]}"
345,06014,6,7/8/1993,Adolfo Gonzales Chaves,Buenos Aires,6965-2207,57.47,192,invierno,1993-08-02,"[1993-08-02, 1993-08-03, 1993-08-04, 1993-08-05, 1993-08-06, 1993-08-07, 1993-08-08]",false,345,-37.85445023,-59.95879364,2.19,"[0, 0, 0, 0, 0, 0, 0]",3.342330455780029E-5,276.9009094238281,Molisoles,-7.3956698179245E-4,0.39876429239908856,"{""type"":""Point"",""coordinates"":[-59.95879364,-37.85445023]}"
346,06742,6,22/2/2000,San Cayetano,Buenos Aires,6903-2151,83.21,24,verano,2000-02-21,"[2000-02-21, 2000-02-22, 2000-02-23, 2000-02-24, 2000-02-25, 2000-02-26, 2000-02-27]",false,346,-38.6740577,-59.49935949,0,"[0, 0, 0, 0, 23, 26.6, 22.3]",6.213784217834473E-6,294.36366780598956,Molisoles,-0.004276452586054802,0.1975104014078776,"{""type"":""Point"",""coordinates"":[-59.49935949,-38.6740577]}"
347,06581,6,19/4/1999,Necochea,Buenos Aires,32742-6427,63.08,124,otoño,1999-04-19,"[1999-04-19, 1999-04-20, 1999-04-21, 1999-04-22, 1999-04-23, 1999-04-24, 1999-04-25]",false,347,-38.085516,-59.2924177,1.5,"[0, 0, 0, 0, 0, 0, 0]",1.3113021850585938E-6,285.206511815389,Molisoles,-0.0014431625604629517,0.29643821716308594,"{""type"":""Point"",""coordinates"":[-59.2924177,-38.085516000000005]}"
348,06707,6,23/9/2004,Saladillo,Buenos Aires,9022-2838,28.23,40,invierno,2004-09-20,"[2004-09-20, 2004-09-21, 2004-09-22, 2004-09-23, 2004-09-24, 2004-09-25, 2004-09-26]",false,348,-35.6504504,-59.8096018,7.74,"[0, 0, 0, 0, 0, 0, 0]",1.7195940017700195E-5,283.47268613179523,Molisoles,-0.0029987581074237823,0.38621266682942706,"{""type"":""Point"",""coordinates"":[-59.8096018,-35.6504504]}"
349,06532,6,12/5/1990,Mercedes,Buenos Aires,7-7,20.35,37,otoño,1990-05-07,"[1990-05-07, 1990-05-08, 1990-05-09, 1990-05-10, 1990-05-11, 1990-05-12, 1990-05-13]",false,349,-34.64501572,-59.35927582,3.5,"[0, 0, 11.8, 0, 0, 3.8, 8.2]",1.6137957572937012E-5,287.1575183868408,Molisoles,-9.922729805111885E-4,0.41262181599934894,"{""type"":""Point"",""coordinates"":[-59.35927582,-34.64501572]}"
350,06581,6,23/4/2001,Necochea,Buenos Aires,32742-6427,63.08,124,otoño,2001-04-23,"[2001-04-23, 2001-04-24, 2001-04-25, 2001-04-26, 2001-04-27, 2001-04-28, 2001-04-29]",false,350,-38.085516,-59.2924177,1.5,"[0.3, 0, 0, 0, 0, 0, 0]",6.258487701416016E-6,284.1192264556885,Molisoles,-0.0017114048823714256,0.3537362416585286,"{""type"":""Point"",""coordinates"":[-59.2924177,-38.085516000000005]}"
351,06742,6,13/5/1992,San Cayetano,Buenos Aires,6903-2151,83.21,24,otoño,1992-05-11,"[1992-05-11, 1992-05-12, 1992-05-13, 1992-05-14, 1992-05-15, 1992-05-16, 1992-05-17]",false,351,-38.6740577,-59.49935949,0,"[50.1, 7.1, 10.6, 0, 0, 0, 4.4]",6.527602672576904E-4,288.4798838297526,Molisoles,-8.943043649196625E-4,0.3326250712076823,"{""type"":""Point"",""coordinates"":[-59.49935949,-38.6740577]}"
352,06638,6,21/9/1995,Pilar,Buenos Aires,34357-5904,12.77,16,invierno,1995-09-18,"[1995-09-18, 1995-09-19, 1995-09-20, 1995-09-21, 1995-09-22, 1995-09-23, 1995-09-24]",true,352,-34.42200558,-58.95283788,1.46,"[0.3, 0, 0, 0, 0.3, 0, 0]",1.7896294593811035E-5,289.12310727437335,Molisoles,-0.002029089257121086,0.32605870564778644,"{""type"":""Point"",""coordinates"":[-58.95283788,-34.42200558]}"
353,06532,6,25/9/1995,Mercedes,Buenos Aires,7-7,20.35,37,primavera,1995-09-25,"[1995-09-25, 1995-09-26, 1995-09-27, 1995-09-28, 1995-09-29, 1995-09-30, 1995-10-01]",false,353,-34.64501572,-59.35927582,3.5,"[0.8, 0, 0, 0, 0.5, 0, 0]",2.714991569519043E-5,290.79235649108887,Molisoles,-0.001270713284611702,0.28910191853841144,"{""type"":""Point"",""coordinates"":[-59.35927582,-34.64501572]}"
354,06595,6,14/9/2010,Olavarria,Buenos Aires,36844-7242,15.37,185,invierno,2010-09-13,"[2010-09-13, 2010-09-14, 2010-09-15, 2010-09-16, 2010-09-17, 2010-09-18, 2010-09-19]",false,354,-36.8410918,-60.4478581,1.16,"[0.3, 0, 0.7, 0.2, 0, 0, 0]",4.5746564865112305E-6,281.9235382080078,Molisoles,-0.001042214222252369,0.3847802480061849,"{""type"":""Point"",""coordinates"":[-60.4478581,-36.841091799999994]}"
355,06077,6,13/9/2014,Bartolome Mitre,Buenos Aires,6745-2129,17.6,31,invierno,2014-09-08,"[2014-09-08, 2014-09-09, 2014-09-10, 2014-09-11, 2014-09-12, 2014-09-13, 2014-09-14]",false,355,-33.9628001,-59.8615291,2.16,"[0, 49.5, 0, 0, 0, 5.6, 30.4]",1.354515552520752E-5,289.6595706939697,Molisoles,-0.0024705417454242706,0.4557902018229167,"{""type"":""Point"",""coordinates"":[-59.861529100000006,-33.9628001]}"
356,06560,6,13/3/1993,Moreno,Buenos Aires,42-42,17.53,33,verano,1993-03-08,"[1993-03-08, 1993-03-09, 1993-03-10, 1993-03-11, 1993-03-12, 1993-03-13, 1993-03-14]",false,356,-34.55865957,-58.81630109,4.33,"[0, 0, 0, 0, 0.1, 1.9, 1]",1.882016658782959E-5,295.724578221639,Complejo indiferenci,-0.0029579196125268936,0.2837899525960286,"{""type"":""Point"",""coordinates"":[-58.81630109,-34.55865957]}"
357,06672,6,28/6/2015,Rauch,Buenos Aires,9552-2855,64.46,51,invierno,2015-06-22,"[2015-06-22, 2015-06-23, 2015-06-24, 2015-06-25, 2015-06-26, 2015-06-27, 2015-06-28]",false,357,-36.3845307,-59.0051146,3.61,"[0, 0, 0, 1.8, 4, 9.3, 4.4]",1.1771917343139648E-6,280.57166989644367,Molisoles,-6.332173943519592E-4,0.34653472900390625,"{""type"":""Point"",""coordinates"":[-59.0051146,-36.3845307]}"
358,06049,6,28/7/2014,Azul,Buenos Aires,32742-6427,7.78,205,invierno,2014-07-28,"[2014-07-28, 2014-07-29, 2014-07-30, 2014-07-31, 2014-08-01, 2014-08-02, 2014-08-03]",true,358,-37.0314689,-59.6042326,2.5,"[0, 0.5, 0, 15.3, 0.6, 0.3, 0.1]",1.4901161193847656E-7,279.52196947733563,Molisoles,-0.0010175611823797226,0.4222799936930339,"{""type"":""Point"",""coordinates"":[-59.604232599999996,-37.0314689]}"
359,06770,6,6/8/2003,San Pedro,Buenos Aires,33257-6395,3.79,14,invierno,2003-08-04,"[2003-08-04, 2003-08-05, 2003-08-06, 2003-08-07, 2003-08-08, 2003-08-09, 2003-08-10]",true,359,-33.6362648,-59.7862782,1.45,"[0.8, 0, 1.5, 0, 0.9, 0, 0]",0.0013760030269622803,287.5238920847575,Rio,-7.829200476408005E-4,0.5556443532307943,"{""type"":""Point"",""coordinates"":[-59.78627819999999,-33.6362648]}"
360,06427,6,16/6/2013,La Matanza,Buenos Aires,33486-6512,4.98,8,otoño,2013-06-10,"[2013-06-10, 2013-06-11, 2013-06-12, 2013-06-13, 2013-06-14, 2013-06-15, 2013-06-16]",true,360,-34.71417289,-58.50890438,7.28,"[0, 0, 0, 0, 0, 0, 2.8]",1.2442469596862793E-4,285.64705657958984,Molisoles,-7.53229483962059E-4,0.4091803232828776,"{""type"":""Point"",""coordinates"":[-58.50890437999999,-34.71417289000001]}"
361,06427,6,10/1/2006,La Matanza,Buenos Aires,33486-6512,4.98,8,verano,2006-01-09,"[2006-01-09, 2006-01-10, 2006-01-11, 2006-01-12, 2006-01-13, 2006-01-14, 2006-01-15]",true,361,-34.71417289,-58.50890438,7.28,"[1.9, 14.3, 18.8, 42, 2.9, 9.7, 45.6]",2.240985631942749E-4,300.3355305989583,Molisoles,-0.003653694875538349,0.25220807393391925,"{""type"":""Point"",""coordinates"":[-58.50890437999999,-34.71417289000001]}"
362,06427,6,1/7/2003,La Matanza,Buenos Aires,33486-6512,4.98,8,invierno,2003-06-30,"[2003-06-30, 2003-07-01, 2003-07-02, 2003-07-03, 2003-07-04, 2003-07-05, 2003-07-06]",true,362,-34.71417289,-58.50890438,7.28,"[2.5, 2.6, 0, 0.2, 44, 0, 0]",2.1505355834960938E-4,286.7835687001546,Molisoles,-6.302176043391228E-4,0.4766763051350911,"{""type"":""Point"",""coordinates"":[-58.50890437999999,-34.71417289000001]}"
363,06833,6,17/12/1992,Tres Arroyos,Buenos Aires,36844-7242,76.95,163,primavera,1992-12-14,"[1992-12-14, 1992-12-15, 1992-12-16, 1992-12-17, 1992-12-18, 1992-12-19, 1992-12-20]",false,363,-38.2667152,-60.4002814,2.78,"[0, 0, 2.5, 0, 0, 0, 0]",5.304813385009766E-6,292.196969350179,Molisoles,-0.005279959179461002,0.3422253926595052,"{""type"":""Point"",""coordinates"":[-60.400281400000004,-38.26671519999999]}"
364,02003,2,28/9/2004,Comuna 3,Capital Federal,85-85,2.82,29,primavera,2004-09-27,"[2004-09-27, 2004-09-28, 2004-09-29, 2004-09-30, 2004-10-01, 2004-10-02, 2004-10-03]",true,364,-34.60909977,-58.40306252,1.46,"[1.1, 0, 0, 0.3, 0, 0.1, 0.5]",3.992021083831787E-4,289.92395337422687,Miscelaneas,-0.0025515779852867126,0.26941998799641925,"{""type"":""Point"",""coordinates"":[-58.403062520000006,-34.60909977000001]}"
365,06098,6,18/6/2005,Berisso,Buenos Aires,3314-1708,0.7,7,otoño,2005-06-13,"[2005-06-13, 2005-06-14, 2005-06-15, 2005-06-16, 2005-06-17, 2005-06-18, 2005-06-19]",true,365,-34.84587606,-57.87973336,3.58,"[3.8, 0, 10.9, 0.4, 0, 0.4, 0]",,,Miscelaneas,,,"{""type"":""Point"",""coordinates"":[-57.87973336,-34.84587606]}"
366,06658,6,21/6/1998,Quilmes,Buenos Aires,35407-6950,4.25,3,otoño,1998-06-15,"[1998-06-15, 1998-06-16, 1998-06-17, 1998-06-18, 1998-06-19, 1998-06-20, 1998-06-21]",true,366,-34.70037841,-58.27664278,2.17,"[2.9, 0.2, 0, 0, 0, 0, 0]",,,Miscelaneas,,,"{""type"":""Point"",""coordinates"":[-58.276642779999996,-34.70037841]}"
367,06505,6,14/5/1997,Magdalena,Buenos Aires,3344-1739,9.75,18,otoño,1997-05-12,"[1997-05-12, 1997-05-13, 1997-05-14, 1997-05-15, 1997-05-16, 1997-05-17, 1997-05-18]",true,367,-35.17544498,-57.51894858,0.93,"[0, 0, 0, 0, 0, 0, 6]",2.16066837310791E-6,292.8100986480713,Complejo indiferenci,-7.968693971633911E-4,0.2937876383463542,"{""type"":""Point"",""coordinates"":[-57.51894857999999,-35.17544498]}"
368,06245,6,26/11/2010,Ensenada,Buenos Aires,3314-1708,6.45,8,primavera,2010-11-22,"[2010-11-22, 2010-11-23, 2010-11-24, 2010-11-25, 2010-11-26, 2010-11-27, 2010-11-28]",true,368,-34.87584856,-57.9336299,5.71,"[1.5, 0.9, 0, 0.4, 0, 4.7, 0]",5.6296586990356445E-5,293.06715393066406,Miscelaneas,-0.002714186906814575,0.2834186553955078,"{""type"":""Point"",""coordinates"":[-57.9336299,-34.875848559999994]}"
369,06119,6,2/6/2009,Brandsen,Buenos Aires,7058-2230,12.02,27,otoño,2009-06-01,"[2009-06-01, 2009-06-02, 2009-06-03, 2009-06-04, 2009-06-05, 2009-06-06, 2009-06-07]",true,369,-34.9854674,-58.1762428,1.46,"[0, 0, 0, 0, 0, 0, 0]",2.294778823852539E-6,283.1731643676758,Molisoles,-7.536699995398521E-4,0.3926239013671875,"{""type"":""Point"",""coordinates"":[-58.176242800000004,-34.98546739999999]}"
370,06427,6,10/8/2005,La Matanza,Buenos Aires,33486-6512,4.98,8,invierno,2005-08-08,"[2005-08-08, 2005-08-09, 2005-08-10, 2005-08-11, 2005-08-12, 2005-08-13, 2005-08-14]",true,370,-34.71417289,-58.50890438,7.28,"[0, 0, 0, 0, 0, 0, 0]",4.5692920684814453E-4,280.3029950459798,Molisoles,-0.0015331748872995377,0.4335645039876302,"{""type"":""Point"",""coordinates"":[-58.50890437999999,-34.71417289000001]}"
371,06427,6,10/10/2011,La Matanza,Buenos Aires,33486-6512,4.98,8,primavera,2011-10-10,"[2011-10-10, 2011-10-11, 2011-10-12, 2011-10-13, 2011-10-14, 2011-10-15, 2011-10-16]",true,371,-34.71417289,-58.50890438,7.28,"[0.6, 0.5, 8.8, 0.1, 0, 0, 0]",6.592273712158203E-5,289.3901964823405,Molisoles,-0.002015264704823494,0.46562830607096356,"{""type"":""Point"",""coordinates"":[-58.50890437999999,-34.71417289000001]}"
372,06427,6,7/10/1993,La Matanza,Buenos Aires,33486-6512,4.98,8,primavera,1993-10-04,"[1993-10-04, 1993-10-05, 1993-10-06, 1993-10-07, 1993-10-08, 1993-10-09, 1993-10-10]",true,372,-34.71417289,-58.50890438,7.28,"[0, 0, 0, 0, 0, 0, 0]",3.865063190460205E-4,287.18129475911456,Molisoles,-0.003225000575184822,0.42359161376953125,"{""type"":""Point"",""coordinates"":[-58.50890437999999,-34.71417289000001]}"
373,06560,6,28/8/2001,Moreno,Buenos Aires,42-42,17.53,33,invierno,2001-08-27,"[2001-08-27, 2001-08-28, 2001-08-29, 2001-08-30, 2001-08-31, 2001-09-01, 2001-09-02]",false,373,-34.55865957,-58.81630109,4.33,"[9.4, 0, 0.1, 0.4, 1, 7.3, 0]",0.003220677375793457,287.07901318868,Complejo indiferenci,-0.003692447207868099,0.44579633076985675,"{""type"":""Point"",""coordinates"":[-58.81630109,-34.55865957]}"
374,06217,6,13/2/2007,Chascomus,Buenos Aires,6766-2227,28.22,14,verano,2007-02-12,"[2007-02-12, 2007-02-13, 2007-02-14, 2007-02-15, 2007-02-16, 2007-02-17, 2007-02-18]",false,374,-35.4916042,-57.8945611,1.47,"[0.1, 0, 0, 1.3, 39.5, 5.8, 0]",6.064772605895996E-6,294.91100311279297,Complejo indiferenci,-0.001749671995639801,0.3162498474121094,"{""type"":""Point"",""coordinates"":[-57.894561100000004,-35.4916042]}"
375,06490,6,7/7/2008,Lomas de Zamora,Buenos Aires,35405-6949,5.53,9,invierno,2008-07-07,"[2008-07-07, 2008-07-08, 2008-07-09, 2008-07-10, 2008-07-11, 2008-07-12, 2008-07-13]",true,375,-34.73790272,-58.44067537,3,"[13.8, 0, 0, 0, 2.4, 0, 4.2]",2.471357583999634E-4,287.6273778279622,Miscelaneas,-6.591128185391426E-4,0.46229998270670575,"{""type"":""Point"",""coordinates"":[-58.44067537000001,-34.73790272]}"
376,06602,6,9/1/2007,Patagones,Buenos Aires,33091-6394,65.81,17,verano,2007-01-08,"[2007-01-08, 2007-01-09, 2007-01-10, 2007-01-11, 2007-01-12, 2007-01-13, 2007-01-14]",false,376,-40.8136857,-62.6629984,1.54,"[9.9, 1.3, 0, 0, 0, 0, 0]",1.3113021850585938E-6,298.7098217010498,Complejo indiferenci,-0.0010610418394207954,0.06296857198079427,"{""type"":""Point"",""coordinates"":[-62.6629984,-40.8136857]}"
377,06371,6,26/6/2003,General San Martin,Buenos Aires,36837-7237,8.51,8,invierno,2003-06-23,"[2003-06-23, 2003-06-24, 2003-06-25, 2003-06-26, 2003-06-27, 2003-06-28, 2003-06-29]",true,377,-34.56734338,-58.58431125,17.23,"[6.8, 0, 4.3, 12, 42.4, 0.1, 0]",1.7946958541870117E-4,287.5659872690837,Miscelaneas,-0.0015337904915213585,0.478518803914388,"{""type"":""Point"",""coordinates"":[-58.58431125,-34.56734338]}"
378,06638,6,7/10/1995,Pilar,Buenos Aires,42-42,10.41,16,primavera,1995-10-02,"[1995-10-02, 1995-10-03, 1995-10-04, 1995-10-05, 1995-10-06, 1995-10-07, 1995-10-08]",true,378,-34.42200558,-58.95283788,1.46,"[0, 63.5, 6.7, 0, 0, 0, 2]",1.5497207641601562E-5,288.134947458903,Molisoles,-6.468165665864944E-4,0.2905292510986328,"{""type"":""Point"",""coordinates"":[-58.95283788,-34.42200558]}"
379,06441,6,26/8/1997,La Plata,Buenos Aires,3314-1708,23.31,26,invierno,1997-08-25,"[1997-08-25, 1997-08-26, 1997-08-27, 1997-08-28, 1997-08-29, 1997-08-30, 1997-08-31]",false,379,-35.03880607,-58.05930616,0.93,"[0.7, 0, 0, 0, 0, 0, 24.9]",7.644295692443848E-6,288.0598742167155,Complejo indiferenci,-0.0023912135511636734,0.44366455078125,"{""type"":""Point"",""coordinates"":[-58.05930616,-35.03880607000001]}"
380,82098,82,13/1/2011,San Javier,Santa Fe,6247-1929,17.29,60,verano,2011-01-10,"[2011-01-10, 2011-01-11, 2011-01-12, 2011-01-13, 2011-01-14, 2011-01-15, 2011-01-16]",false,380,-29.42420679,-59.97955475,5.55,"[2.6, 0, 0, 0, 0, 0, 0.5]",3.534555435180664E-5,297.67842292785645,Complejo indiferenci,-0.0035530924797058105,0.4053942362467448,"{""type"":""Point"",""coordinates"":[-59.97955475,-29.424206790000007]}"
381,06455,6,19/6/2007,Las Flores,Buenos Aires,32742-6427,50.28,60,otoño,2007-06-18,"[2007-06-18, 2007-06-19, 2007-06-20, 2007-06-21, 2007-06-22, 2007-06-23, 2007-06-24]",false,381,-36.3036243,-59.3193839,1.15,"[0, 0, 0, 0, 0.6, 0, 0]",1.4603137969970703E-6,276.27232869466144,Molisoles,-7.645823061466217E-4,0.42123667399088544,"{""type"":""Point"",""coordinates"":[-59.3193839,-36.3036243]}"
382,06812,6,18/6/2008,Tordillo,Buenos Aires,3309-1703,53.41,3,otoño,2008-06-16,"[2008-06-16, 2008-06-17, 2008-06-18, 2008-06-19, 2008-06-20, 2008-06-21, 2008-06-22]",false,382,-36.4708183,-57.1914178,0.93,"[0, 0, 0, 10.5, 23.4, 1, 0]",9.387731552124023E-7,280.4711335500081,Lagunas,-0.0011323066428303719,0.38992881774902344,"{""type"":""Point"",""coordinates"":[-57.1914178,-36.4708183]}"
383,06399,6,9/11/2007,Guamini,Buenos Aires,34120-6732,88.38,113,primavera,2007-11-05,"[2007-11-05, 2007-11-06, 2007-11-07, 2007-11-08, 2007-11-09, 2007-11-10, 2007-11-11]",false,383,-36.8942337,-62.3563118,1.85,"[0, 0, 0, 2.2, 32.3, 3.8, 0.1]",1.0655820369720459E-4,290.507911046346,Molisoles,-0.004775543697178364,0.35416285196940106,"{""type"":""Point"",""coordinates"":[-62.3563118,-36.8942337]}"
384,06049,6,7/6/2012,Azul,Buenos Aires,32742-6427,7.78,205,otoño,2012-06-04,"[2012-06-04, 2012-06-05, 2012-06-06, 2012-06-07, 2012-06-08, 2012-06-09, 2012-06-10]",true,384,-37.0314689,-59.6042326,2.5,"[0, 0, 0, 0, 0, 0, 0]",1.1920928955078125E-6,280.39251772562665,Molisoles,-7.448494434356689E-4,0.43239084879557294,"{""type"":""Point"",""coordinates"":[-59.604232599999996,-37.0314689]}"
385,06700,6,1/4/2000,Saavedra,Buenos Aires,31981-6426,70.51,362,otoño,2000-03-27,"[2000-03-27, 2000-03-28, 2000-03-29, 2000-03-30, 2000-03-31, 2000-04-01, 2000-04-02]",false,385,-37.72446606,-62.10173503,5.67,"[1.8, 0, 0, 0, 0, 0, 0]",1.3723969459533691E-5,283.8392588297526,Roca,-0.0018570590764284134,0.3208929697672526,"{""type"":""Point"",""coordinates"":[-62.10173503000001,-37.72446606]}"
386,06791,6,20/11/1993,Tandil,Buenos Aires,32742-6427,53.39,366,primavera,1993-11-15,"[1993-11-15, 1993-11-16, 1993-11-17, 1993-11-18, 1993-11-19, 1993-11-20, 1993-11-21]",false,386,-37.3502704,-59.07873297,26.89,"[0, 0.3, 4.4, 0, 0, 0.4, 3.1]",1.0867416858673096E-4,286.5631472269694,Molisoles,-0.0027310429140925407,0.3694101969401042,"{""type"":""Point"",""coordinates"":[-59.07873297,-37.3502704]}"
387,06196,6,15/3/2007,Coronel Pringles,Buenos Aires,36845-7243,88.06,183,verano,2007-03-12,"[2007-03-12, 2007-03-13, 2007-03-14, 2007-03-15, 2007-03-16, 2007-03-17, 2007-03-18]",false,387,-37.9951979,-60.8897785,1.5,"[0, 0, 15.2, 0.1, 0, 0, 0]",7.450580596923828E-7,294.3567129770915,Molisoles,-0.00336515624076128,0.27600733439127606,"{""type"":""Point"",""coordinates"":[-60.889778500000006,-37.9951979]}"
388,06812,6,1/2/1998,Tordillo,Buenos Aires,3309-1703,53.41,3,verano,1998-01-26,"[1998-01-26, 1998-01-27, 1998-01-28, 1998-01-29, 1998-01-30, 1998-01-31, 1998-02-01]",false,388,-36.4708183,-57.1914178,0.93,"[0.2, 6.6, 0, 0, 0, 0, 0.1]",2.1457672119140625E-6,296.2315317789714,Lagunas,-0.0017919344827532768,0.29687054951985675,"{""type"":""Point"",""coordinates"":[-57.1914178,-36.4708183]}"
389,06609,6,21/2/2011,Pehuajo,Buenos Aires,6725-2212,72.84,89,verano,2011-02-21,"[2011-02-21, 2011-02-22, 2011-02-23, 2011-02-24, 2011-02-25, 2011-02-26, 2011-02-27]",false,389,-35.6179927,-62.0046671,1.47,"[0.8, 6.6, 8.6, 0, 0, 0, 0]",5.260109901428223E-6,295.5287342071533,Molisoles,-0.0027506574988365173,0.3815422058105469,"{""type"":""Point"",""coordinates"":[-62.0046671,-35.61799270000001]}"
390,06084,6,8/4/2014,Benito Juarez,Buenos Aires,36844-7242,42.97,230,otoño,2014-04-07,"[2014-04-07, 2014-04-08, 2014-04-09, 2014-04-10, 2014-04-11, 2014-04-12, 2014-04-13]",false,390,-37.5763984,-60.1392005,1.49,"[6.6, 7, 0, 1.1, 0, 6.3, 0.9]",2.7683377265930176E-4,292.2338695526123,Molisoles,-7.766131311655045E-4,0.47271728515625,"{""type"":""Point"",""coordinates"":[-60.13920050000001,-37.5763984]}"
391,06105,6,4/2/2000,Bolivar,Buenos Aires,36845-7243,42.03,73,verano,2000-01-31,"[2000-01-31, 2000-02-01, 2000-02-02, 2000-02-03, 2000-02-04, 2000-02-05, 2000-02-06]",false,391,-36.002259,-60.623087,1.47,"[0.3, 0, 8.7, 0, 0, 0, 1.9]",6.020069122314453E-6,299.38268280029297,Molisoles,-0.002206253819167614,0.2674051920572917,"{""type"":""Point"",""coordinates"":[-60.623087,-36.002259]}"
392,06147,6,9/7/1998,Carlos Casares,Buenos Aires,36845-7243,60.46,84,invierno,1998-07-06,"[1998-07-06, 1998-07-07, 1998-07-08, 1998-07-09, 1998-07-10, 1998-07-11, 1998-07-12]",false,392,-35.83601,-61.43436,1.47,"[0, 0, 0, 0, 0, 0, 0]",1.6704201698303223E-5,286.5096124013265,Molisoles,-0.00100813340395689,0.3435662587483724,"{""type"":""Point"",""coordinates"":[-61.43436,-35.83601]}"
393,06854,6,12/5/1995,25 de Mayo,Buenos Aires,6954-2111,20.08,55,otoño,1995-05-08,"[1995-05-08, 1995-05-09, 1995-05-10, 1995-05-11, 1995-05-12, 1995-05-13, 1995-05-14]",false,393,-35.2813845,-60.2618183,2.27,"[0, 0, 0, 0, 0, 1.7, 19]",3.4809112548828125E-5,290.2343324025472,Molisoles,-0.0022003082558512688,0.3161474863688151,"{""type"":""Point"",""coordinates"":[-60.2618183,-35.2813845]}"
394,06357,6,5/3/1992,General Pueyrredon,Buenos Aires,3347-1742,17.47,21,verano,1992-03-02,"[1992-03-02, 1992-03-03, 1992-03-04, 1992-03-05, 1992-03-06, 1992-03-07, 1992-03-08]",false,394,-37.80766254,-57.62989086,5.55,"[0, 0.1, 0.6, 1, 0, 0, 0.4]",3.859400749206543E-6,294.37699635823566,Molisoles,-0.0035750363022089005,0.3650519053141276,"{""type"":""Point"",""coordinates"":[-57.62989086,-37.80766254000001]}"
395,06049,6,27/4/2005,Azul,Buenos Aires,32742-6427,7.78,205,otoño,2005-04-25,"[2005-04-25, 2005-04-26, 2005-04-27, 2005-04-28, 2005-04-29, 2005-04-30, 2005-05-01]",true,395,-37.0314689,-59.6042326,2.5,"[0, 0, 0, 0, 0, 0, 0]",7.748603820800781E-6,282.2295837402344,Molisoles,-6.49147666990757E-4,0.28264109293619794,"{""type"":""Point"",""coordinates"":[-59.604232599999996,-37.0314689]}"
396,14028,14,10/5/2005,Cruz del Eje,Cordoba,9461-2776,35.72,750,otoño,2005-05-09,"[2005-05-09, 2005-05-10, 2005-05-11, 2005-05-12, 2005-05-13, 2005-05-14, 2005-05-15]",false,396,-31.0893001,-65.0484771,4.7,"[0, 0, 0, 0, 0, 3.6, 9.6]",1.684725284576416E-4,285.2201843261719,Salinas,-0.0015513617545366287,0.34686851501464844,"{""type"":""Point"",""coordinates"":[-65.0484771,-31.089300099999996]}"
397,02005,2,12/6/1990,Comuna 5,Capital Federal,85-85,3.75,37,otoño,1990-06-11,"[1990-06-11, 1990-06-12, 1990-06-13, 1990-06-14, 1990-06-15, 1990-06-16, 1990-06-17]",true,397,-34.60922769,-58.42174523,2.44,"[0, 0, 0, 0.2, 0, 0, 0]",4.7178566455841064E-4,280.4525686899821,Miscelaneas,-0.0011609792709350586,0.3627134958902995,"{""type"":""Point"",""coordinates"":[-58.42174523,-34.609227690000004]}"
398,86168,86,25/1/2003,Salavina,Santiago del Estero,36916-7263,18.29,101,verano,2003-01-20,"[2003-01-20, 2003-01-21, 2003-01-22, 2003-01-23, 2003-01-24, 2003-01-25, 2003-01-26]",false,398,-29.03431036,-63.33874661,2.14,"[1.4, 7.6, 9.7, 0, 0, 0, 0]",6.67572021484375E-6,302.0892988840739,Alfisoles,-0.0051898043602705,0.3387317657470703,"{""type"":""Point"",""coordinates"":[-63.33874661,-29.034310360000003]}"
399,86112,86,22/8/2003,Mitre,Santiago del Estero,37593-7391,10.57,90,invierno,2003-08-18,"[2003-08-18, 2003-08-19, 2003-08-20, 2003-08-21, 2003-08-22, 2003-08-23, 2003-08-24]",true,399,-29.29157166,-63.03450311,1.06,"[0, 0, 0, 0, 0.3, 1.6, 0]",7.998943328857422E-5,291.9252446492513,Alfisoles,-0.0033708326518535614,0.2357813517252604,"{""type"":""Point"",""coordinates"":[-63.03450311000001,-29.29157166]}"
400,86007,86,23/2/2010,Aguirre,Santiago del Estero,32009-6398,20.73,98,verano,2010-02-22,"[2010-02-22, 2010-02-23, 2010-02-24, 2010-02-25, 2010-02-26, 2010-02-27, 2010-02-28]",false,400,-28.96850322,-62.90029133,2.31,"[8.1, 13.7, 2.2, 0.2, 1.1, 0, 0]",7.131695747375488E-5,300.5918509165446,Complejo indiferenci,-0.004058400169014931,0.4102776845296224,"{""type"":""Point"",""coordinates"":[-62.90029133,-28.968503220000006]}"
401,86028,86,4/9/1996,Avellaneda,Santiago del Estero,32009-6398,25.02,106,invierno,1996-09-02,"[1996-09-02, 1996-09-03, 1996-09-04, 1996-09-05, 1996-09-06, 1996-09-07, 1996-09-08]",false,401,-28.70814175,-63.1050531,2.31,"[0.3, 0, 0, 0, 0, 1.9, 0]",1.6391277313232422E-6,290.74684079488117,Alfisoles,-6.409306079149246E-4,0.12730916341145834,"{""type"":""Point"",""coordinates"":[-63.1050531,-28.708141750000003]}"
402,86098,86,23/2/2011,Juan F. Ibarra,Santiago del Estero,36727-7188,55.55,99,verano,2011-02-21,"[2011-02-21, 2011-02-22, 2011-02-23, 2011-02-24, 2011-02-25, 2011-02-26, 2011-02-27]",false,402,-27.95003,-61.84724,1.85,"[7.9, 4.9, 7.3, 0, 0, 0, 0]",8.837878704071045E-5,297.37647183736163,Entisoles,-0.0026224534958601,0.39708391825358075,"{""type"":""Point"",""coordinates"":[-61.84724,-27.95003]}"
403,86182,86,13/6/2013,Sarmiento,Santiago del Estero,6804-2223,13.63,127,otoño,2013-06-10,"[2013-06-10, 2013-06-11, 2013-06-12, 2013-06-13, 2013-06-14, 2013-06-15, 2013-06-16]",true,403,-28.08144587,-63.33466823,3.7,"[0, 0, 0, 0.2, 27, 0, 0]",9.834766387939453E-7,294.79345957438153,Alfisoles,-2.5532767176628113E-4,0.12048848470052083,"{""type"":""Point"",""coordinates"":[-63.33466822999999,-28.081445870000003]}"
404,86070,86,1/12/2015,Figueroa,Santiago del Estero,6309-1957,34.35,186,primavera,2015-11-30,"[2015-11-30, 2015-12-01, 2015-12-02, 2015-12-03, 2015-12-04, 2015-12-05, 2015-12-06]",false,404,-26.91460859,-63.52985443,3.47,"[0, 0, 0.2, 0.1, 0.7, 13.4, 0]",5.960464477539063E-8,296.5619831085205,Entisoles,-0.006009248085319996,0.2866433461507161,"{""type"":""Point"",""coordinates"":[-63.52985443,-26.914608590000004]}"
405,86056,86,11/11/2007,Copo,Santiago del Estero,6309-1957,42.91,266,primavera,2007-11-05,"[2007-11-05, 2007-11-06, 2007-11-07, 2007-11-08, 2007-11-09, 2007-11-10, 2007-11-11]",false,405,-25.72948778,-63.46601397,2.96,"[0, 0.5, 0, 16.2, 0.4, 8.1, 0.6]",1.2606382369995117E-5,299.0822925567627,Molisoles,-0.0020061610266566277,0.21416473388671875,"{""type"":""Point"",""coordinates"":[-63.46601397,-25.72948778]}"
406,86133,86,14/9/2012,Pellegrini,Santiago del Estero,32820-6498,6.85,375,invierno,2012-09-10,"[2012-09-10, 2012-09-11, 2012-09-12, 2012-09-13, 2012-09-14, 2012-09-15, 2012-09-16]",true,406,-26.28318787,-64.45684052,0,"[1.4, 0, 0, 0, 0, 0, 0]",1.0102987289428711E-5,290.14727783203125,Entisoles,-0.0014997916296124458,0.2669798533121745,"{""type"":""Point"",""coordinates"":[-64.45684052,-26.28318787]}"
407,86091,86,20/4/2000,Jimnez,Santiago del Estero,32820-6498,23.4,292,otoño,2000-04-17,"[2000-04-17, 2000-04-18, 2000-04-19, 2000-04-20, 2000-04-21, 2000-04-22, 2000-04-23]",false,407,-26.68895431,-64.45447124,5.64,"[2.3, 0, 0, 0, 0, 0, 0]",7.650703191757202E-4,290.3127384185791,Molisoles,-0.001643066294491291,0.40035120646158856,"{""type"":""Point"",""coordinates"":[-64.45447124,-26.68895431]}"
408,86014,86,9/5/2010,Alberdi,Santiago del Estero,6855-2224,89.3,176,otoño,2010-05-03,"[2010-05-03, 2010-05-04, 2010-05-05, 2010-05-06, 2010-05-07, 2010-05-08, 2010-05-09]",false,408,-26.78946686,-62.70516586,4.17,"[0.1, 0, 0, 0.2, 0.2, 0, 0]",3.0547380447387695E-5,292.4673563639323,Entisoles,-0.0032033296301960945,0.36540794372558594,"{""type"":""Point"",""coordinates"":[-62.70516586,-26.789466860000005]}"
409,14007,14,25/1/2010,Calamuchita,Cordoba,36828-7231,19.43,603,verano,2010-01-25,"[2010-01-25, 2010-01-26, 2010-01-27, 2010-01-28, 2010-01-29, 2010-01-30, 2010-01-31]",false,409,-32.09286214,-64.56387845,5.66,"[0, 0, 0, 0, 0, 4.2, 16.5]",9.894371032714844E-6,297.65706698099774,Roca,-0.003202180378139019,0.14835611979166666,"{""type"":""Point"",""coordinates"":[-64.56387845,-32.09286214]}"
410,02014,2,23/1/1992,Comuna 14,Capital Federal,85-85,2.68,24,verano,1992-01-20,"[1992-01-20, 1992-01-21, 1992-01-22, 1992-01-23, 1992-01-24, 1992-01-25, 1992-01-26]",true,410,-34.57389998,-58.42243645,5.28,"[0.4, 0, 0, 0, 0, 0.6, 4.5]",5.158260464668274E-4,298.3660125732422,Miscelaneas,-0.0025289757177233696,0.14415613810221353,"{""type"":""Point"",""coordinates"":[-58.42243645,-34.57389997999999]}"
411,10105,10,12/4/2002,Tinogasta,Catamarca,6718-2196,43.56,2589,otoño,2002-04-08,"[2002-04-08, 2002-04-09, 2002-04-10, 2002-04-11, 2002-04-12, 2002-04-13, 2002-04-14]",false,411,-27.09210847,-67.81896152,26.54,"[0, 0.2, 0.5, 1.8, 0.4, 3.6, 0]",6.4373016357421875E-6,288.01758511861163,Roca,-5.047284066677094E-4,0.1408672332763672,"{""type"":""Point"",""coordinates"":[-67.81896152,-27.092108470000003]}"
412,02001,2,20/12/2003,Comuna 1,Capital Federal,8891-2706,1.05,28,primavera,2003-12-15,"[2003-12-15, 2003-12-16, 2003-12-17, 2003-12-18, 2003-12-19, 2003-12-20, 2003-12-21]",true,412,-34.62504786,-58.38438723,3.7,"[3.9, 0, 0, 0, 0, 6.3, 13]",5.050450563430786E-4,292.9781608581543,Miscelaneas,-0.004168648272752762,0.3219617207845052,"{""type"":""Point"",""coordinates"":[-58.38438723000001,-34.62504786000001]}"
413,02002,2,4/3/2001,Comuna 2,Capital Federal,85-85,1.52,30,verano,2001-02-26,"[2001-02-26, 2001-02-27, 2001-02-28, 2001-03-01, 2001-03-02, 2001-03-03, 2001-03-04]",true,413,-34.58587601,-58.39499618,1.85,"[0, 0.7, 0, 26.1, 54, 15.7, 0]",2.7538836002349854E-4,296.8157704671224,Miscelaneas,-0.0024483930319547653,0.2339763641357422,"{""type"":""Point"",""coordinates"":[-58.39499618,-34.58587601000001]}"
414,06658,6,20/6/2004,Quilmes,Buenos Aires,35407-6950,4.25,3,otoño,2004-06-14,"[2004-06-14, 2004-06-15, 2004-06-16, 2004-06-17, 2004-06-18, 2004-06-19, 2004-06-20]",true,414,-34.70037841,-58.27664278,2.17,"[0, 0, 0, 0, 0, 0, 19.1]",,,Miscelaneas,,,"{""type"":""Point"",""coordinates"":[-58.276642779999996,-34.70037841]}"
415,66028,66,2/5/1998,Capital,Salta,6351-1974,15.04,1377,otoño,1998-04-27,"[1998-04-27, 1998-04-28, 1998-04-29, 1998-04-30, 1998-05-01, 1998-05-02, 1998-05-03]",false,415,-24.70494203,-65.47051055,1.02,"[6.7, 0.1, 0, 0, 0, 0.5, 5.6]",0.004867687821388245,285.88648923238117,Inceptisoles,-0.0026570959016680717,0.5002479553222656,"{""type"":""Point"",""coordinates"":[-65.47051055,-24.70494203]}"
416,02013,2,5/3/2002,Comuna 13,Capital Federal,54-54,3.99,10,verano,2002-03-04,"[2002-03-04, 2002-03-05, 2002-03-06, 2002-03-07, 2002-03-08, 2002-03-09, 2002-03-10]",true,416,-34.55488152,-58.4502891,3.85,"[19.9, 0, 0, 9.2, 0.8, 26, 33.9]",6.144791841506958E-4,297.63432121276855,Miscelaneas,-0.002559686079621315,0.35339609781901044,"{""type"":""Point"",""coordinates"":[-58.4502891,-34.55488152]}"
417,02013,2,23/2/2012,Comuna 13,Capital Federal,54-54,3.99,10,verano,2012-02-20,"[2012-02-20, 2012-02-21, 2012-02-22, 2012-02-23, 2012-02-24, 2012-02-25, 2012-02-26]",true,417,-34.55488152,-58.4502891,3.85,"[34.8, 8.1, 0.1, 0, 0, 0.7, 4.6]",0.0029848068952560425,297.23900349934894,Miscelaneas,-0.0026673516258597374,0.4456615447998047,"{""type"":""Point"",""coordinates"":[-58.4502891,-34.55488152]}"
418,42021,42,24/1/1992,Capital,La Pampa,32779-6443,14.55,163,verano,1992-01-20,"[1992-01-20, 1992-01-21, 1992-01-22, 1992-01-23, 1992-01-24, 1992-01-25, 1992-01-26]",true,418,-36.68302536,-64.19379425,0,"[12, 0, 0, 0.8, 0, 0, 0]",0.0025423243641853333,297.1993459065755,Entisoles,-0.005039554089307785,0.33591334025065106,"{""type"":""Point"",""coordinates"":[-64.19379425,-36.68302536]}"
419,42021,42,19/6/2015,Capital,La Pampa,32779-6443,14.55,163,otoño,2015-06-15,"[2015-06-15, 2015-06-16, 2015-06-17, 2015-06-18, 2015-06-19, 2015-06-20, 2015-06-21]",true,419,-36.68302536,-64.19379425,0,"[0, 0, 0, 0, 0, 0, 0]",8.940696716308594E-8,282.98997688293457,Entisoles,-9.515844285488129E-4,0.20932451883951822,"{""type"":""Point"",""coordinates"":[-64.19379425,-36.68302536]}"
420,14021,14,15/8/2013,Colon,Cordoba,33948-6745,20.69,355,invierno,2013-08-12,"[2013-08-12, 2013-08-13, 2013-08-14, 2013-08-15, 2013-08-16, 2013-08-17, 2013-08-18]",false,420,-31.25624481,-63.95340394,0.93,"[0, 0, 0, 0, 0, 0, 0]",5.960464477539063E-8,285.2721684773763,Miscelaneas,-4.635034129023552E-4,0.153656005859375,"{""type"":""Point"",""coordinates"":[-63.953403939999994,-31.256244809999995]}"
421,14014,14,12/12/1998,Capital,Cordoba,37574-7384,24.04,426,primavera,1998-12-07,"[1998-12-07, 1998-12-08, 1998-12-09, 1998-12-10, 1998-12-11, 1998-12-12, 1998-12-13]",false,421,-31.47878838,-64.14509583,2.86,"[0, 20.3, 0, 0, 0, 0, 19.1]",6.988644599914551E-5,295.71467844645184,Miscelaneas,-0.0036615338176488876,0.29086748758951825,"{""type"":""Point"",""coordinates"":[-64.14509583,-31.478788380000008]}"
422,06357,6,12/1/1999,General Pueyrredon,Buenos Aires,3347-1742,17.47,21,verano,1999-01-11,"[1999-01-11, 1999-01-12, 1999-01-13, 1999-01-14, 1999-01-15, 1999-01-16, 1999-01-17]",false,422,-37.80766254,-57.62989086,5.55,"[0, 0, 1.7, 0, 0, 0, 0]",6.586313247680664E-6,288.74518458048504,Molisoles,-0.003830166533589363,0.37918345133463544,"{""type"":""Point"",""coordinates"":[-57.62989086,-37.80766254000001]}"
423,34063,34,20/12/1997,Ramon Lista,Formosa,33909-6556,7.68,204,primavera,1997-12-15,"[1997-12-15, 1997-12-16, 1997-12-17, 1997-12-18, 1997-12-19, 1997-12-20, 1997-12-21]",true,423,-23.18007636,-62.03032748,1.37,"[0, 0, 0, 0.1, 0, 0, 0]",1.1920928955078125E-7,300.17412185668945,Rio,-0.005118543282151222,0.31143951416015625,"{""type"":""Point"",""coordinates"":[-62.03032747999999,-23.18007636]}"
424,34063,34,9/2/2008,Ramon Lista,Formosa,33909-6556,7.68,204,verano,2008-02-04,"[2008-02-04, 2008-02-05, 2008-02-06, 2008-02-07, 2008-02-08, 2008-02-09, 2008-02-10]",true,424,-23.18007636,-62.03032748,1.37,"[0, 0, 0, 0, 21.8, 21.2, 6]",4.172325134277344E-7,299.87599118550617,Rio,-0.005651364102959633,0.27272669474283856,"{""type"":""Point"",""coordinates"":[-62.03032747999999,-23.18007636]}"
425,14014,14,26/9/1999,Capital,Cordoba,37574-7384,24.04,426,invierno,1999-09-20,"[1999-09-20, 1999-09-21, 1999-09-22, 1999-09-23, 1999-09-24, 1999-09-25, 1999-09-26]",false,425,-31.47878838,-64.14509583,2.86,"[0, 0, 0, 0, 9.6, 26, 13.3]",1.1703372001647949E-4,291.4595864613851,Miscelaneas,-0.0019180336967110634,0.24536641438802084,"{""type"":""Point"",""coordinates"":[-64.14509583,-31.478788380000008]}"
426,82035,82,17/9/1997,Garay,Santa Fe,33531-6669,2.91,23,invierno,1997-09-15,"[1997-09-15, 1997-09-16, 1997-09-17, 1997-09-18, 1997-09-19, 1997-09-20, 1997-09-21]",true,426,-31.1523125,-60.1365521,2.36,"[0, 0, 0, 0, 0.1, 0, 0]",2.8774142265319824E-5,290.0857874552409,Molisoles,-0.0018129050731658936,0.1651299794514974,"{""type"":""Point"",""coordinates"":[-60.1365521,-31.152312499999997]}"
427,66056,66,6/2/2000,General Jose de San Martin,Salta,6934-2187,25.44,797,verano,2000-01-31,"[2000-01-31, 2000-02-01, 2000-02-02, 2000-02-03, 2000-02-04, 2000-02-05, 2000-02-06]",false,427,-22.16459982,-63.9088426,0.93,"[0, 0, 3.9, 40.7, 0, 0, 13.1]",4.06801700592041E-5,295.85973358154297,Molisoles,-0.005275227129459381,0.47699546813964844,"{""type"":""Point"",""coordinates"":[-63.90884259999999,-22.16459982]}"
428,06602,6,8/1/1996,Patagones,Buenos Aires,33091-6394,65.81,17,verano,1996-01-08,"[1996-01-08, 1996-01-09, 1996-01-10, 1996-01-11, 1996-01-12, 1996-01-13, 1996-01-14]",false,428,-40.8136857,-62.6629984,1.54,"[0, 0, 0, 0, 7.7, 0.1, 0]",0.0,292.52922439575195,Complejo indiferenci,-0.0015078894793987274,0.09440104166666667,"{""type"":""Point"",""coordinates"":[-62.6629984,-40.8136857]}"
429,30070,30,24/9/2002,La Paz,Entre Rios,6543-2055,11.16,36,primavera,2002-09-23,"[2002-09-23, 2002-09-24, 2002-09-25, 2002-09-26, 2002-09-27, 2002-09-28, 2002-09-29]",true,429,-30.60360412,-59.52751986,4.26,"[0, 0, 0, 0, 0, 0, 12.9]",5.89326024055481E-4,289.2442207336426,Molisoles,-0.003413347527384758,0.42679468790690106,"{""type"":""Point"",""coordinates"":[-59.52751986,-30.60360412]}"
430,06260,6,24/4/1991,Esteban Echeverria,Buenos Aires,33486-6512,6.94,23,otoño,1991-04-22,"[1991-04-22, 1991-04-23, 1991-04-24, 1991-04-25, 1991-04-26, 1991-04-27, 1991-04-28]",true,430,-34.88497914,-58.47780994,1.46,"[0, 1.2, 0, 0, 0, 0, 0]",1.099705696105957E-5,290.26427904764813,Miscelaneas,-0.0018504876643419266,0.4067096710205078,"{""type"":""Point"",""coordinates"":[-58.47780994,-34.884979140000006]}"
431,06441,6,11/1/1998,La Plata,Buenos Aires,3314-1708,23.31,26,verano,1998-01-05,"[1998-01-05, 1998-01-06, 1998-01-07, 1998-01-08, 1998-01-09, 1998-01-10, 1998-01-11]",false,431,-35.03880607,-58.05930616,0.93,"[39.8, 0.3, 0, 0, 0, 0, 0.7]",0.009829878807067871,297.1029968261719,Complejo indiferenci,-0.0033834893256425858,0.45624669392903644,"{""type"":""Point"",""coordinates"":[-58.05930616,-35.03880607000001]}"
432,06427,6,7/1/2004,La Matanza,Buenos Aires,33486-6512,4.98,8,verano,2004-01-05,"[2004-01-05, 2004-01-06, 2004-01-07, 2004-01-08, 2004-01-09, 2004-01-10, 2004-01-11]",true,432,-34.71417289,-58.50890438,7.28,"[0, 1.8, 3.9, 1.3, 0, 9.3, 0]",2.978593111038208E-4,298.649720509847,Molisoles,-0.0034351972863078117,0.19465192159016928,"{""type"":""Point"",""coordinates"":[-58.50890437999999,-34.71417289000001]}"
433,06329,6,7/11/1992,General Las Heras,Buenos Aires,6936-2128,14.14,39,primavera,1992-11-02,"[1992-11-02, 1992-11-03, 1992-11-04, 1992-11-05, 1992-11-06, 1992-11-07, 1992-11-08]",true,433,-34.8223015,-59.1343749,1.13,"[11.4, 1.3, 0, 0, 0, 0, 0]",2.828836441040039E-4,287.1018981933594,Complejo indiferenci,-0.0018786070868372917,0.449771245320638,"{""type"":""Point"",""coordinates"":[-59.1343749,-34.8223015]}"
434,06035,6,3/5/2013,Avellaneda,Buenos Aires,35411-6952,1.59,6,otoño,2013-04-29,"[2013-04-29, 2013-04-30, 2013-05-01, 2013-05-02, 2013-05-03, 2013-05-04, 2013-05-05]",true,434,-34.67500565,-58.31056343,3.38,"[0, 0, 17.9, 2.9, 33.5, 0, 0]",,,Miscelaneas,,,"{""type"":""Point"",""coordinates"":[-58.31056343,-34.675005649999996]}"
435,06434,6,2/5/1990,Lanus,Buenos Aires,8891-2706,4.6,5,otoño,1990-04-30,"[1990-04-30, 1990-05-01, 1990-05-02, 1990-05-03, 1990-05-04, 1990-05-05, 1990-05-06]",true,435,-34.69095715,-58.38386285,4.6,"[0, 0, 0, 0.1, 0, 0, 0]",2.9352307319641113E-4,286.92630195617676,Miscelaneas,-0.001886117272078991,0.4253807067871094,"{""type"":""Point"",""coordinates"":[-58.38386285000001,-34.69095715000001]}"
436,02012,2,22/6/2003,Comuna 12,Capital Federal,54-54,3.13,20,otoño,2003-06-16,"[2003-06-16, 2003-06-17, 2003-06-18, 2003-06-19, 2003-06-20, 2003-06-21, 2003-06-22]",true,436,-34.56062514,-58.47494475,0.93,"[0, 0, 0, 0, 2.2, 0, 4.3]",5.956590175628662E-4,283.6324272155762,Miscelaneas,-0.001324281096458435,0.38816388448079425,"{""type"":""Point"",""coordinates"":[-58.474944750000006,-34.560625140000006]}"
437,06371,6,14/5/1992,General San Martin,Buenos Aires,36837-7237,8.51,8,otoño,1992-05-11,"[1992-05-11, 1992-05-12, 1992-05-13, 1992-05-14, 1992-05-15, 1992-05-16, 1992-05-17]",true,437,-34.56734338,-58.58431125,17.23,"[7.3, 0, 0, 0, 0, 0, 1.2]",9.73045825958252E-5,291.93675231933594,Miscelaneas,-0.0010365340858697891,0.4562034606933594,"{""type"":""Point"",""coordinates"":[-58.58431125,-34.56734338]}"
438,06756,6,10/11/1991,San Isidro,Buenos Aires,53-53,1.29,24,primavera,1991-11-04,"[1991-11-04, 1991-11-05, 1991-11-06, 1991-11-07, 1991-11-08, 1991-11-09, 1991-11-10]",true,438,-34.47940181,-58.5074044,5.81,"[0, 1.2, 19.9, 0.2, 0, 0.2, 8.6]",,,Rio,,,"{""type"":""Point"",""coordinates"":[-58.507404400000006,-34.47940181]}"
439,02013,2,5/1/2008,Comuna 13,Capital Federal,54-54,3.99,10,verano,2007-12-31,"[2007-12-31, 2008-01-01, 2008-01-02, 2008-01-03, 2008-01-04, 2008-01-05, 2008-01-06]",true,439,-34.55488152,-58.4502891,3.85,"[0, 0, 0, 0, 0, 0, 0]",3.076493740081787E-4,301.03402455647785,Miscelaneas,-0.003860372118651867,0.1831512451171875,"{""type"":""Point"",""coordinates"":[-58.4502891,-34.55488152]}"
440,02014,2,7/7/2003,Comuna 14,Capital Federal,85-85,2.68,24,invierno,2003-07-07,"[2003-07-07, 2003-07-08, 2003-07-09, 2003-07-10, 2003-07-11, 2003-07-12, 2003-07-13]",true,440,-34.57389998,-58.42243645,5.28,"[0, 8.8, 0, 0.1, 0, 0, 0]",8.006095886230469E-4,283.6781355539958,Miscelaneas,-0.0012018084526062012,0.3956031799316406,"{""type"":""Point"",""coordinates"":[-58.42243645,-34.57389997999999]}"
441,02013,2,16/11/2010,Comuna 13,Capital Federal,54-54,3.99,10,primavera,2010-11-15,"[2010-11-15, 2010-11-16, 2010-11-17, 2010-11-18, 2010-11-19, 2010-11-20, 2010-11-21]",true,441,-34.55488152,-58.4502891,3.85,"[0, 1.8, 0, 0, 0, 0, 0]",4.960149526596069E-4,291.4168300628662,Miscelaneas,-0.0021637268364429474,0.16084798177083334,"{""type"":""Point"",""coordinates"":[-58.4502891,-34.55488152]}"
442,14021,14,8/5/2003,Colon,Cordoba,33948-6745,20.69,355,otoño,2003-05-05,"[2003-05-05, 2003-05-06, 2003-05-07, 2003-05-08, 2003-05-09, 2003-05-10, 2003-05-11]",false,442,-31.25624481,-63.95340394,0.93,"[0, 0, 0, 0, 0, 0, 0]",1.7656385898590088E-4,288.1306915283203,Miscelaneas,-0.0018184734508395195,0.3551146189371745,"{""type"":""Point"",""coordinates"":[-63.953403939999994,-31.256244809999995]}"
443,06161,6,8/10/1999,Carmen de Areco,Buenos Aires,32711-6544,5.4,52,primavera,1999-10-04,"[1999-10-04, 1999-10-05, 1999-10-06, 1999-10-07, 1999-10-08, 1999-10-09, 1999-10-10]",true,443,-34.4145467,-59.8540512,1.12,"[0, 0, 1.5, 0.5, 0, 0, 1.4]",5.826354026794434E-6,281.7522652943929,Molisoles,-0.0029296018183231354,0.42007891337076825,"{""type"":""Point"",""coordinates"":[-59.8540512,-34.41454670000001]}"
444,06413,6,21/5/1997,Junin,Buenos Aires,34343-6359,11.52,80,otoño,1997-05-19,"[1997-05-19, 1997-05-20, 1997-05-21, 1997-05-22, 1997-05-23, 1997-05-24, 1997-05-25]",true,444,-34.5109222,-60.865793,3.5,"[12.9, 16.9, 23.9, 0, 0, 0, 0]",8.696317672729492E-5,290.5497245788574,Lagunas,-9.120218455791473E-4,0.2912820180257161,"{""type"":""Point"",""coordinates"":[-60.865793,-34.5109222]}"
445,06462,6,22/7/1996,Leonardo N. Alem,Buenos Aires,6852-2211,7.44,84,invierno,1996-07-22,"[1996-07-22, 1996-07-23, 1996-07-24, 1996-07-25, 1996-07-26, 1996-07-27, 1996-07-28]",true,445,-34.4448464,-61.3192363,3.49,"[0, 0, 0.1, 0, 0, 0, 0]",4.112720489501953E-6,278.74029477437335,Complejo indiferenci,-0.0011552851647138596,0.24312655131022134,"{""type"":""Point"",""coordinates"":[-61.3192363,-34.4448464]}"
446,06351,6,15/5/1997,General Pinto,Buenos Aires,6811-2213,37.98,106,otoño,1997-05-12,"[1997-05-12, 1997-05-13, 1997-05-14, 1997-05-15, 1997-05-16, 1997-05-17, 1997-05-18]",false,446,-34.8011277,-61.8636453,2.17,"[0, 0, 0, 0, 0, 0, 4.2]",5.513429641723633E-7,294.7313226064046,Molisoles,-9.9965650588274E-4,0.271755854288737,"{""type"":""Point"",""coordinates"":[-61.8636453,-34.8011277]}"
447,06392,6,3/1/1996,General Villegas,Buenos Aires,33055-6609,38.59,123,verano,1996-01-01,"[1996-01-01, 1996-01-02, 1996-01-03, 1996-01-04, 1996-01-05, 1996-01-06, 1996-01-07]",false,447,-34.8579191,-63.1611931,3.58,"[0.2, 0, 12.6, 0, 0, 0, 1.6]",1.6838312149047852E-6,300.8556493123372,Molisoles,-0.0023698220029473305,0.15552711486816406,"{""type"":""Point"",""coordinates"":[-63.1611931,-34.8579191]}"
448,82063,82,1/2/1992,La Capital,Santa Fe,103-103,23.73,25,verano,1992-01-27,"[1992-01-27, 1992-01-28, 1992-01-29, 1992-01-30, 1992-01-31, 1992-02-01, 1992-02-02]",false,448,-31.18858147,-60.62677383,2.15,"[0, 2.1, 3.4, 12.3, 1, 0.4, 0]",4.3360888957977295E-4,299.50751304626465,Molisoles,-0.0037345588207244873,0.2648385365804036,"{""type"":""Point"",""coordinates"":[-60.62677383,-31.18858147]}"
449,18077,18,14/11/1991,Itati,Corrientes,17-17,41.46,69,primavera,1991-11-11,"[1991-11-11, 1991-11-12, 1991-11-13, 1991-11-14, 1991-11-15, 1991-11-16, 1991-11-17]",false,449,-27.35196615,-57.87393625,1.04,"[0.3, 1.3, 7.2, 3.9, 0, 0, 0]",2.611428499221802E-4,293.84875361124676,Entisoles,-0.004935196600854397,0.3828315734863281,"{""type"":""Point"",""coordinates"":[-57.87393625,-27.35196615]}"
450,82084,82,4/2/1996,Rosario,Santa Fe,118-118,22.58,64,verano,1996-01-29,"[1996-01-29, 1996-01-30, 1996-01-31, 1996-02-01, 1996-02-02, 1996-02-03, 1996-02-04]",false,450,-33.07901008,-60.91379957,1.11,"[0, 0.7, 2.1, 0.2, 0.1, 11, 6.4]",2.4884939193725586E-6,299.0961659749349,Alfisoles,-0.0036334609612822533,0.26483790079752606,"{""type"":""Point"",""coordinates"":[-60.91379957,-33.07901008]}"
451,18070,18,10/5/1991,Goya,Corrientes,6624-2091,11.86,59,otoño,1991-05-06,"[1991-05-06, 1991-05-07, 1991-05-08, 1991-05-09, 1991-05-10, 1991-05-11, 1991-05-12]",true,451,-29.1751244,-58.88982054,2.14,"[0, 0, 0, 0, 0, 0, 1.1]",2.783834934234619E-4,284.33398056030273,Rio,-0.002402719110250473,0.36341094970703125,"{""type"":""Point"",""coordinates"":[-58.889820540000024,-29.1751244]}"
452,82049,82,21/10/1994,General Obligado,Santa Fe,32822-6509,17.99,58,primavera,1994-10-17,"[1994-10-17, 1994-10-18, 1994-10-19, 1994-10-20, 1994-10-21, 1994-10-22, 1994-10-23]",false,452,-28.6765561,-59.7497004,1.41,"[8.5, 2.7, 0.3, 0, 0.8, 5.1, 8.5]",3.03804874420166E-4,293.6581293741862,Alfisoles,-0.0031806910410523415,0.46095021565755206,"{""type"":""Point"",""coordinates"":[-59.7497004,-28.676556099999996]}"
453,82035,82,9/2/1991,Garay,Santa Fe,33531-6669,2.91,23,verano,1991-02-04,"[1991-02-04, 1991-02-05, 1991-02-06, 1991-02-07, 1991-02-08, 1991-02-09, 1991-02-10]",true,453,-31.1523125,-60.1365521,2.36,"[0.1, 0.1, 0, 0, 0, 0.2, 0.4]",9.412169456481934E-4,299.3605600992839,Molisoles,-0.005662268027663231,0.30744298299153644,"{""type"":""Point"",""coordinates"":[-60.1365521,-31.152312499999997]}"
454,82035,82,4/6/2011,Garay,Santa Fe,33531-6669,2.91,23,otoño,2011-05-30,"[2011-05-30, 2011-05-31, 2011-06-01, 2011-06-02, 2011-06-03, 2011-06-04, 2011-06-05]",true,454,-31.1523125,-60.1365521,2.36,"[0, 0, 0, 1.5, 0, 0, 0]",4.267692565917969E-5,286.0797971089681,Molisoles,-0.0012759454548358917,0.3600622812906901,"{""type"":""Point"",""coordinates"":[-60.1365521,-31.152312499999997]}"
455,82098,82,28/7/2009,San Javier,Santa Fe,6247-1929,17.29,60,invierno,2009-07-27,"[2009-07-27, 2009-07-28, 2009-07-29, 2009-07-30, 2009-07-31, 2009-08-01, 2009-08-02]",false,455,-29.42420679,-59.97955475,5.55,"[0, 0, 0, 0, 0, 0, 0]",3.129243850708008E-7,282.56857045491535,Complejo indiferenci,-0.0013510538265109062,0.382327397664388,"{""type"":""Point"",""coordinates"":[-59.97955475,-29.424206790000007]}"
456,82063,82,18/1/1999,La Capital,Santa Fe,103-103,23.73,25,verano,1999-01-18,"[1999-01-18, 1999-01-19, 1999-01-20, 1999-01-21, 1999-01-22, 1999-01-23, 1999-01-24]",false,456,-31.18858147,-60.62677383,2.15,"[24.3, 0.1, 0, 0.2, 1.1, 18.7, 36.7]",2.3449957370758057E-4,296.0104122161865,Molisoles,-0.001433318480849266,0.3508262634277344,"{""type"":""Point"",""coordinates"":[-60.62677383,-31.18858147]}"
457,02014,2,5/2/1991,Comuna 14,Capital Federal,85-85,2.68,24,verano,1991-02-04,"[1991-02-04, 1991-02-05, 1991-02-06, 1991-02-07, 1991-02-08, 1991-02-09, 1991-02-10]",true,457,-34.57389998,-58.42243645,5.28,"[0.3, 0, 0, 0, 0, 2.1, 0]",6.034821271896362E-4,297.7331186930339,Miscelaneas,-0.004096531309187412,0.2992998758951823,"{""type"":""Point"",""coordinates"":[-58.42243645,-34.57389997999999]}"
458,06505,6,20/4/2012,Magdalena,Buenos Aires,3344-1739,9.75,18,otoño,2012-04-16,"[2012-04-16, 2012-04-17, 2012-04-18, 2012-04-19, 2012-04-20, 2012-04-21, 2012-04-22]",true,458,-35.17544498,-57.51894858,0.93,"[0, 1.9, 0, 0, 0, 0, 0]",4.112720489501953E-6,291.3797969818115,Complejo indiferenci,-0.002209465019404888,0.3912576039632161,"{""type"":""Point"",""coordinates"":[-57.51894857999999,-35.17544498]}"
459,14007,14,8/9/2012,Calamuchita,Cordoba,36828-7231,19.43,603,invierno,2012-09-03,"[2012-09-03, 2012-09-04, 2012-09-05, 2012-09-06, 2012-09-07, 2012-09-08, 2012-09-09]",false,459,-32.09286214,-64.56387845,5.66,"[5.1, 4.3, 6.3, 15.9, 0, 0, 1.4]",8.049607276916504E-5,289.37030029296875,Roca,-0.0019061723724007607,0.305511474609375,"{""type"":""Point"",""coordinates"":[-64.56387845,-32.09286214]}"
460,06245,6,11/9/2000,Ensenada,Buenos Aires,3314-1708,6.45,8,invierno,2000-09-11,"[2000-09-11, 2000-09-12, 2000-09-13, 2000-09-14, 2000-09-15, 2000-09-16, 2000-09-17]",true,460,-34.87584856,-57.9336299,5.71,"[0, 0, 0, 7.1, 1.6, 0.7, 0]",0.004859715700149536,288.05830510457355,Miscelaneas,-0.004220135509967804,0.4893805185953776,"{""type"":""Point"",""coordinates"":[-57.9336299,-34.875848559999994]}"
461,06098,6,22/1/2015,Berisso,Buenos Aires,3314-1708,0.7,7,verano,2015-01-19,"[2015-01-19, 2015-01-20, 2015-01-21, 2015-01-22, 2015-01-23, 2015-01-24, 2015-01-25]",true,461,-34.84587606,-57.87973336,3.58,"[9.9, 0, 0, 0, 0, 0, 0]",,,Miscelaneas,,,"{""type"":""Point"",""coordinates"":[-57.87973336,-34.84587606]}"
462,06749,6,25/12/2011,San Fernando,Buenos Aires,34847-6831,5.62,5,primavera,2011-12-19,"[2011-12-19, 2011-12-20, 2011-12-21, 2011-12-22, 2011-12-23, 2011-12-24, 2011-12-25]",true,462,-34.2256455,-58.5931568,3.84,"[0, 0, 1.4, 8.3, 8.6, 0, 0]",1.4901161193847656E-8,296.53115971883136,Rio,-0.0019783610478043556,0.3586750030517578,"{""type"":""Point"",""coordinates"":[-58.5931568,-34.2256455]}"
463,06805,6,11/12/2011,Tigre,Buenos Aires,34847-6831,1.44,4,primavera,2011-12-05,"[2011-12-05, 2011-12-06, 2011-12-07, 2011-12-08, 2011-12-09, 2011-12-10, 2011-12-11]",true,463,-34.3277116,-58.608687,3.84,"[0.2, 0, 0, 0, 0, 0, 1.2]",7.62939453125E-6,296.6652119954427,Rio,-0.002928357571363449,0.23161824544270834,"{""type"":""Point"",""coordinates"":[-58.608687,-34.3277116]}"
464,06861,6,23/1/1996,Vicente Lopez,Buenos Aires,36837-7237,3.72,28,verano,1996-01-22,"[1996-01-22, 1996-01-23, 1996-01-24, 1996-01-25, 1996-01-26, 1996-01-27, 1996-01-28]",true,464,-34.52591497,-58.53576394,1.13,"[0.1, 0, 0, 0, 0.3, 0, 0]",,,Miscelaneas,,,"{""type"":""Point"",""coordinates"":[-58.53576394000001,-34.52591497]}"
465,06035,6,25/11/2014,Avellaneda,Buenos Aires,35411-6952,1.59,6,primavera,2014-11-24,"[2014-11-24, 2014-11-25, 2014-11-26, 2014-11-27, 2014-11-28, 2014-11-29, 2014-11-30]",true,465,-34.67500565,-58.31056343,3.38,"[11, 0, 0, 0, 0, 23.7, 64.4]",,,Miscelaneas,,,"{""type"":""Point"",""coordinates"":[-58.31056343,-34.675005649999996]}"
466,06805,6,12/2/2004,Tigre,Buenos Aires,34847-6831,1.44,4,verano,2004-02-09,"[2004-02-09, 2004-02-10, 2004-02-11, 2004-02-12, 2004-02-13, 2004-02-14, 2004-02-15]",true,466,-34.3277116,-58.608687,3.84,"[0, 0, 0, 0.1, 8.6, 0, 0]",9.02712345123291E-5,298.7494125366211,Rio,-0.003685121424496174,0.255096435546875,"{""type"":""Point"",""coordinates"":[-58.608687,-34.3277116]}"
467,06770,6,11/11/2009,San Pedro,Buenos Aires,33257-6395,3.79,14,primavera,2009-11-09,"[2009-11-09, 2009-11-10, 2009-11-11, 2009-11-12, 2009-11-13, 2009-11-14, 2009-11-15]",true,467,-33.6362648,-59.7862782,1.45,"[3, 0, 0, 0, 0.8, 0, 0.3]",3.193318843841553E-5,290.8336645762126,Rio,-0.0035821981728076935,0.4483540852864583,"{""type"":""Point"",""coordinates"":[-59.78627819999999,-33.6362648]}"
468,06658,6,14/9/2000,Quilmes,Buenos Aires,35407-6950,4.25,3,invierno,2000-09-11,"[2000-09-11, 2000-09-12, 2000-09-13, 2000-09-14, 2000-09-15, 2000-09-16, 2000-09-17]",true,468,-34.70037841,-58.27664278,2.17,"[0, 0, 0, 10, 1.4, 0.4, 0]",,,Miscelaneas,,,"{""type"":""Point"",""coordinates"":[-58.276642779999996,-34.70037841]}"
469,06574,6,2/11/1996,Navarro,Buenos Aires,150-150,22.27,43,primavera,1996-10-28,"[1996-10-28, 1996-10-29, 1996-10-30, 1996-10-31, 1996-11-01, 1996-11-02, 1996-11-03]",false,469,-35.0117915,-59.4247779,3.87,"[5.6, 6.7, 0.6, 3.8, 0, 0, 1.8]",1.0377168655395508E-4,293.7214012145996,Molisoles,-0.004645988345146179,0.4623572031656901,"{""type"":""Point"",""coordinates"":[-59.42477790000001,-35.0117915]}"
470,06707,6,18/11/2008,Saladillo,Buenos Aires,9022-2838,28.23,40,primavera,2008-11-17,"[2008-11-17, 2008-11-18, 2008-11-19, 2008-11-20, 2008-11-21, 2008-11-22, 2008-11-23]",false,470,-35.6504504,-59.8096018,7.74,"[0, 0.1, 0, 0, 0, 0, 0]",7.450580596923828E-7,293.17182032267254,Molisoles,-0.0016328208148479462,0.2444616953531901,"{""type"":""Point"",""coordinates"":[-59.8096018,-35.6504504]}"
471,82063,82,11/10/1992,La Capital,Santa Fe,103-103,23.73,25,primavera,1992-10-05,"[1992-10-05, 1992-10-06, 1992-10-07, 1992-10-08, 1992-10-09, 1992-10-10, 1992-10-11]",false,471,-31.18858147,-60.62677383,2.15,"[8.9, 0, 0.6, 0, 0, 0, 0.3]",4.795640707015991E-4,292.22162946065265,Molisoles,-0.001563417725265026,0.4325173695882161,"{""type"":""Point"",""coordinates"":[-60.62677383,-31.18858147]}"
472,06287,6,27/3/2015,General Alvear,Buenos Aires,34350-6366,21.23,71,otoño,2015-03-23,"[2015-03-23, 2015-03-24, 2015-03-25, 2015-03-26, 2015-03-27, 2015-03-28, 2015-03-29]",false,472,-36.0095752,-60.2101369,11.05,"[0, 0.4, 1.4, 0, 0, 0, 0]",1.1771917343139648E-6,289.60707155863446,Molisoles,-6.223740056157112E-4,0.2763226826985677,"{""type"":""Point"",""coordinates"":[-60.2101369,-36.0095752]}"
473,06798,6,5/11/2010,Tapalque,Buenos Aires,34350-6366,29.39,107,primavera,2010-11-01,"[2010-11-01, 2010-11-02, 2010-11-03, 2010-11-04, 2010-11-05, 2010-11-06, 2010-11-07]",false,473,-36.475682,-60.1222218,2.48,"[0, 0, 1.3, 0.5, 0, 0, 28.1]",2.2351741790771484E-7,289.90659777323407,Molisoles,-0.004125859588384628,0.39437103271484375,"{""type"":""Point"",""coordinates"":[-60.1222218,-36.475682]}"
474,06609,6,27/2/2011,Pehuajo,Buenos Aires,6725-2212,72.84,89,verano,2011-02-21,"[2011-02-21, 2011-02-22, 2011-02-23, 2011-02-24, 2011-02-25, 2011-02-26, 2011-02-27]",false,474,-35.6179927,-62.0046671,1.47,"[0.8, 6.6, 8.6, 0, 0, 0, 0]",5.260109901428223E-6,295.5287342071533,Molisoles,-0.0027506574988365173,0.3815422058105469,"{""type"":""Point"",""coordinates"":[-62.0046671,-35.61799270000001]}"
475,82035,82,5/5/1994,Garay,Santa Fe,33531-6669,2.91,23,otoño,1994-05-02,"[1994-05-02, 1994-05-03, 1994-05-04, 1994-05-05, 1994-05-06, 1994-05-07, 1994-05-08]",true,475,-31.1523125,-60.1365521,2.36,"[14.1, 44.4, 0, 0, 1.1, 0.4, 19]",4.1359663009643555E-4,295.35202662150067,Molisoles,-0.0012468667700886726,0.4009113311767578,"{""type"":""Point"",""coordinates"":[-60.1365521,-31.152312499999997]}"
476,82098,82,1/3/1996,San Javier,Santa Fe,6247-1929,17.29,60,verano,1996-02-26,"[1996-02-26, 1996-02-27, 1996-02-28, 1996-02-29, 1996-03-01, 1996-03-02, 1996-03-03]",false,476,-29.42420679,-59.97955475,5.55,"[0.1, 9, 0.9, 0.6, 0, 0.3, 0.2]",1.2964010238647461E-5,298.4176502227783,Complejo indiferenci,-0.003725603222846985,0.4594491322835286,"{""type"":""Point"",""coordinates"":[-59.97955475,-29.424206790000007]}"
477,06287,6,13/6/2008,General Alvear,Buenos Aires,34350-6366,21.23,71,otoño,2008-06-09,"[2008-06-09, 2008-06-10, 2008-06-11, 2008-06-12, 2008-06-13, 2008-06-14, 2008-06-15]",false,477,-36.0095752,-60.2101369,11.05,"[7.2, 0, 0, 0, 0, 0, 0]",9.830296039581299E-5,281.86977704366046,Molisoles,-9.383382275700569E-4,0.4404144287109375,"{""type"":""Point"",""coordinates"":[-60.2101369,-36.0095752]}"
478,90084,90,18/2/2014,Capital,Tucuman,33966-6506,7.44,453,verano,2014-02-17,"[2014-02-17, 2014-02-18, 2014-02-19, 2014-02-20, 2014-02-21, 2014-02-22, 2014-02-23]",true,478,-26.82900979,-65.21054418,6.28,"[5.1, 16.8, 4.3, 0.3, 6.1, 9, 0.9]",2.4782121181488037E-4,293.9179935455322,Molisoles,-0.003246709704399109,0.48952166239420575,"{""type"":""Point"",""coordinates"":[-65.21054418,-26.829009789999997]}"
479,82084,82,16/11/1995,Rosario,Santa Fe,118-118,22.58,64,primavera,1995-11-13,"[1995-11-13, 1995-11-14, 1995-11-15, 1995-11-16, 1995-11-17, 1995-11-18, 1995-11-19]",false,479,-33.07901008,-60.91379957,1.11,"[0.5, 0, 0, 1.7, 1, 0, 0]",1.0207295417785645E-5,290.63809331258136,Alfisoles,-0.003662528470158577,0.3959217071533203,"{""type"":""Point"",""coordinates"":[-60.91379957,-33.07901008]}"
480,82028,82,18/3/2013,Constitucion,Santa Fe,36996-7283,18.3,104,verano,2013-03-18,"[2013-03-18, 2013-03-19, 2013-03-20, 2013-03-21, 2013-03-22, 2013-03-23, 2013-03-24]",false,480,-33.3790173,-61.3544315,1.85,"[0, 0, 0.5, 0, 0, 1.6, 0.4]",6.854534149169922E-7,290.38268025716144,Alfisoles,-0.0017294073477387428,0.3241869608561198,"{""type"":""Point"",""coordinates"":[-61.354431500000004,-33.37901730000001]}"
481,82049,82,28/2/2000,General Obligado,Santa Fe,32822-6509,17.99,58,verano,2000-02-28,"[2000-02-28, 2000-02-29, 2000-03-01, 2000-03-02, 2000-03-03, 2000-03-04, 2000-03-05]",false,481,-28.6765561,-59.7497004,1.41,"[0.5, 0, 1.3, 8.2, 21.8, 1.7, 8.2]",8.328258991241455E-5,293.68283716837567,Alfisoles,-0.004868112504482269,0.4851226806640625,"{""type"":""Point"",""coordinates"":[-59.7497004,-28.676556099999996]}"
482,26021,26,4/4/2003,Escalante,Chubut,6927-2157,90.29,605,otoño,2003-03-31,"[2003-03-31, 2003-04-01, 2003-04-02, 2003-04-03, 2003-04-04, 2003-04-05, 2003-04-06]",false,482,-45.89050293,-68.06896973,8.7,"[0, 0, 0, 0, 0, 0, 0]",4.470348358154297E-8,281.6195710500081,Aridisoles,-0.0015373285859823227,0.23673121134440103,"{""type"":""Point"",""coordinates"":[-68.06896973,-45.89050293]}"
483,30028,30,22/3/2005,Federacion,Entre Rios,1385-1073,7.52,49,otoño,2005-03-21,"[2005-03-21, 2005-03-22, 2005-03-23, 2005-03-24, 2005-03-25, 2005-03-26, 2005-03-27]",true,483,-30.70681007,-57.88784914,1.85,"[1.8, 12, 0, 0, 0, 0, 0.2]",2.3344159126281738E-4,296.1592852274577,Molisoles,-0.002803872339427471,0.11284955342610677,"{""type"":""Point"",""coordinates"":[-57.88784913999999,-30.70681007]}"
484,06735,6,3/2/2006,San Antonio de Areco,Buenos Aires,6906-2215,2.81,39,verano,2006-01-30,"[2006-01-30, 2006-01-31, 2006-02-01, 2006-02-02, 2006-02-03, 2006-02-04, 2006-02-05]",true,484,-34.2881384,-59.5070413,1.46,"[0, 0, 16.2, 0.7, 5.1, 49.5, 0]",5.841255187988281E-6,296.5190963745117,Molisoles,-0.004412539303302765,0.3202800750732422,"{""type"":""Point"",""coordinates"":[-59.5070413,-34.2881384]}"
485,06714,6,13/6/2002,Salto,Buenos Aires,31982-6397,17.53,69,otoño,2002-06-10,"[2002-06-10, 2002-06-11, 2002-06-12, 2002-06-13, 2002-06-14, 2002-06-15, 2002-06-16]",false,485,-34.1554316,-60.4724629,0,"[0, 0, 0, 0, 0, 0, 0]",0.0011198818683624268,278.348393758138,Molisoles,-0.0011157291010022163,0.43783315022786456,"{""type"":""Point"",""coordinates"":[-60.472462900000004,-34.1554316]}"
486,06623,6,28/7/2015,Pergamino,Buenos Aires,140-140,25.11,63,invierno,2015-07-27,"[2015-07-27, 2015-07-28, 2015-07-29, 2015-07-30, 2015-07-31, 2015-08-01, 2015-08-02]",false,486,-33.5893048,-60.7727646,0.93,"[0, 0, 0.3, 12.5, 41.1, 0, 0]",2.592802047729492E-6,289.1436398824056,Alfisoles,-0.0010988153517246246,0.3465843200683594,"{""type"":""Point"",""coordinates"":[-60.7727646,-33.5893048]}"
487,06077,6,4/8/2007,Bartolome Mitre,Buenos Aires,6745-2129,17.6,31,invierno,2007-07-30,"[2007-07-30, 2007-07-31, 2007-08-01, 2007-08-02, 2007-08-03, 2007-08-04, 2007-08-05]",false,487,-33.9628001,-59.8615291,2.16,"[0, 0, 0.6, 0, 4.5, 0, 0]",1.0959804058074951E-4,279.8052336374919,Molisoles,-0.00107613205909729,0.3617852528889974,"{""type"":""Point"",""coordinates"":[-59.861529100000006,-33.9628001]}"
488,50105,50,28/1/1999,San Rafael,Mendoza,36905-7260,15.55,545,verano,1999-01-25,"[1999-01-25, 1999-01-26, 1999-01-27, 1999-01-28, 1999-01-29, 1999-01-30, 1999-01-31]",false,488,-34.22018814,-67.91163635,2.91,"[0, 0.8, 2, 0.7, 0, 0, 0]",1.1534988880157471E-4,301.1779034932454,Entisoles,-5.798842757940292E-4,0.029580434163411457,"{""type"":""Point"",""coordinates"":[-67.91163635,-34.220188140000005]}"
489,30098,30,27/12/1998,Uruguay,Entre Rios,7061-2233,5.89,21,verano,1998-12-21,"[1998-12-21, 1998-12-22, 1998-12-23, 1998-12-24, 1998-12-25, 1998-12-26, 1998-12-27]",true,489,-32.38095474,-58.23688127,0,"[0.6, 0, 0, 0, 0, 0, 2.2]",2.511441707611084E-4,293.0369135538737,Entisoles,-0.004180749878287315,0.20070838928222656,"{""type"":""Point"",""coordinates"":[-58.23688127,-32.38095474000001]}"
490,18161,18,18/8/2002,San Roque,Corrientes,6577-2072,8.48,71,invierno,2002-08-12,"[2002-08-12, 2002-08-13, 2002-08-14, 2002-08-15, 2002-08-16, 2002-08-17, 2002-08-18]",true,490,-28.88393134,-58.78485627,3.17,"[0, 24.1, 0, 0.1, 5.6, 0, 3.5]",0.0011446177959442139,290.1871445973714,Molisoles,-0.0021887067705392838,0.34714698791503906,"{""type"":""Point"",""coordinates"":[-58.78485626999999,-28.883931339999997]}"
491,18147,18,4/10/2011,San Martin,Corrientes,71-71,6.69,68,primavera,2011-10-03,"[2011-10-03, 2011-10-04, 2011-10-05, 2011-10-06, 2011-10-07, 2011-10-08, 2011-10-09]",true,491,-29.3611063,-56.8024261,2.13,"[0, 9.1, 0, 0, 8.8, 27.3, 7.6]",3.8495659828186035E-4,289.53747685750324,Alfisoles,-0.004633443430066109,0.3992424011230469,"{""type"":""Point"",""coordinates"":[-56.8024261,-29.361106300000003]}"
492,18140,18,17/8/2000,San Luis del Palmar,Corrientes,6711-2131,17.23,66,invierno,2000-08-14,"[2000-08-14, 2000-08-15, 2000-08-16, 2000-08-17, 2000-08-18, 2000-08-19, 2000-08-20]",false,492,-27.41325145,-58.37888858,2.13,"[0.2, 0.2, 0, 0, 0, 0, 0]",7.435381412506104E-4,290.80505816141766,Alfisoles,-0.0015001073479652405,0.34055328369140625,"{""type"":""Point"",""coordinates"":[-58.378888579999995,-27.413251449999997]}"
493,30113,30,6/4/1992,Villaguay,Entre Rios,116-116,41.03,64,otoño,1992-04-06,"[1992-04-06, 1992-04-07, 1992-04-08, 1992-04-09, 1992-04-10, 1992-04-11, 1992-04-12]",false,493,-31.77167964,-59.57091449,0.93,"[16.4, 0, 0, 0, 1.8, 0.1, 0]",0.001375734806060791,291.41704813639325,Vertisoles,-0.002031932584941387,0.4755115509033203,"{""type"":""Point"",""coordinates"":[-59.57091449000001,-31.77167964]}"
494,30063,30,12/11/2001,Islas del Ibicuy,Entre Rios,25459-1836,8.14,3,primavera,2001-11-12,"[2001-11-12, 2001-11-13, 2001-11-14, 2001-11-15, 2001-11-16, 2001-11-17, 2001-11-18]",true,494,-33.7787707,-58.54070986,2.16,"[0.1, 2.3, 0.2, 0, 0, 0, 0]",0.0018623769283294678,292.5507017771403,Entisoles,-0.00494791753590107,0.5233860015869141,"{""type"":""Point"",""coordinates"":[-58.54070986000001,-33.7787707]}"
495,30056,30,22/11/2009,Gualeguaychu,Entre Rios,9550-2853,31.43,22,primavera,2009-11-16,"[2009-11-16, 2009-11-17, 2009-11-18, 2009-11-19, 2009-11-20, 2009-11-21, 2009-11-22]",false,495,-33.15450509,-58.98890113,0,"[0, 30.6, 46.5, 35, 0, 13.9, 0]",1.6689300537109375E-6,294.84179433186847,Alfisoles,-0.00450732558965683,0.3551190694173177,"{""type"":""Point"",""coordinates"":[-58.98890113000001,-33.15450509]}"
496,30015,30,1/9/1993,Concordia,Entre Rios,6557-2063,4.51,37,invierno,1993-08-30,"[1993-08-30, 1993-08-31, 1993-09-01, 1993-09-02, 1993-09-03, 1993-09-04, 1993-09-05]",true,496,-31.35230446,-58.05355072,6.42,"[8.6, 3.5, 0.6, 0, 0, 0, 0]",8.94591212272644E-4,288.0453058878581,Vertisoles,-0.0011172592639923096,0.2528394063313802,"{""type"":""Point"",""coordinates"":[-58.05355072,-31.352304459999996]}"
497,22140,22,1/9/2003,San Fernando,Chaco,6254-1933,11.88,54,invierno,2003-09-01,"[2003-09-01, 2003-09-02, 2003-09-03, 2003-09-04, 2003-09-05, 2003-09-06, 2003-09-07]",true,497,-27.92561531,-59.31798172,2.97,"[0, 0, 0, 0, 0, 0, 10]",4.3548643589019775E-4,288.2087631225586,Complejo indiferenci,-0.002583833411335945,0.2337334950764974,"{""type"":""Point"",""coordinates"":[-59.317981720000006,-27.925615310000005]}"
498,22126,22,10/3/2003,1 de Mayo,Chaco,32633-6454,13.09,57,verano,2003-03-10,"[2003-03-10, 2003-03-11, 2003-03-12, 2003-03-13, 2003-03-14, 2003-03-15, 2003-03-16]",true,498,-27.22855035,-58.90405078,1.85,"[11.7, 2.8, 0.2, 3, 8.7, 35.5, 38.8]",0.0010245144367218018,298.6740188598633,Molisoles,-0.003750905394554138,0.48366228739420575,"{""type"":""Point"",""coordinates"":[-58.904050780000006,-27.22855035]}"
499,14098,14,13/2/2013,Rio Cuarto,Cordoba,34345-6361,23.14,514,verano,2013-02-11,"[2013-02-11, 2013-02-12, 2013-02-13, 2013-02-14, 2013-02-15, 2013-02-16, 2013-02-17]",false,499,-32.64751095,-64.22141859,2.88,"[0, 0, 25.9, 0.1, 1.1, 0.3, 7.7]",4.470348358154297E-8,298.59445571899414,Complejo indiferenci,-7.614707574248314E-4,0.1270898183186849,"{""type"":""Point"",""coordinates"":[-64.22141859,-32.64751095]}"
500,18021,18,28/4/1996,Capital,Corrientes,6611-2085,6.4,45,otoño,1996-04-22,"[1996-04-22, 1996-04-23, 1996-04-24, 1996-04-25, 1996-04-26, 1996-04-27, 1996-04-28]",true,500,-27.4064,-58.78276,12.77,"[0.1, 13.7, 41.5, 26.2, 0, 13.1, 20.9]",8.00400972366333E-4,295.89542897542316,Rio,-0.002554725855588913,0.30837758382161456,"{""type"":""Point"",""coordinates"":[-58.78276,-27.4064]}"
501,30008,30,13/11/2010,Colon,Entre Rios,32026-6403,25.96,31,primavera,2010-11-08,"[2010-11-08, 2010-11-09, 2010-11-10, 2010-11-11, 2010-11-12, 2010-11-13, 2010-11-14]",false,501,-31.70735861,-58.28660961,1.43,"[4.7, 29.2, 0, 0, 0, 0, 0]",2.9468536376953125E-4,298.3307247161865,Entisoles,-0.0041504353284835815,0.2836875915527344,"{""type"":""Point"",""coordinates"":[-58.28660961,-31.70735861]}"
502,30028,30,19/9/1991,Federacion,Entre Rios,1385-1073,7.52,49,invierno,1991-09-16,"[1991-09-16, 1991-09-17, 1991-09-18, 1991-09-19, 1991-09-20, 1991-09-21, 1991-09-22]",true,502,-30.70681007,-57.88784914,1.85,"[0.4, 33.5, 0, 0, 0, 0, 0]",0.0020449459552764893,290.7375685373942,Molisoles,-0.001389404758810997,0.2567221323649089,"{""type"":""Point"",""coordinates"":[-57.88784913999999,-30.70681007]}"
503,18105,18,1/4/2000,Mercedes,Corrientes,34121-6735,25.8,80,otoño,2000-03-27,"[2000-03-27, 2000-03-28, 2000-03-29, 2000-03-30, 2000-03-31, 2000-04-01, 2000-04-02]",false,503,-29.06,-57.76000002,0,"[40.2, 0, 0, 3, 9.5, 6.2, 0]",0.013728082180023193,292.71759541829425,Entisoles,-0.0013832207769155502,0.4736766815185547,"{""type"":""Point"",""coordinates"":[-57.76000002,-29.06]}"
504,18070,18,6/6/1993,Goya,Corrientes,6624-2091,11.86,59,otoño,1993-05-31,"[1993-05-31, 1993-06-01, 1993-06-02, 1993-06-03, 1993-06-04, 1993-06-05, 1993-06-06]",true,504,-29.1751244,-58.88982054,2.14,"[0, 0, 0, 1.5, 0.1, 0.1, 0]",6.365329027175903E-4,283.53819211324054,Rio,-0.00212106853723526,0.3695799509684245,"{""type"":""Point"",""coordinates"":[-58.889820540000024,-29.1751244]}"
505,22077,22,18/4/2008,Libertad,Chaco,9491-2841,1.71,66,otoño,2008-04-14,"[2008-04-14, 2008-04-15, 2008-04-16, 2008-04-17, 2008-04-18, 2008-04-19, 2008-04-20]",true,505,-27.26945671,-59.21122233,3.13,"[0.8, 0, 0, 0, 0, 1.1, 0.7]",8.985400199890137E-6,287.53815269470215,Entisoles,-0.00397048145532608,0.45917002360026044,"{""type"":""Point"",""coordinates"":[-59.21122232999999,-27.26945671]}"
506,22014,22,15/6/2004,Bermejo,Chaco,32998-6511,18.89,65,otoño,2004-06-14,"[2004-06-14, 2004-06-15, 2004-06-16, 2004-06-17, 2004-06-18, 2004-06-19, 2004-06-20]",false,506,-26.92175039,-58.77874597,2.28,"[0, 0, 0, 0, 0, 0, 0]",3.978610038757324E-6,283.41703097025555,Rio,-0.0011357180774211884,0.37343724568684894,"{""type"":""Point"",""coordinates"":[-58.77874597,-26.92175039]}"
507,30035,30,2/2/2015,Federal,Entre Rios,36958-7272,25.83,66,verano,2015-02-02,"[2015-02-02, 2015-02-03, 2015-02-04, 2015-02-05, 2015-02-06, 2015-02-07, 2015-02-08]",false,507,-30.97193714,-58.99327599,2.16,"[0, 5.9, 0.1, 0.2, 0.1, 0, 0]",3.861039876937866E-4,299.1510836283366,Vertisoles,-0.005385901778936386,0.33704694112141925,"{""type"":""Point"",""coordinates"":[-58.99327599,-30.971937140000005]}"
508,82063,82,25/6/1994,La Capital,Santa Fe,103-103,23.73,25,otoño,1994-06-20,"[1994-06-20, 1994-06-21, 1994-06-22, 1994-06-23, 1994-06-24, 1994-06-25, 1994-06-26]",false,508,-31.18858147,-60.62677383,2.15,"[8.1, 0, 4.7, 0, 0, 0, 0]",2.5869905948638916E-4,284.95439465840656,Molisoles,-0.0013392502442002296,0.4635295867919922,"{""type"":""Point"",""coordinates"":[-60.62677383,-31.18858147]}"
509,50028,50,15/9/2005,Guaymallen,Mendoza,32300-6465,57.79,677,invierno,2005-09-12,"[2005-09-12, 2005-09-13, 2005-09-14, 2005-09-15, 2005-09-16, 2005-09-17, 2005-09-18]",false,509,-32.92076147,-68.70711858,1.1,"[2.8, 1.8, 0, 0, 0, 0, 0]",2.1904706954956055E-5,276.65975125630695,Entisoles,-0.0016966275870800018,0.25893910725911456,"{""type"":""Point"",""coordinates"":[-68.70711858,-32.92076147000001]}"
510,82084,82,13/11/1994,Rosario,Santa Fe,118-118,22.58,64,primavera,1994-11-07,"[1994-11-07, 1994-11-08, 1994-11-09, 1994-11-10, 1994-11-11, 1994-11-12, 1994-11-13]",false,510,-33.07901008,-60.91379957,1.11,"[0, 0.8, 0, 0, 0.5, 0, 0]",6.461143493652344E-5,293.5481707255046,Alfisoles,-0.004376508295536041,0.362124760945638,"{""type"":""Point"",""coordinates"":[-60.91379957,-33.07901008]}"
511,82049,82,4/10/2013,General Obligado,Santa Fe,32822-6509,17.99,58,primavera,2013-09-30,"[2013-09-30, 2013-10-01, 2013-10-02, 2013-10-03, 2013-10-04, 2013-10-05, 2013-10-06]",false,511,-28.6765561,-59.7497004,1.41,"[0.3, 0, 0, 0, 0, 0, 0]",4.649162292480469E-6,288.02205721537274,Alfisoles,-0.002806633710861206,0.324886957804362,"{""type"":""Point"",""coordinates"":[-59.7497004,-28.676556099999996]}"
512,30070,30,9/8/1999,La Paz,Entre Rios,6543-2055,11.16,36,invierno,1999-08-09,"[1999-08-09, 1999-08-10, 1999-08-11, 1999-08-12, 1999-08-13, 1999-08-14, 1999-08-15]",true,512,-30.60360412,-59.52751986,4.26,"[0, 0, 0, 7.7, 0, 0.1, 0]",6.271898746490479E-5,285.6703681945801,Molisoles,-0.0023511499166488647,0.41076914469401044,"{""type"":""Point"",""coordinates"":[-59.52751986,-30.60360412]}"
513,30049,30,4/3/1995,Gualeguay,Entre Rios,39-39,13.76,2,verano,1995-02-27,"[1995-02-27, 1995-02-28, 1995-03-01, 1995-03-02, 1995-03-03, 1995-03-04, 1995-03-05]",true,513,-33.55871824,-59.48052013,2.16,"[1.3, 0.3, 0, 0.1, 2.6, 0.2, 0]",4.8667192459106445E-5,295.62346903483075,Entisoles,-0.002910289913415909,0.450778325398763,"{""type"":""Point"",""coordinates"":[-59.48052013,-33.558718240000005]}"
514,82028,82,9/10/2010,Constitucion,Santa Fe,36996-7283,18.3,104,primavera,2010-10-04,"[2010-10-04, 2010-10-05, 2010-10-06, 2010-10-07, 2010-10-08, 2010-10-09, 2010-10-10]",false,514,-33.3790173,-61.3544315,1.85,"[0, 0, 11.5, 1.6, 0, 0, 0]",8.940696716308594E-7,288.95250574747723,Alfisoles,-0.003289693035185337,0.37762896219889325,"{""type"":""Point"",""coordinates"":[-61.354431500000004,-33.37901730000001]}"
515,30105,30,16/12/2003,Victoria,Entre Rios,37055-7301,21.48,5,primavera,2003-12-15,"[2003-12-15, 2003-12-16, 2003-12-17, 2003-12-18, 2003-12-19, 2003-12-20, 2003-12-21]",false,515,-32.957337,-60.049086,1.85,"[3.7, 0, 0, 0, 0, 3.4, 11.1]",1.97485089302063E-4,294.551321665446,Molisoles,-0.004179096780717373,0.4735616048177083,"{""type"":""Point"",""coordinates"":[-60.049086,-32.957337]}"
516,30021,30,23/8/2002,Diamante,Entre Rios,3331-1725,3.81,30,invierno,2002-08-19,"[2002-08-19, 2002-08-20, 2002-08-21, 2002-08-22, 2002-08-23, 2002-08-24, 2002-08-25]",true,516,-32.01197804,-60.61726225,1.43,"[7.9, 0, 0, 0, 0, 0, 0]",0.004466518759727478,289.1679350535075,Molisoles,-0.002176857553422451,0.4448509216308594,"{""type"":""Point"",""coordinates"":[-60.61726225,-32.01197804]}"
517,02012,2,27/6/1994,Comuna 12,Capital Federal,54-54,3.13,20,invierno,1994-06-27,"[1994-06-27, 1994-06-28, 1994-06-29, 1994-06-30, 1994-07-01, 1994-07-02, 1994-07-03]",true,517,-34.56062514,-58.47494475,0.93,"[0, 0, 5.9, 1.3, 0, 0, 0]",0.0012516826391220093,279.0869623819987,Miscelaneas,-0.0016349665820598602,0.3567638397216797,"{""type"":""Point"",""coordinates"":[-58.474944750000006,-34.560625140000006]}"
518,62021,62,8/10/2000,Bariloche,Rio Negro,6953-2144,0.07,408,primavera,2000-10-02,"[2000-10-02, 2000-10-03, 2000-10-04, 2000-10-05, 2000-10-06, 2000-10-07, 2000-10-08]",true,518,-41.89814608,-71.50316469,2.66,"[9.2, 0.2, 0, 4.5, 0.1, 0.2, 3.9]",0.010482162237167358,277.126615524292,Inceptisoles,2.15873122215271E-4,0.46665700276692706,"{""type"":""Point"",""coordinates"":[-71.50316469000002,-41.898146080000004]}"
519,62021,62,24/2/2008,Bariloche,Rio Negro,6953-2144,0.07,408,verano,2008-02-18,"[2008-02-18, 2008-02-19, 2008-02-20, 2008-02-21, 2008-02-22, 2008-02-23, 2008-02-24]",true,519,-41.89814608,-71.50316469,2.66,"[0, 0, 0, 0, 0, 0, 0]",2.4847686290740967E-4,288.2872994740804,Inceptisoles,-0.0017956215888261795,0.2965005238850911,"{""type"":""Point"",""coordinates"":[-71.50316469000002,-41.898146080000004]}"
520,62021,62,3/3/1993,Bariloche,Rio Negro,6953-2144,0.07,408,verano,1993-03-01,"[1993-03-01, 1993-03-02, 1993-03-03, 1993-03-04, 1993-03-05, 1993-03-06, 1993-03-07]",true,520,-41.89814608,-71.50316469,2.66,"[0, 0, 6.9, 0.8, 0, 0, 0]",2.590566873550415E-4,288.0848801930745,Inceptisoles,-0.0020081661641597748,0.33409754435221356,"{""type"":""Point"",""coordinates"":[-71.50316469000002,-41.898146080000004]}"
521,62021,62,7/6/1991,Bariloche,Rio Negro,6953-2144,0.07,408,otoño,1991-06-03,"[1991-06-03, 1991-06-04, 1991-06-05, 1991-06-06, 1991-06-07, 1991-06-08, 1991-06-09]",true,521,-41.89814608,-71.50316469,2.66,"[0.8, 0.6, 0, 0, 0, 0, 0]",0.0011948645114898682,273.70127550760907,Inceptisoles,5.1394104957580566E-5,0.4696051279703776,"{""type"":""Point"",""coordinates"":[-71.50316469000002,-41.898146080000004]}"
522,62021,62,10/5/2011,Bariloche,Rio Negro,6953-2144,0.07,408,otoño,2011-05-09,"[2011-05-09, 2011-05-10, 2011-05-11, 2011-05-12, 2011-05-13, 2011-05-14, 2011-05-15]",true,522,-41.89814608,-71.50316469,2.66,"[0, 8.1, 0, 0.4, 0.3, 0, 0]",4.40061092376709E-4,277.63733291625977,Inceptisoles,-4.486851394176483E-4,0.46637407938639325,"{""type"":""Point"",""coordinates"":[-71.50316469000002,-41.898146080000004]}"
523,58070,58,24/1/1990,Los Lagos,Neuquen,33703-6477,20.32,918,verano,1990-01-22,"[1990-01-22, 1990-01-23, 1990-01-24, 1990-01-25, 1990-01-26, 1990-01-27, 1990-01-28]",false,523,-40.7275238,-71.67723084,3.7,"[0, 0, 0.2, 5.6, 6.9, 26.7, 1.5]",0.001825377345085144,287.11991182963055,Inceptisoles,-0.003737536258995533,0.2676232655843099,"{""type"":""Point"",""coordinates"":[-71.67723084,-40.7275238]}"
524,34035,34,25/12/1998,Patino,Formosa,34065-6553,11.81,124,verano,1998-12-21,"[1998-12-21, 1998-12-22, 1998-12-23, 1998-12-24, 1998-12-25, 1998-12-26, 1998-12-27]",true,524,-24.61192,-60.30033,0,"[24.8, 0, 0, 0, 0, 0.1, 2.7]",1.4795362949371338E-4,297.20642852783203,Rio,-0.0032227952033281326,0.30759620666503906,"{""type"":""Point"",""coordinates"":[-60.30033000000001,-24.611919999999998]}"
525,26035,26,21/4/2011,Futaleufu,Chubut,6680-2145,1.68,556,otoño,2011-04-18,"[2011-04-18, 2011-04-19, 2011-04-20, 2011-04-21, 2011-04-22, 2011-04-23, 2011-04-24]",true,525,-43.48395319,-71.59418478,8.92,"[0.7, 0, 0.9, 42.7, 7, 7.6, 12.1]",7.317662239074707E-4,279.01562881469727,Aridisoles,-5.693184211850166E-4,0.5049349466959635,"{""type"":""Point"",""coordinates"":[-71.59418478,-43.48395319]}"
526,26014,26,6/2/1996,Cushamen,Chubut,36848-7245,2.82,312,verano,1996-02-05,"[1996-02-05, 1996-02-06, 1996-02-07, 1996-02-08, 1996-02-09, 1996-02-10, 1996-02-11]",true,526,-42.03927359,-71.56551616,3.05,"[3, 1.7, 1, 0.2, 1.3, 0, 0]",7.841438055038452E-4,276.2611363728841,Entisoles,-0.002122005447745323,0.385589599609375,"{""type"":""Point"",""coordinates"":[-71.56551616,-42.03927359]}"
527,02014,2,24/12/2012,Comuna 14,Capital Federal,85-85,2.68,24,verano,2012-12-24,"[2012-12-24, 2012-12-25, 2012-12-26, 2012-12-27, 2012-12-28, 2012-12-29, 2012-12-30]",true,527,-34.57389998,-58.42243645,5.28,"[0.9, 3.1, 0, 0, 0, 0, 0]",9.631365537643433E-4,301.51670900980633,Miscelaneas,-0.004291820339858532,0.28983434041341144,"{""type"":""Point"",""coordinates"":[-58.42243645,-34.57389997999999]}"
528,66133,66,14/5/2007,Rivadavia,Salta,6362-1978,14.31,246,otoño,2007-05-14,"[2007-05-14, 2007-05-15, 2007-05-16, 2007-05-17, 2007-05-18, 2007-05-19, 2007-05-20]",true,528,-22.49881,-62.40759,1,"[0, 0, 2.3, 0, 0, 0, 0]",3.129243850708008E-7,293.12278175354004,Molisoles,-0.0011249920353293419,0.22127087910970053,"{""type"":""Point"",""coordinates"":[-62.40759,-22.498810000000002]}"
529,70119,70,4/8/2015,Valle Fertil,San Juan,34179-6743,71.88,763,invierno,2015-08-03,"[2015-08-03, 2015-08-04, 2015-08-05, 2015-08-06, 2015-08-07, 2015-08-08, 2015-08-09]",false,529,-30.80415774,-67.366235,3.37,"[0, 0.1, 0.3, 0, 0.1, 7, 0]",7.06017017364502E-5,290.27111117045087,Entisoles,-1.6776472330093384E-4,0.029596964518229168,"{""type"":""Point"",""coordinates"":[-67.366235,-30.80415774]}"
530,82126,82,16/12/2005,San Martin,Santa Fe,36872-7253,53.42,73,primavera,2005-12-12,"[2005-12-12, 2005-12-13, 2005-12-14, 2005-12-15, 2005-12-16, 2005-12-17, 2005-12-18]",false,530,-31.84254265,-61.56270981,1.43,"[0, 0, 0, 1.9, 26.6, 0, 1]",2.2351741790771484E-6,296.09667523701984,Molisoles,-0.0026129260659217834,0.2839711507161458,"{""type"":""Point"",""coordinates"":[-61.56270981,-31.84254265]}"
531,82105,82,7/3/1994,San Jeronimo,Santa Fe,123-123,29.33,42,verano,1994-03-07,"[1994-03-07, 1994-03-08, 1994-03-09, 1994-03-10, 1994-03-11, 1994-03-12, 1994-03-13]",false,531,-32.2399352,-61.231266,4.95,"[0, 0, 0, 0, 0, 0, 0]",5.435943603515625E-5,296.8524475097656,Molisoles,-0.0025409525260329247,0.27319081624348956,"{""type"":""Point"",""coordinates"":[-61.231266,-32.2399352]}"
532,30098,30,20/6/1996,Uruguay,Entre Rios,7061-2233,5.89,21,otoño,1996-06-17,"[1996-06-17, 1996-06-18, 1996-06-19, 1996-06-20, 1996-06-21, 1996-06-22, 1996-06-23]",true,532,-32.38095474,-58.23688127,0,"[0, 0, 0, 0.6, 0, 0, 0]",5.748867988586426E-5,285.75093777974445,Entisoles,-9.108837693929672E-4,0.25756390889485675,"{""type"":""Point"",""coordinates"":[-58.23688127,-32.38095474000001]}"
533,30021,30,5/4/2000,Diamante,Entre Rios,3331-1725,3.81,30,otoño,2000-04-03,"[2000-04-03, 2000-04-04, 2000-04-05, 2000-04-06, 2000-04-07, 2000-04-08, 2000-04-09]",true,533,-32.01197804,-60.61726225,1.43,"[39.8, 5.3, 0, 63.6, 24.8, 0, 8.8]",0.0037071704864501953,289.3628094991048,Molisoles,-0.001507870852947235,0.4100182851155599,"{""type"":""Point"",""coordinates"":[-60.61726225,-32.01197804]}"
534,14140,14,7/8/2009,San Justo,Cordoba,6955-2119,12.54,107,invierno,2009-08-03,"[2009-08-03, 2009-08-04, 2009-08-05, 2009-08-06, 2009-08-07, 2009-08-08, 2009-08-09]",true,534,-31.23400374,-62.74066613,1.08,"[0, 0, 0, 0, 0, 0, 0]",6.407499313354492E-7,284.0741678873698,Alfisoles,-7.050801068544388E-4,0.18331400553385416,"{""type"":""Point"",""coordinates"":[-62.74066613,-31.234003740000002]}"
535,14133,14,19/12/2009,San Javier,Cordoba,9461-2776,37.8,572,primavera,2009-12-14,"[2009-12-14, 2009-12-15, 2009-12-16, 2009-12-17, 2009-12-18, 2009-12-19, 2009-12-20]",false,535,-32.01613487,-65.16382005,2.78,"[1.2, 2.8, 1.9, 0, 5.9, 15.1, 0.5]",2.5779008865356445E-6,298.0851294199626,Entisoles,-0.0027086930349469185,0.16706085205078125,"{""type"":""Point"",""coordinates"":[-65.16382005,-32.01613487]}"
536,14091,14,23/6/2001,Punilla,Cordoba,36828-7231,28.57,1223,otoño,2001-06-18,"[2001-06-18, 2001-06-19, 2001-06-20, 2001-06-21, 2001-06-22, 2001-06-23, 2001-06-24]",false,536,-31.10580063,-64.59128571,2.98,"[0, 0, 0, 0, 0, 0, 0.9]",4.903823137283325E-4,273.39724922180176,Molisoles,-9.135939180850983E-4,0.3764972686767578,"{""type"":""Point"",""coordinates"":[-64.59128571,-31.105800630000005]}"
537,14021,14,21/6/2015,Colon,Cordoba,33948-6745,20.69,355,otoño,2015-06-15,"[2015-06-15, 2015-06-16, 2015-06-17, 2015-06-18, 2015-06-19, 2015-06-20, 2015-06-21]",false,537,-31.25624481,-63.95340394,0.93,"[0, 0, 0, 0, 0, 0, 0]",3.129243850708008E-7,283.7178414662679,Miscelaneas,-9.213890880346298E-4,0.20935376485188803,"{""type"":""Point"",""coordinates"":[-63.953403939999994,-31.256244809999995]}"
538,14014,14,9/3/2012,Capital,Cordoba,37574-7384,24.04,426,verano,2012-03-05,"[2012-03-05, 2012-03-06, 2012-03-07, 2012-03-08, 2012-03-09, 2012-03-10, 2012-03-11]",false,538,-31.47878838,-64.14509583,2.86,"[29, 3.2, 1.3, 8.5, 2.6, 0, 0]",0.006869882345199585,297.9339599609375,Miscelaneas,-0.0035059042274951935,0.36620839436848956,"{""type"":""Point"",""coordinates"":[-64.14509583,-31.478788380000008]}"
539,14147,14,28/6/2007,Santa Maria,Cordoba,37574-7384,17.55,469,invierno,2007-06-25,"[2007-06-25, 2007-06-26, 2007-06-27, 2007-06-28, 2007-06-29, 2007-06-30, 2007-07-01]",false,539,-31.55910043,-64.19196866,4.28,"[0.3, 0, 0, 0, 0, 0, 0]",5.260109901428223E-6,279.2487316131592,Roca,-0.0010029757395386696,0.25319353739420575,"{""type"":""Point"",""coordinates"":[-64.19196866,-31.55910043]}"
540,02004,2,16/2/2003,Comuna 4,Capital Federal,8891-2706,2.09,10,verano,2003-02-10,"[2003-02-10, 2003-02-11, 2003-02-12, 2003-02-13, 2003-02-14, 2003-02-15, 2003-02-16]",true,540,-34.64641355,-58.38427103,1.46,"[21.9, 28, 0.2, 0, 0, 19.5, 0]",6.834119558334351E-4,298.06653086344403,Miscelaneas,-0.002502686344087124,0.3217283884684245,"{""type"":""Point"",""coordinates"":[-58.384271029999994,-34.64641355]}"
541,54028,54,23/10/1990,Capital,Misiones,14-14,8.07,150,primavera,1990-10-22,"[1990-10-22, 1990-10-23, 1990-10-24, 1990-10-25, 1990-10-26, 1990-10-27, 1990-10-28]",true,541,-27.47659493,-55.92169961,2.79,"[0, 0, 0.9, 0.1, 7.1, 0, 0.3]",0.0017982572317123413,295.1743043263753,Alfisoles,-0.005136045627295971,0.4078356424967448,"{""type"":""Point"",""coordinates"":[-55.92169961,-27.47659493]}"
542,02013,2,6/12/2001,Comuna 13,Capital Federal,54-54,3.99,10,primavera,2001-12-03,"[2001-12-03, 2001-12-04, 2001-12-05, 2001-12-06, 2001-12-07, 2001-12-08, 2001-12-09]",true,542,-34.55488152,-58.4502891,3.85,"[0, 0.1, 0, 0, 14.8, 0, 0]",0.0017252117395401,288.11469650268555,Miscelaneas,-0.00267181359231472,0.3267046610514323,"{""type"":""Point"",""coordinates"":[-58.4502891,-34.55488152]}"
543,02003,2,10/3/2001,Comuna 3,Capital Federal,85-85,2.82,29,verano,2001-03-05,"[2001-03-05, 2001-03-06, 2001-03-07, 2001-03-08, 2001-03-09, 2001-03-10, 2001-03-11]",true,543,-34.60909977,-58.40306252,1.46,"[16.3, 0.2, 0, 0, 0, 0, 0.5]",0.0012751966714859009,299.01401392618817,Miscelaneas,-0.002688085660338402,0.43361790974934894,"{""type"":""Point"",""coordinates"":[-58.403062520000006,-34.60909977000001]}"
544,02014,2,22/3/2012,Comuna 14,Capital Federal,85-85,2.68,24,verano,2012-03-19,"[2012-03-19, 2012-03-20, 2012-03-21, 2012-03-22, 2012-03-23, 2012-03-24, 2012-03-25]",true,544,-34.57389998,-58.42243645,5.28,"[2.4, 9.2, 2.3, 0, 0, 0, 8]",9.605288505554199E-5,297.8931706746419,Miscelaneas,-0.0021493565291166306,0.2112725575764974,"{""type"":""Point"",""coordinates"":[-58.42243645,-34.57389997999999]}"
545,02004,2,26/2/1990,Comuna 4,Capital Federal,8891-2706,2.09,10,verano,1990-02-26,"[1990-02-26, 1990-02-27, 1990-02-28, 1990-03-01, 1990-03-02, 1990-03-03, 1990-03-04]",true,545,-34.64641355,-58.38427103,1.46,"[0, 4.3, 0.8, 1.3, 0, 1.7, 5.4]",8.269250392913818E-4,292.0988941192627,Miscelaneas,-0.005603516474366188,0.4195963541666667,"{""type"":""Point"",""coordinates"":[-58.384271029999994,-34.64641355]}"
546,02003,2,6/4/2000,Comuna 3,Capital Federal,85-85,2.82,29,otoño,2000-04-03,"[2000-04-03, 2000-04-04, 2000-04-05, 2000-04-06, 2000-04-07, 2000-04-08, 2000-04-09]",true,546,-34.60909977,-58.40306252,1.46,"[1.6, 5.5, 0, 2.2, 56, 0, 20.8]",1.234114170074463E-4,290.9545249938965,Miscelaneas,-0.0020574769005179405,0.2572244008382161,"{""type"":""Point"",""coordinates"":[-58.403062520000006,-34.60909977000001]}"
547,02014,2,28/2/1996,Comuna 14,Capital Federal,85-85,2.68,24,verano,1996-02-26,"[1996-02-26, 1996-02-27, 1996-02-28, 1996-02-29, 1996-03-01, 1996-03-02, 1996-03-03]",true,547,-34.57389998,-58.42243645,5.28,"[0, 0, 8.1, 0.6, 0, 0, 0]",7.714331150054932E-5,297.2203845977783,Miscelaneas,-0.0042461976408958435,0.31530189514160156,"{""type"":""Point"",""coordinates"":[-58.42243645,-34.57389997999999]}"
548,02002,2,14/1/2014,Comuna 2,Capital Federal,85-85,1.52,30,verano,2014-01-13,"[2014-01-13, 2014-01-14, 2014-01-15, 2014-01-16, 2014-01-17, 2014-01-18, 2014-01-19]",true,548,-34.58587601,-58.39499618,1.85,"[0, 0, 0, 0, 0, 0, 0.3]",1.4671683311462402E-4,295.3755366007487,Miscelaneas,-0.0032389312982559204,0.17194430033365884,"{""type"":""Point"",""coordinates"":[-58.39499618,-34.58587601000001]}"
549,06861,6,27/11/2000,Vicente Lopez,Buenos Aires,36837-7237,3.72,28,primavera,2000-11-27,"[2000-11-27, 2000-11-28, 2000-11-29, 2000-11-30, 2000-12-01, 2000-12-02, 2000-12-03]",true,549,-34.52591497,-58.53576394,1.13,"[1.1, 0.2, 0, 0, 0, 0, 0.5]",,,Miscelaneas,,,"{""type"":""Point"",""coordinates"":[-58.53576394000001,-34.52591497]}"
550,06434,6,15/9/1997,Lanus,Buenos Aires,8891-2706,4.6,5,invierno,1997-09-15,"[1997-09-15, 1997-09-16, 1997-09-17, 1997-09-18, 1997-09-19, 1997-09-20, 1997-09-21]",true,550,-34.69095715,-58.38386285,4.6,"[0, 0, 0, 0, 1.8, 0.4, 0]",4.3138861656188965E-5,285.1741663614909,Miscelaneas,-0.0028180964291095734,0.3525644938151042,"{""type"":""Point"",""coordinates"":[-58.38386285000001,-34.69095715000001]}"
551,06035,6,1/4/1993,Avellaneda,Buenos Aires,35411-6952,1.59,6,otoño,1993-03-29,"[1993-03-29, 1993-03-30, 1993-03-31, 1993-04-01, 1993-04-02, 1993-04-03, 1993-04-04]",true,551,-34.67500565,-58.31056343,3.38,"[2.1, 0, 0, 0, 7.8, 33.6, 15.8]",,,Miscelaneas,,,"{""type"":""Point"",""coordinates"":[-58.31056343,-34.675005649999996]}"
552,06357,6,28/5/2005,General Pueyrredon,Buenos Aires,3347-1742,17.47,21,otoño,2005-05-23,"[2005-05-23, 2005-05-24, 2005-05-25, 2005-05-26, 2005-05-27, 2005-05-28, 2005-05-29]",false,552,-37.80766254,-57.62989086,5.55,"[0, 0, 0, 0.6, 0, 0, 5.9]",1.0013580322265625E-5,284.9856293996175,Molisoles,-7.760170847177505E-4,0.34064292907714844,"{""type"":""Point"",""coordinates"":[-57.62989086,-37.80766254000001]}"
553,02004,2,6/3/1992,Comuna 4,Capital Federal,8891-2706,2.09,10,verano,1992-03-02,"[1992-03-02, 1992-03-03, 1992-03-04, 1992-03-05, 1992-03-06, 1992-03-07, 1992-03-08]",true,553,-34.64641355,-58.38427103,1.46,"[0, 0, 0, 0.3, 0, 0, 0]",3.490746021270752E-4,296.54406992594403,Miscelaneas,-0.0015516933053731918,0.1358464558919271,"{""type"":""Point"",""coordinates"":[-58.384271029999994,-34.64641355]}"
554,58035,58,20/12/1993,Confluencia,Neuquen,6898-2210,63.38,857,primavera,1993-12-20,"[1993-12-20, 1993-12-21, 1993-12-22, 1993-12-23, 1993-12-24, 1993-12-25, 1993-12-26]",false,554,-38.75282316,-68.83773873,2.2,"[0, 0, 0, 0, 0, 0, 0]",0.0,296.4259204864502,Aridisoles,-4.6897679567337036E-4,0.04026921590169271,"{""type"":""Point"",""coordinates"":[-68.83773873,-38.75282316]}"
555,22063,22,12/2/2014,General Guemes,Chaco,33840-6431,76.76,130,verano,2014-02-10,"[2014-02-10, 2014-02-11, 2014-02-12, 2014-02-13, 2014-02-14, 2014-02-15, 2014-02-16]",false,555,-25.70413822,-61.03150273,0,"[0.8, 0.7, 2.7, 7.3, 0.1, 0.1, 2.3]",2.6673078536987305E-6,305.5560493469238,Alfisoles,-0.0014198832213878632,0.13641039530436197,"{""type"":""Point"",""coordinates"":[-61.03150273,-25.70413822]}"
556,02005,2,20/8/2001,Comuna 5,Capital Federal,85-85,3.75,37,invierno,2001-08-20,"[2001-08-20, 2001-08-21, 2001-08-22, 2001-08-23, 2001-08-24, 2001-08-25, 2001-08-26]",true,556,-34.60922769,-58.42174523,2.44,"[0, 0, 0, 0, 0, 0, 45.6]",3.6932528018951416E-4,283.9227720896403,Miscelaneas,-0.002644868567585945,0.4351755777994792,"{""type"":""Point"",""coordinates"":[-58.42174523,-34.609227690000004]}"
557,66126,66,14/12/2005,Oran,Salta,6350-1973,11.39,373,primavera,2005-12-12,"[2005-12-12, 2005-12-13, 2005-12-14, 2005-12-15, 2005-12-16, 2005-12-17, 2005-12-18]",true,557,-22.9746,-64.41384,1.37,"[0, 0, 7.1, 9.9, 0.7, 5.9, 0]",3.7103891372680664E-5,296.58813031514484,Roca,-0.004029121249914169,0.47659746805826825,"{""type"":""Point"",""coordinates"":[-64.41384,-22.974599999999995]}"
558,66126,66,6/12/1999,Oran,Salta,6350-1973,11.39,373,primavera,1999-12-06,"[1999-12-06, 1999-12-07, 1999-12-08, 1999-12-09, 1999-12-10, 1999-12-11, 1999-12-12]",true,558,-22.9746,-64.41384,1.37,"[0, 0, 0, 0, 0, 9.1, 1.5]",5.78761100769043E-5,292.7440249125163,Roca,-0.003058893606066704,0.36682573954264325,"{""type"":""Point"",""coordinates"":[-64.41384,-22.974599999999995]}"
559,66056,66,25/5/1996,General Jose de San Martin,Salta,6934-2187,25.44,797,otoño,1996-05-20,"[1996-05-20, 1996-05-21, 1996-05-22, 1996-05-23, 1996-05-24, 1996-05-25, 1996-05-26]",false,559,-22.16459982,-63.9088426,0.93,"[7.2, 0.4, 1.3, 3.3, 0.4, 0.7, 0]",0.0015846490859985352,285.7109139760335,Molisoles,-0.0017038248479366302,0.48470306396484375,"{""type"":""Point"",""coordinates"":[-63.90884259999999,-22.16459982]}"
560,02008,2,18/12/2014,Comuna 8,Capital Federal,36837-7237,7.49,21,primavera,2014-12-15,"[2014-12-15, 2014-12-16, 2014-12-17, 2014-12-18, 2014-12-19, 2014-12-20, 2014-12-21]",true,560,-34.67499358,-58.47616299,1.13,"[0.8, 0.3, 1.7, 0, 0, 16.6, 8.6]",4.2484700679779053E-4,293.5434347788493,Miscelaneas,-0.004255625419318676,0.27564048767089844,"{""type"":""Point"",""coordinates"":[-58.47616299,-34.67499358]}"
561,02010,2,14/11/2013,Comuna 10,Capital Federal,36837-7237,4.71,24,primavera,2013-11-11,"[2013-11-11, 2013-11-12, 2013-11-13, 2013-11-14, 2013-11-15, 2013-11-16, 2013-11-17]",true,561,-34.62768629,-58.48358728,1.46,"[0.4, 0, 0, 0, 40.1, 0, 0]",1.939535140991211E-4,292.84538714090985,Miscelaneas,-0.0034402580931782722,0.41465504964192706,"{""type"":""Point"",""coordinates"":[-58.48358728,-34.62768628999999]}"
562,02012,2,2/8/2009,Comuna 12,Capital Federal,54-54,3.13,20,invierno,2009-07-27,"[2009-07-27, 2009-07-28, 2009-07-29, 2009-07-30, 2009-07-31, 2009-08-01, 2009-08-02]",true,562,-34.56062514,-58.47494475,0.93,"[0, 0, 0, 0, 0, 0.4, 0]",9.740889072418213E-5,281.74459584554035,Miscelaneas,-0.001258031465113163,0.370602289835612,"{""type"":""Point"",""coordinates"":[-58.474944750000006,-34.560625140000006]}"
563,38077,38,17/6/1997,Santa Catalina,Jujuy,6324-1963,38.66,3649,otoño,1997-06-16,"[1997-06-16, 1997-06-17, 1997-06-18, 1997-06-19, 1997-06-20, 1997-06-21, 1997-06-22]",false,563,-22.05120277,-65.84176636,4.99,"[0, 0, 0, 0, 0, 0, 0]",4.5746564865112305E-5,277.67141342163086,Entisoles,-7.275305688381195E-4,0.17042986551920572,"{""type"":""Point"",""coordinates"":[-65.84176636,-22.051202770000003]}"
564,66147,66,2/4/2014,Rosario de Lerma,Salta,36870-7251,46.75,3614,otoño,2014-03-31,"[2014-03-31, 2014-04-01, 2014-04-02, 2014-04-03, 2014-04-04, 2014-04-05, 2014-04-06]",false,564,-24.14188957,-66.01944733,2.11,"[3.8, 4.6, 6.6, 3.4, 2, 16.1, 9.2]",4.3213367462158203E-7,279.9561341603597,Inceptisoles,-7.728384807705879E-4,0.28484471638997394,"{""type"":""Point"",""coordinates"":[-66.01944733,-24.141889570000004]}"
565,66133,66,5/11/2008,Rivadavia,Salta,6362-1978,14.31,246,primavera,2008-11-03,"[2008-11-03, 2008-11-04, 2008-11-05, 2008-11-06, 2008-11-07, 2008-11-08, 2008-11-09]",true,565,-22.49881,-62.40759,1,"[0, 6.1, 1.4, 13.7, 0, 6.3, 23.5]",1.7881393432617188E-7,299.01367314656574,Molisoles,-0.0018205353990197182,0.2084636688232422,"{""type"":""Point"",""coordinates"":[-62.40759,-22.498810000000002]}"
566,66112,66,11/4/1993,Metan,Salta,9546-2814,6.06,567,otoño,1993-04-05,"[1993-04-05, 1993-04-06, 1993-04-07, 1993-04-08, 1993-04-09, 1993-04-10, 1993-04-11]",true,566,-25.51643753,-64.60592651,1.03,"[0, 0, 0, 0, 0, 0, 0]",2.53334641456604E-4,289.10960578918457,Molisoles,-0.002060413360595703,0.4760417938232422,"{""type"":""Point"",""coordinates"":[-64.60592651,-25.516437529999997]}"
567,66056,66,18/4/2015,General Jose de San Martin,Salta,6934-2187,25.44,797,otoño,2015-04-13,"[2015-04-13, 2015-04-14, 2015-04-15, 2015-04-16, 2015-04-17, 2015-04-18, 2015-04-19]",false,567,-22.16459982,-63.9088426,0.93,"[3.4, 12, 10.5, 47.3, 21.6, 17.4, 0]",0.0010548830032348633,294.89567375183105,Molisoles,-0.0029815426096320152,0.46216265360514325,"{""type"":""Point"",""coordinates"":[-63.90884259999999,-22.16459982]}"
568,66161,66,22/12/2004,Santa Victoria,Salta,36860-7249,4.53,2511,primavera,2004-12-20,"[2004-12-20, 2004-12-21, 2004-12-22, 2004-12-23, 2004-12-24, 2004-12-25, 2004-12-26]",true,568,-22.17502,-64.93502,19.09,"[15.6, 24.2, 31.9, 3.8, 4.3, 15.2, 10.1]",0.007522657513618469,286.67221705118817,Roca,-0.0030712271109223366,0.48993555704752606,"{""type"":""Point"",""coordinates"":[-64.93502,-22.17502]}"
569,66126,66,9/7/2008,Oran,Salta,6350-1973,11.39,373,invierno,2008-07-07,"[2008-07-07, 2008-07-08, 2008-07-09, 2008-07-10, 2008-07-11, 2008-07-12, 2008-07-13]",true,569,-22.9746,-64.41384,1.37,"[0, 0, 0, 0.3, 0, 0, 0]",4.229545593261719E-4,292.2017593383789,Roca,-9.246198460459709E-4,0.330752690633138,"{""type"":""Point"",""coordinates"":[-64.41384,-22.974599999999995]}"
570,66007,66,12/10/1999,Anta,Salta,6353-1975,44.37,541,primavera,1999-10-11,"[1999-10-11, 1999-10-12, 1999-10-13, 1999-10-14, 1999-10-15, 1999-10-16, 1999-10-17]",false,570,-24.25001144,-64.14095306,4.63,"[1.9, 0, 0, 0, 0, 1.8, 0.6]",7.891654968261719E-5,298.3511339823405,Molisoles,-0.0023473137989640236,0.19632911682128906,"{""type"":""Point"",""coordinates"":[-64.14095306,-24.250011440000005]}"
571,02015,2,19/5/1990,Comuna 15,Capital Federal,36837-7237,2.81,29,otoño,1990-05-14,"[1990-05-14, 1990-05-15, 1990-05-16, 1990-05-17, 1990-05-18, 1990-05-19, 1990-05-20]",true,571,-34.59294425,-58.48867142,4.63,"[2, 0, 0.5, 1.6, 0, 0, 0]",6.40377402305603E-4,287.2012087504069,Miscelaneas,-0.0013316692784428596,0.4278093973795573,"{""type"":""Point"",""coordinates"":[-58.48867142,-34.59294425]}"
572,02012,2,9/12/2002,Comuna 12,Capital Federal,54-54,3.13,20,primavera,2002-12-09,"[2002-12-09, 2002-12-10, 2002-12-11, 2002-12-12, 2002-12-13, 2002-12-14, 2002-12-15]",true,572,-34.56062514,-58.47494475,0.93,"[0.1, 0, 0.8, 0, 0, 0.6, 0]",0.0012626200914382935,292.6711082458496,Miscelaneas,-0.0031812870875000954,0.29284922281901044,"{""type"":""Point"",""coordinates"":[-58.474944750000006,-34.560625140000006]}"
573,02015,2,7/9/2007,Comuna 15,Capital Federal,36837-7237,2.81,29,invierno,2007-09-03,"[2007-09-03, 2007-09-04, 2007-09-05, 2007-09-06, 2007-09-07, 2007-09-08, 2007-09-09]",true,573,-34.59294425,-58.48867142,4.63,"[0, 1.5, 21.1, 0, 3.9, 0.3, 0.2]",3.9893388748168945E-4,289.535940806071,Miscelaneas,-0.0013470035046339035,0.2970682779947917,"{""type"":""Point"",""coordinates"":[-58.48867142,-34.59294425]}"
574,02014,2,22/1/2003,Comuna 14,Capital Federal,85-85,2.68,24,verano,2003-01-20,"[2003-01-20, 2003-01-21, 2003-01-22, 2003-01-23, 2003-01-24, 2003-01-25, 2003-01-26]",true,574,-34.57389998,-58.42243645,5.28,"[0, 0, 26.5, 0, 0, 0, 0]",6.1798095703125E-4,296.89048703511554,Miscelaneas,-0.004412760958075523,0.3685862223307292,"{""type"":""Point"",""coordinates"":[-58.42243645,-34.57389997999999]}"
575,02014,2,20/6/2001,Comuna 14,Capital Federal,85-85,2.68,24,otoño,2001-06-18,"[2001-06-18, 2001-06-19, 2001-06-20, 2001-06-21, 2001-06-22, 2001-06-23, 2001-06-24]",true,575,-34.57389998,-58.42243645,5.28,"[0, 0, 0, 0, 0, 0, 0]",2.689063549041748E-4,280.59345690409344,Miscelaneas,-0.0015048589557409286,0.4300333658854167,"{""type"":""Point"",""coordinates"":[-58.42243645,-34.57389997999999]}"
576,02009,2,8/2/2013,Comuna 9,Capital Federal,36837-7237,4.96,32,verano,2013-02-04,"[2013-02-04, 2013-02-05, 2013-02-06, 2013-02-07, 2013-02-08, 2013-02-09, 2013-02-10]",true,576,-34.64379608,-58.5191299,1.85,"[0, 0, 0, 0, 0, 0, 3.5]",3.6829710006713867E-4,293.7217623392741,Miscelaneas,-0.003988425247371197,0.22796185811360678,"{""type"":""Point"",""coordinates"":[-58.51912990000001,-34.64379608]}"
577,02009,2,12/2/2015,Comuna 9,Capital Federal,36837-7237,4.96,32,verano,2015-02-09,"[2015-02-09, 2015-02-10, 2015-02-11, 2015-02-12, 2015-02-13, 2015-02-14, 2015-02-15]",true,577,-34.64379608,-58.5191299,1.85,"[0.4, 3.4, 0, 0.8, 0, 0, 0]",4.352778196334839E-4,299.05443572998047,Miscelaneas,-0.0038982797414064407,0.21433703104654947,"{""type"":""Point"",""coordinates"":[-58.51912990000001,-34.64379608]}"
578,02008,2,28/5/2000,Comuna 8,Capital Federal,36837-7237,7.49,21,otoño,2000-05-22,"[2000-05-22, 2000-05-23, 2000-05-24, 2000-05-25, 2000-05-26, 2000-05-27, 2000-05-28]",true,578,-34.67499358,-58.47616299,1.13,"[0, 0, 1, 8.8, 0, 0, 0]",7.079392671585083E-4,287.58652687072754,Miscelaneas,-9.227432310581207E-4,0.43703460693359375,"{""type"":""Point"",""coordinates"":[-58.47616299,-34.67499358]}"
579,02015,2,27/12/1992,Comuna 15,Capital Federal,36837-7237,2.81,29,verano,1992-12-21,"[1992-12-21, 1992-12-22, 1992-12-23, 1992-12-24, 1992-12-25, 1992-12-26, 1992-12-27]",true,579,-34.59294425,-58.48867142,4.63,"[0.3, 6.2, 31.4, 0, 0, 0, 0]",4.739910364151001E-4,295.8883171081543,Miscelaneas,-0.003924650140106678,0.20215161641438803,"{""type"":""Point"",""coordinates"":[-58.48867142,-34.59294425]}"
580,02010,2,10/1/2010,Comuna 10,Capital Federal,36837-7237,4.71,24,verano,2010-01-04,"[2010-01-04, 2010-01-05, 2010-01-06, 2010-01-07, 2010-01-08, 2010-01-09, 2010-01-10]",true,580,-34.62768629,-58.48358728,1.46,"[17.8, 12.3, 9.7, 0, 0, 0, 3.6]",0.0015549957752227783,297.25026512145996,Miscelaneas,-0.0030590081587433815,0.374972661336263,"{""type"":""Point"",""coordinates"":[-58.48358728,-34.62768628999999]}"
581,02007,2,18/2/1995,Comuna 7,Capital Federal,36837-7237,7.04,22,verano,1995-02-13,"[1995-02-13, 1995-02-14, 1995-02-15, 1995-02-16, 1995-02-17, 1995-02-18, 1995-02-19]",true,581,-34.63680708,-58.45826985,2.25,"[5.2, 0.1, 13.8, 0.3, 5.5, 0, 0]",2.99796462059021E-4,296.64413324991864,Miscelaneas,-0.002854525111615658,0.285671869913737,"{""type"":""Point"",""coordinates"":[-58.45826984999999,-34.63680708]}"
582,02013,2,19/10/2015,Comuna 13,Capital Federal,54-54,3.99,10,primavera,2015-10-19,"[2015-10-19, 2015-10-20, 2015-10-21, 2015-10-22, 2015-10-23, 2015-10-24, 2015-10-25]",true,582,-34.55488152,-58.4502891,3.85,"[4.6, 0.9, 0, 0.6, 0, 0.8, 1.2]",1.7401576042175293E-4,289.2462679545085,Miscelaneas,-0.0016796831041574478,0.18726094563802084,"{""type"":""Point"",""coordinates"":[-58.4502891,-34.55488152]}"
583,02015,2,23/10/2000,Comuna 15,Capital Federal,36837-7237,2.81,29,primavera,2000-10-23,"[2000-10-23, 2000-10-24, 2000-10-25, 2000-10-26, 2000-10-27, 2000-10-28, 2000-10-29]",true,583,-34.59294425,-58.48867142,4.63,"[0.8, 2.1, 5.4, 10.8, 0, 0, 1.2]",0.0012997090816497803,288.12637583414715,Miscelaneas,-0.004247065633535385,0.4058984120686849,"{""type"":""Point"",""coordinates"":[-58.48867142,-34.59294425]}"
584,02014,2,28/3/1997,Comuna 14,Capital Federal,85-85,2.68,24,otoño,1997-03-24,"[1997-03-24, 1997-03-25, 1997-03-26, 1997-03-27, 1997-03-28, 1997-03-29, 1997-03-30]",true,584,-34.57389998,-58.42243645,5.28,"[0, 0, 0, 0, 0, 0, 0]",1.2604892253875732E-4,288.6739921569824,Miscelaneas,-0.003601876087486744,0.3143259684244792,"{""type"":""Point"",""coordinates"":[-58.42243645,-34.57389997999999]}"
585,02005,2,12/6/2009,Comuna 5,Capital Federal,85-85,3.75,37,otoño,2009-06-08,"[2009-06-08, 2009-06-09, 2009-06-10, 2009-06-11, 2009-06-12, 2009-06-13, 2009-06-14]",true,585,-34.60922769,-58.42174523,2.44,"[0, 0, 0, 0, 0, 0, 0]",6.520748138427734E-5,283.5869566599528,Miscelaneas,-7.093008607625961E-4,0.2705090840657552,"{""type"":""Point"",""coordinates"":[-58.42174523,-34.609227690000004]}"
586,02002,2,23/8/2007,Comuna 2,Capital Federal,85-85,1.52,30,invierno,2007-08-20,"[2007-08-20, 2007-08-21, 2007-08-22, 2007-08-23, 2007-08-24, 2007-08-25, 2007-08-26]",true,586,-34.58587601,-58.39499618,1.85,"[0, 0, 0, 0, 0, 0, 2.8]",4.547536373138428E-4,280.8086414337158,Miscelaneas,-0.0016530733555555344,0.3702341715494792,"{""type"":""Point"",""coordinates"":[-58.39499618,-34.58587601000001]}"
587,06840,6,5/11/2014,Tres de Febrero,Buenos Aires,36837-7237,6.8,27,primavera,2014-11-03,"[2014-11-03, 2014-11-04, 2014-11-05, 2014-11-06, 2014-11-07, 2014-11-08, 2014-11-09]",true,587,-34.60887295,-58.56366446,1.85,"[35.1, 0, 0, 0, 0, 0, 0]",0.006804332137107849,289.0079771677653,Miscelaneas,-0.0021225791424512863,0.47106297810872394,"{""type"":""Point"",""coordinates"":[-58.563664460000005,-34.60887294999999]}"
588,06568,6,9/9/2003,Moron,Buenos Aires,33486-6512,15.92,14,invierno,2003-09-08,"[2003-09-08, 2003-09-09, 2003-09-10, 2003-09-11, 2003-09-12, 2003-09-13, 2003-09-14]",false,588,-34.6644131,-58.64564271,3.58,"[0, 0.9, 0, 0, 0, 0, 0]",2.5109946727752686E-4,284.9468644460042,Miscelaneas,-0.002628333866596222,0.4773877461751302,"{""type"":""Point"",""coordinates"":[-58.645642710000004,-34.6644131]}"
589,06560,6,14/7/1992,Moreno,Buenos Aires,42-42,17.53,33,invierno,1992-07-13,"[1992-07-13, 1992-07-14, 1992-07-15, 1992-07-16, 1992-07-17, 1992-07-18, 1992-07-19]",false,589,-34.55865957,-58.81630109,4.33,"[43.7, 2, 0, 0, 0, 0, 0]",0.005060911178588867,285.5126374562581,Complejo indiferenci,-9.266994893550873E-4,0.47352854410807294,"{""type"":""Point"",""coordinates"":[-58.81630109,-34.55865957]}"
590,06539,6,22/8/2004,Merlo,Buenos Aires,33486-6512,18.44,32,invierno,2004-08-16,"[2004-08-16, 2004-08-17, 2004-08-18, 2004-08-19, 2004-08-20, 2004-08-21, 2004-08-22]",false,590,-34.70854224,-58.67958673,3.7,"[18.4, 2.9, 0.2, 1.4, 5.2, 3.6, 0]",9.393841028213501E-4,287.8496850331624,Complejo indiferenci,-7.030339911580086E-4,0.4892578125,"{""type"":""Point"",""coordinates"":[-58.67958673,-34.70854223999999]}"
591,06525,6,23/9/1990,Marcos Paz,Buenos Aires,6936-2128,28.61,33,invierno,1990-09-17,"[1990-09-17, 1990-09-18, 1990-09-19, 1990-09-20, 1990-09-21, 1990-09-22, 1990-09-23]",false,591,-34.776242,-58.9395696,1.46,"[0.1, 3.1, 2.1, 3.2, 1.4, 0, 0]",3.577768802642822E-5,282.6812101999919,Complejo indiferenci,-0.0012037679553031921,0.41996320088704425,"{""type"":""Point"",""coordinates"":[-58.9395696,-34.776242]}"
592,06490,6,3/4/2008,Lomas de Zamora,Buenos Aires,35405-6949,5.53,9,otoño,2008-03-31,"[2008-03-31, 2008-04-01, 2008-04-02, 2008-04-03, 2008-04-04, 2008-04-05, 2008-04-06]",true,592,-34.73790272,-58.44067537,3,"[0.2, 1.2, 1.2, 0, 0, 0, 0]",1.2041628360748291E-4,293.0705903371175,Miscelaneas,-0.0023602424189448357,0.284243901570638,"{""type"":""Point"",""coordinates"":[-58.44067537000001,-34.73790272]}"
593,06441,6,15/2/1991,La Plata,Buenos Aires,3314-1708,23.31,26,verano,1991-02-11,"[1991-02-11, 1991-02-12, 1991-02-13, 1991-02-14, 1991-02-15, 1991-02-16, 1991-02-17]",false,593,-35.03880607,-58.05930616,0.93,"[0, 0, 0, 0, 0, 0, 0.2]",4.798173904418945E-6,295.14723523457843,Complejo indiferenci,-0.00434337742626667,0.33579381306966144,"{""type"":""Point"",""coordinates"":[-58.05930616,-35.03880607000001]}"
594,06427,6,9/6/1997,La Matanza,Buenos Aires,33486-6512,4.98,8,otoño,1997-06-09,"[1997-06-09, 1997-06-10, 1997-06-11, 1997-06-12, 1997-06-13, 1997-06-14, 1997-06-15]",true,594,-34.71417289,-58.50890438,7.28,"[0, 0, 0, 0.4, 23.7, 12.7, 0.2]",3.8683414459228516E-5,284.64294878641766,Molisoles,-8.735861629247665E-4,0.40531349182128906,"{""type"":""Point"",""coordinates"":[-58.50890437999999,-34.71417289000001]}"
595,06638,6,11/7/2003,Pilar,Buenos Aires,42-42,10.41,16,invierno,2003-07-07,"[2003-07-07, 2003-07-08, 2003-07-09, 2003-07-10, 2003-07-11, 2003-07-12, 2003-07-13]",true,595,-34.42200558,-58.95283788,1.46,"[0, 8, 0, 0.1, 0, 0, 0]",1.5048682689666748E-4,282.3920027414958,Molisoles,-0.0011228956282138824,0.4389152526855469,"{""type"":""Point"",""coordinates"":[-58.95283788,-34.42200558]}"
596,06336,6,22/8/1998,General Lavalle,Buenos Aires,3309-1703,42.05,3,invierno,1998-08-17,"[1998-08-17, 1998-08-18, 1998-08-19, 1998-08-20, 1998-08-21, 1998-08-22, 1998-08-23]",false,596,-36.55442064,-57.07742058,0,"[0.9, 0, 5.4, 0, 0, 0.4, 2.4]",3.540515899658203E-5,286.1178894042969,Entisoles,-0.0022916169837117195,0.41746266682942706,"{""type"":""Point"",""coordinates"":[-57.07742058,-36.554420640000004]}"
597,06274,6,14/7/2013,Florencio Varela,Buenos Aires,7058-2230,1.42,23,invierno,2013-07-08,"[2013-07-08, 2013-07-09, 2013-07-10, 2013-07-11, 2013-07-12, 2013-07-13, 2013-07-14]",true,597,-34.8275807,-58.222912,0,"[0, 11.7, 2.7, 51.8, 0.1, 0, 0]",3.001093864440918E-5,280.95576095581055,Complejo indiferenci,-0.001089712604880333,0.37749481201171875,"{""type"":""Point"",""coordinates"":[-58.22291200000001,-34.8275807]}"
598,06260,6,1/12/2007,Esteban Echeverria,Buenos Aires,33486-6512,6.94,23,primavera,2007-11-26,"[2007-11-26, 2007-11-27, 2007-11-28, 2007-11-29, 2007-11-30, 2007-12-01, 2007-12-02]",true,598,-34.88497914,-58.47780994,1.46,"[0, 0, 0, 0, 0, 0, 0]",1.7334520816802979E-4,292.1927611033122,Miscelaneas,-0.0049891117960214615,0.3516349792480469,"{""type"":""Point"",""coordinates"":[-58.47780994,-34.884979140000006]}"
599,06245,6,24/2/1997,Ensenada,Buenos Aires,3314-1708,6.45,8,verano,1997-02-24,"[1997-02-24, 1997-02-25, 1997-02-26, 1997-02-27, 1997-02-28, 1997-03-01, 1997-03-02]",true,599,-34.87584856,-57.9336299,5.71,"[0, 0, 0, 0, 0, 0.2, 0.9]",8.52346420288086E-6,296.13028208414715,Miscelaneas,-0.0020004231482744217,0.28243255615234375,"{""type"":""Point"",""coordinates"":[-57.9336299,-34.875848559999994]}"
600,06210,6,18/12/2012,Chacabuco,Buenos Aires,6713-2117,29.06,67,primavera,2012-12-17,"[2012-12-17, 2012-12-18, 2012-12-19, 2012-12-20, 2012-12-21, 2012-12-22, 2012-12-23]",false,600,-34.66495,-60.44139,2.17,"[2.5, 0.2, 7, 9.6, 0, 0, 0]",3.793835639953613E-5,293.4847049713135,Alfisoles,-0.0044272299855947495,0.449459711710612,"{""type"":""Point"",""coordinates"":[-60.44138999999999,-34.664950000000005]}"
601,06028,6,21/10/1996,Almirante Brown,Buenos Aires,35405-6949,1.13,28,primavera,1996-10-21,"[1996-10-21, 1996-10-22, 1996-10-23, 1996-10-24, 1996-10-25, 1996-10-26, 1996-10-27]",true,601,-34.80155807,-58.39146772,0.93,"[0, 1.2, 0.3, 1.8, 0.1, 0.4, 1.7]",4.738569259643555E-6,285.1983076731364,Miscelaneas,-0.0022634081542491913,0.43804295857747394,"{""type"":""Point"",""coordinates"":[-58.39146772000001,-34.80155807]}"
602,06420,6,9/3/2013,La Costa,Buenos Aires,3346-1741,3.63,6,verano,2013-03-04,"[2013-03-04, 2013-03-05, 2013-03-06, 2013-03-07, 2013-03-08, 2013-03-09, 2013-03-10]",true,602,-36.48839763,-56.70043526,1.85,"[0, 0, 0.1, 2.4, 5.3, 0.1, 0]",4.8467516899108887E-4,289.0780436197917,Entisoles,-0.005552917718887329,0.2083460489908854,"{""type"":""Point"",""coordinates"":[-56.70043526,-36.48839763]}"
603,06420,6,28/2/2003,La Costa,Buenos Aires,3346-1741,3.63,6,verano,2003-02-24,"[2003-02-24, 2003-02-25, 2003-02-26, 2003-02-27, 2003-02-28, 2003-03-01, 2003-03-02]",true,603,-36.48839763,-56.70043526,1.85,"[2.3, 0, 0.1, 40.7, 0, 0, 0]",4.514828324317932E-4,293.65806007385254,Entisoles,-0.002436152659356594,0.23458480834960938,"{""type"":""Point"",""coordinates"":[-56.70043526,-36.48839763]}"
604,90105,90,7/12/2001,Tafi Viejo,Tucuman,6759-2167,15.47,1798,primavera,2001-12-03,"[2001-12-03, 2001-12-04, 2001-12-05, 2001-12-06, 2001-12-07, 2001-12-08, 2001-12-09]",false,604,-26.74196322,-65.56315645,3.47,"[21.2, 1.1, 0, 0.4, 3.9, 30.6, 0]",0.010535120964050293,280.25564702351886,Molisoles,-0.002488422207534313,0.4270763397216797,"{""type"":""Point"",""coordinates"":[-65.56315645,-26.74196322]}"
605,90077,90,10/2/2010,Rio Chico,Tucuman,6896-2166,16.62,376,verano,2010-02-08,"[2010-02-08, 2010-02-09, 2010-02-10, 2010-02-11, 2010-02-12, 2010-02-13, 2010-02-14]",false,605,-27.4543092,-65.603622,9.42,"[12.2, 4.1, 15.5, 9.7, 0.9, 0, 5.3]",0.006438732147216797,298.234229405721,Roca,-0.0037637250497937202,0.3708546956380208,"{""type"":""Point"",""coordinates"":[-65.603622,-27.4543092]}"
606,90084,90,1/3/2002,Capital,Tucuman,33966-6506,7.44,453,verano,2002-02-25,"[2002-02-25, 2002-02-26, 2002-02-27, 2002-02-28, 2002-03-01, 2002-03-02, 2002-03-03]",true,606,-26.82900979,-65.21054418,6.28,"[0, 0, 0, 40.7, 31.5, 0, 0]",0.0016453862190246582,297.249449412028,Molisoles,-0.0054141199216246605,0.4097983042399089,"{""type"":""Point"",""coordinates"":[-65.21054418,-26.829009789999997]}"
607,38021,38,10/11/2008,Capital,Jujuy,33913-6597,37.78,3875,primavera,2008-11-10,"[2008-11-10, 2008-11-11, 2008-11-12, 2008-11-13, 2008-11-14, 2008-11-15, 2008-11-16]",false,607,-24.02938843,-65.64742279,17.2,"[0.6, 3.2, 3.7, 1.8, 0, 1.3, 0.4]",8.514076471328735E-4,280.4227212270101,Roca,-0.0031256703659892082,0.39383888244628906,"{""type"":""Point"",""coordinates"":[-65.64742279,-24.02938843]}"
608,10105,10,27/1/2006,Tinogasta,Catamarca,6718-2196,43.56,2589,verano,2006-01-23,"[2006-01-23, 2006-01-24, 2006-01-25, 2006-01-26, 2006-01-27, 2006-01-28, 2006-01-29]",false,608,-27.09210847,-67.81896152,26.54,"[0.7, 0, 0.4, 0, 0.1, 0.3, 0]",6.972253322601318E-5,285.84533818562824,Roca,-0.0030194753780961037,0.3837502797444661,"{""type"":""Point"",""coordinates"":[-67.81896152,-27.092108470000003]}"
609,42154,42,17/9/1996,Ultracan,La Pampa,33160-6527,48.14,323,invierno,1996-09-16,"[1996-09-16, 1996-09-17, 1996-09-18, 1996-09-19, 1996-09-20, 1996-09-21, 1996-09-22]",false,609,-37.4392128,-65.02373505,5.79,"[0, 0, 7, 0, 0.1, 2.6, 0]",0.0,283.52336438496906,Molisoles,-0.002068992704153061,0.16167322794596353,"{""type"":""Point"",""coordinates"":[-65.02373505,-37.4392128]}"
610,14098,14,7/3/2010,Rio Cuarto,Cordoba,34345-6361,23.14,514,verano,2010-03-01,"[2010-03-01, 2010-03-02, 2010-03-03, 2010-03-04, 2010-03-05, 2010-03-06, 2010-03-07]",false,610,-32.64751095,-64.22141859,2.88,"[0, 6.1, 0, 0, 0, 0, 0]",1.1920928955078125E-7,294.25337982177734,Complejo indiferenci,-0.0037638256326317787,0.2658507029215495,"{""type"":""Point"",""coordinates"":[-64.22141859,-32.64751095]}"
611,14098,14,6/1/2003,Rio Cuarto,Cordoba,34345-6361,23.14,514,verano,2003-01-06,"[2003-01-06, 2003-01-07, 2003-01-08, 2003-01-09, 2003-01-10, 2003-01-11, 2003-01-12]",false,611,-32.64751095,-64.22141859,2.88,"[0, 0, 0.8, 0, 3.7, 14.4, 1]",2.384185791015625E-6,296.1128953297933,Complejo indiferenci,-0.00581352598965168,0.3268108367919922,"{""type"":""Point"",""coordinates"":[-64.22141859,-32.64751095]}"
612,58091,58,25/4/2011,Pehuenches,Neuquen,36849-7246,13.15,1786,otoño,2011-04-25,"[2011-04-25, 2011-04-26, 2011-04-27, 2011-04-28, 2011-04-29, 2011-04-30, 2011-05-01]",true,612,-36.92528915,-69.9850235,5.78,"[0, 0, 0, 10.5, 0, 0, 0]",1.7924606800079346E-4,278.01634979248047,Entisoles,-5.822554230690002E-4,0.22736231486002603,"{""type"":""Point"",""coordinates"":[-69.9850235,-36.92528915]}"
613,66133,66,17/2/2011,Rivadavia,Salta,6362-1978,14.31,246,verano,2011-02-14,"[2011-02-14, 2011-02-15, 2011-02-16, 2011-02-17, 2011-02-18, 2011-02-19, 2011-02-20]",true,613,-22.49881,-62.40759,1,"[5.5, 0, 0, 0, 37.2, 17.1, 3.4]",3.889203071594238E-5,298.646333694458,Molisoles,-0.005038710311055183,0.3042456309000651,"{""type"":""Point"",""coordinates"":[-62.40759,-22.498810000000002]}"
614,66126,66,7/5/1998,Oran,Salta,6350-1973,11.39,373,otoño,1998-05-04,"[1998-05-04, 1998-05-05, 1998-05-06, 1998-05-07, 1998-05-08, 1998-05-09, 1998-05-10]",true,614,-22.9746,-64.41384,1.37,"[0, 0, 0, 0, 0, 0, 0]",0.0025571733713150024,288.61292521158856,Roca,-0.0023595020174980164,0.4614111582438151,"{""type"":""Point"",""coordinates"":[-64.41384,-22.974599999999995]}"
615,66056,66,20/7/1991,General Jose de San Martin,Salta,6934-2187,25.44,797,invierno,1991-07-15,"[1991-07-15, 1991-07-16, 1991-07-17, 1991-07-18, 1991-07-19, 1991-07-20, 1991-07-21]",false,615,-22.16459982,-63.9088426,0.93,"[0, 0, 0, 2.2, 0, 0, 5.9]",4.119873046875E-4,284.6946055094401,Molisoles,-0.0015578866004943848,0.3876171112060547,"{""type"":""Point"",""coordinates"":[-63.90884259999999,-22.16459982]}"
616,66028,66,20/12/2004,Capital,Salta,6351-1974,15.04,1377,primavera,2004-12-20,"[2004-12-20, 2004-12-21, 2004-12-22, 2004-12-23, 2004-12-24, 2004-12-25, 2004-12-26]",false,616,-24.70494203,-65.47051055,1.02,"[38.3, 16.8, 24, 1.2, 5.4, 20.7, 8]",0.015987366437911987,289.73154322306317,Inceptisoles,-0.0031998278573155403,0.47177886962890625,"{""type"":""Point"",""coordinates"":[-65.47051055,-24.70494203]}"
617,14133,14,3/1/2012,San Javier,Cordoba,9461-2776,37.8,572,verano,2012-01-02,"[2012-01-02, 2012-01-03, 2012-01-04, 2012-01-05, 2012-01-06, 2012-01-07, 2012-01-08]",false,617,-32.01613487,-65.16382005,2.78,"[0, 0, 0, 0.5, 0, 0, 0]",2.9802322387695312E-8,303.01963869730633,Entisoles,-0.001122456043958664,0.0954577128092448,"{""type"":""Point"",""coordinates"":[-65.16382005,-32.01613487]}"
618,02002,2,8/2/2007,Comuna 2,Capital Federal,85-85,1.52,30,verano,2007-02-05,"[2007-02-05, 2007-02-06, 2007-02-07, 2007-02-08, 2007-02-09, 2007-02-10, 2007-02-11]",true,618,-34.58587601,-58.39499618,1.85,"[1.3, 1.6, 0, 0, 0, 0, 0.6]",1.0405480861663818E-4,297.84961636861163,Miscelaneas,-0.0026541240513324738,0.15971501668294272,"{""type"":""Point"",""coordinates"":[-58.39499618,-34.58587601000001]}"
619,02011,2,3/1/1991,Comuna 11,Capital Federal,36837-7237,3.14,29,verano,1990-12-31,"[1990-12-31, 1991-01-01, 1991-01-02, 1991-01-03, 1991-01-04, 1991-01-05, 1991-01-06]",true,619,-34.6042463,-58.49067643,2.78,"[0, 12.4, 0.1, 0, 0, 0, 0]",0.0010887831449508667,295.8368333180745,Miscelaneas,-0.004639798775315285,0.33823394775390625,"{""type"":""Point"",""coordinates"":[-58.49067643,-34.60424629999999]}"
620,02006,2,19/9/2009,Comuna 6,Capital Federal,85-85,5.9,32,invierno,2009-09-14,"[2009-09-14, 2009-09-15, 2009-09-16, 2009-09-17, 2009-09-18, 2009-09-19, 2009-09-20]",true,620,-34.6168255,-58.44360311,5.01,"[0, 0, 0, 20.4, 31.4, 0, 0]",9.518861770629883E-5,288.46412086486816,Miscelaneas,-0.0019766613841056824,0.3475627899169922,"{""type"":""Point"",""coordinates"":[-58.44360310999999,-34.6168255]}"
621,06035,6,3/8/1990,Avellaneda,Buenos Aires,35411-6952,1.59,6,invierno,1990-07-30,"[1990-07-30, 1990-07-31, 1990-08-01, 1990-08-02, 1990-08-03, 1990-08-04, 1990-08-05]",true,621,-34.67500565,-58.31056343,3.38,"[0, 0, 0, 0, 0, 0, 0]",,,Miscelaneas,,,"{""type"":""Point"",""coordinates"":[-58.31056343,-34.675005649999996]}"
622,06805,6,13/9/1996,Tigre,Buenos Aires,34847-6831,1.44,4,invierno,1996-09-09,"[1996-09-09, 1996-09-10, 1996-09-11, 1996-09-12, 1996-09-13, 1996-09-14, 1996-09-15]",true,622,-34.3277116,-58.608687,3.84,"[0, 0, 0, 0, 0.1, 0.5, 12.6]",3.084540367126465E-6,282.09380594889325,Rio,-0.0029701096937060356,0.3461691538492839,"{""type"":""Point"",""coordinates"":[-58.608687,-34.3277116]}"
623,06778,6,10/11/2001,San Vicente,Buenos Aires,33486-6512,23.66,24,primavera,2001-11-05,"[2001-11-05, 2001-11-06, 2001-11-07, 2001-11-08, 2001-11-09, 2001-11-10, 2001-11-11]",false,623,-35.18311,-58.45241002,2.17,"[14.9, 8.2, 0, 0, 1.6, 21.9, 0]",0.0011887401342391968,291.7733383178711,Molisoles,-0.0030268169939517975,0.40765635172526044,"{""type"":""Point"",""coordinates"":[-58.45241002,-35.18311]}"
624,06658,6,4/3/1998,Quilmes,Buenos Aires,35407-6950,4.25,3,verano,1998-03-02,"[1998-03-02, 1998-03-03, 1998-03-04, 1998-03-05, 1998-03-06, 1998-03-07, 1998-03-08]",true,624,-34.70037841,-58.27664278,2.17,"[0, 0, 0.4, 25.9, 69, 4.3, 0]",,,Miscelaneas,,,"{""type"":""Point"",""coordinates"":[-58.276642779999996,-34.70037841]}"
625,06638,6,23/3/1999,Pilar,Buenos Aires,34357-5904,12.77,16,otoño,1999-03-22,"[1999-03-22, 1999-03-23, 1999-03-24, 1999-03-25, 1999-03-26, 1999-03-27, 1999-03-28]",true,625,-34.42200558,-58.95283788,1.46,"[0, 0, 17.2, 0, 0, 8.4, 28.8]",2.4437904357910156E-6,295.1869653065999,Molisoles,-0.003224693238735199,0.4379374186197917,"{""type"":""Point"",""coordinates"":[-58.95283788,-34.42200558]}"
626,06568,6,5/1/2012,Moron,Buenos Aires,33486-6512,15.92,14,verano,2012-01-02,"[2012-01-02, 2012-01-03, 2012-01-04, 2012-01-05, 2012-01-06, 2012-01-07, 2012-01-08]",false,626,-34.6644131,-58.64564271,3.58,"[0, 0, 0, 0, 0, 0, 0]",5.21540641784668E-7,298.91221682230633,Miscelaneas,-0.00180027075111866,0.249603271484375,"{""type"":""Point"",""coordinates"":[-58.645642710000004,-34.6644131]}"
627,06568,6,12/6/1992,Moron,Buenos Aires,33486-6512,15.92,14,otoño,1992-06-08,"[1992-06-08, 1992-06-09, 1992-06-10, 1992-06-11, 1992-06-12, 1992-06-13, 1992-06-14]",false,627,-34.6644131,-58.64564271,3.58,"[19.3, 0, 0.7, 0, 0, 16.7, 21.7]",5.678832530975342E-4,285.96558380126953,Miscelaneas,-6.905626505613327E-4,0.459781010945638,"{""type"":""Point"",""coordinates"":[-58.645642710000004,-34.6644131]}"
628,06490,6,13/8/2006,Lomas de Zamora,Buenos Aires,35405-6949,5.53,9,invierno,2006-08-07,"[2006-08-07, 2006-08-08, 2006-08-09, 2006-08-10, 2006-08-11, 2006-08-12, 2006-08-13]",true,628,-34.73790272,-58.44067537,3,"[5.9, 0, 0, 0, 0, 0, 0]",1.7102062702178955E-4,286.1482276916504,Miscelaneas,-8.249003440141678E-4,0.3989245096842448,"{""type"":""Point"",""coordinates"":[-58.44067537000001,-34.73790272]}"
629,06434,6,25/7/2012,Lanus,Buenos Aires,8891-2706,4.6,5,invierno,2012-07-23,"[2012-07-23, 2012-07-24, 2012-07-25, 2012-07-26, 2012-07-27, 2012-07-28, 2012-07-29]",true,629,-34.69095715,-58.38386285,4.6,"[0, 0, 0, 0, 0, 0, 0]",2.753734588623047E-5,282.5335388183594,Miscelaneas,-6.854534149169922E-4,0.3176167805989583,"{""type"":""Point"",""coordinates"":[-58.38386285000001,-34.69095715000001]}"
630,06441,6,1/1/1991,La Plata,Buenos Aires,3314-1708,23.31,26,verano,1990-12-31,"[1990-12-31, 1991-01-01, 1991-01-02, 1991-01-03, 1991-01-04, 1991-01-05, 1991-01-06]",false,630,-35.03880607,-58.05930616,0.93,"[0, 11.2, 0, 0, 0, 0, 0]",6.079673767089844E-6,295.9037278493245,Complejo indiferenci,-0.005535656586289406,0.41205088297526044,"{""type"":""Point"",""coordinates"":[-58.05930616,-35.03880607000001]}"
631,06427,6,13/4/2003,La Matanza,Buenos Aires,33486-6512,4.98,8,otoño,2003-04-07,"[2003-04-07, 2003-04-08, 2003-04-09, 2003-04-10, 2003-04-11, 2003-04-12, 2003-04-13]",true,631,-34.71417289,-58.50890438,7.28,"[0.4, 0, 3.8, 0, 0.1, 0, 0]",2.184659242630005E-4,291.34357198079425,Molisoles,-0.0024775080382823944,0.429653803507487,"{""type"":""Point"",""coordinates"":[-58.50890437999999,-34.71417289000001]}"
632,06638,6,22/7/2002,Pilar,Buenos Aires,42-42,10.41,16,invierno,2002-07-22,"[2002-07-22, 2002-07-23, 2002-07-24, 2002-07-25, 2002-07-26, 2002-07-27, 2002-07-28]",true,632,-34.42200558,-58.95283788,1.46,"[0, 0.9, 4.4, 0, 0, 0, 0]",6.511211395263672E-4,286.205467859904,Molisoles,-0.002123648300766945,0.47045008341471356,"{""type"":""Point"",""coordinates"":[-58.95283788,-34.42200558]}"
633,06638,6,24/4/1995,Pilar,Buenos Aires,42-42,10.41,16,otoño,1995-04-24,"[1995-04-24, 1995-04-25, 1995-04-26, 1995-04-27, 1995-04-28, 1995-04-29, 1995-04-30]",true,633,-34.42200558,-58.95283788,1.46,"[0, 0, 0, 0, 28.8, 0, 2]",2.3543834686279297E-5,288.0597089131673,Molisoles,-0.001990020275115967,0.38991228739420575,"{""type"":""Point"",""coordinates"":[-58.95283788,-34.42200558]}"
634,06274,6,1/3/2015,Florencio Varela,Buenos Aires,7058-2230,1.42,23,verano,2015-02-23,"[2015-02-23, 2015-02-24, 2015-02-25, 2015-02-26, 2015-02-27, 2015-02-28, 2015-03-01]",true,634,-34.8275807,-58.222912,0,"[0, 0, 1.1, 0.1, 0, 0, 0.1]",8.83936882019043E-5,297.86977513631183,Complejo indiferenci,-0.0032722363248467445,0.3238779703776042,"{""type"":""Point"",""coordinates"":[-58.22291200000001,-34.8275807]}"
635,06260,6,17/11/2013,Esteban Echeverria,Buenos Aires,33486-6512,6.94,23,primavera,2013-11-11,"[2013-11-11, 2013-11-12, 2013-11-13, 2013-11-14, 2013-11-15, 2013-11-16, 2013-11-17]",true,635,-34.88497914,-58.47780994,1.46,"[0.2, 0, 1.5, 0.8, 45, 0, 0]",1.1593103408813477E-5,292.5684502919515,Miscelaneas,-0.0032357079908251762,0.47579193115234375,"{""type"":""Point"",""coordinates"":[-58.47780994,-34.884979140000006]}"
636,06252,6,1/12/1996,Escobar,Buenos Aires,42-42,1.31,4,primavera,1996-11-25,"[1996-11-25, 1996-11-26, 1996-11-27, 1996-11-28, 1996-11-29, 1996-11-30, 1996-12-01]",true,636,-34.3007971,-58.7215474,2.24,"[0, 0, 0, 0, 16.1, 0, 0]",3.725290298461914E-7,293.34064928690594,Molisoles,-0.004606456495821476,0.31841405232747394,"{""type"":""Point"",""coordinates"":[-58.7215474,-34.3007971]}"
637,06245,6,2/1/2003,Ensenada,Buenos Aires,3314-1708,6.45,8,verano,2002-12-30,"[2002-12-30, 2002-12-31, 2003-01-01, 2003-01-02, 2003-01-03, 2003-01-04, 2003-01-05]",true,637,-34.87584856,-57.9336299,5.71,"[20.1, 2.7, 2.1, 0, 0, 0.7, 2.4]",0.0066300928592681885,293.1459490458171,Miscelaneas,-0.005218428559601307,0.4516652425130208,"{""type"":""Point"",""coordinates"":[-57.9336299,-34.875848559999994]}"
638,06217,6,2/6/2015,Chascomus,Buenos Aires,6766-2227,28.22,14,otoño,2015-06-01,"[2015-06-01, 2015-06-02, 2015-06-03, 2015-06-04, 2015-06-05, 2015-06-06, 2015-06-07]",false,638,-35.4916042,-57.8945611,1.47,"[0, 0, 0, 0, 0.7, 4.5, 0]",3.0860304832458496E-5,287.48501777648926,Complejo indiferenci,-9.431429207324982E-4,0.3818817138671875,"{""type"":""Point"",""coordinates"":[-57.894561100000004,-35.4916042]}"
639,06126,6,23/8/1993,Campana,Buenos Aires,26206-5876,0.02,4,invierno,1993-08-23,"[1993-08-23, 1993-08-24, 1993-08-25, 1993-08-26, 1993-08-27, 1993-08-28, 1993-08-29]",true,639,-34.059934,-58.836065,2.91,"[0, 0, 0, 0, 7.8, 16.5, 14.9]",8.940696716308594E-8,285.5713399251302,Rio,-0.0018890388309955597,0.40624237060546875,"{""type"":""Point"",""coordinates"":[-58.836065000000005,-34.059934]}"
640,06098,6,4/4/2009,Berisso,Buenos Aires,3314-1708,0.7,7,otoño,2009-03-30,"[2009-03-30, 2009-03-31, 2009-04-01, 2009-04-02, 2009-04-03, 2009-04-04, 2009-04-05]",true,640,-34.84587606,-57.87973336,3.58,"[0.6, 2.9, 0, 6.2, 0, 33.2, 0]",,,Miscelaneas,,,"{""type"":""Point"",""coordinates"":[-57.87973336,-34.84587606]}"
641,02009,2,1/10/1993,Comuna 9,Capital Federal,36837-7237,4.96,32,primavera,1993-09-27,"[1993-09-27, 1993-09-28, 1993-09-29, 1993-09-30, 1993-10-01, 1993-10-02, 1993-10-03]",true,641,-34.64379608,-58.5191299,1.85,"[0, 4.4, 0, 9.1, 0.5, 0.2, 0]",5.23298978805542E-4,287.1813170115153,Miscelaneas,-0.003505905158817768,0.4001636505126953,"{""type"":""Point"",""coordinates"":[-58.51912990000001,-34.64379608]}"
642,02008,2,8/2/2010,Comuna 8,Capital Federal,36837-7237,7.49,21,verano,2010-02-08,"[2010-02-08, 2010-02-09, 2010-02-10, 2010-02-11, 2010-02-12, 2010-02-13, 2010-02-14]",true,642,-34.67499358,-58.47616299,1.13,"[0, 0, 6.9, 0, 0, 0.8, 0]",5.289912223815918E-5,296.901709874471,Miscelaneas,-0.006389874964952469,0.47133509318033856,"{""type"":""Point"",""coordinates"":[-58.47616299,-34.67499358]}"
643,02011,2,22/9/2008,Comuna 11,Capital Federal,36837-7237,3.14,29,primavera,2008-09-22,"[2008-09-22, 2008-09-23, 2008-09-24, 2008-09-25, 2008-09-26, 2008-09-27, 2008-09-28]",true,643,-34.6042463,-58.49067643,2.78,"[0, 0, 0, 0, 0, 0, 0.1]",9.098649024963379E-5,287.3457946777344,Miscelaneas,-0.001339850015938282,0.21691767374674478,"{""type"":""Point"",""coordinates"":[-58.49067643,-34.60424629999999]}"
644,02011,2,26/7/2007,Comuna 11,Capital Federal,36837-7237,3.14,29,invierno,2007-07-23,"[2007-07-23, 2007-07-24, 2007-07-25, 2007-07-26, 2007-07-27, 2007-07-28, 2007-07-29]",true,644,-34.6042463,-58.49067643,2.78,"[0, 0, 0.3, 0, 0, 0, 0]",5.884468555450439E-4,280.74522336324054,Miscelaneas,-0.002064613625407219,0.3365732828776042,"{""type"":""Point"",""coordinates"":[-58.49067643,-34.60424629999999]}"
645,02007,2,9/4/2000,Comuna 7,Capital Federal,36837-7237,7.04,22,otoño,2000-04-03,"[2000-04-03, 2000-04-04, 2000-04-05, 2000-04-06, 2000-04-07, 2000-04-08, 2000-04-09]",true,645,-34.63680708,-58.45826985,2.25,"[1, 5.9, 0, 0.5, 47.6, 0, 21.8]",8.976459503173828E-5,290.7234052022298,Miscelaneas,-0.0020479243248701096,0.28119850158691406,"{""type"":""Point"",""coordinates"":[-58.45826984999999,-34.63680708]}"
646,02012,2,10/11/1993,Comuna 12,Capital Federal,54-54,3.13,20,primavera,1993-11-08,"[1993-11-08, 1993-11-09, 1993-11-10, 1993-11-11, 1993-11-12, 1993-11-13, 1993-11-14]",true,646,-34.56062514,-58.47494475,0.93,"[0, 0, 0, 50.4, 0.2, 15.1, 2.1]",0.0011434555053710938,292.9294490814209,Miscelaneas,-0.004785079509019852,0.33889134724934894,"{""type"":""Point"",""coordinates"":[-58.474944750000006,-34.560625140000006]}"
647,02015,2,7/8/1997,Comuna 15,Capital Federal,36837-7237,2.81,29,invierno,1997-08-04,"[1997-08-04, 1997-08-05, 1997-08-06, 1997-08-07, 1997-08-08, 1997-08-09, 1997-08-10]",true,647,-34.59294425,-58.48867142,4.63,"[0, 0, 0, 0, 0, 0, 0]",1.5905499458312988E-4,279.21877415974933,Miscelaneas,-0.002129179425537586,0.36511675516764325,"{""type"":""Point"",""coordinates"":[-58.48867142,-34.59294425]}"
648,02006,2,8/3/1996,Comuna 6,Capital Federal,85-85,5.9,32,verano,1996-03-04,"[1996-03-04, 1996-03-05, 1996-03-06, 1996-03-07, 1996-03-08, 1996-03-09, 1996-03-10]",true,648,-34.6168255,-58.44360311,5.01,"[0, 0, 0, 0, 0, 0, 0]",7.522106170654297E-5,295.1028238932292,Miscelaneas,-0.003325745463371277,0.22413762410481772,"{""type"":""Point"",""coordinates"":[-58.44360310999999,-34.6168255]}"
649,02005,2,15/3/1990,Comuna 5,Capital Federal,85-85,3.75,37,verano,1990-03-12,"[1990-03-12, 1990-03-13, 1990-03-14, 1990-03-15, 1990-03-16, 1990-03-17, 1990-03-18]",true,649,-34.60922769,-58.42174523,2.44,"[0, 4.7, 0, 0, 0, 0.1, 0]",6.792545318603516E-4,295.3022524515788,Miscelaneas,-0.0040792785584926605,0.39886474609375,"{""type"":""Point"",""coordinates"":[-58.42174523,-34.609227690000004]}"
650,02004,2,1/3/2011,Comuna 4,Capital Federal,8891-2706,2.09,10,verano,2011-02-28,"[2011-02-28, 2011-03-01, 2011-03-02, 2011-03-03, 2011-03-04, 2011-03-05, 2011-03-06]",true,650,-34.64641355,-58.38427103,1.46,"[0, 0, 0, 0, 0, 0, 0.8]",1.706331968307495E-4,296.0645287831624,Miscelaneas,-0.003058522939682007,0.24452590942382812,"{""type"":""Point"",""coordinates"":[-58.384271029999994,-34.64641355]}"
651,02014,2,17/11/1994,Comuna 14,Capital Federal,85-85,2.68,24,primavera,1994-11-14,"[1994-11-14, 1994-11-15, 1994-11-16, 1994-11-17, 1994-11-18, 1994-11-19, 1994-11-20]",true,651,-34.57389998,-58.42243645,5.28,"[0.1, 0.1, 0.3, 0, 0, 0, 0]",5.726218223571777E-4,295.2632884979248,Miscelaneas,-0.004205562174320221,0.2673301696777344,"{""type"":""Point"",""coordinates"":[-58.42243645,-34.57389997999999]}"
652,02004,2,11/5/2005,Comuna 4,Capital Federal,8891-2706,2.09,10,otoño,2005-05-09,"[2005-05-09, 2005-05-10, 2005-05-11, 2005-05-12, 2005-05-13, 2005-05-14, 2005-05-15]",true,652,-34.64641355,-58.38427103,1.46,"[2.3, 1.3, 0.9, 2, 0.6, 2.4, 3.4]",2.5878846645355225E-4,288.86902872721356,Miscelaneas,-0.001222444698214531,0.26130930582682294,"{""type"":""Point"",""coordinates"":[-58.384271029999994,-34.64641355]}"
653,02001,2,10/12/1992,Comuna 1,Capital Federal,8891-2706,1.05,28,primavera,1992-12-07,"[1992-12-07, 1992-12-08, 1992-12-09, 1992-12-10, 1992-12-11, 1992-12-12, 1992-12-13]",true,653,-34.62504786,-58.38438723,3.7,"[0, 2.4, 1.6, 1, 0, 0, 3]",5.216002464294434E-4,294.0326919555664,Miscelaneas,-0.0030897166579961777,0.16939163208007812,"{""type"":""Point"",""coordinates"":[-58.38438723000001,-34.62504786000001]}"
654,02014,2,26/3/1995,Comuna 14,Capital Federal,85-85,2.68,24,verano,1995-03-20,"[1995-03-20, 1995-03-21, 1995-03-22, 1995-03-23, 1995-03-24, 1995-03-25, 1995-03-26]",true,654,-34.57389998,-58.42243645,5.28,"[0, 0, 5, 0, 0, 1.3, 0]",2.0127743482589722E-4,296.7247091929118,Miscelaneas,-0.0017616255208849907,0.18552335103352866,"{""type"":""Point"",""coordinates"":[-58.42243645,-34.57389997999999]}"
655,02002,2,1/8/1991,Comuna 2,Capital Federal,85-85,1.52,30,invierno,1991-07-29,"[1991-07-29, 1991-07-30, 1991-07-31, 1991-08-01, 1991-08-02, 1991-08-03, 1991-08-04]",true,655,-34.58587601,-58.39499618,1.85,"[30.7, 2.5, 0, 0, 0, 0, 1.3]",0.002062290906906128,285.7246920267741,Miscelaneas,-0.0018549645319581032,0.45056597391764325,"{""type"":""Point"",""coordinates"":[-58.39499618,-34.58587601000001]}"
656,06861,6,21/1/1990,Vicente Lopez,Buenos Aires,36837-7237,3.72,28,verano,1990-01-15,"[1990-01-15, 1990-01-16, 1990-01-17, 1990-01-18, 1990-01-19, 1990-01-20, 1990-01-21]",true,656,-34.52591497,-58.53576394,1.13,"[0, 0.3, 20.5, 0, 0, 0, 0]",,,Miscelaneas,,,"{""type"":""Point"",""coordinates"":[-58.53576394000001,-34.52591497]}"
657,06840,6,24/6/2006,Tres de Febrero,Buenos Aires,36837-7237,6.8,27,otoño,2006-06-19,"[2006-06-19, 2006-06-20, 2006-06-21, 2006-06-22, 2006-06-23, 2006-06-24, 2006-06-25]",true,657,-34.60887295,-58.56366446,1.85,"[6.6, 0, 0.2, 0, 0, 23.3, 10.1]",6.842613220214844E-5,289.4716688791911,Miscelaneas,-9.854156523942947E-4,0.4327932993570964,"{""type"":""Point"",""coordinates"":[-58.563664460000005,-34.60887294999999]}"
658,06035,6,1/2/2009,Avellaneda,Buenos Aires,35411-6952,1.59,6,verano,2009-01-26,"[2009-01-26, 2009-01-27, 2009-01-28, 2009-01-29, 2009-01-30, 2009-01-31, 2009-02-01]",true,658,-34.67500565,-58.31056343,3.38,"[0, 0.4, 0.3, 1.7, 5.4, 0, 0]",,,Miscelaneas,,,"{""type"":""Point"",""coordinates"":[-58.31056343,-34.675005649999996]}"
659,82112,82,20/4/1991,San Justo,Santa Fe,6235-1924,3,25,otoño,1991-04-15,"[1991-04-15, 1991-04-16, 1991-04-17, 1991-04-18, 1991-04-19, 1991-04-20, 1991-04-21]",true,659,-30.8130411,-60.3886502,2.35,"[8.7, 18.6, 3.2, 0, 0, 0, 0]",8.95380973815918E-4,296.108829498291,Molisoles,-0.0013116104528307915,0.4537645975748698,"{""type"":""Point"",""coordinates"":[-60.3886502,-30.813041099999996]}"
660,82091,82,12/10/2001,San Cristobal,Santa Fe,105-105,37.56,78,primavera,2001-10-08,"[2001-10-08, 2001-10-09, 2001-10-10, 2001-10-11, 2001-10-12, 2001-10-13, 2001-10-14]",false,660,-29.88749922,-61.57182768,1.85,"[0.4, 0, 0, 0, 1.6, 0, 0.1]",5.84721565246582E-5,289.72857093811035,Complejo indiferenci,-0.0034711724147200584,0.4742908477783203,"{""type"":""Point"",""coordinates"":[-61.571827680000006,-29.88749922]}"
661,82070,82,4/4/2014,Las Colonias,Santa Fe,6856-2113,19.32,40,otoño,2014-03-31,"[2014-03-31, 2014-04-01, 2014-04-02, 2014-04-03, 2014-04-04, 2014-04-05, 2014-04-06]",false,661,-31.6618986,-61.0112577,0,"[0, 0, 0.1, 0.4, 0, 0.2, 4.2]",2.1010637283325195E-6,290.72599093119305,Molisoles,-0.0034385686740279198,0.43919944763183594,"{""type"":""Point"",""coordinates"":[-61.0112577,-31.6618986]}"
662,82070,82,17/1/2009,Las Colonias,Santa Fe,6856-2113,19.32,40,verano,2009-01-12,"[2009-01-12, 2009-01-13, 2009-01-14, 2009-01-15, 2009-01-16, 2009-01-17, 2009-01-18]",false,662,-31.6618986,-61.0112577,0,"[1.6, 3.2, 0, 0, 0, 0, 8.2]",6.4820051193237305E-6,299.9061622619629,Molisoles,-0.0010065492242574692,0.26067161560058594,"{""type"":""Point"",""coordinates"":[-61.0112577,-31.6618986]}"
663,82070,82,16/11/2013,Las Colonias,Santa Fe,6856-2113,19.32,40,primavera,2013-11-11,"[2013-11-11, 2013-11-12, 2013-11-13, 2013-11-14, 2013-11-15, 2013-11-16, 2013-11-17]",false,663,-31.6618986,-61.0112577,0,"[8.5, 0, 0, 0, 20, 0, 0]",0.0018156766891479492,292.12321917215985,Molisoles,-0.003776480443775654,0.45185216267903644,"{""type"":""Point"",""coordinates"":[-61.0112577,-31.6618986]}"
664,82063,82,12/10/1995,La Capital,Santa Fe,103-103,23.73,25,primavera,1995-10-09,"[1995-10-09, 1995-10-10, 1995-10-11, 1995-10-12, 1995-10-13, 1995-10-14, 1995-10-15]",false,664,-31.18858147,-60.62677383,2.15,"[0, 0, 6.6, 12.9, 0, 0, 0]",8.255243301391602E-6,288.1917374928792,Molisoles,-0.004500754177570343,0.4216868082682292,"{""type"":""Point"",""coordinates"":[-60.62677383,-31.18858147]}"
665,82063,82,8/12/1993,La Capital,Santa Fe,103-103,23.73,25,primavera,1993-12-06,"[1993-12-06, 1993-12-07, 1993-12-08, 1993-12-09, 1993-12-10, 1993-12-11, 1993-12-12]",false,665,-31.18858147,-60.62677383,2.15,"[0, 0, 0.2, 0.8, 0, 0, 6.3]",0.0011553019285202026,292.6764437357585,Molisoles,-0.0051360297948122025,0.4311682383219401,"{""type"":""Point"",""coordinates"":[-60.62677383,-31.18858147]}"
666,14014,14,11/12/1996,Capital,Cordoba,37574-7384,24.04,426,primavera,1996-12-09,"[1996-12-09, 1996-12-10, 1996-12-11, 1996-12-12, 1996-12-13, 1996-12-14, 1996-12-15]",false,666,-31.47878838,-64.14509583,2.86,"[3.3, 4.4, 0, 0.2, 0, 0, 4.8]",1.9475817680358887E-5,292.3008581797282,Miscelaneas,-0.0017128726467490196,0.33875783284505206,"{""type"":""Point"",""coordinates"":[-64.14509583,-31.478788380000008]}"
667,02013,2,21/11/2015,Comuna 13,Capital Federal,54-54,3.99,10,primavera,2015-11-16,"[2015-11-16, 2015-11-17, 2015-11-18, 2015-11-19, 2015-11-20, 2015-11-21, 2015-11-22]",true,667,-34.55488152,-58.4502891,3.85,"[0, 13.4, 0.5, 16.2, 0, 0, 0]",1.3080239295959473E-4,295.66387939453125,Miscelaneas,-0.004974759183824062,0.28565025329589844,"{""type"":""Point"",""coordinates"":[-58.4502891,-34.55488152]}"
668,06035,6,27/1/2010,Avellaneda,Buenos Aires,35411-6952,1.59,6,verano,2010-01-25,"[2010-01-25, 2010-01-26, 2010-01-27, 2010-01-28, 2010-01-29, 2010-01-30, 2010-01-31]",true,668,-34.67500565,-58.31056343,3.38,"[0, 0, 0, 0, 0, 0, 7.1]",,,Miscelaneas,,,"{""type"":""Point"",""coordinates"":[-58.31056343,-34.675005649999996]}"
669,30028,30,8/12/2001,Federacion,Entre Rios,1385-1073,7.52,49,primavera,2001-12-03,"[2001-12-03, 2001-12-04, 2001-12-05, 2001-12-06, 2001-12-07, 2001-12-08, 2001-12-09]",true,669,-30.70681007,-57.88784914,1.85,"[4.9, 0.6, 0, 0, 0, 4, 0]",0.002278342843055725,293.82856369018555,Molisoles,-0.0037025995552539825,0.18865140279134116,"{""type"":""Point"",""coordinates"":[-57.88784913999999,-30.70681007]}"
670,06658,6,17/4/1990,Quilmes,Buenos Aires,35407-6950,4.25,3,otoño,1990-04-16,"[1990-04-16, 1990-04-17, 1990-04-18, 1990-04-19, 1990-04-20, 1990-04-21, 1990-04-22]",true,670,-34.70037841,-58.27664278,2.17,"[32.7, 0.4, 0, 0, 1.3, 5.6, 6.2]",,,Miscelaneas,,,"{""type"":""Point"",""coordinates"":[-58.276642779999996,-34.70037841]}"
671,06245,6,8/1/2004,Ensenada,Buenos Aires,3314-1708,6.45,8,verano,2004-01-05,"[2004-01-05, 2004-01-06, 2004-01-07, 2004-01-08, 2004-01-09, 2004-01-10, 2004-01-11]",true,671,-34.87584856,-57.9336299,5.71,"[0.3, 0.5, 3.2, 0, 0, 10.2, 0]",1.3139843940734863E-4,298.4296684265137,Miscelaneas,-0.004353245720267296,0.2954387664794922,"{""type"":""Point"",""coordinates"":[-57.9336299,-34.875848559999994]}"
672,06098,6,7/5/2014,Berisso,Buenos Aires,3314-1708,0.7,7,otoño,2014-05-05,"[2014-05-05, 2014-05-06, 2014-05-07, 2014-05-08, 2014-05-09, 2014-05-10, 2014-05-11]",true,672,-34.84587606,-57.87973336,3.58,"[0.3, 0.6, 0.1, 0.1, 0.5, 0, 1.5]",,,Miscelaneas,,,"{""type"":""Point"",""coordinates"":[-57.87973336,-34.84587606]}"
673,38094,38,4/11/1994,Tilcara,Jujuy,32945-6436,43.06,2663,primavera,1994-10-31,"[1994-10-31, 1994-11-01, 1994-11-02, 1994-11-03, 1994-11-04, 1994-11-05, 1994-11-06]",false,673,-23.77525242,-65.29804781,15.83,"[2.4, 0, 0, 4.1, 4.4, 4.2, 13.3]",0.005792304873466492,280.82912254333496,Aridisoles,-0.003124415874481201,0.4772758483886719,"{""type"":""Point"",""coordinates"":[-65.29804781,-23.775252419999997]}"
674,38094,38,23/6/1999,Tilcara,Jujuy,32945-6436,43.06,2663,invierno,1999-06-21,"[1999-06-21, 1999-06-22, 1999-06-23, 1999-06-24, 1999-06-25, 1999-06-26, 1999-06-27]",false,674,-23.77525242,-65.29804781,15.83,"[0, 0, 0.2, 0.1, 9, 0, 2.4]",0.0013611763715744019,280.0277779897054,Aridisoles,-0.0015801247209310532,0.47558848063151044,"{""type"":""Point"",""coordinates"":[-65.29804781,-23.775252419999997]}"
675,38094,38,22/9/2008,Tilcara,Jujuy,32945-6436,43.06,2663,primavera,2008-09-22,"[2008-09-22, 2008-09-23, 2008-09-24, 2008-09-25, 2008-09-26, 2008-09-27, 2008-09-28]",false,675,-23.77525242,-65.29804781,15.83,"[0.6, 0.2, 4.4, 8.4, 0, 0, 2.7]",3.272891044616699E-4,280.06495157877606,Aridisoles,-0.0024068672209978104,0.37536366780598956,"{""type"":""Point"",""coordinates"":[-65.29804781,-23.775252419999997]}"
676,70105,70,23/6/1993,Sarmiento,San Juan,32300-6465,34.88,546,invierno,1993-06-21,"[1993-06-21, 1993-06-22, 1993-06-23, 1993-06-24, 1993-06-25, 1993-06-26, 1993-06-27]",false,676,-32.02091413,-68.39270346,1.43,"[0, 0, 0, 0, 0, 0, 0]",0.0,283.69837125142413,Roca,-4.9666501581668854E-5,0.049442291259765625,"{""type"":""Point"",""coordinates"":[-68.39270346,-32.02091413]}"
677,14161,14,4/2/2008,Tercero Arriba,Cordoba,34345-6361,4.53,473,verano,2008-02-04,"[2008-02-04, 2008-02-05, 2008-02-06, 2008-02-07, 2008-02-08, 2008-02-09, 2008-02-10]",true,677,-32.25289151,-64.25143209,2.87,"[0, 0, 0, 38.6, 1.1, 0.6, 0]",6.258487701416016E-7,295.64072100321454,Complejo indiferenci,-0.004654714837670326,0.3225104014078776,"{""type"":""Point"",""coordinates"":[-64.25143209,-32.25289151]}"
678,66126,66,18/6/2002,Oran,Salta,6350-1973,11.39,373,otoño,2002-06-17,"[2002-06-17, 2002-06-18, 2002-06-19, 2002-06-20, 2002-06-21, 2002-06-22, 2002-06-23]",true,678,-22.9746,-64.41384,1.37,"[0, 0, 0, 0, 0, 0.5, 0]",7.167011499404907E-4,286.5339883168538,Roca,-0.0011559687554836273,0.41618601481119794,"{""type"":""Point"",""coordinates"":[-64.41384,-22.974599999999995]}"
679,06490,6,19/6/2013,Lomas de Zamora,Buenos Aires,35405-6949,5.53,9,otoño,2013-06-17,"[2013-06-17, 2013-06-18, 2013-06-19, 2013-06-20, 2013-06-21, 2013-06-22, 2013-06-23]",true,679,-34.73790272,-58.44067537,3,"[0, 0, 0, 0, 0, 0, 0]",1.3324618339538574E-4,281.0681546529134,Miscelaneas,-9.397994726896286E-4,0.3725465138753255,"{""type"":""Point"",""coordinates"":[-58.44067537000001,-34.73790272]}"
680,02015,2,4/4/2011,Comuna 15,Capital Federal,36837-7237,2.81,29,otoño,2011-04-04,"[2011-04-04, 2011-04-05, 2011-04-06, 2011-04-07, 2011-04-08, 2011-04-09, 2011-04-10]",true,680,-34.59294425,-58.48867142,4.63,"[0, 0, 0, 0.4, 1.4, 0, 0]",9.204447269439697E-5,290.1704902648926,Miscelaneas,-0.0031436001881957054,0.365268071492513,"{""type"":""Point"",""coordinates"":[-58.48867142,-34.59294425]}"
681,82063,82,17/9/1998,La Capital,Santa Fe,103-103,23.73,25,invierno,1998-09-14,"[1998-09-14, 1998-09-15, 1998-09-16, 1998-09-17, 1998-09-18, 1998-09-19, 1998-09-20]",false,681,-31.18858147,-60.62677383,2.15,"[0.5, 0, 0, 3.8, 0, 0, 0]",2.0430982112884521E-4,285.18393007914227,Molisoles,-0.002150006592273712,0.34836069742838544,"{""type"":""Point"",""coordinates"":[-60.62677383,-31.18858147]}"
682,06357,6,12/4/2014,General Pueyrredon,Buenos Aires,3347-1742,17.47,21,otoño,2014-04-07,"[2014-04-07, 2014-04-08, 2014-04-09, 2014-04-10, 2014-04-11, 2014-04-12, 2014-04-13]",false,682,-37.80766254,-57.62989086,5.55,"[8.5, 45.5, 0, 2.3, 0, 12.5, 3.2]",1.329183578491211E-5,292.4755687713623,Molisoles,-0.0010216590017080307,0.45580800374348956,"{""type"":""Point"",""coordinates"":[-57.62989086,-37.80766254000001]}"
683,02006,2,17/2/2001,Comuna 6,Capital Federal,85-85,5.9,32,verano,2001-02-12,"[2001-02-12, 2001-02-13, 2001-02-14, 2001-02-15, 2001-02-16, 2001-02-17, 2001-02-18]",true,683,-34.6168255,-58.44360311,5.01,"[0, 0, 0, 0, 0.2, 0, 0]",3.064572811126709E-4,293.13242594401044,Miscelaneas,-0.005417010746896267,0.42608388264973956,"{""type"":""Point"",""coordinates"":[-58.44360310999999,-34.6168255]}"
684,02014,2,8/6/2015,Comuna 14,Capital Federal,85-85,2.68,24,otoño,2015-06-08,"[2015-06-08, 2015-06-09, 2015-06-10, 2015-06-11, 2015-06-12, 2015-06-13, 2015-06-14]",true,684,-34.57389998,-58.42243645,5.28,"[0, 4.3, 0, 0, 0, 0, 0.1]",1.5527009963989258E-4,286.4534225463867,Miscelaneas,-0.0015108566731214523,0.31652386983235675,"{""type"":""Point"",""coordinates"":[-58.42243645,-34.57389997999999]}"
685,02004,2,2/1/1990,Comuna 4,Capital Federal,8891-2706,2.09,10,verano,1990-01-01,"[1990-01-01, 1990-01-02, 1990-01-03, 1990-01-04, 1990-01-05, 1990-01-06, 1990-01-07]",true,685,-34.64641355,-58.38427103,1.46,"[0, 0, 0, 0.6, 0, 0, 3.4]",1.0335445404052734E-4,295.75294558207196,Miscelaneas,-0.0019755419343709946,0.13247235616048178,"{""type"":""Point"",""coordinates"":[-58.384271029999994,-34.64641355]}"
686,02005,2,7/8/2008,Comuna 5,Capital Federal,85-85,3.75,37,invierno,2008-08-04,"[2008-08-04, 2008-08-05, 2008-08-06, 2008-08-07, 2008-08-08, 2008-08-09, 2008-08-10]",true,686,-34.60922769,-58.42174523,2.44,"[3.2, 0, 0, 0, 0, 0, 0]",1.223236322402954E-4,282.7136344909668,Miscelaneas,-0.0011878423392772675,0.3695576985677083,"{""type"":""Point"",""coordinates"":[-58.42174523,-34.609227690000004]}"
687,58035,58,21/7/2001,Confluencia,Neuquen,6898-2210,63.38,857,invierno,2001-07-16,"[2001-07-16, 2001-07-17, 2001-07-18, 2001-07-19, 2001-07-20, 2001-07-21, 2001-07-22]",false,687,-38.75282316,-68.83773873,2.2,"[3.2, 0, 6.4, 2, 2.8, 2.1, 0]",9.804964065551758E-6,278.4477119445801,Aridisoles,-4.833340644836426E-4,0.1626605987548828,"{""type"":""Point"",""coordinates"":[-68.83773873,-38.75282316]}"
688,62021,62,15/9/1996,Bariloche,Rio Negro,6953-2144,0.07,408,invierno,1996-09-09,"[1996-09-09, 1996-09-10, 1996-09-11, 1996-09-12, 1996-09-13, 1996-09-14, 1996-09-15]",true,688,-41.89814608,-71.50316469,2.66,"[0, 0, 0, 5.3, 3.6, 0, 0]",0.003569170832633972,274.1498769124349,Inceptisoles,-3.59291210770607E-4,0.4912300109863281,"{""type"":""Point"",""coordinates"":[-71.50316469000002,-41.898146080000004]}"
689,58035,58,1/9/2011,Confluencia,Neuquen,6898-2210,63.38,857,invierno,2011-08-29,"[2011-08-29, 2011-08-30, 2011-08-31, 2011-09-01, 2011-09-02, 2011-09-03, 2011-09-04]",false,689,-38.75282316,-68.83773873,2.2,"[0, 0, 0, 0, 0, 0, 0]",2.086162567138672E-7,281.28696314493817,Aridisoles,-7.974468171596527E-4,0.07981300354003906,"{""type"":""Point"",""coordinates"":[-68.83773873,-38.75282316]}"
690,58042,58,5/9/2001,Chos Malal,Neuquen,6798-2155,17.14,1162,invierno,2001-09-03,"[2001-09-03, 2001-09-04, 2001-09-05, 2001-09-06, 2001-09-07, 2001-09-08, 2001-09-09]",false,690,-37.06895161,-70.38454137,6.54,"[0, 0, 0, 0, 0, 0.9, 0]",0.0023358166217803955,270.28792063395184,Roca,-1.8037669360637665E-4,0.25504112243652344,"{""type"":""Point"",""coordinates"":[-70.38454137,-37.06895161]}"
691,58035,58,19/5/2009,Confluencia,Neuquen,6898-2210,63.38,857,otoño,2009-05-18,"[2009-05-18, 2009-05-19, 2009-05-20, 2009-05-21, 2009-05-22, 2009-05-23, 2009-05-24]",false,691,-38.75282316,-68.83773873,2.2,"[0, 0, 0.5, 0, 0, 0, 0.6]",1.4901161193847656E-8,279.7837168375651,Aridisoles,-0.0010303817689418793,0.20143826802571616,"{""type"":""Point"",""coordinates"":[-68.83773873,-38.75282316]}"
692,58049,58,16/9/2001,Huiliches,Neuquen,33712-6513,31.44,959,invierno,2001-09-10,"[2001-09-10, 2001-09-11, 2001-09-12, 2001-09-13, 2001-09-14, 2001-09-15, 2001-09-16]",false,692,-39.73103584,-71.07764941,4.42,"[0, 0, 0, 1.4, 0, 0, 0]",0.002212822437286377,274.8082497914632,Inceptisoles,-9.92530956864357E-4,0.46086883544921875,"{""type"":""Point"",""coordinates"":[-71.07764941,-39.73103584]}"
693,26014,26,10/8/1996,Cushamen,Chubut,36848-7245,2.82,312,invierno,1996-08-05,"[1996-08-05, 1996-08-06, 1996-08-07, 1996-08-08, 1996-08-09, 1996-08-10, 1996-08-11]",true,693,-42.03927359,-71.56551616,3.05,"[2.3, 0.4, 1.9, 5.1, 13.7, 20.3, 0]",0.002366960048675537,273.00800132751465,Entisoles,-3.6637764424085617E-4,0.473202387491862,"{""type"":""Point"",""coordinates"":[-71.56551616,-42.03927359]}"
694,22133,22,3/1/1997,Quitilipi,Chaco,36786-7204,29.42,89,verano,1996-12-30,"[1996-12-30, 1996-12-31, 1997-01-01, 1997-01-02, 1997-01-03, 1997-01-04, 1997-01-05]",false,694,-26.99698694,-60.33777397,2.13,"[0.4, 1.3, 0.3, 0, 0, 0, 0.1]",9.682774543762207E-5,301.8679084777832,Molisoles,-0.006373335607349873,0.3548075358072917,"{""type"":""Point"",""coordinates"":[-60.33777397000001,-26.99698694]}"
695,22063,22,17/3/1997,General Guemes,Chaco,33840-6431,76.76,130,verano,1997-03-17,"[1997-03-17, 1997-03-18, 1997-03-19, 1997-03-20, 1997-03-21, 1997-03-22, 1997-03-23]",false,695,-25.70413822,-61.03150273,0,"[0, 0, 0, 0.1, 0, 10.4, 28.7]",1.6391277313232422E-6,299.35816383361816,Alfisoles,-0.005463229492306709,0.33196576436360675,"{""type"":""Point"",""coordinates"":[-61.03150273,-25.70413822]}"
696,66056,66,25/4/1999,General Jose de San Martin,Salta,6934-2187,25.44,797,otoño,1999-04-19,"[1999-04-19, 1999-04-20, 1999-04-21, 1999-04-22, 1999-04-23, 1999-04-24, 1999-04-25]",false,696,-22.16459982,-63.9088426,0.93,"[0, 0, 0, 0, 0, 0, 0]",0.0023456215858459473,286.46204566955566,Molisoles,-0.0030975714325904846,0.44684473673502606,"{""type"":""Point"",""coordinates"":[-63.90884259999999,-22.16459982]}"
697,66056,66,24/12/1999,General Jose de San Martin,Salta,6934-2187,25.44,797,primavera,1999-12-20,"[1999-12-20, 1999-12-21, 1999-12-22, 1999-12-23, 1999-12-24, 1999-12-25, 1999-12-26]",false,697,-22.16459982,-63.9088426,0.93,"[5.1, 0, 3.3, 0.2, 9.5, 3, 0]",1.0377168655395508E-4,296.86656379699707,Molisoles,-0.005278775468468666,0.457791010538737,"{""type"":""Point"",""coordinates"":[-63.90884259999999,-22.16459982]}"
698,66056,66,3/2/1997,General Jose de San Martin,Salta,6934-2187,25.44,797,verano,1997-02-03,"[1997-02-03, 1997-02-04, 1997-02-05, 1997-02-06, 1997-02-07, 1997-02-08, 1997-02-09]",false,698,-22.16459982,-63.9088426,0.93,"[0.4, 3.4, 14.9, 7.3, 0.9, 0.4, 0]",8.836686611175537E-4,294.9590377807617,Molisoles,-0.004573233425617218,0.4504082997639974,"{""type"":""Point"",""coordinates"":[-63.90884259999999,-22.16459982]}"
699,66056,66,3/11/1992,General Jose de San Martin,Salta,6934-2187,25.44,797,primavera,1992-11-02,"[1992-11-02, 1992-11-03, 1992-11-04, 1992-11-05, 1992-11-06, 1992-11-07, 1992-11-08]",false,699,-22.16459982,-63.9088426,0.93,"[0, 0.4, 1.3, 0, 0, 0, 0]",5.599856376647949E-5,298.7389424641927,Molisoles,-0.004135565832257271,0.3831322987874349,"{""type"":""Point"",""coordinates"":[-63.90884259999999,-22.16459982]}"
700,66056,66,6/10/2007,General Jose de San Martin,Salta,6934-2187,25.44,797,primavera,2007-10-01,"[2007-10-01, 2007-10-02, 2007-10-03, 2007-10-04, 2007-10-05, 2007-10-06, 2007-10-07]",false,700,-22.16459982,-63.9088426,0.93,"[0, 0, 0, 0, 0, 2.7, 0]",6.748735904693604E-5,301.6871916453044,Molisoles,-0.002010870724916458,0.33145586649576825,"{""type"":""Point"",""coordinates"":[-63.90884259999999,-22.16459982]}"
701,38105,38,27/1/2000,Valle Grande,Jujuy,33117-6463,19.12,2679,verano,2000-01-24,"[2000-01-24, 2000-01-25, 2000-01-26, 2000-01-27, 2000-01-28, 2000-01-29, 2000-01-30]",false,701,-23.56311433,-64.89713769,4.22,"[24.1, 42.4, 11.1, 10.6, 14.7, 12.5, 11.2]",0.010759413242340088,289.46377881368,Roca,-0.0027521420270204544,0.4832318623860677,"{""type"":""Point"",""coordinates"":[-64.89713769,-23.563114329999998]}"
702,38063,38,22/10/1999,San Pedro,Jujuy,33117-6463,31.49,760,primavera,1999-10-18,"[1999-10-18, 1999-10-19, 1999-10-20, 1999-10-21, 1999-10-22, 1999-10-23, 1999-10-24]",false,702,-24.40863991,-64.62158966,4.74,"[0, 0, 0, 1.6, 7.6, 27, 0.8]",1.5957653522491455E-4,291.7720769246419,Molisoles,-0.0020183268934488297,0.18944676717122397,"{""type"":""Point"",""coordinates"":[-64.62158966000001,-24.40863991]}"
703,86049,86,21/11/1992,Capital,Santiago del Estero,36917-7264,13.33,287,primavera,1992-11-16,"[1992-11-16, 1992-11-17, 1992-11-18, 1992-11-19, 1992-11-20, 1992-11-21, 1992-11-22]",true,703,-27.80983349,-64.48893926,0.93,"[0, 0, 0, 0.3, 30.4, 32.6, 0.3]",1.5598535537719727E-4,296.4611536661784,Alfisoles,-0.0032590702176094055,0.1929149627685547,"{""type"":""Point"",""coordinates"":[-64.48893926,-27.809833490000003]}"
704,86049,86,15/1/2014,Capital,Santiago del Estero,36917-7264,13.33,287,verano,2014-01-13,"[2014-01-13, 2014-01-14, 2014-01-15, 2014-01-16, 2014-01-17, 2014-01-18, 2014-01-19]",true,704,-27.80983349,-64.48893926,0.93,"[0, 0.1, 0.1, 0, 0, 1.4, 5]",9.5367431640625E-7,298.5010248819987,Alfisoles,-0.0035355165600776672,0.21620305379231772,"{""type"":""Point"",""coordinates"":[-64.48893926,-27.809833490000003]}"
705,86035,86,1/1/1998,Banda,Santiago del Estero,36917-7264,0.64,223,verano,1997-12-29,"[1997-12-29, 1997-12-30, 1997-12-31, 1998-01-01, 1998-01-02, 1998-01-03, 1998-01-04]",true,705,-27.59548811,-64.41117012,1.4,"[0.3, 45.8, 9.1, 41.8, 0, 0, 0.3]",4.0024518966674805E-5,301.9286257425944,Alfisoles,-0.0037907063961029053,0.3841845194498698,"{""type"":""Point"",""coordinates"":[-64.41117012,-27.595488109999998]}"
706,66126,66,21/8/2009,Oran,Salta,6350-1973,11.39,373,invierno,2009-08-17,"[2009-08-17, 2009-08-18, 2009-08-19, 2009-08-20, 2009-08-21, 2009-08-22, 2009-08-23]",true,706,-22.9746,-64.41384,1.37,"[0, 0, 0, 0, 0, 0, 0]",7.340312004089355E-5,291.24615414937335,Roca,-0.0019582808017730713,0.28130531311035156,"{""type"":""Point"",""coordinates"":[-64.41384,-22.974599999999995]}"
707,38105,38,16/9/1991,Valle Grande,Jujuy,33117-6463,19.12,2679,invierno,1991-09-16,"[1991-09-16, 1991-09-17, 1991-09-18, 1991-09-19, 1991-09-20, 1991-09-21, 1991-09-22]",false,707,-23.56311433,-64.89713769,4.22,"[0, 2.4, 4.1, 0.1, 0, 0, 6.2]",4.6528875827789307E-4,286.5102736155192,Roca,-0.0030199168249964714,0.4725812276204427,"{""type"":""Point"",""coordinates"":[-64.89713769,-23.563114329999998]}"
708,38105,38,17/9/1990,Valle Grande,Jujuy,33117-6463,19.12,2679,invierno,1990-09-17,"[1990-09-17, 1990-09-18, 1990-09-19, 1990-09-20, 1990-09-21, 1990-09-22, 1990-09-23]",false,708,-23.56311433,-64.89713769,4.22,"[0, 0.1, 0, 0.4, 5.8, 11.4, 3.2]",2.43455171585083E-4,285.4288501739502,Roca,-0.003101613372564316,0.3740895589192708,"{""type"":""Point"",""coordinates"":[-64.89713769,-23.563114329999998]}"
709,38105,38,24/2/2007,Valle Grande,Jujuy,33117-6463,19.12,2679,verano,2007-02-19,"[2007-02-19, 2007-02-20, 2007-02-21, 2007-02-22, 2007-02-23, 2007-02-24, 2007-02-25]",false,709,-23.56311433,-64.89713769,4.22,"[2.9, 8.3, 4.1, 6, 3.7, 2.6, 0.8]",0.007274240255355835,286.7633247375488,Roca,-0.004126673564314842,0.4758930206298828,"{""type"":""Point"",""coordinates"":[-64.89713769,-23.563114329999998]}"
710,38105,38,21/8/1995,Valle Grande,Jujuy,33117-6463,19.12,2679,invierno,1995-08-21,"[1995-08-21, 1995-08-22, 1995-08-23, 1995-08-24, 1995-08-25, 1995-08-26, 1995-08-27]",false,710,-23.56311433,-64.89713769,4.22,"[0, 0, 0, 0, 0, 0, 0.5]",3.954470157623291E-4,283.757178624471,Roca,-0.0023574363440275192,0.38595136006673175,"{""type"":""Point"",""coordinates"":[-64.89713769,-23.563114329999998]}"
711,38077,38,23/6/2007,Santa Catalina,Jujuy,6324-1963,38.66,3649,otoño,2007-06-18,"[2007-06-18, 2007-06-19, 2007-06-20, 2007-06-21, 2007-06-22, 2007-06-23, 2007-06-24]",false,711,-22.05120277,-65.84176636,4.99,"[0, 0, 0, 0, 0, 0, 0.3]",4.023313522338867E-7,281.36095174153644,Entisoles,-3.349762409925461E-4,0.13448206583658853,"{""type"":""Point"",""coordinates"":[-65.84176636,-22.051202770000003]}"
712,38070,38,6/4/1999,Santa Barbara,Jujuy,6326-1964,20.94,570,otoño,1999-04-05,"[1999-04-05, 1999-04-06, 1999-04-07, 1999-04-08, 1999-04-09, 1999-04-10, 1999-04-11]",false,712,-24.13571358,-64.58811188,2.11,"[0.6, 0.5, 4.7, 3.7, 2.3, 1.5, 2]",9.800344705581665E-4,289.926607131958,Entisoles,-0.0017113154754042625,0.4932212829589844,"{""type"":""Point"",""coordinates"":[-64.58811188,-24.13571358]}"
713,38063,38,28/11/2011,San Pedro,Jujuy,33117-6463,31.49,760,primavera,2011-11-28,"[2011-11-28, 2011-11-29, 2011-11-30, 2011-12-01, 2011-12-02, 2011-12-03, 2011-12-04]",false,713,-24.40863991,-64.62158966,4.74,"[4.3, 0, 11.8, 0, 0, 0, 15.1]",1.4522671699523926E-4,299.08646329243976,Molisoles,-0.0028150267899036407,0.24149958292643228,"{""type"":""Point"",""coordinates"":[-64.62158966000001,-24.40863991]}"
714,66056,66,5/6/1990,General Jose de San Martin,Salta,6934-2187,25.44,797,otoño,1990-06-04,"[1990-06-04, 1990-06-05, 1990-06-06, 1990-06-07, 1990-06-08, 1990-06-09, 1990-06-10]",false,714,-22.16459982,-63.9088426,0.93,"[3.1, 3.6, 0, 0, 0, 0, 3.1]",8.446872234344482E-4,287.2747605641683,Molisoles,-0.0010202322155237198,0.38802146911621094,"{""type"":""Point"",""coordinates"":[-63.90884259999999,-22.16459982]}"
715,66056,66,15/12/1997,General Jose de San Martin,Salta,6934-2187,25.44,797,primavera,1997-12-15,"[1997-12-15, 1997-12-16, 1997-12-17, 1997-12-18, 1997-12-19, 1997-12-20, 1997-12-21]",false,715,-22.16459982,-63.9088426,0.93,"[0, 0.2, 0.8, 0, 0, 0, 0]",2.9742717742919922E-5,296.31393305460614,Molisoles,-0.004722448065876961,0.44474029541015625,"{""type"":""Point"",""coordinates"":[-63.90884259999999,-22.16459982]}"
716,66133,66,2/7/2014,Rivadavia,Salta,6362-1978,14.31,246,invierno,2014-06-30,"[2014-06-30, 2014-07-01, 2014-07-02, 2014-07-03, 2014-07-04, 2014-07-05, 2014-07-06]",true,716,-22.49881,-62.40759,1,"[0, 0, 0, 0, 0.1, 3.3, 0]",2.9802322387695312E-8,286.70174853007,Molisoles,-0.0022226832807064056,0.3038584391276042,"{""type"":""Point"",""coordinates"":[-62.40759,-22.498810000000002]}"
717,66126,66,5/8/2002,Oran,Salta,6350-1973,11.39,373,invierno,2002-08-05,"[2002-08-05, 2002-08-06, 2002-08-07, 2002-08-08, 2002-08-09, 2002-08-10, 2002-08-11]",true,717,-22.9746,-64.41384,1.37,"[0, 0, 0, 0.9, 0.9, 0, 0]",3.0940771102905273E-4,286.9924233754476,Roca,-0.00217532180249691,0.35192616780598956,"{""type"":""Point"",""coordinates"":[-64.41384,-22.974599999999995]}"
718,66126,66,16/9/2010,Oran,Salta,6350-1973,11.39,373,invierno,2010-09-13,"[2010-09-13, 2010-09-14, 2010-09-15, 2010-09-16, 2010-09-17, 2010-09-18, 2010-09-19]",true,718,-22.9746,-64.41384,1.37,"[0.5, 0, 0, 0, 0, 0, 0]",1.2540817260742188E-4,293.8463897705078,Roca,-0.0019633639603853226,0.2916310628255208,"{""type"":""Point"",""coordinates"":[-64.41384,-22.974599999999995]}"
719,66126,66,19/9/2014,Oran,Salta,6350-1973,11.39,373,invierno,2014-09-15,"[2014-09-15, 2014-09-16, 2014-09-17, 2014-09-18, 2014-09-19, 2014-09-20, 2014-09-21]",true,719,-22.9746,-64.41384,1.37,"[0, 0, 0.2, 2.5, 0.2, 0, 0]",1.7210841178894043E-5,291.11531257629395,Roca,-0.0027275364845991135,0.3386046091715495,"{""type"":""Point"",""coordinates"":[-64.41384,-22.974599999999995]}"
720,66056,66,7/12/2014,General Jose de San Martin,Salta,6934-2187,25.44,797,primavera,2014-12-01,"[2014-12-01, 2014-12-02, 2014-12-03, 2014-12-04, 2014-12-05, 2014-12-06, 2014-12-07]",false,720,-22.16459982,-63.9088426,0.93,"[0.6, 0, 0, 0, 0, 0, 0]",2.7239322662353516E-5,289.47693888346356,Molisoles,-0.0034350696951150894,0.4618568420410156,"{""type"":""Point"",""coordinates"":[-63.90884259999999,-22.16459982]}"
721,66056,66,15/11/2009,General Jose de San Martin,Salta,6934-2187,25.44,797,primavera,2009-11-09,"[2009-11-09, 2009-11-10, 2009-11-11, 2009-11-12, 2009-11-13, 2009-11-14, 2009-11-15]",false,721,-22.16459982,-63.9088426,0.93,"[0, 7.5, 13.2, 0.8, 0.1, 2.1, 13.6]",3.6403536796569824E-5,297.2424373626709,Molisoles,-0.0035129860043525696,0.40806833902994794,"{""type"":""Point"",""coordinates"":[-63.90884259999999,-22.16459982]}"
722,66056,66,23/4/1997,General Jose de San Martin,Salta,6934-2187,25.44,797,otoño,1997-04-21,"[1997-04-21, 1997-04-22, 1997-04-23, 1997-04-24, 1997-04-25, 1997-04-26, 1997-04-27]",false,722,-22.16459982,-63.9088426,0.93,"[0, 0, 0, 0, 9.4, 0, 0]",0.0015833079814910889,290.95540682474774,Molisoles,-0.002566221170127392,0.4428234100341797,"{""type"":""Point"",""coordinates"":[-63.90884259999999,-22.16459982]}"
723,66056,66,8/5/2015,General Jose de San Martin,Salta,6934-2187,25.44,797,otoño,2015-05-04,"[2015-05-04, 2015-05-05, 2015-05-06, 2015-05-07, 2015-05-08, 2015-05-09, 2015-05-10]",false,723,-22.16459982,-63.9088426,0.93,"[1.8, 0, 0.8, 0.4, 0, 0, 0.3]",0.002498835325241089,287.506991704305,Molisoles,-0.002624613232910633,0.4735310872395833,"{""type"":""Point"",""coordinates"":[-63.90884259999999,-22.16459982]}"
724,66056,66,3/2/2011,General Jose de San Martin,Salta,6934-2187,25.44,797,verano,2011-01-31,"[2011-01-31, 2011-02-01, 2011-02-02, 2011-02-03, 2011-02-04, 2011-02-05, 2011-02-06]",false,724,-22.16459982,-63.9088426,0.93,"[3.5, 36.6, 4.5, 1.9, 53.8, 20.8, 32.4]",3.4928321838378906E-5,299.67578506469727,Molisoles,-0.005628136917948723,0.4606679280598958,"{""type"":""Point"",""coordinates"":[-63.90884259999999,-22.16459982]}"
725,66056,66,19/11/1995,General Jose de San Martin,Salta,6934-2187,25.44,797,primavera,1995-11-13,"[1995-11-13, 1995-11-14, 1995-11-15, 1995-11-16, 1995-11-17, 1995-11-18, 1995-11-19]",false,725,-22.16459982,-63.9088426,0.93,"[0, 0, 0.1, 0.3, 48, 14.7, 1.9]",3.166496753692627E-5,295.72370529174805,Molisoles,-0.0034559397026896477,0.40065956115722656,"{""type"":""Point"",""coordinates"":[-63.90884259999999,-22.16459982]}"
726,66056,66,19/2/1992,General Jose de San Martin,Salta,6934-2187,25.44,797,verano,1992-02-17,"[1992-02-17, 1992-02-18, 1992-02-19, 1992-02-20, 1992-02-21, 1992-02-22, 1992-02-23]",false,726,-22.16459982,-63.9088426,0.93,"[7.3, 2.1, 0, 0, 14.8, 30.2, 0]",0.007250174880027771,294.99731699625653,Molisoles,-0.004508619196712971,0.4790058135986328,"{""type"":""Point"",""coordinates"":[-63.90884259999999,-22.16459982]}"
727,82091,82,7/8/1992,San Cristobal,Santa Fe,105-105,37.56,78,invierno,1992-08-03,"[1992-08-03, 1992-08-04, 1992-08-05, 1992-08-06, 1992-08-07, 1992-08-08, 1992-08-09]",false,727,-29.88749922,-61.57182768,1.85,"[0, 0, 0, 0, 1.4, 0, 0]",3.027617931365967E-4,280.7504431406657,Complejo indiferenci,-0.0015037208795547485,0.4243621826171875,"{""type"":""Point"",""coordinates"":[-61.571827680000006,-29.88749922]}"
728,02004,2,6/7/1996,Comuna 4,Capital Federal,8891-2706,2.09,10,invierno,1996-07-01,"[1996-07-01, 1996-07-02, 1996-07-03, 1996-07-04, 1996-07-05, 1996-07-06, 1996-07-07]",true,728,-34.64641355,-58.38427103,1.46,"[0, 0, 0, 0, 0, 0, 6.7]",1.5138089656829834E-4,281.1704457600911,Miscelaneas,-8.65815207362175E-4,0.3358192443847656,"{""type"":""Point"",""coordinates"":[-58.384271029999994,-34.64641355]}"
729,02009,2,12/4/2003,Comuna 9,Capital Federal,36837-7237,4.96,32,otoño,2003-04-07,"[2003-04-07, 2003-04-08, 2003-04-09, 2003-04-10, 2003-04-11, 2003-04-12, 2003-04-13]",true,729,-34.64379608,-58.5191299,1.85,"[0.4, 0, 3.8, 0, 0.1, 0, 0]",3.602355718612671E-4,291.36945088704425,Miscelaneas,-0.0025103120133280754,0.3851585388183594,"{""type"":""Point"",""coordinates"":[-58.51912990000001,-34.64379608]}"
730,02008,2,4/4/1992,Comuna 8,Capital Federal,36837-7237,7.49,21,otoño,1992-03-30,"[1992-03-30, 1992-03-31, 1992-04-01, 1992-04-02, 1992-04-03, 1992-04-04, 1992-04-05]",true,730,-34.67499358,-58.47616299,1.13,"[0, 0, 0, 0.2, 0, 12.4, 0]",1.920163631439209E-4,291.66795539855957,Miscelaneas,-0.0012392466887831688,0.191375732421875,"{""type"":""Point"",""coordinates"":[-58.47616299,-34.67499358]}"
731,02014,2,2/3/2014,Comuna 14,Capital Federal,85-85,2.68,24,verano,2014-02-24,"[2014-02-24, 2014-02-25, 2014-02-26, 2014-02-27, 2014-02-28, 2014-03-01, 2014-03-02]",true,731,-34.57389998,-58.42243645,5.28,"[0, 0, 0.4, 0, 0, 0, 0]",0.0014568939805030823,295.44312413533527,Miscelaneas,-0.00442186463624239,0.3355458577473958,"{""type"":""Point"",""coordinates"":[-58.42243645,-34.57389997999999]}"
732,02007,2,23/7/1995,Comuna 7,Capital Federal,36837-7237,7.04,22,invierno,1995-07-17,"[1995-07-17, 1995-07-18, 1995-07-19, 1995-07-20, 1995-07-21, 1995-07-22, 1995-07-23]",true,732,-34.63680708,-58.45826985,2.25,"[0, 0, 0, 0, 0, 0, 0]",2.2524595260620117E-4,277.817829767863,Miscelaneas,-0.0013502798974514008,0.3858782450358073,"{""type"":""Point"",""coordinates"":[-58.45826984999999,-34.63680708]}"
733,02012,2,10/3/1991,Comuna 12,Capital Federal,54-54,3.13,20,verano,1991-03-04,"[1991-03-04, 1991-03-05, 1991-03-06, 1991-03-07, 1991-03-08, 1991-03-09, 1991-03-10]",true,733,-34.56062514,-58.47494475,0.93,"[0, 0, 0, 0, 1.9, 4.6, 0]",4.187077283859253E-4,293.94824091593426,Miscelaneas,-0.00576501339673996,0.3492469787597656,"{""type"":""Point"",""coordinates"":[-58.474944750000006,-34.560625140000006]}"
734,02014,2,13/6/2015,Comuna 14,Capital Federal,85-85,2.68,24,otoño,2015-06-08,"[2015-06-08, 2015-06-09, 2015-06-10, 2015-06-11, 2015-06-12, 2015-06-13, 2015-06-14]",true,734,-34.57389998,-58.42243645,5.28,"[0, 4.3, 0, 0, 0, 0, 0.1]",1.5527009963989258E-4,286.4534225463867,Miscelaneas,-0.0015108566731214523,0.31652386983235675,"{""type"":""Point"",""coordinates"":[-58.42243645,-34.57389997999999]}"
735,02002,2,26/10/1999,Comuna 2,Capital Federal,85-85,1.52,30,primavera,1999-10-25,"[1999-10-25, 1999-10-26, 1999-10-27, 1999-10-28, 1999-10-29, 1999-10-30, 1999-10-31]",true,735,-34.58587601,-58.39499618,1.85,"[0, 0, 0, 1, 7.9, 1.9, 0]",5.234181880950928E-4,293.04406038920087,Miscelaneas,-0.002667957916855812,0.19693883260091147,"{""type"":""Point"",""coordinates"":[-58.39499618,-34.58587601000001]}"
736,06778,6,9/2/1992,San Vicente,Buenos Aires,33486-6512,23.66,24,verano,1992-02-03,"[1992-02-03, 1992-02-04, 1992-02-05, 1992-02-06, 1992-02-07, 1992-02-08, 1992-02-09]",false,736,-35.18311,-58.45241002,2.17,"[0.1, 0, 0, 0, 0, 0, 19.8]",7.484853267669678E-5,296.81442642211914,Molisoles,-0.004096329212188721,0.3796240488688151,"{""type"":""Point"",""coordinates"":[-58.45241002,-35.18311]}"
737,02013,2,20/9/2002,Comuna 13,Capital Federal,54-54,3.99,10,invierno,2002-09-16,"[2002-09-16, 2002-09-17, 2002-09-18, 2002-09-19, 2002-09-20, 2002-09-21, 2002-09-22]",true,737,-34.55488152,-58.4502891,3.85,"[2.5, 4.4, 29.6, 11.5, 0, 0, 0.5]",7.43865966796875E-4,285.8984018961589,Miscelaneas,-0.001980528235435486,0.36214256286621094,"{""type"":""Point"",""coordinates"":[-58.4502891,-34.55488152]}"
738,38042,38,21/5/1995,Palpala,Jujuy,32929-6365,32.49,1247,otoño,1995-05-15,"[1995-05-15, 1995-05-16, 1995-05-17, 1995-05-18, 1995-05-19, 1995-05-20, 1995-05-21]",false,738,-24.18229866,-65.20774078,13.98,"[14.7, 0.1, 11, 6.7, 5.8, 0.3, 0]",0.0030641257762908936,285.70791880289715,Inceptisoles,-0.0016884095966815948,0.4631156921386719,"{""type"":""Point"",""coordinates"":[-65.20774078,-24.18229866]}"
739,38021,38,6/8/2005,Capital,Jujuy,33913-6597,37.78,3875,invierno,2005-08-01,"[2005-08-01, 2005-08-02, 2005-08-03, 2005-08-04, 2005-08-05, 2005-08-06, 2005-08-07]",false,739,-24.02938843,-65.64742279,17.2,"[0, 0, 0, 0, 0, 0, 0]",7.252693176269531E-4,281.43432807922363,Roca,-0.0016805408522486687,0.3014062245686849,"{""type"":""Point"",""coordinates"":[-65.64742279,-24.02938843]}"
740,38035,38,20/4/2000,Ledesma,Jujuy,33117-6463,14.96,383,otoño,2000-04-17,"[2000-04-17, 2000-04-18, 2000-04-19, 2000-04-20, 2000-04-21, 2000-04-22, 2000-04-23]",true,740,-23.88497353,-64.67390442,0.93,"[3.9, 0.1, 0, 0.1, 2.3, 2.2, 0]",0.003251001238822937,291.4064070383708,Roca,-0.0020983675494790077,0.470944086710612,"{""type"":""Point"",""coordinates"":[-64.67390442,-23.884973529999996]}"
741,46007,46,9/9/1995,Arauco,La Rioja,33392-6628,11.53,729,invierno,1995-09-04,"[1995-09-04, 1995-09-05, 1995-09-06, 1995-09-07, 1995-09-08, 1995-09-09, 1995-09-10]",true,741,-28.39283371,-66.56823731,1.4,"[0, 0, 0, 0, 0, 0, 0]",0.0,293.1549243927002,Roca,-3.17692756652832E-5,0.06861114501953125,"{""type"":""Point"",""coordinates"":[-66.56823731,-28.392833709999998]}"
742,82063,82,3/4/2007,La Capital,Santa Fe,103-103,23.73,25,otoño,2007-04-02,"[2007-04-02, 2007-04-03, 2007-04-04, 2007-04-05, 2007-04-06, 2007-04-07, 2007-04-08]",false,742,-31.18858147,-60.62677383,2.15,"[0, 0, 6.2, 4.2, 39.8, 1, 0]",1.0788440704345703E-5,294.6503162384033,Molisoles,-0.002301339991390705,0.4577484130859375,"{""type"":""Point"",""coordinates"":[-60.62677383,-31.18858147]}"
743,14098,14,23/8/1994,Rio Cuarto,Cordoba,34345-6361,23.14,514,invierno,1994-08-22,"[1994-08-22, 1994-08-23, 1994-08-24, 1994-08-25, 1994-08-26, 1994-08-27, 1994-08-28]",false,743,-32.64751095,-64.22141859,2.88,"[0, 0, 0, 0, 0, 0, 0]",2.6971101760864258E-6,285.221778233846,Complejo indiferenci,-7.974617183208466E-4,0.22305806477864584,"{""type"":""Point"",""coordinates"":[-64.22141859,-32.64751095]}"
744,14014,14,24/7/2015,Capital,Cordoba,37574-7384,24.04,426,invierno,2015-07-20,"[2015-07-20, 2015-07-21, 2015-07-22, 2015-07-23, 2015-07-24, 2015-07-25, 2015-07-26]",false,744,-31.47878838,-64.14509583,2.86,"[0.1, 0, 0, 0, 0, 0, 0]",4.26173210144043E-6,282.9225076039632,Miscelaneas,-9.198114275932312E-4,0.23035748799641928,"{""type"":""Point"",""coordinates"":[-64.14509583,-31.478788380000008]}"
745,06357,6,10/11/2007,General Pueyrredon,Buenos Aires,3347-1742,17.47,21,primavera,2007-11-05,"[2007-11-05, 2007-11-06, 2007-11-07, 2007-11-08, 2007-11-09, 2007-11-10, 2007-11-11]",false,745,-37.80766254,-57.62989086,5.55,"[1.1, 0, 10.7, 0, 26, 2.6, 1]",1.3247132301330566E-5,286.9913908640544,Molisoles,-0.003298281691968441,0.3380718231201172,"{""type"":""Point"",""coordinates"":[-57.62989086,-37.80766254000001]}"
746,70021,70,23/6/2004,Calingasta,San Juan,32645-6429,1.14,1345,invierno,2004-06-21,"[2004-06-21, 2004-06-22, 2004-06-23, 2004-06-24, 2004-06-25, 2004-06-26, 2004-06-27]",true,746,-31.30289373,-69.41260371,3.52,"[0, 0, 0, 0, 0, 0, 0]",2.3543834686279297E-6,279.47363154093426,Roca,-8.680634200572968E-4,0.3890158335367839,"{""type"":""Point"",""coordinates"":[-69.41260371,-31.30289373]}"
747,66056,66,27/2/2001,General Jose de San Martin,Salta,6934-2187,25.44,797,verano,2001-02-26,"[2001-02-26, 2001-02-27, 2001-02-28, 2001-03-01, 2001-03-02, 2001-03-03, 2001-03-04]",false,747,-22.16459982,-63.9088426,0.93,"[15.4, 8.6, 0.4, 0.1, 0.6, 0.3, 0.1]",0.002375990152359009,294.5335439046224,Molisoles,-0.003505457192659378,0.46243731180826825,"{""type"":""Point"",""coordinates"":[-63.90884259999999,-22.16459982]}"
748,02012,2,26/1/2004,Comuna 12,Capital Federal,54-54,3.13,20,verano,2004-01-26,"[2004-01-26, 2004-01-27, 2004-01-28, 2004-01-29, 2004-01-30, 2004-01-31, 2004-02-01]",true,748,-34.56062514,-58.47494475,0.93,"[0, 0, 0, 0, 0.9, 36.8, 3]",3.7047266960144043E-4,300.8332748413086,Miscelaneas,-0.0034775510430336,0.19023895263671875,"{""type"":""Point"",""coordinates"":[-58.474944750000006,-34.560625140000006]}"
749,02008,2,25/2/1990,Comuna 8,Capital Federal,36837-7237,7.49,21,verano,1990-02-19,"[1990-02-19, 1990-02-20, 1990-02-21, 1990-02-22, 1990-02-23, 1990-02-24, 1990-02-25]",true,749,-34.67499358,-58.47616299,1.13,"[0, 0.1, 0, 1.6, 6.6, 23.9, 8.7]",1.6933679580688477E-4,293.74095153808594,Miscelaneas,-0.0048361727967858315,0.4311358133951823,"{""type"":""Point"",""coordinates"":[-58.47616299,-34.67499358]}"
750,02004,2,27/3/2003,Comuna 4,Capital Federal,8891-2706,2.09,10,otoño,2003-03-24,"[2003-03-24, 2003-03-25, 2003-03-26, 2003-03-27, 2003-03-28, 2003-03-29, 2003-03-30]",true,750,-34.64641355,-58.38427103,1.46,"[0, 0, 0, 0, 17.7, 35, 0]",3.6616623401641846E-4,293.3598378499349,Miscelaneas,-0.0021460121497511864,0.20665423075358072,"{""type"":""Point"",""coordinates"":[-58.384271029999994,-34.64641355]}"
751,06658,6,17/2/1993,Quilmes,Buenos Aires,35407-6950,4.25,3,verano,1993-02-15,"[1993-02-15, 1993-02-16, 1993-02-17, 1993-02-18, 1993-02-19, 1993-02-20, 1993-02-21]",true,751,-34.70037841,-58.27664278,2.17,"[0, 0, 0.4, 5.8, 0.7, 8.1, 0]",,,Miscelaneas,,,"{""type"":""Point"",""coordinates"":[-58.276642779999996,-34.70037841]}"
752,06497,6,9/1/1998,Lujan,Buenos Aires,7-7,7.25,39,verano,1998-01-05,"[1998-01-05, 1998-01-06, 1998-01-07, 1998-01-08, 1998-01-09, 1998-01-10, 1998-01-11]",true,752,-34.4619848,-59.1744878,0.93,"[19.7, 0.2, 0, 0, 0, 0.1, 0.3]",0.0017613470554351807,297.3274434407552,Complejo indiferenci,-0.0027877073734998703,0.4692516326904297,"{""type"":""Point"",""coordinates"":[-59.1744878,-34.4619848]}"
753,06490,6,24/8/2002,Lomas de Zamora,Buenos Aires,35405-6949,5.53,9,invierno,2002-08-19,"[2002-08-19, 2002-08-20, 2002-08-21, 2002-08-22, 2002-08-23, 2002-08-24, 2002-08-25]",true,753,-34.73790272,-58.44067537,3,"[19.1, 0, 0, 0, 0.3, 0, 0]",0.01083347201347351,289.4381987253825,Miscelaneas,-0.0016169920563697815,0.4611053466796875,"{""type"":""Point"",""coordinates"":[-58.44067537000001,-34.73790272]}"
754,06441,6,18/12/1995,La Plata,Buenos Aires,3314-1708,23.31,26,primavera,1995-12-18,"[1995-12-18, 1995-12-19, 1995-12-20, 1995-12-21, 1995-12-22, 1995-12-23, 1995-12-24]",false,754,-35.03880607,-58.05930616,0.93,"[0, 0, 0, 1.6, 27.8, 4.1, 0]",9.2238187789917E-6,304.22937965393066,Complejo indiferenci,-0.001727670431137085,0.25667063395182294,"{""type"":""Point"",""coordinates"":[-58.05930616,-35.03880607000001]}"
755,06427,6,16/6/2013,La Matanza,Buenos Aires,33486-6512,4.98,8,otoño,2013-06-10,"[2013-06-10, 2013-06-11, 2013-06-12, 2013-06-13, 2013-06-14, 2013-06-15, 2013-06-16]",true,755,-34.71417289,-58.50890438,7.28,"[0, 0, 0, 0, 0, 0, 2.8]",1.2442469596862793E-4,285.64705657958984,Molisoles,-7.53229483962059E-4,0.4091803232828776,"{""type"":""Point"",""coordinates"":[-58.50890437999999,-34.71417289000001]}"
756,06638,6,2/11/2005,Pilar,Buenos Aires,42-42,10.41,16,primavera,2005-10-31,"[2005-10-31, 2005-11-01, 2005-11-02, 2005-11-03, 2005-11-04, 2005-11-05, 2005-11-06]",true,756,-34.42200558,-58.95283788,1.46,"[0.1, 0, 0, 0, 12.3, 0, 0]",2.084672451019287E-5,286.2181854248047,Molisoles,-0.0033865738660097122,0.3665854136149089,"{""type"":""Point"",""coordinates"":[-58.95283788,-34.42200558]}"
757,06371,6,11/12/2000,General San Martin,Buenos Aires,36837-7237,8.51,8,primavera,2000-12-11,"[2000-12-11, 2000-12-12, 2000-12-13, 2000-12-14, 2000-12-15, 2000-12-16, 2000-12-17]",true,757,-34.56734338,-58.58431125,17.23,"[3.8, 0, 16.7, 1.2, 1.2, 0.3, 0]",3.003627061843872E-4,298.1270834604899,Miscelaneas,-0.004113676026463509,0.29703521728515625,"{""type"":""Point"",""coordinates"":[-58.58431125,-34.56734338]}"
758,06260,6,10/12/2005,Esteban Echeverria,Buenos Aires,33486-6512,6.94,23,primavera,2005-12-05,"[2005-12-05, 2005-12-06, 2005-12-07, 2005-12-08, 2005-12-09, 2005-12-10, 2005-12-11]",true,758,-34.88497914,-58.47780994,1.46,"[0, 0.1, 0, 1, 0.3, 0, 0]",3.6150217056274414E-5,292.80957412719727,Miscelaneas,-0.004283915273845196,0.3811206817626953,"{""type"":""Point"",""coordinates"":[-58.47780994,-34.884979140000006]}"
759,06252,6,23/6/2007,Escobar,Buenos Aires,42-42,1.31,4,otoño,2007-06-18,"[2007-06-18, 2007-06-19, 2007-06-20, 2007-06-21, 2007-06-22, 2007-06-23, 2007-06-24]",true,759,-34.3007971,-58.7215474,2.24,"[0, 0, 24.7, 0, 0.9, 0, 0]",3.097951412200928E-5,278.4633280436198,Molisoles,-0.0011217305436730385,0.4795538584391276,"{""type"":""Point"",""coordinates"":[-58.7215474,-34.3007971]}"
760,06098,6,2/4/2005,Berisso,Buenos Aires,3314-1708,0.7,7,otoño,2005-03-28,"[2005-03-28, 2005-03-29, 2005-03-30, 2005-03-31, 2005-04-01, 2005-04-02, 2005-04-03]",true,760,-34.84587606,-57.87973336,3.58,"[7.2, 18.8, 0.2, 0.5, 0, 0, 0]",,,Miscelaneas,,,"{""type"":""Point"",""coordinates"":[-57.87973336,-34.84587606]}"
761,06035,6,14/4/1996,Avellaneda,Buenos Aires,35411-6952,1.59,6,otoño,1996-04-08,"[1996-04-08, 1996-04-09, 1996-04-10, 1996-04-11, 1996-04-12, 1996-04-13, 1996-04-14]",true,761,-34.67500565,-58.31056343,3.38,"[0, 34.4, 0, 0, 0.7, 2.6, 38.7]",,,Miscelaneas,,,"{""type"":""Point"",""coordinates"":[-58.31056343,-34.675005649999996]}"
762,02013,2,2/5/1999,Comuna 13,Capital Federal,54-54,3.99,10,otoño,1999-04-26,"[1999-04-26, 1999-04-27, 1999-04-28, 1999-04-29, 1999-04-30, 1999-05-01, 1999-05-02]",true,762,-34.55488152,-58.4502891,3.85,"[15.5, 1.1, 2.2, 0, 0, 0, 12]",3.8954615592956543E-4,289.7427285512288,Miscelaneas,-0.0022753989323973656,0.3518759409586589,"{""type"":""Point"",""coordinates"":[-58.4502891,-34.55488152]}"
763,10084,10,2/4/2000,Poman,Catamarca,33392-6628,13.77,730,otoño,2000-03-27,"[2000-03-27, 2000-03-28, 2000-03-29, 2000-03-30, 2000-03-31, 2000-04-01, 2000-04-02]",true,763,-28.33781745,-66.54987231,1.05,"[0, 0, 0, 0, 0.1, 7.6, 0]",1.1473894119262695E-6,291.84357198079425,Entisoles,-3.344770520925522E-4,0.0753161112467448,"{""type"":""Point"",""coordinates"":[-66.54987231,-28.33781745]}"
764,66133,66,23/3/1991,Rivadavia,Salta,6362-1978,14.31,246,verano,1991-03-18,"[1991-03-18, 1991-03-19, 1991-03-20, 1991-03-21, 1991-03-22, 1991-03-23, 1991-03-24]",true,764,-22.49881,-62.40759,1,"[0, 0.6, 77.8, 21.1, 1.7, 0.2, 0.4]",7.301568984985352E-7,299.6692587534587,Molisoles,-0.004178057424724102,0.3358084360758464,"{""type"":""Point"",""coordinates"":[-62.40759,-22.498810000000002]}"
765,66056,66,24/8/2015,General Jose de San Martin,Salta,6934-2187,25.44,797,invierno,2015-08-24,"[2015-08-24, 2015-08-25, 2015-08-26, 2015-08-27, 2015-08-28, 2015-08-29, 2015-08-30]",false,765,-22.16459982,-63.9088426,0.93,"[0, 0, 0, 0, 0, 0, 0]",2.599060535430908E-4,287.8254623413086,Molisoles,-0.00194481760263443,0.4534689585367839,"{""type"":""Point"",""coordinates"":[-63.90884259999999,-22.16459982]}"
766,34014,34,2/11/2009,Formosa,Formosa,34001-6658,9.62,61,primavera,2009-11-02,"[2009-11-02, 2009-11-03, 2009-11-04, 2009-11-05, 2009-11-06, 2009-11-07, 2009-11-08]",true,766,-25.73826408,-57.92005921,3.22,"[0, 0, 0, 0.5, 6.9, 35.1, 2]",4.4405460357666016E-6,303.58372179667157,Rio,-0.0065382979810237885,0.21330833435058594,"{""type"":""Point"",""coordinates"":[-57.920059210000005,-25.73826408]}"
767,14028,14,1/7/2009,Cruz del Eje,Cordoba,9461-2776,35.72,750,invierno,2009-06-29,"[2009-06-29, 2009-06-30, 2009-07-01, 2009-07-02, 2009-07-03, 2009-07-04, 2009-07-05]",false,767,-31.0893001,-65.0484771,4.7,"[0, 0, 0, 0, 0, 0, 0]",3.2573938369750977E-5,286.06491470336914,Salinas,-8.761603385210037E-4,0.24552090962727866,"{""type"":""Point"",""coordinates"":[-65.0484771,-31.089300099999996]}"
768,14014,14,25/12/1995,Capital,Cordoba,37574-7384,24.04,426,verano,1995-12-25,"[1995-12-25, 1995-12-26, 1995-12-27, 1995-12-28, 1995-12-29, 1995-12-30, 1995-12-31]",false,768,-31.47878838,-64.14509583,2.86,"[0.5, 0, 0, 0, 0, 0, 0]",1.6510486602783203E-5,297.68986320495605,Miscelaneas,-0.0032959766685962677,0.27334849039713544,"{""type"":""Point"",""coordinates"":[-64.14509583,-31.478788380000008]}"
769,90077,90,4/5/2004,Rio Chico,Tucuman,6896-2166,16.62,376,otoño,2004-05-03,"[2004-05-03, 2004-05-04, 2004-05-05, 2004-05-06, 2004-05-07, 2004-05-08, 2004-05-09]",false,769,-27.4543092,-65.603622,9.42,"[1.9, 1.8, 0, 0, 0, 0, 0]",0.002498313784599304,287.7321033477783,Roca,-7.88702629506588E-4,0.39768346150716144,"{""type"":""Point"",""coordinates"":[-65.603622,-27.4543092]}"
770,06427,6,25/3/1990,La Matanza,Buenos Aires,33486-6512,4.98,8,verano,1990-03-19,"[1990-03-19, 1990-03-20, 1990-03-21, 1990-03-22, 1990-03-23, 1990-03-24, 1990-03-25]",true,770,-34.71417289,-58.50890438,7.28,"[0, 0, 0, 0, 13.5, 0.4, 1.1]",2.2238492965698242E-4,291.9392897288005,Molisoles,-0.002935415133833885,0.35625267028808594,"{""type"":""Point"",""coordinates"":[-58.50890437999999,-34.71417289000001]}"
771,06658,6,2/6/1992,Quilmes,Buenos Aires,35407-6950,4.25,3,otoño,1992-06-01,"[1992-06-01, 1992-06-02, 1992-06-03, 1992-06-04, 1992-06-05, 1992-06-06, 1992-06-07]",true,771,-34.70037841,-58.27664278,2.17,"[0, 0, 0, 0.4, 3.2, 0, 5.6]",,,Miscelaneas,,,"{""type"":""Point"",""coordinates"":[-58.276642779999996,-34.70037841]}"
772,06357,6,12/1/1996,General Pueyrredon,Buenos Aires,3347-1742,17.47,21,verano,1996-01-08,"[1996-01-08, 1996-01-09, 1996-01-10, 1996-01-11, 1996-01-12, 1996-01-13, 1996-01-14]",false,772,-37.80766254,-57.62989086,5.55,"[22.9, 0, 1.3, 18.5, 2.8, 0.4, 0]",1.7400085926055908E-4,293.43384679158527,Molisoles,-0.002277625724673271,0.41376177469889325,"{""type"":""Point"",""coordinates"":[-57.62989086,-37.80766254000001]}"
773,30063,30,9/3/2002,Islas del Ibicuy,Entre Rios,25459-1836,8.14,3,verano,2002-03-04,"[2002-03-04, 2002-03-05, 2002-03-06, 2002-03-07, 2002-03-08, 2002-03-09, 2002-03-10]",true,773,-33.7787707,-58.54070986,2.16,"[17.6, 0.5, 0.3, 4.4, 0.3, 14.3, 36.1]",0.001150861382484436,299.04065259297687,Entisoles,-0.0024007102474570274,0.49920082092285156,"{""type"":""Point"",""coordinates"":[-58.54070986000001,-33.7787707]}"
774,82077,82,11/3/1995,9 de Julio,Santa Fe,105-105,10.52,84,verano,1995-03-06,"[1995-03-06, 1995-03-07, 1995-03-08, 1995-03-09, 1995-03-10, 1995-03-11, 1995-03-12]",true,774,-29.0758472,-61.73625069,5.09,"[5.8, 32.8, 0, 0, 0, 0, 0]",8.244812488555908E-5,298.13039843241376,Molisoles,-0.0030804695561528206,0.4688568115234375,"{""type"":""Point"",""coordinates"":[-61.73625069,-29.07584719999999]}"
775,82035,82,27/4/2002,Garay,Santa Fe,33531-6669,2.91,23,otoño,2002-04-22,"[2002-04-22, 2002-04-23, 2002-04-24, 2002-04-25, 2002-04-26, 2002-04-27, 2002-04-28]",true,775,-31.1523125,-60.1365521,2.36,"[17, 4.1, 0.2, 0, 0.2, 0, 5.8]",0.005920007824897766,287.9506301879883,Molisoles,-0.0018297014757990837,0.394528071085612,"{""type"":""Point"",""coordinates"":[-60.1365521,-31.152312499999997]}"
776,82007,82,12/12/2000,Belgrano,Santa Fe,6317-1960,30.84,118,primavera,2000-12-11,"[2000-12-11, 2000-12-12, 2000-12-13, 2000-12-14, 2000-12-15, 2000-12-16, 2000-12-17]",false,776,-32.7494032,-61.5381149,2.39,"[0.5, 0, 17.1, 14.3, 0.7, 0, 0]",4.2743980884552E-4,298.77169609069824,Molisoles,-0.0029916325584053993,0.2930291493733724,"{""type"":""Point"",""coordinates"":[-61.53811489999999,-32.7494032]}"
777,50063,50,8/9/1993,Lujan de Cuyo,Mendoza,6840-2183,38.57,951,invierno,1993-09-06,"[1993-09-06, 1993-09-07, 1993-09-08, 1993-09-09, 1993-09-10, 1993-09-11, 1993-09-12]",false,777,-33.32638993,-68.92342084,1.45,"[15.8, 0.4, 0, 0, 0, 0, 0]",4.295855760574341E-4,281.7085825602214,Roca,-0.0011707209050655365,0.19970385233561197,"{""type"":""Point"",""coordinates"":[-68.92342084,-33.32638993]}"
778,14140,14,12/9/2003,San Justo,Cordoba,6955-2119,12.54,107,invierno,2003-09-08,"[2003-09-08, 2003-09-09, 2003-09-10, 2003-09-11, 2003-09-12, 2003-09-13, 2003-09-14]",true,778,-31.23400374,-62.74066613,1.08,"[0, 0, 0, 0, 0, 0, 0]",1.1178851127624512E-4,286.7146053314209,Alfisoles,-0.0029525384306907654,0.31725502014160156,"{""type"":""Point"",""coordinates"":[-62.74066613,-31.234003740000002]}"
779,02008,2,25/4/1993,Comuna 8,Capital Federal,36837-7237,7.49,21,otoño,1993-04-19,"[1993-04-19, 1993-04-20, 1993-04-21, 1993-04-22, 1993-04-23, 1993-04-24, 1993-04-25]",true,779,-34.67499358,-58.47616299,1.13,"[38.4, 29.4, 0, 0, 0, 0, 0]",0.005452454090118408,294.3392086029053,Miscelaneas,-2.7094967663288116E-4,0.4868640899658203,"{""type"":""Point"",""coordinates"":[-58.47616299,-34.67499358]}"
780,02012,2,7/4/2005,Comuna 12,Capital Federal,54-54,3.13,20,otoño,2005-04-04,"[2005-04-04, 2005-04-05, 2005-04-06, 2005-04-07, 2005-04-08, 2005-04-09, 2005-04-10]",true,780,-34.56062514,-58.47494475,0.93,"[0, 0, 0, 41.4, 0, 0.4, 15.3]",3.598034381866455E-4,288.59321149190265,Miscelaneas,-0.002604123204946518,0.2956727345784505,"{""type"":""Point"",""coordinates"":[-58.474944750000006,-34.560625140000006]}"
781,02014,2,1/8/2015,Comuna 14,Capital Federal,85-85,2.68,24,invierno,2015-07-27,"[2015-07-27, 2015-07-28, 2015-07-29, 2015-07-30, 2015-07-31, 2015-08-01, 2015-08-02]",true,781,-34.57389998,-58.42243645,5.28,"[0, 0.9, 1, 14.8, 27.6, 0, 0.1]",1.1804699897766113E-4,288.41260147094727,Miscelaneas,-9.60388220846653E-4,0.2263361612955729,"{""type"":""Point"",""coordinates"":[-58.42243645,-34.57389997999999]}"
782,06763,6,16/5/1997,San Nicolas,Buenos Aires,6776-2114,14.58,50,otoño,1997-05-12,"[1997-05-12, 1997-05-13, 1997-05-14, 1997-05-15, 1997-05-16, 1997-05-17, 1997-05-18]",true,782,-33.6042287,-60.4178226,1.45,"[0, 0, 0, 0, 0, 0.1, 10.8]",7.003545761108398E-7,294.5129795074463,Molisoles,-4.452168941497803E-4,0.24614969889322916,"{""type"":""Point"",""coordinates"":[-60.417822599999994,-33.6042287]}"
783,06665,6,12/3/2009,Ramallo,Buenos Aires,3325-1719,9.81,37,verano,2009-03-09,"[2009-03-09, 2009-03-10, 2009-03-11, 2009-03-12, 2009-03-13, 2009-03-14, 2009-03-15]",true,783,-33.6241496,-60.0461017,3.82,"[0.2, 1, 6.1, 0.3, 0, 0, 0]",6.0498714447021484E-6,294.51527468363446,Rio,-0.003364056348800659,0.4305400848388672,"{""type"":""Point"",""coordinates"":[-60.04610170000001,-33.6241496]}"
784,06427,6,16/9/1999,La Matanza,Buenos Aires,33486-6512,4.98,8,invierno,1999-09-13,"[1999-09-13, 1999-09-14, 1999-09-15, 1999-09-16, 1999-09-17, 1999-09-18, 1999-09-19]",true,784,-34.71417289,-58.50890438,7.28,"[11.6, 0, 0, 0, 0, 0, 0]",5.525499582290649E-4,288.7134011586507,Molisoles,-0.001994747668504715,0.452328364054362,"{""type"":""Point"",""coordinates"":[-58.50890437999999,-34.71417289000001]}"
785,06371,6,7/1/2015,General San Martin,Buenos Aires,36837-7237,8.51,8,verano,2015-01-05,"[2015-01-05, 2015-01-06, 2015-01-07, 2015-01-08, 2015-01-09, 2015-01-10, 2015-01-11]",true,785,-34.56734338,-58.58431125,17.23,"[0, 2.9, 1.3, 0, 8.7, 0, 0.1]",1.3139843940734863E-4,297.25671513875324,Miscelaneas,-0.005370497703552246,0.32305145263671875,"{""type"":""Point"",""coordinates"":[-58.58431125,-34.56734338]}"
786,06266,6,15/3/2004,Exaltacion de la Cruz,Buenos Aires,151-151,15.15,34,verano,2004-03-15,"[2004-03-15, 2004-03-16, 2004-03-17, 2004-03-18, 2004-03-19, 2004-03-20, 2004-03-21]",false,786,-34.2240131,-59.232576,1.46,"[0, 0, 0.2, 1.3, 1.5, 0, 0]",3.956258296966553E-5,295.4790496826172,Molisoles,-0.0010194983333349228,0.28017552693684894,"{""type"":""Point"",""coordinates"":[-59.232576,-34.2240131]}"
787,06252,6,23/12/2009,Escobar,Buenos Aires,42-42,1.31,4,verano,2009-12-21,"[2009-12-21, 2009-12-22, 2009-12-23, 2009-12-24, 2009-12-25, 2009-12-26, 2009-12-27]",true,787,-34.3007971,-58.7215474,2.24,"[0, 1.2, 33.2, 29.5, 1.1, 19.9, 0]",5.811452865600586E-7,294.8332513173421,Molisoles,-0.0039630187675356865,0.4760519663492839,"{""type"":""Point"",""coordinates"":[-58.7215474,-34.3007971]}"
788,06070,6,3/11/2014,Baradero,Buenos Aires,39-39,5.39,33,primavera,2014-11-03,"[2014-11-03, 2014-11-04, 2014-11-05, 2014-11-06, 2014-11-07, 2014-11-08, 2014-11-09]",true,788,-33.8417492,-59.4518203,4.55,"[26.2, 0, 0, 0, 0, 0, 0.7]",0.007147625088691711,288.51351102193195,Rio,-0.001497739925980568,0.5414594014485677,"{""type"":""Point"",""coordinates"":[-59.45182030000001,-33.8417492]}"
789,06490,6,4/11/2013,Lomas de Zamora,Buenos Aires,35405-6949,5.53,9,primavera,2013-11-04,"[2013-11-04, 2013-11-05, 2013-11-06, 2013-11-07, 2013-11-08, 2013-11-09, 2013-11-10]",true,789,-34.73790272,-58.44067537,3,"[0, 0, 0, 14.1, 15.1, 0.8, 5.3]",9.213387966156006E-5,289.2337703704834,Miscelaneas,-0.004316456615924835,0.41118748982747394,"{""type"":""Point"",""coordinates"":[-58.44067537000001,-34.73790272]}"
790,06427,6,23/3/2006,La Matanza,Buenos Aires,33486-6512,4.98,8,verano,2006-03-20,"[2006-03-20, 2006-03-21, 2006-03-22, 2006-03-23, 2006-03-24, 2006-03-25, 2006-03-26]",true,790,-34.71417289,-58.50890438,7.28,"[0, 0, 0, 0.8, 1.5, 0, 0.4]",1.3329088687896729E-4,292.78611946105957,Molisoles,-0.00327388197183609,0.4210338592529297,"{""type"":""Point"",""coordinates"":[-58.50890437999999,-34.71417289000001]}"
791,06427,6,14/8/1998,La Matanza,Buenos Aires,33486-6512,4.98,8,invierno,1998-08-10,"[1998-08-10, 1998-08-11, 1998-08-12, 1998-08-13, 1998-08-14, 1998-08-15, 1998-08-16]",true,791,-34.71417289,-58.50890438,7.28,"[5.2, 0, 0, 0, 0, 0, 0]",6.502419710159302E-4,285.85986773173016,Molisoles,-7.355371490120888E-4,0.4108409881591797,"{""type"":""Point"",""coordinates"":[-58.50890437999999,-34.71417289000001]}"
792,06427,6,10/12/1990,La Matanza,Buenos Aires,33486-6512,4.98,8,primavera,1990-12-10,"[1990-12-10, 1990-12-11, 1990-12-12, 1990-12-13, 1990-12-14, 1990-12-15, 1990-12-16]",true,792,-34.71417289,-58.50890438,7.28,"[0, 0, 0, 0, 0, 0, 0]",2.569258213043213E-4,293.8352807362874,Molisoles,-0.004061900079250336,0.43526458740234375,"{""type"":""Point"",""coordinates"":[-58.50890437999999,-34.71417289000001]}"
793,82126,82,15/3/1991,San Martin,Santa Fe,36872-7253,53.42,73,verano,1991-03-11,"[1991-03-11, 1991-03-12, 1991-03-13, 1991-03-14, 1991-03-15, 1991-03-16, 1991-03-17]",false,793,-31.84254265,-61.56270981,1.43,"[0.8, 0.7, 0, 0, 0, 0, 0]",4.431605339050293E-5,295.57604598999023,Molisoles,-0.003520408645272255,0.4617322285970052,"{""type"":""Point"",""coordinates"":[-61.56270981,-31.84254265]}"
794,82105,82,19/5/1997,San Jeronimo,Santa Fe,123-123,29.33,42,otoño,1997-05-19,"[1997-05-19, 1997-05-20, 1997-05-21, 1997-05-22, 1997-05-23, 1997-05-24, 1997-05-25]",false,794,-32.2399352,-61.231266,4.95,"[10.6, 0.1, 16.6, 0, 0, 0, 0]",1.1141598224639893E-4,292.92431767781574,Molisoles,-0.001097165048122406,0.42446454366048175,"{""type"":""Point"",""coordinates"":[-61.231266,-32.2399352]}"
795,82105,82,15/11/1996,San Jeronimo,Santa Fe,123-123,29.33,42,primavera,1996-11-11,"[1996-11-11, 1996-11-12, 1996-11-13, 1996-11-14, 1996-11-15, 1996-11-16, 1996-11-17]",false,795,-32.2399352,-61.231266,4.95,"[0, 0, 0, 0, 6.3, 0, 0]",1.475214958190918E-6,292.36797459920246,Molisoles,-0.005349926650524139,0.4451211293538411,"{""type"":""Point"",""coordinates"":[-61.231266,-32.2399352]}"
796,82105,82,23/11/2011,San Jeronimo,Santa Fe,123-123,29.33,42,primavera,2011-11-21,"[2011-11-21, 2011-11-22, 2011-11-23, 2011-11-24, 2011-11-25, 2011-11-26, 2011-11-27]",false,796,-32.2399352,-61.231266,4.95,"[12.3, 0, 0, 0, 0, 0.7, 0.1]",0.0012015104293823242,293.90209197998047,Molisoles,-0.0038117999210953712,0.4589316050211589,"{""type"":""Point"",""coordinates"":[-61.231266,-32.2399352]}"
797,82105,82,26/9/1991,San Jeronimo,Santa Fe,123-123,29.33,42,primavera,1991-09-23,"[1991-09-23, 1991-09-24, 1991-09-25, 1991-09-26, 1991-09-27, 1991-09-28, 1991-09-29]",false,797,-32.2399352,-61.231266,4.95,"[0, 0, 0, 0, 1.3, 0, 0]",4.6640634536743164E-5,287.28112030029297,Molisoles,-0.003230215050280094,0.35946909586588544,"{""type"":""Point"",""coordinates"":[-61.231266,-32.2399352]}"
798,82084,82,18/4/2014,Rosario,Santa Fe,118-118,22.58,64,otoño,2014-04-14,"[2014-04-14, 2014-04-15, 2014-04-16, 2014-04-17, 2014-04-18, 2014-04-19, 2014-04-20]",false,798,-33.07901008,-60.91379957,1.11,"[0, 0, 0, 0.4, 0, 0, 0]",1.1771917343139648E-6,285.1197509765625,Alfisoles,-0.002318178303539753,0.3959801991780599,"{""type"":""Point"",""coordinates"":[-60.91379957,-33.07901008]}"
799,30091,30,25/5/2015,Tala,Entre Rios,6833-2205,17.37,52,otoño,2015-05-25,"[2015-05-25, 2015-05-26, 2015-05-27, 2015-05-28, 2015-05-29, 2015-05-30, 2015-05-31]",false,799,-31.99620378,-59.24649058,1.09,"[0, 0, 0, 0, 0, 0, 0]",9.775161743164062E-6,287.14233716328937,Molisoles,-0.0010284557938575745,0.4140504201253255,"{""type"":""Point"",""coordinates"":[-59.24649058,-31.99620378]}"
800,30077,30,22/8/2014,Nogoya,Entre Rios,116-116,25.52,78,invierno,2014-08-18,"[2014-08-18, 2014-08-19, 2014-08-20, 2014-08-21, 2014-08-22, 2014-08-23, 2014-08-24]",false,800,-32.17297901,-59.56341301,1.1,"[0, 0, 0, 0, 0, 0, 10.4]",6.705522537231445E-6,290.7876224517822,Alfisoles,-0.002108963206410408,0.35074106852213544,"{""type"":""Point"",""coordinates"":[-59.563413010000005,-32.172979010000006]}"
801,30063,30,17/8/2004,Islas del Ibicuy,Entre Rios,25459-1836,8.14,3,invierno,2004-08-16,"[2004-08-16, 2004-08-17, 2004-08-18, 2004-08-19, 2004-08-20, 2004-08-21, 2004-08-22]",true,801,-33.7787707,-58.54070986,2.16,"[30.4, 0.8, 0.5, 5.7, 2.6, 0, 0]",0.003570079803466797,290.0659122467041,Entisoles,-7.360102608799934E-4,0.5685145060221354,"{""type"":""Point"",""coordinates"":[-58.54070986000001,-33.7787707]}"
802,82091,82,21/12/2006,San Cristobal,Santa Fe,105-105,37.56,78,primavera,2006-12-18,"[2006-12-18, 2006-12-19, 2006-12-20, 2006-12-21, 2006-12-22, 2006-12-23, 2006-12-24]",false,802,-29.88749922,-61.57182768,1.85,"[9.8, 4.3, 24.1, 0, 0, 19.1, 5]",7.146447896957397E-4,298.3696543375651,Complejo indiferenci,-0.002680305391550064,0.4596563975016276,"{""type"":""Point"",""coordinates"":[-61.571827680000006,-29.88749922]}"
803,82084,82,14/6/1991,Rosario,Santa Fe,118-118,22.58,64,otoño,1991-06-10,"[1991-06-10, 1991-06-11, 1991-06-12, 1991-06-13, 1991-06-14, 1991-06-15, 1991-06-16]",false,803,-33.07901008,-60.91379957,1.11,"[0, 0, 0, 0, 0, 1.1, 0.6]",5.6743621826171875E-5,283.15860748291016,Alfisoles,-9.819157421588898E-4,0.43891143798828125,"{""type"":""Point"",""coordinates"":[-60.91379957,-33.07901008]}"
804,82063,82,1/10/2003,La Capital,Santa Fe,103-103,23.73,25,primavera,2003-09-29,"[2003-09-29, 2003-09-30, 2003-10-01, 2003-10-02, 2003-10-03, 2003-10-04, 2003-10-05]",false,804,-31.18858147,-60.62677383,2.15,"[0, 0, 0, 0, 8, 24.6, 0]",4.304051399230957E-4,286.6915060679118,Molisoles,-0.0034289229661226273,0.38181495666503906,"{""type"":""Point"",""coordinates"":[-60.62677383,-31.18858147]}"
805,82063,82,15/9/2013,La Capital,Santa Fe,103-103,23.73,25,invierno,2013-09-09,"[2013-09-09, 2013-09-10, 2013-09-11, 2013-09-12, 2013-09-13, 2013-09-14, 2013-09-15]",false,805,-31.18858147,-60.62677383,2.15,"[0, 0, 0, 0.4, 13.8, 4, 1.9]",6.854534149169922E-7,298.90639940897626,Molisoles,-0.0021067876368761063,0.27584203084309894,"{""type"":""Point"",""coordinates"":[-60.62677383,-31.18858147]}"
806,82063,82,10/10/2015,La Capital,Santa Fe,103-103,23.73,25,primavera,2015-10-05,"[2015-10-05, 2015-10-06, 2015-10-07, 2015-10-08, 2015-10-09, 2015-10-10, 2015-10-11]",false,806,-31.18858147,-60.62677383,2.15,"[0, 0, 2.6, 1, 0, 0, 0]",9.08970832824707E-7,291.33874829610187,Molisoles,-0.0036439020186662674,0.3889503479003906,"{""type"":""Point"",""coordinates"":[-60.62677383,-31.18858147]}"
807,82063,82,19/10/2003,La Capital,Santa Fe,103-103,23.73,25,primavera,2003-10-13,"[2003-10-13, 2003-10-14, 2003-10-15, 2003-10-16, 2003-10-17, 2003-10-18, 2003-10-19]",false,807,-31.18858147,-60.62677383,2.15,"[0, 0, 0, 0, 0, 0.2, 0]",3.5108625888824463E-4,289.17327880859375,Molisoles,-0.004297109320759773,0.40464528401692706,"{""type"":""Point"",""coordinates"":[-60.62677383,-31.18858147]}"
808,82021,82,17/2/2005,Castellanos,Santa Fe,36829-7232,43.75,69,verano,2005-02-14,"[2005-02-14, 2005-02-15, 2005-02-16, 2005-02-17, 2005-02-18, 2005-02-19, 2005-02-20]",false,808,-31.38184929,-61.37005997,1.09,"[0.1, 0.1, 19.2, 0.3, 0, 0, 0]",4.92483377456665E-6,297.5151723225911,Alfisoles,-0.004154788330197334,0.3683484395345052,"{""type"":""Point"",""coordinates"":[-61.37005997,-31.38184929000001]}"
809,82021,82,5/6/2006,Castellanos,Santa Fe,36829-7232,43.75,69,otoño,2006-06-05,"[2006-06-05, 2006-06-06, 2006-06-07, 2006-06-08, 2006-06-09, 2006-06-10, 2006-06-11]",false,809,-31.38184929,-61.37005997,1.09,"[0, 0, 0.5, 5.1, 10.5, 0, 0]",1.3113021850585938E-6,285.83801142374676,Alfisoles,-0.0011100471019744873,0.34363746643066406,"{""type"":""Point"",""coordinates"":[-61.37005997,-31.38184929000001]}"
810,30113,30,22/5/2005,Villaguay,Entre Rios,116-116,41.03,64,otoño,2005-05-16,"[2005-05-16, 2005-05-17, 2005-05-18, 2005-05-19, 2005-05-20, 2005-05-21, 2005-05-22]",false,810,-31.77167964,-59.57091449,0.93,"[0.1, 0.1, 0, 0.5, 1.2, 0, 0]",1.239180564880371E-4,285.82958984375,Vertisoles,-0.001573287881910801,0.4564291636149089,"{""type"":""Point"",""coordinates"":[-59.57091449000001,-31.77167964]}"
811,30056,30,16/8/1994,Gualeguaychu,Entre Rios,9550-2853,31.43,22,invierno,1994-08-15,"[1994-08-15, 1994-08-16, 1994-08-17, 1994-08-18, 1994-08-19, 1994-08-20, 1994-08-21]",false,811,-33.15450509,-58.98890113,0,"[0, 0, 0, 0, 0, 1.4, 2]",3.100186586380005E-4,281.73497263590497,Alfisoles,-0.0016573136672377586,0.42595863342285156,"{""type"":""Point"",""coordinates"":[-58.98890113000001,-33.15450509]}"
812,30035,30,25/5/2008,Federal,Entre Rios,36958-7272,25.83,66,otoño,2008-05-19,"[2008-05-19, 2008-05-20, 2008-05-21, 2008-05-22, 2008-05-23, 2008-05-24, 2008-05-25]",false,812,-30.97193714,-58.99327599,2.16,"[0, 0, 0, 0, 7.9, 0, 0]",4.351139068603516E-6,297.3612238566081,Vertisoles,-0.0011404920369386673,0.3208630879720052,"{""type"":""Point"",""coordinates"":[-58.99327599,-30.971937140000005]}"
813,14154,14,13/2/1993,Sobremonte,Cordoba,33116-6456,62.97,486,verano,1993-02-08,"[1993-02-08, 1993-02-09, 1993-02-10, 1993-02-11, 1993-02-12, 1993-02-13, 1993-02-14]",false,813,-29.61635494,-64.06243638,2.33,"[0, 0, 0, 0, 0.3, 2.7, 0]",5.598068237304688E-4,289.964687983195,Aridisoles,-0.0036709345877170563,0.2968457539876302,"{""type"":""Point"",""coordinates"":[-64.06243638,-29.616354940000004]}"
814,14140,14,10/4/2007,San Justo,Cordoba,6955-2119,12.54,107,otoño,2007-04-09,"[2007-04-09, 2007-04-10, 2007-04-11, 2007-04-12, 2007-04-13, 2007-04-14, 2007-04-15]",true,814,-31.23400374,-62.74066613,1.08,"[0, 0.5, 1.6, 0, 0, 0.6, 0.5]",1.9371509552001953E-6,291.7829170227051,Alfisoles,-0.0027744704857468605,0.3803539276123047,"{""type"":""Point"",""coordinates"":[-62.74066613,-31.234003740000002]}"
815,82119,82,16/12/2004,San Lorenzo,Santa Fe,3329-1723,0.93,27,primavera,2004-12-13,"[2004-12-13, 2004-12-14, 2004-12-15, 2004-12-16, 2004-12-17, 2004-12-18, 2004-12-19]",true,815,-32.69503021,-60.73096848,3.55,"[0, 0.4, 11.3, 0, 0, 0.4, 7.5]",7.092952728271484E-6,299.02178955078125,Alfisoles,-0.00555415078997612,0.3446858723958333,"{""type"":""Point"",""coordinates"":[-60.73096848,-32.69503021]}"
816,82119,82,22/6/2009,San Lorenzo,Santa Fe,3329-1723,0.93,27,invierno,2009-06-22,"[2009-06-22, 2009-06-23, 2009-06-24, 2009-06-25, 2009-06-26, 2009-06-27, 2009-06-28]",true,816,-32.69503021,-60.73096848,3.55,"[0, 0, 0, 0, 0, 0, 0.2]",8.046627044677734E-7,283.78280448913574,Alfisoles,-0.0011735670268535614,0.3616676330566406,"{""type"":""Point"",""coordinates"":[-60.73096848,-32.69503021]}"
817,82119,82,2/5/1997,San Lorenzo,Santa Fe,3329-1723,0.93,27,otoño,1997-04-28,"[1997-04-28, 1997-04-29, 1997-04-30, 1997-05-01, 1997-05-02, 1997-05-03, 1997-05-04]",true,817,-32.69503021,-60.73096848,3.55,"[0, 0, 0, 0, 0, 0, 0]",6.705522537231445E-7,288.6259231567383,Alfisoles,-0.002177515998482704,0.37559064229329425,"{""type"":""Point"",""coordinates"":[-60.73096848,-32.69503021]}"
818,82021,82,4/5/2012,Castellanos,Santa Fe,36829-7232,43.75,69,otoño,2012-04-30,"[2012-04-30, 2012-05-01, 2012-05-02, 2012-05-03, 2012-05-04, 2012-05-05, 2012-05-06]",false,818,-31.38184929,-61.37005997,1.09,"[0, 0, 0, 0, 0, 0, 0]",1.043081283569336E-7,284.7026430765788,Alfisoles,-0.0016177641227841377,0.36148516337076825,"{""type"":""Point"",""coordinates"":[-61.37005997,-31.38184929000001]}"
819,82014,82,12/8/2005,Caseros,Santa Fe,6726-2218,16.67,107,invierno,2005-08-08,"[2005-08-08, 2005-08-09, 2005-08-10, 2005-08-11, 2005-08-12, 2005-08-13, 2005-08-14]",false,819,-33.2334798,-61.682947,0,"[0, 0, 0, 0, 0, 0, 0]",1.9073486328125E-6,279.19980494181317,Alfisoles,-0.0013192305341362953,0.408908208211263,"{""type"":""Point"",""coordinates"":[-61.682947000000006,-33.23347979999999]}"
820,30084,30,16/5/2012,Parana,Entre Rios,110-110,12.53,81,otoño,2012-05-14,"[2012-05-14, 2012-05-15, 2012-05-16, 2012-05-17, 2012-05-18, 2012-05-19, 2012-05-20]",true,820,-31.88541285,-60.23444834,1.43,"[0, 0, 0, 0, 22.2, 0.1, 3.8]",1.3262033462524414E-6,287.1909014383952,Molisoles,-0.0014031734317541122,0.36070505777994794,"{""type"":""Point"",""coordinates"":[-60.23444834,-31.88541285]}"
821,82119,82,17/10/2007,San Lorenzo,Santa Fe,3329-1723,0.93,27,primavera,2007-10-15,"[2007-10-15, 2007-10-16, 2007-10-17, 2007-10-18, 2007-10-19, 2007-10-20, 2007-10-21]",true,821,-32.69503021,-60.73096848,3.55,"[0.5, 0, 0, 0, 0, 11.5, 0]",6.905198097229004E-5,290.112824122111,Alfisoles,-0.0034311693161726,0.5234082539876302,"{""type"":""Point"",""coordinates"":[-60.73096848,-32.69503021]}"
822,82119,82,8/2/2006,San Lorenzo,Santa Fe,3329-1723,0.93,27,verano,2006-02-06,"[2006-02-06, 2006-02-07, 2006-02-08, 2006-02-09, 2006-02-10, 2006-02-11, 2006-02-12]",true,822,-32.69503021,-60.73096848,3.55,"[0, 0, 0, 0, 0, 0, 0]",1.1771917343139648E-6,298.46801948547363,Alfisoles,-0.006516932509839535,0.46625328063964844,"{""type"":""Point"",""coordinates"":[-60.73096848,-32.69503021]}"
823,82105,82,21/5/2008,San Jeronimo,Santa Fe,123-123,29.33,42,otoño,2008-05-19,"[2008-05-19, 2008-05-20, 2008-05-21, 2008-05-22, 2008-05-23, 2008-05-24, 2008-05-25]",false,823,-32.2399352,-61.231266,4.95,"[0, 0, 0, 0, 1.4, 0, 0]",7.18235969543457E-6,296.9513117472331,Molisoles,-0.00138790812343359,0.30675379435221356,"{""type"":""Point"",""coordinates"":[-61.231266,-32.2399352]}"
824,82105,82,7/1/2006,San Jeronimo,Santa Fe,123-123,29.33,42,verano,2006-01-02,"[2006-01-02, 2006-01-03, 2006-01-04, 2006-01-05, 2006-01-06, 2006-01-07, 2006-01-08]",false,824,-32.2399352,-61.231266,4.95,"[0, 0, 0, 0, 0, 0, 0]",1.087784767150879E-6,301.32446416219074,Molisoles,-0.0014180820435285568,0.2443262736002604,"{""type"":""Point"",""coordinates"":[-61.231266,-32.2399352]}"
825,82084,82,27/2/2015,Rosario,Santa Fe,118-118,22.58,64,verano,2015-02-23,"[2015-02-23, 2015-02-24, 2015-02-25, 2015-02-26, 2015-02-27, 2015-02-28, 2015-03-01]",false,825,-33.07901008,-60.91379957,1.11,"[0, 0, 43.2, 0.8, 0, 5, 6.1]",1.341104507446289E-6,297.5168291727702,Alfisoles,-0.003748810850083828,0.3081804911295573,"{""type"":""Point"",""coordinates"":[-60.91379957,-33.07901008]}"
826,82084,82,5/11/1997,Rosario,Santa Fe,118-118,22.58,64,primavera,1997-11-03,"[1997-11-03, 1997-11-04, 1997-11-05, 1997-11-06, 1997-11-07, 1997-11-08, 1997-11-09]",false,826,-33.07901008,-60.91379957,1.11,"[0, 0.5, 1.6, 0.3, 0, 17, 0]",1.8775463104248047E-6,290.51155344645184,Alfisoles,-0.0024194959551095963,0.4560095469156901,"{""type"":""Point"",""coordinates"":[-60.91379957,-33.07901008]}"
827,82084,82,10/7/2005,Rosario,Santa Fe,118-118,22.58,64,invierno,2005-07-04,"[2005-07-04, 2005-07-05, 2005-07-06, 2005-07-07, 2005-07-08, 2005-07-09, 2005-07-10]",false,827,-33.07901008,-60.91379957,1.11,"[1.3, 0, 0, 0, 0, 0, 0]",2.421438694000244E-5,283.15083503723145,Alfisoles,-0.0011725742369890213,0.477847417195638,"{""type"":""Point"",""coordinates"":[-60.91379957,-33.07901008]}"
828,82084,82,21/5/2011,Rosario,Santa Fe,118-118,22.58,64,otoño,2011-05-16,"[2011-05-16, 2011-05-17, 2011-05-18, 2011-05-19, 2011-05-20, 2011-05-21, 2011-05-22]",false,828,-33.07901008,-60.91379957,1.11,"[0, 0, 0, 0, 0, 0, 0]",1.1920928955078125E-6,287.95634778340656,Alfisoles,-0.0010508792474865913,0.42431640625,"{""type"":""Point"",""coordinates"":[-60.91379957,-33.07901008]}"
829,82070,82,27/3/2009,Las Colonias,Santa Fe,6856-2113,19.32,40,otoño,2009-03-23,"[2009-03-23, 2009-03-24, 2009-03-25, 2009-03-26, 2009-03-27, 2009-03-28, 2009-03-29]",false,829,-31.6618986,-61.0112577,0,"[0, 0.1, 0, 0, 0, 0, 0]",1.341104507446289E-6,297.8352578481038,Molisoles,-0.0028872163966298103,0.2944189707438151,"{""type"":""Point"",""coordinates"":[-61.0112577,-31.6618986]}"
830,82070,82,21/12/2013,Las Colonias,Santa Fe,6856-2113,19.32,40,primavera,2013-12-16,"[2013-12-16, 2013-12-17, 2013-12-18, 2013-12-19, 2013-12-20, 2013-12-21, 2013-12-22]",false,830,-31.6618986,-61.0112577,0,"[0, 0, 0, 0, 0, 0, 0]",3.159046173095703E-6,301.8811683654785,Molisoles,-0.00614996999502182,0.3335126241048177,"{""type"":""Point"",""coordinates"":[-61.0112577,-31.6618986]}"
831,82070,82,25/3/2003,Las Colonias,Santa Fe,6856-2113,19.32,40,otoño,2003-03-24,"[2003-03-24, 2003-03-25, 2003-03-26, 2003-03-27, 2003-03-28, 2003-03-29, 2003-03-30]",false,831,-31.6618986,-61.0112577,0,"[0.6, 0, 0, 0, 0.8, 62, 9.8]",3.9643049240112305E-4,293.74842834472656,Molisoles,-0.0029377033933997154,0.39015769958496094,"{""type"":""Point"",""coordinates"":[-61.0112577,-31.6618986]}"
832,82063,82,22/6/1993,La Capital,Santa Fe,103-103,23.73,25,invierno,1993-06-21,"[1993-06-21, 1993-06-22, 1993-06-23, 1993-06-24, 1993-06-25, 1993-06-26, 1993-06-27]",false,832,-31.18858147,-60.62677383,2.15,"[0, 0, 0, 0, 0, 0, 0.2]",6.297528743743896E-4,285.5076160430908,Molisoles,-0.0011829622089862823,0.4312597910563151,"{""type"":""Point"",""coordinates"":[-60.62677383,-31.18858147]}"
833,82056,82,13/10/2000,Iriondo,Santa Fe,36996-7283,43.86,58,primavera,2000-10-09,"[2000-10-09, 2000-10-10, 2000-10-11, 2000-10-12, 2000-10-13, 2000-10-14, 2000-10-15]",false,833,-32.92903431,-61.26562377,1.44,"[18.5, 0, 0, 0.6, 3.8, 3.7, 25.4]",0.001803576946258545,291.1303475697835,Molisoles,-0.004912775009870529,0.44889259338378906,"{""type"":""Point"",""coordinates"":[-61.26562377,-32.92903431]}"
834,82056,82,19/7/2011,Iriondo,Santa Fe,36996-7283,43.86,58,invierno,2011-07-18,"[2011-07-18, 2011-07-19, 2011-07-20, 2011-07-21, 2011-07-22, 2011-07-23, 2011-07-24]",false,834,-32.92903431,-61.26562377,1.44,"[1.7, 0, 0, 0, 0, 0, 0]",2.238154411315918E-5,283.55030059814453,Molisoles,-9.478181600570679E-4,0.38927332560221356,"{""type"":""Point"",""coordinates"":[-61.26562377,-32.92903431]}"
835,82056,82,25/7/2011,Iriondo,Santa Fe,36996-7283,43.86,58,invierno,2011-07-25,"[2011-07-25, 2011-07-26, 2011-07-27, 2011-07-28, 2011-07-29, 2011-07-30, 2011-07-31]",false,835,-32.92903431,-61.26562377,1.44,"[16.3, 0, 0, 0, 0, 0, 0.4]",1.929253339767456E-4,290.9133243560791,Molisoles,-0.0013835672289133072,0.3835296630859375,"{""type"":""Point"",""coordinates"":[-61.26562377,-32.92903431]}"
836,82056,82,18/2/2007,Iriondo,Santa Fe,36996-7283,43.86,58,verano,2007-02-12,"[2007-02-12, 2007-02-13, 2007-02-14, 2007-02-15, 2007-02-16, 2007-02-17, 2007-02-18]",false,836,-32.92903431,-61.26562377,1.44,"[0, 0, 2, 4.8, 21, 10.6, 0]",2.5033950805664062E-6,295.7682622273763,Molisoles,-0.0031400173902511597,0.3085492451985677,"{""type"":""Point"",""coordinates"":[-61.26562377,-32.92903431]}"
837,82028,82,27/4/1999,Constitucion,Santa Fe,36996-7283,18.3,104,otoño,1999-04-26,"[1999-04-26, 1999-04-27, 1999-04-28, 1999-04-29, 1999-04-30, 1999-05-01, 1999-05-02]",false,837,-33.3790173,-61.3544315,1.85,"[18.3, 0, 0.5, 0, 0, 0, 2.6]",0.0020734816789627075,289.0105508168538,Alfisoles,-0.0013268440961837769,0.48338762919108075,"{""type"":""Point"",""coordinates"":[-61.354431500000004,-33.37901730000001]}"
838,30105,30,2/5/1996,Victoria,Entre Rios,37055-7301,21.48,5,otoño,1996-04-29,"[1996-04-29, 1996-04-30, 1996-05-01, 1996-05-02, 1996-05-03, 1996-05-04, 1996-05-05]",false,838,-32.957337,-60.049086,1.85,"[2.7, 0.6, 0.2, 0, 0, 0, 0]",4.458427429199219E-5,292.5346393585205,Molisoles,-0.0015796823427081108,0.583642323811849,"{""type"":""Point"",""coordinates"":[-60.049086,-32.957337]}"
839,30084,30,13/1/2000,Parana,Entre Rios,110-110,12.53,81,verano,2000-01-10,"[2000-01-10, 2000-01-11, 2000-01-12, 2000-01-13, 2000-01-14, 2000-01-15, 2000-01-16]",true,839,-31.88541285,-60.23444834,1.43,"[27.1, 0, 1.8, 0, 16, 0.5, 15.4]",0.0028342753648757935,299.6314818064372,Molisoles,-0.0032528676092624664,0.3234182993570964,"{""type"":""Point"",""coordinates"":[-60.23444834,-31.88541285]}"
840,30056,30,26/5/1991,Gualeguaychu,Entre Rios,9550-2853,31.43,22,otoño,1991-05-20,"[1991-05-20, 1991-05-21, 1991-05-22, 1991-05-23, 1991-05-24, 1991-05-25, 1991-05-26]",false,840,-33.15450509,-58.98890113,0,"[0.8, 44.7, 0, 0, 0, 0, 0.8]",5.003809928894043E-5,292.2405865987142,Alfisoles,-0.0011850129812955856,0.3807303110758464,"{""type"":""Point"",""coordinates"":[-58.98890113000001,-33.15450509]}"
841,30049,30,1/10/2009,Gualeguay,Entre Rios,39-39,13.76,2,primavera,2009-09-28,"[2009-09-28, 2009-09-29, 2009-09-30, 2009-10-01, 2009-10-02, 2009-10-03, 2009-10-04]",true,841,-33.55871824,-59.48052013,2.16,"[0, 0, 0, 0.1, 0, 0, 0]",1.5795230865478516E-6,282.17492485046387,Entisoles,-0.0028646960854530334,0.5587164560953776,"{""type"":""Point"",""coordinates"":[-59.48052013,-33.558718240000005]}"
842,30049,30,20/4/1991,Gualeguay,Entre Rios,39-39,13.76,2,otoño,1991-04-15,"[1991-04-15, 1991-04-16, 1991-04-17, 1991-04-18, 1991-04-19, 1991-04-20, 1991-04-21]",true,842,-33.55871824,-59.48052013,2.16,"[0.2, 31.8, 10.8, 0, 0, 0, 0]",8.800625801086426E-5,293.27858861287433,Entisoles,-4.4502224773168564E-4,0.5255839029947916,"{""type"":""Point"",""coordinates"":[-59.48052013,-33.558718240000005]}"
843,30021,30,14/3/2003,Diamante,Entre Rios,3331-1725,3.81,30,verano,2003-03-10,"[2003-03-10, 2003-03-11, 2003-03-12, 2003-03-13, 2003-03-14, 2003-03-15, 2003-03-16]",true,843,-32.01197804,-60.61726225,1.43,"[2.9, 2.8, 0, 0, 0.2, 1.2, 0]",4.6487152576446533E-4,297.1531041463216,Molisoles,-0.00284593366086483,0.47716840108235675,"{""type"":""Point"",""coordinates"":[-60.61726225,-32.01197804]}"
844,14175,14,28/12/2002,Tulumba,Cordoba,37559-7382,48.1,293,verano,2002-12-23,"[2002-12-23, 2002-12-24, 2002-12-25, 2002-12-26, 2002-12-27, 2002-12-28, 2002-12-29]",false,844,-29.9823914,-64.49000783,2.33,"[13.1, 0, 0, 0, 0, 5.8, 29.1]",7.230043411254883E-5,292.79692967732746,Salinas,-0.004902428016066551,0.3024559020996094,"{""type"":""Point"",""coordinates"":[-64.49000783000001,-29.982391400000004]}"
845,14021,14,6/4/2004,Colon,Cordoba,33948-6745,20.69,355,otoño,2004-04-05,"[2004-04-05, 2004-04-06, 2004-04-07, 2004-04-08, 2004-04-09, 2004-04-10, 2004-04-11]",false,845,-31.25624481,-63.95340394,0.93,"[0.2, 3.3, 6.6, 9.7, 12.6, 5.7, 0]",2.1710991859436035E-5,296.66125742594403,Miscelaneas,-0.0013113291934132576,0.3187859853108724,"{""type"":""Point"",""coordinates"":[-63.953403939999994,-31.256244809999995]}"
846,14014,14,17/10/1998,Capital,Cordoba,37574-7384,24.04,426,primavera,1998-10-12,"[1998-10-12, 1998-10-13, 1998-10-14, 1998-10-15, 1998-10-16, 1998-10-17, 1998-10-18]",false,846,-31.47878838,-64.14509583,2.86,"[0.6, 17.9, 0.2, 0, 0.2, 9.8, 0]",1.0070204734802246E-4,291.52501742045087,Miscelaneas,-0.00179331935942173,0.2870470682779948,"{""type"":""Point"",""coordinates"":[-64.14509583,-31.478788380000008]}"
847,30077,30,3/11/1992,Nogoya,Entre Rios,116-116,25.52,78,primavera,1992-11-02,"[1992-11-02, 1992-11-03, 1992-11-04, 1992-11-05, 1992-11-06, 1992-11-07, 1992-11-08]",false,847,-32.17297901,-59.56341301,1.1,"[20.1, 0.1, 0, 0, 0, 0, 0]",5.125850439071655E-4,289.3118591308594,Alfisoles,-0.0018019238486886024,0.3474432627360026,"{""type"":""Point"",""coordinates"":[-59.563413010000005,-32.172979010000006]}"
848,30084,30,19/6/2002,Parana,Entre Rios,110-110,12.53,81,otoño,2002-06-17,"[2002-06-17, 2002-06-18, 2002-06-19, 2002-06-20, 2002-06-21, 2002-06-22, 2002-06-23]",true,848,-31.88541285,-60.23444834,1.43,"[0, 0, 0, 0, 0, 0, 0]",9.455978870391846E-4,284.8119017283122,Molisoles,-6.536878645420074E-4,0.42476971944173175,"{""type"":""Point"",""coordinates"":[-60.23444834,-31.88541285]}"
849,30021,30,27/12/2011,Diamante,Entre Rios,3331-1725,3.81,30,verano,2011-12-26,"[2011-12-26, 2011-12-27, 2011-12-28, 2011-12-29, 2011-12-30, 2011-12-31, 2012-01-01]",true,849,-32.01197804,-60.61726225,1.43,"[0, 0, 0, 0, 0, 0, 0]",3.723800182342529E-5,296.2661883036296,Molisoles,-0.002225371077656746,0.2788530985514323,"{""type"":""Point"",""coordinates"":[-60.61726225,-32.01197804]}"
850,30113,30,3/7/1992,Villaguay,Entre Rios,116-116,41.03,64,invierno,1992-06-29,"[1992-06-29, 1992-06-30, 1992-07-01, 1992-07-02, 1992-07-03, 1992-07-04, 1992-07-05]",false,850,-31.77167964,-59.57091449,0.93,"[0, 0, 0, 0, 0, 0.2, 0]",3.2761693000793457E-4,281.0787715911865,Vertisoles,-0.0011672098189592361,0.4684747060139974,"{""type"":""Point"",""coordinates"":[-59.57091449000001,-31.77167964]}"
851,30105,30,15/3/2014,Victoria,Entre Rios,37055-7301,21.48,5,verano,2014-03-10,"[2014-03-10, 2014-03-11, 2014-03-12, 2014-03-13, 2014-03-14, 2014-03-15, 2014-03-16]",false,851,-32.957337,-60.049086,1.85,"[0, 0, 0, 0, 39.9, 0, 0]",6.943941116333008E-6,291.8419583638509,Molisoles,-0.004100412130355835,0.5110511779785156,"{""type"":""Point"",""coordinates"":[-60.049086,-32.957337]}"
852,30070,30,9/8/2013,La Paz,Entre Rios,6543-2055,11.16,36,invierno,2013-08-05,"[2013-08-05, 2013-08-06, 2013-08-07, 2013-08-08, 2013-08-09, 2013-08-10, 2013-08-11]",true,852,-30.60360412,-59.52751986,4.26,"[0, 0, 0, 2.5, 0, 0, 0]",9.804964065551758E-6,286.63228034973145,Molisoles,-0.001661231741309166,0.3638388315836589,"{""type"":""Point"",""coordinates"":[-59.52751986,-30.60360412]}"
853,30049,30,26/2/2007,Gualeguay,Entre Rios,39-39,13.76,2,verano,2007-02-26,"[2007-02-26, 2007-02-27, 2007-02-28, 2007-03-01, 2007-03-02, 2007-03-03, 2007-03-04]",true,853,-33.55871824,-59.48052013,2.16,"[10.6, 15.9, 23, 50.7, 0, 10.3, 53.8]",5.400329828262329E-4,300.14753913879395,Entisoles,-0.003190630115568638,0.5637391408284506,"{""type"":""Point"",""coordinates"":[-59.48052013,-33.558718240000005]}"
854,30049,30,22/4/1996,Gualeguay,Entre Rios,39-39,13.76,2,otoño,1996-04-22,"[1996-04-22, 1996-04-23, 1996-04-24, 1996-04-25, 1996-04-26, 1996-04-27, 1996-04-28]",true,854,-33.55871824,-59.48052013,2.16,"[0, 0.7, 28.5, 0.1, 0.6, 0, 7.9]",3.2335519790649414E-6,290.89079030354816,Entisoles,-0.0016320431604981422,0.5253518422444662,"{""type"":""Point"",""coordinates"":[-59.48052013,-33.558718240000005]}"
855,02013,2,5/2/1999,Comuna 13,Capital Federal,54-54,3.99,10,verano,1999-02-01,"[1999-02-01, 1999-02-02, 1999-02-03, 1999-02-04, 1999-02-05, 1999-02-06, 1999-02-07]",true,855,-34.55488152,-58.4502891,3.85,"[45.4, 1.4, 0.1, 0, 0, 115.3, 24.1]",0.004682585597038269,289.80591773986816,Miscelaneas,-0.003075997345149517,0.3553657531738281,"{""type"":""Point"",""coordinates"":[-58.4502891,-34.55488152]}"
856,02014,2,10/9/1992,Comuna 14,Capital Federal,85-85,2.68,24,invierno,1992-09-07,"[1992-09-07, 1992-09-08, 1992-09-09, 1992-09-10, 1992-09-11, 1992-09-12, 1992-09-13]",true,856,-34.57389998,-58.42243645,5.28,"[0, 0, 0.6, 3.6, 30, 0.6, 0]",6.170570850372314E-4,285.3733666737874,Miscelaneas,-0.0024384576827287674,0.3880939483642578,"{""type"":""Point"",""coordinates"":[-58.42243645,-34.57389997999999]}"
857,02001,2,20/6/1996,Comuna 1,Capital Federal,8891-2706,1.05,28,otoño,1996-06-17,"[1996-06-17, 1996-06-18, 1996-06-19, 1996-06-20, 1996-06-21, 1996-06-22, 1996-06-23]",true,857,-34.62504786,-58.38438723,3.7,"[2.5, 0, 0, 0, 0, 0, 0]",2.0444393157958984E-4,282.9924742380778,Miscelaneas,-0.0016395319253206253,0.43068377176920575,"{""type"":""Point"",""coordinates"":[-58.38438723000001,-34.62504786000001]}"
858,82063,82,11/12/1994,La Capital,Santa Fe,103-103,23.73,25,primavera,1994-12-05,"[1994-12-05, 1994-12-06, 1994-12-07, 1994-12-08, 1994-12-09, 1994-12-10, 1994-12-11]",false,858,-31.18858147,-60.62677383,2.15,"[0, 0, 0, 0, 0, 0, 0.6]",6.16610050201416E-5,293.3331769307454,Molisoles,-0.006073496304452419,0.4143473307291667,"{""type"":""Point"",""coordinates"":[-60.62677383,-31.18858147]}"
859,66140,66,27/12/1997,Rosario de la Frontera,Salta,9546-2814,30.72,701,verano,1997-12-22,"[1997-12-22, 1997-12-23, 1997-12-24, 1997-12-25, 1997-12-26, 1997-12-27, 1997-12-28]",false,859,-25.89667,-64.7655,1.03,"[13.3, 0.9, 0, 0, 0, 4.5, 7.9]",1.2154877185821533E-4,294.1850388844808,Entisoles,-0.0022392263635993004,0.31465721130371094,"{""type"":""Point"",""coordinates"":[-64.7655,-25.89667]}"
860,66112,66,28/1/2011,Metan,Salta,9546-2814,6.06,567,verano,2011-01-24,"[2011-01-24, 2011-01-25, 2011-01-26, 2011-01-27, 2011-01-28, 2011-01-29, 2011-01-30]",true,860,-25.51643753,-64.60592651,1.03,"[6.9, 4.2, 4.7, 6.7, 3.9, 9.3, 4.5]",8.996427059173584E-4,297.0331179300944,Molisoles,-0.005377886816859245,0.4649238586425781,"{""type"":""Point"",""coordinates"":[-64.60592651,-25.516437529999997]}"
861,66112,66,28/2/1991,Metan,Salta,9546-2814,6.06,567,verano,1991-02-25,"[1991-02-25, 1991-02-26, 1991-02-27, 1991-02-28, 1991-03-01, 1991-03-02, 1991-03-03]",true,861,-25.51643753,-64.60592651,1.03,"[3.1, 24.8, 6.8, 0.5, 0.3, 17.9, 20.3]",7.203668355941772E-4,297.925968170166,Molisoles,-0.0037344442680478096,0.4582481384277344,"{""type"":""Point"",""coordinates"":[-64.60592651,-25.516437529999997]}"
862,82091,82,8/10/2001,San Cristobal,Santa Fe,105-105,37.56,78,primavera,2001-10-08,"[2001-10-08, 2001-10-09, 2001-10-10, 2001-10-11, 2001-10-12, 2001-10-13, 2001-10-14]",false,862,-29.88749922,-61.57182768,1.85,"[0.4, 0, 0, 0, 1.6, 0, 0.1]",5.84721565246582E-5,289.72857093811035,Complejo indiferenci,-0.0034711724147200584,0.4742908477783203,"{""type"":""Point"",""coordinates"":[-61.571827680000006,-29.88749922]}"
863,82077,82,23/2/1992,9 de Julio,Santa Fe,105-105,10.52,84,verano,1992-02-17,"[1992-02-17, 1992-02-18, 1992-02-19, 1992-02-20, 1992-02-21, 1992-02-22, 1992-02-23]",true,863,-29.0758472,-61.73625069,5.09,"[0.1, 0.1, 0, 0, 5, 10.8, 0]",2.669990062713623E-4,299.84424082438153,Molisoles,-0.005070081911981106,0.4551544189453125,"{""type"":""Point"",""coordinates"":[-61.73625069,-29.07584719999999]}"
864,82098,82,5/10/2014,San Javier,Santa Fe,6247-1929,17.29,60,primavera,2014-09-29,"[2014-09-29, 2014-09-30, 2014-10-01, 2014-10-02, 2014-10-03, 2014-10-04, 2014-10-05]",false,864,-29.42420679,-59.97955475,5.55,"[0, 2.2, 0, 0, 0, 4.3, 54.6]",1.685023307800293E-4,294.4512583414714,Complejo indiferenci,-0.0021427366882562637,0.3640664418538411,"{""type"":""Point"",""coordinates"":[-59.97955475,-29.424206790000007]}"
865,82035,82,6/8/2003,Garay,Santa Fe,33531-6669,2.91,23,invierno,2003-08-04,"[2003-08-04, 2003-08-05, 2003-08-06, 2003-08-07, 2003-08-08, 2003-08-09, 2003-08-10]",true,865,-31.1523125,-60.1365521,2.36,"[13.6, 0.6, 0.3, 0, 0, 0, 0]",0.003794372081756592,287.54749234517413,Molisoles,-3.1700171530246735E-4,0.42543665568033856,"{""type"":""Point"",""coordinates"":[-60.1365521,-31.152312499999997]}"
866,82028,82,8/10/2003,Constitucion,Santa Fe,36996-7283,18.3,104,primavera,2003-10-06,"[2003-10-06, 2003-10-07, 2003-10-08, 2003-10-09, 2003-10-10, 2003-10-11, 2003-10-12]",false,866,-33.3790173,-61.3544315,1.85,"[0, 0, 18.7, 0, 0, 0, 0]",7.881224155426025E-5,294.23661041259766,Alfisoles,-0.0023917118087410927,0.300753911336263,"{""type"":""Point"",""coordinates"":[-61.354431500000004,-33.37901730000001]}"
867,86056,86,24/11/2004,Copo,Santiago del Estero,6309-1957,42.91,266,primavera,2004-11-22,"[2004-11-22, 2004-11-23, 2004-11-24, 2004-11-25, 2004-11-26, 2004-11-27, 2004-11-28]",false,867,-25.72948778,-63.46601397,2.96,"[0, 1.8, 13.1, 7.7, 5, 9.1, 0]",3.2782554626464844E-6,302.74538167317706,Molisoles,-0.0032594604417681694,0.2190831502278646,"{""type"":""Point"",""coordinates"":[-63.46601397,-25.72948778]}"
868,86028,86,6/6/1992,Avellaneda,Santiago del Estero,32009-6398,25.02,106,otoño,1992-06-01,"[1992-06-01, 1992-06-02, 1992-06-03, 1992-06-04, 1992-06-05, 1992-06-06, 1992-06-07]",false,868,-28.70814175,-63.1050531,2.31,"[0, 0, 0, 0, 0, 2.7, 2.2]",1.447051763534546E-4,286.5487403869629,Alfisoles,-0.0014626393094658852,0.28267987569173175,"{""type"":""Point"",""coordinates"":[-63.1050531,-28.708141750000003]}"
869,18070,18,5/5/2014,Goya,Corrientes,6624-2091,11.86,59,otoño,2014-05-05,"[2014-05-05, 2014-05-06, 2014-05-07, 2014-05-08, 2014-05-09, 2014-05-10, 2014-05-11]",true,869,-29.1751244,-58.88982054,2.14,"[4.6, 0.4, 0, 0, 0, 0, 0.3]",2.0441412925720215E-4,294.99180666605633,Rio,-0.0015832483768463135,0.4007396697998047,"{""type"":""Point"",""coordinates"":[-58.889820540000024,-29.1751244]}"
870,18021,18,4/2/2002,Capital,Corrientes,6611-2085,6.4,45,verano,2002-02-04,"[2002-02-04, 2002-02-05, 2002-02-06, 2002-02-07, 2002-02-08, 2002-02-09, 2002-02-10]",true,870,-27.4064,-58.78276,12.77,"[0, 0.4, 0.9, 0.6, 0, 0.1, 0]",4.1772425174713135E-4,297.61591657002765,Rio,-0.006631993688642979,0.3164316813151042,"{""type"":""Point"",""coordinates"":[-58.78276,-27.4064]}"
871,82063,82,18/2/1997,La Capital,Santa Fe,103-103,23.73,25,verano,1997-02-17,"[1997-02-17, 1997-02-18, 1997-02-19, 1997-02-20, 1997-02-21, 1997-02-22, 1997-02-23]",false,871,-31.18858147,-60.62677383,2.15,"[0, 0, 3, 0, 0, 0, 0]",2.512335777282715E-5,298.2310269673665,Molisoles,-0.003860277123749256,0.4578227996826172,"{""type"":""Point"",""coordinates"":[-60.62677383,-31.18858147]}"
872,82049,82,24/5/2012,General Obligado,Santa Fe,32822-6509,17.99,58,otoño,2012-05-21,"[2012-05-21, 2012-05-22, 2012-05-23, 2012-05-24, 2012-05-25, 2012-05-26, 2012-05-27]",false,872,-28.6765561,-59.7497004,1.41,"[0.9, 3.2, 20.5, 0.5, 0, 0, 0.1]",1.703202724456787E-5,294.1745827992757,Alfisoles,-0.001578853465616703,0.4238707224527995,"{""type"":""Point"",""coordinates"":[-59.7497004,-28.676556099999996]}"
873,38035,38,4/6/2009,Ledesma,Jujuy,33117-6463,14.96,383,otoño,2009-06-01,"[2009-06-01, 2009-06-02, 2009-06-03, 2009-06-04, 2009-06-05, 2009-06-06, 2009-06-07]",true,873,-23.88497353,-64.67390442,0.93,"[0, 0, 0, 0, 0, 0, 0]",4.078596830368042E-4,287.2612991333008,Roca,-0.002674248069524765,0.46470896402994794,"{""type"":""Point"",""coordinates"":[-64.67390442,-23.884973529999996]}"
874,18126,18,15/1/2007,Saladas,Corrientes,36693-7166,23.89,72,verano,2007-01-15,"[2007-01-15, 2007-01-16, 2007-01-17, 2007-01-18, 2007-01-19, 2007-01-20, 2007-01-21]",false,874,-28.32076054,-58.54644943,2.3,"[0, 0, 5.4, 0.4, 10.7, 1.2, 0]",2.8014183044433594E-6,296.01233164469403,Molisoles,-0.006616231985390186,0.3865044911702474,"{""type"":""Point"",""coordinates"":[-58.54644943,-28.320760540000002]}"
875,18119,18,17/3/1993,Paso de los Libres,Corrientes,1383-1063,15.85,57,verano,1993-03-15,"[1993-03-15, 1993-03-16, 1993-03-17, 1993-03-18, 1993-03-19, 1993-03-20, 1993-03-21]",false,875,-29.87793885,-57.53288465,1.42,"[8.3, 1.6, 0.6, 0.2, 1.1, 0, 0]",1.9031763076782227E-4,300.30941645304364,Molisoles,-0.00419863685965538,0.41776593526204425,"{""type"":""Point"",""coordinates"":[-57.53288465,-29.877938850000003]}"
876,18112,18,21/6/1998,Monte Caseros,Corrientes,1388-1077,8.95,56,otoño,1998-06-15,"[1998-06-15, 1998-06-16, 1998-06-17, 1998-06-18, 1998-06-19, 1998-06-20, 1998-06-21]",true,876,-30.47490444,-57.98344137,1.85,"[20.4, 69.4, 0, 0, 0, 0, 0]",0.006554752588272095,289.330259958903,Alfisoles,-7.191291078925133E-4,0.4980328877766927,"{""type"":""Point"",""coordinates"":[-57.98344137000001,-30.474904439999996]}"
877,18049,18,8/5/2008,Esquina,Corrientes,9200-2836,11.96,43,otoño,2008-05-05,"[2008-05-05, 2008-05-06, 2008-05-07, 2008-05-08, 2008-05-09, 2008-05-10, 2008-05-11]",true,877,-30.0784368,-59.4055912,1.42,"[0, 0, 0, 0, 0, 0, 0]",2.0712614059448242E-6,288.1261870066325,Complejo indiferenci,-0.0019768662750720978,0.32024192810058594,"{""type"":""Point"",""coordinates"":[-59.405591199999996,-30.0784368]}"
878,18035,18,3/8/1998,Curuzu Cuatia,Corrientes,9021-2832,18.94,69,invierno,1998-08-03,"[1998-08-03, 1998-08-04, 1998-08-05, 1998-08-06, 1998-08-07, 1998-08-08, 1998-08-09]",false,878,-29.30959977,-58.51285545,1.41,"[0, 0, 0, 0, 0, 0, 0]",0.002095162868499756,286.5454107920329,Alfisoles,-0.0016718721017241478,0.4564355214436849,"{""type"":""Point"",""coordinates"":[-58.51285545,-29.30959977]}"
879,18021,18,11/4/1998,Capital,Corrientes,6611-2085,6.4,45,otoño,1998-04-06,"[1998-04-06, 1998-04-07, 1998-04-08, 1998-04-09, 1998-04-10, 1998-04-11, 1998-04-12]",true,879,-27.4064,-58.78276,12.77,"[46, 0, 0, 0, 1.4, 22.9, 37.7]",0.00896473228931427,294.45271492004395,Rio,-0.001312093809247017,0.36588478088378906,"{""type"":""Point"",""coordinates"":[-58.78276,-27.4064]}"
880,22140,22,24/2/2000,San Fernando,Chaco,6254-1933,11.88,54,verano,2000-02-21,"[2000-02-21, 2000-02-22, 2000-02-23, 2000-02-24, 2000-02-25, 2000-02-26, 2000-02-27]",true,880,-27.92561531,-59.31798172,2.97,"[0.5, 0, 1.3, 1.6, 30.6, 14.8, 30.6]",1.1453032493591309E-4,297.90053304036456,Complejo indiferenci,-0.004333138465881348,0.22562853495279947,"{""type"":""Point"",""coordinates"":[-59.317981720000006,-27.925615310000005]}"
881,22140,22,18/4/2013,San Fernando,Chaco,6254-1933,11.88,54,otoño,2013-04-15,"[2013-04-15, 2013-04-16, 2013-04-17, 2013-04-18, 2013-04-19, 2013-04-20, 2013-04-21]",true,881,-27.92561531,-59.31798172,2.97,"[0, 0, 0, 0, 0, 0, 0]",7.107853889465332E-6,291.3061606089274,Complejo indiferenci,-0.003316248767077923,0.3435535430908203,"{""type"":""Point"",""coordinates"":[-59.317981720000006,-27.925615310000005]}"
882,02008,2,1/12/1997,Comuna 8,Capital Federal,36837-7237,7.49,21,primavera,1997-12-01,"[1997-12-01, 1997-12-02, 1997-12-03, 1997-12-04, 1997-12-05, 1997-12-06, 1997-12-07]",true,882,-34.67499358,-58.47616299,1.13,"[0, 19.8, 0, 0, 0, 3.4, 4.4]",4.13358211517334E-5,293.08125495910645,Miscelaneas,-0.005353461019694805,0.42633946736653644,"{""type"":""Point"",""coordinates"":[-58.47616299,-34.67499358]}"
883,02010,2,22/5/2015,Comuna 10,Capital Federal,36837-7237,4.71,24,otoño,2015-05-18,"[2015-05-18, 2015-05-19, 2015-05-20, 2015-05-21, 2015-05-22, 2015-05-23, 2015-05-24]",true,883,-34.62768629,-58.48358728,1.46,"[1.1, 0, 0, 0, 0.4, 4.7, 0]",1.6430020332336426E-4,293.8325017293294,Miscelaneas,-9.17503610253334E-4,0.271518071492513,"{""type"":""Point"",""coordinates"":[-58.48358728,-34.62768628999999]}"
884,02008,2,25/11/2015,Comuna 8,Capital Federal,36837-7237,7.49,21,primavera,2015-11-23,"[2015-11-23, 2015-11-24, 2015-11-25, 2015-11-26, 2015-11-27, 2015-11-28, 2015-11-29]",true,884,-34.67499358,-58.47616299,1.13,"[0, 0, 0, 0.2, 18.1, 0, 0]",6.559491157531738E-5,292.15011469523114,Miscelaneas,-0.004020801745355129,0.28601964314778644,"{""type"":""Point"",""coordinates"":[-58.47616299,-34.67499358]}"
885,02015,2,6/10/2011,Comuna 15,Capital Federal,36837-7237,2.81,29,primavera,2011-10-03,"[2011-10-03, 2011-10-04, 2011-10-05, 2011-10-06, 2011-10-07, 2011-10-08, 2011-10-09]",true,885,-34.59294425,-58.48867142,4.63,"[0, 0, 0, 5.6, 61.1, 0, 5.5]",2.2646784782409668E-4,284.55163701375324,Miscelaneas,-0.0036332784220576286,0.2911275227864583,"{""type"":""Point"",""coordinates"":[-58.48867142,-34.59294425]}"
886,02007,2,9/2/1991,Comuna 7,Capital Federal,36837-7237,7.04,22,verano,1991-02-04,"[1991-02-04, 1991-02-05, 1991-02-06, 1991-02-07, 1991-02-08, 1991-02-09, 1991-02-10]",true,886,-34.63680708,-58.45826985,2.25,"[0.6, 0, 0, 0, 0, 3.5, 0.1]",6.599575281143188E-4,297.6992645263672,Miscelaneas,-0.004131379537284374,0.3065357208251953,"{""type"":""Point"",""coordinates"":[-58.45826984999999,-34.63680708]}"
887,02013,2,12/11/1996,Comuna 13,Capital Federal,54-54,3.99,10,primavera,1996-11-11,"[1996-11-11, 1996-11-12, 1996-11-13, 1996-11-14, 1996-11-15, 1996-11-16, 1996-11-17]",true,887,-34.55488152,-58.4502891,3.85,"[0, 0, 0, 0.1, 3.9, 0.1, 0]",2.7148425579071045E-4,291.24419530232746,Miscelaneas,-0.005431776866316795,0.4109948476155599,"{""type"":""Point"",""coordinates"":[-58.4502891,-34.55488152]}"
888,02015,2,16/5/1990,Comuna 15,Capital Federal,36837-7237,2.81,29,otoño,1990-05-14,"[1990-05-14, 1990-05-15, 1990-05-16, 1990-05-17, 1990-05-18, 1990-05-19, 1990-05-20]",true,888,-34.59294425,-58.48867142,4.63,"[2, 0, 0.5, 1.6, 0, 0, 0]",6.40377402305603E-4,287.2012087504069,Miscelaneas,-0.0013316692784428596,0.4278093973795573,"{""type"":""Point"",""coordinates"":[-58.48867142,-34.59294425]}"
889,02006,2,8/6/1995,Comuna 6,Capital Federal,85-85,5.9,32,otoño,1995-06-05,"[1995-06-05, 1995-06-06, 1995-06-07, 1995-06-08, 1995-06-09, 1995-06-10, 1995-06-11]",true,889,-34.6168255,-58.44360311,5.01,"[0, 25.6, 0, 0, 1.8, 0.3, 0.9]",1.8730759620666504E-4,291.2018337249756,Miscelaneas,-0.0011705541983246803,0.32998212178548175,"{""type"":""Point"",""coordinates"":[-58.44360310999999,-34.6168255]}"
890,02003,2,3/5/1997,Comuna 3,Capital Federal,85-85,2.82,29,otoño,1997-04-28,"[1997-04-28, 1997-04-29, 1997-04-30, 1997-05-01, 1997-05-02, 1997-05-03, 1997-05-04]",true,890,-34.60909977,-58.40306252,1.46,"[0, 0, 0, 0, 0, 0, 0]",1.0073184967041016E-4,287.0348587036133,Miscelaneas,-0.0018958374857902527,0.3086630503336589,"{""type"":""Point"",""coordinates"":[-58.403062520000006,-34.60909977000001]}"
891,02014,2,14/7/1996,Comuna 14,Capital Federal,85-85,2.68,24,invierno,1996-07-08,"[1996-07-08, 1996-07-09, 1996-07-10, 1996-07-11, 1996-07-12, 1996-07-13, 1996-07-14]",true,891,-34.57389998,-58.42243645,5.28,"[25.3, 10.9, 4.2, 0, 0, 0, 0]",3.4877657890319824E-4,284.3308442433675,Miscelaneas,-0.002165054902434349,0.42885462443033856,"{""type"":""Point"",""coordinates"":[-58.42243645,-34.57389997999999]}"
892,02001,2,22/11/1997,Comuna 1,Capital Federal,8891-2706,1.05,28,primavera,1997-11-17,"[1997-11-17, 1997-11-18, 1997-11-19, 1997-11-20, 1997-11-21, 1997-11-22, 1997-11-23]",true,892,-34.62504786,-58.38438723,3.7,"[0, 0, 0, 3.6, 1, 1.8, 4.3]",1.5263259410858154E-4,289.0831832885742,Miscelaneas,-0.0050306739285588264,0.3049964904785156,"{""type"":""Point"",""coordinates"":[-58.38438723000001,-34.62504786000001]}"
893,02004,2,1/10/1998,Comuna 4,Capital Federal,8891-2706,2.09,10,primavera,1998-09-28,"[1998-09-28, 1998-09-29, 1998-09-30, 1998-10-01, 1998-10-02, 1998-10-03, 1998-10-04]",true,893,-34.64641355,-58.38427103,1.46,"[0, 0, 0, 0, 0, 0.9, 7.7]",6.557852029800415E-4,284.0668137868245,Miscelaneas,-0.0041355593129992485,0.40268898010253906,"{""type"":""Point"",""coordinates"":[-58.384271029999994,-34.64641355]}"
894,02003,2,17/10/1993,Comuna 3,Capital Federal,85-85,2.82,29,primavera,1993-10-11,"[1993-10-11, 1993-10-12, 1993-10-13, 1993-10-14, 1993-10-15, 1993-10-16, 1993-10-17]",true,894,-34.60909977,-58.40306252,1.46,"[0, 8, 0, 0, 0, 54, 19.9]",5.011111497879028E-4,294.5929425557454,Miscelaneas,-0.0030795345082879066,0.25789769490559894,"{""type"":""Point"",""coordinates"":[-58.403062520000006,-34.60909977000001]}"
895,02014,2,13/8/1991,Comuna 14,Capital Federal,85-85,2.68,24,invierno,1991-08-12,"[1991-08-12, 1991-08-13, 1991-08-14, 1991-08-15, 1991-08-16, 1991-08-17, 1991-08-18]",true,895,-34.57389998,-58.42243645,5.28,"[0.2, 0, 0, 0, 0, 0, 4.2]",6.147772073745728E-4,282.5276222229004,Miscelaneas,-0.0014995643869042397,0.43830426534016925,"{""type"":""Point"",""coordinates"":[-58.42243645,-34.57389997999999]}"
896,06861,6,16/4/2002,Vicente Lopez,Buenos Aires,36837-7237,3.72,28,otoño,2002-04-15,"[2002-04-15, 2002-04-16, 2002-04-17, 2002-04-18, 2002-04-19, 2002-04-20, 2002-04-21]",true,896,-34.52591497,-58.53576394,1.13,"[7.8, 40.7, 9.5, 0, 0.3, 0, 0]",,,Miscelaneas,,,"{""type"":""Point"",""coordinates"":[-58.53576394000001,-34.52591497]}"
897,06840,6,21/3/2008,Tres de Febrero,Buenos Aires,36837-7237,6.8,27,verano,2008-03-17,"[2008-03-17, 2008-03-18, 2008-03-19, 2008-03-20, 2008-03-21, 2008-03-22, 2008-03-23]",true,897,-34.60887295,-58.56366446,1.85,"[0, 0.4, 0.2, 0, 9.4, 17.4, 0]",3.059208393096924E-5,296.6079578399658,Miscelaneas,-0.0024079326540231705,0.31123797098795575,"{""type"":""Point"",""coordinates"":[-58.563664460000005,-34.60887294999999]}"
898,06805,6,19/7/2009,Tigre,Buenos Aires,34847-6831,1.44,4,invierno,2009-07-13,"[2009-07-13, 2009-07-14, 2009-07-15, 2009-07-16, 2009-07-17, 2009-07-18, 2009-07-19]",true,898,-34.3277116,-58.608687,3.84,"[0, 0, 0, 0, 0, 0, 0.2]",9.685754776000977E-7,282.9882214864095,Rio,-0.0012765619903802872,0.3603515625,"{""type"":""Point"",""coordinates"":[-58.608687,-34.3277116]}"
899,06756,6,28/11/1994,San Isidro,Buenos Aires,53-53,1.29,24,primavera,1994-11-28,"[1994-11-28, 1994-11-29, 1994-11-30, 1994-12-01, 1994-12-02, 1994-12-03, 1994-12-04]",true,899,-34.47940181,-58.5074044,5.81,"[9.3, 1.3, 0, 0.2, 6.8, 51.5, 0]",,,Rio,,,"{""type"":""Point"",""coordinates"":[-58.507404400000006,-34.47940181]}"
900,06749,6,14/10/1993,San Fernando,Buenos Aires,34847-6831,5.62,5,primavera,1993-10-11,"[1993-10-11, 1993-10-12, 1993-10-13, 1993-10-14, 1993-10-15, 1993-10-16, 1993-10-17]",true,900,-34.2256455,-58.5931568,3.84,"[0, 12.8, 0, 0, 0, 62.2, 26.9]",7.450580596923828E-8,295.6456769307454,Rio,-0.004255454055964947,0.4327125549316406,"{""type"":""Point"",""coordinates"":[-58.5931568,-34.2256455]}"
901,06658,6,13/1/2007,Quilmes,Buenos Aires,35407-6950,4.25,3,verano,2007-01-08,"[2007-01-08, 2007-01-09, 2007-01-10, 2007-01-11, 2007-01-12, 2007-01-13, 2007-01-14]",true,901,-34.70037841,-58.27664278,2.17,"[0, 0, 5, 0.5, 0, 0.6, 0]",,,Miscelaneas,,,"{""type"":""Point"",""coordinates"":[-58.276642779999996,-34.70037841]}"
902,06638,6,17/11/1999,Pilar,Buenos Aires,34357-5904,12.77,16,primavera,1999-11-15,"[1999-11-15, 1999-11-16, 1999-11-17, 1999-11-18, 1999-11-19, 1999-11-20, 1999-11-21]",true,902,-34.42200558,-58.95283788,1.46,"[0, 0, 0, 2.7, 1.5, 0, 0]",8.38935375213623E-6,295.70879046122235,Molisoles,-0.004334021359682083,0.298587163289388,"{""type"":""Point"",""coordinates"":[-58.95283788,-34.42200558]}"
903,06568,6,5/2/2009,Moron,Buenos Aires,33486-6512,15.92,14,verano,2009-02-02,"[2009-02-02, 2009-02-03, 2009-02-04, 2009-02-05, 2009-02-06, 2009-02-07, 2009-02-08]",false,903,-34.6644131,-58.64564271,3.58,"[1.7, 27.4, 0.2, 0.8, 0.2, 0, 0]",1.9073486328125E-6,296.7810522715251,Miscelaneas,-0.0010478198528289795,0.2677319844563802,"{""type"":""Point"",""coordinates"":[-58.645642710000004,-34.6644131]}"
904,06568,6,12/5/2015,Moron,Buenos Aires,33486-6512,15.92,14,otoño,2015-05-11,"[2015-05-11, 2015-05-12, 2015-05-13, 2015-05-14, 2015-05-15, 2015-05-16, 2015-05-17]",false,904,-34.6644131,-58.64564271,3.58,"[0.2, 0, 0.1, 0, 0.2, 0, 0]",1.7583370208740234E-5,287.0504258473714,Miscelaneas,-8.769836276769638E-4,0.35769017537434894,"{""type"":""Point"",""coordinates"":[-58.645642710000004,-34.6644131]}"
905,06560,6,27/3/1998,Moreno,Buenos Aires,42-42,17.53,33,otoño,1998-03-23,"[1998-03-23, 1998-03-24, 1998-03-25, 1998-03-26, 1998-03-27, 1998-03-28, 1998-03-29]",false,905,-34.55865957,-58.81630109,4.33,"[1.5, 0.3, 0, 0, 6.6, 0.1, 0]",1.290440559387207E-5,294.2247994740804,Complejo indiferenci,-0.002177545800805092,0.34177080790201825,"{""type"":""Point"",""coordinates"":[-58.81630109,-34.55865957]}"
906,06539,6,1/4/2011,Merlo,Buenos Aires,33486-6512,18.44,32,otoño,2011-03-28,"[2011-03-28, 2011-03-29, 2011-03-30, 2011-03-31, 2011-04-01, 2011-04-02, 2011-04-03]",false,906,-34.70854224,-58.67958673,3.7,"[0, 0, 0, 0, 0.4, 0.3, 12.5]",7.450580596923828E-7,289.6620616912842,Complejo indiferenci,-0.0020048990845680237,0.32585589090983075,"{""type"":""Point"",""coordinates"":[-58.67958673,-34.70854223999999]}"
907,06525,6,28/11/1995,Marcos Paz,Buenos Aires,6936-2128,28.61,33,primavera,1995-11-27,"[1995-11-27, 1995-11-28, 1995-11-29, 1995-11-30, 1995-12-01, 1995-12-02, 1995-12-03]",false,907,-34.776242,-58.9395696,1.46,"[0, 0, 0, 4.2, 5, 0, 0]",1.595914363861084E-5,289.9845898946126,Complejo indiferenci,-0.0033923350274562836,0.30371348063151044,"{""type"":""Point"",""coordinates"":[-58.9395696,-34.776242]}"
908,06505,6,13/11/1990,Magdalena,Buenos Aires,3344-1739,9.75,18,primavera,1990-11-12,"[1990-11-12, 1990-11-13, 1990-11-14, 1990-11-15, 1990-11-16, 1990-11-17, 1990-11-18]",true,908,-35.17544498,-57.51894858,0.93,"[0, 27.2, 0.7, 16.1, 0, 0, 0]",1.2680888175964355E-5,291.3127791086833,Complejo indiferenci,-0.003891352564096451,0.332858403523763,"{""type"":""Point"",""coordinates"":[-57.51894857999999,-35.17544498]}"
909,06497,6,23/9/2004,Lujan,Buenos Aires,7-7,7.25,39,invierno,2004-09-20,"[2004-09-20, 2004-09-21, 2004-09-22, 2004-09-23, 2004-09-24, 2004-09-25, 2004-09-26]",true,909,-34.4619848,-59.1744878,0.93,"[0, 0, 0, 0, 0, 0, 0]",3.056228160858154E-5,284.45584042867023,Complejo indiferenci,-0.003153381869196892,0.4449990590413411,"{""type"":""Point"",""coordinates"":[-59.1744878,-34.4619848]}"
910,06490,6,7/7/1992,Lomas de Zamora,Buenos Aires,35405-6949,5.53,9,invierno,1992-07-06,"[1992-07-06, 1992-07-07, 1992-07-08, 1992-07-09, 1992-07-10, 1992-07-11, 1992-07-12]",true,910,-34.73790272,-58.44067537,3,"[0, 0, 0, 0, 0, 0, 7.6]",1.6663968563079834E-4,279.0514787038167,Miscelaneas,-0.0012855920940637589,0.42550214131673175,"{""type"":""Point"",""coordinates"":[-58.44067537000001,-34.73790272]}"
911,06434,6,14/12/2003,Lanus,Buenos Aires,8891-2706,4.6,5,primavera,2003-12-08,"[2003-12-08, 2003-12-09, 2003-12-10, 2003-12-11, 2003-12-12, 2003-12-13, 2003-12-14]",true,911,-34.69095715,-58.38386285,4.6,"[18.4, 0, 0, 8, 0, 0, 3.9]",0.002449125051498413,290.98808034261066,Miscelaneas,-0.0017115110531449318,0.4386405944824219,"{""type"":""Point"",""coordinates"":[-58.38386285000001,-34.69095715000001]}"
912,06441,6,15/6/2006,La Plata,Buenos Aires,3314-1708,23.31,26,otoño,2006-06-12,"[2006-06-12, 2006-06-13, 2006-06-14, 2006-06-15, 2006-06-16, 2006-06-17, 2006-06-18]",false,912,-35.03880607,-58.05930616,0.93,"[0, 0, 0, 0, 0, 0, 4.6]",8.32974910736084E-6,282.90697224934894,Complejo indiferenci,-9.912112727761269E-4,0.4212360382080078,"{""type"":""Point"",""coordinates"":[-58.05930616,-35.03880607000001]}"
913,06427,6,18/6/2006,La Matanza,Buenos Aires,33486-6512,4.98,8,otoño,2006-06-12,"[2006-06-12, 2006-06-13, 2006-06-14, 2006-06-15, 2006-06-16, 2006-06-17, 2006-06-18]",true,913,-34.71417289,-58.50890438,7.28,"[0, 0, 0, 0, 0, 0.6, 2.4]",9.590387344360352E-5,282.7047424316406,Molisoles,-0.0011445358395576477,0.3827934265136719,"{""type"":""Point"",""coordinates"":[-58.50890437999999,-34.71417289000001]}"
914,06638,6,9/9/1995,Pilar,Buenos Aires,42-42,10.41,16,invierno,1995-09-04,"[1995-09-04, 1995-09-05, 1995-09-06, 1995-09-07, 1995-09-08, 1995-09-09, 1995-09-10]",true,914,-34.42200558,-58.95283788,1.46,"[0, 0, 0, 6.9, 0.7, 0.1, 0]",1.7464160919189453E-5,288.3469003041585,Molisoles,-0.0017836298793554306,0.3278299967447917,"{""type"":""Point"",""coordinates"":[-58.95283788,-34.42200558]}"
915,06638,6,1/1/2007,Pilar,Buenos Aires,42-42,10.41,16,verano,2007-01-01,"[2007-01-01, 2007-01-02, 2007-01-03, 2007-01-04, 2007-01-05, 2007-01-06, 2007-01-07]",true,915,-34.42200558,-58.95283788,1.46,"[0, 0.3, 11, 0, 0, 0, 0]",1.8328428268432617E-6,302.5923652648926,Molisoles,-0.006487499922513962,0.3948535919189453,"{""type"":""Point"",""coordinates"":[-58.95283788,-34.42200558]}"
916,06371,6,26/7/2002,General San Martin,Buenos Aires,36837-7237,8.51,8,invierno,2002-07-22,"[2002-07-22, 2002-07-23, 2002-07-24, 2002-07-25, 2002-07-26, 2002-07-27, 2002-07-28]",true,916,-34.56734338,-58.58431125,17.23,"[0.6, 0.1, 5.9, 0, 0, 0, 0]",7.865577936172485E-4,286.1271800994873,Miscelaneas,-0.002186322584748268,0.47027015686035156,"{""type"":""Point"",""coordinates"":[-58.58431125,-34.56734338]}"
917,06364,6,22/1/2000,General Rodriguez,Buenos Aires,6936-2128,20,32,verano,2000-01-17,"[2000-01-17, 2000-01-18, 2000-01-19, 2000-01-20, 2000-01-21, 2000-01-22, 2000-01-23]",false,917,-34.72117406,-59.01160158,1.46,"[0, 0, 0, 0, 21.1, 0, 0]",8.419156074523926E-6,298.12277285257977,Complejo indiferenci,-0.002056712284684181,0.2862739562988281,"{""type"":""Point"",""coordinates"":[-59.01160158,-34.72117406]}"
918,06357,6,13/7/2003,General Pueyrredon,Buenos Aires,3347-1742,17.47,21,invierno,2003-07-07,"[2003-07-07, 2003-07-08, 2003-07-09, 2003-07-10, 2003-07-11, 2003-07-12, 2003-07-13]",false,918,-37.80766254,-57.62989086,5.55,"[0, 7.2, 1.8, 0.5, 0, 0, 0]",4.0084123611450195E-5,281.7463321685791,Molisoles,-9.418437257409096E-4,0.42614110310872394,"{""type"":""Point"",""coordinates"":[-57.62989086,-37.80766254000001]}"
919,06274,6,28/5/2011,Florencio Varela,Buenos Aires,7058-2230,1.42,23,otoño,2011-05-23,"[2011-05-23, 2011-05-24, 2011-05-25, 2011-05-26, 2011-05-27, 2011-05-28, 2011-05-29]",true,919,-34.8275807,-58.222912,0,"[0, 13.6, 6.4, 0, 0, 0, 0]",1.1235475540161133E-5,283.5560836791992,Complejo indiferenci,-0.0015272535383701324,0.3913764953613281,"{""type"":""Point"",""coordinates"":[-58.22291200000001,-34.8275807]}"
920,06245,6,18/10/1998,Ensenada,Buenos Aires,3314-1708,6.45,8,primavera,1998-10-12,"[1998-10-12, 1998-10-13, 1998-10-14, 1998-10-15, 1998-10-16, 1998-10-17, 1998-10-18]",true,920,-34.87584856,-57.9336299,5.71,"[0.1, 0, 0, 0, 3.4, 1.6, 0]",2.002716064453125E-5,290.0297374725342,Miscelaneas,-0.00285528227686882,0.33168792724609375,"{""type"":""Point"",""coordinates"":[-57.9336299,-34.875848559999994]}"
921,06161,6,6/1/2009,Carmen de Areco,Buenos Aires,32711-6544,5.4,52,verano,2009-01-05,"[2009-01-05, 2009-01-06, 2009-01-07, 2009-01-08, 2009-01-09, 2009-01-10, 2009-01-11]",true,921,-34.4145467,-59.8540512,1.12,"[0, 0.2, 0, 0, 0, 0, 0]",2.8908252716064453E-6,299.2918014526367,Molisoles,-0.0013558156788349152,0.2770989735921224,"{""type"":""Point"",""coordinates"":[-59.8540512,-34.41454670000001]}"
922,06140,6,28/6/2014,Capitan Sarmiento,Buenos Aires,6745-2129,5.72,42,invierno,2014-06-23,"[2014-06-23, 2014-06-24, 2014-06-25, 2014-06-26, 2014-06-27, 2014-06-28, 2014-06-29]",true,922,-34.1731879,-59.9792421,0.93,"[1.2, 0, 0, 0, 0, 0, 0]",4.951655864715576E-5,288.8339163462321,Molisoles,-6.451625376939774E-4,0.4558798472086589,"{""type"":""Point"",""coordinates"":[-59.9792421,-34.1731879]}"
923,06126,6,20/3/1990,Campana,Buenos Aires,26206-5876,0.02,4,verano,1990-03-19,"[1990-03-19, 1990-03-20, 1990-03-21, 1990-03-22, 1990-03-23, 1990-03-24, 1990-03-25]",true,923,-34.059934,-58.836065,2.91,"[0, 0, 0.3, 0, 12.5, 0.6, 0.1]",2.9802322387695312E-8,291.8430169423421,Rio,-0.003782598301768303,0.5163186391194662,"{""type"":""Point"",""coordinates"":[-58.836065000000005,-34.059934]}"
924,06119,6,21/4/2007,Brandsen,Buenos Aires,7058-2230,12.02,27,otoño,2007-04-16,"[2007-04-16, 2007-04-17, 2007-04-18, 2007-04-19, 2007-04-20, 2007-04-21, 2007-04-22]",true,924,-34.9854674,-58.1762428,1.46,"[0, 19.1, 0, 0, 4.2, 2.3, 18.9]",4.0918588638305664E-5,293.02763811747235,Molisoles,-0.0018548984080553055,0.4436747233072917,"{""type"":""Point"",""coordinates"":[-58.176242800000004,-34.98546739999999]}"
925,06098,6,4/5/1999,Berisso,Buenos Aires,3314-1708,0.7,7,otoño,1999-05-03,"[1999-05-03, 1999-05-04, 1999-05-05, 1999-05-06, 1999-05-07, 1999-05-08, 1999-05-09]",true,925,-34.84587606,-57.87973336,3.58,"[15.8, 1.2, 0, 2.8, 0, 0, 0]",,,Miscelaneas,,,"{""type"":""Point"",""coordinates"":[-57.87973336,-34.84587606]}"
926,06091,6,7/6/2014,Berazategui,Buenos Aires,7058-2230,14.45,26,otoño,2014-06-02,"[2014-06-02, 2014-06-03, 2014-06-04, 2014-06-05, 2014-06-06, 2014-06-07, 2014-06-08]",true,926,-34.83264047,-58.10084123,1.46,"[0, 0, 9, 0, 0, 1, 0]",2.7677416801452637E-4,285.73175112406415,Miscelaneas,-0.0013860240578651428,0.4645086924235026,"{""type"":""Point"",""coordinates"":[-58.10084122999999,-34.83264047]}"
927,06035,6,20/1/1996,Avellaneda,Buenos Aires,35411-6952,1.59,6,verano,1996-01-15,"[1996-01-15, 1996-01-16, 1996-01-17, 1996-01-18, 1996-01-19, 1996-01-20, 1996-01-21]",true,927,-34.67500565,-58.31056343,3.38,"[0, 0, 1.9, 0.3, 0, 0, 0]",,,Miscelaneas,,,"{""type"":""Point"",""coordinates"":[-58.31056343,-34.675005649999996]}"
928,06028,6,3/1/1999,Almirante Brown,Buenos Aires,35405-6949,1.13,28,verano,1998-12-28,"[1998-12-28, 1998-12-29, 1998-12-30, 1998-12-31, 1999-01-01, 1999-01-02, 1999-01-03]",true,928,-34.80155807,-58.39146772,0.93,"[31.9, 0, 0, 0, 0, 1.8, 7.8]",9.671002626419067E-4,296.6461696624756,Miscelaneas,-0.002158466726541519,0.37665239969889325,"{""type"":""Point"",""coordinates"":[-58.39146772000001,-34.80155807]}"
929,06882,6,9/10/1993,Zarate,Buenos Aires,3320-1714,3.88,28,primavera,1993-10-04,"[1993-10-04, 1993-10-05, 1993-10-06, 1993-10-07, 1993-10-08, 1993-10-09, 1993-10-10]",true,929,-33.9804188,-59.2846864,2.42,"[0, 0, 0, 0, 0, 0, 0]",9.523332118988037E-5,287.17681884765625,Rio,-0.003468724898993969,0.5277385711669922,"{""type"":""Point"",""coordinates"":[-59.2846864,-33.9804188]}"
930,82063,82,25/3/2006,La Capital,Santa Fe,103-103,23.73,25,verano,2006-03-20,"[2006-03-20, 2006-03-21, 2006-03-22, 2006-03-23, 2006-03-24, 2006-03-25, 2006-03-26]",false,930,-31.18858147,-60.62677383,2.15,"[0, 0, 0.2, 0, 0.3, 2, 0]",7.405877113342285E-6,295.32949511210126,Molisoles,-0.0038090255111455917,0.41822179158528644,"{""type"":""Point"",""coordinates"":[-60.62677383,-31.18858147]}"
931,34028,34,15/10/1996,Matacos,Formosa,33909-6556,47.74,205,primavera,1996-10-14,"[1996-10-14, 1996-10-15, 1996-10-16, 1996-10-17, 1996-10-18, 1996-10-19, 1996-10-20]",false,931,-23.67500877,-62.31292343,2.02,"[0, 0, 0, 0, 0, 4.4, 13.2]",8.940696716308594E-8,293.9588845570882,Alfisoles,-0.004304295405745506,0.3149089813232422,"{""type"":""Point"",""coordinates"":[-62.31292343,-23.67500877]}"
932,30070,30,17/12/1990,La Paz,Entre Rios,6543-2055,11.16,36,primavera,1990-12-17,"[1990-12-17, 1990-12-18, 1990-12-19, 1990-12-20, 1990-12-21, 1990-12-22, 1990-12-23]",true,932,-30.60360412,-59.52751986,4.26,"[47.5, 3.6, 0, 0, 6, 20.4, 0.2]",0.009923622012138367,299.2302665710449,Molisoles,-0.005949964746832848,0.39369455973307294,"{""type"":""Point"",""coordinates"":[-59.52751986,-30.60360412]}"
933,06357,6,20/2/2007,General Pueyrredon,Buenos Aires,3347-1742,17.47,21,verano,2007-02-19,"[2007-02-19, 2007-02-20, 2007-02-21, 2007-02-22, 2007-02-23, 2007-02-24, 2007-02-25]",false,933,-37.80766254,-57.62989086,5.55,"[0, 0.3, 0, 4.8, 0.7, 0.6, 0]",2.3543834686279297E-6,292.8040962219238,Molisoles,-0.004134477116167545,0.410952885945638,"{""type"":""Point"",""coordinates"":[-57.62989086,-37.80766254000001]}"
934,86056,86,22/4/2007,Copo,Santiago del Estero,6309-1957,42.91,266,otoño,2007-04-16,"[2007-04-16, 2007-04-17, 2007-04-18, 2007-04-19, 2007-04-20, 2007-04-21, 2007-04-22]",false,934,-25.72948778,-63.46601397,2.96,"[0.2, 0, 0, 0, 0, 1.7, 0.1]",3.056228160858154E-5,299.14490699768066,Molisoles,-0.002608056180179119,0.3165791829427083,"{""type"":""Point"",""coordinates"":[-63.46601397,-25.72948778]}"
935,86133,86,8/12/2011,Pellegrini,Santiago del Estero,32820-6498,6.85,375,primavera,2011-12-05,"[2011-12-05, 2011-12-06, 2011-12-07, 2011-12-08, 2011-12-09, 2011-12-10, 2011-12-11]",true,935,-26.28318787,-64.45684052,0,"[8.4, 4.6, 17.8, 7.2, 0, 0, 0]",7.05718994140625E-5,294.0865173339844,Entisoles,-0.0028628483414649963,0.3960272471110026,"{""type"":""Point"",""coordinates"":[-64.45684052,-26.28318787]}"
936,82098,82,15/9/1993,San Javier,Santa Fe,6247-1929,17.29,60,invierno,1993-09-13,"[1993-09-13, 1993-09-14, 1993-09-15, 1993-09-16, 1993-09-17, 1993-09-18, 1993-09-19]",false,936,-29.42420679,-59.97955475,5.55,"[50.3, 0.8, 0, 0, 0, 26.8, 8.7]",0.007071629166603088,287.96764246622723,Complejo indiferenci,-8.857604116201401E-4,0.3827838897705078,"{""type"":""Point"",""coordinates"":[-59.97955475,-29.424206790000007]}"
937,82049,82,2/7/1992,General Obligado,Santa Fe,32822-6509,17.99,58,invierno,1992-06-29,"[1992-06-29, 1992-06-30, 1992-07-01, 1992-07-02, 1992-07-03, 1992-07-04, 1992-07-05]",false,937,-28.6765561,-59.7497004,1.41,"[0, 0, 0, 0, 0, 0.2, 0]",0.0015877783298492432,284.6239376068115,Alfisoles,-8.14453698694706E-4,0.4525197347005208,"{""type"":""Point"",""coordinates"":[-59.7497004,-28.676556099999996]}"
938,82035,82,26/3/1993,Garay,Santa Fe,33531-6669,2.91,23,otoño,1993-03-22,"[1993-03-22, 1993-03-23, 1993-03-24, 1993-03-25, 1993-03-26, 1993-03-27, 1993-03-28]",true,938,-31.1523125,-60.1365521,2.36,"[0, 0, 0, 0, 0, 0, 0]",5.623400211334229E-4,294.7957878112793,Molisoles,-0.0037877289578318596,0.3252906799316406,"{""type"":""Point"",""coordinates"":[-60.1365521,-31.152312499999997]}"
939,90014,90,20/6/1993,Cruz Alta,Tucuman,33966-6506,21.31,370,otoño,1993-06-14,"[1993-06-14, 1993-06-15, 1993-06-16, 1993-06-17, 1993-06-18, 1993-06-19, 1993-06-20]",false,939,-27.0201218,-65.0182022,1.85,"[0, 0.7, 0, 0, 0, 0, 0]",5.578547716140747E-4,287.3318812052409,Molisoles,-7.757600396871567E-4,0.3173758188883464,"{""type"":""Point"",""coordinates"":[-65.0182022,-27.0201218]}"
940,90042,90,5/2/2013,Alberdi,Tucuman,6896-2166,25.5,359,verano,2013-02-04,"[2013-02-04, 2013-02-05, 2013-02-06, 2013-02-07, 2013-02-08, 2013-02-09, 2013-02-10]",false,940,-27.60163,-65.5373,2.13,"[0, 2, 0.2, 0.3, 0, 0, 0.5]",2.5674700736999512E-5,298.17944463094074,Roca,-0.003304596059024334,0.2140814463297526,"{""type"":""Point"",""coordinates"":[-65.5373,-27.601630000000004]}"
941,86140,86,11/3/1991,Quebrachos,Santiago del Estero,36916-7263,27.02,81,verano,1991-03-11,"[1991-03-11, 1991-03-12, 1991-03-13, 1991-03-14, 1991-03-15, 1991-03-16, 1991-03-17]",false,941,-29.79049,-63.18682,3.33,"[1.2, 1.7, 2.9, 0.7, 0.6, 0, 0]",4.5359134674072266E-5,297.73791122436523,Alfisoles,-0.0029058801010251045,0.37871869405110675,"{""type"":""Point"",""coordinates"":[-63.18682,-29.790489999999995]}"
942,86175,86,12/11/2003,San Martin,Santiago del Estero,33116-6456,15.66,135,primavera,2003-11-10,"[2003-11-10, 2003-11-11, 2003-11-12, 2003-11-13, 2003-11-14, 2003-11-15, 2003-11-16]",false,942,-28.2954,-63.86655,2.8,"[0, 0, 2.8, 0, 0, 0, 1.2]",1.519918441772461E-6,301.6802978515625,Alfisoles,-0.0028743837028741837,0.1683680216471354,"{""type"":""Point"",""coordinates"":[-63.86655,-28.2954]}"
943,86168,86,4/6/2000,Salavina,Santiago del Estero,36916-7263,18.29,101,otoño,2000-05-29,"[2000-05-29, 2000-05-30, 2000-05-31, 2000-06-01, 2000-06-02, 2000-06-03, 2000-06-04]",false,943,-29.03431036,-63.33874661,2.14,"[0, 0, 0, 0, 0, 0, 0]",3.2633543014526367E-6,288.59817695617676,Alfisoles,-0.0013438276946544647,0.3157049814860026,"{""type"":""Point"",""coordinates"":[-63.33874661,-29.034310360000003]}"
944,86112,86,20/5/2004,Mitre,Santiago del Estero,37593-7391,10.57,90,otoño,2004-05-17,"[2004-05-17, 2004-05-18, 2004-05-19, 2004-05-20, 2004-05-21, 2004-05-22, 2004-05-23]",true,944,-29.29157166,-63.03450311,1.06,"[0, 0, 0, 0, 0, 2.5, 0.2]",1.6763806343078613E-5,286.54128964742023,Alfisoles,-0.0014567933976650238,0.24115371704101562,"{""type"":""Point"",""coordinates"":[-63.03450311000001,-29.29157166]}"
945,86105,86,28/8/1996,Loreto,Santiago del Estero,33116-6456,8.34,133,invierno,1996-08-26,"[1996-08-26, 1996-08-27, 1996-08-28, 1996-08-29, 1996-08-30, 1996-08-31, 1996-09-01]",true,945,-28.47635326,-64.04507396,2.78,"[0, 0, 0, 0, 0.3, 0, 0]",7.897615432739258E-6,288.2530568440755,Alfisoles,-7.375963032245636E-4,0.1398181915283203,"{""type"":""Point"",""coordinates"":[-64.04507396,-28.47635326]}"
946,86105,86,9/4/2001,Loreto,Santiago del Estero,33116-6456,8.34,133,otoño,2001-04-09,"[2001-04-09, 2001-04-10, 2001-04-11, 2001-04-12, 2001-04-13, 2001-04-14, 2001-04-15]",true,946,-28.47635326,-64.04507396,2.78,"[0, 0, 1.4, 1.1, 0.2, 1.7, 27.3]",1.2287497520446777E-4,294.3594379425049,Alfisoles,-0.002653045579791069,0.3788337707519531,"{""type"":""Point"",""coordinates"":[-64.04507396,-28.47635326]}"
947,86042,86,10/9/2008,Belgrano,Santiago del Estero,6800-2197,12.07,97,invierno,2008-09-08,"[2008-09-08, 2008-09-09, 2008-09-10, 2008-09-11, 2008-09-12, 2008-09-13, 2008-09-14]",true,947,-28.89628,-62.62596,2.97,"[0, 0, 0, 0, 0, 0, 0]",2.5331974029541016E-7,290.7544809977214,Molisoles,-4.932070150971413E-4,0.13530286153157553,"{""type"":""Point"",""coordinates"":[-62.62596,-28.89628]}"
948,86119,86,4/3/1999,Moreno,Santiago del Estero,6804-2223,49.25,157,verano,1999-03-01,"[1999-03-01, 1999-03-02, 1999-03-03, 1999-03-04, 1999-03-05, 1999-03-06, 1999-03-07]",false,948,-27.41385841,-63.06546783,1.4,"[0, 50.1, 1.1, 0.2, 0, 0, 1.7]",2.980232238769531E-7,305.04342524210614,Entisoles,-0.004194878041744232,0.14499918619791666,"{""type"":""Point"",""coordinates"":[-63.06546783,-27.41385841]}"
949,14021,14,3/9/2006,Colon,Cordoba,33948-6745,20.69,355,invierno,2006-08-28,"[2006-08-28, 2006-08-29, 2006-08-30, 2006-08-31, 2006-09-01, 2006-09-02, 2006-09-03]",false,949,-31.25624481,-63.95340394,0.93,"[0, 0, 0, 0, 0.1, 0, 0]",2.473592758178711E-6,285.53820927937824,Miscelaneas,-0.0012544188648462296,0.21394666035970053,"{""type"":""Point"",""coordinates"":[-63.953403939999994,-31.256244809999995]}"
950,74049,74,8/7/1992,Junin,San Luis,34137-6448,58.78,587,invierno,1992-07-06,"[1992-07-06, 1992-07-07, 1992-07-08, 1992-07-09, 1992-07-10, 1992-07-11, 1992-07-12]",false,950,-32.31398017,-65.41102538,2.15,"[0, 0, 0, 0, 0, 0.2, 3.6]",5.960464477539063E-8,275.1728165944417,Entisoles,-7.457314059138298E-4,0.18925158182779947,"{""type"":""Point"",""coordinates"":[-65.41102538,-32.31398017]}"
951,22140,22,14/4/2007,San Fernando,Chaco,6254-1933,11.88,54,otoño,2007-04-09,"[2007-04-09, 2007-04-10, 2007-04-11, 2007-04-12, 2007-04-13, 2007-04-14, 2007-04-15]",true,951,-27.92561531,-59.31798172,2.97,"[0, 0, 9.6, 6.1, 0, 5, 4.2]",7.212162017822266E-6,293.96887079874676,Complejo indiferenci,-0.0029158461838960648,0.3764362335205078,"{""type"":""Point"",""coordinates"":[-59.317981720000006,-27.925615310000005]}"
952,66056,66,26/3/1997,General Jose de San Martin,Salta,6934-2187,25.44,797,otoño,1997-03-24,"[1997-03-24, 1997-03-25, 1997-03-26, 1997-03-27, 1997-03-28, 1997-03-29, 1997-03-30]",false,952,-22.16459982,-63.9088426,0.93,"[1, 3.9, 2, 1.5, 1.1, 0, 0]",0.006049931049346924,290.7623710632324,Molisoles,-0.0021123168990015984,0.4716256459554036,"{""type"":""Point"",""coordinates"":[-63.90884259999999,-22.16459982]}"
953,18021,18,13/7/2009,Capital,Corrientes,6611-2085,6.4,45,invierno,2009-07-13,"[2009-07-13, 2009-07-14, 2009-07-15, 2009-07-16, 2009-07-17, 2009-07-18, 2009-07-19]",true,953,-27.4064,-58.78276,12.77,"[0, 0, 0.6, 0, 0, 0, 0]",7.645785808563232E-5,285.6449597676595,Rio,-0.002330719493329525,0.31778589884440106,"{""type"":""Point"",""coordinates"":[-58.78276,-27.4064]}"
954,66056,66,4/12/1994,General Jose de San Martin,Salta,6934-2187,25.44,797,primavera,1994-11-28,"[1994-11-28, 1994-11-29, 1994-11-30, 1994-12-01, 1994-12-02, 1994-12-03, 1994-12-04]",false,954,-22.16459982,-63.9088426,0.93,"[16.7, 25.9, 0, 0, 0, 6, 27.9]",4.8279762268066406E-5,297.4062309265137,Molisoles,-0.00532198790460825,0.4296550750732422,"{""type"":""Point"",""coordinates"":[-63.90884259999999,-22.16459982]}"
955,86091,86,6/8/2008,Jimnez,Santiago del Estero,32820-6498,23.4,292,invierno,2008-08-04,"[2008-08-04, 2008-08-05, 2008-08-06, 2008-08-07, 2008-08-08, 2008-08-09, 2008-08-10]",false,955,-26.68895431,-64.45447124,5.64,"[0, 0, 0, 0, 0.1, 0, 0]",3.2588839530944824E-5,292.2404899597168,Molisoles,-0.00119856558740139,0.1293646494547526,"{""type"":""Point"",""coordinates"":[-64.45447124,-26.68895431]}"
956,86070,86,23/11/1994,Figueroa,Santiago del Estero,6309-1957,34.35,186,primavera,1994-11-21,"[1994-11-21, 1994-11-22, 1994-11-23, 1994-11-24, 1994-11-25, 1994-11-26, 1994-11-27]",false,956,-26.91460859,-63.52985443,3.47,"[0, 0, 0, 0, 0, 2.1, 0.5]",5.140900611877441E-6,294.78351974487305,Entisoles,-0.006067405454814434,0.29933738708496094,"{""type"":""Point"",""coordinates"":[-63.52985443,-26.914608590000004]}"
957,86056,86,10/3/2003,Copo,Santiago del Estero,6309-1957,42.91,266,verano,2003-03-10,"[2003-03-10, 2003-03-11, 2003-03-12, 2003-03-13, 2003-03-14, 2003-03-15, 2003-03-16]",false,957,-25.72948778,-63.46601397,2.96,"[0, 0, 0, 11.8, 1.1, 33.2, 11.6]",5.5283308029174805E-6,300.17589060465497,Molisoles,-0.004227638244628906,0.37734222412109375,"{""type"":""Point"",""coordinates"":[-63.46601397,-25.72948778]}"
958,86021,86,18/5/1999,Atamisqui,Santiago del Estero,33116-6456,37.58,112,otoño,1999-05-17,"[1999-05-17, 1999-05-18, 1999-05-19, 1999-05-20, 1999-05-21, 1999-05-22, 1999-05-23]",false,958,-28.82072,-63.74698,2.12,"[0.5, 7, 0, 0, 0, 0, 0]",5.723536014556885E-5,291.94354311625165,Alfisoles,-0.0015074899420142174,0.286526362101237,"{""type"":""Point"",""coordinates"":[-63.74697999999999,-28.820720000000005]}"
959,50049,50,19/9/2008,Las Heras,Mendoza,32660-6492,18.88,2682,invierno,2008-09-15,"[2008-09-15, 2008-09-16, 2008-09-17, 2008-09-18, 2008-09-19, 2008-09-20, 2008-09-21]",false,959,-32.24008942,-69.45531464,5.54,"[0, 0, 0, 10.9, 1.8, 0, 0]",4.038214683532715E-6,268.8093630472819,Roca,-2.674013376235962E-4,0.15237553914388022,"{""type"":""Point"",""coordinates"":[-69.45531464,-32.24008942]}"
960,50049,50,24/4/1995,Las Heras,Mendoza,32660-6492,18.88,2682,otoño,1995-04-24,"[1995-04-24, 1995-04-25, 1995-04-26, 1995-04-27, 1995-04-28, 1995-04-29, 1995-04-30]",false,960,-32.24008942,-69.45531464,5.54,"[0, 0, 0, 0.4, 2, 0, 0]",1.4901161193847656E-7,277.8956464131673,Roca,-1.0082963854074478E-4,0.05175654093424479,"{""type"":""Point"",""coordinates"":[-69.45531464,-32.24008942]}"
961,90084,90,25/10/2006,Capital,Tucuman,33966-6506,7.44,453,primavera,2006-10-23,"[2006-10-23, 2006-10-24, 2006-10-25, 2006-10-26, 2006-10-27, 2006-10-28, 2006-10-29]",true,961,-26.82900979,-65.21054418,6.28,"[6.4, 0, 17.5, 21.4, 0, 0.2, 2.8]",2.1150708198547363E-4,296.8274326324463,Molisoles,-0.0039017237722873688,0.3963979085286458,"{""type"":""Point"",""coordinates"":[-65.21054418,-26.829009789999997]}"
962,86070,86,4/9/2014,Figueroa,Santiago del Estero,6309-1957,34.35,186,invierno,2014-09-01,"[2014-09-01, 2014-09-02, 2014-09-03, 2014-09-04, 2014-09-05, 2014-09-06, 2014-09-07]",false,962,-26.91460859,-63.52985443,3.47,"[0.8, 9.6, 5, 2.2, 0.6, 0.3, 0]",4.470348358154297E-8,300.5249780019124,Entisoles,-5.339998751878738E-4,0.13388570149739584,"{""type"":""Point"",""coordinates"":[-63.52985443,-26.914608590000004]}"
963,86070,86,22/2/1995,Figueroa,Santiago del Estero,6309-1957,34.35,186,verano,1995-02-20,"[1995-02-20, 1995-02-21, 1995-02-22, 1995-02-23, 1995-02-24, 1995-02-25, 1995-02-26]",false,963,-26.91460859,-63.52985443,3.47,"[0, 0.3, 15.5, 3.9, 3.1, 0, 0.6]",3.56137752532959E-6,298.8432331085205,Entisoles,-0.0059391167014837265,0.23698743184407553,"{""type"":""Point"",""coordinates"":[-63.52985443,-26.914608590000004]}"
964,86049,86,28/1/2000,Capital,Santiago del Estero,36917-7264,13.33,287,verano,2000-01-24,"[2000-01-24, 2000-01-25, 2000-01-26, 2000-01-27, 2000-01-28, 2000-01-29, 2000-01-30]",true,964,-27.80983349,-64.48893926,0.93,"[16.2, 0, 0, 0, 0, 2.5, 5.9]",3.123432397842407E-4,297.81346956888837,Alfisoles,-0.0033506965264678,0.2933158874511719,"{""type"":""Point"",""coordinates"":[-64.48893926,-27.809833490000003]}"
965,86049,86,6/8/1994,Capital,Santiago del Estero,36917-7264,13.33,287,invierno,1994-08-01,"[1994-08-01, 1994-08-02, 1994-08-03, 1994-08-04, 1994-08-05, 1994-08-06, 1994-08-07]",true,965,-27.80983349,-64.48893926,0.93,"[0.2, 0, 0, 0, 0, 0, 2.5]",1.7274916172027588E-4,286.0609588623047,Alfisoles,-0.0012744609266519547,0.14294751485188803,"{""type"":""Point"",""coordinates"":[-64.48893926,-27.809833490000003]}"
966,86035,86,16/11/1993,Banda,Santiago del Estero,36917-7264,0.64,223,primavera,1993-11-15,"[1993-11-15, 1993-11-16, 1993-11-17, 1993-11-18, 1993-11-19, 1993-11-20, 1993-11-21]",true,966,-27.59548811,-64.41117012,1.4,"[0.1, 4.4, 0, 0, 0, 0, 0.9]",9.02414321899414E-5,293.17626571655273,Alfisoles,-0.0026541082188487053,0.3233795166015625,"{""type"":""Point"",""coordinates"":[-64.41117012,-27.595488109999998]}"
967,86035,86,6/12/2007,Banda,Santiago del Estero,36917-7264,0.64,223,primavera,2007-12-03,"[2007-12-03, 2007-12-04, 2007-12-05, 2007-12-06, 2007-12-07, 2007-12-08, 2007-12-09]",true,967,-27.59548811,-64.41117012,1.4,"[0.1, 15.3, 3.9, 0, 0, 2.4, 9.4]",3.153085708618164E-5,298.99223645528156,Alfisoles,-0.002698163501918316,0.3226312001546224,"{""type"":""Point"",""coordinates"":[-64.41117012,-27.595488109999998]}"
968,86014,86,19/2/2010,Alberdi,Santiago del Estero,6855-2224,89.3,176,verano,2010-02-15,"[2010-02-15, 2010-02-16, 2010-02-17, 2010-02-18, 2010-02-19, 2010-02-20, 2010-02-21]",false,968,-26.78946686,-62.70516586,4.17,"[59.5, 0, 0.4, 0.1, 0, 29.1, 49.1]",0.010379940271377563,298.643513361613,Entisoles,-0.004181930795311928,0.34546788533528644,"{""type"":""Point"",""coordinates"":[-62.70516586,-26.789466860000005]}"
969,86014,86,9/6/1990,Alberdi,Santiago del Estero,6855-2224,89.3,176,otoño,1990-06-04,"[1990-06-04, 1990-06-05, 1990-06-06, 1990-06-07, 1990-06-08, 1990-06-09, 1990-06-10]",false,969,-26.78946686,-62.70516586,4.17,"[0.1, 0, 0, 0, 0, 0, 0]",3.7997961044311523E-6,287.78363100687665,Entisoles,-7.744599133729935E-4,0.23828951517740884,"{""type"":""Point"",""coordinates"":[-62.70516586,-26.789466860000005]}"
970,86014,86,28/11/1999,Alberdi,Santiago del Estero,6855-2224,89.3,176,primavera,1999-11-22,"[1999-11-22, 1999-11-23, 1999-11-24, 1999-11-25, 1999-11-26, 1999-11-27, 1999-11-28]",false,970,-26.78946686,-62.70516586,4.17,"[0.2, 0, 0, 11.7, 0, 0, 0]",4.76837158203125E-7,299.9326171875,Entisoles,-0.0019562076777219772,0.18544387817382812,"{""type"":""Point"",""coordinates"":[-62.70516586,-26.789466860000005]}"
971,86014,86,5/9/1996,Alberdi,Santiago del Estero,6855-2224,89.3,176,invierno,1996-09-02,"[1996-09-02, 1996-09-03, 1996-09-04, 1996-09-05, 1996-09-06, 1996-09-07, 1996-09-08]",false,971,-26.78946686,-62.70516586,4.17,"[0, 0, 0, 0, 0, 2.7, 4.3]",4.470348358154297E-8,293.65602048238117,Entisoles,-1.8878839910030365E-4,0.13667996724446616,"{""type"":""Point"",""coordinates"":[-62.70516586,-26.789466860000005]}"
972,86014,86,22/1/2001,Alberdi,Santiago del Estero,6855-2224,89.3,176,verano,2001-01-22,"[2001-01-22, 2001-01-23, 2001-01-24, 2001-01-25, 2001-01-26, 2001-01-27, 2001-01-28]",false,972,-26.78946686,-62.70516586,4.17,"[23.7, 19.4, 9.5, 6.2, 1.7, 0.5, 3]",0.007891684770584106,297.66467157999676,Entisoles,-0.003768675960600376,0.377560297648112,"{""type"":""Point"",""coordinates"":[-62.70516586,-26.789466860000005]}"
973,02010,2,28/11/2000,Comuna 10,Capital Federal,36837-7237,4.71,24,primavera,2000-11-27,"[2000-11-27, 2000-11-28, 2000-11-29, 2000-11-30, 2000-12-01, 2000-12-02, 2000-12-03]",true,973,-34.62768629,-58.48358728,1.46,"[1.3, 0, 0, 0, 0, 0, 0.4]",9.055435657501221E-4,296.3063500722249,Miscelaneas,-0.00439075194299221,0.3299274444580078,"{""type"":""Point"",""coordinates"":[-58.48358728,-34.62768628999999]}"
974,02013,2,14/3/2015,Comuna 13,Capital Federal,54-54,3.99,10,verano,2015-03-09,"[2015-03-09, 2015-03-10, 2015-03-11, 2015-03-12, 2015-03-13, 2015-03-14, 2015-03-15]",true,974,-34.55488152,-58.4502891,3.85,"[0, 0.1, 0, 0, 0, 1.2, 0]",3.288835287094116E-4,297.2952798207601,Miscelaneas,-0.0033170972019433975,0.23868115743001303,"{""type"":""Point"",""coordinates"":[-58.4502891,-34.55488152]}"
975,02014,2,27/5/1999,Comuna 14,Capital Federal,85-85,2.68,24,otoño,1999-05-24,"[1999-05-24, 1999-05-25, 1999-05-26, 1999-05-27, 1999-05-28, 1999-05-29, 1999-05-30]",true,975,-34.57389998,-58.42243645,5.28,"[0, 0, 0, 0, 14.6, 2.4, 0]",2.8073787689208984E-4,284.5727736155192,Miscelaneas,-0.0012578796595335007,0.34527587890625,"{""type"":""Point"",""coordinates"":[-58.42243645,-34.57389997999999]}"
976,02009,2,26/6/1990,Comuna 9,Capital Federal,36837-7237,4.96,32,invierno,1990-06-25,"[1990-06-25, 1990-06-26, 1990-06-27, 1990-06-28, 1990-06-29, 1990-06-30, 1990-07-01]",true,976,-34.64379608,-58.5191299,1.85,"[0, 0, 0, 0, 0, 0, 0]",4.265308380126953E-4,281.17768414815265,Miscelaneas,-9.143799543380737E-4,0.32290903727213544,"{""type"":""Point"",""coordinates"":[-58.51912990000001,-34.64379608]}"
977,02011,2,23/7/2003,Comuna 11,Capital Federal,36837-7237,3.14,29,invierno,2003-07-21,"[2003-07-21, 2003-07-22, 2003-07-23, 2003-07-24, 2003-07-25, 2003-07-26, 2003-07-27]",true,977,-34.6042463,-58.49067643,2.78,"[0, 0.3, 0.2, 0, 0, 0.1, 15.4]",0.0011748969554901123,282.27596219380695,Miscelaneas,-0.002117721363902092,0.3777612050374349,"{""type"":""Point"",""coordinates"":[-58.49067643,-34.60424629999999]}"
978,02007,2,15/3/1991,Comuna 7,Capital Federal,36837-7237,7.04,22,verano,1991-03-11,"[1991-03-11, 1991-03-12, 1991-03-13, 1991-03-14, 1991-03-15, 1991-03-16, 1991-03-17]",true,978,-34.63680708,-58.45826985,2.25,"[0, 0, 0.8, 0, 0, 0, 0.1]",3.8166344165802E-4,293.2080446879069,Miscelaneas,-0.003378714434802532,0.31658299763997394,"{""type"":""Point"",""coordinates"":[-58.45826984999999,-34.63680708]}"
979,02013,2,17/12/2002,Comuna 13,Capital Federal,54-54,3.99,10,primavera,2002-12-16,"[2002-12-16, 2002-12-17, 2002-12-18, 2002-12-19, 2002-12-20, 2002-12-21, 2002-12-22]",true,979,-34.55488152,-58.4502891,3.85,"[0.5, 0, 0.6, 21.6, 0, 0, 31.5]",0.0010067522525787354,298.39271545410156,Miscelaneas,-0.005265306681394577,0.20977210998535156,"{""type"":""Point"",""coordinates"":[-58.4502891,-34.55488152]}"
980,02006,2,25/6/2003,Comuna 6,Capital Federal,85-85,5.9,32,invierno,2003-06-23,"[2003-06-23, 2003-06-24, 2003-06-25, 2003-06-26, 2003-06-27, 2003-06-28, 2003-06-29]",true,980,-34.6168255,-58.44360311,5.01,"[6.8, 0, 4.3, 12, 42.4, 0.1, 0]",5.130767822265625E-4,287.6223023732503,Miscelaneas,-0.0016122125089168549,0.4406960805257161,"{""type"":""Point"",""coordinates"":[-58.44360310999999,-34.6168255]}"
981,66133,66,25/9/2003,Rivadavia,Salta,6362-1978,14.31,246,primavera,2003-09-22,"[2003-09-22, 2003-09-23, 2003-09-24, 2003-09-25, 2003-09-26, 2003-09-27, 2003-09-28]",true,981,-22.49881,-62.40759,1,"[0, 2.3, 4.7, 1.8, 22.4, 0, 10.9]",4.470348358154297E-8,306.43810780843097,Molisoles,-3.626011312007904E-4,0.12706311543782553,"{""type"":""Point"",""coordinates"":[-62.40759,-22.498810000000002]}"
982,66133,66,21/11/2006,Rivadavia,Salta,6362-1978,14.31,246,primavera,2006-11-20,"[2006-11-20, 2006-11-21, 2006-11-22, 2006-11-23, 2006-11-24, 2006-11-25, 2006-11-26]",true,982,-22.49881,-62.40759,1,"[0, 0, 0, 19.3, 7.2, 0.5, 0.1]",2.9802322387695312E-8,296.93130111694336,Molisoles,-0.0015190811827778816,0.16143099466959634,"{""type"":""Point"",""coordinates"":[-62.40759,-22.498810000000002]}"
983,66035,66,20/3/2013,Cerrillos,Salta,8141-2593,9.28,1166,verano,2013-03-18,"[2013-03-18, 2013-03-19, 2013-03-20, 2013-03-21, 2013-03-22, 2013-03-23, 2013-03-24]",true,983,-24.95319832,-65.42243492,2.76,"[4.4, 2.9, 0, 0, 0.3, 4.9, 0.1]",1.9069015979766846E-4,286.9179178873698,Alfisoles,-0.00276753306388855,0.5081672668457031,"{""type"":""Point"",""coordinates"":[-65.42243492,-24.953198319999995]}"
984,66028,66,28/9/2004,Capital,Salta,6351-1974,15.04,1377,primavera,2004-09-27,"[2004-09-27, 2004-09-28, 2004-09-29, 2004-09-30, 2004-10-01, 2004-10-02, 2004-10-03]",false,984,-24.70494203,-65.47051055,1.02,"[0.6, 16.9, 26.9, 8.5, 3, 0, 0]",4.13358211517334E-4,291.23669751485187,Inceptisoles,-0.0029343431815505028,0.41027069091796875,"{""type"":""Point"",""coordinates"":[-65.47051055,-24.70494203]}"
985,82063,82,19/3/1992,La Capital,Santa Fe,103-103,23.73,25,verano,1992-03-16,"[1992-03-16, 1992-03-17, 1992-03-18, 1992-03-19, 1992-03-20, 1992-03-21, 1992-03-22]",false,985,-31.18858147,-60.62677383,2.15,"[0, 0, 0, 0, 13, 45.8, 0]",1.7796456813812256E-4,298.1095898946126,Molisoles,-0.00420098751783371,0.4092852274576823,"{""type"":""Point"",""coordinates"":[-60.62677383,-31.18858147]}"
986,82049,82,1/11/1991,General Obligado,Santa Fe,32822-6509,17.99,58,primavera,1991-10-28,"[1991-10-28, 1991-10-29, 1991-10-30, 1991-10-31, 1991-11-01, 1991-11-02, 1991-11-03]",false,986,-28.6765561,-59.7497004,1.41,"[7.9, 7.5, 5.7, 1, 0, 0, 0]",5.82963228225708E-4,296.4314715067546,Alfisoles,-0.0031037740409374237,0.4551868438720703,"{""type"":""Point"",""coordinates"":[-59.7497004,-28.676556099999996]}"
987,90056,90,21/4/1990,Leales,Tucuman,37530-7378,13.29,336,otoño,1990-04-16,"[1990-04-16, 1990-04-17, 1990-04-18, 1990-04-19, 1990-04-20, 1990-04-21, 1990-04-22]",true,987,-27.14003944,-65.13464356,1.85,"[1, 17.9, 0, 0, 0, 0, 4.8]",1.6547739505767822E-4,297.66736602783203,Molisoles,-0.002085925079882145,0.37078285217285156,"{""type"":""Point"",""coordinates"":[-65.13464356,-27.14003944]}"
988,90014,90,2/2/2000,Cruz Alta,Tucuman,33966-6506,21.31,370,verano,2000-01-31,"[2000-01-31, 2000-02-01, 2000-02-02, 2000-02-03, 2000-02-04, 2000-02-05, 2000-02-06]",false,988,-27.0201218,-65.0182022,1.85,"[1, 0.2, 19.5, 6.1, 0, 0.6, 22.1]",1.1795759201049805E-4,297.98180389404297,Molisoles,-0.004956084303557873,0.42351404825846356,"{""type"":""Point"",""coordinates"":[-65.0182022,-27.0201218]}"
989,90014,90,16/11/1998,Cruz Alta,Tucuman,33966-6506,21.31,370,primavera,1998-11-16,"[1998-11-16, 1998-11-17, 1998-11-18, 1998-11-19, 1998-11-20, 1998-11-21, 1998-11-22]",false,989,-27.0201218,-65.0182022,1.85,"[10.4, 2.3, 0, 0, 0, 0, 0]",2.9115378856658936E-4,295.5356381734212,Molisoles,-0.0018024537712335587,0.41694196065266925,"{""type"":""Point"",""coordinates"":[-65.0182022,-27.0201218]}"
990,90014,90,23/10/1994,Cruz Alta,Tucuman,33966-6506,21.31,370,primavera,1994-10-17,"[1994-10-17, 1994-10-18, 1994-10-19, 1994-10-20, 1994-10-21, 1994-10-22, 1994-10-23]",false,990,-27.0201218,-65.0182022,1.85,"[4.6, 0, 0, 13.3, 10.4, 4.1, 0.4]",1.628100872039795E-4,291.83008575439453,Molisoles,-0.0021480340510606766,0.3294836680094401,"{""type"":""Point"",""coordinates"":[-65.0182022,-27.0201218]}"
991,90070,90,4/3/2002,Monteros,Tucuman,6759-2167,13.31,350,verano,2002-03-04,"[2002-03-04, 2002-03-05, 2002-03-06, 2002-03-07, 2002-03-08, 2002-03-09, 2002-03-10]",true,991,-27.13862419,-65.44361877,4.74,"[3, 32.1, 7.5, 3.1, 3.7, 7.7, 5]",0.001339152455329895,298.68046379089355,Roca,-0.003861676901578903,0.38815053304036456,"{""type"":""Point"",""coordinates"":[-65.44361877,-27.13862419]}"
992,90070,90,25/5/2013,Monteros,Tucuman,6759-2167,13.31,350,otoño,2013-05-20,"[2013-05-20, 2013-05-21, 2013-05-22, 2013-05-23, 2013-05-24, 2013-05-25, 2013-05-26]",true,992,-27.13862419,-65.44361877,4.74,"[0, 0, 0, 0, 0, 0, 0]",2.7026236057281494E-4,285.54655774434406,Roca,-0.0018294472247362137,0.32450103759765625,"{""type"":""Point"",""coordinates"":[-65.44361877,-27.13862419]}"
993,90014,90,6/8/2014,Cruz Alta,Tucuman,33966-6506,21.31,370,invierno,2014-08-04,"[2014-08-04, 2014-08-05, 2014-08-06, 2014-08-07, 2014-08-08, 2014-08-09, 2014-08-10]",false,993,-27.0201218,-65.0182022,1.85,"[0.6, 0, 0, 0, 0, 0, 0]",5.990266799926758E-6,290.8287665049235,Molisoles,-0.0012742150574922562,0.23908170064290366,"{""type"":""Point"",""coordinates"":[-65.0182022,-27.0201218]}"
994,90007,90,12/8/2012,Burruyacu,Tucuman,32820-6498,30.8,763,invierno,2012-08-06,"[2012-08-06, 2012-08-07, 2012-08-08, 2012-08-09, 2012-08-10, 2012-08-11, 2012-08-12]",false,994,-26.36994,-64.78136,5.48,"[0, 1.6, 0, 0, 0, 0, 0]",3.007352352142334E-4,286.17511622111004,Entisoles,-0.0014381203800439835,0.36751556396484375,"{""type"":""Point"",""coordinates"":[-64.78136,-26.36994]}"
995,90007,90,25/2/1999,Burruyacu,Tucuman,32820-6498,30.8,763,verano,1999-02-22,"[1999-02-22, 1999-02-23, 1999-02-24, 1999-02-25, 1999-02-26, 1999-02-27, 1999-02-28]",false,995,-26.36994,-64.78136,5.48,"[11.5, 23.1, 1, 0.8, 11.7, 9.4, 0]",0.005096420645713806,296.59071159362793,Entisoles,-0.005578207783401012,0.48213768005371094,"{""type"":""Point"",""coordinates"":[-64.78136,-26.36994]}"
996,34007,34,25/10/1998,Bermejo,Formosa,33977-6576,27.95,164,primavera,1998-10-19,"[1998-10-19, 1998-10-20, 1998-10-21, 1998-10-22, 1998-10-23, 1998-10-24, 1998-10-25]",false,996,-23.75578308,-61.17063904,1.01,"[0, 0, 0, 0, 21.4, 16.2, 2.9]",2.9802322387695312E-8,299.05215009053546,Rio,-0.0033402834087610245,0.22446123758951822,"{""type"":""Point"",""coordinates"":[-61.17063904,-23.755783079999997]}"
997,34063,34,25/9/2005,Ramon Lista,Formosa,33909-6556,7.68,204,invierno,2005-09-19,"[2005-09-19, 2005-09-20, 2005-09-21, 2005-09-22, 2005-09-23, 2005-09-24, 2005-09-25]",true,997,-23.18007636,-62.03032748,1.37,"[0, 0, 0, 0, 0, 3.5, 0.9]",1.4901161193847656E-7,292.7519874572754,Rio,-9.102746844291687E-4,0.14757283528645834,"{""type"":""Point"",""coordinates"":[-62.03032747999999,-23.18007636]}"
998,34063,34,5/4/2010,Ramon Lista,Formosa,33909-6556,7.68,204,otoño,2010-04-05,"[2010-04-05, 2010-04-06, 2010-04-07, 2010-04-08, 2010-04-09, 2010-04-10, 2010-04-11]",true,998,-23.18007636,-62.03032748,1.37,"[1.5, 0, 0, 0, 0, 0, 0]",8.478760719299316E-6,291.5071627298991,Rio,-0.0021485332399606705,0.28774388631184894,"{""type"":""Point"",""coordinates"":[-62.03032747999999,-23.18007636]}"
999,86175,86,11/2/2000,San Martin,Santiago del Estero,33116-6456,15.66,135,verano,2000-02-07,"[2000-02-07, 2000-02-08, 2000-02-09, 2000-02-10, 2000-02-11, 2000-02-12, 2000-02-13]",false,999,-28.2954,-63.86655,2.8,"[0, 14, 0.3, 5.6, 4.1, 13.9, 49.8]",1.6242265701293945E-6,300.6814594268799,Alfisoles,-0.00503929890692234,0.30001258850097656,"{""type"":""Point"",""coordinates"":[-63.86655,-28.2954]}"
1000,86168,86,25/12/2010,Salavina,Santiago del Estero,36916-7263,18.29,101,primavera,2010-12-20,"[2010-12-20, 2010-12-21, 2010-12-22, 2010-12-23, 2010-12-24, 2010-12-25, 2010-12-26]",false,1000,-29.03431036,-63.33874661,2.14,"[3.6, 0.2, 2.3, 0.5, 16.2, 0, 0]",1.2695789337158203E-5,298.29722277323407,Alfisoles,-0.0028442805632948875,0.1629937489827474,"{""type"":""Point"",""coordinates"":[-63.33874661,-29.034310360000003]}"
1001,86105,86,16/2/1990,Loreto,Santiago del Estero,33116-6456,8.34,133,verano,1990-02-12,"[1990-02-12, 1990-02-13, 1990-02-14, 1990-02-15, 1990-02-16, 1990-02-17, 1990-02-18]",true,1001,-28.47635326,-64.04507396,2.78,"[0.7, 0, 0, 0, 0, 0, 4.9]",9.775161743164062E-6,297.9609889984131,Alfisoles,-0.0033629555255174637,0.35815175374348956,"{""type"":""Point"",""coordinates"":[-64.04507396,-28.47635326]}"
1002,86021,86,4/12/1993,Atamisqui,Santiago del Estero,33116-6456,37.58,112,primavera,1993-11-29,"[1993-11-29, 1993-11-30, 1993-12-01, 1993-12-02, 1993-12-03, 1993-12-04, 1993-12-05]",false,1002,-28.82072,-63.74698,2.12,"[0.3, 14.7, 0, 0, 0, 0, 0]",5.7891011238098145E-5,299.37056096394855,Alfisoles,-0.003464645706117153,0.23315747578938803,"{""type"":""Point"",""coordinates"":[-63.74697999999999,-28.820720000000005]}"
1003,66133,66,9/2/2003,Rivadavia,Salta,6362-1978,14.31,246,verano,2003-02-03,"[2003-02-03, 2003-02-04, 2003-02-05, 2003-02-06, 2003-02-07, 2003-02-08, 2003-02-09]",true,1003,-22.49881,-62.40759,1,"[0.2, 0, 0, 0, 1.8, 11.8, 3.6]",5.811452865600586E-7,303.96929359436035,Molisoles,-0.004689427092671394,0.16513379414876303,"{""type"":""Point"",""coordinates"":[-62.40759,-22.498810000000002]}"
1004,66133,66,22/4/2008,Rivadavia,Salta,6362-1978,14.31,246,otoño,2008-04-21,"[2008-04-21, 2008-04-22, 2008-04-23, 2008-04-24, 2008-04-25, 2008-04-26, 2008-04-27]",true,1004,-22.49881,-62.40759,1,"[0, 0.3, 1.4, 0.5, 0, 0, 0]",8.940696716308594E-8,296.3013292948405,Molisoles,-0.00336618535220623,0.2374089558919271,"{""type"":""Point"",""coordinates"":[-62.40759,-22.498810000000002]}"
1005,66133,66,4/8/1990,Rivadavia,Salta,6362-1978,14.31,246,invierno,1990-07-30,"[1990-07-30, 1990-07-31, 1990-08-01, 1990-08-02, 1990-08-03, 1990-08-04, 1990-08-05]",true,1005,-22.49881,-62.40759,1,"[0, 0, 0, 0, 0, 0, 0]",3.8743019104003906E-7,286.1394863128662,Molisoles,-8.270908147096634E-4,0.1475830078125,"{""type"":""Point"",""coordinates"":[-62.40759,-22.498810000000002]}"
1006,66133,66,26/12/2009,Rivadavia,Salta,6362-1978,14.31,246,verano,2009-12-21,"[2009-12-21, 2009-12-22, 2009-12-23, 2009-12-24, 2009-12-25, 2009-12-26, 2009-12-27]",true,1006,-22.49881,-62.40759,1,"[5.2, 0.5, 0, 0, 0.2, 0, 0.4]",2.1323561668395996E-5,300.8203932444255,Molisoles,-0.00446617417037487,0.28642845153808594,"{""type"":""Point"",""coordinates"":[-62.40759,-22.498810000000002]}"
1007,66133,66,17/1/2005,Rivadavia,Salta,6362-1978,14.31,246,verano,2005-01-17,"[2005-01-17, 2005-01-18, 2005-01-19, 2005-01-20, 2005-01-21, 2005-01-22, 2005-01-23]",true,1007,-22.49881,-62.40759,1,"[0, 0, 0, 0, 0, 0, 14]",2.9802322387695312E-8,299.8896058400472,Molisoles,-0.006131613627076149,0.28946495056152344,"{""type"":""Point"",""coordinates"":[-62.40759,-22.498810000000002]}"
1008,66133,66,17/12/2007,Rivadavia,Salta,6362-1978,14.31,246,primavera,2007-12-17,"[2007-12-17, 2007-12-18, 2007-12-19, 2007-12-20, 2007-12-21, 2007-12-22, 2007-12-23]",true,1008,-22.49881,-62.40759,1,"[34.5, 0.7, 0, 0, 0, 0, 0]",0.006891191005706787,292.4701722462972,Molisoles,-0.0028274133801460266,0.42246119181315106,"{""type"":""Point"",""coordinates"":[-62.40759,-22.498810000000002]}"
1009,66161,66,15/1/2014,Santa Victoria,Salta,36860-7249,4.53,2511,verano,2014-01-13,"[2014-01-13, 2014-01-14, 2014-01-15, 2014-01-16, 2014-01-17, 2014-01-18, 2014-01-19]",true,1009,-22.17502,-64.93502,19.09,"[4.5, 10.6, 3.6, 0.4, 3.8, 14, 9]",0.0031803250312805176,284.9839350382487,Roca,-0.002980954945087433,0.4788169860839844,"{""type"":""Point"",""coordinates"":[-64.93502,-22.17502]}"
1010,66070,66,11/4/2000,Iruya,Salta,32945-6436,9.1,3403,otoño,2000-04-10,"[2000-04-10, 2000-04-11, 2000-04-12, 2000-04-13, 2000-04-14, 2000-04-15, 2000-04-16]",true,1010,-22.7747986,-65.14338644,5.55,"[0.7, 3.2, 14.6, 0, 0.3, 1.4, 2.9]",0.003377258777618408,286.22857729593915,Roca,-0.002431018278002739,0.45209821065266925,"{""type"":""Point"",""coordinates"":[-65.14338644,-22.774798600000004]}"
1011,86049,86,17/1/2011,Capital,Santiago del Estero,36917-7264,13.33,287,verano,2011-01-17,"[2011-01-17, 2011-01-18, 2011-01-19, 2011-01-20, 2011-01-21, 2011-01-22, 2011-01-23]",true,1011,-27.80983349,-64.48893926,0.93,"[13.8, 0, 0.6, 14.2, 0, 1.6, 1.7]",1.2943148612976074E-4,296.43730608622235,Alfisoles,-0.0027613388374447823,0.22455342610677084,"{""type"":""Point"",""coordinates"":[-64.48893926,-27.809833490000003]}"
1012,38112,38,7/6/2000,Yavi,Jujuy,6324-1963,26.12,3815,otoño,2000-06-05,"[2000-06-05, 2000-06-06, 2000-06-07, 2000-06-08, 2000-06-09, 2000-06-10, 2000-06-11]",false,1012,-22.32981174,-65.82598231,3.53,"[0, 0, 0, 0, 0, 0, 0]",1.33514404296875E-5,276.61329142252606,Aridisoles,-1.366790384054184E-4,0.04801368713378906,"{""type"":""Point"",""coordinates"":[-65.82598231,-22.32981174]}"
1013,38094,38,2/5/2004,Tilcara,Jujuy,32945-6436,43.06,2663,otoño,2004-04-26,"[2004-04-26, 2004-04-27, 2004-04-28, 2004-04-29, 2004-04-30, 2004-05-01, 2004-05-02]",false,1013,-23.77525242,-65.29804781,15.83,"[2.6, 0, 0.3, 3.2, 1.1, 0, 0.1]",0.003965631127357483,280.8220507303874,Aridisoles,-0.0018167877569794655,0.4877936045328776,"{""type"":""Point"",""coordinates"":[-65.29804781,-23.775252419999997]}"
1014,38094,38,2/12/2013,Tilcara,Jujuy,32945-6436,43.06,2663,primavera,2013-12-02,"[2013-12-02, 2013-12-03, 2013-12-04, 2013-12-05, 2013-12-06, 2013-12-07, 2013-12-08]",false,1014,-23.77525242,-65.29804781,15.83,"[6.8, 1, 11.7, 3.5, 12.9, 8.5, 12.8]",5.895644426345825E-4,287.81456565856934,Aridisoles,-0.004517916589975357,0.46971384684244794,"{""type"":""Point"",""coordinates"":[-65.29804781,-23.775252419999997]}"
1015,38028,38,2/2/2010,Humahuaca,Jujuy,32945-6436,25.12,3533,verano,2010-02-01,"[2010-02-01, 2010-02-02, 2010-02-03, 2010-02-04, 2010-02-05, 2010-02-06, 2010-02-07]",false,1015,-22.96907829,-65.43667552,7.45,"[8.9, 6.9, 0, 0, 1.6, 0, 0]",5.9507787227630615E-5,285.5564428965251,Roca,-0.00246315635740757,0.30916913350423175,"{""type"":""Point"",""coordinates"":[-65.43667552,-22.96907829]}"
1016,90098,90,9/4/2006,Tafi del Valle,Tucuman,37013-7286,26.86,2318,otoño,2006-04-03,"[2006-04-03, 2006-04-04, 2006-04-05, 2006-04-06, 2006-04-07, 2006-04-08, 2006-04-09]",false,1016,-26.596217,-65.8573856,7.28,"[6.3, 5.1, 0.2, 3, 2, 10, 0]",1.9727647304534912E-4,287.6664326985677,Roca,-0.002107067033648491,0.4428094228108724,"{""type"":""Point"",""coordinates"":[-65.8573856,-26.596217000000003]}"
1017,90077,90,26/5/1991,Rio Chico,Tucuman,6896-2166,16.62,376,otoño,1991-05-20,"[1991-05-20, 1991-05-21, 1991-05-22, 1991-05-23, 1991-05-24, 1991-05-25, 1991-05-26]",false,1017,-27.4543092,-65.603622,9.42,"[24.9, 2.8, 0.8, 0, 0, 5.8, 2.3]",0.011253416538238525,289.86810938517254,Roca,-5.172602832317352E-4,0.42815907796223956,"{""type"":""Point"",""coordinates"":[-65.603622,-27.4543092]}"
1018,90091,90,28/3/1991,Simoca,Tucuman,32292-6460,1.11,309,otoño,1991-03-25,"[1991-03-25, 1991-03-26, 1991-03-27, 1991-03-28, 1991-03-29, 1991-03-30, 1991-03-31]",true,1018,-27.40925026,-65.26894379,3.85,"[28.8, 22.1, 3.2, 1.2, 0.5, 2.8, 25]",0.009254410862922668,296.8300088246663,Entisoles,-0.002667761407792568,0.40516090393066406,"{""type"":""Point"",""coordinates"":[-65.26894379,-27.409250260000004]}"
1019,90091,90,23/3/1992,Simoca,Tucuman,32292-6460,1.11,309,otoño,1992-03-23,"[1992-03-23, 1992-03-24, 1992-03-25, 1992-03-26, 1992-03-27, 1992-03-28, 1992-03-29]",true,1019,-27.40925026,-65.26894379,3.85,"[0, 0, 0.1, 5.2, 15.1, 0.5, 0]",5.044490098953247E-4,290.9457092285156,Entisoles,-0.003781210631132126,0.3769601186116536,"{""type"":""Point"",""coordinates"":[-65.26894379,-27.409250260000004]}"
1020,90070,90,15/4/2006,Monteros,Tucuman,6759-2167,13.31,350,otoño,2006-04-10,"[2006-04-10, 2006-04-11, 2006-04-12, 2006-04-13, 2006-04-14, 2006-04-15, 2006-04-16]",true,1020,-27.13862419,-65.44361877,4.74,"[0, 0, 0.1, 2.1, 12.2, 0.2, 0.1]",0.0021079927682876587,292.4222768147786,Roca,-0.0029678139835596085,0.3901691436767578,"{""type"":""Point"",""coordinates"":[-65.44361877,-27.13862419]}"
1021,90049,90,19/6/1999,La Cocha,Tucuman,33832-6763,27.69,458,otoño,1999-06-14,"[1999-06-14, 1999-06-15, 1999-06-16, 1999-06-17, 1999-06-18, 1999-06-19, 1999-06-20]",false,1021,-27.75605583,-65.59912109,0.93,"[0, 0, 3.8, 3.8, 2.3, 0.2, 0]",0.0036646127700805664,283.8108774820964,Roca,-0.001507841981947422,0.3623797098795573,"{""type"":""Point"",""coordinates"":[-65.59912109000001,-27.75605583]}"
1022,90021,90,3/3/1995,Chicligasta,Tucuman,32679-6504,18.33,349,verano,1995-02-27,"[1995-02-27, 1995-02-28, 1995-03-01, 1995-03-02, 1995-03-03, 1995-03-04, 1995-03-05]",false,1022,-27.3126707,-65.4820785,2.28,"[3.1, 20.2, 6.4, 7.8, 10.6, 18.5, 21.4]",0.0026174038648605347,294.74855041503906,Roca,-0.0033413469791412354,0.4180564880371094,"{""type"":""Point"",""coordinates"":[-65.4820785,-27.3126707]}"
1023,90042,90,1/7/2007,Alberdi,Tucuman,6896-2166,25.5,359,invierno,2007-06-25,"[2007-06-25, 2007-06-26, 2007-06-27, 2007-06-28, 2007-06-29, 2007-06-30, 2007-07-01]",false,1023,-27.60163,-65.5373,2.13,"[2.1, 0, 0, 0, 0, 0, 0]",4.2776763439178467E-4,281.0324230194092,Roca,-0.002024281769990921,0.3673699696858724,"{""type"":""Point"",""coordinates"":[-65.5373,-27.601630000000004]}"
1024,90119,90,13/8/1996,Yerba Buena,Tucuman,33966-6506,13.99,569,invierno,1996-08-12,"[1996-08-12, 1996-08-13, 1996-08-14, 1996-08-15, 1996-08-16, 1996-08-17, 1996-08-18]",true,1024,-26.77896396,-65.28532084,4.25,"[0, 0, 0, 0, 0, 0, 0]",0.001050308346748352,287.5830256144206,Molisoles,-0.002466246485710144,0.2508563995361328,"{""type"":""Point"",""coordinates"":[-65.28532084,-26.778963959999995]}"
1025,90105,90,10/10/2001,Tafi Viejo,Tucuman,6759-2167,15.47,1798,primavera,2001-10-08,"[2001-10-08, 2001-10-09, 2001-10-10, 2001-10-11, 2001-10-12, 2001-10-13, 2001-10-14]",false,1025,-26.74196322,-65.56315645,3.47,"[1.4, 0, 0.4, 0.6, 1.7, 4.6, 2.6]",6.892979145050049E-4,282.02479489644367,Molisoles,-0.002594233490526676,0.39276123046875,"{""type"":""Point"",""coordinates"":[-65.56315645,-26.74196322]}"
1026,90063,90,21/2/2002,Lules,Tucuman,33520-6650,8.65,394,verano,2002-02-18,"[2002-02-18, 2002-02-19, 2002-02-20, 2002-02-21, 2002-02-22, 2002-02-23, 2002-02-24]",true,1026,-26.94954,-65.30289,1.39,"[19.8, 7.2, 2.6, 3.5, 0, 0, 0.1]",0.011798650026321411,294.8374767303467,Inceptisoles,-0.0024960478767752647,0.4339129130045573,"{""type"":""Point"",""coordinates"":[-65.30289,-26.949540000000002]}"
1027,90063,90,1/7/1996,Lules,Tucuman,33520-6650,8.65,394,invierno,1996-07-01,"[1996-07-01, 1996-07-02, 1996-07-03, 1996-07-04, 1996-07-05, 1996-07-06, 1996-07-07]",true,1027,-26.94954,-65.30289,1.39,"[0, 0, 0, 0, 0, 0, 0]",0.0011178851127624512,281.4987335205078,Inceptisoles,-0.0015533771365880966,0.4015572865804036,"{""type"":""Point"",""coordinates"":[-65.30289,-26.949540000000002]}"
1028,90056,90,2/7/1993,Leales,Tucuman,37530-7378,13.29,336,invierno,1993-06-28,"[1993-06-28, 1993-06-29, 1993-06-30, 1993-07-01, 1993-07-02, 1993-07-03, 1993-07-04]",true,1028,-27.14003944,-65.13464356,1.85,"[0, 0, 0, 0, 5.5, 2.8, 0.2]",6.673187017440796E-4,287.7307319641113,Molisoles,-0.0010228091850876808,0.2532202402750651,"{""type"":""Point"",""coordinates"":[-65.13464356,-27.14003944]}"
1029,90028,90,22/6/1999,Famailla,Tucuman,6759-2167,12.15,356,invierno,1999-06-21,"[1999-06-21, 1999-06-22, 1999-06-23, 1999-06-24, 1999-06-25, 1999-06-26, 1999-06-27]",true,1029,-27.11478,-65.42955,2.13,"[0, 0, 1.8, 0.4, 9, 0, 4.1]",0.0018963366746902466,286.71462694803876,Inceptisoles,-0.001586196944117546,0.38517316182454425,"{""type"":""Point"",""coordinates"":[-65.42955,-27.114780000000003]}"
1030,90021,90,17/2/2001,Chicligasta,Tucuman,32679-6504,18.33,349,verano,2001-02-12,"[2001-02-12, 2001-02-13, 2001-02-14, 2001-02-15, 2001-02-16, 2001-02-17, 2001-02-18]",false,1030,-27.3126707,-65.4820785,2.28,"[20.2, 0.1, 1.7, 4.2, 7.2, 0.1, 0.1]",0.010104328393936157,293.61973063151044,Roca,-0.002400022931396961,0.42411231994628906,"{""type"":""Point"",""coordinates"":[-65.4820785,-27.3126707]}"
1031,90084,90,13/11/1997,Capital,Tucuman,33966-6506,7.44,453,primavera,1997-11-10,"[1997-11-10, 1997-11-11, 1997-11-12, 1997-11-13, 1997-11-14, 1997-11-15, 1997-11-16]",true,1031,-26.82900979,-65.21054418,6.28,"[0, 1.3, 22.2, 2.9, 0, 0, 4.4]",2.2739171981811523E-4,297.1689173380534,Molisoles,-0.005166703835129738,0.46051915486653644,"{""type"":""Point"",""coordinates"":[-65.21054418,-26.829009789999997]}"
1032,90084,90,1/4/2010,Capital,Tucuman,33966-6506,7.44,453,otoño,2010-03-29,"[2010-03-29, 2010-03-30, 2010-03-31, 2010-04-01, 2010-04-02, 2010-04-03, 2010-04-04]",true,1032,-26.82900979,-65.21054418,6.28,"[1.4, 0, 0, 0, 9.7, 20.1, 3.3]",0.004231750965118408,295.4097156524658,Molisoles,-0.002975250594317913,0.45558802286783856,"{""type"":""Point"",""coordinates"":[-65.21054418,-26.829009789999997]}"
1033,90007,90,12/6/1998,Burruyacu,Tucuman,32820-6498,30.8,763,otoño,1998-06-08,"[1998-06-08, 1998-06-09, 1998-06-10, 1998-06-11, 1998-06-12, 1998-06-13, 1998-06-14]",false,1033,-26.36994,-64.78136,5.48,"[0.2, 3.6, 16.7, 3.6, 0, 0.1, 0]",9.483993053436279E-4,288.7852026621501,Entisoles,-4.401039332151413E-4,0.4489606221516927,"{""type"":""Point"",""coordinates"":[-64.78136,-26.36994]}"
1034,66098,66,1/4/1992,La Vina,Salta,33188-6577,11.23,1183,otoño,1992-03-30,"[1992-03-30, 1992-03-31, 1992-04-01, 1992-04-02, 1992-04-03, 1992-04-04, 1992-04-05]",true,1034,-25.62320328,-65.61323547,1.38,"[0, 3.7, 19.5, 6.7, 6.1, 4.9, 6.2]",0.001127690076828003,287.33445930480957,Entisoles,-0.0030102981254458427,0.4398536682128906,"{""type"":""Point"",""coordinates"":[-65.61323547,-25.62320328]}"
1035,66028,66,11/6/1998,Capital,Salta,6351-1974,15.04,1377,otoño,1998-06-08,"[1998-06-08, 1998-06-09, 1998-06-10, 1998-06-11, 1998-06-12, 1998-06-13, 1998-06-14]",false,1035,-24.70494203,-65.47051055,1.02,"[2.9, 7.4, 23.4, 6.8, 1.2, 0.2, 0]",0.0022993385791778564,286.2563940684001,Inceptisoles,-0.0012141251936554909,0.4597613016764323,"{""type"":""Point"",""coordinates"":[-65.47051055,-24.70494203]}"
1036,66021,66,13/2/2008,Cafayate,Salta,6365-1979,21.78,1868,verano,2008-02-11,"[2008-02-11, 2008-02-12, 2008-02-13, 2008-02-14, 2008-02-15, 2008-02-16, 2008-02-17]",false,1036,-26.10228924,-66.01550671,3.61,"[0, 0, 0.5, 0.6, 2.9, 2.6, 10.7]",2.692490816116333E-4,284.6181945800781,Roca,-0.0038004890084266663,0.4732672373453776,"{""type"":""Point"",""coordinates"":[-66.01550671,-26.102289239999998]}"
1037,14098,14,11/3/1998,Rio Cuarto,Cordoba,34345-6361,23.14,514,verano,1998-03-09,"[1998-03-09, 1998-03-10, 1998-03-11, 1998-03-12, 1998-03-13, 1998-03-14, 1998-03-15]",false,1037,-32.64751095,-64.22141859,2.88,"[0, 0.2, 0.3, 0, 0, 0, 0]",4.649162292480469E-6,293.8999665578206,Complejo indiferenci,-0.0031976336613297462,0.36046091715494794,"{""type"":""Point"",""coordinates"":[-64.22141859,-32.64751095]}"
1038,14098,14,13/10/1996,Rio Cuarto,Cordoba,34345-6361,23.14,514,primavera,1996-10-07,"[1996-10-07, 1996-10-08, 1996-10-09, 1996-10-10, 1996-10-11, 1996-10-12, 1996-10-13]",false,1038,-32.64751095,-64.22141859,2.88,"[0, 0.4, 15.2, 1.1, 0, 0, 0]",3.725290298461914E-7,292.8422673543294,Complejo indiferenci,-0.00215922761708498,0.18230501810709634,"{""type"":""Point"",""coordinates"":[-64.22141859,-32.64751095]}"
1039,14098,14,4/4/2005,Rio Cuarto,Cordoba,34345-6361,23.14,514,otoño,2005-04-04,"[2005-04-04, 2005-04-05, 2005-04-06, 2005-04-07, 2005-04-08, 2005-04-09, 2005-04-10]",false,1039,-32.64751095,-64.22141859,2.88,"[0, 0, 0, 0, 0, 0.2, 0]",4.172325134277344E-7,287.71332867940265,Complejo indiferenci,-0.0026398561894893646,0.3067099253336589,"{""type"":""Point"",""coordinates"":[-64.22141859,-32.64751095]}"
1040,14056,14,27/10/2003,Juarez Celman,Cordoba,8232-2605,4.84,142,primavera,2003-10-27,"[2003-10-27, 2003-10-28, 2003-10-29, 2003-10-30, 2003-10-31, 2003-11-01, 2003-11-02]",true,1040,-33.3160107,-63.2538219,1.45,"[0, 0, 0, 7, 0.1, 0, 0]",2.1710991859436035E-5,290.65561866760254,Molisoles,-0.002998179756104946,0.27308400472005206,"{""type"":""Point"",""coordinates"":[-63.2538219,-33.3160107]}"
1041,14056,14,24/4/1991,Juarez Celman,Cordoba,8232-2605,4.84,142,otoño,1991-04-22,"[1991-04-22, 1991-04-23, 1991-04-24, 1991-04-25, 1991-04-26, 1991-04-27, 1991-04-28]",true,1041,-33.3160107,-63.2538219,1.45,"[0, 0, 0, 0, 0, 0, 0]",7.465481758117676E-6,291.02152188618976,Molisoles,-0.002135513350367546,0.3236230214436849,"{""type"":""Point"",""coordinates"":[-63.2538219,-33.3160107]}"
1042,14147,14,7/8/1991,Santa Maria,Cordoba,37574-7384,17.55,469,invierno,1991-08-05,"[1991-08-05, 1991-08-06, 1991-08-07, 1991-08-08, 1991-08-09, 1991-08-10, 1991-08-11]",false,1042,-31.55910043,-64.19196866,4.28,"[0, 0, 0, 0.1, 2.8, 0, 0]",6.479024887084961E-5,279.42506472269696,Roca,-0.0014636386185884476,0.3170897165934245,"{""type"":""Point"",""coordinates"":[-64.19196866,-31.55910043]}"
1043,14126,14,13/12/2011,San Alberto,Cordoba,9461-2776,35.26,669,primavera,2011-12-12,"[2011-12-12, 2011-12-13, 2011-12-14, 2011-12-15, 2011-12-16, 2011-12-17, 2011-12-18]",false,1043,-31.79056275,-65.16710187,5.71,"[12.8, 2.5, 0, 0, 0, 0, 0]",4.556775093078613E-5,293.5776507059733,Entisoles,-0.003197631798684597,0.2064507802327474,"{""type"":""Point"",""coordinates"":[-65.16710187,-31.79056275]}"
1044,14098,14,7/6/2014,Rio Cuarto,Cordoba,34345-6361,23.14,514,otoño,2014-06-02,"[2014-06-02, 2014-06-03, 2014-06-04, 2014-06-05, 2014-06-06, 2014-06-07, 2014-06-08]",false,1044,-32.64751095,-64.22141859,2.88,"[0, 0, 0, 0, 0, 0, 0]",5.960464477539063E-8,284.20497703552246,Complejo indiferenci,-0.0012621395289897919,0.29689915974934894,"{""type"":""Point"",""coordinates"":[-64.22141859,-32.64751095]}"
1045,14098,14,19/12/2004,Rio Cuarto,Cordoba,34345-6361,23.14,514,primavera,2004-12-13,"[2004-12-13, 2004-12-14, 2004-12-15, 2004-12-16, 2004-12-17, 2004-12-18, 2004-12-19]",false,1045,-32.64751095,-64.22141859,2.88,"[7.5, 8.5, 2, 0, 0.3, 4.6, 0.7]",3.272294998168945E-5,298.18430582682294,Complejo indiferenci,-0.0026791663840413094,0.19631830851236978,"{""type"":""Point"",""coordinates"":[-64.22141859,-32.64751095]}"
1046,14091,14,22/8/2015,Punilla,Cordoba,36828-7231,28.57,1223,invierno,2015-08-17,"[2015-08-17, 2015-08-18, 2015-08-19, 2015-08-20, 2015-08-21, 2015-08-22, 2015-08-23]",false,1046,-31.10580063,-64.59128571,2.98,"[0, 0, 0, 0, 0, 0, 0]",7.227063179016113E-6,281.14451281229657,Molisoles,-0.00166991725564003,0.3118184407552083,"{""type"":""Point"",""coordinates"":[-64.59128571,-31.105800630000005]}"
1047,14042,14,5/3/2011,General San Martin,Cordoba,9400-2835,27.92,162,verano,2011-02-28,"[2011-02-28, 2011-03-01, 2011-03-02, 2011-03-03, 2011-03-04, 2011-03-05, 2011-03-06]",false,1047,-32.34123693,-62.99621706,2.87,"[0, 0, 0, 0, 0, 0, 0]",2.0712614059448242E-6,296.2095483144124,Complejo indiferenci,-0.003601349890232086,0.31812477111816406,"{""type"":""Point"",""coordinates"":[-62.99621706,-32.34123693]}"
1048,06357,6,7/4/2006,General Pueyrredon,Buenos Aires,3347-1742,17.47,21,otoño,2006-04-03,"[2006-04-03, 2006-04-04, 2006-04-05, 2006-04-06, 2006-04-07, 2006-04-08, 2006-04-09]",false,1048,-37.80766254,-57.62989086,5.55,"[0.1, 5.5, 0, 0, 0, 0.3, 0]",4.827976226806641E-6,290.9938252766927,Molisoles,-6.203977391123772E-4,0.2959715525309245,"{""type"":""Point"",""coordinates"":[-57.62989086,-37.80766254000001]}"
1049,82063,82,5/8/2011,La Capital,Santa Fe,103-103,23.73,25,invierno,2011-08-01,"[2011-08-01, 2011-08-02, 2011-08-03, 2011-08-04, 2011-08-05, 2011-08-06, 2011-08-07]",false,1049,-31.18858147,-60.62677383,2.15,"[10.9, 0, 0, 0, 0, 0, 0]",1.8201768398284912E-4,278.7443141937256,Molisoles,-0.0016878973692655563,0.4782358805338542,"{""type"":""Point"",""coordinates"":[-60.62677383,-31.18858147]}"
1050,22133,22,8/2/2003,Quitilipi,Chaco,36786-7204,29.42,89,verano,2003-02-03,"[2003-02-03, 2003-02-04, 2003-02-05, 2003-02-06, 2003-02-07, 2003-02-08, 2003-02-09]",false,1050,-26.99698694,-60.33777397,2.13,"[0, 0, 0, 0, 0.8, 18.7, 18.9]",6.823241710662842E-5,304.46709632873535,Molisoles,-0.006294352933764458,0.18570073445638022,"{""type"":""Point"",""coordinates"":[-60.33777397000001,-26.99698694]}"
1051,22036,22,26/10/2005,12 de Octubre,Chaco,36727-7188,40.58,99,primavera,2005-10-24,"[2005-10-24, 2005-10-25, 2005-10-26, 2005-10-27, 2005-10-28, 2005-10-29, 2005-10-30]",false,1051,-27.34587947,-61.4341435,1.85,"[15.1, 0, 0, 1.4, 0, 0, 8.6]",6.796419620513916E-5,296.28209431966144,Alfisoles,-0.002308630384504795,0.21645100911458334,"{""type"":""Point"",""coordinates"":[-61.43414349999999,-27.345879470000003]}"
1052,22070,22,20/1/2012,Independencia,Chaco,36786-7204,62.87,105,verano,2012-01-16,"[2012-01-16, 2012-01-17, 2012-01-18, 2012-01-19, 2012-01-20, 2012-01-21, 2012-01-22]",false,1052,-26.52423694,-60.57193526,2.78,"[0, 0, 0, 1.5, 0.6, 0.8, 9.1]",7.599592208862305E-7,299.5881818135579,Inceptisoles,-0.004942995496094227,0.23457781473795572,"{""type"":""Point"",""coordinates"":[-60.57193525999999,-26.52423694]}"
1053,22105,22,27/2/2011,9 de Julio,Chaco,36727-7188,60.12,102,verano,2011-02-21,"[2011-02-21, 2011-02-22, 2011-02-23, 2011-02-24, 2011-02-25, 2011-02-26, 2011-02-27]",false,1053,-27.01701868,-61.18742808,0.93,"[24.8, 9.1, 23.3, 0, 0, 0, 0]",0.002061024308204651,297.658535639445,Inceptisoles,-0.0029042381793260574,0.4133453369140625,"{""type"":""Point"",""coordinates"":[-61.187428080000004,-27.01701868]}"
1054,22112,22,17/9/2005,OHiggins,Chaco,36729-7190,40.04,93,invierno,2005-09-12,"[2005-09-12, 2005-09-13, 2005-09-14, 2005-09-15, 2005-09-16, 2005-09-17, 2005-09-18]",false,1054,-27.28230625,-60.80237676,1.4,"[0, 0, 0, 0, 0, 0, 0]",1.817941665649414E-6,284.87093289693195,Inceptisoles,-0.001740812323987484,0.19763310750325522,"{""type"":""Point"",""coordinates"":[-60.80237676000001,-27.282306249999998]}"
1055,22112,22,16/5/2008,OHiggins,Chaco,36729-7190,40.04,93,otoño,2008-05-12,"[2008-05-12, 2008-05-13, 2008-05-14, 2008-05-15, 2008-05-16, 2008-05-17, 2008-05-18]",false,1055,-27.28230625,-60.80237676,1.4,"[0, 0, 0, 0, 0, 0, 0]",2.086162567138672E-7,290.4172814687093,Inceptisoles,-5.177855491638184E-4,0.15018463134765625,"{""type"":""Point"",""coordinates"":[-60.80237676000001,-27.282306249999998]}"
1056,02014,2,10/10/1999,Comuna 14,Capital Federal,85-85,2.68,24,primavera,1999-10-04,"[1999-10-04, 1999-10-05, 1999-10-06, 1999-10-07, 1999-10-08, 1999-10-09, 1999-10-10]",true,1056,-34.57389998,-58.42243645,5.28,"[0, 0, 1.6, 1.3, 0.2, 0, 1.1]",5.966722965240479E-4,282.2088082631429,Miscelaneas,-0.0030496176332235336,0.33552106221516925,"{""type"":""Point"",""coordinates"":[-58.42243645,-34.57389997999999]}"
1057,06028,6,18/12/2015,Almirante Brown,Buenos Aires,35405-6949,1.13,28,primavera,2015-12-14,"[2015-12-14, 2015-12-15, 2015-12-16, 2015-12-17, 2015-12-18, 2015-12-19, 2015-12-20]",true,1057,-34.80155807,-58.39146772,0.93,"[26, 0, 0, 2.6, 0, 0, 0]",8.867383003234863E-4,297.196143468221,Miscelaneas,-0.0026108138263225555,0.3536523183186849,"{""type"":""Point"",""coordinates"":[-58.39146772000001,-34.80155807]}"
1058,22070,22,19/6/1995,Independencia,Chaco,36786-7204,62.87,105,otoño,1995-06-19,"[1995-06-19, 1995-06-20, 1995-06-21, 1995-06-22, 1995-06-23, 1995-06-24, 1995-06-25]",false,1058,-26.52423694,-60.57193526,2.78,"[0, 0, 0, 0, 0.1, 0.5, 0]",8.07642936706543E-5,283.3560511271159,Inceptisoles,-0.0016148015856742859,0.28636741638183594,"{""type"":""Point"",""coordinates"":[-60.57193525999999,-26.52423694]}"
1059,22049,22,7/10/2002,General Belgrano,Chaco,36729-7190,65.96,108,primavera,2002-10-07,"[2002-10-07, 2002-10-08, 2002-10-09, 2002-10-10, 2002-10-11, 2002-10-12, 2002-10-13]",false,1059,-26.96507701,-61.03071359,3.25,"[0, 0.2, 4.4, 8.9, 6.6, 0, 0]",2.3633241653442383E-5,306.4406159718831,Inceptisoles,-0.004258926026523113,0.14385096232096353,"{""type"":""Point"",""coordinates"":[-61.03071359,-26.96507701]}"
1060,22070,22,1/6/2010,Independencia,Chaco,36786-7204,62.87,105,otoño,2010-05-31,"[2010-05-31, 2010-06-01, 2010-06-02, 2010-06-03, 2010-06-04, 2010-06-05, 2010-06-06]",false,1060,-26.52423694,-60.57193526,2.78,"[0, 0, 0, 0.2, 0.1, 0, 0]",1.3113021850585938E-6,284.43935712178546,Inceptisoles,-0.0020632315427064896,0.3590831756591797,"{""type"":""Point"",""coordinates"":[-60.57193525999999,-26.52423694]}"
1061,22147,22,18/9/2009,San Lorenzo,Chaco,36729-7190,46.33,87,invierno,2009-09-14,"[2009-09-14, 2009-09-15, 2009-09-16, 2009-09-17, 2009-09-18, 2009-09-19, 2009-09-20]",false,1061,-27.25204807,-60.51610474,3.85,"[0, 1.3, 2.6, 27.6, 0, 0, 0]",2.5331974029541016E-7,292.95402971903485,Inceptisoles,-0.0012067891657352448,0.15732892354329428,"{""type"":""Point"",""coordinates"":[-60.51610474,-27.25204807]}"
1062,22098,22,2/12/2003,Mayor Luis J Fontana,Chaco,36729-7190,21.35,85,primavera,2003-12-01,"[2003-12-01, 2003-12-02, 2003-12-03, 2003-12-04, 2003-12-05, 2003-12-06, 2003-12-07]",false,1062,-27.68955287,-60.83488783,1.4,"[0, 0, 11.5, 0, 0, 0, 0]",6.379187107086182E-5,298.36616643269855,Alfisoles,-0.006120860576629639,0.3511149088541667,"{""type"":""Point"",""coordinates"":[-60.83488783,-27.689552870000004]}"
1063,22112,22,23/2/2003,OHiggins,Chaco,36729-7190,40.04,93,verano,2003-02-17,"[2003-02-17, 2003-02-18, 2003-02-19, 2003-02-20, 2003-02-21, 2003-02-22, 2003-02-23]",false,1063,-27.28230625,-60.80237676,1.4,"[0, 0, 2.6, 2.4, 0.3, 0.4, 0]",1.049041748046875E-5,294.6997756958008,Inceptisoles,-0.00567040778696537,0.3314380645751953,"{""type"":""Point"",""coordinates"":[-60.80237676000001,-27.282306249999998]}"
1064,78021,78,20/2/1991,Guer Aike,Santa Cruz,33331-6533,4.21,83,verano,1991-02-18,"[1991-02-18, 1991-02-19, 1991-02-20, 1991-02-21, 1991-02-22, 1991-02-23, 1991-02-24]",true,1064,-51.8701101,-70.5994988,4,"[2.4, 0.2, 3, 2.2, 0, 8.2, 4.7]",1.4008581638336182E-4,281.51972071329754,Molisoles,-0.002287779003381729,0.4313519795735677,"{""type"":""Point"",""coordinates"":[-70.5994988,-51.87011009999999]}"
1065,26070,26,17/9/1991,Paso de Indios,Chubut,6448-2012,25,623,invierno,1991-09-16,"[1991-09-16, 1991-09-17, 1991-09-18, 1991-09-19, 1991-09-20, 1991-09-21, 1991-09-22]",false,1065,-44.46556091,-68.47408295,6.12,"[3.5, 10, 0, 4.1, 0.3, 0.3, 0.1]",2.7224421501159668E-5,278.01946957906085,Molisoles,-0.001533983275294304,0.23531341552734375,"{""type"":""Point"",""coordinates"":[-68.47408295,-44.46556091]}"
1066,26056,26,13/11/2007,Languineo,Chubut,6385-1987,0.67,480,primavera,2007-11-12,"[2007-11-12, 2007-11-13, 2007-11-14, 2007-11-15, 2007-11-16, 2007-11-17, 2007-11-18]",true,1066,-42.66468787,-70.44354981,3.75,"[0.1, 1.7, 0, 0, 0.3, 0, 0]",1.4483928680419922E-5,279.423775990804,Molisoles,-5.505960434675217E-4,0.0966351826985677,"{""type"":""Point"",""coordinates"":[-70.44354981,-42.66468787]}"
1067,26014,26,12/9/2004,Cushamen,Chubut,36848-7245,2.82,312,invierno,2004-09-06,"[2004-09-06, 2004-09-07, 2004-09-08, 2004-09-09, 2004-09-10, 2004-09-11, 2004-09-12]",true,1067,-42.03927359,-71.56551616,3.05,"[6.6, 2.3, 0, 0, 0, 0, 0]",0.006306171417236328,271.87586975097656,Entisoles,-6.781499832868576E-4,0.48494211832682294,"{""type"":""Point"",""coordinates"":[-71.56551616,-42.03927359]}"
1068,26035,26,25/11/1995,Futaleufu,Chubut,6680-2145,1.68,556,primavera,1995-11-20,"[1995-11-20, 1995-11-21, 1995-11-22, 1995-11-23, 1995-11-24, 1995-11-25, 1995-11-26]",true,1068,-43.48395319,-71.59418478,8.92,"[9.1, 3, 1.5, 3.4, 5.7, 0, 0]",0.005937725305557251,280.78133900960285,Aridisoles,-0.0034640133380889893,0.4819183349609375,"{""type"":""Point"",""coordinates"":[-71.59418478,-43.48395319]}"
1069,26014,26,20/7/1999,Cushamen,Chubut,36848-7245,2.82,312,invierno,1999-07-19,"[1999-07-19, 1999-07-20, 1999-07-21, 1999-07-22, 1999-07-23, 1999-07-24, 1999-07-25]",true,1069,-42.03927359,-71.56551616,3.05,"[0, 2.4, 0, 1.6, 23.4, 47.8, 41.4]",7.797777652740479E-4,273.4960250854492,Entisoles,-1.6178004443645477E-4,0.4557565053304036,"{""type"":""Point"",""coordinates"":[-71.56551616,-42.03927359]}"
1070,58070,58,22/6/1998,Los Lagos,Neuquen,33703-6477,20.32,918,invierno,1998-06-22,"[1998-06-22, 1998-06-23, 1998-06-24, 1998-06-25, 1998-06-26, 1998-06-27, 1998-06-28]",false,1070,-40.7275238,-71.67723084,3.7,"[13.6, 0.5, 0, 0, 0, 1.3, 22.3]",0.0017939209938049316,275.77905718485516,Inceptisoles,-2.444479614496231E-4,0.3708375295003255,"{""type"":""Point"",""coordinates"":[-71.67723084,-40.7275238]}"
1071,62056,62,11/7/2009,Norquinco,Rio Negro,32726-6390,20.64,1023,invierno,2009-07-06,"[2009-07-06, 2009-07-07, 2009-07-08, 2009-07-09, 2009-07-10, 2009-07-11, 2009-07-12]",false,1071,-41.68252462,-70.71325062,3.1,"[6.7, 0, 1.3, 6.6, 0, 0.7, 1.7]",4.492253065109253E-4,274.6284122467041,Aridisoles,-2.590147778391838E-4,0.27119700113932294,"{""type"":""Point"",""coordinates"":[-70.71325062,-41.682524619999995]}"
1072,26014,26,17/11/2008,Cushamen,Chubut,36848-7245,2.82,312,primavera,2008-11-17,"[2008-11-17, 2008-11-18, 2008-11-19, 2008-11-20, 2008-11-21, 2008-11-22, 2008-11-23]",true,1072,-42.03927359,-71.56551616,3.05,"[0, 0, 0, 0, 2.1, 9.6, 0.4]",0.0015272796154022217,286.5821393330892,Entisoles,-0.0038153566420078278,0.4142475128173828,"{""type"":""Point"",""coordinates"":[-71.56551616,-42.03927359]}"
1073,26035,26,24/9/1997,Futaleufu,Chubut,6680-2145,1.68,556,primavera,1997-09-22,"[1997-09-22, 1997-09-23, 1997-09-24, 1997-09-25, 1997-09-26, 1997-09-27, 1997-09-28]",true,1073,-43.48395319,-71.59418478,8.92,"[0.9, 0.1, 0.6, 0, 0, 0.8, 4.3]",0.003007367253303528,278.573974609375,Aridisoles,-7.799658924341202E-4,0.4877878824869792,"{""type"":""Point"",""coordinates"":[-71.59418478,-43.48395319]}"
1074,26014,26,2/8/2005,Cushamen,Chubut,36848-7245,2.82,312,invierno,2005-08-01,"[2005-08-01, 2005-08-02, 2005-08-03, 2005-08-04, 2005-08-05, 2005-08-06, 2005-08-07]",true,1074,-42.03927359,-71.56551616,3.05,"[12.2, 14.7, 15.6, 2.2, 6.1, 0, 0]",0.002576112747192383,273.79939969380695,Entisoles,-5.2255578339099884E-5,0.494903564453125,"{""type"":""Point"",""coordinates"":[-71.56551616,-42.03927359]}"
1075,26014,26,13/11/2008,Cushamen,Chubut,36848-7245,2.82,312,primavera,2008-11-10,"[2008-11-10, 2008-11-11, 2008-11-12, 2008-11-13, 2008-11-14, 2008-11-15, 2008-11-16]",true,1075,-42.03927359,-71.56551616,3.05,"[0, 0, 0, 0, 0.4, 0, 0]",0.0033486634492874146,281.64838854471844,Entisoles,-0.0028480226173996925,0.49921735127766925,"{""type"":""Point"",""coordinates"":[-71.56551616,-42.03927359]}"
1076,62021,62,14/2/2015,Bariloche,Rio Negro,6953-2144,0.07,408,verano,2015-02-09,"[2015-02-09, 2015-02-10, 2015-02-11, 2015-02-12, 2015-02-13, 2015-02-14, 2015-02-15]",true,1076,-41.89814608,-71.50316469,2.66,"[0, 0, 0, 0, 0, 0, 0]",3.205239772796631E-4,280.7302983601888,Inceptisoles,-0.0021810438483953476,0.328518549601237,"{""type"":""Point"",""coordinates"":[-71.50316469000002,-41.898146080000004]}"
1077,26014,26,13/9/1995,Cushamen,Chubut,36848-7245,2.82,312,invierno,1995-09-11,"[1995-09-11, 1995-09-12, 1995-09-13, 1995-09-14, 1995-09-15, 1995-09-16, 1995-09-17]",true,1077,-42.03927359,-71.56551616,3.05,"[0, 0, 0, 0.8, 9.9, 10.1, 23.1]",0.002400428056716919,274.7913112640381,Entisoles,-4.910863935947418E-4,0.4872996012369792,"{""type"":""Point"",""coordinates"":[-71.56551616,-42.03927359]}"
1078,26014,26,2/10/1997,Cushamen,Chubut,36848-7245,2.82,312,primavera,1997-09-29,"[1997-09-29, 1997-09-30, 1997-10-01, 1997-10-02, 1997-10-03, 1997-10-04, 1997-10-05]",true,1078,-42.03927359,-71.56551616,3.05,"[4.6, 1.3, 3.6, 2.4, 0.5, 2.4, 0]",0.004346713423728943,274.7692216237386,Entisoles,-8.545015007257462E-4,0.4942067464192708,"{""type"":""Point"",""coordinates"":[-71.56551616,-42.03927359]}"
1079,26014,26,1/1/2002,Cushamen,Chubut,36848-7245,2.82,312,verano,2001-12-31,"[2001-12-31, 2002-01-01, 2002-01-02, 2002-01-03, 2002-01-04, 2002-01-05, 2002-01-06]",true,1079,-42.03927359,-71.56551616,3.05,"[0.8, 0.4, 0, 0, 0, 0, 0]",5.228817462921143E-4,288.8243522644043,Entisoles,-0.001656271517276764,0.2682291666666667,"{""type"":""Point"",""coordinates"":[-71.56551616,-42.03927359]}"
1080,62021,62,27/9/2000,Bariloche,Rio Negro,6953-2144,0.07,408,primavera,2000-09-25,"[2000-09-25, 2000-09-26, 2000-09-27, 2000-09-28, 2000-09-29, 2000-09-30, 2000-10-01]",true,1080,-41.89814608,-71.50316469,2.66,"[0, 0, 0, 0.7, 0.1, 0, 0]",0.0023324191570281982,274.7869466145833,Inceptisoles,-3.8051046431064606E-5,0.4895617167154948,"{""type"":""Point"",""coordinates"":[-71.50316469000002,-41.898146080000004]}"
1081,62021,62,7/8/2002,Bariloche,Rio Negro,6953-2144,0.07,408,invierno,2002-08-05,"[2002-08-05, 2002-08-06, 2002-08-07, 2002-08-08, 2002-08-09, 2002-08-10, 2002-08-11]",true,1081,-41.89814608,-71.50316469,2.66,"[7.4, 0.2, 3.9, 2.2, 19.3, 7.7, 4.7]",0.002729848027229309,269.26057116190594,Inceptisoles,-4.114024341106415E-5,0.47347386678059894,"{""type"":""Point"",""coordinates"":[-71.50316469000002,-41.898146080000004]}"
1082,34035,34,18/1/2009,Patino,Formosa,34065-6553,11.81,124,verano,2009-01-12,"[2009-01-12, 2009-01-13, 2009-01-14, 2009-01-15, 2009-01-16, 2009-01-17, 2009-01-18]",true,1082,-24.61192,-60.30033,0,"[9.9, 8.4, 0.2, 22.5, 1.5, 0, 18.9]",3.160536289215088E-5,301.6135190327962,Rio,-0.00431524682790041,0.25828297932942706,"{""type"":""Point"",""coordinates"":[-60.30033000000001,-24.611919999999998]}"
1083,14098,14,25/3/1995,Rio Cuarto,Cordoba,34345-6361,23.14,514,verano,1995-03-20,"[1995-03-20, 1995-03-21, 1995-03-22, 1995-03-23, 1995-03-24, 1995-03-25, 1995-03-26]",false,1083,-32.64751095,-64.22141859,2.88,"[0, 0.8, 7.3, 0.6, 0, 0, 0]",2.391636371612549E-6,295.8197612762451,Complejo indiferenci,-0.0023599639534950256,0.19817543029785156,"{""type"":""Point"",""coordinates"":[-64.22141859,-32.64751095]}"
1084,14098,14,23/8/2015,Rio Cuarto,Cordoba,34345-6361,23.14,514,invierno,2015-08-17,"[2015-08-17, 2015-08-18, 2015-08-19, 2015-08-20, 2015-08-21, 2015-08-22, 2015-08-23]",false,1084,-32.64751095,-64.22141859,2.88,"[0, 0, 0, 0.2, 0, 0.3, 0]",1.4901161193847656E-7,283.34104601542157,Complejo indiferenci,-0.0013514673337340355,0.2429962158203125,"{""type"":""Point"",""coordinates"":[-64.22141859,-32.64751095]}"
1085,14098,14,6/2/2012,Rio Cuarto,Cordoba,34345-6361,23.14,514,verano,2012-02-06,"[2012-02-06, 2012-02-07, 2012-02-08, 2012-02-09, 2012-02-10, 2012-02-11, 2012-02-12]",false,1085,-32.64751095,-64.22141859,2.88,"[5, 0, 29.8, 0, 0, 0, 0]",2.238154411315918E-5,298.854149500529,Complejo indiferenci,-0.002823086455464363,0.2627143859863281,"{""type"":""Point"",""coordinates"":[-64.22141859,-32.64751095]}"
1086,30084,30,2/5/2013,Parana,Entre Rios,110-110,12.53,81,otoño,2013-04-29,"[2013-04-29, 2013-04-30, 2013-05-01, 2013-05-02, 2013-05-03, 2013-05-04, 2013-05-05]",true,1086,-31.88541285,-60.23444834,1.43,"[0, 0.2, 27.3, 30.2, 47.2, 0, 0]",3.081560134887695E-5,290.4947001139323,Molisoles,-0.002391102723777294,0.4573211669921875,"{""type"":""Point"",""coordinates"":[-60.23444834,-31.88541285]}"
1087,02001,2,28/4/1994,Comuna 1,Capital Federal,8891-2706,1.05,28,otoño,1994-04-25,"[1994-04-25, 1994-04-26, 1994-04-27, 1994-04-28, 1994-04-29, 1994-04-30, 1994-05-01]",true,1087,-34.62504786,-58.38438723,3.7,"[20.8, 1, 16.3, 0, 0, 32.3, 22.5]",7.557421922683716E-4,291.2255662282308,Miscelaneas,-0.0016015805304050446,0.37588055928548175,"{""type"":""Point"",""coordinates"":[-58.38438723000001,-34.62504786000001]}"
1088,02001,2,25/11/2015,Comuna 1,Capital Federal,8891-2706,1.05,28,primavera,2015-11-23,"[2015-11-23, 2015-11-24, 2015-11-25, 2015-11-26, 2015-11-27, 2015-11-28, 2015-11-29]",true,1088,-34.62504786,-58.38438723,3.7,"[0, 0, 0, 0.2, 18.1, 0, 0]",1.2792646884918213E-4,292.22539138793945,Miscelaneas,-0.004693522118031979,0.2706298828125,"{""type"":""Point"",""coordinates"":[-58.38438723000001,-34.62504786000001]}"
1089,74049,74,15/11/2005,Junin,San Luis,34137-6448,58.78,587,primavera,2005-11-14,"[2005-11-14, 2005-11-15, 2005-11-16, 2005-11-17, 2005-11-18, 2005-11-19, 2005-11-20]",false,1089,-32.31398017,-65.41102538,2.15,"[4.9, 7.1, 9.8, 14.9, 0.7, 0, 0.1]",2.072751522064209E-5,296.4593760172526,Entisoles,-0.0035210223868489265,0.18244361877441406,"{""type"":""Point"",""coordinates"":[-65.41102538,-32.31398017]}"
1090,14014,14,11/5/1996,Capital,Cordoba,37574-7384,24.04,426,otoño,1996-05-06,"[1996-05-06, 1996-05-07, 1996-05-08, 1996-05-09, 1996-05-10, 1996-05-11, 1996-05-12]",false,1090,-31.47878838,-64.14509583,2.86,"[3.2, 0.8, 0.6, 0, 0, 0, 0]",4.094839096069336E-5,292.82297197977704,Miscelaneas,-0.0015145353972911835,0.3370361328125,"{""type"":""Point"",""coordinates"":[-64.14509583,-31.478788380000008]}"
1091,22063,22,18/6/2014,General Guemes,Chaco,33840-6431,76.76,130,otoño,2014-06-16,"[2014-06-16, 2014-06-17, 2014-06-18, 2014-06-19, 2014-06-20, 2014-06-21, 2014-06-22]",false,1091,-25.70413822,-61.03150273,0,"[0.2, 0, 6.2, 0, 0, 0, 1.6]",3.129243850708008E-6,291.3102862040202,Alfisoles,-8.852686733007431E-4,0.29557228088378906,"{""type"":""Point"",""coordinates"":[-61.03150273,-25.70413822]}"
1092,82063,82,14/9/1994,La Capital,Santa Fe,103-103,23.73,25,invierno,1994-09-12,"[1994-09-12, 1994-09-13, 1994-09-14, 1994-09-15, 1994-09-16, 1994-09-17, 1994-09-18]",false,1092,-31.18858147,-60.62677383,2.15,"[1.5, 0, 17.7, 0, 0, 0, 0]",1.0971724987030029E-4,293.8016821543376,Molisoles,-0.002727808430790901,0.3834667205810547,"{""type"":""Point"",""coordinates"":[-60.62677383,-31.18858147]}"
1093,66126,66,7/8/1991,Oran,Salta,6350-1973,11.39,373,invierno,1991-08-05,"[1991-08-05, 1991-08-06, 1991-08-07, 1991-08-08, 1991-08-09, 1991-08-10, 1991-08-11]",true,1093,-22.9746,-64.41384,1.37,"[0, 0, 0, 0, 0, 0, 0]",5.026161670684814E-4,285.9052079518636,Roca,-0.0027658939361572266,0.40542348225911456,"{""type"":""Point"",""coordinates"":[-64.41384,-22.974599999999995]}"
1094,66028,66,25/11/1994,Capital,Salta,6351-1974,15.04,1377,primavera,1994-11-21,"[1994-11-21, 1994-11-22, 1994-11-23, 1994-11-24, 1994-11-25, 1994-11-26, 1994-11-27]",false,1094,-24.70494203,-65.47051055,1.02,"[12.4, 2.9, 0, 0.5, 0.1, 6.4, 23.9]",0.010502010583877563,286.89362716674805,Inceptisoles,-0.003906684927642345,0.48372459411621094,"{""type"":""Point"",""coordinates"":[-65.47051055,-24.70494203]}"
1095,82063,82,27/5/1992,La Capital,Santa Fe,103-103,23.73,25,otoño,1992-05-25,"[1992-05-25, 1992-05-26, 1992-05-27, 1992-05-28, 1992-05-29, 1992-05-30, 1992-05-31]",false,1095,-31.18858147,-60.62677383,2.15,"[0, 2.6, 0.8, 0.9, 0, 0, 0]",2.712756395339966E-4,289.8093598683675,Molisoles,-0.0016660401597619057,0.40590985616048175,"{""type"":""Point"",""coordinates"":[-60.62677383,-31.18858147]}"
1096,82098,82,28/10/1995,San Javier,Santa Fe,6247-1929,17.29,60,primavera,1995-10-23,"[1995-10-23, 1995-10-24, 1995-10-25, 1995-10-26, 1995-10-27, 1995-10-28, 1995-10-29]",false,1096,-29.42420679,-59.97955475,5.55,"[0, 0, 10.3, 6.2, 5.2, 0, 0]",4.303455352783203E-5,298.50326347351074,Complejo indiferenci,-0.00397539883852005,0.2755730946858724,"{""type"":""Point"",""coordinates"":[-59.97955475,-29.424206790000007]}"
1097,14105,14,12/1/2001,Rio Primero,Cordoba,6799-2118,21.24,93,verano,2001-01-08,"[2001-01-08, 2001-01-09, 2001-01-10, 2001-01-11, 2001-01-12, 2001-01-13, 2001-01-14]",false,1097,-30.80593546,-63.17324293,3.7,"[14.2, 8.5, 14, 0, 0, 0, 0]",0.0012788176536560059,298.32523981730145,Molisoles,-0.003991494886577129,0.3928852081298828,"{""type"":""Point"",""coordinates"":[-63.17324293,-30.805935460000004]}"
1098,82133,82,16/5/1994,Vera,Santa Fe,3041-1094,9.46,59,otoño,1994-05-16,"[1994-05-16, 1994-05-17, 1994-05-18, 1994-05-19, 1994-05-20, 1994-05-21, 1994-05-22]",true,1098,-29.72572798,-60.28951287,2.33,"[0, 0, 0, 0.5, 0, 1.7, 0]",5.5909156799316406E-5,290.70568084716797,Lagunas,-0.001825287938117981,0.3891277313232422,"{""type"":""Point"",""coordinates"":[-60.28951287,-29.72572798]}"
1099,82049,82,19/8/2005,General Obligado,Santa Fe,32822-6509,17.99,58,invierno,2005-08-15,"[2005-08-15, 2005-08-16, 2005-08-17, 2005-08-18, 2005-08-19, 2005-08-20, 2005-08-21]",false,1099,-28.6765561,-59.7497004,1.41,"[0.2, 0, 15.2, 0, 0, 0.3, 20.7]",1.5348196029663086E-5,291.6654453277588,Alfisoles,-0.0012292135506868362,0.2839914957682292,"{""type"":""Point"",""coordinates"":[-59.7497004,-28.676556099999996]}"
1100,82077,82,3/8/1992,9 de Julio,Santa Fe,105-105,10.52,84,invierno,1992-08-03,"[1992-08-03, 1992-08-04, 1992-08-05, 1992-08-06, 1992-08-07, 1992-08-08, 1992-08-09]",true,1100,-29.0758472,-61.73625069,5.09,"[0, 0, 0, 0, 0, 0, 0]",5.813837051391602E-4,280.85094769795734,Molisoles,-0.001234523020684719,0.4131825764973958,"{""type"":""Point"",""coordinates"":[-61.73625069,-29.07584719999999]}"
1101,06098,6,19/7/2004,Berisso,Buenos Aires,3314-1708,0.7,7,invierno,2004-07-19,"[2004-07-19, 2004-07-20, 2004-07-21, 2004-07-22, 2004-07-23, 2004-07-24, 2004-07-25]",true,1101,-34.84587606,-57.87973336,3.58,"[0, 0, 0, 8.4, 10.3, 0.7, 13.8]",,,Miscelaneas,,,"{""type"":""Point"",""coordinates"":[-57.87973336,-34.84587606]}"
1102,06490,6,16/2/2001,Lomas de Zamora,Buenos Aires,35405-6949,5.53,9,verano,2001-02-12,"[2001-02-12, 2001-02-13, 2001-02-14, 2001-02-15, 2001-02-16, 2001-02-17, 2001-02-18]",true,1102,-34.73790272,-58.44067537,3,"[0, 0, 0, 0, 0, 0, 0]",2.397298812866211E-4,292.88869222005206,Miscelaneas,-0.005105942487716675,0.44859886169433594,"{""type"":""Point"",""coordinates"":[-58.44067537000001,-34.73790272]}"
1103,06658,6,13/12/2011,Quilmes,Buenos Aires,35407-6950,4.25,3,primavera,2011-12-12,"[2011-12-12, 2011-12-13, 2011-12-14, 2011-12-15, 2011-12-16, 2011-12-17, 2011-12-18]",true,1103,-34.70037841,-58.27664278,2.17,"[0, 2.3, 2.7, 5.9, 0.9, 0.1, 0]",,,Miscelaneas,,,"{""type"":""Point"",""coordinates"":[-58.276642779999996,-34.70037841]}"
1104,06035,6,6/4/2010,Avellaneda,Buenos Aires,35411-6952,1.59,6,otoño,2010-04-05,"[2010-04-05, 2010-04-06, 2010-04-07, 2010-04-08, 2010-04-09, 2010-04-10, 2010-04-11]",true,1104,-34.67500565,-58.31056343,3.38,"[0, 0, 0, 0, 0, 0, 0]",,,Miscelaneas,,,"{""type"":""Point"",""coordinates"":[-58.31056343,-34.675005649999996]}"
1105,02012,2,3/9/2001,Comuna 12,Capital Federal,54-54,3.13,20,invierno,2001-09-03,"[2001-09-03, 2001-09-04, 2001-09-05, 2001-09-06, 2001-09-07, 2001-09-08, 2001-09-09]",true,1105,-34.56062514,-58.47494475,0.93,"[1.2, 0, 0, 0, 16, 0, 0]",0.0010927021503448486,285.08577219645184,Miscelaneas,-0.0010295864194631577,0.4021250406901042,"{""type"":""Point"",""coordinates"":[-58.474944750000006,-34.560625140000006]}"
1106,02004,2,24/7/2005,Comuna 4,Capital Federal,8891-2706,2.09,10,invierno,2005-07-18,"[2005-07-18, 2005-07-19, 2005-07-20, 2005-07-21, 2005-07-22, 2005-07-23, 2005-07-24]",true,1106,-34.64641355,-58.38427103,1.46,"[0, 0, 0, 0, 0.1, 7.5, 0.4]",8.418262004852295E-4,280.7755438486735,Miscelaneas,-0.001988014206290245,0.4351348876953125,"{""type"":""Point"",""coordinates"":[-58.384271029999994,-34.64641355]}"
1107,02013,2,5/6/2004,Comuna 13,Capital Federal,54-54,3.99,10,otoño,2004-05-31,"[2004-05-31, 2004-06-01, 2004-06-02, 2004-06-03, 2004-06-04, 2004-06-05, 2004-06-06]",true,1107,-34.55488152,-58.4502891,3.85,"[0, 0, 0, 0, 0, 0, 0]",1.656264066696167E-4,284.61010615030926,Miscelaneas,-0.0012729642912745476,0.4029553731282552,"{""type"":""Point"",""coordinates"":[-58.4502891,-34.55488152]}"
1108,02006,2,22/2/1994,Comuna 6,Capital Federal,85-85,5.9,32,verano,1994-02-21,"[1994-02-21, 1994-02-22, 1994-02-23, 1994-02-24, 1994-02-25, 1994-02-26, 1994-02-27]",true,1108,-34.6168255,-58.44360311,5.01,"[0, 0, 0, 0, 0, 0, 0.9]",4.86031174659729E-4,298.97636731465656,Miscelaneas,-0.0017366092652082443,0.1353734334309896,"{""type"":""Point"",""coordinates"":[-58.44360310999999,-34.6168255]}"
1109,06056,6,9/1/1995,Bahia Blanca,Buenos Aires,34120-6732,48.75,47,verano,1995-01-09,"[1995-01-09, 1995-01-10, 1995-01-11, 1995-01-12, 1995-01-13, 1995-01-14, 1995-01-15]",false,1109,-38.68387462,-62.21595631,0,"[0.3, 0.4, 4.8, 0, 0, 0, 3.3]",1.9669532775878906E-6,290.6267267862956,Molisoles,-0.0015826169401407242,0.16791280110677084,"{""type"":""Point"",""coordinates"":[-62.21595631,-38.68387462]}"
1110,06203,6,13/3/2000,Coronel Suarez,Buenos Aires,31981-6426,68.12,297,verano,2000-03-13,"[2000-03-13, 2000-03-14, 2000-03-15, 2000-03-16, 2000-03-17, 2000-03-18, 2000-03-19]",false,1110,-37.6402741,-62.0066225,1.85,"[7.3, 0, 13.1, 1.8, 0, 0, 0.1]",7.267296314239502E-5,291.7224750518799,Roca,-0.0015151798725128174,0.2652880350748698,"{""type"":""Point"",""coordinates"":[-62.0066225,-37.64027409999999]}"
1111,06700,6,20/5/1991,Saavedra,Buenos Aires,31981-6426,70.51,362,otoño,1991-05-20,"[1991-05-20, 1991-05-21, 1991-05-22, 1991-05-23, 1991-05-24, 1991-05-25, 1991-05-26]",false,1111,-37.72446606,-62.10173503,5.67,"[0, 0, 0, 0, 0, 0, 0]",5.170702934265137E-6,282.4192975362142,Roca,-8.735731244087219E-4,0.358584721883138,"{""type"":""Point"",""coordinates"":[-62.10173503000001,-37.72446606]}"
1112,06819,6,22/3/1992,Tornquist,Buenos Aires,34120-6732,17.08,142,verano,1992-03-16,"[1992-03-16, 1992-03-17, 1992-03-18, 1992-03-19, 1992-03-20, 1992-03-21, 1992-03-22]",false,1112,-38.41312,-62.79452,2.37,"[0.2, 0, 0, 4.7, 14.8, 0, 0]",3.7550926208496094E-6,295.049612681071,Roca,-0.0028320513665676117,0.3650805155436198,"{""type"":""Point"",""coordinates"":[-62.79452,-38.41312]}"
1113,62021,62,10/4/2003,Bariloche,Rio Negro,6953-2144,0.07,408,otoño,2003-04-07,"[2003-04-07, 2003-04-08, 2003-04-09, 2003-04-10, 2003-04-11, 2003-04-12, 2003-04-13]",true,1113,-41.89814608,-71.50316469,2.66,"[0.1, 1.2, 0, 0, 0, 0, 0]",2.0210444927215576E-4,277.3080088297526,Inceptisoles,-4.878230392932892E-4,0.36066246032714844,"{""type"":""Point"",""coordinates"":[-71.50316469000002,-41.898146080000004]}"
1114,26035,26,4/9/2003,Futaleufu,Chubut,6680-2145,1.68,556,invierno,2003-09-01,"[2003-09-01, 2003-09-02, 2003-09-03, 2003-09-04, 2003-09-05, 2003-09-06, 2003-09-07]",true,1114,-43.48395319,-71.59418478,8.92,"[0, 0.7, 2.2, 14.7, 9.4, 6.3, 0.4]",0.00595758855342865,276.4140040079753,Aridisoles,5.4302625358104706E-5,0.4855308532714844,"{""type"":""Point"",""coordinates"":[-71.59418478,-43.48395319]}"
1115,26035,26,15/4/2006,Futaleufu,Chubut,6680-2145,1.68,556,otoño,2006-04-10,"[2006-04-10, 2006-04-11, 2006-04-12, 2006-04-13, 2006-04-14, 2006-04-15, 2006-04-16]",true,1115,-43.48395319,-71.59418478,8.92,"[8, 2.1, 0, 0, 0, 0, 0]",0.0012124031782150269,283.5209096272786,Aridisoles,-0.001271774061024189,0.4687951405843099,"{""type"":""Point"",""coordinates"":[-71.59418478,-43.48395319]}"
1116,82133,82,8/12/2003,Vera,Santa Fe,3041-1094,9.46,59,primavera,2003-12-08,"[2003-12-08, 2003-12-09, 2003-12-10, 2003-12-11, 2003-12-12, 2003-12-13, 2003-12-14]",true,1116,-29.72572798,-60.28951287,2.33,"[7.9, 0, 0, 0.5, 0, 8.9, 1.1]",2.1147727966308594E-4,295.25525156656903,Lagunas,-0.003055321052670479,0.3094654083251953,"{""type"":""Point"",""coordinates"":[-60.28951287,-29.72572798]}"
1117,82112,82,28/10/2006,San Justo,Santa Fe,6235-1924,3,25,primavera,2006-10-23,"[2006-10-23, 2006-10-24, 2006-10-25, 2006-10-26, 2006-10-27, 2006-10-28, 2006-10-29]",true,1117,-30.8130411,-60.3886502,2.35,"[0, 0, 0.2, 0, 14.8, 1, 54.3]",3.337860107421875E-6,298.9300530751546,Molisoles,-0.0038839075714349747,0.2957146962483724,"{""type"":""Point"",""coordinates"":[-60.3886502,-30.813041099999996]}"
1118,82098,82,7/9/2011,San Javier,Santa Fe,6247-1929,17.29,60,invierno,2011-09-05,"[2011-09-05, 2011-09-06, 2011-09-07, 2011-09-08, 2011-09-09, 2011-09-10, 2011-09-11]",false,1118,-29.42420679,-59.97955475,5.55,"[7.3, 0, 0, 0, 0, 0, 0]",1.4825165271759033E-4,288.5155970255534,Complejo indiferenci,-0.0037939827889204025,0.40442848205566406,"{""type"":""Point"",""coordinates"":[-59.97955475,-29.424206790000007]}"
1119,82091,82,27/12/2002,San Cristobal,Santa Fe,105-105,37.56,78,verano,2002-12-23,"[2002-12-23, 2002-12-24, 2002-12-25, 2002-12-26, 2002-12-27, 2002-12-28, 2002-12-29]",false,1119,-29.88749922,-61.57182768,1.85,"[4.8, 0, 0, 0, 0, 36, 37.1]",8.089542388916016E-4,294.57476170857746,Complejo indiferenci,-0.004986166954040527,0.4973487854003906,"{""type"":""Point"",""coordinates"":[-61.571827680000006,-29.88749922]}"
1120,82070,82,18/3/1995,Las Colonias,Santa Fe,6856-2113,19.32,40,verano,1995-03-13,"[1995-03-13, 1995-03-14, 1995-03-15, 1995-03-16, 1995-03-17, 1995-03-18, 1995-03-19]",false,1120,-31.6618986,-61.0112577,0,"[0, 0, 3.4, 0.2, 0, 0, 0.2]",2.25752592086792E-5,296.42440859476727,Molisoles,-0.002954958938062191,0.37006187438964844,"{""type"":""Point"",""coordinates"":[-61.0112577,-31.6618986]}"
1121,82035,82,4/2/1995,Garay,Santa Fe,33531-6669,2.91,23,verano,1995-01-30,"[1995-01-30, 1995-01-31, 1995-02-01, 1995-02-02, 1995-02-03, 1995-02-04, 1995-02-05]",true,1121,-31.1523125,-60.1365521,2.36,"[0.1, 0, 9.1, 0, 0.8, 0.4, 0]",2.630650997161865E-4,297.4158535003662,Molisoles,-0.004269939847290516,0.18624496459960938,"{""type"":""Point"",""coordinates"":[-60.1365521,-31.152312499999997]}"
1122,82077,82,11/4/2006,9 de Julio,Santa Fe,105-105,10.52,84,otoño,2006-04-10,"[2006-04-10, 2006-04-11, 2006-04-12, 2006-04-13, 2006-04-14, 2006-04-15, 2006-04-16]",true,1122,-29.0758472,-61.73625069,5.09,"[0.1, 0, 0, 1.4, 31.2, 0, 0]",1.773238182067871E-6,294.8289337158203,Molisoles,-0.0026738857850432396,0.41238657633463544,"{""type"":""Point"",""coordinates"":[-61.73625069,-29.07584719999999]}"
1123,30084,30,23/5/2004,Parana,Entre Rios,110-110,12.53,81,otoño,2004-05-17,"[2004-05-17, 2004-05-18, 2004-05-19, 2004-05-20, 2004-05-21, 2004-05-22, 2004-05-23]",true,1123,-31.88541285,-60.23444834,1.43,"[0, 0, 0, 0, 0.6, 3.9, 0.7]",2.3990869522094727E-5,284.51736386617023,Molisoles,-0.00119762122631073,0.4257850646972656,"{""type"":""Point"",""coordinates"":[-60.23444834,-31.88541285]}"
1124,14175,14,7/1/2012,Tulumba,Cordoba,37559-7382,48.1,293,verano,2012-01-02,"[2012-01-02, 2012-01-03, 2012-01-04, 2012-01-05, 2012-01-06, 2012-01-07, 2012-01-08]",false,1124,-29.9823914,-64.49000783,2.33,"[0, 0, 0, 0, 0, 0, 0]",0.0,303.26296552022296,Salinas,-1.6147829592227936E-4,0.10977617899576823,"{""type"":""Point"",""coordinates"":[-64.49000783000001,-29.982391400000004]}"
1125,14140,14,7/3/2007,San Justo,Cordoba,6955-2119,12.54,107,verano,2007-03-05,"[2007-03-05, 2007-03-06, 2007-03-07, 2007-03-08, 2007-03-09, 2007-03-10, 2007-03-11]",true,1125,-31.23400374,-62.74066613,1.08,"[0, 8.8, 65.9, 20.3, 0.1, 0, 0]",9.98377799987793E-7,294.6456470489502,Alfisoles,-0.0027580000460147858,0.3647295633951823,"{""type"":""Point"",""coordinates"":[-62.74066613,-31.234003740000002]}"
1126,14112,14,16/9/2015,Rio Seco,Cordoba,36916-7263,67.01,597,invierno,2015-09-14,"[2015-09-14, 2015-09-15, 2015-09-16, 2015-09-17, 2015-09-18, 2015-09-19, 2015-09-20]",false,1126,-29.8135599,-63.75524,2.83,"[0, 0, 0, 0, 0, 0.3, 0.4]",2.2815167903900146E-4,291.3736508687337,Molisoles,-0.0019187042489647865,0.06682459513346355,"{""type"":""Point"",""coordinates"":[-63.75524,-29.813559900000005]}"
1127,06623,6,14/7/1993,Pergamino,Buenos Aires,140-140,25.11,63,invierno,1993-07-12,"[1993-07-12, 1993-07-13, 1993-07-14, 1993-07-15, 1993-07-16, 1993-07-17, 1993-07-18]",false,1127,-33.5893048,-60.7727646,0.93,"[0.1, 0, 0, 0, 0, 0, 0]",6.691217422485352E-4,279.0629742940267,Alfisoles,-9.217550978064537E-4,0.4421132405598958,"{""type"":""Point"",""coordinates"":[-60.7727646,-33.5893048]}"
1128,06462,6,2/12/2003,Leonardo N. Alem,Buenos Aires,6852-2211,7.44,84,primavera,2003-12-01,"[2003-12-01, 2003-12-02, 2003-12-03, 2003-12-04, 2003-12-05, 2003-12-06, 2003-12-07]",true,1128,-34.4448464,-61.3192363,3.49,"[0, 5.3, 0.2, 12.8, 0, 0, 9.5]",6.394088268280029E-5,296.2981325785319,Complejo indiferenci,-0.00589334312826395,0.26515642801920575,"{""type"":""Point"",""coordinates"":[-61.3192363,-34.4448464]}"
1129,06351,6,12/10/1990,General Pinto,Buenos Aires,6811-2213,37.98,106,primavera,1990-10-08,"[1990-10-08, 1990-10-09, 1990-10-10, 1990-10-11, 1990-10-12, 1990-10-13, 1990-10-14]",false,1129,-34.8011277,-61.8636453,2.17,"[0, 0, 0, 6.8, 0, 0, 0]",3.427267074584961E-6,288.8258921305339,Molisoles,-0.004141092300415039,0.4624195098876953,"{""type"":""Point"",""coordinates"":[-61.8636453,-34.8011277]}"
1130,06175,6,13/9/2001,Colon,Buenos Aires,6852-2211,35.94,86,invierno,2001-09-10,"[2001-09-10, 2001-09-11, 2001-09-12, 2001-09-13, 2001-09-14, 2001-09-15, 2001-09-16]",false,1130,-33.97042426,-61.07620535,4.32,"[0, 0, 0.2, 1, 0, 0.6, 0]",6.277859210968018E-5,286.2217426300049,Molisoles,-0.002696556970477104,0.4383697509765625,"{""type"":""Point"",""coordinates"":[-61.07620535,-33.97042426000001]}"
1131,06147,6,22/3/2009,Carlos Casares,Buenos Aires,36845-7243,60.46,84,verano,2009-03-16,"[2009-03-16, 2009-03-17, 2009-03-18, 2009-03-19, 2009-03-20, 2009-03-21, 2009-03-22]",false,1131,-35.83601,-61.43436,1.47,"[0, 0, 0, 0, 0, 0, 1.3]",4.76837158203125E-7,291.8474006652832,Molisoles,-0.0016541928052902222,0.1709918975830078,"{""type"":""Point"",""coordinates"":[-61.43436,-35.83601]}"
1132,82063,82,11/2/1999,La Capital,Santa Fe,103-103,23.73,25,verano,1999-02-08,"[1999-02-08, 1999-02-09, 1999-02-10, 1999-02-11, 1999-02-12, 1999-02-13, 1999-02-14]",false,1132,-31.18858147,-60.62677383,2.15,"[0, 0, 0, 0, 3, 18.2, 0.1]",2.4646520614624023E-5,292.29458554585773,Molisoles,-0.005530437454581261,0.44740867614746094,"{""type"":""Point"",""coordinates"":[-60.62677383,-31.18858147]}"
1133,30113,30,16/7/1996,Villaguay,Entre Rios,116-116,41.03,64,invierno,1996-07-15,"[1996-07-15, 1996-07-16, 1996-07-17, 1996-07-18, 1996-07-19, 1996-07-20, 1996-07-21]",false,1133,-31.77167964,-59.57091449,0.93,"[0, 0, 0, 0, 0, 0, 0]",2.130866050720215E-6,278.58499908447266,Vertisoles,-0.0011141812428832054,0.39441998799641925,"{""type"":""Point"",""coordinates"":[-59.57091449000001,-31.77167964]}"
1134,30091,30,18/12/2010,Tala,Entre Rios,6833-2205,17.37,52,primavera,2010-12-13,"[2010-12-13, 2010-12-14, 2010-12-15, 2010-12-16, 2010-12-17, 2010-12-18, 2010-12-19]",false,1134,-31.99620378,-59.24649058,1.09,"[0, 0, 0, 0, 0, 3.2, 45.4]",7.648766040802002E-5,290.4473571777344,Molisoles,-0.005917483940720558,0.4361871083577474,"{""type"":""Point"",""coordinates"":[-59.24649058,-31.99620378]}"
1135,30077,30,20/3/2009,Nogoya,Entre Rios,116-116,25.52,78,verano,2009-03-16,"[2009-03-16, 2009-03-17, 2009-03-18, 2009-03-19, 2009-03-20, 2009-03-21, 2009-03-22]",false,1135,-32.17297901,-59.56341301,1.1,"[1.7, 0, 0, 0, 0, 0, 0]",1.6644597053527832E-5,290.5949592590332,Alfisoles,-0.002839459106326103,0.3564332326253255,"{""type"":""Point"",""coordinates"":[-59.563413010000005,-32.172979010000006]}"
1136,30070,30,17/3/2013,La Paz,Entre Rios,6543-2055,11.16,36,verano,2013-03-11,"[2013-03-11, 2013-03-12, 2013-03-13, 2013-03-14, 2013-03-15, 2013-03-16, 2013-03-17]",true,1136,-30.60360412,-59.52751986,4.26,"[11.7, 1.1, 0, 6.4, 0, 0, 0]",9.891390800476074E-5,296.72068850199383,Molisoles,-0.00400935672223568,0.4364770253499349,"{""type"":""Point"",""coordinates"":[-59.52751986,-30.60360412]}"
1137,30056,30,7/12/1992,Gualeguaychu,Entre Rios,9550-2853,31.43,22,primavera,1992-12-07,"[1992-12-07, 1992-12-08, 1992-12-09, 1992-12-10, 1992-12-11, 1992-12-12, 1992-12-13]",false,1137,-33.15450509,-58.98890113,0,"[0, 3.3, 14.8, 11, 0, 0, 0.3]",2.257823944091797E-4,296.0361913045247,Alfisoles,-0.005063118413090706,0.3610954284667969,"{""type"":""Point"",""coordinates"":[-58.98890113000001,-33.15450509]}"
1138,30049,30,9/11/2014,Gualeguay,Entre Rios,39-39,13.76,2,primavera,2014-11-03,"[2014-11-03, 2014-11-04, 2014-11-05, 2014-11-06, 2014-11-07, 2014-11-08, 2014-11-09]",true,1138,-33.55871824,-59.48052013,2.16,"[29.5, 0, 0, 0, 0, 0, 1.9]",0.00988110899925232,288.8380552927653,Entisoles,-0.0015671737492084503,0.5810273488362631,"{""type"":""Point"",""coordinates"":[-59.48052013,-33.558718240000005]}"
1139,30042,30,5/8/2012,Feliciano,Entre Rios,36832-7234,6.85,64,invierno,2012-07-30,"[2012-07-30, 2012-07-31, 2012-08-01, 2012-08-02, 2012-08-03, 2012-08-04, 2012-08-05]",true,1139,-30.42934153,-58.76618814,2.84,"[0, 0, 0, 0, 0, 0, 0]",2.7567148208618164E-6,281.1796016693115,Molisoles,-0.001286858692765236,0.31934165954589844,"{""type"":""Point"",""coordinates"":[-58.766188140000004,-30.42934153]}"
1140,30035,30,14/9/1995,Federal,Entre Rios,36958-7272,25.83,66,invierno,1995-09-11,"[1995-09-11, 1995-09-12, 1995-09-13, 1995-09-14, 1995-09-15, 1995-09-16, 1995-09-17]",false,1140,-30.97193714,-58.99327599,2.16,"[0, 0, 12.6, 0, 0, 0, 0]",9.462237358093262E-6,292.4837754567464,Vertisoles,-0.00338798388838768,0.4614340464274089,"{""type"":""Point"",""coordinates"":[-58.99327599,-30.971937140000005]}"
1141,30021,30,22/11/2012,Diamante,Entre Rios,3331-1725,3.81,30,primavera,2012-11-19,"[2012-11-19, 2012-11-20, 2012-11-21, 2012-11-22, 2012-11-23, 2012-11-24, 2012-11-25]",true,1141,-32.01197804,-60.61726225,1.43,"[0, 0, 0, 17.2, 0, 0, 0]",2.5938451290130615E-4,296.1715653737386,Molisoles,-0.005079268477857113,0.328060785929362,"{""type"":""Point"",""coordinates"":[-60.61726225,-32.01197804]}"
1142,30008,30,12/3/2002,Colon,Entre Rios,32026-6403,25.96,31,verano,2002-03-11,"[2002-03-11, 2002-03-12, 2002-03-13, 2002-03-14, 2002-03-15, 2002-03-16, 2002-03-17]",false,1142,-31.70735861,-58.28660961,1.43,"[38.4, 27.8, 3.5, 1.8, 0, 16.1, 14]",0.0030008554458618164,297.8121706644694,Entisoles,-0.001814565621316433,0.4650885264078776,"{""type"":""Point"",""coordinates"":[-58.28660961,-31.70735861]}"
1143,82063,82,26/9/1998,La Capital,Santa Fe,103-103,23.73,25,primavera,1998-09-21,"[1998-09-21, 1998-09-22, 1998-09-23, 1998-09-24, 1998-09-25, 1998-09-26, 1998-09-27]",false,1143,-31.18858147,-60.62677383,2.15,"[0, 0, 0, 0, 0, 14.7, 0]",1.818239688873291E-4,283.0065511067708,Molisoles,-0.0023350929841399193,0.3331076304117839,"{""type"":""Point"",""coordinates"":[-60.62677383,-31.18858147]}"
1144,82021,82,8/12/1990,Castellanos,Santa Fe,36829-7232,43.75,69,primavera,1990-12-03,"[1990-12-03, 1990-12-04, 1990-12-05, 1990-12-06, 1990-12-07, 1990-12-08, 1990-12-09]",false,1144,-31.38184929,-61.37005997,1.09,"[0, 0, 10, 4.4, 0, 0, 40.2]",4.217028617858887E-5,293.176310857137,Alfisoles,-0.006400488317012787,0.4386285146077474,"{""type"":""Point"",""coordinates"":[-61.37005997,-31.38184929000001]}"
1145,82112,82,27/3/2002,San Justo,Santa Fe,6235-1924,3,25,otoño,2002-03-25,"[2002-03-25, 2002-03-26, 2002-03-27, 2002-03-28, 2002-03-29, 2002-03-30, 2002-03-31]",true,1145,-30.8130411,-60.3886502,2.35,"[1.6, 2.4, 2.8, 14, 28.2, 17.6, 0]",9.866058826446533E-5,297.47111384073895,Molisoles,-0.0027432460337877274,0.42043431599934894,"{""type"":""Point"",""coordinates"":[-60.3886502,-30.813041099999996]}"
1146,82098,82,4/11/1998,San Javier,Santa Fe,6247-1929,17.29,60,primavera,1998-11-02,"[1998-11-02, 1998-11-03, 1998-11-04, 1998-11-05, 1998-11-06, 1998-11-07, 1998-11-08]",false,1146,-29.42420679,-59.97955475,5.55,"[0, 0, 0, 0, 49.7, 0, 0]",5.231797695159912E-4,293.52736218770343,Complejo indiferenci,-0.0038367733359336853,0.315765380859375,"{""type"":""Point"",""coordinates"":[-59.97955475,-29.424206790000007]}"
1147,82091,82,9/4/1990,San Cristobal,Santa Fe,105-105,37.56,78,otoño,1990-04-09,"[1990-04-09, 1990-04-10, 1990-04-11, 1990-04-12, 1990-04-13, 1990-04-14, 1990-04-15]",false,1147,-29.88749922,-61.57182768,1.85,"[0, 0.1, 0.9, 18, 0.3, 0.5, 54.4]",9.521842002868652E-6,295.592565536499,Complejo indiferenci,-0.002108546905219555,0.45116233825683594,"{""type"":""Point"",""coordinates"":[-61.571827680000006,-29.88749922]}"
1148,82070,82,12/8/1996,Las Colonias,Santa Fe,6856-2113,19.32,40,invierno,1996-08-12,"[1996-08-12, 1996-08-13, 1996-08-14, 1996-08-15, 1996-08-16, 1996-08-17, 1996-08-18]",false,1148,-31.6618986,-61.0112577,0,"[0, 0, 0, 0, 0, 0, 0]",3.1739473342895508E-6,285.2746760050456,Molisoles,-0.0017613600939512253,0.389010747273763,"{""type"":""Point"",""coordinates"":[-61.0112577,-31.6618986]}"
1149,82063,82,17/4/2005,La Capital,Santa Fe,103-103,23.73,25,otoño,2005-04-11,"[2005-04-11, 2005-04-12, 2005-04-13, 2005-04-14, 2005-04-15, 2005-04-16, 2005-04-17]",false,1149,-31.18858147,-60.62677383,2.15,"[35.6, 0, 7.3, 0, 0, 0, 0]",0.014392703771591187,293.47706031799316,Molisoles,-6.67177140712738E-4,0.4701576232910156,"{""type"":""Point"",""coordinates"":[-60.62677383,-31.18858147]}"
1150,82049,82,20/12/2009,General Obligado,Santa Fe,32822-6509,17.99,58,primavera,2009-12-14,"[2009-12-14, 2009-12-15, 2009-12-16, 2009-12-17, 2009-12-18, 2009-12-19, 2009-12-20]",false,1150,-28.6765561,-59.7497004,1.41,"[0, 0, 0.2, 0.6, 1, 0.2, 40.4]",1.0728836059570312E-6,296.0706437428792,Alfisoles,-0.006153087131679058,0.42372576395670575,"{""type"":""Point"",""coordinates"":[-59.7497004,-28.676556099999996]}"
1151,82021,82,4/1/1993,Castellanos,Santa Fe,36829-7232,43.75,69,verano,1993-01-04,"[1993-01-04, 1993-01-05, 1993-01-06, 1993-01-07, 1993-01-08, 1993-01-09, 1993-01-10]",false,1151,-31.38184929,-61.37005997,1.09,"[0.8, 0.8, 15.1, 48.3, 0, 0, 0]",6.397813558578491E-5,298.22836049397785,Alfisoles,-0.004773267544806004,0.4744192759195964,"{""type"":""Point"",""coordinates"":[-61.37005997,-31.38184929000001]}"
1152,02012,2,10/10/2008,Comuna 12,Capital Federal,54-54,3.13,20,primavera,2008-10-06,"[2008-10-06, 2008-10-07, 2008-10-08, 2008-10-09, 2008-10-10, 2008-10-11, 2008-10-12]",true,1152,-34.56062514,-58.47494475,0.93,"[0, 0, 0, 0, 0, 0, 14.4]",8.744001388549805E-5,290.5713424682617,Miscelaneas,-0.003592272289097309,0.264034907023112,"{""type"":""Point"",""coordinates"":[-58.474944750000006,-34.560625140000006]}"
1153,06357,6,16/6/2005,General Pueyrredon,Buenos Aires,3347-1742,17.47,21,otoño,2005-06-13,"[2005-06-13, 2005-06-14, 2005-06-15, 2005-06-16, 2005-06-17, 2005-06-18, 2005-06-19]",false,1153,-37.80766254,-57.62989086,5.55,"[1.2, 0, 2.1, 15.3, 5.7, 0.7, 0]",2.4393200874328613E-5,282.7960090637207,Molisoles,-0.0010484885424375534,0.46178118387858075,"{""type"":""Point"",""coordinates"":[-57.62989086,-37.80766254000001]}"
1154,90077,90,28/8/2013,Rio Chico,Tucuman,6896-2166,16.62,376,invierno,2013-08-26,"[2013-08-26, 2013-08-27, 2013-08-28, 2013-08-29, 2013-08-30, 2013-08-31, 2013-09-01]",false,1154,-27.4543092,-65.603622,9.42,"[0, 0, 0, 0, 0, 0, 0]",2.696514129638672E-4,280.9980932871501,Roca,-0.002281186170876026,0.2573432922363281,"{""type"":""Point"",""coordinates"":[-65.603622,-27.4543092]}"
1155,06840,6,17/4/1991,Tres de Febrero,Buenos Aires,36837-7237,6.8,27,otoño,1991-04-15,"[1991-04-15, 1991-04-16, 1991-04-17, 1991-04-18, 1991-04-19, 1991-04-20, 1991-04-21]",true,1155,-34.60887295,-58.56366446,1.85,"[13.1, 24.3, 2.5, 0, 0, 0, 0]",5.5789947509765625E-5,292.9014727274577,Miscelaneas,-9.83167439699173E-4,0.3393745422363281,"{""type"":""Point"",""coordinates"":[-58.563664460000005,-34.60887294999999]}"
1156,06427,6,17/2/2015,La Matanza,Buenos Aires,33486-6512,4.98,8,verano,2015-02-16,"[2015-02-16, 2015-02-17, 2015-02-18, 2015-02-19, 2015-02-20, 2015-02-21, 2015-02-22]",true,1156,-34.71417289,-58.50890438,7.28,"[0, 0, 10.6, 0, 0, 1.8, 0]",2.40229070186615E-4,297.0889314015706,Molisoles,-0.0012980513274669647,0.16315142313639322,"{""type"":""Point"",""coordinates"":[-58.50890437999999,-34.71417289000001]}"
1157,06638,6,27/12/2015,Pilar,Buenos Aires,42-42,10.41,16,verano,2015-12-21,"[2015-12-21, 2015-12-22, 2015-12-23, 2015-12-24, 2015-12-25, 2015-12-26, 2015-12-27]",true,1157,-34.42200558,-58.95283788,1.46,"[1.5, 8.9, 1.8, 0, 0, 0, 0]",1.856684684753418E-5,297.06597963968915,Molisoles,-0.002802319824695587,0.2943566640218099,"{""type"":""Point"",""coordinates"":[-58.95283788,-34.42200558]}"
1158,06638,6,7/9/2001,Pilar,Buenos Aires,42-42,10.41,16,invierno,2001-09-03,"[2001-09-03, 2001-09-04, 2001-09-05, 2001-09-06, 2001-09-07, 2001-09-08, 2001-09-09]",true,1158,-34.42200558,-58.95283788,1.46,"[1, 0, 0, 0, 13.5, 0, 0]",1.8599629402160645E-4,284.92602284749347,Molisoles,-7.288819178938866E-4,0.4690233866373698,"{""type"":""Point"",""coordinates"":[-58.95283788,-34.42200558]}"
1159,02010,2,13/2/1996,Comuna 10,Capital Federal,36837-7237,4.71,24,verano,1996-02-12,"[1996-02-12, 1996-02-13, 1996-02-14, 1996-02-15, 1996-02-16, 1996-02-17, 1996-02-18]",true,1159,-34.62768629,-58.48358728,1.46,"[0, 0, 0, 0.1, 0, 0, 0]",9.390711784362793E-5,292.809045791626,Miscelaneas,-0.002029506489634514,0.20220438639322916,"{""type"":""Point"",""coordinates"":[-58.48358728,-34.62768628999999]}"
1160,02012,2,9/8/1996,Comuna 12,Capital Federal,54-54,3.13,20,invierno,1996-08-05,"[1996-08-05, 1996-08-06, 1996-08-07, 1996-08-08, 1996-08-09, 1996-08-10, 1996-08-11]",true,1160,-34.56062514,-58.47494475,0.93,"[18.8, 1.2, 0.1, 6.7, 4.5, 0, 0]",7.14421272277832E-4,286.54470380147296,Miscelaneas,-9.238161146640778E-4,0.42217445373535156,"{""type"":""Point"",""coordinates"":[-58.474944750000006,-34.560625140000006]}"
1161,02015,2,24/8/1999,Comuna 15,Capital Federal,36837-7237,2.81,29,invierno,1999-08-23,"[1999-08-23, 1999-08-24, 1999-08-25, 1999-08-26, 1999-08-27, 1999-08-28, 1999-08-29]",true,1161,-34.59294425,-58.48867142,4.63,"[4.2, 36.3, 0.1, 0, 0, 0, 0]",4.375725984573364E-4,283.5503234863281,Miscelaneas,-0.0019770562648773193,0.39673105875651044,"{""type"":""Point"",""coordinates"":[-58.48867142,-34.59294425]}"
1162,02013,2,23/5/2015,Comuna 13,Capital Federal,54-54,3.99,10,otoño,2015-05-18,"[2015-05-18, 2015-05-19, 2015-05-20, 2015-05-21, 2015-05-22, 2015-05-23, 2015-05-24]",true,1162,-34.55488152,-58.4502891,3.85,"[0.7, 0, 0, 0, 0.4, 3.9, 0]",1.8496811389923096E-4,293.7314275105794,Miscelaneas,-8.899383246898651E-4,0.22406323750813803,"{""type"":""Point"",""coordinates"":[-58.4502891,-34.55488152]}"
1163,02015,2,21/2/2000,Comuna 15,Capital Federal,36837-7237,2.81,29,verano,2000-02-21,"[2000-02-21, 2000-02-22, 2000-02-23, 2000-02-24, 2000-02-25, 2000-02-26, 2000-02-27]",true,1163,-34.59294425,-58.48867142,4.63,"[0, 0, 0, 0, 0.2, 0.5, 34.8]",1.2609362602233887E-4,296.90395100911456,Miscelaneas,-0.0019004447385668755,0.20338312784830728,"{""type"":""Point"",""coordinates"":[-58.48867142,-34.59294425]}"
1164,02001,2,27/8/2015,Comuna 1,Capital Federal,8891-2706,1.05,28,invierno,2015-08-24,"[2015-08-24, 2015-08-25, 2015-08-26, 2015-08-27, 2015-08-28, 2015-08-29, 2015-08-30]",true,1164,-34.62504786,-58.38438723,3.7,"[0, 0, 2.2, 0, 0, 0, 0]",1.4698505401611328E-4,282.7907943725586,Miscelaneas,-0.0022464413195848465,0.3742624918619792,"{""type"":""Point"",""coordinates"":[-58.38438723000001,-34.62504786000001]}"
1165,02005,2,3/12/2014,Comuna 5,Capital Federal,85-85,3.75,37,primavera,2014-12-01,"[2014-12-01, 2014-12-02, 2014-12-03, 2014-12-04, 2014-12-05, 2014-12-06, 2014-12-07]",true,1165,-34.60922769,-58.42174523,2.44,"[0, 0, 0, 0, 0, 0, 3.8]",7.780790328979492E-4,289.0684102376302,Miscelaneas,-0.004485974088311195,0.39718882242838544,"{""type"":""Point"",""coordinates"":[-58.42174523,-34.609227690000004]}"
1166,02002,2,15/1/2005,Comuna 2,Capital Federal,85-85,1.52,30,verano,2005-01-10,"[2005-01-10, 2005-01-11, 2005-01-12, 2005-01-13, 2005-01-14, 2005-01-15, 2005-01-16]",true,1166,-34.58587601,-58.39499618,1.85,"[0, 0, 0, 1.7, 11, 0.1, 0]",2.597719430923462E-4,296.16503143310547,Miscelaneas,-0.003698701038956642,0.14644813537597656,"{""type"":""Point"",""coordinates"":[-58.39499618,-34.58587601000001]}"
1167,06840,6,14/9/2003,Tres de Febrero,Buenos Aires,36837-7237,6.8,27,invierno,2003-09-08,"[2003-09-08, 2003-09-09, 2003-09-10, 2003-09-11, 2003-09-12, 2003-09-13, 2003-09-14]",true,1167,-34.60887295,-58.56366446,1.85,"[0.2, 0.3, 0, 0, 0, 0, 0]",4.61384654045105E-4,285.0426489512126,Miscelaneas,-0.0025090184062719345,0.48009363810221356,"{""type"":""Point"",""coordinates"":[-58.563664460000005,-34.60887294999999]}"
1168,06490,6,10/8/2006,Lomas de Zamora,Buenos Aires,35405-6949,5.53,9,invierno,2006-08-07,"[2006-08-07, 2006-08-08, 2006-08-09, 2006-08-10, 2006-08-11, 2006-08-12, 2006-08-13]",true,1168,-34.73790272,-58.44067537,3,"[5.9, 0, 0, 0, 0, 0, 0]",1.7102062702178955E-4,286.1482276916504,Miscelaneas,-8.249003440141678E-4,0.3989245096842448,"{""type"":""Point"",""coordinates"":[-58.44067537000001,-34.73790272]}"
1169,06252,6,6/1/1997,Escobar,Buenos Aires,42-42,1.31,4,verano,1997-01-06,"[1997-01-06, 1997-01-07, 1997-01-08, 1997-01-09, 1997-01-10, 1997-01-11, 1997-01-12]",true,1169,-34.3007971,-58.7215474,2.24,"[0.6, 40.1, 5.8, 0, 0, 5.1, 1.9]",6.191432476043701E-6,300.2352244059245,Molisoles,-0.004961442202329636,0.3930931091308594,"{""type"":""Point"",""coordinates"":[-58.7215474,-34.3007971]}"
1170,06134,6,10/2/2011,Canuelas,Buenos Aires,3274-1695,30.68,34,verano,2011-02-07,"[2011-02-07, 2011-02-08, 2011-02-09, 2011-02-10, 2011-02-11, 2011-02-12, 2011-02-13]",false,1170,-35.2637758,-58.6725328,0.93,"[11.1, 0.3, 0.2, 0, 0, 0, 0]",8.442997932434082E-5,292.18257331848145,Complejo indiferenci,-0.0022587906569242477,0.3579120635986328,"{""type"":""Point"",""coordinates"":[-58.6725328,-35.26377579999999]}"
1171,06126,6,18/11/1996,Campana,Buenos Aires,26206-5876,0.02,4,primavera,1996-11-18,"[1996-11-18, 1996-11-19, 1996-11-20, 1996-11-21, 1996-11-22, 1996-11-23, 1996-11-24]",true,1171,-34.059934,-58.836065,2.91,"[0, 0, 0, 0, 0.9, 0, 0]",5.960464477539063E-8,296.0844618479411,Rio,-0.005489707924425602,0.39221445719401044,"{""type"":""Point"",""coordinates"":[-58.836065000000005,-34.059934]}"
1172,06638,6,4/12/2000,Pilar,Buenos Aires,34357-5904,12.77,16,primavera,2000-12-04,"[2000-12-04, 2000-12-05, 2000-12-06, 2000-12-07, 2000-12-08, 2000-12-09, 2000-12-10]",true,1172,-34.42200558,-58.95283788,1.46,"[0, 0, 0, 0, 0, 0, 0.1]",4.2706727981567383E-4,289.8692995707194,Molisoles,-0.004777632653713226,0.31971995035807294,"{""type"":""Point"",""coordinates"":[-58.95283788,-34.42200558]}"
1173,02011,2,6/2/2006,Comuna 11,Capital Federal,36837-7237,3.14,29,verano,2006-02-06,"[2006-02-06, 2006-02-07, 2006-02-08, 2006-02-09, 2006-02-10, 2006-02-11, 2006-02-12]",true,1173,-34.6042463,-58.49067643,2.78,"[0, 0, 0, 0, 0.1, 0, 0]",1.6207993030548096E-4,295.95784695943195,Miscelaneas,-0.006855187006294727,0.32485389709472656,"{""type"":""Point"",""coordinates"":[-58.49067643,-34.60424629999999]}"
1174,02006,2,3/7/2006,Comuna 6,Capital Federal,85-85,5.9,32,invierno,2006-07-03,"[2006-07-03, 2006-07-04, 2006-07-05, 2006-07-06, 2006-07-07, 2006-07-08, 2006-07-09]",true,1174,-34.6168255,-58.44360311,5.01,"[0.5, 0.5, 0, 0, 0.4, 5.4, 0]",1.5854835510253906E-4,288.8987299601237,Miscelaneas,-3.445427864789963E-4,0.38941319783528644,"{""type"":""Point"",""coordinates"":[-58.44360310999999,-34.6168255]}"
1175,02013,2,27/10/2002,Comuna 13,Capital Federal,54-54,3.99,10,primavera,2002-10-21,"[2002-10-21, 2002-10-22, 2002-10-23, 2002-10-24, 2002-10-25, 2002-10-26, 2002-10-27]",true,1175,-34.55488152,-58.4502891,3.85,"[0, 0, 0, 0, 0.2, 0.7, 18.4]",8.248090744018555E-4,283.1746120452881,Miscelaneas,-0.004807034507393837,0.44876352945963544,"{""type"":""Point"",""coordinates"":[-58.4502891,-34.55488152]}"
1176,06357,6,1/8/1997,General Pueyrredon,Buenos Aires,3347-1742,17.47,21,invierno,1997-07-28,"[1997-07-28, 1997-07-29, 1997-07-30, 1997-07-31, 1997-08-01, 1997-08-02, 1997-08-03]",false,1176,-37.80766254,-57.62989086,5.55,"[0, 0, 3.9, 0, 0, 1, 0.3]",1.817941665649414E-6,291.9878094991048,Molisoles,-0.0010994793847203255,0.460751215616862,"{""type"":""Point"",""coordinates"":[-57.62989086,-37.80766254000001]}"
1177,02008,2,13/4/2015,Comuna 8,Capital Federal,36837-7237,7.49,21,otoño,2015-04-13,"[2015-04-13, 2015-04-14, 2015-04-15, 2015-04-16, 2015-04-17, 2015-04-18, 2015-04-19]",true,1177,-34.67499358,-58.47616299,1.13,"[0, 0, 0.1, 0.5, 18.7, 0, 0]",1.4562904834747314E-4,295.46736971537274,Miscelaneas,-0.0018186094239354134,0.2584673563639323,"{""type"":""Point"",""coordinates"":[-58.47616299,-34.67499358]}"
1178,02007,2,6/9/2014,Comuna 7,Capital Federal,36837-7237,7.04,22,invierno,2014-09-01,"[2014-09-01, 2014-09-02, 2014-09-03, 2014-09-04, 2014-09-05, 2014-09-06, 2014-09-07]",true,1178,-34.63680708,-58.45826985,2.25,"[0, 0.8, 1, 2.7, 19.8, 8.3, 0]",8.711665868759155E-4,286.3592878977458,Miscelaneas,-0.0016139699146151543,0.37175877888997394,"{""type"":""Point"",""coordinates"":[-58.45826984999999,-34.63680708]}"
1179,02001,2,27/4/2006,Comuna 1,Capital Federal,8891-2706,1.05,28,otoño,2006-04-24,"[2006-04-24, 2006-04-25, 2006-04-26, 2006-04-27, 2006-04-28, 2006-04-29, 2006-04-30]",true,1179,-34.62504786,-58.38438723,3.7,"[0, 0, 0, 0, 1.5, 8.1, 0]",1.9727647304534912E-4,290.44336191813153,Miscelaneas,-0.001975596882402897,0.2964515686035156,"{""type"":""Point"",""coordinates"":[-58.38438723000001,-34.62504786000001]}"
1180,06840,6,17/3/1990,Tres de Febrero,Buenos Aires,36837-7237,6.8,27,verano,1990-03-12,"[1990-03-12, 1990-03-13, 1990-03-14, 1990-03-15, 1990-03-16, 1990-03-17, 1990-03-18]",true,1180,-34.60887295,-58.56366446,1.85,"[0, 4.7, 0, 0, 0, 0.1, 0]",6.839632987976074E-6,294.8951886494954,Miscelaneas,-0.00432630255818367,0.4384930928548177,"{""type"":""Point"",""coordinates"":[-58.563664460000005,-34.60887294999999]}"
1181,06035,6,17/6/2002,Avellaneda,Buenos Aires,35411-6952,1.59,6,otoño,2002-06-17,"[2002-06-17, 2002-06-18, 2002-06-19, 2002-06-20, 2002-06-21, 2002-06-22, 2002-06-23]",true,1181,-34.67500565,-58.31056343,3.38,"[0, 0, 0, 0, 0, 0, 0]",,,Miscelaneas,,,"{""type"":""Point"",""coordinates"":[-58.31056343,-34.675005649999996]}"
1182,50042,50,8/1/2011,La Paz,Mendoza,31950-2172,13.02,470,verano,2011-01-03,"[2011-01-03, 2011-01-04, 2011-01-05, 2011-01-06, 2011-01-07, 2011-01-08, 2011-01-09]",true,1182,-33.55845261,-67.25244904,1.45,"[4, 25, 0, 0, 0, 0.1, 5.1]",7.453560829162598E-5,296.7873344421387,Entisoles,-0.005246582441031933,0.3692773183186849,"{""type"":""Point"",""coordinates"":[-67.25244904,-33.55845261]}"
1183,06357,6,28/5/2006,General Pueyrredon,Buenos Aires,3347-1742,17.47,21,otoño,2006-05-22,"[2006-05-22, 2006-05-23, 2006-05-24, 2006-05-25, 2006-05-26, 2006-05-27, 2006-05-28]",false,1183,-37.80766254,-57.62989086,5.55,"[0.9, 0, 0, 0.6, 1.8, 0, 0]",1.0862946510314941E-5,281.3794460296631,Molisoles,-8.986406028270721E-4,0.32396189371744794,"{""type"":""Point"",""coordinates"":[-57.62989086,-37.80766254000001]}"
1184,82098,82,10/8/2004,San Javier,Santa Fe,6247-1929,17.29,60,invierno,2004-08-09,"[2004-08-09, 2004-08-10, 2004-08-11, 2004-08-12, 2004-08-13, 2004-08-14, 2004-08-15]",false,1184,-29.42420679,-59.97955475,5.55,"[0, 0, 0, 0, 0, 0, 0]",1.4096498489379883E-5,283.2350616455078,Complejo indiferenci,-0.0016174670308828354,0.3544127146402995,"{""type"":""Point"",""coordinates"":[-59.97955475,-29.424206790000007]}"
1185,06351,6,10/11/2015,General Pinto,Buenos Aires,6811-2213,37.98,106,primavera,2015-11-09,"[2015-11-09, 2015-11-10, 2015-11-11, 2015-11-12, 2015-11-13, 2015-11-14, 2015-11-15]",false,1185,-34.8011277,-61.8636453,2.17,"[9.2, 0, 0, 39.6, 0.3, 0, 0]",1.3655424118041992E-4,292.85365867614746,Molisoles,-0.002198457717895508,0.3768666585286458,"{""type"":""Point"",""coordinates"":[-61.8636453,-34.8011277]}"
1186,06277,6,6/1/2014,Florentino Ameghino,Buenos Aires,6885-2219,19.32,117,verano,2014-01-06,"[2014-01-06, 2014-01-07, 2014-01-08, 2014-01-09, 2014-01-10, 2014-01-11, 2014-01-12]",false,1186,-34.81670709,-62.44968298,0.93,"[0, 0, 0, 3.5, 0, 0, 0]",3.725290298461914E-8,301.9385579427083,Molisoles,-0.0014998223632574081,0.2663288116455078,"{""type"":""Point"",""coordinates"":[-62.44968298,-34.81670709]}"
1187,06245,6,1/12/1993,Ensenada,Buenos Aires,3314-1708,6.45,8,primavera,1993-11-29,"[1993-11-29, 1993-11-30, 1993-12-01, 1993-12-02, 1993-12-03, 1993-12-04, 1993-12-05]",true,1187,-34.87584856,-57.9336299,5.71,"[0, 21.2, 0, 0, 16, 3, 0]",3.333538770675659E-4,291.9599978129069,Miscelaneas,-0.005009002983570099,0.43247095743815106,"{""type"":""Point"",""coordinates"":[-57.9336299,-34.875848559999994]}"
1188,06077,6,27/4/1997,Bartolome Mitre,Buenos Aires,6745-2129,17.6,31,otoño,1997-04-21,"[1997-04-21, 1997-04-22, 1997-04-23, 1997-04-24, 1997-04-25, 1997-04-26, 1997-04-27]",false,1188,-33.9628001,-59.8615291,2.16,"[0, 0, 0, 10, 0, 0, 0]",7.748603820800781E-7,288.44987297058105,Molisoles,-9.725000709295273E-4,0.3989798227945964,"{""type"":""Point"",""coordinates"":[-59.861529100000006,-33.9628001]}"
1189,06070,6,24/8/2000,Baradero,Buenos Aires,39-39,5.39,33,invierno,2000-08-21,"[2000-08-21, 2000-08-22, 2000-08-23, 2000-08-24, 2000-08-25, 2000-08-26, 2000-08-27]",true,1189,-33.8417492,-59.4518203,4.55,"[33.3, 23.9, 0.8, 0.4, 0.2, 0, 1.6]",0.004793107509613037,291.19608370463055,Rio,-0.0016568638384342194,0.5438753763834635,"{""type"":""Point"",""coordinates"":[-59.45182030000001,-33.8417492]}"
1190,82063,82,17/6/1996,La Capital,Santa Fe,103-103,23.73,25,otoño,1996-06-17,"[1996-06-17, 1996-06-18, 1996-06-19, 1996-06-20, 1996-06-21, 1996-06-22, 1996-06-23]",false,1190,-31.18858147,-60.62677383,2.15,"[0.1, 0, 0, 1.6, 0, 0, 0]",4.082918167114258E-6,285.0286070505778,Molisoles,-6.023477762937546E-4,0.4654693603515625,"{""type"":""Point"",""coordinates"":[-60.62677383,-31.18858147]}"
1191,58091,58,15/4/2015,Pehuenches,Neuquen,36849-7246,13.15,1786,otoño,2015-04-13,"[2015-04-13, 2015-04-14, 2015-04-15, 2015-04-16, 2015-04-17, 2015-04-18, 2015-04-19]",true,1191,-36.92528915,-69.9850235,5.78,"[0, 1.7, 2, 2, 0, 0, 4.5]",1.042485237121582E-4,284.47550773620605,Entisoles,-7.809856906533241E-4,0.051021575927734375,"{""type"":""Point"",""coordinates"":[-69.9850235,-36.92528915]}"
1192,06833,6,3/4/2001,Tres Arroyos,Buenos Aires,36844-7242,76.95,163,otoño,2001-04-02,"[2001-04-02, 2001-04-03, 2001-04-04, 2001-04-05, 2001-04-06, 2001-04-07, 2001-04-08]",false,1192,-38.2667152,-60.4002814,2.78,"[1.4, 2, 0, 1.7, 0, 0, 0]",5.781650543212891E-6,291.4017969767253,Molisoles,-0.0017112232744693756,0.2793763478597005,"{""type"":""Point"",""coordinates"":[-60.400281400000004,-38.26671519999999]}"
1193,06427,6,12/4/2009,La Matanza,Buenos Aires,33486-6512,4.98,8,otoño,2009-04-06,"[2009-04-06, 2009-04-07, 2009-04-08, 2009-04-09, 2009-04-10, 2009-04-11, 2009-04-12]",true,1193,-34.71417289,-58.50890438,7.28,"[0, 0, 0, 0, 0, 0, 0]",2.644956111907959E-5,292.7123107910156,Molisoles,-0.002780824899673462,0.3851006825764974,"{""type"":""Point"",""coordinates"":[-58.50890437999999,-34.71417289000001]}"
1194,06427,6,13/2/1998,La Matanza,Buenos Aires,33486-6512,4.98,8,verano,1998-02-09,"[1998-02-09, 1998-02-10, 1998-02-11, 1998-02-12, 1998-02-13, 1998-02-14, 1998-02-15]",true,1194,-34.71417289,-58.50890438,7.28,"[0, 0, 0, 0, 0, 0, 0.1]",6.93202018737793E-5,292.15797932942706,Molisoles,-0.003537079319357872,0.4611682891845703,"{""type"":""Point"",""coordinates"":[-58.50890437999999,-34.71417289000001]}"
1195,82084,82,16/5/2011,Rosario,Santa Fe,118-118,22.58,64,otoño,2011-05-16,"[2011-05-16, 2011-05-17, 2011-05-18, 2011-05-19, 2011-05-20, 2011-05-21, 2011-05-22]",false,1195,-33.07901008,-60.91379957,1.11,"[0, 0, 0, 0, 0, 0, 0]",1.1920928955078125E-6,287.95634778340656,Alfisoles,-0.0010508792474865913,0.42431640625,"{""type"":""Point"",""coordinates"":[-60.91379957,-33.07901008]}"
1196,30098,30,18/5/2008,Uruguay,Entre Rios,7061-2233,5.89,21,otoño,2008-05-12,"[2008-05-12, 2008-05-13, 2008-05-14, 2008-05-15, 2008-05-16, 2008-05-17, 2008-05-18]",true,1196,-32.38095474,-58.23688127,0,"[0, 0, 0, 0, 0, 0, 0.8]",7.350742816925049E-5,288.211145401001,Entisoles,-0.0013660658150911331,0.1303558349609375,"{""type"":""Point"",""coordinates"":[-58.23688127,-32.38095474000001]}"
1197,30063,30,21/10/2008,Islas del Ibicuy,Entre Rios,25459-1836,8.14,3,primavera,2008-10-20,"[2008-10-20, 2008-10-21, 2008-10-22, 2008-10-23, 2008-10-24, 2008-10-25, 2008-10-26]",true,1197,-33.7787707,-58.54070986,2.16,"[0, 23.5, 0, 0, 0, 1, 8.7]",1.189112663269043E-5,293.73548634847003,Entisoles,-0.003954319283366203,0.45020612080891925,"{""type"":""Point"",""coordinates"":[-58.54070986000001,-33.7787707]}"
1198,30015,30,11/5/2008,Concordia,Entre Rios,6557-2063,4.51,37,otoño,2008-05-05,"[2008-05-05, 2008-05-06, 2008-05-07, 2008-05-08, 2008-05-09, 2008-05-10, 2008-05-11]",true,1198,-31.35230446,-58.05355072,6.42,"[0, 0, 0, 0, 0, 0, 0]",6.718933582305908E-5,287.0756498972575,Vertisoles,-0.002053036354482174,0.1859893798828125,"{""type"":""Point"",""coordinates"":[-58.05355072,-31.352304459999996]}"
1199,06077,6,27/9/2014,Bartolome Mitre,Buenos Aires,6745-2129,17.6,31,primavera,2014-09-22,"[2014-09-22, 2014-09-23, 2014-09-24, 2014-09-25, 2014-09-26, 2014-09-27, 2014-09-28]",false,1199,-33.9628001,-59.8615291,2.16,"[0, 3.5, 0, 2.9, 0, 0, 5.7]",2.218782901763916E-5,289.52929496765137,Molisoles,-0.0033358773216605186,0.413723627726237,"{""type"":""Point"",""coordinates"":[-59.861529100000006,-33.9628001]}"
1200,06763,6,18/8/1990,San Nicolas,Buenos Aires,6776-2114,14.58,50,invierno,1990-08-13,"[1990-08-13, 1990-08-14, 1990-08-15, 1990-08-16, 1990-08-17, 1990-08-18, 1990-08-19]",true,1200,-33.6042287,-60.4178226,1.45,"[0, 18.1, 0, 0, 0, 0, 0]",2.7418136596679688E-5,293.8990675608317,Molisoles,-0.0020447988063097,0.37445640563964844,"{""type"":""Point"",""coordinates"":[-60.417822599999994,-33.6042287]}"
1201,06763,6,27/3/2007,San Nicolas,Buenos Aires,6776-2114,14.58,50,otoño,2007-03-26,"[2007-03-26, 2007-03-27, 2007-03-28, 2007-03-29, 2007-03-30, 2007-03-31, 2007-04-01]",true,1201,-33.6042287,-60.4178226,1.45,"[11.9, 29.3, 61.6, 60.7, 51.8, 8.8, 7.1]",1.8334388732910156E-4,294.551716486613,Molisoles,-0.001262657344341278,0.4111410776774089,"{""type"":""Point"",""coordinates"":[-60.417822599999994,-33.6042287]}"
1202,06665,6,18/3/2002,Ramallo,Buenos Aires,3325-1719,9.81,37,verano,2002-03-18,"[2002-03-18, 2002-03-19, 2002-03-20, 2002-03-21, 2002-03-22, 2002-03-23, 2002-03-24]",true,1202,-33.6241496,-60.0461017,3.82,"[25.3, 14.5, 0, 0, 0, 0, 2.2]",0.0028838366270065308,293.8774897257487,Rio,-0.0017856564372777939,0.5385456085205078,"{""type"":""Point"",""coordinates"":[-60.04610170000001,-33.6241496]}"
1203,06351,6,7/2/2014,General Pinto,Buenos Aires,6811-2213,37.98,106,verano,2014-02-03,"[2014-02-03, 2014-02-04, 2014-02-05, 2014-02-06, 2014-02-07, 2014-02-08, 2014-02-09]",false,1203,-34.8011277,-61.8636453,2.17,"[12.2, 2, 29.6, 2.5, 0.1, 25.8, 0]",0.0021567940711975098,295.78365325927734,Molisoles,-0.002599993720650673,0.47330665588378906,"{""type"":""Point"",""coordinates"":[-61.8636453,-34.8011277]}"
1204,06277,6,7/9/2015,Florentino Ameghino,Buenos Aires,6885-2219,19.32,117,invierno,2015-09-07,"[2015-09-07, 2015-09-08, 2015-09-09, 2015-09-10, 2015-09-11, 2015-09-12, 2015-09-13]",false,1204,-34.81670709,-62.44968298,0.93,"[1, 0.3, 23.1, 0, 0, 0, 0]",1.1816620826721191E-5,288.553227742513,Molisoles,-0.0019415970891714096,0.3277740478515625,"{""type"":""Point"",""coordinates"":[-62.44968298,-34.81670709]}"
1205,82105,82,25/11/1997,San Jeronimo,Santa Fe,123-123,29.33,42,primavera,1997-11-24,"[1997-11-24, 1997-11-25, 1997-11-26, 1997-11-27, 1997-11-28, 1997-11-29, 1997-11-30]",false,1205,-32.2399352,-61.231266,4.95,"[10.5, 67.9, 0.4, 0, 0, 0.8, 1.4]",1.2351572513580322E-4,294.89535586039227,Molisoles,-0.004893966019153595,0.3758780161539714,"{""type"":""Point"",""coordinates"":[-61.231266,-32.2399352]}"
1206,82063,82,1/2/2005,La Capital,Santa Fe,103-103,23.73,25,verano,2005-01-31,"[2005-01-31, 2005-02-01, 2005-02-02, 2005-02-03, 2005-02-04, 2005-02-05, 2005-02-06]",false,1206,-31.18858147,-60.62677383,2.15,"[12.2, 0, 0, 0, 0, 0.1, 0.8]",0.0012798309326171875,290.58625920613605,Molisoles,-0.0031672315672039986,0.4631919860839844,"{""type"":""Point"",""coordinates"":[-60.62677383,-31.18858147]}"
1207,82042,82,8/6/1996,General Lopez,Santa Fe,6725-2212,8.61,121,otoño,1996-06-03,"[1996-06-03, 1996-06-04, 1996-06-05, 1996-06-06, 1996-06-07, 1996-06-08, 1996-06-09]",true,1207,-34.17471073,-62.05032677,3.84,"[0, 0, 0, 0, 0, 0, 0]",1.1995434761047363E-5,282.0694357554118,Molisoles,-9.741745889186859E-4,0.347140630086263,"{""type"":""Point"",""coordinates"":[-62.05032677,-34.17471073]}"
1208,82042,82,9/12/1995,General Lopez,Santa Fe,6725-2212,8.61,121,primavera,1995-12-04,"[1995-12-04, 1995-12-05, 1995-12-06, 1995-12-07, 1995-12-08, 1995-12-09, 1995-12-10]",true,1208,-34.17471073,-62.05032677,3.84,"[0, 0, 0.1, 1.4, 0, 1.4, 0]",1.8164515495300293E-5,300.3671582539876,Molisoles,-0.0046458132565021515,0.20880254109700522,"{""type"":""Point"",""coordinates"":[-62.05032677,-34.17471073]}"
1209,82042,82,2/2/2003,General Lopez,Santa Fe,6725-2212,8.61,121,verano,2003-01-27,"[2003-01-27, 2003-01-28, 2003-01-29, 2003-01-30, 2003-01-31, 2003-02-01, 2003-02-02]",true,1209,-34.17471073,-62.05032677,3.84,"[0, 0, 3.3, 0, 0, 6.1, 8.1]",1.1560320854187012E-4,299.3218173980713,Molisoles,-0.005360174924135208,0.17131360371907553,"{""type"":""Point"",""coordinates"":[-62.05032677,-34.17471073]}"
1210,82042,82,20/8/1998,General Lopez,Santa Fe,6725-2212,8.61,121,invierno,1998-08-17,"[1998-08-17, 1998-08-18, 1998-08-19, 1998-08-20, 1998-08-21, 1998-08-22, 1998-08-23]",true,1210,-34.17471073,-62.05032677,3.84,"[0.9, 0, 1, 0, 0, 4.8, 0.9]",2.1696090698242188E-4,286.34925333658856,Molisoles,-0.00224959384649992,0.3148244222005208,"{""type"":""Point"",""coordinates"":[-62.05032677,-34.17471073]}"
1211,30084,30,4/6/1997,Parana,Entre Rios,110-110,12.53,81,otoño,1997-06-02,"[1997-06-02, 1997-06-03, 1997-06-04, 1997-06-05, 1997-06-06, 1997-06-07, 1997-06-08]",true,1211,-31.88541285,-60.23444834,1.43,"[0.3, 0.2, 8.7, 4.5, 0, 0, 0]",2.3290514945983887E-5,289.5686378479004,Molisoles,-0.0010845642536878586,0.4541492462158203,"{""type"":""Point"",""coordinates"":[-60.23444834,-31.88541285]}"
1212,26014,26,1/11/1998,Cushamen,Chubut,36848-7245,2.82,312,primavera,1998-10-26,"[1998-10-26, 1998-10-27, 1998-10-28, 1998-10-29, 1998-10-30, 1998-10-31, 1998-11-01]",true,1212,-42.03927359,-71.56551616,3.05,"[5.5, 1.7, 1.6, 0, 0, 1.3, 0]",0.003308713436126709,279.868460337321,Entisoles,-0.002914702519774437,0.46219825744628906,"{""type"":""Point"",""coordinates"":[-71.56551616,-42.03927359]}"
1213,26014,26,11/9/2009,Cushamen,Chubut,36848-7245,2.82,312,invierno,2009-09-07,"[2009-09-07, 2009-09-08, 2009-09-09, 2009-09-10, 2009-09-11, 2009-09-12, 2009-09-13]",true,1213,-42.03927359,-71.56551616,3.05,"[0.7, 0, 0.1, 0, 0, 1.3, 10.3]",0.004473656415939331,273.7058188120524,Entisoles,-6.635822355747223E-4,0.4833138783772786,"{""type"":""Point"",""coordinates"":[-71.56551616,-42.03927359]}"
1214,26014,26,13/3/2006,Cushamen,Chubut,36848-7245,2.82,312,verano,2006-03-13,"[2006-03-13, 2006-03-14, 2006-03-15, 2006-03-16, 2006-03-17, 2006-03-18, 2006-03-19]",true,1214,-42.03927359,-71.56551616,3.05,"[2.9, 0, 0, 15.4, 1.2, 0, 0]",0.0011169910430908203,282.38754336039227,Entisoles,-0.002576286904513836,0.46335792541503906,"{""type"":""Point"",""coordinates"":[-71.56551616,-42.03927359]}"
1215,06392,6,2/2/1999,General Villegas,Buenos Aires,33055-6609,38.59,123,verano,1999-02-01,"[1999-02-01, 1999-02-02, 1999-02-03, 1999-02-04, 1999-02-05, 1999-02-06, 1999-02-07]",false,1215,-34.8579191,-63.1611931,3.58,"[8.8, 0, 0, 0, 0.1, 8, 0]",7.010996341705322E-5,290.2261651357015,Molisoles,-0.00319118145853281,0.29643885294596356,"{""type"":""Point"",""coordinates"":[-63.1611931,-34.8579191]}"
1216,30098,30,18/2/2013,Uruguay,Entre Rios,7061-2233,5.89,21,verano,2013-02-18,"[2013-02-18, 2013-02-19, 2013-02-20, 2013-02-21, 2013-02-22, 2013-02-23, 2013-02-24]",true,1216,-32.38095474,-58.23688127,0,"[16.1, 20.5, 26.1, 0.8, 0, 0, 58.8]",4.229247570037842E-4,294.1650168100993,Entisoles,-0.004535062238574028,0.25011444091796875,"{""type"":""Point"",""coordinates"":[-58.23688127,-32.38095474000001]}"
1217,62021,62,3/9/2005,Bariloche,Rio Negro,6953-2144,0.07,408,invierno,2005-08-29,"[2005-08-29, 2005-08-30, 2005-08-31, 2005-09-01, 2005-09-02, 2005-09-03, 2005-09-04]",true,1217,-41.89814608,-71.50316469,2.66,"[1.6, 0, 0, 0, 1.2, 0, 0]",0.001459568738937378,272.816447575887,Inceptisoles,-4.155980423092842E-4,0.48184776306152344,"{""type"":""Point"",""coordinates"":[-71.50316469000002,-41.898146080000004]}"
1218,30015,30,7/12/2002,Concordia,Entre Rios,6557-2063,4.51,37,primavera,2002-12-02,"[2002-12-02, 2002-12-03, 2002-12-04, 2002-12-05, 2002-12-06, 2002-12-07, 2002-12-08]",true,1218,-31.35230446,-58.05355072,6.42,"[0, 7.6, 14.4, 38, 0.6, 0.6, 0]",0.0025885701179504395,293.239054997762,Vertisoles,-0.005526291206479073,0.23661931355794272,"{""type"":""Point"",""coordinates"":[-58.05355072,-31.352304459999996]}"
1219,06623,6,20/1/2010,Pergamino,Buenos Aires,140-140,25.11,63,verano,2010-01-18,"[2010-01-18, 2010-01-19, 2010-01-20, 2010-01-21, 2010-01-22, 2010-01-23, 2010-01-24]",false,1219,-33.5893048,-60.7727646,0.93,"[5.8, 19.9, 0, 0, 0, 0, 0]",8.159875869750977E-5,299.09055773417157,Alfisoles,-0.003703022375702858,0.3225396474202474,"{""type"":""Point"",""coordinates"":[-60.7727646,-33.5893048]}"
1220,06357,6,11/5/1992,General Pueyrredon,Buenos Aires,3347-1742,17.47,21,otoño,1992-05-11,"[1992-05-11, 1992-05-12, 1992-05-13, 1992-05-14, 1992-05-15, 1992-05-16, 1992-05-17]",false,1220,-37.80766254,-57.62989086,5.55,"[40.4, 0, 1.6, 0, 0, 0, 1.4]",0.010398074984550476,289.58494567871094,Molisoles,-8.056573569774628E-4,0.47482554117838544,"{""type"":""Point"",""coordinates"":[-57.62989086,-37.80766254000001]}"
1221,06056,6,13/9/1990,Bahia Blanca,Buenos Aires,34120-6732,48.75,47,invierno,1990-09-10,"[1990-09-10, 1990-09-11, 1990-09-12, 1990-09-13, 1990-09-14, 1990-09-15, 1990-09-16]",false,1221,-38.68387462,-62.21595631,0,"[0, 0.8, 0.4, 0, 0, 0, 0]",3.5762786865234375E-7,288.29765192667645,Molisoles,-0.0016897916793823242,0.3068491617838542,"{""type"":""Point"",""coordinates"":[-62.21595631,-38.68387462]}"
1222,58070,58,14/7/2004,Los Lagos,Neuquen,33703-6477,20.32,918,invierno,2004-07-12,"[2004-07-12, 2004-07-13, 2004-07-14, 2004-07-15, 2004-07-16, 2004-07-17, 2004-07-18]",false,1222,-40.7275238,-71.67723084,3.7,"[39.5, 21.2, 6.7, 0, 0, 0, 3.2]",0.009149223566055298,274.46797879536945,Inceptisoles,-2.2622756659984589E-4,0.3284282684326172,"{""type"":""Point"",""coordinates"":[-71.67723084,-40.7275238]}"
1223,62021,62,13/1/2007,Bariloche,Rio Negro,6953-2144,0.07,408,verano,2007-01-08,"[2007-01-08, 2007-01-09, 2007-01-10, 2007-01-11, 2007-01-12, 2007-01-13, 2007-01-14]",true,1223,-41.89814608,-71.50316469,2.66,"[0, 0, 0, 0, 0, 0, 0]",9.16793942451477E-4,287.6786530812581,Inceptisoles,-0.003848605789244175,0.4032554626464844,"{""type"":""Point"",""coordinates"":[-71.50316469000002,-41.898146080000004]}"
1224,06042,6,10/7/2007,Ayacucho,Buenos Aires,6903-2151,72.41,107,invierno,2007-07-09,"[2007-07-09, 2007-07-10, 2007-07-11, 2007-07-12, 2007-07-13, 2007-07-14, 2007-07-15]",false,1224,-37.2159908,-58.6862018,2.33,"[0, 0, 0, 0, 0, 4.7, 0]",6.705522537231445E-7,274.2517369588216,Molisoles,-5.623903125524521E-4,0.3539282480875651,"{""type"":""Point"",""coordinates"":[-58.6862018,-37.21599079999999]}"
1225,06609,6,7/9/1999,Pehuajo,Buenos Aires,6725-2212,72.84,89,invierno,1999-09-06,"[1999-09-06, 1999-09-07, 1999-09-08, 1999-09-09, 1999-09-10, 1999-09-11, 1999-09-12]",false,1225,-35.6179927,-62.0046671,1.47,"[27.6, 2.1, 0, 0, 0, 2.4, 0]",0.0014726072549819946,286.8100191752116,Molisoles,-0.0012764018028974533,0.4888146718343099,"{""type"":""Point"",""coordinates"":[-62.0046671,-35.61799270000001]}"
1226,06147,6,4/11/2015,Carlos Casares,Buenos Aires,36845-7243,60.46,84,primavera,2015-11-02,"[2015-11-02, 2015-11-03, 2015-11-04, 2015-11-05, 2015-11-06, 2015-11-07, 2015-11-08]",false,1226,-35.83601,-61.43436,1.47,"[0, 0, 0, 0, 0, 0, 0.9]",2.250075340270996E-6,288.79406356811523,Molisoles,-0.004727130755782127,0.2909425099690755,"{""type"":""Point"",""coordinates"":[-61.43436,-35.83601]}"
1227,06112,6,27/2/2001,Bragado,Buenos Aires,6954-2111,27.83,62,verano,2001-02-26,"[2001-02-26, 2001-02-27, 2001-02-28, 2001-03-01, 2001-03-02, 2001-03-03, 2001-03-04]",false,1227,-35.2410531,-60.3474272,1.47,"[0, 0.4, 0.3, 43.7, 4, 37.5, 1.3]",8.788704872131348E-5,297.73162333170575,Molisoles,-0.002191837877035141,0.19600677490234375,"{""type"":""Point"",""coordinates"":[-60.3474272,-35.24105310000001]}"
1228,06588,6,15/5/1999,9 de Julio,Buenos Aires,36845-7243,39.61,81,otoño,1999-05-10,"[1999-05-10, 1999-05-11, 1999-05-12, 1999-05-13, 1999-05-14, 1999-05-15, 1999-05-16]",false,1228,-35.6497312,-61.0228986,2.46,"[0, 0, 0, 0, 0, 0, 0.7]",2.3484230041503906E-5,289.1316445668538,Molisoles,-0.0016009025275707245,0.333957036336263,"{""type"":""Point"",""coordinates"":[-61.022898600000005,-35.6497312]}"
1229,06791,6,7/4/1999,Tandil,Buenos Aires,32742-6427,53.39,366,otoño,1999-04-05,"[1999-04-05, 1999-04-06, 1999-04-07, 1999-04-08, 1999-04-09, 1999-04-10, 1999-04-11]",false,1229,-37.3502704,-59.07873297,26.89,"[0, 0, 0, 0, 0, 0, 9.6]",8.359551429748535E-6,288.072114944458,Molisoles,-0.001849881373345852,0.3825213114420573,"{""type"":""Point"",""coordinates"":[-59.07873297,-37.3502704]}"
1230,06778,6,13/12/1998,San Vicente,Buenos Aires,33486-6512,23.66,24,primavera,1998-12-07,"[1998-12-07, 1998-12-08, 1998-12-09, 1998-12-10, 1998-12-11, 1998-12-12, 1998-12-13]",false,1230,-35.18311,-58.45241002,2.17,"[0, 0, 0, 0, 0, 5.9, 24.1]",2.911686897277832E-5,294.14233144124347,Molisoles,-0.0039012786000967026,0.33712196350097656,"{""type"":""Point"",""coordinates"":[-58.45241002,-35.18311]}"
1231,06658,6,17/6/2008,Quilmes,Buenos Aires,35407-6950,4.25,3,otoño,2008-06-16,"[2008-06-16, 2008-06-17, 2008-06-18, 2008-06-19, 2008-06-20, 2008-06-21, 2008-06-22]",true,1231,-34.70037841,-58.27664278,2.17,"[0, 0, 0, 20.8, 21.1, 0, 0]",,,Miscelaneas,,,"{""type"":""Point"",""coordinates"":[-58.276642779999996,-34.70037841]}"
1232,06560,6,9/2/1998,Moreno,Buenos Aires,42-42,17.53,33,verano,1998-02-09,"[1998-02-09, 1998-02-10, 1998-02-11, 1998-02-12, 1998-02-13, 1998-02-14, 1998-02-15]",false,1232,-34.55865957,-58.81630109,4.33,"[0, 0, 0, 0, 0, 0, 0.4]",6.556510925292969E-7,291.88315836588544,Complejo indiferenci,-0.003715919330716133,0.4757855733235677,"{""type"":""Point"",""coordinates"":[-58.81630109,-34.55865957]}"
1233,06490,6,20/10/2014,Lomas de Zamora,Buenos Aires,35405-6949,5.53,9,primavera,2014-10-20,"[2014-10-20, 2014-10-21, 2014-10-22, 2014-10-23, 2014-10-24, 2014-10-25, 2014-10-26]",true,1233,-34.73790272,-58.44067537,3,"[0, 0, 0, 0, 0, 0, 0]",7.210671901702881E-4,289.5069389343262,Miscelaneas,-0.003887169063091278,0.32783953348795575,"{""type"":""Point"",""coordinates"":[-58.44067537000001,-34.73790272]}"
1234,06427,6,19/5/2000,La Matanza,Buenos Aires,33486-6512,4.98,8,otoño,2000-05-15,"[2000-05-15, 2000-05-16, 2000-05-17, 2000-05-18, 2000-05-19, 2000-05-20, 2000-05-21]",true,1234,-34.71417289,-58.50890438,7.28,"[24.4, 39.1, 1.6, 0, 0.4, 0, 0]",0.006202638149261475,288.4311809539795,Molisoles,-0.0012704692780971527,0.4875602722167969,"{""type"":""Point"",""coordinates"":[-58.50890437999999,-34.71417289000001]}"
1235,06274,6,16/5/2010,Florencio Varela,Buenos Aires,7058-2230,1.42,23,otoño,2010-05-10,"[2010-05-10, 2010-05-11, 2010-05-12, 2010-05-13, 2010-05-14, 2010-05-15, 2010-05-16]",true,1235,-34.8275807,-58.222912,0,"[0, 0, 0, 0, 0, 0.3, 0]",1.4692544937133789E-5,285.0068944295247,Complejo indiferenci,-0.0016415556892752647,0.3766040802001953,"{""type"":""Point"",""coordinates"":[-58.22291200000001,-34.8275807]}"
1236,06217,6,11/9/1990,Chascomus,Buenos Aires,6766-2227,28.22,14,invierno,1990-09-10,"[1990-09-10, 1990-09-11, 1990-09-12, 1990-09-13, 1990-09-14, 1990-09-15, 1990-09-16]",false,1236,-35.4916042,-57.8945611,1.47,"[2.3, 8.2, 1.4, 0, 0, 0, 0]",6.280839443206787E-5,290.8627560933431,Complejo indiferenci,-0.002285398542881012,0.45023028055826825,"{""type"":""Point"",""coordinates"":[-57.894561100000004,-35.4916042]}"
1237,06049,6,19/10/2002,Azul,Buenos Aires,32742-6427,7.78,205,primavera,2002-10-14,"[2002-10-14, 2002-10-15, 2002-10-16, 2002-10-17, 2002-10-18, 2002-10-19, 2002-10-20]",true,1237,-37.0314689,-59.6042326,2.5,"[70.3, 13.3, 0, 0, 0.2, 0.8, 49.4]",0.020702704787254333,291.04310607910156,Molisoles,-0.0026467181742191315,0.4598948160807292,"{""type"":""Point"",""coordinates"":[-59.604232599999996,-37.0314689]}"
1238,06274,6,8/1/1995,Florencio Varela,Buenos Aires,7058-2230,1.42,23,verano,1995-01-02,"[1995-01-02, 1995-01-03, 1995-01-04, 1995-01-05, 1995-01-06, 1995-01-07, 1995-01-08]",true,1238,-34.8275807,-58.222912,0,"[12.9, 12.9, 2, 5.6, 0, 7.8, 0.1]",2.578645944595337E-4,296.2590026855469,Complejo indiferenci,-0.005672634579241276,0.36893272399902344,"{""type"":""Point"",""coordinates"":[-58.22291200000001,-34.8275807]}"
1239,02010,2,24/9/1997,Comuna 10,Capital Federal,36837-7237,4.71,24,primavera,1997-09-22,"[1997-09-22, 1997-09-23, 1997-09-24, 1997-09-25, 1997-09-26, 1997-09-27, 1997-09-28]",true,1239,-34.62768629,-58.48358728,1.46,"[0.4, 0.5, 0, 0, 0, 1.4, 1.2]",2.7345120906829834E-4,287.0372721354167,Miscelaneas,-0.0019509978592395782,0.29738299051920575,"{""type"":""Point"",""coordinates"":[-58.48358728,-34.62768628999999]}"
1240,02011,2,10/2/2009,Comuna 11,Capital Federal,36837-7237,3.14,29,verano,2009-02-09,"[2009-02-09, 2009-02-10, 2009-02-11, 2009-02-12, 2009-02-13, 2009-02-14, 2009-02-15]",true,1240,-34.6042463,-58.49067643,2.78,"[0, 30.2, 0, 0, 0, 0, 0]",5.054473876953125E-5,297.96597480773926,Miscelaneas,-0.002340385690331459,0.20300674438476562,"{""type"":""Point"",""coordinates"":[-58.49067643,-34.60424629999999]}"
1241,50014,50,7/4/2013,General Alvear,Mendoza,6876-2180,0.62,364,otoño,2013-04-01,"[2013-04-01, 2013-04-02, 2013-04-03, 2013-04-04, 2013-04-05, 2013-04-06, 2013-04-07]",true,1241,-35.16899569,-66.50196772,0.93,"[14.5, 0, 2.6, 0.4, 0, 0, 0]",0.0015029162168502808,286.18299229939777,Entisoles,-0.0015175938606262207,0.47345225016276044,"{""type"":""Point"",""coordinates"":[-66.50196772,-35.16899569]}"
1242,06581,6,9/4/1994,Necochea,Buenos Aires,32742-6427,63.08,124,otoño,1994-04-04,"[1994-04-04, 1994-04-05, 1994-04-06, 1994-04-07, 1994-04-08, 1994-04-09, 1994-04-10]",false,1242,-38.085516,-59.2924177,1.5,"[0.1, 0.7, 0.5, 0, 0.9, 9.1, 20.5]",8.07642936706543E-6,289.641019821167,Molisoles,-0.0015834402292966843,0.2645161946614583,"{""type"":""Point"",""coordinates"":[-59.2924177,-38.085516000000005]}"
1243,06791,6,15/2/2009,Tandil,Buenos Aires,32742-6427,53.39,366,verano,2009-02-09,"[2009-02-09, 2009-02-10, 2009-02-11, 2009-02-12, 2009-02-13, 2009-02-14, 2009-02-15]",false,1243,-37.3502704,-59.07873297,26.89,"[0, 0.7, 0.7, 0, 0, 0, 0]",3.516674041748047E-6,291.78645006815594,Molisoles,-0.003454826772212982,0.3400351206461589,"{""type"":""Point"",""coordinates"":[-59.07873297,-37.3502704]}"
1244,06581,6,22/3/2004,Necochea,Buenos Aires,32742-6427,63.08,124,otoño,2004-03-22,"[2004-03-22, 2004-03-23, 2004-03-24, 2004-03-25, 2004-03-26, 2004-03-27, 2004-03-28]",false,1244,-38.085516,-59.2924177,1.5,"[0, 0, 0, 0, 0, 0, 0]",5.498528480529785E-6,294.01366488138837,Molisoles,-0.002402552403509617,0.2263329823811849,"{""type"":""Point"",""coordinates"":[-59.2924177,-38.085516000000005]}"
1245,06560,6,21/3/2012,Moreno,Buenos Aires,42-42,17.53,33,verano,2012-03-19,"[2012-03-19, 2012-03-20, 2012-03-21, 2012-03-22, 2012-03-23, 2012-03-24, 2012-03-25]",false,1245,-34.55865957,-58.81630109,4.33,"[4, 10.5, 1.1, 0, 0, 0, 7.3]",3.975629806518555E-5,297.5561752319336,Complejo indiferenci,-0.0024773310869932175,0.3440195719401042,"{""type"":""Point"",""coordinates"":[-58.81630109,-34.55865957]}"
1246,06441,6,27/12/2009,La Plata,Buenos Aires,3314-1708,23.31,26,verano,2009-12-21,"[2009-12-21, 2009-12-22, 2009-12-23, 2009-12-24, 2009-12-25, 2009-12-26, 2009-12-27]",false,1246,-35.03880607,-58.05930616,0.93,"[0, 0, 5.9, 40.5, 0, 26.5, 0]",1.4603137969970703E-6,294.4514153798421,Complejo indiferenci,-0.0055504245683550835,0.41750462849934894,"{""type"":""Point"",""coordinates"":[-58.05930616,-35.03880607000001]}"
1247,06427,6,12/9/2011,La Matanza,Buenos Aires,33486-6512,4.98,8,invierno,2011-09-12,"[2011-09-12, 2011-09-13, 2011-09-14, 2011-09-15, 2011-09-16, 2011-09-17, 2011-09-18]",true,1247,-34.71417289,-58.50890438,7.28,"[0, 0, 0, 0, 15.2, 12.3, 0]",5.498528480529785E-5,289.6428686777751,Molisoles,-0.0022960426285862923,0.21543375651041666,"{""type"":""Point"",""coordinates"":[-58.50890437999999,-34.71417289000001]}"
1248,06357,6,17/12/2002,General Pueyrredon,Buenos Aires,3347-1742,17.47,21,primavera,2002-12-16,"[2002-12-16, 2002-12-17, 2002-12-18, 2002-12-19, 2002-12-20, 2002-12-21, 2002-12-22]",false,1248,-37.80766254,-57.62989086,5.55,"[1.6, 0, 7.4, 13.5, 0.3, 0, 8.1]",2.34946608543396E-4,293.7067616780599,Molisoles,-0.0036694789305329323,0.3365020751953125,"{""type"":""Point"",""coordinates"":[-57.62989086,-37.80766254000001]}"
1249,06274,6,27/2/2005,Florencio Varela,Buenos Aires,7058-2230,1.42,23,verano,2005-02-21,"[2005-02-21, 2005-02-22, 2005-02-23, 2005-02-24, 2005-02-25, 2005-02-26, 2005-02-27]",true,1249,-34.8275807,-58.222912,0,"[2.5, 0, 0, 3.1, 19, 0, 0]",3.883242607116699E-5,297.77470207214355,Complejo indiferenci,-0.003470364958047867,0.3347860972086589,"{""type"":""Point"",""coordinates"":[-58.22291200000001,-34.8275807]}"
1250,06084,6,10/10/2004,Benito Juarez,Buenos Aires,36844-7242,42.97,230,primavera,2004-10-04,"[2004-10-04, 2004-10-05, 2004-10-06, 2004-10-07, 2004-10-08, 2004-10-09, 2004-10-10]",false,1250,-37.5763984,-60.1392005,1.49,"[0, 0, 0, 2.7, 0.6, 3.1, 13.1]",1.2814998626708984E-5,285.0805524190267,Molisoles,-0.0013226550072431564,0.3598988850911458,"{""type"":""Point"",""coordinates"":[-60.13920050000001,-37.5763984]}"
1251,06735,6,3/7/1993,San Antonio de Areco,Buenos Aires,6906-2215,2.81,39,invierno,1993-06-28,"[1993-06-28, 1993-06-29, 1993-06-30, 1993-07-01, 1993-07-02, 1993-07-03, 1993-07-04]",true,1251,-34.2881384,-59.5070413,1.46,"[0, 0, 0, 0, 1.6, 3.9, 0.2]",0.0010732561349868774,283.847838083903,Molisoles,-0.001256515271961689,0.42830340067545575,"{""type"":""Point"",""coordinates"":[-59.5070413,-34.2881384]}"
1252,06714,6,4/10/2012,Salto,Buenos Aires,31982-6397,17.53,69,primavera,2012-10-01,"[2012-10-01, 2012-10-02, 2012-10-03, 2012-10-04, 2012-10-05, 2012-10-06, 2012-10-07]",false,1252,-34.1554316,-60.4724629,0,"[1.7, 4.5, 0, 0, 15.2, 2.9, 10.5]",3.1188130378723145E-5,291.2273750305176,Molisoles,-0.002899518236517906,0.4208030700683594,"{""type"":""Point"",""coordinates"":[-60.472462900000004,-34.1554316]}"
1253,06658,6,14/11/2011,Quilmes,Buenos Aires,35407-6950,4.25,3,primavera,2011-11-14,"[2011-11-14, 2011-11-15, 2011-11-16, 2011-11-17, 2011-11-18, 2011-11-19, 2011-11-20]",true,1253,-34.70037841,-58.27664278,2.17,"[0, 0, 0, 0, 0, 3.8, 14.6]",,,Miscelaneas,,,"{""type"":""Point"",""coordinates"":[-58.276642779999996,-34.70037841]}"
