system:index,Code Departamento,Code Provincia,Date (YMD),Departamento,Provincia,codeRio,distanciaRio,estacion,fecha0,fechas,hayRioCercano,idx,lat,lon,runoff_sum,temperature_2m,tipoDeSuelo,total_evaporation_sum,volumetric_soil_water_layer_1,.geo
0,58007,hay que cambiarlo,29/6/2014,hay que cambiarlo,hay que cambiarlo,33712-6513,53.44,invierno,2014-06-23,"[2014-06-23, 2014-06-24, 2014-06-25, 2014-06-26, 2014-06-27, 2014-06-28, 2014-06-29]",false,0,-39.30917583,-70.92970664,3.109574317932129E-4,274.2643362681071,Entisoles,-3.8477592170238495E-4,0.3104515075683594,"{""type"":""Point"",""coordinates"":[-70.92970664,-39.30917583]}"
1,18056,hay que cambiarlo,6/2/2014,hay que cambiarlo,hay que cambiarlo,1369-1019,0.61,verano,2014-02-03,"[2014-02-03, 2014-02-04, 2014-02-05, 2014-02-06, 2014-02-07, 2014-02-08, 2014-02-09]",true,1,-29.10620117,-56.5596695,1.8909573554992676E-4,303.94177500406903,Inceptisoles,-0.006031828001141548,0.26923497517903644,"{""type"":""Point"",""coordinates"":[-56.5596695,-29.10620117]}"
2,70049,hay que cambiarlo,28/10/2014,hay que cambiarlo,hay que cambiarlo,36862-7250,8.99,primavera,2014-10-27,"[2014-10-27, 2014-10-28, 2014-10-29, 2014-10-30, 2014-10-31, 2014-11-01, 2014-11-02]",true,2,-30.27013016,-69.19116211,3.0185282230377197E-4,289.48497200012207,Roca,-0.0019977763295173645,0.06339772542317708,"{""type"":""Point"",""coordinates"":[-69.19116211,-30.270130160000008]}"
3,06364,hay que cambiarlo,12/2/2014,hay que cambiarlo,hay que cambiarlo,6936-2128,20,verano,2014-02-10,"[2014-02-10, 2014-02-11, 2014-02-12, 2014-02-13, 2014-02-14, 2014-02-15, 2014-02-16]",false,3,-34.72117406,-59.01160158,6.033480167388916E-5,295.9463488260905,Complejo indiferenci,-0.00285430159419775,0.45612144470214844,"{""type"":""Point"",""coordinates"":[-59.01160158,-34.72117406]}"
4,86007,hay que cambiarlo,2/3/2015,hay que cambiarlo,hay que cambiarlo,32009-6398,20.73,verano,2015-03-02,"[2015-03-02, 2015-03-03, 2015-03-04, 2015-03-05, 2015-03-06, 2015-03-07, 2015-03-08]",false,4,-28.96850322,-62.90029133,1.5780329704284668E-5,298.2060553232829,Complejo indiferenci,-0.002667028456926346,0.4006811777750651,"{""type"":""Point"",""coordinates"":[-62.90029133,-28.968503220000006]}"
5,46042,hay que cambiarlo,2/3/2015,hay que cambiarlo,hay que cambiarlo,34179-6743,13,verano,2015-03-02,"[2015-03-02, 2015-03-03, 2015-03-04, 2015-03-05, 2015-03-06, 2015-03-07, 2015-03-08]",true,5,-29.10233846,-67.60548106,0.011916190385818481,290.5309251149495,Roca,-0.0034597311168909073,0.2821661631266276,"{""type"":""Point"",""coordinates"":[-67.60548106,-29.102338459999995]}"
6,82035,hay que cambiarlo,2/3/2015,hay que cambiarlo,hay que cambiarlo,33531-6669,2.91,verano,2015-03-02,"[2015-03-02, 2015-03-03, 2015-03-04, 2015-03-05, 2015-03-06, 2015-03-07, 2015-03-08]",true,6,-31.1523125,-60.1365521,0.0015884488821029663,297.8217779795329,Molisoles,-0.002903653308749199,0.42900721232096356,"{""type"":""Point"",""coordinates"":[-60.1365521,-31.152312499999997]}"
7,06760,hay que cambiarlo,25/2/2015,hay que cambiarlo,hay que cambiarlo,50-50,12.96,verano,2015-02-23,"[2015-02-23, 2015-02-24, 2015-02-25, 2015-02-26, 2015-02-27, 2015-02-28, 2015-03-01]",true,7,-34.57514015,-58.69604099,2.5287270545959473E-5,298.1157061258952,Miscelaneas,-0.0031202584505081177,0.31294822692871094,"{""type"":""Point"",""coordinates"":[-58.69604099,-34.575140149999996]}"
8,54119,hay que cambiarlo,25/2/2015,hay que cambiarlo,hay que cambiarlo,63-63,9.3,verano,2015-02-23,"[2015-02-23, 2015-02-24, 2015-02-25, 2015-02-26, 2015-02-27, 2015-02-28, 2015-03-01]",true,8,-27.54825371,-54.76106548,5.4168701171875E-4,297.5615882873535,Alfisoles,-0.004233764484524727,0.4521827697753906,"{""type"":""Point"",""coordinates"":[-54.761065480000006,-27.548253710000004]}"
9,02002,hay que cambiarlo,25/2/2015,hay que cambiarlo,hay que cambiarlo,85-85,1.52,verano,2015-02-23,"[2015-02-23, 2015-02-24, 2015-02-25, 2015-02-26, 2015-02-27, 2015-02-28, 2015-03-01]",true,9,-34.58587601,-58.39499618,3.7977099418640137E-4,298.16298802693683,Miscelaneas,-0.002649463713169098,0.18227767944335938,"{""type"":""Point"",""coordinates"":[-58.39499618,-34.58587601000001]}"
10,86112,hay que cambiarlo,25/2/2015,hay que cambiarlo,hay que cambiarlo,37593-7391,10.57,verano,2015-02-23,"[2015-02-23, 2015-02-24, 2015-02-25, 2015-02-26, 2015-02-27, 2015-02-28, 2015-03-01]",true,10,-29.29157166,-63.03450311,2.205371856689453E-6,299.1137530008952,Alfisoles,-0.00420002918690443,0.27999623616536456,"{""type"":""Point"",""coordinates"":[-63.03450311000001,-29.29157166]}"
11,34035,hay que cambiarlo,6/9/2012,hay que cambiarlo,hay que cambiarlo,34065-6553,11.81,invierno,2012-09-03,"[2012-09-03, 2012-09-04, 2012-09-05, 2012-09-06, 2012-09-07, 2012-09-08, 2012-09-09]",true,11,-24.61192,-60.30033,2.9802322387695312E-8,299.97113037109375,Rio,-0.003727511502802372,0.1905371348063151,"{""type"":""Point"",""coordinates"":[-60.30033000000001,-24.611919999999998]}"
12,78021,hay que cambiarlo,10/8/2015,hay que cambiarlo,hay que cambiarlo,33331-6533,4.21,invierno,2015-08-10,"[2015-08-10, 2015-08-11, 2015-08-12, 2015-08-13, 2015-08-14, 2015-08-15, 2015-08-16]",true,12,-51.8701101,-70.5994988,4.032999277114868E-4,273.9039758046468,Molisoles,-1.9136257469654083E-4,0.467526117960612,"{""type"":""Point"",""coordinates"":[-70.5994988,-51.87011009999999]}"
13,06609,hay que cambiarlo,10/8/2015,hay que cambiarlo,hay que cambiarlo,6725-2212,72.84,invierno,2015-08-10,"[2015-08-10, 2015-08-11, 2015-08-12, 2015-08-13, 2015-08-14, 2015-08-15, 2015-08-16]",false,13,-35.6179927,-62.0046671,3.863871097564697E-5,284.2467492421468,Molisoles,-0.0017156582325696945,0.49255116780598956,"{""type"":""Point"",""coordinates"":[-62.0046671,-35.61799270000001]}"
14,70133,hay que cambiarlo,13/1/2015,hay que cambiarlo,hay que cambiarlo,32300-6465,32.17,verano,2015-01-12,"[2015-01-12, 2015-01-13, 2015-01-14, 2015-01-15, 2015-01-16, 2015-01-17, 2015-01-18]",false,14,-31.77467156,-68.91460419,0.0024412870407104492,291.39709599812824,Roca,-0.0030823834240436554,0.30185508728027344,"{""type"":""Point"",""coordinates"":[-68.91460419,-31.77467156]}"
15,06420,hay que cambiarlo,13/1/2015,hay que cambiarlo,hay que cambiarlo,3346-1741,3.63,verano,2015-01-12,"[2015-01-12, 2015-01-13, 2015-01-14, 2015-01-15, 2015-01-16, 2015-01-17, 2015-01-18]",true,15,-36.48839763,-56.70043526,5.606710910797119E-4,295.6630465189616,Entisoles,-0.0075544994324445724,0.14362970987955728,"{""type"":""Point"",""coordinates"":[-56.70043526,-36.48839763]}"
16,38105,hay que cambiarlo,13/1/2015,hay que cambiarlo,hay que cambiarlo,33117-6463,19.12,verano,2015-01-12,"[2015-01-12, 2015-01-13, 2015-01-14, 2015-01-15, 2015-01-16, 2015-01-17, 2015-01-18]",false,16,-23.56311433,-64.89713769,0.00470907986164093,290.28991826375324,Roca,-0.0035381484776735306,0.5008099873860677,"{""type"":""Point"",""coordinates"":[-64.89713769,-23.563114329999998]}"
17,06084,hay que cambiarlo,13/1/2015,hay que cambiarlo,hay que cambiarlo,36844-7242,42.97,verano,2015-01-12,"[2015-01-12, 2015-01-13, 2015-01-14, 2015-01-15, 2015-01-16, 2015-01-17, 2015-01-18]",false,17,-37.5763984,-60.1392005,7.450580596923828E-7,295.2826754252116,Molisoles,-0.0015673190355300903,0.2694327036539714,"{""type"":""Point"",""coordinates"":[-60.13920050000001,-37.5763984]}"
18,42028,hay que cambiarlo,23/12/2015,hay que cambiarlo,hay que cambiarlo,32779-6443,73.15,verano,2015-12-21,"[2015-12-21, 2015-12-22, 2015-12-23, 2015-12-24, 2015-12-25, 2015-12-26, 2015-12-27]",false,18,-36.67294558,-63.66446349,2.6226043701171875E-6,297.1164353688558,Entisoles,-0.003722814843058586,0.19449869791666666,"{""type"":""Point"",""coordinates"":[-63.66446349,-36.672945580000004]}"
19,06028,hay que cambiarlo,23/12/2015,hay que cambiarlo,hay que cambiarlo,35405-6949,1.13,verano,2015-12-21,"[2015-12-21, 2015-12-22, 2015-12-23, 2015-12-24, 2015-12-25, 2015-12-26, 2015-12-27]",true,19,-34.80155807,-58.39146772,1.271069049835205E-5,296.69399070739746,Miscelaneas,-0.0025050947442650795,0.2796490987141927,"{""type"":""Point"",""coordinates"":[-58.39146772000001,-34.80155807]}"
20,90021,hay que cambiarlo,22/12/2015,hay que cambiarlo,hay que cambiarlo,32679-6504,18.33,verano,2015-12-21,"[2015-12-21, 2015-12-22, 2015-12-23, 2015-12-24, 2015-12-25, 2015-12-26, 2015-12-27]",false,20,-27.3126707,-65.4820785,8.032470941543579E-4,295.42144838968915,Roca,-0.005738109350204468,0.3715292612711589,"{""type"":""Point"",""coordinates"":[-65.4820785,-27.3126707]}"
21,78035,hay que cambiarlo,22/12/2015,hay que cambiarlo,hay que cambiarlo,6176-1899,18.04,verano,2015-12-21,"[2015-12-21, 2015-12-22, 2015-12-23, 2015-12-24, 2015-12-25, 2015-12-26, 2015-12-27]",false,21,-46.04208374,-71.65873718,7.264167070388794E-4,281.74501609802246,Aridisoles,-0.002831081859767437,0.3479747772216797,"{""type"":""Point"",""coordinates"":[-71.65873718,-46.04208374]}"
22,46063,hay que cambiarlo,22/12/2015,hay que cambiarlo,hay que cambiarlo,33392-6628,95.42,verano,2015-12-21,"[2015-12-21, 2015-12-22, 2015-12-23, 2015-12-24, 2015-12-25, 2015-12-26, 2015-12-27]",false,22,-30.55722809,-66.16072846,1.296401023864746E-6,297.36757469177246,Entisoles,-0.004627835936844349,0.16754976908365884,"{""type"":""Point"",""coordinates"":[-66.16072846,-30.55722809]}"
23,54077,hay que cambiarlo,23/12/2015,hay que cambiarlo,hay que cambiarlo,6487-2027,13.67,verano,2015-12-21,"[2015-12-21, 2015-12-22, 2015-12-23, 2015-12-24, 2015-12-25, 2015-12-26, 2015-12-27]",true,23,-26.78501255,-54.90115103,0.008802607655525208,297.9413865407308,Molisoles,-0.005027187988162041,0.438259760538737,"{""type"":""Point"",""coordinates"":[-54.90115103000001,-26.785012549999998]}"
24,78028,hay que cambiarlo,22/12/2015,hay que cambiarlo,hay que cambiarlo,6778-2165,1.79,verano,2015-12-21,"[2015-12-21, 2015-12-22, 2015-12-23, 2015-12-24, 2015-12-25, 2015-12-26, 2015-12-27]",true,24,-50.27098465,-71.8927536,7.566213607788086E-4,282.81899070739746,Entisoles,-0.00277538038790226,0.21585400899251303,"{""type"":""Point"",""coordinates"":[-71.8927536,-50.27098465]}"
25,06308,hay que cambiarlo,22/12/2015,hay que cambiarlo,hay que cambiarlo,36871-7252,47.06,verano,2015-12-21,"[2015-12-21, 2015-12-22, 2015-12-23, 2015-12-24, 2015-12-25, 2015-12-26, 2015-12-27]",false,25,-36.6656205,-58.0745242,1.4528632164001465E-5,295.01845359802246,Lagunas,-0.0021406961604952812,0.2934118906656901,"{""type"":""Point"",""coordinates"":[-58.0745242,-36.665620499999996]}"
26,06077,hay que cambiarlo,22/12/2015,hay que cambiarlo,hay que cambiarlo,6745-2129,17.6,verano,2015-12-21,"[2015-12-21, 2015-12-22, 2015-12-23, 2015-12-24, 2015-12-25, 2015-12-26, 2015-12-27]",false,26,-33.9628001,-59.8615291,2.3603439331054688E-5,297.18959617614746,Molisoles,-0.0031105317175388336,0.32055409749348956,"{""type"":""Point"",""coordinates"":[-59.861529100000006,-33.9628001]}"
27,22007,hay que cambiarlo,23/12/2015,hay que cambiarlo,hay que cambiarlo,6309-1957,105.62,verano,2015-12-21,"[2015-12-21, 2015-12-22, 2015-12-23, 2015-12-24, 2015-12-25, 2015-12-26, 2015-12-27]",false,27,-25.53445625,-62.85266113,2.086162567138672E-7,301.3595994313558,Entisoles,-0.001446414738893509,0.13841120402018228,"{""type"":""Point"",""coordinates"":[-62.85266113,-25.53445625]}"
28,06798,hay que cambiarlo,6/12/2015,hay que cambiarlo,hay que cambiarlo,34350-6366,29.39,primavera,2015-11-30,"[2015-11-30, 2015-12-01, 2015-12-02, 2015-12-03, 2015-12-04, 2015-12-05, 2015-12-06]",false,28,-36.475682,-60.1222218,5.111098289489746E-6,292.4538288116455,Molisoles,-0.00491537619382143,0.3783270517985026,"{""type"":""Point"",""coordinates"":[-60.1222218,-36.475682]}"
29,06665,hay que cambiarlo,22/12/2015,hay que cambiarlo,hay que cambiarlo,3325-1719,9.81,verano,2015-12-21,"[2015-12-21, 2015-12-22, 2015-12-23, 2015-12-24, 2015-12-25, 2015-12-26, 2015-12-27]",true,29,-33.6241496,-60.0461017,1.5735626220703125E-5,297.31988588968915,Rio,-0.003277065232396126,0.3463446299235026,"{""type"":""Point"",""coordinates"":[-60.04610170000001,-33.6241496]}"
30,06532,hay que cambiarlo,22/12/2015,hay que cambiarlo,hay que cambiarlo,7-7,20.35,verano,2015-12-21,"[2015-12-21, 2015-12-22, 2015-12-23, 2015-12-24, 2015-12-25, 2015-12-26, 2015-12-27]",false,30,-34.64501572,-59.35927582,2.0042061805725098E-5,297.05157534281415,Molisoles,-0.0028486857190728188,0.2950369517008464,"{""type"":""Point"",""coordinates"":[-59.35927582,-34.64501572]}"
31,14084,hay que cambiarlo,22/12/2015,hay que cambiarlo,hay que cambiarlo,32598-6391,38.93,verano,2015-12-21,"[2015-12-21, 2015-12-22, 2015-12-23, 2015-12-24, 2015-12-25, 2015-12-26, 2015-12-27]",false,31,-33.90469055,-63.83804658,1.2814998626708984E-6,297.99249331156415,Alfisoles,-0.003438720479607582,0.22697003682454428,"{""type"":""Point"",""coordinates"":[-63.83804657999999,-33.90469055]}"
32,06161,hay que cambiarlo,22/12/2015,hay que cambiarlo,hay que cambiarlo,32711-6544,5.4,verano,2015-12-21,"[2015-12-21, 2015-12-22, 2015-12-23, 2015-12-24, 2015-12-25, 2015-12-26, 2015-12-27]",true,32,-34.4145467,-59.8540512,1.506507396697998E-5,296.89434878031415,Molisoles,-0.002845698967576027,0.30625152587890625,"{""type"":""Point"",""coordinates"":[-59.8540512,-34.41454670000001]}"
33,06168,hay que cambiarlo,22/12/2015,hay que cambiarlo,hay que cambiarlo,36871-7252,8.76,verano,2015-12-21,"[2015-12-21, 2015-12-22, 2015-12-23, 2015-12-24, 2015-12-25, 2015-12-26, 2015-12-27]",true,33,-36.1352289,-57.7158097,5.2616000175476074E-5,295.0519822438558,Complejo indiferenci,-0.002842889167368412,0.29259300231933594,"{""type"":""Point"",""coordinates"":[-57.7158097,-36.1352289]}"
34,06351,hay que cambiarlo,22/12/2015,hay que cambiarlo,hay que cambiarlo,6811-2213,37.98,verano,2015-12-21,"[2015-12-21, 2015-12-22, 2015-12-23, 2015-12-24, 2015-12-25, 2015-12-26, 2015-12-27]",false,34,-34.8011277,-61.8636453,1.8477439880371094E-6,296.99859682718915,Molisoles,-0.0034398259595036507,0.2988739013671875,"{""type"":""Point"",""coordinates"":[-61.8636453,-34.8011277]}"
35,22007,hay que cambiarlo,22/12/2015,hay que cambiarlo,hay que cambiarlo,6309-1957,105.62,verano,2015-12-21,"[2015-12-21, 2015-12-22, 2015-12-23, 2015-12-24, 2015-12-25, 2015-12-26, 2015-12-27]",false,35,-25.53445625,-62.85266113,2.086162567138672E-7,301.3595994313558,Entisoles,-0.001446414738893509,0.13841120402018228,"{""type"":""Point"",""coordinates"":[-62.85266113,-25.53445625]}"
36,14007,hay que cambiarlo,21/12/2015,hay que cambiarlo,hay que cambiarlo,36828-7231,19.43,verano,2015-12-21,"[2015-12-21, 2015-12-22, 2015-12-23, 2015-12-24, 2015-12-25, 2015-12-26, 2015-12-27]",false,36,-32.09286214,-64.56387845,1.0435283184051514E-4,294.1227830251058,Roca,-0.00518915057182312,0.3019307454427083,"{""type"":""Point"",""coordinates"":[-64.56387845,-32.09286214]}"
37,06098,hay que cambiarlo,21/12/2015,hay que cambiarlo,hay que cambiarlo,3314-1708,0.7,verano,2015-12-21,"[2015-12-21, 2015-12-22, 2015-12-23, 2015-12-24, 2015-12-25, 2015-12-26, 2015-12-27]",true,37,-34.84587606,-57.87973336,,,Miscelaneas,,,"{""type"":""Point"",""coordinates"":[-57.87973336,-34.84587606]}"
38,86175,hay que cambiarlo,21/12/2015,hay que cambiarlo,hay que cambiarlo,33116-6456,15.66,verano,2015-12-21,"[2015-12-21, 2015-12-22, 2015-12-23, 2015-12-24, 2015-12-25, 2015-12-26, 2015-12-27]",false,38,-28.2954,-63.86655,5.960464477539063E-8,301.6164353688558,Alfisoles,-0.003627709113061428,0.24058405558268228,"{""type"":""Point"",""coordinates"":[-63.86655,-28.2954]}"
39,06693,hay que cambiarlo,21/12/2015,hay que cambiarlo,hay que cambiarlo,9022-2838,10.28,verano,2015-12-21,"[2015-12-21, 2015-12-22, 2015-12-23, 2015-12-24, 2015-12-25, 2015-12-26, 2015-12-27]",true,39,-35.41999054,-59.66501618,1.761317253112793E-5,297.08901023864746,Complejo indiferenci,-0.003193882293999195,0.1985454559326172,"{""type"":""Point"",""coordinates"":[-59.665016179999995,-35.41999054]}"
40,86182,hay que cambiarlo,21/12/2015,hay que cambiarlo,hay que cambiarlo,6804-2223,13.63,verano,2015-12-21,"[2015-12-21, 2015-12-22, 2015-12-23, 2015-12-24, 2015-12-25, 2015-12-26, 2015-12-27]",true,40,-28.08144587,-63.33466823,2.384185791015625E-7,301.45033836364746,Alfisoles,-0.00410765316337347,0.1896839141845703,"{""type"":""Point"",""coordinates"":[-63.33466822999999,-28.081445870000003]}"
41,86161,hay que cambiarlo,21/12/2015,hay que cambiarlo,hay que cambiarlo,32305-6480,7.04,verano,2015-12-21,"[2015-12-21, 2015-12-22, 2015-12-23, 2015-12-24, 2015-12-25, 2015-12-26, 2015-12-27]",true,41,-27.84078886,-63.93408912,1.671910285949707E-5,301.87978172302246,Alfisoles,-0.0036523006856441498,0.14327176411946616,"{""type"":""Point"",""coordinates"":[-63.93408912,-27.84078886]}"
42,06505,hay que cambiarlo,21/12/2015,hay que cambiarlo,hay que cambiarlo,3344-1739,9.75,verano,2015-12-21,"[2015-12-21, 2015-12-22, 2015-12-23, 2015-12-24, 2015-12-25, 2015-12-26, 2015-12-27]",true,42,-35.17544498,-57.51894858,1.958012580871582E-5,295.52471987406415,Complejo indiferenci,-0.0029275212436914444,0.3142127990722656,"{""type"":""Point"",""coordinates"":[-57.51894857999999,-35.17544498]}"
43,82098,hay que cambiarlo,21/12/2015,hay que cambiarlo,hay que cambiarlo,6247-1929,17.29,verano,2015-12-21,"[2015-12-21, 2015-12-22, 2015-12-23, 2015-12-24, 2015-12-25, 2015-12-26, 2015-12-27]",false,43,-29.42420679,-59.97955475,1.7496943473815918E-4,298.27577781677246,Complejo indiferenci,-0.0033323001116514206,0.43650563557942706,"{""type"":""Point"",""coordinates"":[-59.97955475,-29.424206790000007]}"
44,46091,hay que cambiarlo,21/12/2015,hay que cambiarlo,hay que cambiarlo,33022-6481,59.91,verano,2015-12-21,"[2015-12-21, 2015-12-22, 2015-12-23, 2015-12-24, 2015-12-25, 2015-12-26, 2015-12-27]",false,44,-31.69222606,-65.88603902,0.0,301.37799135843915,Salinas,-0.0014167334884405136,0.042957305908203125,"{""type"":""Point"",""coordinates"":[-65.88603902,-31.692226060000007]}"
45,06833,hay que cambiarlo,21/12/2015,hay que cambiarlo,hay que cambiarlo,36844-7242,76.95,verano,2015-12-21,"[2015-12-21, 2015-12-22, 2015-12-23, 2015-12-24, 2015-12-25, 2015-12-26, 2015-12-27]",false,45,-38.2667152,-60.4002814,2.339482307434082E-6,295.72125307718915,Molisoles,-0.0017591165378689766,0.17189598083496094,"{""type"":""Point"",""coordinates"":[-60.400281400000004,-38.26671519999999]}"
46,42042,hay que cambiarlo,21/12/2015,hay que cambiarlo,hay que cambiarlo,32291-6462,69.01,verano,2015-12-21,"[2015-12-21, 2015-12-22, 2015-12-23, 2015-12-24, 2015-12-25, 2015-12-26, 2015-12-27]",false,46,-38.74134077,-66.43606534,5.960464477539062E-7,299.51430320739746,Complejo indiferenci,-6.342371925711632E-4,0.24977938334147134,"{""type"":""Point"",""coordinates"":[-66.43606534,-38.74134077]}"
47,06140,hay que cambiarlo,21/12/2015,hay que cambiarlo,hay que cambiarlo,6745-2129,5.72,verano,2015-12-21,"[2015-12-21, 2015-12-22, 2015-12-23, 2015-12-24, 2015-12-25, 2015-12-26, 2015-12-27]",true,47,-34.1731879,-59.9792421,2.3186206817626953E-5,296.8698533376058,Molisoles,-0.003091784194111824,0.3138173421223958,"{""type"":""Point"",""coordinates"":[-59.9792421,-34.1731879]}"
48,38007,hay que cambiarlo,21/12/2015,hay que cambiarlo,hay que cambiarlo,6324-1963,25.69,verano,2015-12-21,"[2015-12-21, 2015-12-22, 2015-12-23, 2015-12-24, 2015-12-25, 2015-12-26, 2015-12-27]",false,48,-22.84146227,-66.07927857,6.183981895446777E-6,285.9101365407308,Entisoles,-0.001453193835914135,0.16278775533040366,"{""type"":""Point"",""coordinates"":[-66.07927857,-22.84146227]}"
49,06035,hay que cambiarlo,21/12/2015,hay que cambiarlo,hay que cambiarlo,35411-6952,1.59,verano,2015-12-21,"[2015-12-21, 2015-12-22, 2015-12-23, 2015-12-24, 2015-12-25, 2015-12-26, 2015-12-27]",true,49,-34.67500565,-58.31056343,,,Miscelaneas,,,"{""type"":""Point"",""coordinates"":[-58.31056343,-34.675005649999996]}"
50,42126,hay que cambiarlo,21/12/2015,hay que cambiarlo,hay que cambiarlo,6712-2140,60.37,verano,2015-12-21,"[2015-12-21, 2015-12-22, 2015-12-23, 2015-12-24, 2015-12-25, 2015-12-26, 2015-12-27]",false,50,-35.08643621,-64.92315252,9.834766387939453E-7,298.22369448343915,Molisoles,-0.0037620095536112785,0.25242042541503906,"{""type"":""Point"",""coordinates"":[-64.92315252,-35.08643621000001]}"
51,50126,hay que cambiarlo,6/12/2015,hay que cambiarlo,hay que cambiarlo,6840-2183,16.87,primavera,2015-11-30,"[2015-11-30, 2015-12-01, 2015-12-02, 2015-12-03, 2015-12-04, 2015-12-05, 2015-12-06]",false,51,-33.30008474,-69.17169565,0.0032584071159362793,284.9157428741455,Roca,-0.004667999222874641,0.23912556966145834,"{""type"":""Point"",""coordinates"":[-69.17169565,-33.30008474]}"
52,10056,hay que cambiarlo,6/12/2015,hay que cambiarlo,hay que cambiarlo,34147-6631,17.54,primavera,2015-11-30,"[2015-11-30, 2015-12-01, 2015-12-02, 2015-12-03, 2015-12-04, 2015-12-05, 2015-12-06]",false,52,-28.37478,-65.15865,1.0281801223754883E-6,293.1394570668538,Roca,-0.0035321302711963654,0.24058214823404947,"{""type"":""Point"",""coordinates"":[-65.15865,-28.37478000000001]}"
53,42091,hay que cambiarlo,6/12/2015,hay que cambiarlo,hay que cambiarlo,33324-6517,66.7,primavera,2015-11-30,"[2015-11-30, 2015-12-01, 2015-12-02, 2015-12-03, 2015-12-04, 2015-12-05, 2015-12-06]",false,53,-37.55200494,-66.2268539,3.2782554626464844E-7,297.2255573272705,Roca,-0.0018417537212371826,0.0437469482421875,"{""type"":""Point"",""coordinates"":[-66.2268539,-37.55200494000001]}"
54,66042,hay que cambiarlo,6/12/2015,hay que cambiarlo,hay que cambiarlo,33913-6597,18.11,primavera,2015-11-30,"[2015-11-30, 2015-12-01, 2015-12-02, 2015-12-03, 2015-12-04, 2015-12-05, 2015-12-06]",false,54,-25.15339187,-65.69363231,5.96165657043457E-4,282.1332721710205,Entisoles,-0.003081459552049637,0.412811279296875,"{""type"":""Point"",""coordinates"":[-65.69363231,-25.15339187]}"
55,18161,hay que cambiarlo,6/12/2015,hay que cambiarlo,hay que cambiarlo,6577-2072,8.48,primavera,2015-11-30,"[2015-11-30, 2015-12-01, 2015-12-02, 2015-12-03, 2015-12-04, 2015-12-05, 2015-12-06]",true,55,-28.88393134,-58.78485627,0.0018848180770874023,293.4636758168538,Molisoles,-0.006688959896564484,0.346066157023112,"{""type"":""Point"",""coordinates"":[-58.78485626999999,-28.883931339999997]}"
56,50077,hay que cambiarlo,6/12/2015,hay que cambiarlo,hay que cambiarlo,36849-7246,13.81,primavera,2015-11-30,"[2015-11-30, 2015-12-01, 2015-12-02, 2015-12-03, 2015-12-04, 2015-12-05, 2015-12-06]",true,56,-36.47914887,-69.82659912,1.3177096843719482E-4,287.0091673533122,Roca,-0.0013836119323968887,0.04216766357421875,"{""type"":""Point"",""coordinates"":[-69.82659912,-36.47914887]}"
57,46070,hay que cambiarlo,6/12/2015,hay que cambiarlo,hay que cambiarlo,33392-6628,93.93,primavera,2015-11-30,"[2015-11-30, 2015-12-01, 2015-12-02, 2015-12-03, 2015-12-04, 2015-12-05, 2015-12-06]",false,57,-30.75595424,-66.66826174,8.940696716308594E-6,293.3564980824788,Entisoles,-0.001462879590690136,0.04445775349934896,"{""type"":""Point"",""coordinates"":[-66.66826174,-30.75595424]}"
58,02003,hay que cambiarlo,5/12/2015,hay que cambiarlo,hay que cambiarlo,85-85,2.82,primavera,2015-11-30,"[2015-11-30, 2015-12-01, 2015-12-02, 2015-12-03, 2015-12-04, 2015-12-05, 2015-12-06]",true,58,-34.60909977,-58.40306252,1.2414157390594482E-4,294.6960163116455,Miscelaneas,-0.00454302504658699,0.28160985310872394,"{""type"":""Point"",""coordinates"":[-58.403062520000006,-34.60909977000001]}"
59,06448,hay que cambiarlo,19/11/2015,hay que cambiarlo,hay que cambiarlo,36845-7243,62.27,primavera,2015-11-16,"[2015-11-16, 2015-11-17, 2015-11-18, 2015-11-19, 2015-11-20, 2015-11-21, 2015-11-22]",false,59,-37.52471,-60.96114,2.086162567138672E-7,295.60048421223956,Molisoles,-0.002942904829978943,0.32742945353190106,"{""type"":""Point"",""coordinates"":[-60.96114,-37.52470999999999]}"
60,50021,hay que cambiarlo,19/11/2015,hay que cambiarlo,hay que cambiarlo,6840-2183,42.57,primavera,2015-11-16,"[2015-11-16, 2015-11-17, 2015-11-18, 2015-11-19, 2015-11-20, 2015-11-21, 2015-11-22]",false,60,-32.92152832,-68.85492318,4.988908767700195E-5,291.42885335286456,Roca,-0.004363459534943104,0.2842241923014323,"{""type"":""Point"",""coordinates"":[-68.85492318,-32.92152832]}"
61,22070,hay que cambiarlo,19/11/2015,hay que cambiarlo,hay que cambiarlo,36786-7204,62.87,primavera,2015-11-16,"[2015-11-16, 2015-11-17, 2015-11-18, 2015-11-19, 2015-11-20, 2015-11-21, 2015-11-22]",false,61,-26.52423694,-60.57193526,0.004518419504165649,298.36391194661456,Inceptisoles,-0.0044138673692941666,0.4046885172526042,"{""type"":""Point"",""coordinates"":[-60.57193525999999,-26.52423694]}"
62,06455,hay que cambiarlo,19/11/2015,hay que cambiarlo,hay que cambiarlo,32742-6427,50.28,primavera,2015-11-16,"[2015-11-16, 2015-11-17, 2015-11-18, 2015-11-19, 2015-11-20, 2015-11-21, 2015-11-22]",false,62,-36.3036243,-59.3193839,3.7550926208496094E-6,295.26633707682294,Molisoles,-0.005236356519162655,0.3736858367919922,"{""type"":""Point"",""coordinates"":[-59.3193839,-36.3036243]}"
63,06420,hay que cambiarlo,19/11/2015,hay que cambiarlo,hay que cambiarlo,3346-1741,3.63,primavera,2015-11-16,"[2015-11-16, 2015-11-17, 2015-11-18, 2015-11-19, 2015-11-20, 2015-11-21, 2015-11-22]",true,63,-36.48839763,-56.70043526,6.052255630493164E-4,293.12864176432294,Entisoles,-0.004977886565029621,0.2048041025797526,"{""type"":""Point"",""coordinates"":[-56.70043526,-36.48839763]}"
64,06707,hay que cambiarlo,19/11/2015,hay que cambiarlo,hay que cambiarlo,9022-2838,28.23,primavera,2015-11-16,"[2015-11-16, 2015-11-17, 2015-11-18, 2015-11-19, 2015-11-20, 2015-11-21, 2015-11-22]",false,64,-35.6504504,-59.8096018,8.940696716308594E-7,296.08551025390625,Molisoles,-0.004470943473279476,0.32715797424316406,"{""type"":""Point"",""coordinates"":[-59.8096018,-35.6504504]}"
65,50042,hay que cambiarlo,19/11/2015,hay que cambiarlo,hay que cambiarlo,31950-2172,13.02,primavera,2015-11-16,"[2015-11-16, 2015-11-17, 2015-11-18, 2015-11-19, 2015-11-20, 2015-11-21, 2015-11-22]",true,65,-33.55845261,-67.25244904,5.188584327697754E-5,295.13165283203125,Entisoles,-0.004196743480861187,0.28213246663411456,"{""type"":""Point"",""coordinates"":[-67.25244904,-33.55845261]}"
66,62063,hay que cambiarlo,19/11/2015,hay que cambiarlo,hay que cambiarlo,33760-6593,71.35,primavera,2015-11-16,"[2015-11-16, 2015-11-17, 2015-11-18, 2015-11-19, 2015-11-20, 2015-11-21, 2015-11-22]",false,66,-39.0626,-63.9792,1.5348196029663086E-5,295.27650960286456,Complejo indiferenci,-0.001238793134689331,0.1611321767171224,"{""type"":""Point"",""coordinates"":[-63.97919999999999,-39.062599999999996]}"
67,70133,hay que cambiarlo,26/8/2015,hay que cambiarlo,hay que cambiarlo,32300-6465,32.17,invierno,2015-08-24,"[2015-08-24, 2015-08-25, 2015-08-26, 2015-08-27, 2015-08-28, 2015-08-29, 2015-08-30]",false,67,-31.77467156,-68.91460419,5.297660827636719E-4,279.8048731486003,Roca,-0.0017427243292331696,0.2733084360758464,"{""type"":""Point"",""coordinates"":[-68.91460419,-31.77467156]}"
68,42098,hay que cambiarlo,21/8/2015,hay que cambiarlo,hay que cambiarlo,33160-6527,76.58,invierno,2015-08-17,"[2015-08-17, 2015-08-18, 2015-08-19, 2015-08-20, 2015-08-21, 2015-08-22, 2015-08-23]",false,68,-36.72337723,-65.22473908,0.0,284.91062609354657,Entisoles,-9.06418077647686E-4,0.0971234639485677,"{""type"":""Point"",""coordinates"":[-65.22473908,-36.723377230000004]}"
69,06098,hay que cambiarlo,21/8/2015,hay que cambiarlo,hay que cambiarlo,3314-1708,0.7,invierno,2015-08-17,"[2015-08-17, 2015-08-18, 2015-08-19, 2015-08-20, 2015-08-21, 2015-08-22, 2015-08-23]",true,69,-34.84587606,-57.87973336,,,Miscelaneas,,,"{""type"":""Point"",""coordinates"":[-57.87973336,-34.84587606]}"
70,06868,hay que cambiarlo,21/8/2015,hay que cambiarlo,hay que cambiarlo,3346-1741,61.78,invierno,2015-08-17,"[2015-08-17, 2015-08-18, 2015-08-19, 2015-08-20, 2015-08-21, 2015-08-22, 2015-08-23]",false,70,-37.33667316,-57.03250147,4.4752657413482666E-4,285.2599099477132,Entisoles,-0.0014948304742574692,0.23125648498535156,"{""type"":""Point"",""coordinates"":[-57.03250147,-37.33667316]}"
71,86042,hay que cambiarlo,21/8/2015,hay que cambiarlo,hay que cambiarlo,6800-2197,12.07,invierno,2015-08-17,"[2015-08-17, 2015-08-18, 2015-08-19, 2015-08-20, 2015-08-21, 2015-08-22, 2015-08-23]",true,71,-28.89628,-62.62596,1.9669532775878906E-6,286.96140734354657,Molisoles,-0.0016797706484794617,0.33481788635253906,"{""type"":""Point"",""coordinates"":[-62.62596,-28.89628]}"
72,74042,hay que cambiarlo,21/8/2015,hay que cambiarlo,hay que cambiarlo,33178-6482,15.68,invierno,2015-08-17,"[2015-08-17, 2015-08-18, 2015-08-19, 2015-08-20, 2015-08-21, 2015-08-22, 2015-08-23]",false,72,-34.82387161,-66.44893646,7.092952728271484E-6,284.31858507792157,Entisoles,-0.0016718553379178047,0.13286463419596353,"{""type"":""Point"",""coordinates"":[-66.44893646,-34.82387160999999]}"
73,66014,hay que cambiarlo,21/8/2015,hay que cambiarlo,hay que cambiarlo,147-147,8.08,invierno,2015-08-17,"[2015-08-17, 2015-08-18, 2015-08-19, 2015-08-20, 2015-08-21, 2015-08-22, 2015-08-23]",true,73,-25.02048923,-66.0970212,1.9977986812591553E-4,281.3860492706299,Aridisoles,-0.001107112504541874,0.20978482564290366,"{""type"":""Point"",""coordinates"":[-66.0970212,-25.02048923]}"
74,58035,hay que cambiarlo,13/8/2015,hay que cambiarlo,hay que cambiarlo,6898-2210,63.38,invierno,2015-08-10,"[2015-08-10, 2015-08-11, 2015-08-12, 2015-08-13, 2015-08-14, 2015-08-15, 2015-08-16]",false,74,-38.75282316,-68.83773873,2.2351741790771484E-7,277.4204959869385,Aridisoles,-9.932275861501694E-4,0.18549601236979166,"{""type"":""Point"",""coordinates"":[-68.83773873,-38.75282316]}"
75,74007,hay que cambiarlo,12/8/2015,hay que cambiarlo,hay que cambiarlo,31950-2172,64.22,invierno,2015-08-10,"[2015-08-10, 2015-08-11, 2015-08-12, 2015-08-13, 2015-08-14, 2015-08-15, 2015-08-16]",false,75,-32.13651315,-66.85445389,2.3111701011657715E-5,283.6036014556885,Entisoles,-8.035991340875626E-4,0.052005767822265625,"{""type"":""Point"",""coordinates"":[-66.85445389,-32.13651315]}"
76,30021,hay que cambiarlo,13/8/2015,hay que cambiarlo,hay que cambiarlo,3331-1725,3.81,invierno,2015-08-10,"[2015-08-10, 2015-08-11, 2015-08-12, 2015-08-13, 2015-08-14, 2015-08-15, 2015-08-16]",true,76,-32.01197804,-60.61726225,0.0100841224193573,285.97681109110516,Molisoles,-0.0016386471688747406,0.44295310974121094,"{""type"":""Point"",""coordinates"":[-60.61726225,-32.01197804]}"
77,06686,hay que cambiarlo,13/8/2015,hay que cambiarlo,hay que cambiarlo,31982-6397,19.01,invierno,2015-08-10,"[2015-08-10, 2015-08-11, 2015-08-12, 2015-08-13, 2015-08-14, 2015-08-15, 2015-08-16]",false,77,-34.2433108,-60.532499,0.005735680460929871,284.24512163798016,Molisoles,-0.0012756995856761932,0.48502159118652344,"{""type"":""Point"",""coordinates"":[-60.532498999999994,-34.2433108]}"
78,66154,hay que cambiarlo,13/8/2015,hay que cambiarlo,hay que cambiarlo,6365-1979,21.28,invierno,2015-08-10,"[2015-08-10, 2015-08-11, 2015-08-12, 2015-08-13, 2015-08-14, 2015-08-15, 2015-08-16]",false,78,-25.54455,-65.82056,2.5822222232818604E-4,279.36743609110516,Roca,-0.0013500656932592392,0.3833929697672526,"{""type"":""Point"",""coordinates"":[-65.82056,-25.544550000000008]}"
79,02007,hay que cambiarlo,9/8/2015,hay que cambiarlo,hay que cambiarlo,36837-7237,7.04,invierno,2015-08-03,"[2015-08-03, 2015-08-04, 2015-08-05, 2015-08-06, 2015-08-07, 2015-08-08, 2015-08-09]",true,79,-34.63680708,-58.45826985,1.0013580322265625E-4,286.93395296732587,Miscelaneas,-0.0019268300384283066,0.3812796274820964,"{""type"":""Point"",""coordinates"":[-58.45826984999999,-34.63680708]}"
80,66133,hay que cambiarlo,10/8/2015,hay que cambiarlo,hay que cambiarlo,6362-1978,14.31,invierno,2015-08-10,"[2015-08-10, 2015-08-11, 2015-08-12, 2015-08-13, 2015-08-14, 2015-08-15, 2015-08-16]",true,80,-22.49881,-62.40759,8.925795555114746E-6,293.7676639556885,Molisoles,-0.00142613984644413,0.14965120951334634,"{""type"":""Point"",""coordinates"":[-62.40759,-22.498810000000002]}"
81,42154,hay que cambiarlo,5/8/2015,hay que cambiarlo,hay que cambiarlo,33160-6527,48.14,invierno,2015-08-03,"[2015-08-03, 2015-08-04, 2015-08-05, 2015-08-06, 2015-08-07, 2015-08-08, 2015-08-09]",false,81,-37.4392128,-65.02373505,2.7120113372802734E-6,283.7156098683675,Molisoles,-0.001133585348725319,0.08741315205891927,"{""type"":""Point"",""coordinates"":[-65.02373505,-37.4392128]}"
82,38007,hay que cambiarlo,5/8/2015,hay que cambiarlo,hay que cambiarlo,6324-1963,25.69,invierno,2015-08-03,"[2015-08-03, 2015-08-04, 2015-08-05, 2015-08-06, 2015-08-07, 2015-08-08, 2015-08-09]",false,82,-22.84146227,-66.07927857,1.2069940567016602E-5,278.2848644256592,Entisoles,-4.594717174768448E-4,0.13140169779459634,"{""type"":""Point"",""coordinates"":[-66.07927857,-22.84146227]}"
83,06364,hay que cambiarlo,5/8/2015,hay que cambiarlo,hay que cambiarlo,6936-2128,20,invierno,2015-08-03,"[2015-08-03, 2015-08-04, 2015-08-05, 2015-08-06, 2015-08-07, 2015-08-08, 2015-08-09]",false,83,-34.72117406,-59.01160158,1.4483928680419922E-5,286.4086437225342,Complejo indiferenci,-0.0018464252352714539,0.4357471466064453,"{""type"":""Point"",""coordinates"":[-59.01160158,-34.72117406]}"
84,14014,hay que cambiarlo,10/8/2015,hay que cambiarlo,hay que cambiarlo,37574-7384,24.04,invierno,2015-08-10,"[2015-08-10, 2015-08-11, 2015-08-12, 2015-08-13, 2015-08-14, 2015-08-15, 2015-08-16]",false,84,-31.47878838,-64.14509583,1.3828277587890625E-5,284.8438358306885,Miscelaneas,-0.001577099785208702,0.3738822937011719,"{""type"":""Point"",""coordinates"":[-64.14509583,-31.478788380000008]}"
85,06112,hay que cambiarlo,10/8/2015,hay que cambiarlo,hay que cambiarlo,6954-2111,27.83,invierno,2015-08-10,"[2015-08-10, 2015-08-11, 2015-08-12, 2015-08-13, 2015-08-14, 2015-08-15, 2015-08-16]",false,85,-35.2410531,-60.3474272,0.0018285512924194336,283.8406620025635,Molisoles,-0.001362321898341179,0.42339452107747394,"{""type"":""Point"",""coordinates"":[-60.3474272,-35.24105310000001]}"
86,18056,hay que cambiarlo,6/8/2015,hay que cambiarlo,hay que cambiarlo,1369-1019,0.61,invierno,2015-08-03,"[2015-08-03, 2015-08-04, 2015-08-05, 2015-08-06, 2015-08-07, 2015-08-08, 2015-08-09]",true,86,-29.10620117,-56.5596695,0.0021456480026245117,296.8009777069092,Inceptisoles,-0.0025454647839069366,0.3366311391194661,"{""type"":""Point"",""coordinates"":[-56.5596695,-29.10620117]}"
87,58014,hay que cambiarlo,5/8/2015,hay que cambiarlo,hay que cambiarlo,9459-2811,51.39,invierno,2015-08-03,"[2015-08-03, 2015-08-04, 2015-08-05, 2015-08-06, 2015-08-07, 2015-08-08, 2015-08-09]",false,87,-37.88803423,-68.51449,9.5367431640625E-7,281.4223155975342,Roca,-0.0010924618691205978,0.18909390767415366,"{""type"":""Point"",""coordinates"":[-68.51449,-37.88803423]}"
88,86014,hay que cambiarlo,5/8/2015,hay que cambiarlo,hay que cambiarlo,6855-2224,89.3,invierno,2015-08-03,"[2015-08-03, 2015-08-04, 2015-08-05, 2015-08-06, 2015-08-07, 2015-08-08, 2015-08-09]",false,88,-26.78946686,-62.70516586,2.9802322387695312E-8,298.7646007537842,Entisoles,-1.9703246653079987E-4,0.1333624521891276,"{""type"":""Point"",""coordinates"":[-62.70516586,-26.789466860000005]}"
89,38035,hay que cambiarlo,5/8/2015,hay que cambiarlo,hay que cambiarlo,33117-6463,14.96,invierno,2015-08-03,"[2015-08-03, 2015-08-04, 2015-08-05, 2015-08-06, 2015-08-07, 2015-08-08, 2015-08-09]",true,89,-23.88497353,-64.67390442,5.331039428710938E-4,293.6156749725342,Roca,-0.002931170165538788,0.33228810628255206,"{""type"":""Point"",""coordinates"":[-64.67390442,-23.884973529999996]}"
90,58077,hay que cambiarlo,5/8/2015,hay que cambiarlo,hay que cambiarlo,6798-2155,57.5,invierno,2015-08-03,"[2015-08-03, 2015-08-04, 2015-08-05, 2015-08-06, 2015-08-07, 2015-08-08, 2015-08-09]",false,90,-37.05693858,-70.77617021,2.0325183868408203E-4,275.0522797902425,Roca,-6.373971700668335E-4,0.347018559773763,"{""type"":""Point"",""coordinates"":[-70.77617021,-37.05693858]}"
91,06609,hay que cambiarlo,5/8/2015,hay que cambiarlo,hay que cambiarlo,6725-2212,72.84,invierno,2015-08-03,"[2015-08-03, 2015-08-04, 2015-08-05, 2015-08-06, 2015-08-07, 2015-08-08, 2015-08-09]",false,91,-35.6179927,-62.0046671,1.1563301086425781E-5,285.2431977589925,Molisoles,-0.002079881727695465,0.4248669942220052,"{""type"":""Point"",""coordinates"":[-62.0046671,-35.61799270000001]}"
92,18140,hay que cambiarlo,5/8/2015,hay que cambiarlo,hay que cambiarlo,6711-2131,17.23,invierno,2015-08-03,"[2015-08-03, 2015-08-04, 2015-08-05, 2015-08-06, 2015-08-07, 2015-08-08, 2015-08-09]",false,92,-27.41325145,-58.37888858,3.419220447540283E-4,297.6139659881592,Alfisoles,-0.003096494823694229,0.3108469645182292,"{""type"":""Point"",""coordinates"":[-58.378888579999995,-27.413251449999997]}"
93,90063,hay que cambiarlo,5/8/2015,hay que cambiarlo,hay que cambiarlo,33520-6650,8.65,invierno,2015-08-03,"[2015-08-03, 2015-08-04, 2015-08-05, 2015-08-06, 2015-08-07, 2015-08-08, 2015-08-09]",true,93,-26.94954,-65.30289,6.749927997589111E-4,291.8408540089925,Inceptisoles,-0.0024146754294633865,0.311187744140625,"{""type"":""Point"",""coordinates"":[-65.30289,-26.949540000000002]}"
94,38056,hay que cambiarlo,5/8/2015,hay que cambiarlo,hay que cambiarlo,33913-6597,21.55,invierno,2015-08-03,"[2015-08-03, 2015-08-04, 2015-08-05, 2015-08-06, 2015-08-07, 2015-08-08, 2015-08-09]",false,94,-24.37362671,-65.60406494,8.871257305145264E-4,278.0220063527425,Inceptisoles,-0.0018822886049747467,0.2926807403564453,"{""type"":""Point"",""coordinates"":[-65.60406494,-24.37362671]}"
95,06714,hay que cambiarlo,3/11/2014,hay que cambiarlo,hay que cambiarlo,31982-6397,17.53,primavera,2014-11-03,"[2014-11-03, 2014-11-04, 2014-11-05, 2014-11-06, 2014-11-07, 2014-11-08, 2014-11-09]",false,95,-34.1554316,-60.4724629,0.0037702471017837524,287.4491392771403,Molisoles,-0.001321466639637947,0.469302495320638,"{""type"":""Point"",""coordinates"":[-60.472462900000004,-34.1554316]}"
96,54007,hay que cambiarlo,3/11/2014,hay que cambiarlo,hay que cambiarlo,6498-2033,3.83,primavera,2014-11-03,"[2014-11-03, 2014-11-04, 2014-11-05, 2014-11-06, 2014-11-07, 2014-11-08, 2014-11-09]",true,96,-28.06622124,-55.59853745,0.008301198482513428,297.5919615427653,Ultisoles,-0.00410335510969162,0.483676274617513,"{""type"":""Point"",""coordinates"":[-55.59853745,-28.066221239999997]}"
97,26084,hay que cambiarlo,1/11/2014,hay que cambiarlo,hay que cambiarlo,6442-2010,0.79,primavera,2014-10-27,"[2014-10-27, 2014-10-28, 2014-10-29, 2014-10-30, 2014-10-31, 2014-11-01, 2014-11-02]",true,97,-45.68628224,-70.26062851,6.407499313354492E-7,284.25694465637207,Aridisoles,-4.0584616363048553E-4,0.08790779113769531,"{""type"":""Point"",""coordinates"":[-70.26062851,-45.686282240000004]}"
98,06833,hay que cambiarlo,2/11/2014,hay que cambiarlo,hay que cambiarlo,36844-7242,76.95,primavera,2014-10-27,"[2014-10-27, 2014-10-28, 2014-10-29, 2014-10-30, 2014-10-31, 2014-11-01, 2014-11-02]",false,98,-38.2667152,-60.4002814,0.014216706156730652,291.98684374491376,Molisoles,-0.0015391577035188675,0.41572825113932294,"{""type"":""Point"",""coordinates"":[-60.400281400000004,-38.26671519999999]}"
99,58105,hay que cambiarlo,1/11/2014,hay que cambiarlo,hay que cambiarlo,34051-6530,10.3,primavera,2014-10-27,"[2014-10-27, 2014-10-28, 2014-10-29, 2014-10-30, 2014-10-31, 2014-11-01, 2014-11-02]",true,99,-38.34971979,-69.93995142,7.450580596923828E-8,290.03135871887207,Roca,-5.550235509872437E-4,0.04227383931477865,"{""type"":""Point"",""coordinates"":[-69.93995142,-38.34971979]}"
100,86133,hay que cambiarlo,1/11/2014,hay que cambiarlo,hay que cambiarlo,32820-6498,6.85,primavera,2014-10-27,"[2014-10-27, 2014-10-28, 2014-10-29, 2014-10-30, 2014-10-31, 2014-11-01, 2014-11-02]",true,100,-26.28318787,-64.45684052,1.1920928955078125E-7,306.22154426574707,Entisoles,-0.0023740828037261963,0.20822652180989584,"{""type"":""Point"",""coordinates"":[-64.45684052,-26.28318787]}"
101,02004,hay que cambiarlo,29/10/2014,hay que cambiarlo,hay que cambiarlo,8891-2706,2.09,primavera,2014-10-27,"[2014-10-27, 2014-10-28, 2014-10-29, 2014-10-30, 2014-10-31, 2014-11-01, 2014-11-02]",true,101,-34.64641355,-58.38427103,8.933991193771362E-4,299.04966926574707,Miscelaneas,-0.0037195105105638504,0.18436622619628906,"{""type"":""Point"",""coordinates"":[-58.384271029999994,-34.64641355]}"
102,58098,hay que cambiarlo,28/10/2014,hay que cambiarlo,hay que cambiarlo,6898-2210,25.68,primavera,2014-10-27,"[2014-10-27, 2014-10-28, 2014-10-29, 2014-10-30, 2014-10-31, 2014-11-01, 2014-11-02]",false,102,-39.18308258,-69.37890625,7.62939453125E-6,290.3935006459554,Entisoles,-0.0011162161827087402,0.0481713612874349,"{""type"":""Point"",""coordinates"":[-69.37890625,-39.18308258]}"
103,18077,hay que cambiarlo,28/10/2014,hay que cambiarlo,hay que cambiarlo,17-17,41.46,primavera,2014-10-27,"[2014-10-27, 2014-10-28, 2014-10-29, 2014-10-30, 2014-10-31, 2014-11-01, 2014-11-02]",false,103,-27.35196615,-57.87393625,0.0011292099952697754,303.0910104115804,Entisoles,-0.005113435909152031,0.256741205851237,"{""type"":""Point"",""coordinates"":[-57.87393625,-27.35196615]}"
104,14105,hay que cambiarlo,2/6/2015,hay que cambiarlo,hay que cambiarlo,6799-2118,21.24,otoño,2015-06-01,"[2015-06-01, 2015-06-02, 2015-06-03, 2015-06-04, 2015-06-05, 2015-06-06, 2015-06-07]",false,104,-30.80593546,-63.17324293,5.811452865600586E-7,289.41031074523926,Molisoles,-0.0012738704681396484,0.23428217569986978,"{""type"":""Point"",""coordinates"":[-63.17324293,-30.805935460000004]}"
105,46126,hay que cambiarlo,29/12/2013,hay que cambiarlo,hay que cambiarlo,33523-6661,39.76,verano,2013-12-23,"[2013-12-23, 2013-12-24, 2013-12-25, 2013-12-26, 2013-12-27, 2013-12-28, 2013-12-29]",false,105,-29.16052455,-67.09195563,3.553926944732666E-5,296.5157922108968,Entisoles,-0.005324054509401321,0.21999677022298178,"{""type"":""Point"",""coordinates"":[-67.09195563,-29.160524550000005]}"
106,26098,hay que cambiarlo,22/12/2013,hay que cambiarlo,hay que cambiarlo,6445-2011,54.35,primavera,2013-12-16,"[2013-12-16, 2013-12-17, 2013-12-18, 2013-12-19, 2013-12-20, 2013-12-21, 2013-12-22]",false,106,-43.8274765,-69.90713501,2.4586915969848633E-6,294.4282875061035,Aridisoles,-3.198152408003807E-4,0.025354385375976562,"{""type"":""Point"",""coordinates"":[-69.90713501,-43.827476499999996]}"
107,66021,hay que cambiarlo,9/11/2013,hay que cambiarlo,hay que cambiarlo,6365-1979,21.78,primavera,2013-11-04,"[2013-11-04, 2013-11-05, 2013-11-06, 2013-11-07, 2013-11-08, 2013-11-09, 2013-11-10]",false,107,-26.10228924,-66.01550671,2.8654932975769043E-5,288.5553035736084,Roca,-0.0021324949339032173,0.19449297587076822,"{""type"":""Point"",""coordinates"":[-66.01550671,-26.102289239999998]}"
108,06274,hay que cambiarlo,9/11/2013,hay que cambiarlo,hay que cambiarlo,7058-2230,1.42,primavera,2013-11-04,"[2013-11-04, 2013-11-05, 2013-11-06, 2013-11-07, 2013-11-08, 2013-11-09, 2013-11-10]",true,108,-34.8275807,-58.222912,2.0191073417663574E-5,289.0625464121501,Complejo indiferenci,-0.004373145289719105,0.4353281656901042,"{""type"":""Point"",""coordinates"":[-58.22291200000001,-34.8275807]}"
109,06274,hay que cambiarlo,9/11/2013,hay que cambiarlo,hay que cambiarlo,7058-2230,1.42,primavera,2013-11-04,"[2013-11-04, 2013-11-05, 2013-11-06, 2013-11-07, 2013-11-08, 2013-11-09, 2013-11-10]",true,109,-34.8275807,-58.222912,2.0191073417663574E-5,289.0625464121501,Complejo indiferenci,-0.004373145289719105,0.4353281656901042,"{""type"":""Point"",""coordinates"":[-58.22291200000001,-34.8275807]}"
110,06217,hay que cambiarlo,9/11/2013,hay que cambiarlo,hay que cambiarlo,6766-2227,28.22,primavera,2013-11-04,"[2013-11-04, 2013-11-05, 2013-11-06, 2013-11-07, 2013-11-08, 2013-11-09, 2013-11-10]",false,110,-35.4916042,-57.8945611,1.545250415802002E-5,287.9382788340251,Complejo indiferenci,-0.0036548636853694916,0.44438743591308594,"{""type"":""Point"",""coordinates"":[-57.894561100000004,-35.4916042]}"
111,06434,hay que cambiarlo,22/8/2014,hay que cambiarlo,hay que cambiarlo,8891-2706,4.6,invierno,2014-08-18,"[2014-08-18, 2014-08-19, 2014-08-20, 2014-08-21, 2014-08-22, 2014-08-23, 2014-08-24]",true,111,-34.69095715,-58.38386285,0.001040339469909668,289.4828535715739,Miscelaneas,-0.0015833601355552673,0.32980982462565106,"{""type"":""Point"",""coordinates"":[-58.38386285000001,-34.69095715000001]}"
112,22133,hay que cambiarlo,16/7/2014,hay que cambiarlo,hay que cambiarlo,36786-7204,29.42,invierno,2014-07-14,"[2014-07-14, 2014-07-15, 2014-07-16, 2014-07-17, 2014-07-18, 2014-07-19, 2014-07-20]",false,112,-26.99698694,-60.33777397,1.8477439880371094E-6,295.95654551188153,Molisoles,-0.002602139487862587,0.3461170196533203,"{""type"":""Point"",""coordinates"":[-60.33777397000001,-26.99698694]}"
113,06441,hay que cambiarlo,12/7/2014,hay que cambiarlo,hay que cambiarlo,3314-1708,23.31,invierno,2014-07-07,"[2014-07-07, 2014-07-08, 2014-07-09, 2014-07-10, 2014-07-11, 2014-07-12, 2014-07-13]",false,113,-35.03880607,-58.05930616,1.379847526550293E-5,282.41634941101074,Complejo indiferenci,-0.0014504967257380486,0.48035113016764325,"{""type"":""Point"",""coordinates"":[-58.05930616,-35.03880607000001]}"
114,18168,hay que cambiarlo,3/7/2014,hay que cambiarlo,hay que cambiarlo,68-68,3.13,invierno,2014-06-30,"[2014-06-30, 2014-07-01, 2014-07-02, 2014-07-03, 2014-07-04, 2014-07-05, 2014-07-06]",true,114,-28.51878167,-56.05544289,0.007835403084754944,284.59082730611163,Ultisoles,-0.0014094989746809006,0.46753692626953125,"{""type"":""Point"",""coordinates"":[-56.05544289,-28.518781670000006]}"
115,06826,hay que cambiarlo,27/7/2013,hay que cambiarlo,hay que cambiarlo,36986-7281,85.75,invierno,2013-07-22,"[2013-07-22, 2013-07-23, 2013-07-24, 2013-07-25, 2013-07-26, 2013-07-27, 2013-07-28]",false,115,-36.0383096,-62.8210281,1.1846423149108887E-5,276.9854482014974,Molisoles,-7.557235658168793E-4,0.14848009745279947,"{""type"":""Point"",""coordinates"":[-62.8210281,-36.0383096]}"
116,70119,hay que cambiarlo,11/7/2013,hay que cambiarlo,hay que cambiarlo,34179-6743,71.88,invierno,2013-07-08,"[2013-07-08, 2013-07-09, 2013-07-10, 2013-07-11, 2013-07-12, 2013-07-13, 2013-07-14]",false,116,-30.80415774,-67.366235,3.3974647521972656E-5,278.37568283081055,Entisoles,-4.02575358748436E-4,0.04767799377441406,"{""type"":""Point"",""coordinates"":[-67.366235,-30.80415774]}"
117,82028,hay que cambiarlo,25/6/2013,hay que cambiarlo,hay que cambiarlo,36996-7283,18.3,invierno,2013-06-24,"[2013-06-24, 2013-06-25, 2013-06-26, 2013-06-27, 2013-06-28, 2013-06-29, 2013-06-30]",false,117,-33.3790173,-61.3544315,8.344650268554688E-7,281.5235430399577,Alfisoles,-6.161127239465714E-4,0.3355967203776042,"{""type"":""Point"",""coordinates"":[-61.354431500000004,-33.37901730000001]}"
118,34042,hay que cambiarlo,25/6/2013,hay que cambiarlo,hay que cambiarlo,6515-2042,82.49,invierno,2013-06-24,"[2013-06-24, 2013-06-25, 2013-06-26, 2013-06-27, 2013-06-28, 2013-06-29, 2013-06-30]",false,118,-24.9895438,-58.6912886,2.1010637283325195E-5,287.183048248291,Rio,-0.0010382365435361862,0.48877588907877606,"{""type"":""Point"",""coordinates"":[-58.69128860000001,-24.989543799999996]}"
119,06791,hay que cambiarlo,10/3/2015,hay que cambiarlo,hay que cambiarlo,32742-6427,53.39,verano,2015-03-09,"[2015-03-09, 2015-03-10, 2015-03-11, 2015-03-12, 2015-03-13, 2015-03-14, 2015-03-15]",false,119,-37.3502704,-59.07873297,9.5367431640625E-7,295.80488268534344,Molisoles,-0.0016108714044094086,0.23204612731933594,"{""type"":""Point"",""coordinates"":[-59.07873297,-37.3502704]}"
120,42007,hay que cambiarlo,10/3/2015,hay que cambiarlo,hay que cambiarlo,32779-6443,60.03,verano,2015-03-09,"[2015-03-09, 2015-03-10, 2015-03-11, 2015-03-12, 2015-03-13, 2015-03-14, 2015-03-15]",false,120,-37.12629611,-63.82921122,1.9818544387817383E-5,297.99873034159344,Molisoles,-0.0022834353148937225,0.22330411275227866,"{""type"":""Point"",""coordinates"":[-63.82921121999999,-37.12629611]}"
121,06651,hay que cambiarlo,10/3/2015,hay que cambiarlo,hay que cambiarlo,32666-6430,54.98,verano,2015-03-09,"[2015-03-09, 2015-03-10, 2015-03-11, 2015-03-12, 2015-03-13, 2015-03-14, 2015-03-15]",false,121,-38.2787652,-63.308047,1.1554360389709473E-4,295.77460924784344,Molisoles,-0.002348901703953743,0.32707659403483075,"{""type"":""Point"",""coordinates"":[-63.30804700000001,-38.2787652]}"
122,70028,hay que cambiarlo,10/3/2015,hay que cambiarlo,hay que cambiarlo,32300-6465,13.13,verano,2015-03-09,"[2015-03-09, 2015-03-10, 2015-03-11, 2015-03-12, 2015-03-13, 2015-03-14, 2015-03-15]",true,122,-31.53719704,-68.52501832,3.725290298461914E-6,299.1133950551351,Entisoles,-5.9560127556324E-4,0.16499964396158853,"{""type"":""Point"",""coordinates"":[-68.52501832,-31.53719704]}"
123,14098,hay que cambiarlo,10/3/2015,hay que cambiarlo,hay que cambiarlo,34345-6361,23.14,verano,2015-03-09,"[2015-03-09, 2015-03-10, 2015-03-11, 2015-03-12, 2015-03-13, 2015-03-14, 2015-03-15]",false,123,-32.64751095,-64.22141859,8.493661880493164E-7,297.81570625305176,Complejo indiferenci,-0.0034138672053813934,0.2914727528889974,"{""type"":""Point"",""coordinates"":[-64.22141859,-32.64751095]}"
124,66049,hay que cambiarlo,2/3/2015,hay que cambiarlo,hay que cambiarlo,32929-6365,4.08,verano,2015-03-02,"[2015-03-02, 2015-03-03, 2015-03-04, 2015-03-05, 2015-03-06, 2015-03-07, 2015-03-08]",true,124,-24.75876236,-64.99394226,3.072619438171387E-5,295.7741705576579,Molisoles,-0.003220432437956333,0.46590550740559894,"{""type"":""Point"",""coordinates"":[-64.99394226,-24.758762360000002]}"
125,94035,hay que cambiarlo,2/3/2015,hay que cambiarlo,hay que cambiarlo,33250-6718,4.16,verano,2015-03-02,"[2015-03-02, 2015-03-03, 2015-03-04, 2015-03-05, 2015-03-06, 2015-03-07, 2015-03-08]",true,125,-54.51138676,-67.19580446,2.91287899017334E-4,280.3090826670329,Inceptisoles,-0.0027386806905269623,0.17414347330729166,"{""type"":""Point"",""coordinates"":[-67.19580446,-54.51138676]}"
126,02009,hay que cambiarlo,25/2/2015,hay que cambiarlo,hay que cambiarlo,36837-7237,4.96,verano,2015-02-23,"[2015-02-23, 2015-02-24, 2015-02-25, 2015-02-26, 2015-02-27, 2015-02-28, 2015-03-01]",true,126,-34.64379608,-58.5191299,3.6622583866119385E-4,298.0676918029785,Miscelaneas,-0.003159494139254093,0.23714637756347656,"{""type"":""Point"",""coordinates"":[-58.51912990000001,-34.64379608]}"
127,58042,hay que cambiarlo,25/2/2015,hay que cambiarlo,hay que cambiarlo,6798-2155,17.14,verano,2015-02-23,"[2015-02-23, 2015-02-24, 2015-02-25, 2015-02-26, 2015-02-27, 2015-02-28, 2015-03-01]",false,127,-37.06895161,-70.38454137,1.7943978309631348E-4,290.2285804748535,Roca,-8.886605501174927E-4,0.05930264790852865,"{""type"":""Point"",""coordinates"":[-70.38454137,-37.06895161]}"
128,30049,hay que cambiarlo,18/2/2015,hay que cambiarlo,hay que cambiarlo,39-39,13.76,verano,2015-02-16,"[2015-02-16, 2015-02-17, 2015-02-18, 2015-02-19, 2015-02-20, 2015-02-21, 2015-02-22]",true,128,-33.55871824,-59.48052013,1.0517239570617676E-4,297.6860993703206,Entisoles,-0.003590758889913559,0.3935190836588542,"{""type"":""Point"",""coordinates"":[-59.48052013,-33.558718240000005]}"
129,42084,hay que cambiarlo,15/7/2014,hay que cambiarlo,hay que cambiarlo,6874-2160,76.87,invierno,2014-07-14,"[2014-07-14, 2014-07-15, 2014-07-16, 2014-07-17, 2014-07-18, 2014-07-19, 2014-07-20]",false,129,-38.01481736,-65.58481895,4.0918588638305664E-5,285.01212819417316,Complejo indiferenci,-3.445502370595932E-4,0.26160748799641925,"{""type"":""Point"",""coordinates"":[-65.58481895,-38.01481736]}"
130,06364,hay que cambiarlo,18/2/2015,hay que cambiarlo,hay que cambiarlo,6936-2128,20,verano,2015-02-16,"[2015-02-16, 2015-02-17, 2015-02-18, 2015-02-19, 2015-02-20, 2015-02-21, 2015-02-22]",false,130,-34.72117406,-59.01160158,4.366040229797363E-5,297.1220531463623,Complejo indiferenci,-0.002904812805354595,0.2878500620524089,"{""type"":""Point"",""coordinates"":[-59.01160158,-34.72117406]}"
131,70042,hay que cambiarlo,18/2/2015,hay que cambiarlo,hay que cambiarlo,32300-6465,8.76,verano,2015-02-16,"[2015-02-16, 2015-02-17, 2015-02-18, 2015-02-19, 2015-02-20, 2015-02-21, 2015-02-22]",true,131,-31.49561412,-68.56370679,3.471970558166504E-6,297.065575281779,Entisoles,-0.002729835920035839,0.13881874084472656,"{""type"":""Point"",""coordinates"":[-68.56370679,-31.49561412]}"
132,62077,hay que cambiarlo,18/2/2015,hay que cambiarlo,hay que cambiarlo,32859-6573,2.52,verano,2015-02-16,"[2015-02-16, 2015-02-17, 2015-02-18, 2015-02-19, 2015-02-20, 2015-02-21, 2015-02-22]",true,132,-40.77858734,-65.0507431,,,Aridisoles,,,"{""type"":""Point"",""coordinates"":[-65.0507431,-40.77858734]}"
133,18007,hay que cambiarlo,2/3/2015,hay que cambiarlo,hay que cambiarlo,3339-1733,1.84,verano,2015-03-02,"[2015-03-02, 2015-03-03, 2015-03-04, 2015-03-05, 2015-03-06, 2015-03-07, 2015-03-08]",true,133,-28.48951707,-59.03412064,6.909221410751343E-4,299.3875331878662,Rio,-0.00356880109757185,0.25063323974609375,"{""type"":""Point"",""coordinates"":[-59.034120640000005,-28.489517069999998]}"
134,34028,hay que cambiarlo,2/3/2015,hay que cambiarlo,hay que cambiarlo,33909-6556,47.74,verano,2015-03-02,"[2015-03-02, 2015-03-03, 2015-03-04, 2015-03-05, 2015-03-06, 2015-03-07, 2015-03-08]",false,134,-23.67500877,-62.31292343,2.3677945137023926E-5,301.4183762868245,Alfisoles,-0.00450954120606184,0.31359418233235675,"{""type"":""Point"",""coordinates"":[-62.31292343,-23.67500877]}"
135,30088,hay que cambiarlo,2/3/2015,hay que cambiarlo,hay que cambiarlo,32026-6403,32.48,verano,2015-03-02,"[2015-03-02, 2015-03-03, 2015-03-04, 2015-03-05, 2015-03-06, 2015-03-07, 2015-03-08]",false,135,-31.59398509,-58.37116015,6.485879421234131E-4,297.4813645680745,Vertisoles,-0.003171505406498909,0.4236704508463542,"{""type"":""Point"",""coordinates"":[-58.37116015,-31.593985090000004]}"
136,26007,hay que cambiarlo,2/3/2015,hay que cambiarlo,hay que cambiarlo,32798-6301,46.39,verano,2015-03-02,"[2015-03-02, 2015-03-03, 2015-03-04, 2015-03-05, 2015-03-06, 2015-03-07, 2015-03-08]",false,136,-42.32925797,-65.63134766,2.9802322387695312E-8,297.8548183441162,Aridisoles,-3.5019218921661377E-4,0.10737228393554688,"{""type"":""Point"",""coordinates"":[-65.63134766,-42.32925797]}"
137,42063,hay que cambiarlo,2/3/2015,hay que cambiarlo,hay que cambiarlo,6866-2220,60.56,verano,2015-03-02,"[2015-03-02, 2015-03-03, 2015-03-04, 2015-03-05, 2015-03-06, 2015-03-07, 2015-03-08]",false,137,-36.16043091,-68.1297226,2.980232238769531E-7,292.9970709482829,Roca,-0.002993396483361721,0.1609516143798828,"{""type"":""Point"",""coordinates"":[-68.1297226,-36.16043091]}"
138,06665,hay que cambiarlo,2/3/2015,hay que cambiarlo,hay que cambiarlo,3325-1719,9.81,verano,2015-03-02,"[2015-03-02, 2015-03-03, 2015-03-04, 2015-03-05, 2015-03-06, 2015-03-07, 2015-03-08]",true,138,-33.6241496,-60.0461017,3.9190053939819336E-5,297.2480475107829,Rio,-0.0038770483806729317,0.4523487091064453,"{""type"":""Point"",""coordinates"":[-60.04610170000001,-33.6241496]}"
139,22084,hay que cambiarlo,2/3/2015,hay que cambiarlo,hay que cambiarlo,6521-2046,18.34,verano,2015-03-02,"[2015-03-02, 2015-03-03, 2015-03-04, 2015-03-05, 2015-03-06, 2015-03-07, 2015-03-08]",false,139,-26.51481035,-59.22556127,0.0019668787717819214,300.0354010264079,Rio,-0.004403754137456417,0.42432594299316406,"{""type"":""Point"",""coordinates"":[-59.22556127000001,-26.51481035]}"
140,26056,hay que cambiarlo,2/3/2015,hay que cambiarlo,hay que cambiarlo,6385-1987,0.67,verano,2015-03-02,"[2015-03-02, 2015-03-03, 2015-03-04, 2015-03-05, 2015-03-06, 2015-03-07, 2015-03-08]",true,140,-42.66468787,-70.44354981,1.944601535797119E-5,288.4453945159912,Molisoles,-4.902714863419533E-4,0.08734766642252605,"{""type"":""Point"",""coordinates"":[-70.44354981,-42.66468787]}"
141,54021,hay que cambiarlo,2/3/2015,hay que cambiarlo,hay que cambiarlo,13-13,6.29,verano,2015-03-02,"[2015-03-02, 2015-03-03, 2015-03-04, 2015-03-05, 2015-03-06, 2015-03-07, 2015-03-08]",true,141,-27.37033272,-55.53538513,2.5735795497894287E-4,299.2692877451579,Molisoles,-0.005314541049301624,0.4345296223958333,"{""type"":""Point"",""coordinates"":[-55.53538513,-27.370332719999997]}"
142,06728,hay que cambiarlo,2/3/2015,hay que cambiarlo,hay que cambiarlo,6906-2215,11.15,verano,2015-03-02,"[2015-03-02, 2015-03-03, 2015-03-04, 2015-03-05, 2015-03-06, 2015-03-07, 2015-03-08]",true,142,-34.387887,-59.4326743,3.7163496017456055E-5,297.1569830576579,Molisoles,-0.00336455088108778,0.35726674397786456,"{""type"":""Point"",""coordinates"":[-59.4326743,-34.387887]}"
143,18126,hay que cambiarlo,2/3/2015,hay que cambiarlo,hay que cambiarlo,36693-7166,23.89,verano,2015-03-02,"[2015-03-02, 2015-03-03, 2015-03-04, 2015-03-05, 2015-03-06, 2015-03-07, 2015-03-08]",false,143,-28.32076054,-58.54644943,1.873224973678589E-4,299.3001308441162,Molisoles,-0.004271356388926506,0.4471963246663411,"{""type"":""Point"",""coordinates"":[-58.54644943,-28.320760540000002]}"
144,62042,hay que cambiarlo,2/3/2015,hay que cambiarlo,hay que cambiarlo,32291-6462,34.84,verano,2015-03-02,"[2015-03-02, 2015-03-03, 2015-03-04, 2015-03-05, 2015-03-06, 2015-03-07, 2015-03-08]",false,144,-39.13837603,-66.90952075,0.0,297.7225755055745,Aridisoles,-0.0010240748524665833,0.17830212910970053,"{""type"":""Point"",""coordinates"":[-66.90952075,-39.138376029999996]}"
145,06210,hay que cambiarlo,2/3/2015,hay que cambiarlo,hay que cambiarlo,6713-2117,29.06,verano,2015-03-02,"[2015-03-02, 2015-03-03, 2015-03-04, 2015-03-05, 2015-03-06, 2015-03-07, 2015-03-08]",false,145,-34.66495,-60.44139,1.1965632438659668E-5,296.1857102711995,Alfisoles,-0.004274080507457256,0.44554901123046875,"{""type"":""Point"",""coordinates"":[-60.44138999999999,-34.664950000000005]}"
146,18168,hay que cambiarlo,29/10/2013,hay que cambiarlo,hay que cambiarlo,68-68,3.13,primavera,2013-10-28,"[2013-10-28, 2013-10-29, 2013-10-30, 2013-10-31, 2013-11-01, 2013-11-02, 2013-11-03]",true,146,-28.51878167,-56.05544289,2.7820467948913574E-4,292.1116835276286,Ultisoles,-0.006425714120268822,0.4443340301513672,"{""type"":""Point"",""coordinates"":[-56.05544289,-28.518781670000006]}"
147,06203,hay que cambiarlo,29/10/2013,hay que cambiarlo,hay que cambiarlo,31981-6426,68.12,primavera,2013-10-28,"[2013-10-28, 2013-10-29, 2013-10-30, 2013-10-31, 2013-11-01, 2013-11-02, 2013-11-03]",false,147,-37.6402741,-62.0066225,5.677342414855957E-6,288.7921848297119,Roca,-0.0033172648400068283,0.2718588511149089,"{""type"":""Point"",""coordinates"":[-62.0066225,-37.64027409999999]}"
148,06224,hay que cambiarlo,2/3/2015,hay que cambiarlo,hay que cambiarlo,6954-2111,10.95,verano,2015-03-02,"[2015-03-02, 2015-03-03, 2015-03-04, 2015-03-05, 2015-03-06, 2015-03-07, 2015-03-08]",true,148,-34.9440654,-60.1765372,2.148747444152832E-5,296.1883144378662,Alfisoles,-0.004198899492621422,0.4295972188313802,"{""type"":""Point"",""coordinates"":[-60.1765372,-34.9440654]}"
149,18147,hay que cambiarlo,30/10/2013,hay que cambiarlo,hay que cambiarlo,71-71,6.69,primavera,2013-10-28,"[2013-10-28, 2013-10-29, 2013-10-30, 2013-10-31, 2013-11-01, 2013-11-02, 2013-11-03]",true,149,-29.3611063,-56.8024261,3.154277801513672E-4,291.36697324117023,Alfisoles,-0.006476289592683315,0.42540931701660156,"{""type"":""Point"",""coordinates"":[-56.8024261,-29.361106300000003]}"
150,86056,hay que cambiarlo,30/10/2013,hay que cambiarlo,hay que cambiarlo,6309-1957,42.91,primavera,2013-10-28,"[2013-10-28, 2013-10-29, 2013-10-30, 2013-10-31, 2013-11-01, 2013-11-02, 2013-11-03]",false,150,-25.72948778,-63.46601397,6.705522537231445E-7,298.6070448557536,Molisoles,-0.0015169819816946983,0.18315442403157553,"{""type"":""Point"",""coordinates"":[-63.46601397,-25.72948778]}"
151,06638,hay que cambiarlo,30/10/2013,hay que cambiarlo,hay que cambiarlo,34357-5904,12.77,primavera,2013-10-28,"[2013-10-28, 2013-10-29, 2013-10-30, 2013-10-31, 2013-11-01, 2013-11-02, 2013-11-03]",true,151,-34.42200558,-58.95283788,2.7865171432495117E-6,289.9662570953369,Molisoles,-0.0024149632081389427,0.2998339335123698,"{""type"":""Point"",""coordinates"":[-58.95283788,-34.42200558]}"
152,06140,hay que cambiarlo,30/10/2013,hay que cambiarlo,hay que cambiarlo,6745-2129,5.72,primavera,2013-10-28,"[2013-10-28, 2013-10-29, 2013-10-30, 2013-10-31, 2013-11-01, 2013-11-02, 2013-11-03]",true,152,-34.1731879,-59.9792421,2.3543834686279297E-6,291.0533339182536,Molisoles,-0.0023496923968195915,0.30035654703776044,"{""type"":""Point"",""coordinates"":[-59.9792421,-34.1731879]}"
153,22007,hay que cambiarlo,30/10/2013,hay que cambiarlo,hay que cambiarlo,6309-1957,105.62,primavera,2013-10-28,"[2013-10-28, 2013-10-29, 2013-10-30, 2013-10-31, 2013-11-01, 2013-11-02, 2013-11-03]",false,153,-25.53445625,-62.85266113,2.9802322387695312E-8,297.8226210276286,Entisoles,-0.0025100810453295708,0.20190302530924478,"{""type"":""Point"",""coordinates"":[-62.85266113,-25.53445625]}"
154,22014,hay que cambiarlo,2/3/2015,hay que cambiarlo,hay que cambiarlo,32998-6511,18.89,verano,2015-03-02,"[2015-03-02, 2015-03-03, 2015-03-04, 2015-03-05, 2015-03-06, 2015-03-07, 2015-03-08]",false,154,-26.92175039,-58.77874597,0.0021672099828720093,299.9968268076579,Rio,-0.004616125486791134,0.4403222401936849,"{""type"":""Point"",""coordinates"":[-58.77874597,-26.92175039]}"
155,58063,hay que cambiarlo,2/3/2015,hay que cambiarlo,hay que cambiarlo,6798-2155,40.6,verano,2015-03-02,"[2015-03-02, 2015-03-03, 2015-03-04, 2015-03-05, 2015-03-06, 2015-03-07, 2015-03-08]",false,155,-38.14383318,-70.528734,1.007765531539917E-4,287.1442877451579,Roca,-0.002080921083688736,0.12305514017740886,"{""type"":""Point"",""coordinates"":[-70.528734,-38.14383318]}"
156,62007,hay que cambiarlo,2/3/2015,hay que cambiarlo,hay que cambiarlo,33760-6593,32.37,verano,2015-03-02,"[2015-03-02, 2015-03-03, 2015-03-04, 2015-03-05, 2015-03-06, 2015-03-07, 2015-03-08]",false,156,-40.63358307,-63.50950623,0.0,295.6191412607829,Complejo indiferenci,-0.0022975122556090355,0.11411984761555989,"{""type"":""Point"",""coordinates"":[-63.50950623000001,-40.63358307]}"
157,06098,hay que cambiarlo,2/3/2015,hay que cambiarlo,hay que cambiarlo,3314-1708,0.7,verano,2015-03-02,"[2015-03-02, 2015-03-03, 2015-03-04, 2015-03-05, 2015-03-06, 2015-03-07, 2015-03-08]",true,157,-34.84587606,-57.87973336,,,Miscelaneas,,,"{""type"":""Point"",""coordinates"":[-57.87973336,-34.84587606]}"
158,06351,hay que cambiarlo,2/3/2015,hay que cambiarlo,hay que cambiarlo,6811-2213,37.98,verano,2015-03-02,"[2015-03-02, 2015-03-03, 2015-03-04, 2015-03-05, 2015-03-06, 2015-03-07, 2015-03-08]",false,158,-34.8011277,-61.8636453,1.1920928955078125E-7,295.1548671722412,Molisoles,-0.004041894339025021,0.4484984079996745,"{""type"":""Point"",""coordinates"":[-61.8636453,-34.8011277]}"
159,42056,hay que cambiarlo,2/3/2015,hay que cambiarlo,hay que cambiarlo,32598-6391,21.01,verano,2015-03-02,"[2015-03-02, 2015-03-03, 2015-03-04, 2015-03-05, 2015-03-06, 2015-03-07, 2015-03-08]",false,159,-35.02186343,-63.81897737,1.043081283569336E-7,295.8369960784912,Molisoles,-0.0037586623802781105,0.33141009012858075,"{""type"":""Point"",""coordinates"":[-63.81897736999999,-35.02186343]}"
160,78028,hay que cambiarlo,2/3/2015,hay que cambiarlo,hay que cambiarlo,6778-2165,1.79,verano,2015-03-02,"[2015-03-02, 2015-03-03, 2015-03-04, 2015-03-05, 2015-03-06, 2015-03-07, 2015-03-08]",true,160,-50.27098465,-71.8927536,2.9490888118743896E-4,282.1855475107829,Entisoles,-0.0019065011292696,0.15407816569010416,"{""type"":""Point"",""coordinates"":[-71.8927536,-50.27098465]}"
161,46042,hay que cambiarlo,27/6/2014,hay que cambiarlo,hay que cambiarlo,34179-6743,13,invierno,2014-06-23,"[2014-06-23, 2014-06-24, 2014-06-25, 2014-06-26, 2014-06-27, 2014-06-28, 2014-06-29]",true,161,-29.10233846,-67.60548106,0.0041029006242752075,285.36752637227374,Roca,-0.0015907473862171173,0.21221478780110678,"{""type"":""Point"",""coordinates"":[-67.60548106,-29.102338459999995]}"
162,58014,hay que cambiarlo,9/6/2014,hay que cambiarlo,hay que cambiarlo,9459-2811,51.39,otoño,2014-06-09,"[2014-06-09, 2014-06-10, 2014-06-11, 2014-06-12, 2014-06-13, 2014-06-14, 2014-06-15]",false,162,-37.88803423,-68.51449,1.4901161193847656E-8,282.1965522766113,Roca,-7.887836545705795E-4,0.1514148712158203,"{""type"":""Point"",""coordinates"":[-68.51449,-37.88803423]}"
163,06322,hay que cambiarlo,9/6/2014,hay que cambiarlo,hay que cambiarlo,31981-6426,66.52,otoño,2014-06-09,"[2014-06-09, 2014-06-10, 2014-06-11, 2014-06-12, 2014-06-13, 2014-06-14, 2014-06-15]",false,163,-37.53062058,-61.56911469,9.685754776000977E-7,282.900572458903,Molisoles,-0.0012771645560860634,0.3151111602783203,"{""type"":""Point"",""coordinates"":[-61.56911469,-37.53062058]}"
164,62056,hay que cambiarlo,21/5/2014,hay que cambiarlo,hay que cambiarlo,32726-6390,20.64,otoño,2014-05-19,"[2014-05-19, 2014-05-20, 2014-05-21, 2014-05-22, 2014-05-23, 2014-05-24, 2014-05-25]",false,164,-41.68252462,-70.71325062,3.539472818374634E-4,275.4755516052246,Aridisoles,-4.211273044347763E-4,0.2649218241373698,"{""type"":""Point"",""coordinates"":[-70.71325062,-41.682524619999995]}"
165,54091,hay que cambiarlo,21/5/2014,hay que cambiarlo,hay que cambiarlo,33745-6552,20.16,otoño,2014-05-19,"[2014-05-19, 2014-05-20, 2014-05-21, 2014-05-22, 2014-05-23, 2014-05-24, 2014-05-25]",false,165,-27.3929091,-55.12277042,6.879568099975586E-4,291.8039207458496,Molisoles,-0.002498650923371315,0.44994163513183594,"{""type"":""Point"",""coordinates"":[-55.12277042,-27.392909099999994]}"
166,38070,hay que cambiarlo,21/5/2014,hay que cambiarlo,hay que cambiarlo,6326-1964,20.94,otoño,2014-05-19,"[2014-05-19, 2014-05-20, 2014-05-21, 2014-05-22, 2014-05-23, 2014-05-24, 2014-05-25]",false,166,-24.13571358,-64.58811188,1.8867850303649902E-4,290.6559715270996,Entisoles,-0.0019226893782615662,0.46656036376953125,"{""type"":""Point"",""coordinates"":[-64.58811188,-24.13571358]}"
167,18014,hay que cambiarlo,16/9/2013,hay que cambiarlo,hay que cambiarlo,16-16,14.81,invierno,2013-09-16,"[2013-09-16, 2013-09-17, 2013-09-18, 2013-09-19, 2013-09-20, 2013-09-21, 2013-09-22]",true,167,-27.46421006,-57.46462652,2.132505178451538E-4,286.60891977945965,Entisoles,-0.0018264520913362503,0.4276421864827474,"{""type"":""Point"",""coordinates"":[-57.46462652,-27.464210059999992]}"
168,06511,hay que cambiarlo,7/4/2014,hay que cambiarlo,hay que cambiarlo,36871-7252,49.91,otoño,2014-04-07,"[2014-04-07, 2014-04-08, 2014-04-09, 2014-04-10, 2014-04-11, 2014-04-12, 2014-04-13]",false,168,-37.0161454,-57.4884889,1.3783574104309082E-4,293.7433910369873,Molisoles,-0.0011868719011545181,0.46214930216471356,"{""type"":""Point"",""coordinates"":[-57.48848890000001,-37.016145400000006]}"
169,06274,hay que cambiarlo,7/4/2014,hay que cambiarlo,hay que cambiarlo,7058-2230,1.42,otoño,2014-04-07,"[2014-04-07, 2014-04-08, 2014-04-09, 2014-04-10, 2014-04-11, 2014-04-12, 2014-04-13]",true,169,-34.8275807,-58.222912,9.678751230239868E-4,294.8753083546956,Complejo indiferenci,-0.0015781205147504807,0.4634227752685547,"{""type"":""Point"",""coordinates"":[-58.22291200000001,-34.8275807]}"
170,06648,hay que cambiarlo,7/4/2014,hay que cambiarlo,hay que cambiarlo,35405-6949,8.18,otoño,2014-04-07,"[2014-04-07, 2014-04-08, 2014-04-09, 2014-04-10, 2014-04-11, 2014-04-12, 2014-04-13]",true,170,-34.9075871,-58.4348955,6.493180990219116E-4,294.6972484588623,Molisoles,-0.0012078676372766495,0.47406260172526044,"{""type"":""Point"",""coordinates"":[-58.43489550000001,-34.9075871]}"
171,66063,hay que cambiarlo,27/2/2015,hay que cambiarlo,hay que cambiarlo,33124-6479,13.61,verano,2015-02-23,"[2015-02-23, 2015-02-24, 2015-02-25, 2015-02-26, 2015-02-27, 2015-02-28, 2015-03-01]",true,171,-25.77241,-65.34234,1.3588368892669678E-4,291.1890296936035,Molisoles,-0.0035358741879463196,0.42305946350097656,"{""type"":""Point"",""coordinates"":[-65.34234,-25.77241]}"
172,90098,hay que cambiarlo,2/3/2015,hay que cambiarlo,hay que cambiarlo,37013-7286,26.86,verano,2015-03-02,"[2015-03-02, 2015-03-03, 2015-03-04, 2015-03-05, 2015-03-06, 2015-03-07, 2015-03-08]",false,172,-26.596217,-65.8573856,2.8967857360839844E-5,290.1377773284912,Roca,-0.0030606305226683617,0.3724199930826823,"{""type"":""Point"",""coordinates"":[-65.8573856,-26.596217000000003]}"
173,70112,hay que cambiarlo,27/2/2015,hay que cambiarlo,hay que cambiarlo,32300-6465,10.52,verano,2015-02-23,"[2015-02-23, 2015-02-24, 2015-02-25, 2015-02-26, 2015-02-27, 2015-02-28, 2015-03-01]",true,173,-31.4627522,-68.73605428,1.8194317817687988E-5,294.0659014383952,Roca,-0.0049422914162278175,0.4111817677815755,"{""type"":""Point"",""coordinates"":[-68.73605428,-31.4627522]}"
174,30028,hay que cambiarlo,27/2/2015,hay que cambiarlo,hay que cambiarlo,1385-1073,7.52,verano,2015-02-23,"[2015-02-23, 2015-02-24, 2015-02-25, 2015-02-26, 2015-02-27, 2015-02-28, 2015-03-01]",true,174,-30.70681007,-57.88784914,0.0015306174755096436,298.1431312561035,Molisoles,-0.003918969072401524,0.17609469095865884,"{""type"":""Point"",""coordinates"":[-57.88784913999999,-30.70681007]}"
175,02015,hay que cambiarlo,27/2/2015,hay que cambiarlo,hay que cambiarlo,36837-7237,2.81,verano,2015-02-23,"[2015-02-23, 2015-02-24, 2015-02-25, 2015-02-26, 2015-02-27, 2015-02-28, 2015-03-01]",true,175,-34.59294425,-58.48867142,3.6622583866119385E-4,298.0676918029785,Miscelaneas,-0.003159494139254093,0.23714637756347656,"{""type"":""Point"",""coordinates"":[-58.48867142,-34.59294425]}"
176,50105,hay que cambiarlo,27/2/2015,hay que cambiarlo,hay que cambiarlo,36905-7260,15.55,verano,2015-02-23,"[2015-02-23, 2015-02-24, 2015-02-25, 2015-02-26, 2015-02-27, 2015-02-28, 2015-03-01]",false,176,-34.22018814,-67.91163635,1.7136335372924805E-5,298.76162083943683,Entisoles,-2.9646512120962143E-4,0.028920491536458332,"{""type"":""Point"",""coordinates"":[-67.91163635,-34.220188140000005]}"
177,14154,hay que cambiarlo,27/2/2015,hay que cambiarlo,hay que cambiarlo,33116-6456,62.97,verano,2015-02-23,"[2015-02-23, 2015-02-24, 2015-02-25, 2015-02-26, 2015-02-27, 2015-02-28, 2015-03-01]",false,177,-29.61635494,-64.06243638,3.874301910400391E-6,297.4225908915202,Aridisoles,-0.0028260555118322372,0.22659683227539062,"{""type"":""Point"",""coordinates"":[-64.06243638,-29.616354940000004]}"
178,18035,hay que cambiarlo,17/2/2015,hay que cambiarlo,hay que cambiarlo,9021-2832,18.94,verano,2015-02-16,"[2015-02-16, 2015-02-17, 2015-02-18, 2015-02-19, 2015-02-20, 2015-02-21, 2015-02-22]",false,178,-29.30959977,-58.51285545,1.3762712478637695E-4,299.3981761932373,Alfisoles,-0.004222254268825054,0.3229071299235026,"{""type"":""Point"",""coordinates"":[-58.51285545,-29.30959977]}"
179,06742,hay que cambiarlo,17/2/2015,hay que cambiarlo,hay que cambiarlo,6903-2151,83.21,verano,2015-02-16,"[2015-02-16, 2015-02-17, 2015-02-18, 2015-02-19, 2015-02-20, 2015-02-21, 2015-02-22]",false,179,-38.6740577,-59.49935949,1.4916062355041504E-5,296.780663172404,Molisoles,-0.0023571765050292015,0.07241439819335938,"{""type"":""Point"",""coordinates"":[-59.49935949,-38.6740577]}"
180,38056,hay que cambiarlo,17/2/2015,hay que cambiarlo,hay que cambiarlo,33913-6597,21.55,verano,2015-02-16,"[2015-02-16, 2015-02-17, 2015-02-18, 2015-02-19, 2015-02-20, 2015-02-21, 2015-02-22]",false,180,-24.37362671,-65.60406494,0.025766894221305847,280.0674470265706,Inceptisoles,-0.002682134509086609,0.4271837870279948,"{""type"":""Point"",""coordinates"":[-65.60406494,-24.37362671]}"
181,70056,hay que cambiarlo,17/2/2015,hay que cambiarlo,hay que cambiarlo,33932-6691,22.36,verano,2015-02-16,"[2015-02-16, 2015-02-17, 2015-02-18, 2015-02-19, 2015-02-20, 2015-02-21, 2015-02-22]",false,181,-30.20949542,-68.74673275,1.3262033462524414E-6,296.2365550994873,Roca,-0.002239106222987175,0.16511090596516928,"{""type"":""Point"",""coordinates"":[-68.74673275,-30.209495420000003]}"
182,30028,hay que cambiarlo,17/2/2015,hay que cambiarlo,hay que cambiarlo,1385-1073,7.52,verano,2015-02-16,"[2015-02-16, 2015-02-17, 2015-02-18, 2015-02-19, 2015-02-20, 2015-02-21, 2015-02-22]",true,182,-30.70681007,-57.88784914,0.001806408166885376,298.4126618703206,Molisoles,-0.004288516938686371,0.06989034016927083,"{""type"":""Point"",""coordinates"":[-57.88784913999999,-30.70681007]}"
183,86189,hay que cambiarlo,17/2/2015,hay que cambiarlo,hay que cambiarlo,6315-1959,4.54,verano,2015-02-16,"[2015-02-16, 2015-02-17, 2015-02-18, 2015-02-19, 2015-02-20, 2015-02-21, 2015-02-22]",true,183,-28.10344,-64.08491,0.0011349990963935852,298.5232575734456,Alfisoles,-0.004181988537311554,0.39582570393880206,"{""type"":""Point"",""coordinates"":[-64.08491,-28.103440000000003]}"
184,94007,hay que cambiarlo,17/2/2015,hay que cambiarlo,hay que cambiarlo,33389-6614,0.36,verano,2015-02-16,"[2015-02-16, 2015-02-17, 2015-02-18, 2015-02-19, 2015-02-20, 2015-02-21, 2015-02-22]",true,184,-52.88412863,-68.44878312,,,Inceptisoles,,,"{""type"":""Point"",""coordinates"":[-68.44878312,-52.88412862999999]}"
185,06091,hay que cambiarlo,17/2/2015,hay que cambiarlo,hay que cambiarlo,7058-2230,14.45,verano,2015-02-16,"[2015-02-16, 2015-02-17, 2015-02-18, 2015-02-19, 2015-02-20, 2015-02-21, 2015-02-22]",true,185,-34.83264047,-58.10084123,1.3947486877441406E-4,296.7367992401123,Miscelaneas,-0.002203148789703846,0.24660237630208334,"{""type"":""Point"",""coordinates"":[-58.10084122999999,-34.83264047]}"
186,54035,hay que cambiarlo,17/2/2015,hay que cambiarlo,hay que cambiarlo,6498-2033,22.44,verano,2015-02-16,"[2015-02-16, 2015-02-17, 2015-02-18, 2015-02-19, 2015-02-20, 2015-02-21, 2015-02-22]",false,186,-27.88963381,-55.42634391,8.478015661239624E-4,298.393944422404,Molisoles,-0.005677754059433937,0.3939501444498698,"{""type"":""Point"",""coordinates"":[-55.42634390999999,-27.889633809999996]}"
187,86147,hay que cambiarlo,17/2/2015,hay que cambiarlo,hay que cambiarlo,36917-7264,15.14,verano,2015-02-16,"[2015-02-16, 2015-02-17, 2015-02-18, 2015-02-19, 2015-02-20, 2015-02-21, 2015-02-22]",false,187,-27.60805727,-64.54365708,0.0010131299495697021,298.0742829640706,Molisoles,-0.00402059406042099,0.39371299743652344,"{""type"":""Point"",""coordinates"":[-64.54365708,-27.608057270000003]}"
188,42105,hay que cambiarlo,17/2/2015,hay que cambiarlo,hay que cambiarlo,9549-2809,39.21,verano,2015-02-16,"[2015-02-16, 2015-02-17, 2015-02-18, 2015-02-19, 2015-02-20, 2015-02-21, 2015-02-22]",false,188,-35.48140196,-63.49637054,1.6316771507263184E-6,296.9948558807373,Molisoles,-0.0012624925002455711,0.11436080932617188,"{""type"":""Point"",""coordinates"":[-63.49637054,-35.48140195999999]}"
189,10070,hay que cambiarlo,15/2/2015,hay que cambiarlo,hay que cambiarlo,34147-6631,5.97,verano,2015-02-09,"[2015-02-09, 2015-02-10, 2015-02-11, 2015-02-12, 2015-02-13, 2015-02-14, 2015-02-15]",true,189,-28.71805191,-65.2964859,2.6226043701171875E-6,299.66234588623047,Roca,-0.005615117959678173,0.29197438557942706,"{""type"":""Point"",""coordinates"":[-65.2964859,-28.71805191]}"
190,90063,hay que cambiarlo,6/4/2014,hay que cambiarlo,hay que cambiarlo,33520-6650,8.65,otoño,2014-03-31,"[2014-03-31, 2014-04-01, 2014-04-02, 2014-04-03, 2014-04-04, 2014-04-05, 2014-04-06]",true,190,-26.94954,-65.30289,0.01664036512374878,292.1067689259847,Inceptisoles,-0.0022700494155287743,0.42122650146484375,"{""type"":""Point"",""coordinates"":[-65.30289,-26.949540000000002]}"
191,66091,hay que cambiarlo,6/4/2014,hay que cambiarlo,hay que cambiarlo,6324-1963,46.91,otoño,2014-03-31,"[2014-03-31, 2014-04-01, 2014-04-02, 2014-04-03, 2014-04-04, 2014-04-05, 2014-04-06]",false,191,-23.78698349,-66.06783295,2.9802322387695312E-8,281.79898897806805,Roca,-4.996294155716896E-4,0.10425504048665364,"{""type"":""Point"",""coordinates"":[-66.06783295,-23.78698349]}"
192,30035,hay que cambiarlo,6/4/2014,hay que cambiarlo,hay que cambiarlo,36958-7272,25.83,otoño,2014-03-31,"[2014-03-31, 2014-04-01, 2014-04-02, 2014-04-03, 2014-04-04, 2014-04-05, 2014-04-06]",false,192,-30.97193714,-58.99327599,6.183981895446777E-6,292.22338676452637,Vertisoles,-0.0028831390663981438,0.4656817118326823,"{""type"":""Point"",""coordinates"":[-58.99327599,-30.971937140000005]}"
193,02012,hay que cambiarlo,15/2/2015,hay que cambiarlo,hay que cambiarlo,54-54,3.13,verano,2015-02-09,"[2015-02-09, 2015-02-10, 2015-02-11, 2015-02-12, 2015-02-13, 2015-02-14, 2015-02-15]",true,193,-34.56062514,-58.47494475,4.352778196334839E-4,299.05443572998047,Miscelaneas,-0.0038982797414064407,0.21433703104654947,"{""type"":""Point"",""coordinates"":[-58.474944750000006,-34.560625140000006]}"
194,06351,hay que cambiarlo,15/2/2015,hay que cambiarlo,hay que cambiarlo,6811-2213,37.98,verano,2015-02-09,"[2015-02-09, 2015-02-10, 2015-02-11, 2015-02-12, 2015-02-13, 2015-02-14, 2015-02-15]",false,194,-34.8011277,-61.8636453,4.366040229797363E-5,296.09471893310547,Molisoles,-0.00260737631469965,0.3494497934977214,"{""type"":""Point"",""coordinates"":[-61.8636453,-34.8011277]}"
195,06134,hay que cambiarlo,15/2/2015,hay que cambiarlo,hay que cambiarlo,3274-1695,30.68,verano,2015-02-09,"[2015-02-09, 2015-02-10, 2015-02-11, 2015-02-12, 2015-02-13, 2015-02-14, 2015-02-15]",false,195,-35.2637758,-58.6725328,2.473592758178711E-5,297.87906138102215,Complejo indiferenci,-0.004565794952213764,0.3532867431640625,"{""type"":""Point"",""coordinates"":[-58.6725328,-35.26377579999999]}"
196,66049,hay que cambiarlo,15/2/2015,hay que cambiarlo,hay que cambiarlo,32929-6365,4.08,verano,2015-02-09,"[2015-02-09, 2015-02-10, 2015-02-11, 2015-02-12, 2015-02-13, 2015-02-14, 2015-02-15]",true,196,-24.75876236,-64.99394226,8.849799633026123E-5,297.55345916748047,Molisoles,-0.0050513651221990585,0.477725346883138,"{""type"":""Point"",""coordinates"":[-64.99394226,-24.758762360000002]}"
197,06070,hay que cambiarlo,15/2/2015,hay que cambiarlo,hay que cambiarlo,39-39,5.39,verano,2015-02-09,"[2015-02-09, 2015-02-10, 2015-02-11, 2015-02-12, 2015-02-13, 2015-02-14, 2015-02-15]",true,197,-33.8417492,-59.4518203,6.109476089477539E-6,299.06070200602215,Rio,-0.0035483967512845993,0.3170522054036458,"{""type"":""Point"",""coordinates"":[-59.45182030000001,-33.8417492]}"
198,50126,hay que cambiarlo,15/2/2015,hay que cambiarlo,hay que cambiarlo,6840-2183,16.87,verano,2015-02-09,"[2015-02-09, 2015-02-10, 2015-02-11, 2015-02-12, 2015-02-13, 2015-02-14, 2015-02-15]",false,198,-33.30008474,-69.17169565,0.003350287675857544,289.85318247477215,Roca,-0.0035766493529081345,0.2777105967203776,"{""type"":""Point"",""coordinates"":[-69.17169565,-33.30008474]}"
199,90042,hay que cambiarlo,15/2/2015,hay que cambiarlo,hay que cambiarlo,6896-2166,25.5,verano,2015-02-09,"[2015-02-09, 2015-02-10, 2015-02-11, 2015-02-12, 2015-02-13, 2015-02-14, 2015-02-15]",false,199,-27.60163,-65.5373,4.932135343551636E-4,297.74510955810547,Roca,-0.0051377201452851295,0.3852418263753255,"{""type"":""Point"",""coordinates"":[-65.5373,-27.601630000000004]}"
200,82028,hay que cambiarlo,15/2/2015,hay que cambiarlo,hay que cambiarlo,36996-7283,18.3,verano,2015-02-09,"[2015-02-09, 2015-02-10, 2015-02-11, 2015-02-12, 2015-02-13, 2015-02-14, 2015-02-15]",false,200,-33.3790173,-61.3544315,1.4275312423706055E-5,297.2625249226888,Alfisoles,-0.0029785679653286934,0.3257732391357422,"{""type"":""Point"",""coordinates"":[-61.354431500000004,-33.37901730000001]}"
201,14084,hay que cambiarlo,25/6/2013,hay que cambiarlo,hay que cambiarlo,32598-6391,38.93,invierno,2013-06-24,"[2013-06-24, 2013-06-25, 2013-06-26, 2013-06-27, 2013-06-28, 2013-06-29, 2013-06-30]",false,201,-33.90469055,-63.83804658,6.556510925292969E-7,281.80886205037433,Alfisoles,-5.232486873865128E-4,0.18569310506184897,"{""type"":""Point"",""coordinates"":[-63.83804657999999,-33.90469055]}"
202,02010,hay que cambiarlo,25/6/2013,hay que cambiarlo,hay que cambiarlo,36837-7237,4.71,invierno,2013-06-24,"[2013-06-24, 2013-06-25, 2013-06-26, 2013-06-27, 2013-06-28, 2013-06-29, 2013-06-30]",true,202,-34.62768629,-58.48358728,1.9794702529907227E-4,281.3702227274577,Miscelaneas,-7.29244202375412E-4,0.3079236348470052,"{""type"":""Point"",""coordinates"":[-58.48358728,-34.62768628999999]}"
203,06455,hay que cambiarlo,15/2/2015,hay que cambiarlo,hay que cambiarlo,32742-6427,50.28,verano,2015-02-09,"[2015-02-09, 2015-02-10, 2015-02-11, 2015-02-12, 2015-02-13, 2015-02-14, 2015-02-15]",false,203,-36.3036243,-59.3193839,4.4405460357666016E-6,296.4507573445638,Molisoles,-0.003357083536684513,0.33089574178059894,"{""type"":""Point"",""coordinates"":[-59.3193839,-36.3036243]}"
204,54098,hay que cambiarlo,25/6/2013,hay que cambiarlo,hay que cambiarlo,13-13,8.32,invierno,2013-06-24,"[2013-06-24, 2013-06-25, 2013-06-26, 2013-06-27, 2013-06-28, 2013-06-29, 2013-06-30]",true,204,-27.25123207,-55.5304925,0.00359170138835907,288.119327545166,Entisoles,-7.783975452184677E-4,0.43784523010253906,"{""type"":""Point"",""coordinates"":[-55.5304925,-27.25123207]}"
205,50035,hay que cambiarlo,25/6/2013,hay que cambiarlo,hay que cambiarlo,37581-7388,39.16,invierno,2013-06-24,"[2013-06-24, 2013-06-25, 2013-06-26, 2013-06-27, 2013-06-28, 2013-06-29, 2013-06-30]",false,205,-33.15090031,-68.40880629,4.470348358154297E-8,281.302188873291,Entisoles,-1.2992322444915771E-4,0.11783154805501302,"{""type"":""Point"",""coordinates"":[-68.40880629,-33.15090030999999]}"
206,46126,hay que cambiarlo,5/7/2013,hay que cambiarlo,hay que cambiarlo,33523-6661,39.76,invierno,2013-07-01,"[2013-07-01, 2013-07-02, 2013-07-03, 2013-07-04, 2013-07-05, 2013-07-06, 2013-07-07]",false,206,-29.16052455,-67.09195563,3.4183263778686523E-5,282.691349029541,Entisoles,-5.18500804901123E-4,0.05165545145670573,"{""type"":""Point"",""coordinates"":[-67.09195563,-29.160524550000005]}"
207,66070,hay que cambiarlo,25/6/2013,hay que cambiarlo,hay que cambiarlo,32945-6436,9.1,invierno,2013-06-24,"[2013-06-24, 2013-06-25, 2013-06-26, 2013-06-27, 2013-06-28, 2013-06-29, 2013-06-30]",true,207,-22.7747986,-65.14338644,8.111149072647095E-4,280.2327715555827,Roca,-0.0014039352536201477,0.4037024180094401,"{""type"":""Point"",""coordinates"":[-65.14338644,-22.774798600000004]}"
208,06826,hay que cambiarlo,25/6/2013,hay que cambiarlo,hay que cambiarlo,36986-7281,85.75,invierno,2013-06-24,"[2013-06-24, 2013-06-25, 2013-06-26, 2013-06-27, 2013-06-28, 2013-06-29, 2013-06-30]",false,208,-36.0383096,-62.8210281,1.2695789337158203E-5,280.7298418680827,Molisoles,-5.202814936637878E-4,0.08583005269368489,"{""type"":""Point"",""coordinates"":[-62.8210281,-36.0383096]}"
209,06700,hay que cambiarlo,25/6/2013,hay que cambiarlo,hay que cambiarlo,31981-6426,70.51,invierno,2013-06-24,"[2013-06-24, 2013-06-25, 2013-06-26, 2013-06-27, 2013-06-28, 2013-06-29, 2013-06-30]",false,209,-37.72446606,-62.10173503,2.384185791015625E-7,278.63478978474933,Roca,-4.5381486415863037E-4,0.22661209106445312,"{""type"":""Point"",""coordinates"":[-62.10173503000001,-37.72446606]}"
210,90063,hay que cambiarlo,25/6/2013,hay que cambiarlo,hay que cambiarlo,33520-6650,8.65,invierno,2013-06-24,"[2013-06-24, 2013-06-25, 2013-06-26, 2013-06-27, 2013-06-28, 2013-06-29, 2013-06-30]",true,210,-26.94954,-65.30289,2.509504556655884E-4,283.627140045166,Inceptisoles,-0.0015601888298988342,0.3931833902994792,"{""type"":""Point"",""coordinates"":[-65.30289,-26.949540000000002]}"
211,62070,hay que cambiarlo,25/6/2013,hay que cambiarlo,hay que cambiarlo,31937-6385,27.21,invierno,2013-06-24,"[2013-06-24, 2013-06-25, 2013-06-26, 2013-06-27, 2013-06-28, 2013-06-29, 2013-06-30]",false,211,-41.32152141,-70.27466678,3.829598426818848E-6,272.4808184305827,Inceptisoles,-1.8817000091075897E-4,0.3035774230957031,"{""type"":""Point"",""coordinates"":[-70.27466678,-41.32152141]}"
212,50063,hay que cambiarlo,29/6/2013,hay que cambiarlo,hay que cambiarlo,6840-2183,38.57,invierno,2013-06-24,"[2013-06-24, 2013-06-25, 2013-06-26, 2013-06-27, 2013-06-28, 2013-06-29, 2013-06-30]",false,212,-33.32638993,-68.92342084,9.521842002868652E-6,277.10329564412433,Roca,-5.144067108631134E-4,0.10760815938313802,"{""type"":""Point"",""coordinates"":[-68.92342084,-33.32638993]}"
213,22077,hay que cambiarlo,4/3/2014,hay que cambiarlo,hay que cambiarlo,9491-2841,1.71,verano,2014-03-03,"[2014-03-03, 2014-03-04, 2014-03-05, 2014-03-06, 2014-03-07, 2014-03-08, 2014-03-09]",true,213,-27.26945671,-59.21122233,1.1333823204040527E-4,294.5425141652425,Entisoles,-0.003546108491718769,0.42798296610514325,"{""type"":""Point"",""coordinates"":[-59.21122232999999,-27.26945671]}"
214,90112,hay que cambiarlo,4/3/2014,hay que cambiarlo,hay que cambiarlo,32028-6469,6.72,verano,2014-03-03,"[2014-03-03, 2014-03-04, 2014-03-05, 2014-03-06, 2014-03-07, 2014-03-08, 2014-03-09]",true,214,-26.38549995,-65.36309815,0.004567384719848633,288.96862093607587,Molisoles,-0.004138092510402203,0.4626623789469401,"{""type"":""Point"",""coordinates"":[-65.36309815,-26.38549995]}"
215,06336,hay que cambiarlo,13/1/2015,hay que cambiarlo,hay que cambiarlo,3309-1703,42.05,verano,2015-01-12,"[2015-01-12, 2015-01-13, 2015-01-14, 2015-01-15, 2015-01-16, 2015-01-17, 2015-01-18]",false,215,-36.55442064,-57.07742058,4.172325134277344E-6,296.25183232625324,Entisoles,-0.003651360049843788,0.3008861541748047,"{""type"":""Point"",""coordinates"":[-57.07742058,-36.554420640000004]}"
216,26091,hay que cambiarlo,13/1/2015,hay que cambiarlo,hay que cambiarlo,6715-2225,8.68,verano,2015-01-12,"[2015-01-12, 2015-01-13, 2015-01-14, 2015-01-15, 2015-01-16, 2015-01-17, 2015-01-18]",true,216,-45.59720158,-69.14443499,1.4901161193847656E-8,287.13366826375324,Aridisoles,-9.370315819978714E-4,0.08381017049153645,"{""type"":""Point"",""coordinates"":[-69.14443499,-45.59720158]}"
217,30015,hay que cambiarlo,13/1/2015,hay que cambiarlo,hay que cambiarlo,6557-2063,4.51,verano,2015-01-12,"[2015-01-12, 2015-01-13, 2015-01-14, 2015-01-15, 2015-01-16, 2015-01-17, 2015-01-18]",true,217,-31.35230446,-58.05355072,0.0019213855266571045,299.0786552429199,Vertisoles,-0.005957813933491707,0.2974751790364583,"{""type"":""Point"",""coordinates"":[-58.05355072,-31.352304459999996]}"
218,42014,hay que cambiarlo,13/1/2015,hay que cambiarlo,hay que cambiarlo,32666-6430,54.43,verano,2015-01-12,"[2015-01-12, 2015-01-13, 2015-01-14, 2015-01-15, 2015-01-16, 2015-01-17, 2015-01-18]",false,218,-38.40961523,-63.4727511,8.940696716308594E-8,297.9299736022949,Complejo indiferenci,-0.0012012552469968796,0.14303906758626303,"{""type"":""Point"",""coordinates"":[-63.4727511,-38.40961523]}"
219,22043,hay que cambiarlo,13/1/2015,hay que cambiarlo,hay que cambiarlo,36727-7188,12.15,verano,2015-01-12,"[2015-01-12, 2015-01-13, 2015-01-14, 2015-01-15, 2015-01-16, 2015-01-17, 2015-01-18]",true,219,-27.86749866,-61.32540304,1.2665987014770508E-5,302.4553642272949,Molisoles,-0.005648031830787659,0.3442192077636719,"{""type"":""Point"",""coordinates"":[-61.32540304,-27.867498659999995]}"
220,54112,hay que cambiarlo,13/1/2015,hay que cambiarlo,hay que cambiarlo,33720-6520,20.3,verano,2015-01-12,"[2015-01-12, 2015-01-13, 2015-01-14, 2015-01-15, 2015-01-16, 2015-01-17, 2015-01-18]",false,220,-26.50855467,-53.92302828,0.0018166601657867432,298.0559501647949,Entisoles,-0.005705615505576134,0.464779535929362,"{""type"":""Point"",""coordinates"":[-53.92302828,-26.50855467]}"
221,74056,hay que cambiarlo,25/6/2013,hay que cambiarlo,hay que cambiarlo,33022-6481,39.54,invierno,2013-06-24,"[2013-06-24, 2013-06-25, 2013-06-26, 2013-06-27, 2013-06-28, 2013-06-29, 2013-06-30]",false,221,-33.36877796,-66.40741813,4.172325134277344E-7,283.2750078837077,Medano,-3.161318600177765E-4,0.0602728525797526,"{""type"":""Point"",""coordinates"":[-66.40741813,-33.368777959999996]}"
222,18063,hay que cambiarlo,13/1/2015,hay que cambiarlo,hay que cambiarlo,6589-2077,37.02,verano,2015-01-12,"[2015-01-12, 2015-01-13, 2015-01-14, 2015-01-15, 2015-01-16, 2015-01-17, 2015-01-18]",false,222,-27.7055629,-57.79496584,9.250938892364502E-4,302.0835380554199,Entisoles,-0.006105588749051094,0.4476312001546224,"{""type"":""Point"",""coordinates"":[-57.79496584,-27.7055629]}"
223,74063,hay que cambiarlo,13/1/2015,hay que cambiarlo,hay que cambiarlo,36906-7261,27.91,verano,2015-01-12,"[2015-01-12, 2015-01-13, 2015-01-14, 2015-01-15, 2015-01-16, 2015-01-17, 2015-01-18]",false,223,-32.77143097,-65.76694489,7.718801498413086E-5,295.1045341491699,Entisoles,-0.005633631721138954,0.3232288360595703,"{""type"":""Point"",""coordinates"":[-65.76694489,-32.77143097]}"
224,30091,hay que cambiarlo,13/1/2015,hay que cambiarlo,hay que cambiarlo,6833-2205,17.37,verano,2015-01-12,"[2015-01-12, 2015-01-13, 2015-01-14, 2015-01-15, 2015-01-16, 2015-01-17, 2015-01-18]",false,224,-31.99620378,-59.24649058,1.4826655387878418E-5,299.6211357116699,Molisoles,-0.006072424352169037,0.4615497589111328,"{""type"":""Point"",""coordinates"":[-59.24649058,-31.99620378]}"
225,02009,hay que cambiarlo,13/1/2015,hay que cambiarlo,hay que cambiarlo,36837-7237,4.96,verano,2015-01-12,"[2015-01-12, 2015-01-13, 2015-01-14, 2015-01-15, 2015-01-16, 2015-01-17, 2015-01-18]",true,225,-34.64379608,-58.5191299,5.830526351928711E-4,300.71496709187824,Miscelaneas,-0.0057319216430187225,0.2615782419840495,"{""type"":""Point"",""coordinates"":[-58.51912990000001,-34.64379608]}"
226,70091,hay que cambiarlo,13/1/2015,hay que cambiarlo,hay que cambiarlo,32300-6465,38.03,verano,2015-01-12,"[2015-01-12, 2015-01-13, 2015-01-14, 2015-01-15, 2015-01-16, 2015-01-17, 2015-01-18]",false,226,-31.49227011,-68.30050286,9.387731552124023E-7,301.5391044616699,Entisoles,-0.001299278810620308,0.11473846435546875,"{""type"":""Point"",""coordinates"":[-68.30050286,-31.492270109999993]}"
227,38028,hay que cambiarlo,13/1/2015,hay que cambiarlo,hay que cambiarlo,32945-6436,25.12,verano,2015-01-12,"[2015-01-12, 2015-01-13, 2015-01-14, 2015-01-15, 2015-01-16, 2015-01-17, 2015-01-18]",false,227,-22.96907829,-65.43667552,1.182854175567627E-4,282.38830693562824,Roca,-0.0025929007679224014,0.3546581268310547,"{""type"":""Point"",""coordinates"":[-65.43667552,-22.96907829]}"
228,66098,hay que cambiarlo,13/1/2015,hay que cambiarlo,hay que cambiarlo,33188-6577,11.23,verano,2015-01-12,"[2015-01-12, 2015-01-13, 2015-01-14, 2015-01-15, 2015-01-16, 2015-01-17, 2015-01-18]",true,228,-25.62320328,-65.61323547,1.8543004989624023E-4,292.3926200866699,Entisoles,-0.003429323434829712,0.47218068440755206,"{""type"":""Point"",""coordinates"":[-65.61323547,-25.62320328]}"
229,06105,hay que cambiarlo,13/1/2015,hay que cambiarlo,hay que cambiarlo,36845-7243,42.03,verano,2015-01-12,"[2015-01-12, 2015-01-13, 2015-01-14, 2015-01-15, 2015-01-16, 2015-01-17, 2015-01-18]",false,229,-36.002259,-60.623087,8.940696716308594E-7,298.16052373250324,Molisoles,-0.005480274558067322,0.3197288513183594,"{""type"":""Point"",""coordinates"":[-60.623087,-36.002259]}"
230,14091,hay que cambiarlo,19/6/2013,hay que cambiarlo,hay que cambiarlo,36828-7231,28.57,otoño,2013-06-17,"[2013-06-17, 2013-06-18, 2013-06-19, 2013-06-20, 2013-06-21, 2013-06-22, 2013-06-23]",false,230,-31.10580063,-64.59128571,2.682209014892578E-7,281.00890986124676,Molisoles,-7.083192467689514E-4,0.1814289093017578,"{""type"":""Point"",""coordinates"":[-64.59128571,-31.105800630000005]}"
231,14154,hay que cambiarlo,19/6/2013,hay que cambiarlo,hay que cambiarlo,33116-6456,62.97,otoño,2013-06-17,"[2013-06-17, 2013-06-18, 2013-06-19, 2013-06-20, 2013-06-21, 2013-06-22, 2013-06-23]",false,231,-29.61635494,-64.06243638,5.960464477539063E-8,283.7370999654134,Aridisoles,-2.4805590510368347E-4,0.13850784301757812,"{""type"":""Point"",""coordinates"":[-64.06243638,-29.616354940000004]}"
232,70133,hay que cambiarlo,19/6/2013,hay que cambiarlo,hay que cambiarlo,32300-6465,32.17,otoño,2013-06-17,"[2013-06-17, 2013-06-18, 2013-06-19, 2013-06-20, 2013-06-21, 2013-06-22, 2013-06-23]",false,232,-31.77467156,-68.91460419,5.61833381652832E-4,275.8607978820801,Roca,-7.446464151144028E-4,0.1790135701497396,"{""type"":""Point"",""coordinates"":[-68.91460419,-31.77467156]}"
233,42028,hay que cambiarlo,19/6/2013,hay que cambiarlo,hay que cambiarlo,32779-6443,73.15,otoño,2013-06-17,"[2013-06-17, 2013-06-18, 2013-06-19, 2013-06-20, 2013-06-21, 2013-06-22, 2013-06-23]",false,233,-36.67294558,-63.66446349,5.960464477539063E-8,278.49621454874676,Entisoles,-5.770288407802582E-4,0.16355450948079428,"{""type"":""Point"",""coordinates"":[-63.66446349,-36.672945580000004]}"
234,26021,hay que cambiarlo,19/6/2013,hay que cambiarlo,hay que cambiarlo,6927-2157,90.29,otoño,2013-06-17,"[2013-06-17, 2013-06-18, 2013-06-19, 2013-06-20, 2013-06-21, 2013-06-22, 2013-06-23]",false,234,-45.89050293,-68.06896973,1.4901161193847656E-7,277.9626859029134,Aridisoles,-8.009821176528931E-4,0.19513320922851562,"{""type"":""Point"",""coordinates"":[-68.06896973,-45.89050293]}"
235,66133,hay que cambiarlo,22/2/2014,hay que cambiarlo,hay que cambiarlo,6362-1978,14.31,verano,2014-02-17,"[2014-02-17, 2014-02-18, 2014-02-19, 2014-02-20, 2014-02-21, 2014-02-22, 2014-02-23]",true,235,-22.49881,-62.40759,1.1220574378967285E-5,300.1349531809489,Molisoles,-0.003605814650654793,0.22327486673990884,"{""type"":""Point"",""coordinates"":[-62.40759,-22.498810000000002]}"
236,06665,hay que cambiarlo,25/2/2014,hay que cambiarlo,hay que cambiarlo,3325-1719,9.81,verano,2014-02-24,"[2014-02-24, 2014-02-25, 2014-02-26, 2014-02-27, 2014-02-28, 2014-03-01, 2014-03-02]",true,236,-33.6241496,-60.0461017,5.6549906730651855E-6,295.51156489054364,Rio,-0.004009322263300419,0.5203069051106771,"{""type"":""Point"",""coordinates"":[-60.04610170000001,-33.6241496]}"
237,86133,hay que cambiarlo,25/2/2014,hay que cambiarlo,hay que cambiarlo,32820-6498,6.85,verano,2014-02-24,"[2014-02-24, 2014-02-25, 2014-02-26, 2014-02-27, 2014-02-28, 2014-03-01, 2014-03-02]",true,237,-26.28318787,-64.45684052,8.128583431243896E-6,297.31861241658527,Entisoles,-0.0019443025812506676,0.3805503845214844,"{""type"":""Point"",""coordinates"":[-64.45684052,-26.28318787]}"
238,58105,hay que cambiarlo,25/2/2014,hay que cambiarlo,hay que cambiarlo,34051-6530,10.3,verano,2014-02-24,"[2014-02-24, 2014-02-25, 2014-02-26, 2014-02-27, 2014-02-28, 2014-03-01, 2014-03-02]",true,238,-38.34971979,-69.93995142,1.2665987014770508E-7,288.26628494262695,Roca,-9.690374135971069E-4,0.07706451416015625,"{""type"":""Point"",""coordinates"":[-69.93995142,-38.34971979]}"
239,86133,hay que cambiarlo,6/2/2014,hay que cambiarlo,hay que cambiarlo,32820-6498,6.85,verano,2014-02-03,"[2014-02-03, 2014-02-04, 2014-02-05, 2014-02-06, 2014-02-07, 2014-02-08, 2014-02-09]",true,239,-26.28318787,-64.45684052,2.384185791015625E-6,303.60681406656903,Entisoles,-0.002815723419189453,0.228485107421875,"{""type"":""Point"",""coordinates"":[-64.45684052,-26.28318787]}"
240,30091,hay que cambiarlo,10/2/2014,hay que cambiarlo,hay que cambiarlo,6833-2205,17.37,verano,2014-02-10,"[2014-02-10, 2014-02-11, 2014-02-12, 2014-02-13, 2014-02-14, 2014-02-15, 2014-02-16]",false,240,-31.99620378,-59.24649058,1.5088915824890137E-4,298.6478462219238,Molisoles,-0.002798648551106453,0.45195261637369794,"{""type"":""Point"",""coordinates"":[-59.24649058,-31.99620378]}"
241,38035,hay que cambiarlo,10/2/2014,hay que cambiarlo,hay que cambiarlo,33117-6463,14.96,verano,2014-02-10,"[2014-02-10, 2014-02-11, 2014-02-12, 2014-02-13, 2014-02-14, 2014-02-15, 2014-02-16]",true,241,-23.88497353,-64.67390442,0.010563641786575317,295.9073677062988,Roca,-0.002950897440314293,0.47290611267089844,"{""type"":""Point"",""coordinates"":[-64.67390442,-23.884973529999996]}"
242,66091,hay que cambiarlo,6/2/2014,hay que cambiarlo,hay que cambiarlo,6324-1963,46.91,verano,2014-02-03,"[2014-02-03, 2014-02-04, 2014-02-05, 2014-02-06, 2014-02-07, 2014-02-08, 2014-02-09]",false,242,-23.78698349,-66.06783295,2.205371856689453E-6,284.48515065511066,Roca,-0.003861522302031517,0.28330421447753906,"{""type"":""Point"",""coordinates"":[-66.06783295,-23.78698349]}"
243,38077,hay que cambiarlo,6/2/2014,hay que cambiarlo,hay que cambiarlo,6324-1963,38.66,verano,2014-02-03,"[2014-02-03, 2014-02-04, 2014-02-05, 2014-02-06, 2014-02-07, 2014-02-08, 2014-02-09]",false,243,-22.05120277,-65.84176636,5.930662155151367E-5,283.35966237386066,Entisoles,-0.003445148468017578,0.3999341328938802,"{""type"":""Point"",""coordinates"":[-65.84176636,-22.051202770000003]}"
244,18042,hay que cambiarlo,6/2/2014,hay que cambiarlo,hay que cambiarlo,9551-2854,17.34,verano,2014-02-03,"[2014-02-03, 2014-02-04, 2014-02-05, 2014-02-06, 2014-02-07, 2014-02-08, 2014-02-09]",false,244,-27.70578113,-58.68808341,1.895427703857422E-5,304.78536224365234,Rio,-0.0037358514964580536,0.22823524475097656,"{""type"":""Point"",""coordinates"":[-58.688083410000004,-27.70578113]}"
245,38084,hay que cambiarlo,6/2/2014,hay que cambiarlo,hay que cambiarlo,6324-1963,45.58,verano,2014-02-03,"[2014-02-03, 2014-02-04, 2014-02-05, 2014-02-06, 2014-02-07, 2014-02-08, 2014-02-09]",false,245,-23.11491966,-66.25007629,3.91155481338501E-5,281.90279388427734,Entisoles,-0.0037076659500598907,0.26566314697265625,"{""type"":""Point"",""coordinates"":[-66.25007629,-23.11491966]}"
246,06455,hay que cambiarlo,6/2/2014,hay que cambiarlo,hay que cambiarlo,32742-6427,50.28,verano,2014-02-03,"[2014-02-03, 2014-02-04, 2014-02-05, 2014-02-06, 2014-02-07, 2014-02-08, 2014-02-09]",false,246,-36.3036243,-59.3193839,2.3543834686279297E-6,294.87903086344403,Molisoles,-0.0028974562883377075,0.43123499552408856,"{""type"":""Point"",""coordinates"":[-59.3193839,-36.3036243]}"
247,90091,hay que cambiarlo,6/2/2014,hay que cambiarlo,hay que cambiarlo,32292-6460,1.11,verano,2014-02-03,"[2014-02-03, 2014-02-04, 2014-02-05, 2014-02-06, 2014-02-07, 2014-02-08, 2014-02-09]",true,247,-27.40925026,-65.26894379,5.781650543212891E-6,303.85136159261066,Entisoles,-0.002629198133945465,0.161376953125,"{""type"":""Point"",""coordinates"":[-65.26894379,-27.409250260000004]}"
248,38007,hay que cambiarlo,6/2/2014,hay que cambiarlo,hay que cambiarlo,6324-1963,25.69,verano,2014-02-03,"[2014-02-03, 2014-02-04, 2014-02-05, 2014-02-06, 2014-02-07, 2014-02-08, 2014-02-09]",false,248,-22.84146227,-66.07927857,5.43743371963501E-5,282.62968190511066,Entisoles,-0.003826010972261429,0.3658059438069661,"{""type"":""Point"",""coordinates"":[-66.07927857,-22.84146227]}"
249,62042,hay que cambiarlo,6/2/2014,hay que cambiarlo,hay que cambiarlo,32291-6462,34.84,verano,2014-02-03,"[2014-02-03, 2014-02-04, 2014-02-05, 2014-02-06, 2014-02-07, 2014-02-08, 2014-02-09]",false,249,-39.13837603,-66.90952075,0.0,294.36006927490234,Aridisoles,-5.286186933517456E-5,0.15645217895507812,"{""type"":""Point"",""coordinates"":[-66.90952075,-39.138376029999996]}"
250,34056,hay que cambiarlo,6/2/2014,hay que cambiarlo,hay que cambiarlo,6697-2188,52.43,verano,2014-02-03,"[2014-02-03, 2014-02-04, 2014-02-05, 2014-02-06, 2014-02-07, 2014-02-08, 2014-02-09]",false,250,-25.5645932,-59.10290413,1.4901161193847656E-8,306.53479258219403,Rio,-6.798841059207916E-4,0.23130226135253906,"{""type"":""Point"",""coordinates"":[-59.10290413,-25.564593199999997]}"
251,50007,hay que cambiarlo,6/2/2014,hay que cambiarlo,hay que cambiarlo,6840-2183,42.83,verano,2014-02-03,"[2014-02-03, 2014-02-04, 2014-02-05, 2014-02-06, 2014-02-07, 2014-02-08, 2014-02-09]",false,251,-32.87749385,-68.85278707,1.1071562767028809E-5,293.94983164469403,Entisoles,-0.0015175361186265945,0.16345532735188803,"{""type"":""Point"",""coordinates"":[-68.85278707,-32.87749385]}"
252,06483,hay que cambiarlo,6/2/2014,hay que cambiarlo,hay que cambiarlo,146-146,24.21,verano,2014-02-03,"[2014-02-03, 2014-02-04, 2014-02-05, 2014-02-06, 2014-02-07, 2014-02-08, 2014-02-09]",false,252,-35.2649767,-59.0698098,5.392730236053467E-5,294.60868581136066,Molisoles,-0.0018362142145633698,0.4595781962076823,"{""type"":""Point"",""coordinates"":[-59.06980980000001,-35.264976700000005]}"
253,70035,hay que cambiarlo,3/2/2014,hay que cambiarlo,hay que cambiarlo,32300-6465,40.48,verano,2014-02-03,"[2014-02-03, 2014-02-04, 2014-02-05, 2014-02-06, 2014-02-07, 2014-02-08, 2014-02-09]",false,253,-31.70272711,-68.28587359,1.4901161193847656E-6,299.41524505615234,Entisoles,-1.0280124843120575E-4,0.1020660400390625,"{""type"":""Point"",""coordinates"":[-68.28587359,-31.702727109999998]}"
254,66112,hay que cambiarlo,3/2/2014,hay que cambiarlo,hay que cambiarlo,9546-2814,6.06,verano,2014-02-03,"[2014-02-03, 2014-02-04, 2014-02-05, 2014-02-06, 2014-02-07, 2014-02-08, 2014-02-09]",true,254,-25.51643753,-64.60592651,4.023313522338867E-6,300.76168060302734,Molisoles,-0.004097744822502136,0.36799875895182294,"{""type"":""Point"",""coordinates"":[-64.60592651,-25.516437529999997]}"
255,06728,hay que cambiarlo,28/1/2014,hay que cambiarlo,hay que cambiarlo,6906-2215,11.15,verano,2014-01-27,"[2014-01-27, 2014-01-28, 2014-01-29, 2014-01-30, 2014-01-31, 2014-02-01, 2014-02-02]",true,255,-34.387887,-59.4326743,4.1425228118896484E-6,295.93459192911786,Molisoles,-0.004050660878419876,0.3955758412679036,"{""type"":""Point"",""coordinates"":[-59.4326743,-34.387887]}"
